title;artist;filename;lyrics
Im A Survivor ; Reba;Im A Survivor by Reba.txt;early even gentle deck give im momma month game hide hard victim queen grace circumstance stop god stack work bag baby behind hand root though head heart amazing walk doctor girl want packed kid born past bear fighter without single crown die two mom living mamma love job fast survivorembed survivor mind guess life different believe chance broken never bring ought plant play keep cry may day must try change self-pity
Im Gonna Be Alright ; Jennifer Lopez;Im Gonna Be Alright by Jennifer Lopez.txt;right alright funny need move im eye live yes alone voice use okay hard saw expect baby much would way part friend though first stay woah hear walk start around time girl want always best everybody inside smile feel without alrightembed deep could away realize love tear ah never bring leave control play mine meet day true try change think
Im Gonna Getcha Good! ; Shania Twain;Im Gonna Getcha Good! by Shania Twain.txt;interested bet need fall im sound alone good run bottom honey someone real baby estate serious fun wantcha fact land sight hoo matter find time somehow plan uh worry getcha betcha gotcha weekend knock ahh love fine mmm uh-uh-uh already life piece ah wood never dollar ahh-ahh night mine try
Im Gonna Miss Her (The Fishin Song) ; Brad Paisley UNCERTAIN;Im Gonna Miss Her (The Fishin Song) by Brad Paisley UNCERTAIN.txt;doin right notice quote stove bout stumble troop postman distant order outta pace number live strike inhale rollercoaster mask wrap far ugh rain player vision slick brink real flow would mean ignition kitchen plastic brain fact late fight along sick sea walk form rapper temptation add depict chick past climb ocean feel ache patiently clean goin parent couldve away prayer sky happen mission likebut kiss life mortal final official four enemy bae bound high-rise town sinner pack normal result round coast freak give young cheap cause ship thats zone forget scar song suppose mix foreign insane weak lace blood great red thinkin new ill fire track stash around reason grab ive motion dope candle focus word hit bear year roll sure since repent lie could fish stair look hype stare inform kill death partially chef finish different adjust vein waste ready guy miss wait another many dream glass man fuck try change bye shit outerland star tone follow im turn demon digit thought travel good run theres potion light bag sleepin people decide way brawl call every lust bank note dish land rhythm sight green lord overlord postal motherfuckin askin lose dive ever livin devote slow complete cash end portal tired til bruise imma love important storm never leave flat key pillow breathe aroma think em knife tie bet big fall move name rage tree rope white swish game tight bitch pain grace werent fuckin resort us flight leader dreamin motherfucker chefmade war reach lately challenge billion flickin find flood thing time burn long leg sin fee write burnt intermission clothes flask die reefer place water rule fill fly breath everyday task sorcerer fucken smoke strip curse back learnt face high decision wrapsheets keep wall trace dark air day usembed
Im Movin On ; Rascal Flatts;Im Movin On by Rascal Flatts.txt;sell deal onembed maybe im content finally live alone trap road last demon ghost strength burden stop blame allow pass would way mean passing guarantee find moment time long forgiveness always lose past year everyone peace end patiently somewhere could movin place fill everything love mind life different harm weakness never wait face town pack dream regret belong day change home
Im Real ; Jennifer Lopez;Im Real by Jennifer Lopez.txt;damn fall give im alone hope bitch care bad real baby way call hang friend stay ask matter time long huh plan uh wear woo could show love mmm dance enough night mine pocket phone tryna dress try mystery home understand hair
Im Tryin ; Trace Adkins;Im Tryin by Trace Adkins.txt;early right easy fall im eye wife send use ex climbin mountain run bottle anything hard front ball win heaven much mean call gettin puttin old late shift long finalize always hell ever still rich fallin year tryin money since sayin two away remember double pullin nothin never daddy back seem play keep regret pretty day difference man stumblin
Im With You ; Avril Lavigne;Im With You by Avril Lavigne.txt;right damn maybe anybody im sound standin alone cold rain lookin hand confusing new bridge youembed wo find footstep somebody somewhere waitin listen place searchin ground figure everything mmm mess yeah-yeah mind life anyone face night nothing dark tryna think home
In A Little While ; Uncle Kracker;In A Little While by Uncle Kracker.txt;something someday maybe likei stranger give finally turn beautiful little game good someone baby people behind memory wrong find reason around thing time side lose still wonder feel without erase somewhere away place slip doubt else sometimes life never leave party town face play nothing lyricshere coin belong think
In Another World ; Joe Diffie;In Another World by Joe Diffie.txt;name eye road worldembed beautiful voice world gown hide bone anything stop stick desert weary likein ahead mile moonlight destination decide talk would way heat red cotton underneath lyricsthumb sight rest ride find time sleep girl always inside smile climb car drift whisper polite nod end thank away place look darkness love sky mind life bare back underpass shade high another foot mine air day anywhere try hair
In Da Wind ; Trick Daddy;In Da Wind by Trick Daddy.txt;right bout coke alright stranger jump sound pace live club buddy serial share top slang watt professor reeboks ya sunshine bad flow pass sugar mean sock gotsta sick seven vogue inject want best side chose disrespect scrilla turtle elbow clean none uh-huh snow strain froze quick prophylactic room candy-apple blowin cakalaky hot four four-four da pack rude fury squeezin cuz sandwich ooooooohh ta teacher beyond fool eat eatin lyrical act young cover sean surprise realer buck surplus seven-tres chest line stop thang fade suppose mix windembed work trick grow lookin hen whore roe outlast brother go-rilla pearl plus fire tragic block mack always trash short kinda sure dub jacket wearin thank thug look show chevy tricky finish vein rim straight glass small recognize fuck man true try space chit-chat understand shit drop-top throw shoot put race little gat bright blast ol jean mirror twinkie saggy god swat cut pox freaky way baggy nigga rabbit disconnect heart wrong green oooooooooh pimp loaded aviator murder ah-ha box jewelry livin niggas slow cash south killer anthrax cop cheeferry wear movin danger oughta woodgrain georgia lo love choke rude-ass acquire prepare piece mo weighin lay sicker purist hoe floor mine dirty silence wind verbalize lovin splack bust whole big wing geechy-ass six-five sneaky florida fore mayonnaise yo fool-ass ace-a white stoppin drop john trouble bitch front shane grace gold fuckin us bankroll pair spin talk story motherfucker three truth fresh leg neckbone-eatin-ass kid collard rid .. quite thigh hah enjoy clothes wise reefer spam place slip water velour illegal mess throat killa intend smoke switch purpose boy shade haha face clutch beat sicky
In The End ; Linkin Park;In The End by Linkin Park.txt;even right clock apart fall push remind anymore property put window far swing hard trust hold matterembed mockin would way part mean though pendulum actin memory fight start matter unreal thing time surprised explain inside lose due tryin end design away look everything rhyme translationsturkceespanolportuguesitalianoin fly mind eventually life waste back count valuable tick rememberin keep watch spite day recognize fell try
Insatiable ; Darren Hayes;Insatiable by Darren Hayes.txt;even fall move sound eye turn chase hour bath cause world drop good low stop barely hold within skin light racing asleep taste grow soar sweetness moonlight scent much church way hand heat every revolve heart nobody strong truth holdin youembed along linger practice candy stain sleep footstep together plan always inside kissin word feel body somewhere crawl outside away look close show love street room kiss summer sheet levitate talkin never play insatiable build foot upon floor breathe touch man makin understand
Its Been Awhile ; Staind;Its Been Awhile by Staind.txt;beyond stretch peaceful stand father blame hold saw light taste addict sorry way mean call first head thing sorryembed always best candle still feel since could two away look remember everything love render consequence disappear awhile face seem high straight foot may day fuck must shit
Its Goin Down ; X-Ecutioners;Its Goin Down by X-Ecutioners.txt;right force pen melt sword whatever mighty sound odyssey composed combination wax detect trek caress put daily shot plot weapon gasp world narrow swing th record line mental blast blur degree separation stop board compress regiment ahead vocal stress weather mesh wide men sub-terrestrial call rhythmic defend element flee collage next head dialect nobody timeline rhythm effect hybrid x-men lodge imitation crate future-esque complex long together pure collaborative everybody emotional reflect chin readily distorted progression altogether elevate goin lp properly state blend weaponry pot execution rhyme fine hip-hop super breath logical sentence special pretend cleverly project carefully ready bring natural four audible lung style assimilation pedigree venomous high many safe shoddy watch wind beat edge source steadily advance barrage
Ive Got You ; Marc Anthony;Ive Got You by Marc Anthony.txt;damn whole glad need maybe give alone woman world far strength video hold shoulder baby would way till every compare lucky along matter find around girl want ive fancy lose ever eh feel without money sure clothes could away everything show love life believe chance never ease wait thousand seem another nothing hoe dream spend meet day anywhere trip change think
Jenny From The Block ; Jennifer Lopez;Jenny From The Block by Jennifer Lopez.txt;even fool alright breathing live woman movie put hate use little forget lot color amount ya god real grow much men dont working first f-f-f-flip rumor stay phony boricua produce block matter script side uh kid rock still everyone roll j. south oprah house bronx clip earth ground living lo love happen steal life ah headline bring hey business back bx control nothing public jenny child think laugh
Jigga ; JAY-Z UNCERTAIN;Jigga by JAY-Z UNCERTAIN.txt;right even tattoo wafer slidin cup eat fool stupid maze deal alive illest fame birth mad big need throw remind give tyson name kurt corner daughter eye live paper momma twice shoot bath put cold window bright thirty mil villa game paparazzo good store runneth low bitch survive pigeon chain care bleed catch blame camera flight light work bad insane person baby irs much dont hang translationsfrancaisholy gettin nigga though next heart whose nobody hater michael cheatin ask blue iris fight callin walk entertainer blade shame holy hammer laundry food murder sippin sittin uh hell horse still snappin niggas feel body thriller vanilla please jackson money clothes clean ink die goddamn loud grail psycho drive amazin look water whenever ooh-ooh-ooh-ooh-ooh-ooh dry cobain warn love street soon photo hurt unfair steal life crack guess curtain code talkin kiddin forever enough contagious screamin mouth thanks curse lung back sleeve night high play bail keep dirty watch air blow spite day fuck lobby think shit
Just A Friend 2002 ; Mario;Just A Friend 2002 by Mario.txt;need dip move whatever whoa anytime give name number yes tellin game stop understand real baby mario would call friend lace stay fight wo matter reason girl fantasy want help lose past feel tonight kinda mmh everything fly ready guy night play nothing feeling day man ta laugh
Just Let Me Be In Love ; Tracy Byrd;Just Let Me Be In Love by Tracy Byrd.txt;chemistry right probably convince give eye live heavenly good forget care us hold reality lyricsmy way loveyou future every heart ask matter find moment time incredible sleep want smile past short feel tonight please love fast mess breath soon wonderful concern enough anyone back disregard dream beat question
Just Like A Pill ; P!nk;Just Like A Pill by P!nk.txt;instead swear maybe move support outta little nowhere good run bitch pill bad itch swearembed much would call fun ill middle translationsjust stay bein lyin fear cryin help nurse frustrated morphine fast oh-oh life different ah switch leave keep floor shortage spot must trip try makin think
Knoc ; Knoc-TurnAl;Knoc by Knoc-TurnAl.txt;right tit damn shroom cup bar dyke site soccer suck ruthless dip beach throw pull freak give name order act dubs wife tree turn cali-fornia woman yo firm duck pause c.a drop city line hard ph bud bitch blaze father stop ya god song ball compton vodka givin fuckin deez us nah boulevard shoulder light sunshine bad lick real useless lyricswhatchu dick sack irs stern fulla mean thong nigga three fully rocker nuttin woop crenshaw blood raise head new locker hood-rats ho-hoppers truth palm slangin boulder hermaphrodite soldier block wo ack beef gangsta thing whatchu whip cranberry long doctor redd girl want squad checkin sippin motherfuckin best broad crips hell ea-say lose rock bow nigg-uh weez traffic hit car niggas fo takin getcha .. tonight roll please draw cop deep thru mexican two fifth superstar drink dre thug clip bi-sexual spoke sick-ass police street hip-hop bogart quick nig connect chrome foxx comin helicopter drug mind knoc pas life smoke believe juice poppa told grind head-boppers westcoast l.a. wit cockblockers howard pursue hip party rim full night straight play whooptie-whoop loungin fake bed-rocker beat cuz difference fuck hotter hustler gold-a true trip must chip think shit
Landslide ; Dixie Chicks;Landslide by Dixie Chicks.txt;sky time tide oh-oh bold within handle saw life maybe climb ocean downyou hill snow-covered bring turn afraid landslide reflection build heart old sail mountain rise season child around mirror change love
Lets Stay Home Tonight ; Joe;Lets Stay Home Tonight by Joe.txt;right obvious alright need petal whoa rub outta sound later cause send nowhere anything pleasin tight hold baby bed needin way till romantically call romance friend nobody stay fella hear thing time quality long girl want side mama kid tonight please look dude two-ways show else love kiss lead ah forever remedy talkin enough never leave hey business back key night foot keep stayin phone spend rise soul ta home
Lifestyles Of The Rich And Famous ; Good Charlotte;Lifestyles Of The Rich And Famous by Good Charlotte.txt;even pay stone stumble read mansion fall wife live sympathy celebrity problem run hard famous survive stop catch week someone talk would walking mcdonald thing long complain want always solve inside rich mayor car roll cash money clothes d.c. piss cochran could lifestyle two kill else street magazine moan life crack smoke shoe back rob many famousembed t.v spend day think home
Lifetime ; Maxwell;Lifetime by Maxwell.txt;fairy alright maybe move somethin break use world good line bottom work light baby pass would way hopin rescue free woah lifetime wo time somehow girl want set listen tale love melody fly lifetimeembed life spread storm believe reachin leave reborn day choose try understand
Lights Camera Action! ; Mr Cheeks;Lights Camera Action! by Mr Cheeks.txt;right pay suckin deal tongue turnin suck follow need big move somethin name outta chill buns live loose cheek music turn tat-toooo aww hour ohhhh later yo put killin shot x bink ok navel dancin top dumb swing strut good anything ring dawg low hard tight lot front ha-ha stop frontin ya chain song twist pop fuckin camera shorty us lem light snatch feelin bad cap sexy cut real pant fam lookin sorry talk way fat bill mean hand motherfucker thong youuuu gettin brain nigga bounce hopin toe bouncin seat head next hater new hunnies plus ask miami team wheel physique start walk hear callin ms. stash dime around slide ride thing jet girl actionembed plan want whoo sippin chick askin uh boogie kay calve booty henny word pole niggas climb showin feel jackson money tryin somewhere bent thru goin thinkin could meanwhile squeeze drive vivrant officer drinkin batty love holla action york yea whatcha sex singin heel piece steal dance tonite talkin chance actin ready leave hey mr. onto hot lb back weed style night high butt cork floor geuss keep g.i pushin touch spend cuz showtime table fuck man true smell spot try ta burnin smokin mad shit
Like I Love You ; Justin Timberlake;Like I Love You by Justin Timberlake.txt;swerve notice right happy tone funny deck maybe move whatever somethin fail give type name break number point music deservin a-like turn put shot use little lonely chest good bone scar front joint ya chain song trust nosy baby bed lookin sleepin people talk way would call every gettin anyway brain three limber friend fun pumpin nobody n.e.r.d phony ask late hint sick wo track matter ride destine grab thing whatchu burn girl danceembed best colorful everybody smile mall kid word stage glow feel tonight kinda justin set j. end since jacket timberlake listen could two wow away remember show love fine fly sometimes clipse ho drum special sex life kind chance never hey sing heavy boy face night malicious play dough lane keep dream touch difference man weird change think
Little Things ; IndiaArie;Little Things by IndiaArie.txt;happy even whole fortune round star fame neighborhood need news give donny tea cheek music glitter joy white pray little bright singing world quest good sister run okay low forget honey burden guitar gold sunshine wide call cotton hollywoodembed ask blue late sight find around thing satin humility atlanta pure food circle fancy lose search still focus word birthday feel sweet peace learn morning known mommy place everything silk love sky cute simple kiss mind pour spoonful shoe goal bring lay daddy high savannah nothing phone stevie
Livin It Up ; Ja Rule;Livin It Up by Ja Rule.txt;right betta probably whole sexual mad name wet live really alone turn woman yo put cause hate white little hoes radio zone good uptight meat low stick ya happenin episode trust song thang givin atkins hold flight sun light patnah ecstasy mug sexy cut baby grow half freaky lady teddy hand shadow typical nuttin first next lucky plus wheel callin sight start ride find ugly thing time girl cryin average together want llama chick uh pussy everybody doughnut livin hit uh-oh rid feel .. body tonight takin roll thug poppin rule show jones love vibe crazy collar open prissy everyday uhh cute laughin range yea mind passion life ah p mo physical freeway grind never miss leave key chargin blastin night high another dough foot nothing many cry watch clutch outembed blow phone bay-bay spot think home laugh treat
Living And Living Well ; George Strait;Living And Living Well by George Strait.txt;something sunset deck beach live share little bright good catch saw someone flow till red blue free routine moment shore girl want always best sit ocean set sweet deep could fish sail view living else sky yet life nice caught miss back thousand night breeze boat foot day anywhere difference think
Long Time Gone ; Dixie Chicks;Long Time Gone by Dixie Chicks.txt;burley deal star sunday tip cookin big broadway im sound live choir music road pian supper use radio swing farm row sister junior ol hard front playin guitar song haggard catch work grow porch much dont church way honk mean roof brother every gettin nashville hank old hear lord rest find time long together folk always ive mama sit still nurse hit car sleeping cook cash tire money tryin field garden since listen could sits hock look fill indiana prayer yeahembed jar singin harm deliah never daddy sing back play another hoe vacant watch wind beat horn soul child think home
Lose Yourself ; Eminem;Lose Yourself by Eminem.txt;right clock prima nervous fail order pied music cold world far spit broke father feed option calm snail flow pass much would old fact stay king provide want five best everybody boring goddamn loud hole seed close man.kembed piper tear already mind life believe vomit opportunity mouth ope bomb normal tryna phifer home crowd even easy surface taking give daughter point shot teeter-totter mood anything forget seize lab suppose catch hold boo grow nada sweaty weak joke new plus lifetime bein mekhi nine-to- post-mortem moment snap dope inside word unfold chew dog product look mom show ready blaow miss grows knee another rhymin may blow man hotter arm spot change stamp toward cage homie hope buy plot lonely good run drama god opera donna da-da-dom baby stagnant roof call gettin rabbit amplify palm nose food motherfuckin somebody globetrotter lose ever stage set end diaper jail everything love open choke mobile payin escape chance never screamin heavy foot hoe mine gotten gap mad sell whole move formulate type rage roads rope yo movie spaghetti failure got game drop hard lot pain playin barely reality partner rhapsody da-dom next trailer wo matter time mama step nose-dove family salem write cypher translationsturkcesvenskaespanolportuguesenglishdeutschfrancaisazrbaycanca schmoe two slip water coast-to-coast dah-dah gravity capture success soap back sweater keep better beat day soul beginning
Love At First Sight ; Kylie Minogue;Love At First Sight by Kylie Minogue.txt;crazy right sky time star mind baby give really music mean tire luck first play blow loveembed run day sight wrong hear fill everything think love
Love Of A Woman ; Travis Tritt;Love Of A Woman by Travis Tritt.txt;even fool funny maybe lean aloneyou name young stand alone woman good okay anything hard catch baby tame much behind would call nobody along wrong steady hero pure pride mama everybody rock still word without roll undying oughta beside love crazy daddy full keep runnin feeling man true try wild think
Love Of My Life (An Ode To Hip Hop) ; Erykah Badu;Love Of My Life (An Ode To Hip Hop) by Erykah Badu.txt;right need move give break young advice dawn turn little thought world ode lonely good clear poetry depend queen stop cheese didnt ya shoulder light bad baby grow behind way friend teenage first heart fact around sample girl together become beam rock word feel without roll rush sweat could cheddar look hop whenever love understood simple freak-freak life b-boy nice forever sing hip back boy hoodrat mike many keep mine may touch beat meet table true shit
Love Of My Life ; Brian McKnight;Love Of My Life by Brian McKnight.txt;need ohhhhhhhh eye likebaby ohhhhhhhhhhhhhh heaven-oh-heaven far irreplaceable lonely worth lifeembed anything ohhhhhhhhhh saw reality much amaze first lucky time incredible together want always ohhhhhhhhhhhhhhh feel tonight please away place look close everything love lyricsfirst everyday mind wonderful life forever never leave seem mine day arm shawty
Luv U Better ; LL Cool J;Luv U Better by LL Cool J.txt;right even instead gentle adoreembed apart give im name rub number eye peaceful admit fix use share tellin hood thats pick game good dig hard ring low losin lot tight bottom pain queen stop frontin god trust us hold slick lem aint real baby grow toast today ima painful talk dont would luv way mean hand journey every half-broken foul imaginin bouncin nothins actin lately heart new ill blue king callin sick sl walk around brand appreciated thing candy time long girl sleep together help side somebody inside smile kid sit ever busy slow promise feel baguette sure forbid deep u die addition place look crib stare friendsll show else love deserve fly willin sky sentence hurt tear kiss simple meant forward life female nice self-destruct nothin chance never serene yaknow mentality back flower youre another nothing lap dream cry watch lovin adore cuz day true change embarrassed think laugh hair
Made You Look ; Nas;Made You Look by Nas.txt;even coupe whole stupid cup sexiest mobster convention big dim move whatever push four-forty grey pull rooftop live consciousnessembed music alone shoot last yo put streetsweeper white shot steel little swing city mood bravehearts baseball nicely shootin lot pun benz spit slave stick song baller describe us light athlete bag well-dressed real pass lookin rap talk men way people invitation leader tv hand chazzers thoroughbred goose tee newness gettin rappin every nigga lace intelligent reach seat mi head new tool clasa stay phony aw admission free gangstas king fight soldier start wo pimp beef around reason loot kept time en rapper waist bat girl trunk oblige always best box step lose smurf playboy justice car niggas feel eagle hydro finesse money sure killer wifey mami none timberland enjoyment fifth reefer class knock maybach titty drink thug drive tension look crib hop close doubt show click-clack wop rhyme book street punk love fly page panic just-comin survivor ambulance hoop five-o female nice nasty bringin anthem bring leave nas ladies hot topless dealer lay plasma perspective back appoint count town homies face breeze rude runnin defuse pool sassiness man choose hustler swift slowly pump parolee
