title;artist;filename;lyrics
(Theres No Place Like) Home For The Holidays (1959) ; Perry Como UNCERTAIN;(Theres No Place Like) Home For The Holidays (1959) by Perry Como UNCERTAIN.txt;franklin billie ives martin lou wish noel christmas warm trio midnight live tree alone ellington rockin orleans white daigleembed orchestra little trotter world fontane leona darlene jolly john sister clear merry gene lot drummer song rawls commander tomlin remastered holiday ken collection light vocal perry carter carol daigles ayres jingle aretha crosby lauren armstrong first flack new michael lewis king guaraldi sinatra hear williams frank around time holy chris marshmallow welcome herald nat ella rock roberta christmastime andy como bethlehem bell single lee holly could begin vince caroling waltz place look snow louis duke bing love version reindeer angels everyday burl daigle dean scott darby hark tyler benny autry sing boy town red-nosed night fitzgerald brenda upon keep cole jenny rudolph carpenter singer day rice santa child claus home
1 Step Forward 3 Steps Back ; Olivia Rodrigo;1 Step Forward 3 Steps Back by Olivia Rodrigo.txt;stuff something instead maybe give strike hate masochistic send rollercoaster today much way speak call three fun head forth ask walk wrong lover find somehow nerve want always step door ever still fault kinda understandyou doubt everything love forward life kind translationsturkceespanolportuguesportuguesitalianodeutschfrancaisnederlands never leave back boy cry excite power phone pretty fuck normally mad home understand
100mil ; J Cole UNCERTAIN;100mil by J Cole UNCERTAIN.txt;doin pork west right marley stone basement maybe jump watchin live music paul limelight woman cold club porsche jugular kurupt world far climbin quarter exit farrakhan magnificent ring hall spit check fold verb trust rain pop christ pill stomach option bad weather taste flow stress metropolis rap behind would judgement skydive g-o though endure champagne raise nobody stay old cortez vega saddam king relax andre fan girl tether meek plan five best phil everybody beatle makaveli mayor barbies nova debt feel arthritis takin black grand draw namedroppin none elvis flex kick vers monarchy hip-hop version debate special loan mind passion crack lohan bunk-bed b.i.g. nike hot dollar town cole detroit collect bomb legend tryna kendrick mystery home og even hook pay mollies cup tissue bar fame coast taking give vietnam sean involved hot-headed window cause barbershop tin destruction thats baskin rep city line runneth stop ball suppose millz g aimin eminem drake disc dorothy grow lookin church joke closure great seat thinkin red new anonymous gun fire usually around moment devilish alarm tanglin always ive inside word bunch core lindsay jackson witness sure deep sayin could magnolia tale homeboys ruin unless rich-ass look earth decepticons realize mom show pelvis chevy downfall street death translationsespanolcontrol reign proclaim violence melon jermaine roc tyler business fidgetin party yep flower dome straight stumpin many alias pete rhymin farembed may power sharpie everythang man fuck try change muslim shit flame pbs probably demise solid eyelash need coachin grin wale im finally spittin turn homie juggle buy latex miscellaneous rockin verse put umbrella plot mil good mac run nook exist god hindsight wild someone bond fam dick way clique hiccup fair roof call every nigga head heart land woah sight history relapse lord strictly ride mc funeral -year-old murder motherfuckin connery kissin cartier base pac still miller ap ever niggas juicy tryin shepherd satan bumpin reaper k.r.i.t. blind liquor faith class poppin ground electricity everything love important sake york piece mo talkin chance juggernaut instagram never stewardess nas crutch condom key full b.i.g foot respond infant mine wind noun spray think sell jigga em whole swear may-day magician big move g.o.o.d somethin james name tour cockpit month nut paycheck bracelet white mhm angel game bean drop wreck bitch lot mother front pain mccartney peddlin playin gold competition barely fuckin us jay shoulder villain ahead week hova hand motherfucker cant friend first cologne pusha parachute hear soldier wo matter either find transform rest time a.k ogs long sign uncoachable prosthetic cobra leg sin corvette unsociable step kid rock car vid prayin write explainin single designer granddad house gobble picture drink place crib pew electron book lofty drought pope reverse smoke forever rocky metabolic blessing offspring alien back dread boy face high keep watch dark dress mode pilot
2 Much ; Justin Bieber;2 Much by Justin Bieber.txt;rather right funny maybe big fall name eye music month injustice dancin world problem chest relive forget stop scared god suppose us sun eternity asleep much way every friend head hear rest blink time somehow long prayed second still justice feel without translationsturkcedeutsch everywhere two look close stare mom love breath threat enough layin miss digest touch meet anywhere muchembed hair
2040 ; Lil Baby;2040 by Lil Baby.txt;doin even changin right truck damn whole pay swear eat walkin gas suck neighborhood big active somethin type give name order act number eye ratchet stand live prison goyard homie tax month shoot nut verse put killin ran hate shot send voice mask wick trench top zone lonely award good location band john wake city comment bitch mud handle plug lot playin board trust ch-chic near shorties feelin bad someone urus sexy real baby stock much mrs. wide would way dont talk half purse call gang goofy gettin hundred bracket nigga translation serious perc though othr reach foreverolling confuse first lucky plus ask blue fire woah start hear eight matter beef around moment time blink shooter girl average lawyer want lamb rent pussy ballin everybody inside still traffic lil busy car niggas influence promise feel body without child subtweetin cash money rather molly opp ig none chillin sayin die click morning donut two ear ruin thug look million stare figure fill jordan everything kill show else love boom happen skrrt important hurt flexin laughin couple twenty drug life extort forever nasty enough switch wood never uncomfortable business bustdown ass weed boy befor fifty percocet turnt another play stalker nothing patek safety foot smurk runnin touch feeling grower social fuck man must try change fillin shit
2055 ; Sleepy Hallow;2055 by Sleepy Hallow.txt;fry ice brush big eye really dirt turn hope cold john line compromise bitch stick trust inner cap real sorry dont would way gang nigga friend great blood heart nobody gun ride beef slide huh trade want side everybody kid livin niggas body thigh zaza please tire nine lie die could liquor ak water love sky open drug life different nice never party back boy pack play knowing mine cry fake beat fuck shawty try ta energize sacrifice spill
22 (Taylors Version) ; Taylor Swift;22 (Taylors Version) by Taylor Swift.txt;deadline happy whole instead alright b bet fall stranger news breakfast midnight heartbreak dancin ditch lonely forget feelin crowded bad translationsturkceespanolportugues uh-uh hipster miserable way anyway fun confused next youembed free wo time want exes best kid feel tonight perfect end place look everything love ew version scene oh-oh twenty-two taylor magical dance hey woah-oh-oh-oh night seem many keep r dress cool swift ta
24 ; Kanye West;24 by Kanye West.txt;right alive mm-mm fin alright dear mm-mmembed throw yes hour put wave okay god hand head new old lord translationssvenskaportugues time everybody step candle bow ever feel save please set mm-mm-mm lie everything devil love else sky lik finish exhaust never leave twenty-four high nothing choose ta na-na-na
24 Hours ; A Boogie Wit da Hoodie;24 Hours by A Boogie Wit da Hoodie.txt;right even truck wi-fi shakin somethin comfortable artist bummy type daughter really turn hour put send trench tellin line react bitch swimsuit check stick distance care fuckin stomach slumped bag week bad lick wig real baby bed much reply way fat lickin call every gettin hundred nigga toe thinkin shit nobody land swim wrong seven slide ugly afford thing time twelve burn sherm long religion want always five text touchin ballin inside kissin past car feel body thigh try roll please w money mention healin two house maybach hole laurent look hug love soon see-through hurt kiss singin different herembed forever gucci never miss tru freeze mmm-mmm-mmm dollar thousand twenty-four control play balmains keep pool pretty day fuck saint treat
3435 ; Ariana Grande;3435 by Ariana Grande.txt;doin right even thirty-four alright eatin neighbor maybe need healthy midnight watchin yellin movie put hmm top savin good squeaky shake bitch thirty-five energy baby taste bed dick snooze way mean though seat stay coffee start ride thing candy time side chick goodembed inside door hit belt ayy quite tonight earthquake wifey countin except class favorite drink sunrise water drinkin show crazy open lik lightweight life plainly ah translationspolskiturkceespanolhrvatskiportuguesmagyardeutschfrancaiseestinederlands+ never leave heavy boy night math keep dream gim fuck daylight spot wine true think shit
4 Da Gang ; 42 Dugg;4 Da Gang by 42 Dugg.txt;sell doin even west humble daire probably dawgs deal forgiato interrogation lou minute tie suck wish big cmg throw pull serve harder name act young eye number card really ticket admit turn ridin buy hub put white window digit pause bro groupon east game butter drop city th two-hundred hard low dawg kembed bitch mud lyrics playin check chain quit board catch fuckin peanut us gangster win tub la urus real baby gang call wheat every kitchen gettin nigga fanta though seat twin nobody imagine blue free oxycontin wheel som lyin reason mat soft thing time burn sign want always sippin help timbs four-two dope box blender still lil niggas model frog year kinda swipe respect dub raw die could two tint direct thug trippin kick fiend turntest opanas kill remember love ho bentleys plain hunnid sex crack chicken nothin pullin bang remain never bring wait four da c-side back night lane dough flag public keep amiris mister floor runnin collect propane tryna fed identify fuck try k shit
4th Ba; Mama by Summer Walker;4th Baby Mama by Summer Walker.txt;doin even damn whole probably raisin clout funny b big give stand live really point lavish alone no-no-no trap buy cause tellin date nowhere hard ring bitch queen care fuckin claim pregnancy light work bag drake bad baby addict people would way mean call foul nigga three actin sellin ask start bein wrong havin wo laziness racin find around track time guilt long nerve huh plan pure always add uh mama kid family liar hit word car niggas flashin takin cash money fucking could whoop thug crib hop excuss crazy cute deceiver payin life guess embracin nice pullin instagram cheater never heartbreaker back translationsportuguesth keep r dream hoe beat tryna spend fuck trip ta think shit
50 Shots ; YoungBoy Never Broke Again;50 Shots by YoungBoy Never Broke Again.txt;something irrelevant pay whole pan round chopper tie follow mad taytay skully ten give act sens turn sticky put window shot mask duck got stoppin top zone tot slang city henn run scar bitch benz blaze broke stick catch pop vodka dead prolly boyfriend us g partner bag bad wig spin pass euthanizing today terminator xans talk way clique beatembed scope fn blick goose heat hundred nigga bread red head stay gun start green block wo beef hating around nonchalant fan burn baow plan murder want static pussy suicidal youngin herm rich hit niggas rid car dump taaka grand money sports-inator aim bent die north two loud knock depressed prey separate everything kill sherhonda fly soon sluggin hunnid intelligence different grant smoke forever bang never bring business redbone back skeleton face control fifty full jug flag another dirty runnin beat tryna cable muddy fuck mm think shit
5500 Degrees ; EST Gee;5500 Degrees by EST Gee.txt;right carpet shook soda chill really tough woman cold killin security wave mask top hide owner trapper bottle broke buff zelle pop near cap real much rap luck growl hundred raise twin size fan everybody l without takin none goin except pro overkill snow gram mind bringin hot four town night charge phone pay cup round stressin ice textin stretch brick give switchy young stand ridin last member shot city bartender wake band stop chain catch mix g opps pant lookin new wheel block beef around pistol practice bullets lawyer motion dope inside short hit year lift tire sure dub since coolant booster sayin could dog dismiss thug look wayne show crazy pipe system plain different grind rizzy miss pit straight play glass man fuck drill shit throw starve buy run sixty-day sixty-five brown blicky cut baby bustdowns louisville way roof janes call every gettin nigga head tool team post broad still lil lazy niggas slow ayy model topside promoter cash skill end enrgy monkey hotboy dot crush ground vibe love whipped ho twenty couple kind instagram leave screamin lay glizzy hoe mad walkin bet big youngins sixty ten type insta month generation white send hood stoppin pick drank degree bitch tight playin color rack fuckin us gangster spin hand three fugazi ape actin feature start hear eight find slide dunk time coronavirus text cloth step family car narc deion refund million petty six fine nephew swell building smoke pour twenty-five enough back boy fifty haha rat touch day shiner
7 Summers ; Morgan Wallen;7 Summers by Morgan Wallen.txt;even right probably coke ago bet maybe big sixer young dodge turn road buy last white use proud little acre dumb far east good ol diamond saw baby talk way driveway hand friday anyway friend old translationsespanol seven southern find thing long girl sippin ever still wonder year tennessee bullet south somewhere house drink sad drinkin love couple summer guess comfort forever never daddy river back boy ooh-ooh highway think
7am On Bridle Path ; Drake;7am On Bridle Path by Drake.txt;doin findin right stone david maybe really gildan ferrari banker cold credit puto dancin world top far respectfully driver mud hall antetokounmpo ya trust bad flow neck kudos rap behind mean climax hundred earl toe though old stay rollies walk press level want folk copenhagen ocean sneaker without fallin closed casper mucho aim north address seed state amazement frozen close denial secretly happen association mind life blowin impress chulo believe correct ratio turkce yeahyou hot cloud golden age revelation night relation runnin tryna rise table ta digress slidin boom-ba-ye kumbaya trainin fame wish textin give ruby peacemakin wineglasses buck ironic line ceviri era song stoned givin third buyin hold aimin peopl leavin collection drake la grippin great new passin blue wheel country around hero door marble second year please assume since culo deep lie could papi wage design look hype tombstone show street calacatta comin reign steal toss party seem straight play label cool man fuck true try accept shit least hesitation condo eyelash need total grey owl pull cage put fourth ghost use little bro run desperation famous peacefully god in-between destination people half rizzuto translationsdrake call boys gettin nigga defeat heart head miami team racin post meditation supreme payment squad bezel somebody base still niggas ayy body everyone respect lettin two-tone jealousy vibe open fashion ho behalf nipsey exactly path talkin reachin never natural sing lay thousand speculation full thre lovin t-pain mad vito swear bridle move loophole sixty name loose nuvo boot game low bitch lot playin grace us mark fishbowl beefin speak hang tee three first emotion medium thing time shame somehow kid nation prayin throwin decency nine r.i.p marine place crib pourin understood believer told secrecy switch border caruso explanation sleeve losing back boy feedin face high keep portuguesam shortage watch day wild
865 ; Morgan Wallen;865 by Morgan Wallen.txt;changin give really twice last little pick bottle shoulder whiskey bedroom feelin taste would church colder hand call heat closure first drown holdin seven -- matter brand time girl want door second sip feel tonight jack tennessee sayin could empty liquor loud drink living love room mind different lip face night another glass label phone tryna table try think
95south ; J Cole;95south by J Cole.txt;swerve pyroos damn em whole focal jesusyou stone tie need move village im name young protools really strike rope put cold stunner shot send pray punch world chernobyl top game butter drop th shell low spirit lot slave bible stop father ya god pop hopefuls stack nah ks lem snatch doc vocal cut flow payroll much rap talk locs nigga noon papa hov head tool middle lyricsblack old freestyle fresh track scapegoat halos haiku holy script crips kratos broad rock bow volcano family still basquiat pac stroll slow killah fee feel body lift chokehold sweet south killer cop jan could j neo two pro look echo tho show drapeto slump morgue reign despot smoke nice slowbro mo goat never leave goku float lay tribal back sinner dome target high play full slap floor cole watch dark day meet fuck ta k
A Holly Jolly Christmas ; Burl Ives;A Holly Jolly Christmas by Burl Ives.txt;street time case cup ho ding-dong-dingembed best somebody kiss christmas ahhh ding-dong-ding hello year golly everyone wait friends cheer ding-dong-ding-dong holly hung jolly snow meet walk hear mistletoe ahh
A-O-K ; Tai Verdes;A-O-K by Tai Verdes.txt;eat lemonade minute big terrible throw sound horrible yes yo put hate little world gourmet good trouble okay maid guitar appreciate interstate nah g feelin bad real baby taste na-na-na-na-na-na-na sugar na-na-na-na-na-na way lady friend head middle old blue woah lyin a-o always uh no-good busy sweet saying woo lie water living mmm ew crazy a-o-k shimmy-shake pretend mind finger yuh hey haha day two-four-six-eight fuck makin man change space shit
abcdefu ; GAYLE;abcdefu by GAYLE.txt;even swear craigslist tongue need textin give sound anythin put hate voice date lt sister f couch bitch bad way mean call friend affection first ovr art ask spell start girl always best become attention everybody car everyone na-na-na-na end goin bite could dog two broke-ass place mom translationsturkceespanoldeutschfrancaisabcdefu job nice nothin never nothing a-b-c-d-e connection offembed question tryna day fuck try space shit
Adderall (Corvette Corvette) ; Popp Hunna;Adderall (Corvette Corvette) by Popp Hunna.txt;even alright wish exact move lean name dirt admit turn missile send drop th bottom bitch mud stack opps duckin norris bag real talk nigga head rollin fact walk wo relax rest false slide jet time diss five motherfuckin trash uh corvette pussy exing hit sip niggas rid tay piss die could listen two cece trippin look hop popp sometimes action threat adderall tear different thatembed addy cappin never ungrateful four back face keep girard fuck try think shit
After Last Night ; Silk Sonic (Bruno Mars;After Last Night by Silk Sonic (Bruno Mars.txt;ah-ya-ya even damn bye-bye star minute throw somethin stutter hope last sticky put window ooh-woo-woo-woo game good wake anything shootin change diamond sonic gold player d-d-d-d-do baby suki call every sock goodbye felt head wishin time girl want uh still car feel ah-ah sweet mornin clothes woo toodle-oo place prayer silk love fly oh-oh mind translationsportuguesafter ah never wait thick sing night gushy runnin phone pretty day baba true try mm normally think
Afterglow ; Ed Sheeran;Afterglow by Ed Sheeran.txt;hazel afterglow clock iron miracle eye love-drunk alone white bright radio world clear tight stop fade catch hold sun light weather way hand winter inch bury red new amazing coffee wo track find hair time burn level lose reflect translationsturkceespanolportuguesitalianodeutschafterglow saturday except outside morning two million snow softly colour six darkness love disappear dance wait gaze silent golden play nothing afterglowembed dimension tryna leaf wine change
Aint Always The Cowboy ; Jon Pardi;Aint Always The Cowboy by Jon Pardi.txt;something damn messin eye midnight made-up wrap chasin boot far lonely cowboyyou run settin hard lot sun aint leavin dust hand hang goodbye heart rollin quiet hear tumbleweed around time girl always side settle smile still rid tryin goin away searchin love fly wherever tear mind believe never leave chevrolet restless mine keep wind cowboy
Aint Shit ; Doja Cat;Aint Shit by Doja Cat.txt;doin even pay secret read think need fall bit freak somethin give break lack chill really madison yo planet mhm pick square shake bitch stick ten-page fuckin fridge masochist bag dick lookin much way call coulda translationsturkceespanolromanaportuguesdeutschaint nigga three friend umm actin thinkin head new cheatin woah baddest hobby fob relax find time -ball text rent facepalm still car cousin dumb-ass write waitin listen could two wow mommy look crib mom ahh book job happen logical dad laxative asshole return leave shoulda back key face keep man must lobby ta mad shit
All I Got ; Rod Wave;All I Got by Rod Wave.txt;right damn dzimi bet neighborhood whatever corner give young jump solo finally c live turn ridin road yo killin demon security pray chasin world travel game quarter drop city f low bitch handle playin stop care pop dead grown real bm spinnin nigga century thinkin lately nobody guyyou hatin drophead memory ns wrong seventeen around reason fan tak time want folk broad uh youngin pac lil niggas ayy promise feel try penitentiary since none extension lie morning thug look fightin ceiling six everything love grrah life never hey business goner lay jam back key boy twenty-one play many keep dream touch day fuck mook jumpin spray man lock home shit
All I Know So Far ; P!nk;All I Know So Far by P!nk.txt;right even pay naked stumble wish sword throw teach give rage live loose yes alone afraid razor put use proud little world far drag hide line run scar spit pain candy-coating price rain skin light hmembed someone cut baby people would way anyway felt head nobody stay truth blade girl always unfiltered hell dive still bear feel lie loud away darkness rule show book fly pretend translationsdeutschall life crack handing storm renegade enough leave mistake back key full wind wall blow dress choose fuck change
All I Want For Christmas Is You ; Mariah Carey;All I Want For Christmas Is You by Mariah Carey.txt;happy even list right wish need christmas sound translationsespanolturkcedeutschfrancaisall stand really tree send present shin ring tight lot care nick hold light baby laughter stock much hang fireplace stay underneath ask hear wo thing want door ever pole tonight bell brightly everyone please toy everywhere could outside click north snow fill reindeer ah bring wait awake magic sing upon keep air day mistletoe santa true saint claus sleigh
All Night Parking (Interlude) ; Adele;All Night Parking (Interlude) by Adele.txt;maybe stretch nightyou remind alone hour cold beautiful good erroll hard ft. happenin god flight easily way every glimps next possess usually fight sight thing time long translationsturkceespanolportuguesdeutschadele want text best inside lose feel park thn panic impress interlude leave garner party digest night francaisall dream excite power spend dramatic home
All Too Well (Taylors Version) ; Taylor Swift;All Too Well (Taylors Version) by Taylor Swift.txt;even something upstate need maybe fall teach remind break name cheek paper turn alone album cold use little shirt masterpiece running honest sister translationsturkceespanolportuguesall run okay forget scar mother rare light week real bed lookin much almost story call future kitchen translation disposition first red felt middle old ask team plaid walk wo find crumple thing time somehow long tee-ball wide-eyed scarf door lose kid innocence drawer still past ever car rid promise sweet lie could house stair picture paralyze autumn place counter remember else fine street love fly version photo tear taylor piece dance ar enough mail wellembed leave gaze magic sing casually refrigerator twin-sized back cruel town night nothing keep glass air wind day self smell try think home hair
Almost Maybes ; Jordan Davis;Almost Maybes by Jordan Davis.txt;right whole bar baton need move finally maybesembed turn texting thought pick drop nowhere good september hard lot stop song work wasted real almost talk would college goodbye next blue ons reason maybes girl bat help hell mama outs door sit family daisy july feel year black kinda could picture look crush close sad love crazy happen alones tear enough miss hey back weed knee town night another beer spend pretty man rouge try think shit
Already Dead ; Juice WRLD;Already Dead by Juice WRLD.txt;even alive maybe stand live really alone demand hope demon voice pray wash bitch drama plug pain opera mix dead vicodin pill hold skin feelin much call gettin friend sufferin cellphone head heart nobody popular hear relapse fan medicine want sin lose past ever henny feel year everyone translationsespanolturkceportuguesfrancaisitalianoalready listen applause nightmare house away downfall comin already drug chance reachin soap back straight late-night floor stayin runnin try think home laugh shit
