title;artist;filename;lyrics
Superman (Its Not Easy) ; Five For Fighting;Superman (Its Not Easy) by Five For Fighting.txt;even right train easy alright funny wish disturb bird fall im sound stand concede good anything bleed lookin men way part mean red hoo ride find thing hero sleep inside tonight naive lie could diggin away beside street crazy fly superman special absurd wont sheet plane never kryptonite knee cloud face upon dream cry silly may pretty meyou man home
Sweetness ; Jimmy Eat World;Sweetness by Jimmy Eat World.txt;meembed stumble need sinking little game hide run uncertainty outward a-a-a-and unwinds spin sweetness numbing whoa-oh-oh-oh-oh-oh string meaning free wo seek bind tether lose dizzy whoa-oh-oh-oh-oh still word sweet listen crawl away numb simple concern dance whoa-oh sing ooh-ooh-ooh-ooh-ooh back play ah-ah-ah-ah-ah
Tainted ; Slum Village;Tainted by Slum Village.txt;right even damn alright star minute need type give rub sound tea stand really music fix woman cheap cause strum taint date consider good record okay hard handle guitar trust fade us pedal trail mickey lick someone real flow much people situation would way intimacy dinner brain nigga scandal champagne loving ill hella stay plus free green wo tainted frown main find thing time long girl creep want folk always chick everybody lose smile door oooh sit occasionally rid lifespan feel quite stab year cash bucket alrightembed sayin could blahzay kick everything subject love jeep ho dwele life exactly experience never leave entree hey business wait beneath spleen back sooth full pillow night nothing many hoe keep candlelight blow beat spend rise day man true try think treat
Take A Message ; Remy Shand;Take A Message by Remy Shand.txt;right pay endlessly fall fail break hope wave little honest shake hard price mean hangin every truth find around message thing unconscious lose livin past tire could movin love life defense enough leave bring sensibility back cry foolin sense day makin harbour
Take Away ; Missy Misdemeanor Elliott;Take Away by Missy Misdemeanor Elliott.txt;even lastembed whole yes mm last mhm world nowhere attach anything broke gold chain hold near platinum baby every anyway attached unforgettable ask lifetime thing incredible girl want become ever feel cash perfect since none goin listen cheddar away fill personal everything love oh-oh unbelievable national shoe match regret ooh-ooh spend day ta
Take Ya Home ; Lil Bow Wow;Take Ya Home by Lil Bow Wow.txt;sell right hook something represent tres whole rear read bet move sound cover number point yo smother epidemic mil shirt bling good gate run attract front brown ya flow neck moss lookin way mean group tv scope def gettin left bounce homey red thinkin copy sellin nobody old bridge ask start hear sea ride around fan thing time sign across best everybody step rock bow ever family xembed lil car bear hottest takin black anyplace south park since cake house wow neptune look guaranteed rip remember show girls rhyme holla magazine fast hash todd mind different forever repeat talkin stroke waste shad mr. wit hot back full co floor mine pocket tryna scatter man spot makin lock home
Take You Home With Me aka Body ; R Kelly UNCERTAIN;Take You Home With Me aka Body by R Kelly UNCERTAIN.txt;jacob rear r-o-c tie b need thoroughly connivin everybody-adi big whoa throw freak give type young wife gear momma ganja yo white shot moulin little ex game date hide exit mood clear indeed hard bitch a.k.a tight jean mirror stop army ya catch mark pad bag stitch wearer seam real baby rap behind tv hand call gang motherfucker underwear inch friend first next blue scrungy callin hear hair gangsta girl creep quarterback want louboutin add uh powder everybody ever versace body .. respect money sweat appear mami cypher lapearla christian body-adi-adi favorite suit drive view honestly tra dude rocawear trackmastersembed love speed uhh pajama blowin life heel cd pour strip shoe thick nike four lay back flat key montana dvd smooth sweater r glass watch keep horny cuz rice object fuck hotter rouge bandana ta lexus think home shit
Talkin To Me ; Amerie;Talkin To Me by Amerie.txt;even funny read need whoa give eye composed turn hard us baby much way speak every friend actin head heart la-la-la-la hear wrong callin wishin find time want always uh unspoken word sweet sure deep could mmh look show yeahembed love sometimes action mind lip talkin nothin never hey willing oh-oh-ooh many dream touch feeling meet cool understand
Tell Me Whats It Gonna Be ; Brian McKnight;Tell Me Whats It Gonna Be by Brian McKnight.txt;give wet twice month undone likei.g.y forget hold flight light baby flow much strong fire ribbon soft long want fantasizing side slow beembed desire tonight please anticipation aim two superstar possibility love sky open different nice tokyo ready whats bring leave back night regret air feeling day
Ten Rounds With Jose Cuervo ; Tracy Byrd;Ten Rounds With Jose Cuervo by Tracy Byrd.txt;whole glad round stranger move ten give sound buy tappin boot ruckus good band ol forget catch carry way three left drown ask memory start walk wrong seven eight around jose five lose darn showin tonight bucket countin nine could tune two place six mission cuervo lead dance never four count dang foot floor beat singer pretty reveal think
Thank You ; Lil Bow Wow;Thank You by Lil Bow Wow.txt;heard right west industry whole onembed pen midwest follow need big letter j.d. support live paper yes turn poster buy playa rockin put missin credit tellin little hood top record upstairs barkin store bottom forget lot song pop mix givin us lick real baby promote much would group djed call signin def s.s.d cali first dish heart local new puttin st. station fella callin sick purchase track ride find reason fan thing sign dedicate long daps girl want folk somebody office uh dope rock kid ever plate hit atl showin without write please set tryin sayin could thank fish secondly favorite uh-huh columbus kick louis mom jersey show love street york tape piece singin bark cd nice forever forevermore never opportunity leave rock-rock-rock vinyl autograph website back town play keep woof dirty dj dream l-o-v-e j.e. day man spot makin true ta think braid hair
Thats Just Jessie ; Kevin Denney;Thats Just Jessie by Kevin Denney.txt;jessieembed silhouette ice brush sent butterfly act fence eye cheek dirt road muscadine put cold white little thats exit row ol urge hall stick song catch blame pad work cigarette crowded elevator auburn way every hummin three first seat cotton heart ill ask memory coffee along start hear green hair burn always across help cross legal traffic sweet barefeet morning smilin jasmine wildfire look tho fine knowin crazy yet sometimes likebut kiss mind summer smoke dance lyricssometimes jessie miss slender back flower evening meeting wall may wind dress perfume jumpin wine laugh
Thats When I Love You ; Phil Vassar;Thats When I Love You by Phil Vassar.txt;julie crowd walkin star need name live alone little radio thats far low stop care near asleep people way every heart likewhen middle underneath youembed hear lyin matter find reason around thing explain phil smile car without fallin everywhere loud million softly season close doubt drivin love vassar fast everyday already dance talkin wood sing night high another phone dress day anywhere laugh
The Ba; by Blake Shelton;The Baby by Blake Shelton.txt;truck whole need bayou break young wife really point turn babyembed cause got shrimp ohio rotten care us greg youll work baby would way lady brother call cincinnati friend great goodbye heart along wrong birmingham time sleep photograph always side kid family core save tire could alabama drive look softly mom ronnie mamma love job crazy fast fly kiss guess kind factory never daddy louisiana boy night weep boat cry man child home laugh
The Cowboy In Me ; Tim McGraw;The Cowboy In Me by Tim McGraw.txt;stone mad fall act foolish road wake line run satisfy urge mirror us bad would way head heart fight ride thing time girl cross pride lose worry still allyou single set draw love sometimes lead mind guess life never enemy restlessness face cowboy must think
The Game Of Love ; Santana;The Game Of Love by Santana.txt;right instead whatever bit cold babe use little game lonely good store pain hold sunshine baby guide goodbye start sea around candy bat want door feel please roll die outside knock love boom console kiss divide control laughs play try laugh
The Good Stuff ; Kenny Chesney;The Good Stuff by Kenny Chesney.txt;right stuff whole eat bar milk big corner pull give young eye hour misty supper spaghetti white wed date drop good bottle shake ring catch spent hold whiskey saw light asleep baby pass grandpa sorry much half talk sober way lady hand call string three friend earl t-shirt reach first new old ask strong blue pearl late fight start walk sight lord find around grab thing time stuffembed long girl five cancer mama smile sit second worry plate year burnt black saying end deep marry picture drink drive look stare love tear kiss bonnie kind pour carton school boy seem high neon beer keep glass cry adore pretty rice day small man soul bouffant home hair
The Impossible ; Joe Nichols;The Impossible by Joe Nichols.txt;even thirteen pull loosen break give rusty wet stand turn chase road splinter steel ship top junior check unstoppable bed grandpa would way hand head new monster underneath late walk brand thing unbreakable impossible sharp leg prayed car graduate curve feel without year lift learn underestimate scratch unsinkable unbendable die could bolt away realize mom happen quick sometimes helicopter dad guess believe wrench never impossibleembed bring hopeless daddy flinch bend sink cry wall fury dark wind day arm billy think
The Ketchup Song (Hey Hah) ; Las Ketchup UNCERTAIN;The Ketchup Song (Hey Hah) by Las Ketchup UNCERTAIN.txt;cart griffin jungle whole derek stupid probably ketchup blake naked chopper eatin freezer need dip big throw pull theme freak name wrist jump solo coochie cruisin wet trap chase nut shoot last put cold club send got skeezers dis dancin dumb spine run dyin ring bitch shootin onomatopoeia brown playin song catch desert fuckin dead nah pinky drive-by bag smart bad martial dick cream bah-bah-bah freaky leader would way call gang uzi gettin nigga defeat head art old aw team sauce hear wrong nicki freestyle slam aaliyah block rest dunk thing bullets shopping huh glock- want squad motherfuckin tall meter polo pussy mama beam jeter hit word niggas ayy sneaker eagle body forty hah set money shoppin peace park nine chun-li woo trey raw movin crip empty two knock gunshot kick beeper everything dart street grrah ew chrome heater picky fifa nice lip loc-li mustard drip gucci songz leave hey simi hip back knee mink pink target play ewyou clutch beat tryna spend meet fuck man try ta think home shit
The Long Good;e by Brooks;The Long Goodbye by Brooks.txt;miracle wing pull give really turn carousel climbin hard happenin baby would mean goodbyeyou gettin goodbye heart ask free walk lover matter long always somebody inside still word without set sure goin mill waitin could breakin two away doubt prayer love sometimes oh-oh tear kind chance hill never back face keep cry runnin sense spend day anywhere must try think
The Middle ; Jimmy Eat World;The Middle by Jimmy Eat World.txt;right alright live buy little good someone head heart middle matter ride time girl best worry feel write alrightembed woo bitter away look everything else fine yet enough leave hey try
The One ; Gary Allan;The One by Gary Allan.txt;canyon solid need wing give break stand oneyou shine strength trust behind shadow though heart ask unkind walk wo find time heal girl want best somebody step feel rush sure ground fill beside else love fly lead river touch soul true prove home treat
The One You Love ; Paulina Rubio;The One You Love by Paulina Rubio.txt;secret tie need wing sound loose beautiful world top nowhere anything uncover light ba-ba-baby baby part every string heart start bethe wo lover find girl want inside search ever crash could look ground everything show love fly lovee ba-baby broken leave sing keep dream air phone soul true
The Red ; Chevelle;The Red by Chevelle.txt;threat mind real give single lay throughembed contain red ask truth filter away clear slip sight wo show change
The Rising ; Bruce Springsteen;The Rising by Bruce Springsteen.txt;sadness stone fullness blessed sixty eye stand precious sorrow fiery bright far line ring spirit front chain mix shoulder light behind way sigh hand call shadow blackness blood memory fire wheel track lord fear around bind holy burn half-mile cross mercy lose climb tonightembed feel tonight bell black roll garden pound end mary wear morning emptiness house picture darkness fill love dancing sky tear life dance leave lay back thousand catfish face high nothing longing mine dream glory air may wind rise arm child
The Star Spangled Banner ; Whitney Houston;The Star Spangled Banner by Whitney Houston.txt;early gleaming rocket yet super xxv gallantly star broad light twilight still give banner glare live dawn spangle last stripe bursting wave proof night bright bowl red flag whose perilous braveyou hail watch bomb air star-spangled land fight rampart free stream proudly home
The Streets ; WC;The Streets by WC.txt;smashous right acquit eat swear ceo coast follow big rider throw bit name outta c stand music turn hustlas ridin beanie woman boo-ya put coat bailin little hood recess east game slang -braid drop city trapper spit cheese ya scandalous ball felon rack player cock hold g near drastic unlock lookin massive hand call def ghetto dumpin nigga adam pea next escalade head sellin hater stay land blue free sick career hog pimp ride s-classes gangsta dub-c huh louder want tall side best uh nia livin rich niggas dub-s takin body frame roll cash grind-grimey classic dump penitentiary lah-dah-daaah stacy streetsembed dub shiny goin dah-dah-daaah begin click movin turntable robbery thug uh-huh kick ash love street global niazz fly swangin ho beard blunt spin-ni-nin yea toss campus chance status bringin heisman peruvian cabbage knit wit hot ric jam back freshly mojave solemnly rim high another dj bomb blow fuck spot thrashin bust
The Whole World ; OutKast;The Whole World by OutKast.txt;list even doable right whole force curl stone god-willing wish need remote news whatever throw type break sound daughter eye wife slime neither naw alone turn afraid momma hope divorce glitter music yo disguise crime porsche hate use bah-da little radio glisten world shine utterly dismal junkie quarter running date sunny nowhere dig okay shell dyin world-world polish scar bitch change spit musical diamond stop song gloss catch player befo cock stomach democratic hold slick pepto-bismol limitation cabinet weather neck moss sport lookin rap behind talk way pursuable mic brother hand tv candidate -ation bah withdrawal left fate head new shit hater rollin track forth stay blue nappy along workin havin walk dime abbrevi- ride find aaliyah sailor randy engage brand thing medicine gather relentless corpse want replenish box inside rock horse short still focus hit stage niggas word plate black kinda roll sever set ache fresh dub goin raw marry could course dog tummy dismiss mommy state dre look liable slice republican wo everything love rhyme clueless debate commercial stylin mind forward crack rainin grind outkast extreme cadillac bathroom mouth gel wait scooby prejudice float sing da lay floss enemy back yep dread sucker pursue lost shade pack battle play nothing boat straight mine shaggy wall beat day meet cool must trip airport whole-whole ta think hair
The Worlds Greatest ; R Kelly;The Worlds Greatest by R Kelly.txt;notice right jungle star bit pull anybody stand tree rope hope helpin lion tunnel use little world shine band mountain valley ring mirror gold clearly vision saw light people hand great ask king country walk peak hero tall uh door reflect feel eagle end faith look darkness pot love sky reign life believe success giant sweepin greatestembed hey marchin river back face high rainbow wind swift lock
The Zephyr Song ; Red Hot Chili Peppers;The Zephyr Song by Red Hot Chili Peppers.txt;fortune translationsportuguesthe rebel finally live center world propeller stella yea-yea-yea-yea-yea-yeah song light rev weather flash pass today way hand emotion strong find zephyr pickin together want aviator leg ever kite skater feel write friendly perfect display bite away place look water foreverembed fly super comin piece pas levitate forever night wo-wo-wo-wo-wo-woah wind teller liberator meet smell
These Are The Days ; O-Town;These Are The Days by O-Town.txt;waiting maybe give eye hope fix window use share bright lonely sunny change stop stick uncertain light someone motel in-between way heart stay lover fear thing time moment door sit ever still wonder feel without daysembed tonight frame appear paint end could outside empty knock picture away drive place look fill living everything love unclear room mind crack forever broken never back key face neon dream dark feeling spend day ta think
These Days ; Rascal Flatts;These Days by Rascal Flatts.txt;swerve case rodeo clock sortin alright round wish fall throw really twice doheeney swung put punch top teardrop good wake band run jean check stop ya song rain someone baby bed thenembed much would downtown vegas reminisce college friend next head old late avenue around thing long girl norma ever still car promise curve learn marry wow drive place love job sleepy life guess plane dance mostly miss hey wait sing back town dream phone cowboy day change home hair
This Womans Work ; Maxwell;This Womans Work by Maxwell.txt;ah-hah-ooh darling need whatever give stand ah-hah awayembed woman pray little world strength hard lot father stop god work craft baby part womans hand cope left ooooh start oooooooooh thing moment want oooh-ooh-oooh-oooh surely outside away hop show love yet kiss life never leave thinking back cry pretty man child understand
Through The Rain ; Mariah Carey;Through The Rain by Mariah Carey.txt;translationsfrancaisthrough need fall pull give sound stand live yes alone afraid far prevail nowhere run okay pain rain catch dare hold grow distraught way arise shadow every rainembed nobody strong find time mend tall pressing feel without save faith away close steadfastly tighter enough never anyone face nothing keep safe cry wind blow day hesitate home
Thug Holiday ; Trick Daddy;Thug Holiday by Trick Daddy.txt;right even thugs curl martin sunday coast jew read killing need teach give vietnam name daughter malcolm county prison really point tax po-po later verse put cause x pray use world loved good farrakhan run chapel ring gravy judge hard mother front pain check bible feed god thang us hold ahead holiday bad real baby today much people confront would brother luck home call ghetto nigga muslim conflict war raise head stay plus ask strong gun free fight soldier fella wrong history son responsible message thing time survival dedicate religion always holidayembed somebody trav hell everybody inside lose bam lil without year toby hollywood peace none deep die could christian dog blind jail two liiives away thug itchy state remixes remember american everything show book love crazy sometimes tear drug run-a-ways mind guess life struggle education miss wait school boy face many keep mine cry bomb taterhead day penn true child change teacher think
Thug Lovin ; Ja Rule;Thug Lovin by Ja Rule.txt;even something deal need maybe grin move dim alongside bit freak rub name wrist protect bob rage wet live really stressful hope last woman cold send use sheep duck gotti little generally world bright loser santana peel city ha-ha hard forget ha tight jean bitch woooo brown innocent drama god priceless trust pop visit i.g. hold ja win thugging bad betrayal real baby sugar talk wide way mean story home heat def pugilist porn b. lust nigga oh-ohh diddy next safely loving new relationship weekly lately gun free along wo lord tease pus generous soft thing devilish girl temptation want murder sin family occasionally stage niggas body black sweet faithfully classic money pound woo goin ransom could body-body away drink thug look hop rule secretly lo hostage love life inc. interfere believe code bore shoe headline ha-ha-ha wooo miss intervene bring freeze anyone bentley forgive haunt jam back sacred bacardi town stray murdddda foot build many whitney watch sony horny lovin chink day man beginning fuck try wild shit
Thugz Mansion ; 2Pac UNCERTAIN;Thugz Mansion by 2Pac UNCERTAIN.txt;rather doin even arrest right billie alive dawgs peppermint thugs scream mansion unwind ice marvin need dear maybe peer maintain bit multiple name eye finally peaceful stand malcolm chromed-out chase bicker gaye shoot last cause shot deadly little hood good trouble davis band shake homeboy bottom hard victim store survive change exist chain ya ball tattooed player catch care god dead us g hold holiday trick cooke latasha thugz heaven carry baby grow mile suicide pass much people behind way lady gettin nigga though sho heart head nobody free quiet shed fight slingin rest find thing time sleep together explain sittin schnapps mama inside spark lose ever still family past choice niggas promise save prayin year witness hollywood tire roll please wilson peace depart chillin misery politician die could liquor paradise house picture gunshot drink thug place kick darkness police drinkin jackie poverty show remember love knowin sky skyembed comin lock tear mind drug life struggle smoke escape sam remain kickin cuttin ban forgiven daddy sing contemplate woulda boy homies face night high full mine cry visualize watch spend belong dress day man spot try ta pressure think home understand shit
Tonight I Wanna Be Your Man ; Andy Griggs;Tonight I Wanna Be Your Man by Andy Griggs.txt;whole lyricsbaby swear fool need blanket throw im cover finally music alone put cold cause world band forget hall surrender catch light bedroom week bed pass lookin sleepin husband dont would hand wedding old start find time always ive mmhmmmhm candle patient door hit tonight sweet morning telephone place show love ringin mmmhmmyou pretend couple mhhmh floor safe wind man soul lock think home understand
Too Bad ; Nickelback;Too Bad by Nickelback.txt;right clothe stupid alive scream need apart serve dirt turn line mother father us bad talk hand call goodbye late hear wrong walk main time although long guilt still clothing fee without field sure end talkembed house look street tear guess cafe meal leave mouth back keep dream day rewind try
Toxicity ; System Of A Down;Toxicity by System Of A Down.txt;conversion version sleep eat truck catch revery become flashlight neighbor life sun shone activity eye wood disorder tire toxicity pastime hub headlight somewhere sacred heartsyou software world heart loud silence seed city fire look man
Trade It All ; Fabolous;Trade It All by Fabolous.txt;rather even right fool allembed personally stressin pen need maybe grin teach ten give type lack cover admire light-browns buy yo put window cause hate shine stockton top pick game good strut mac anything store ring benz jean front tight queen malone care ball player flight blonde skin pinky saw real baby whore talk men would way hand call brother every nigga friend u-s expose toe thinkin seat rollin whose middle flaw rumor puttin team king along start wrong green mack thing long girl trade pure bun chick uh l-o nahmean door rock mall patience disrespect drawer slow car closed thigh beepin roll set money sure jag goin fabolous titty bust drive look slip f-a kick thus bitty everything show others love jersey street b-o see-through finger lip shoe never l.a. thick hip back shade seem straight play full dream watch edge horn spend tryna pretty day small retire ta think braid hair
Turn Off The Light ; Nelly Furtado;Turn Off The Light by Nelly Furtado.txt;instead woe follow need act midnight live alone turn tough world lonely good run low ya catch wound light lick bed logic rough head heart aching find thing girl inside search slow quite without morning moon look everything love pretend life magical believe ready sleeve seem high play full dream day cool harvest change think
Two Wrongs ; Wyclef Jean;Two Wrongs by Wyclef Jean.txt;early right alive cure claudette follow maybe booby brick whoa give wyclef yeaa last yo use city wake run forget sand pain playin guitar like+ god song castle rain shorty sickness sunshine boo bed baby grow half would excuse dinner stay longer fight wrong walk block wo girl side sittin fruitful door oooh family promise feel please faithful ehh deep listen could papi two thug tha devil show love destiny yea mind dance chance never leave bring ohh wit lay forgive key night high build candlelight touch tryna cuz man soul home understand
U Dont Have To Call ; Usher;U Dont Have To Call by Usher.txt;right damn alright young eye celebrations playa yo bye pharrell world okay byeembed smart real baby situation dont arise call story nigga friend fun stay ask aw sick around steady sleep girl boogie uh still without tonight hah single end cherish u listen could meanwhile tired honestly love tear life guy leave hey wait oh-oh-oh-oh party face man true smell ta think home sacrifice
U Got It Bad ; Usher;U Got It Bad by Usher.txt;right whole maybe act card really alone use world mate ha stick song bad someone elseembed people wide way lady call hang friend fun nobody off-track track matter find around candy girl want help best somebody past word car promise feel body without everyone money u ooh-oh house fortunate look everything else love life ready miss no-ooh hey sing hump back flower crew keep touch phone adore day man change think
