title;artist;filename;lyrics
Grandma Got Run Over By A Reindeer ; Elmo;Grandma Got Run Over By A Reindeer by Elmo.txt;silver neighbor beg christmas give card watchin fig send hoof proud good attack run forget playin gift mark stagger incriminatin wig football grandpa much would mean goose friend mel blue elf walk lord find thing grandma help license candle door eve family wonder cousin takin without black house drive snow drinkin pudding warn open eggnog reindeer scene forehead mind print believe sleigh never match business sing back play beer medication watch dress table man santa claus home hair
Hands ; Jewel;Hands by Jewel.txt;right heartache break eye stand eyesembed voice pray ok world wasteful god visit light someone useless stole laughter would hand idle heart fight wo fear matter around thing time worry ever despair end could faith darkness poverty steal kindness shoe never shall sing knee golden spite gather small man must
Hard Knock Life (Ghetto Anthem) ; JAY-Z;Hard Knock Life (Ghetto Anthem) by JAY-Z.txt;shawn rather jigga tit lam infinitely pay instead cris clock eat braille whether jiggy stretch corner fail rub volume type foe eye give name live naw really standin verse album put progress shot violate plot logically world tuition top far game lonely drop line hard outsider controllin tight joint bump stick appreciate ya ballers us vision trick real baby flow carter hard-pressed sleepin rap situation analyze droppin ghetto nigga toe though first fleein shit new ill stay phony memory pissy-pissy king hear lukewarm green block size wishin what-not beef find longshot thing time rapper burn sleep murder chick dope hell mama inside second ever cot still sip grill car niggas bear rubber feel pie money since non-stop nightmare movin house knock uh-huh etch prey kick perform drivin everything biggie scene york kiss glock life smoke prophecy futon strip ready anthem hustlin bass lotta school hot split four daddy back machine homies borrow grip cell dough another tryna fuck must spot ta lock bust treat
Have A Little Mercy ; 40 UNCERTAIN;Have A Little Mercy by 40 UNCERTAIN.txt;pa diamond something time ya want dozza mercy royce big mineyou baby choice give cadialine feel miss cook roll percy back little world mine pearl drive shuck love
Have Fun Go Mad ; Blair;Have Fun Go Mad by Blair.txt;sell crowd deck cityembed think move corner break give dawn really yes tree turn road club funkybase funk aboard city lousiana good bottle barrada-b shake gentleman front alot ya chain god ball wez lyricsall disc-crop baby porter downtown lady till mic hang lust fun friend hit-t reaggers along capita-b start lord brow around tender girl bull mercy everybody tursha w dance-crop sailin sweat funky begin morning two house place look trance-crop blowout living jones roller open microphone funkboat tricker dance chance likehave bass party high bella thrust beer floor a-baby space mad bust
Have You Ever ; Brandy;Have You Ever by Brandy.txt;right something need give break eye finally world bone anything care bad someone baby much next heart start wo find sleep somebody inside search ever word feel away look close love brake steal life wait night dream cry day arm try ta understand
Heartbreak Hotel ; Whitney Houston;Heartbreak Hotel by Whitney Houston.txt;right instead fool really oh-oh-oh heartbreak babe ohh-oh-ohh yeah-ah someone baby would way call emotion ask along wrong find around time cheat welcome want oh-whoa-oh-oh uh sit hotel write alrightembed nine since lie could look everything else mmm love mind ah believe boy face play cry letter try mm think
Heaven ; Nu Flavor;Heaven by Nu Flavor.txt;noche bout round minute podido need fall apart give likeheaven eye turn hour pray lonely mire f estas pido anything stop ya spanish fade hold le saw asleep la heaven spin primera way happiness dreamin every upside first thinkin mi head heart rest find corason que time lyricsheaven en somehow sleep girl want always help junto feel save tonight siempre prayin single please dormir cada para could away look dios close vulva love crazy soon kiss life never tu knee face night pillow dark te beat spend day suenos think
Heavens What I Feel ; Gloria Estefan;Heavens What I Feel by Gloria Estefan.txt;wing fall break eye send far devotion stop suppose us light someone heaven real lyricslove way would shadow heart emotion youembed truth likethis find together become side lose feel blowing deep could look realize rule fill darkness answer else love sometimes destiny wherever life forever never silent nothing dream wind may feeling question true
Here We Come ; Timbaland UNCERTAIN;Here We Come by Timbaland UNCERTAIN.txt;right stupid marley basement mfc hot-handed epilogue strike music client chase cold thee bdi broke bad rap dice reflection though walk meetin size empire literally rapper salute doctor atlanta chick brooklyn takin without black new-yorkian goin misery seed state uh-huh kick fast quick page mob life yin p mound-up physical resident wondah bringin hot da twenty-four slap stick-up choose yang steam case even revolution shakin greatness stand sean shot bucktown shine peep buck mood chain steppin song vice-versa best-est freddy heat sneezin new monster forth blue gun block reason incredible dedicate dru-ha sittin glow symmetry sure since mutha system documentary ye nasty clik grind ready dishin madman president play upon fuck man change tuck shit mangler whether throw master cage bob hour rockin duck ok little coward camp good god perfection people massive way gettin nigga fork pay-per-whole team station son lord ride main mc huh food man-handle become ever still stage slow complete kevorkian skeltah usa matrix talkin never crashin syringe starang damn doubled-up name rage paper yo white physically mass boot adu ancient drop transit pain stick fuckin mark bc hand ruck inspiration hater soldier wishin low-down time fuckas kid rock frame worldwide listen die two favorite vengeance crib view mound opposite respec-onizing building heltah hey basic back weed boy face high symphony rob keep beat smokin
Here We Go Again ; Aretha Franklin;Here We Go Again by Aretha Franklin.txt;wasting ago need act give foolish yes precious world problem stop song catch baby old walk around thing time long girl mistreat want door past still black lie blind slip hop everything book else mmm love crazy waste straighten boy many keep must try change think
Here We Go ; Funkmaster Flex Presents Khadejia UNCERTAIN;Here We Go by Funkmaster Flex Presents Khadejia UNCERTAIN.txt;obvious push ten eye really turn yo ooh-woh nowhere clear rain f-r-i-e-n-d-s insane talk brother ah-oh three friend head spell fight lover reason translationsturkcefriends time shame five want uh inside door without polite since ooh-oh morning two away ah-ohembed look six love mmm crazy mess ah pour four thousand nothing shit
Hey Now Now ; Swirl 360;Hey Now Now by Swirl 360.txt;happy right complicate alright star freak really wave bright shine rightembed hard dead sun light real baby way lyricson heart head stay ask free find time sleep together always help inside innocence still ocean rid feel listen could outside loud look everything show love fly believe waste halfway hey cloud night dream cry beat meet true likeand think
Hold Me ; Brian McKnight;Hold Me by Brian McKnight.txt;right need give deny turn unplug put truly hold bad baby lust next nobody wo either around thing time long want wonder tonight lie drive place figure else love crazy waste wait phone arm spot
Hold On To Me ; John Michael Montgomery;Hold On To Me by John Michael Montgomery.txt;right secret turnin unwound ashamed throw eye lyricsi cold window world wake beating hard pain hold light baby laughter spinnin every hopin wipe heart middle emotion rest side lose worry feel prayin tryin blind morning scare darkness ground show comin tear life believe weakness never lay control night drunk dream cry meyou wild
Home Alone ; R Kelly;Home Alone by R Kelly.txt;doin right poor r. b lyrical need dat celebrate warm freak give wrist alone woman verse yo beautiful rockland stoppin shine spine good mood handle burden bangin stack gill real baby doembed non hand call roof def motherfucker gettin earl proof temperature release new nobody truth free fire hear around reason thing moment time burn long girl want squad checkin somebody everybody step lose rock rich word body combine tonight year single baguette set respect cash money keith clothes everywhere goin chillin house parent away drink messiah crib water keepin vibe love fine knockin johnny mind spread concern dance hill bring bass ladies hey kelly genius party town control night universal crew nothing r floor air collect blow beat ayo day choose soul prove jumpin ta home murray
Honey ; Mariah Carey;Honey by Mariah Carey.txt;right hook beyond breakdown darling need whoa simply hardly little world wash far good abruptly elusive dyin hard honey stop ya describe us feelin bad la baby taste addict sugar string every darlin strung compare ask fire wo mc thing cryin want always inside ever hit blatant feel sweet rush insideembed uh-huh dependency love mariah never leave harlem wait da night high another smooth adore day ta
Hooch ; Everything;Hooch by Everything.txt;thing even long levee hooch circle hoochyou simple near work bird dance real baby flow break grind moonlight body much clearer loose bee speak sweet road turn till sing tribal jam heavy night begin world fresh-e-freshy wind truth fire good day water ring vibe love
Hooked On A Feeling (Ooga-Chaka) ; Baby Talk UNCERTAIN;Hooked On A Feeling (Ooga-Chaka) by Baby Talk UNCERTAIN.txt;hook cup cure alright bug need master solo alone turn lyricsooga-chaka good thirsty victim tight stop hold trigon taste stay ooga-ooga candy girl inside word sweet sure deep ooga-chaka realize everything love version mind p believe high another keep feeling feelingyou arm wine
Horse & Carriage ; CamRon;Horse & Carriage by CamRon.txt;early right stuff court jacob shut stressin ice bet need trial big senorita pull name collins wife really topper manson buy yo put shot skate pressin little gat valet lex top world comb thompson drop good blast bitch diamond stop bloodshed quit pop deadin us bag sc ju sexy morn baby aight finessin behind almost cam mean shock hand hire hang underwear thong motherfucker heat foul nigga chair jimmy cameron leather head michael ask betha gun start havin mamacita find andre mason thing whip long girl minor redial readin phil uh rock horse hon ever hit car huddy hotel tonight bell please cash designer everywhere threaten jag gretzky reminder outside tint drive six troy stare show jones love recline preview uncle see-through puerto room kiss cat sex guess giles nothin judo sumo hey harlem foster untertainment party style boy night chancellor tipsy thou toughin bomb glass touch peedy ayo question rise carriage dress fuck rican child think shit
How Deep Is Your Love ; Dru Hill;How Deep Is Your Love by Dru Hill.txt;slug even teeth girlfriend alright gas bet maybe move brick freak aembed drawl turnpike tough turn hour buy yo shot funk duck tellin little comb top hide good hennessy low honey bitch us bike platinum doc dust baby pass damelo talk freaky way mean hand call morenito def nigga friend mi wiggle hear dia wo track bullshit ride around thing time rot creep want squad chick askin mama lose ven word car bear body rush mucho buenos mami dru deep stall goin tap dog papi house look extrano punk love warn pipe duro quick puerto chico double hill nokio bathroom hey papichulo da jam seem high another crew keep dr. te wetter man rican choose aqui
How Do I Live ; LeAnn Rimes;How Do I Live by LeAnn Rimes.txt;sky want hold sun life need lose kind ever baby real without live would leave please night world heart breathe away good soul arm everything survive love
How Do I Say Im Sorry ; Tami Davis;How Do I Say Im Sorry by Tami Davis.txt;early stuff staff pan instead stone coulsons whoa corner sound modern strike chase frustration international stir flashing security voice share stoic nearly ring sweetly dead near vision saw bedroom bed neck much straighter explosive lyricswe solider raise release nobody old grimace amazing along kneeling walk hallway provide jet photograph dock plan side swartz choice stops hotel los coulson draw oversee hole away mm-hmm kick stream shaky fast sky signature boom mission room wheres tear meant disappear life struggle female sort code thinking dollar town night attempt planning cashier undoes upright phone object choose airport protocol relaxes increase hook voila beyond extra pay result easy democratization ramp deny young protect thatll point center vial surprise last chinese wasnt cause stable pause chest vortex material upstairs anything aaron stop lab arrange simpler youll hacktivists continue shock suv joke left local free indication track reason grab screw extract cross door short focus terminal lift rush sure nod appear park radar austin lie tap wow performer hamper ventilation punk others subject seal commercial unhappy finish destroy toss guess introduce shoe hong hasnt minimize regale another play nothing sink collapse safe invade power response reveal stamp tuck combust opening probably badly follow remote total grin slightly lean movement pierce bob turn afraid buy put theyd excitement shirt s.h.i.e.l.d. good th react data cut flash youve almost syrinx b. torture chi note suspect reset main moderate help solve base ever headboard stage promise intentionally glove flip student assess noise end jail censorship treadmill danger idealist lifts infiltrate evil ground fighting ho important codename wont kind remedy avoid chance cafe surprisingly worried mr. syringe shirtless infant breathe hunting prove think mad truck index scream bet move warm break physically zombie game fright satellite satisfy erect hard prisoner pain scared barely flowered ahead limit vent holder lifelong men speak group rate unpleasant story horseback element fun holster first ex-rising privacy evidence -- matter rest either find translate cargo surprised quietly responsibility s.h.i.l.e.d large hell playing search stat .. hello stab burnt classified clothes sleeve/in two house knock vacuum million view huge ceiling water fill thumb super mess breath facility uncle prevent centipedes raina remain strengthen whats landscape back rat english egg air difference rania shouldnt rather stupid apartment naked ago examination hes genetics ashamed kwan beep wrist eye redact havent quickly doesnt wave wrap world top nods far guard exit hed bottom innocent check volatility feed trust harmless rare bad energy flow behind would mean entire brain extinguish fist stay st. shelf average want ridiculous gloating agent feel malnutrition shop institution suit minimal living sad thicker jar cooperate simmons title finger nice corporation l.a. mouth plant create mike beer youd recognizable algorithms excite table letter hurry sd case list theyll something shut someday give origin orphanage alone poster platelet tunnel strap jetta contact interest receiver episode catch gift camera streamer kiddie elevator grow ecological sigh dumbass heat probe similar red confused ill anonymous blue file exhale mat join incredible document sleep attention yins sit word hit belly year tech holsters since speaks empty approach stair fire-resistant known ruin revolutionary crazy confirm various decommissioned soon pigman division nasty match yep stabilize flower control nurture kwans alias dream gather recognize cool try slowly silver poor star tip throw bit pull card workout gear machinery fix icepack investigation little desk run hacker dig okay blast mirror god activity people way roof call chuckle defend head tool palm program hint method green wrong access mechanical pulling china murder sir become exhibit smile dolly body bell experiment weve bus ward corrupt erupt collision chamber everything aside couple lead s.h.i.e classify piece training double path captain never transfer gaze lay remove respond burned scissors obviously identify chip america bust heard sell damn rear harbor magician gas big apart fall teach active type homicidal regard paper trap disappointed bracelet radio pick scorched trouble nicely playfully tide visit shoulder fund pair skin drastic week professional spin closer gridlock hand manifesto hang stance chair disappoint onsite emotion argue hear conversation e.l.d override long s.h.i.e.l.d.s office step kid save listen morning sits drink honestly figure resurface arent building pediatrician soften pour darker switch sliver sly face information fantastic refer texas trace dark touch beat pilot right b hypertext flank live really crime freedom swing scramble board tense kong real mile ciphertext unit canister dont enters luck kitchen restraint though felt handcuff fight pouting toughs fan press inject girl doctor five upset s.o. past clothing without elbow bullet learn direction bite begin couldve loud parent close separate leak happen background log nuclear crack plane comfort resident electronic successful uncomfortable machine charge logo awe normal clapping rise belong housing pressure crowd bar powerful round idea wish news tai skye tourist nutrition stand pyrokinetic thats problem city attach wake line shake plug enter resistant clatter ball shelve hold work manning trick trait pant damage organization closing agnes purse great blood gun whirring fire usually chans around moment always whoo sharp shrug alcohol busy cytoskeleton toy deeper deep outside click thank lydon unless hoking runner look lower remember pleased kill street deserve liquid jab system despise often screen guy bring layer wait id surveillance shove clasp grows earpiece completely able many engulf glass taller small theyve aluminized man cyber grappling change risk space understand least downstairs flame force rapidly secret read whatever push kremlin isnt im toward centipede confusion courtyard hope shoot fireproof ability use emblem bright gasp travel endpoint east square encounter guys ha theres superhero indicate s.h.i.e.l.d within artistic light process win suddenly someone part womans working reader disconnect whoever vitals dish playful fit test team exterior directly blank louder circle agreement fancy mindcraft lose due still immediately shield wear assist intention explosion smirk ash love warn impressed open wouldnt lip leave ohh thanks depress peg foot upper floor insight must containment lock whole deal name folder trojan platitude owe send angel punch detail cost threw couch low lot handle front button us highly scorch hazmat manage invite sorry deposit couldnt talk involve lockdown brighter participation anger three friend wipe discover imagine truth start guilty effect load medical together text gridlock.mp uh tcp family correlate fee crash quite night-night compliment thigh assign audience scratch die picture donation six injury pip rainas giggle needle solution forward account smoke hey alien youre decision embarrass keep day meet laugh notice clock alive funny mumble discuss maybe battleship express sec woman coat credit snowden area hide picking comment insect maintenance informant boyfriend claim .s.h.i.e.l.d h.q pass waking principle strong theyre explain best ding worry rich enamor scrap illusion black whisper clean none whir cuff address commotion s.h.i assemble incinerate uncuff extremis readout action skyes mob kiss consequence already mind yin believe justify observe putin monitor four putter bend serum lying doorway intersection leaf downcast combustion mystery even technician miracle evaluate celebrate surface tabletop steve progress window consider glance record forget unbeastly didnt eco-research trail wire envelope chan scrubbed server impact expression improve idolize wheel block infected alarm drain appreciation impossible indicator snap ive vary inside second tranquilizer chew glow torch brightly please roll field could drive computer stare answer show else yet disease beeping steal violence different whos stunt bay miss reaction onto anyone magic nope seem target boat bra device may blow question pretty true arm disappointment sacrifice creepy outer occasion cantonese need finally c yes favorably beautiful violate well.embed duck rogers houdini sabotage performance shell famous impressive online map bag otherwise person today half every thankfully bank heart lame pinkie station sidewalk sight responsible although huh shaft glowing actually box metal beast everyone set money apology angeles course faster hearth fifth clutter unable unlocked clairvoyant tug towel hurt prepare parking digging resisting key unlawful peephole cell dirty tablet interested mainframe kidnap glare nearby research white neutralize drop secure study suite g. apologize fitz-simmons fitz however situation blare cant serious reach hadnt next crap ask receipt quiet soldier well-financed slide thing time burn somehow hack car counsel identical frame single van arrow lunchboxes place gut l.d petty fine fly nature scene language opposite understood knowledge smiling s.o enough grandfather basic relief shes watch wall whirr dress optional pump hair
How Do You Fall In Love ; Alabama;How Do You Fall In Love by Alabama.txt;fast time sometimes rest rain want find sun life need fall grant bad ever forever sow give never knowyou perfect seem high may seed spend snow season water low love
How Do You Sleep At Night ; Wade Hayes;How Do You Sleep At Night by Wade Hayes.txt;even break conscience eye lyricsi point alone turn loneliness cold x proud good clear tight trust hold sun light feelin week someone bed way call every heart truth rest around chorus sleep help side wonder hurtin promise .. lie morning close darkness room toss believe repeat leave awake thanks haunt night dream
Hows It Goin Down ; DMX UNCERTAIN;Hows It Goin Down by DMX UNCERTAIN.txt;heard doin happy translationsturkcefrancaisu curl naked glad secret marque realistic funny need gots grey act type give admit definition road audemars month send wave use typin mardi world ex game sponsor london ohhh forget bitch lot front playin check dm addiction mime vision cut real lolol elevator flow invite much people talk way group story every kitchen nigga though thinkin gras late start hear walk bein conversation history paragraph career either find around slide thing time girl responsibility together want always text alcohol lose kid immature livin still niggas without sure deep goin sayin could dot house close remember tickin solution mind finger different forever enough never correctin miss meal reaction wit mistake party back weed shitembed shade houston night toyin play pon dough runnin service pool spend tryna belong dmx band-aid day fuck think understand shit
Hows It Going To Be ; Third Eye Blind;Hows It Going To Be by Third Eye Blind.txt;oblivion fall anymore last hammock use swing anything care shouting salt skin taste thumbnail talk hows ignore fight find around soft time always sharp dive wonder hit sure scratch empty loud miss match back nothing doorway silence lightning spend pretty laugh
Husbands And Wives ; Brooks;Husbands And Wives by Brooks.txt;wive side pride inside life word waste lookin broken angry much people wife husband neither live number speak wivesyou forgive woman cause chief decline heart two nobody house lonely haste havin man belief
I Aint Havin That ; Heltah Skeltah;I Aint Havin That by Heltah Skeltah.txt;doin west clock upstate bout train b mfc live bitin quickly killin mazda x interview carryin proper ya pop dead calm macs bad grillin hilshire neck pass emerge mean string rappin goodbye baja fact old semi fort groundbreakin chorus cryin want plan side casa holidayembed french mystikal takin brownsville raw waitin doubt copper happen sex life crack nice physical bon wondah bastard mouth hot william four town night pack diiick magnum cuz willingly airport smell ta home list suckin eat shut siiiide round shakin coast eatin act give kris stand point ridin last ran tunnel macarana date shake hennessy jovi stop chain catch shorty hold doc lick toast sack heat clown joke duren bread wu-tang great new blue gun fire gas-pedal track around pistol pronounce dedicate bull dope door word hit atl fo torch year tire could outside click tale clip show punk street comin print shoe guy business wait wip dome crew mister trenchcoats blow fed horseman fuck man arm spot hi shit yamaha force teeth read cookin throw card c turn all-time orleans put gat lex dig run blast ha drama opera cock privilege aint light win feelin brings dick wooooo precinct people almost way superthug call hangin gettin foul nigga head tool miami smack coffee havin son strictly frown shhhh motherfuckin mash smile still snappin niggas flashin central kielbasa tryin blind upside-down class pow showdown listenin slice h. duke wop whistle warn hash ho u.s. hurt helicopter stabbin piece singin ah escape talkin poppa stewardess leave marshal wit school lay full pillow foot pocket starang lock think bust whole big somethin name human trap research yo owe send missin sha game pick drop rappaz willow low bitch front gold fuckin us techs spliff brag stitch talk hand three willam ruck jimmy first mi next ask hear aiyyo wo matter time long rock car .. write pound u two knock picture riff crib book plastique breath tic-tac smoke forever switch deuce foundation ass overdeuce back hat dough rat keep watch besta wall beat meet soul birdie
