title;artist;filename;lyrics
Say Good;e by Chris Brown;Say Goodbye by Chris Brown.txt;right swear minute need move apart break woah-woah really hope world chest hard lot trust us aight baby grow talk would way mean goodbye first felt head heart ask woah along start walk hear find thing time long girl best side door sit feel kinda park lie listen look crush separate figure remember everything kill love sometimes pretend finish guess ah never thousand dang hat cry tryna day try ta think understand
Say It Right ; Nelly Furtado;Say It Right by Nelly Furtado.txt;right something alive ah-ah-ah-ah fall brick break give stand really god light frk-frk-down mean hand three heyembed free either time holy plan lose feel fault body tonight set could hole place slip everything show love translationsportuguessay nothin hey mouth four sing lay night another nothing dark day space
Say OK ; Vanessa Hudgens;Say OK by Vanessa Hudgens.txt;right alright whatever bit ok shine pick good run okay stick hold lookin way speak call every shy friend wipe heart woah-oh-woah woah start callin find thing time want help spark still word feel sweet naive away close love fine oh-oh tear seein oh-oh-oh-oh boy treat keep breathe safe phone true prove try
See You Again ; Miley Cyrus;See You Again by Miley Cyrus.txt;right something read freak name eye last miley oh-whoa-whoa againembed feelin tame way speak call hang redeem reader friend next felt heart ask sight wrong rest time st-st-stuttered sign tomorrow best inside lesley feel set aim deep could look knowin crazy special mind life ready never wait night another keep connection breathe must think
Sensual Seduction ; Snoop Dogg;Sensual Seduction by Snoop Dogg.txt;right eat bar sexual exchange need big eruption whoa freak anytime eye dogg playa club little game peep bitch brown seduction ya shh us light cigarette week bad real lookin home havin seven time waist sleep redd long want chick mama mall ever hit lil slow doggy curve drift whisper rush sweet approach ear drink bust crib eruptionembed bitty love sensual blowin sheet smoke nice stroke outrageous miss da hip back face play keep floor wind beat dress day pretty bo shawty think hair
Settlin ; Sugarland;Settlin by Sugarland.txt;right even bar minute maybe throw shoot world good anything low streak highyou wide mean friend raise red fate heart new blue rest find around brand time girl together settlin settle feel tire less end could wine look living everything love fifteen open room mind life dance forever chance shoe enough leave high another mine mister try change
Sexy Lady ; Yung Berg;Sexy Lady by Yung Berg.txt;doin right damn coupe swear deal benihanas need big move lean throw young tunin bubblegum y.b really hour album berg cause mona shyea little good run reverand dyin telly dawg bitch spit diamond proper ya lab song shorty us buyin bag lick chi-town sexy baby grow lookin lady diva nigga katana three though thinkin shit new loafer feature lisa truth lyin vick vuitton girl yung want always chick rock kid oooh d-boy hit bos year write roll denyin provin park deep bite movin outside reefer look lady~ dude louis dinin love prada crazy onnnnnnnnn-ah-onnnnnnnnn-ah-onnnnnnnnn-ah-onnnnnnnnn fly ether uhh blunt blowin heel ah dance nice forever babygirl shoe instrumental bring l.a. hey wit getter back nope boy full straight another keep hoe micheal man divin ta bust treat
Sexy Movimiento ; Wisin;Sexy Movimiento by Wisin.txt;el combina nesty tocar decir eres cosa talento menta siempreembed ponte de pierde noto una herramientas chula dinamico victor su diosa caso estas tiempo antebrazo dame es pierdas ha movimiento wh eso oye ya llegaron viento prendete e frontua vestimenta rico acosa todo la sexy beso baby suelta momento pelo rosa necesario bebe alguna nasi define otra lideres mi goza nacimos por tienta representa pimienta perdido son que desearia venir en cartera sin vaso ella besito sabes acaba extraterrestres huele mano eh imitar quienes como cenicienta los hah marioso w guayaba mami nacieron sentir para entendiendo hace eh-eh con echa tra jamas ni cheerleader rato lo sepa verdad quisiera cuerpo nunca maquilla usa ellos duro brava mata un pensarlo tienes bailando hombre sirvienta estoy abrazo seguidores esclava sobreviviente nosotros mohosa duda tu yandel frega enseguida brutal desespero bella aruname rabiosa duo lava aja laso pero te paso musicales ey woh baba perfume se poderosa mirando
SexyBack ; Justin Timberlake;SexyBack by Justin Timberlake.txt;act lack slack yes turn vip babe pick good attack ha twerking slave sexy baby behind way motherfucker sexyback bridge fact around misbehave chorus thing whip burn girl uh smile feel fucker drink look uh-huh fast special ready bringin hip back boy shackle dirty watch child ta think
Shadow Of The Day ; Linkin Park;Shadow Of The Day by Linkin Park.txt;plead sometimes solution simple sun grey card translationsportuguesitalianoshadow way embrace turn set shadow window flower friend goodbye blind world stay away youyou day close beginning lock
Shadowplay ; The Killers;Shadowplay by The Killers.txt;crowd move corner act roads center oh-oh-oh cold window steel use city line group shadow truth find want motion search ocean without body end woo could hop stare everything death connect assassin room odour dance disbelief depth leave wait ohyou shadowplay four night play sink floor silence meet
Shawty ; Plies UNCERTAIN;Shawty by Plies UNCERTAIN.txt;even swear blake blaqnmild clap-clap al biggy clap-clap-clap need card jump trapmoneybenny really trap buy skate ex worth bitch ya wraith care jt pop option work drake bad lookembed real neck rap b-bring thaiportuguesespanolin weak nigga translation netflix champagne toppin new net-net-net earn block chillwhat girl trade want phasa always clap kissin ever still henny choice hit rid ayy feel black shoppin goin diggin two look kill beside love show deserve confirm d-down special photo d-d-down guess smoke code instagram never miss leave bring genius kiki ass yup back kb boy safe-safe many kiss-kissin safe jenny runnin feeling code-code spend fuck shawty try ta think shit
Shawty Is A 10 ; The-Dream;Shawty Is A 10 by The-Dream.txt;right hook lyricsshawty em flame truck ice fragance burberry tip maybe need butterfly ten tisha pricey name outta tea ahhhhhhhhhh fix rockin yo cause nece use radio little shirt pick good shell nicely hard honey jean tight ya tonya keke ahhhhhhhhhhh stiletto grow sugar would mean icy sh-sh-sh-sh kiesha tee tia goodbye thinkin ill stay lisa late ahhhhhhhh hear walk aaliyah dime find mercedes time girl food side mama rock hit ahhhhhhhhhhhh aye monique hello kinda sweet clean park hi-c could morning fabolous keisha kick feisty dior hug yeahembed love fine grit pancake destiny killa pisces guess prettiest nice shoe byturned miss match bring shoulda bacon back boy precisely night ahhhhhhhhh teresa egg sonya touch beat day hotter shawty jumpin spicy treat
Shes Everything ; Brad Paisley;Shes Everything by Brad Paisley.txt;meembed wallet right yellow sunday wish need someday ninety bubble warm monday holey cover bath movie cheap cause pray voice good run anything stealer chocolate jean mother brown song hold pair baby neck pass talk would church hand chair great loving land sunglass hear saturn conversation lover find around soft thing girl want cross sunroof candle rock ever saturday word fighter feel child kinda wooden wear could picture place look unborn everything answer cuss prayer love beside moody everyday kiss piece life shoe rocking miss lay knee shes town play nothing a-blowing tipsy glass giver feeling wine mad hair
Shes Like The Wind ; Lumidee;Shes Like The Wind by Lumidee.txt;right something damn fool need give young sound eye outta yes tree put cause league little far peep muffin anything mirror pain stop windembed sun sunshine boo insane baby stress plams moonlight pass tony would way sweaty luck hangin profound vaby thinkin next heart old hear wo rest sneakin around burn girl together always best ever rid feel body without please rush since wear crown u listen could look dude crush close doubt living everything impressed fulfill everybodys breath lead yea believe talkin ohh ease conceive style shes face night nothing dream toughin wind man try
Shortie Like Mine ; Bow Wow;Shortie Like Mine by Bow Wow.txt;hi-hat meembed right something wish need shortie give break eye jock anythin yes momma afraid homie buy woman put club hate reps beautiful hoping little hood bright world good run ha hard drama brown stop care price datin nah hold shorties real baby grow cut addict talk behind would way mean every gettin l-b nigga twirl skirt friend stay plus rhythm prize fella hear walk sight conversation size pimpin e-n-t find around wicked wassup gangsta thing chris girl snap want help uh inside lose smile bow patient search kitted ever playboy lil slow feel try roll dub woo could thank wow look uh-huh crib hop kick carin everything redrum love fine else street cute yeah-yeah mind finger mold nice winner never hey face homies haha straight another nothing play keep mine runnin tryna pretty day hotter shawty nuh-uh ta wild mad
Shoulda Let You Go ; Keyshia Cole Introducing Amina UNCERTAIN;Shoulda Let You Go by Keyshia Cole Introducing Amina UNCERTAIN.txt;rather right damn fool glad ago tone need move give advice alone last world zone hard low handle queen ya care hold tried real baby grow aight would coulda thinkin felt heart stay plus strong wrong around thing time long ever without undo keyshia respect learn deep lie could look everything yeahembed love life never hey business shoulda throne night play nothing darkchild keep cole regret phone tryna try think home understand
Show Me The Money ; Petey Pablo;Show Me The Money by Petey Pablo.txt;em clock deal dumpty need anyhow move somethin break give sound number really ridin yo put cheap cause x ok little world good shake bump song player shorty work athlete likethat creator bed patron lookin today way swallow def skirt nobody gun workin hear richter wicked swap thing shame want tomorrow sippin hell mama lose rock blouse ever twerkin still feel body fallin tonight dump money south lipo could dog jail breakin wow drink look tickin show love background breath couple life definitely slosh dance nothin ready switch silicon bring thick wit hot natural ought ass back high nothing floor keep scale beat spend botox man spendin change home
Show Me What You Got ; JAY-Z;Show Me What You Got by JAY-Z.txt;even fool swear force bout ow fall snowflake james give name young number opus aww spade turn homie month babe shot wave got wrap top zone drop good record okay bottle gentleman bitch front blaze h-o gold drummer dare shorty baby patron continue brave ace sorry talk roc-a-fella lady hand winter luck brain nigga ignore hov head truth king slur blazettes thing time shopping incredible alike long girl huh coldest stingy want engine together dynasty uh mama ballin word lil sip write justin assure clothes less peace learn mami hovi misery listen die two state uh-huh dude hype jordan show clone important emergency already summer whatcha purr h.o.v.a. guy hey determined hot throne back applaud night cork mike mine gim may pretty difference spot trip fuck try two-three shit
Show Stopper ; Danity Kane;Show Stopper by Danity Kane.txt;doin right coupe bet big somethin break ridin turn yo put creepin chevys divas white deadly cadillacs stopper stoppin top jonsin mirror color proper interstate us bad real baby taste lookin lady till jingle call kane three left seat sho fit head escalade danity plus blue late wheel chicas ride mercedes maserati vuitton thing candy time girl engine sittin coordinate lose smile car slow aye black sure shinin nod bucket clean beamers two tint look superstars poppin louis stare show open fly knockin breath range twenty-two chicks blowin purr jim shoe never bass hydraulics passenger four bentley stripe yup back key boy mink breeze high neon keep rainbow showstopper tryna spot lexus h hair
Shut Up And Drive ; Rihanna;Shut Up And Drive by Rihanna.txt;even whole shut wish lean sixty supersonic point ferrari fine-tuned explode shot hood top run driver handle lot stop light baby lookin sorry would mean three qualify start ride gangsta huh five engine sunroof step inside feel curve sure waitin class maybach drive look speed boom zero overdrive ready cadillac worried back key machine boy night smooth keep watch limousine think
Signal Fire ; Snow Patrol;Signal Fire by Snow Patrol.txt;right naked scream need fall sound confusion eye stand trap aftermath joy drag front stick hold root every guide signal felt fire wo fear forgiveness want cross spark past word without year perfect deep could away earth close fast speed foreveryou mind faint forever never leave wait thousand ounce nothing safety resolution arm
Smack That ; Akon;Smack That by Akon.txt;whole sore shady doll gal maybe big throw konvict give pull pal jump chase woman put creepin club little problem game attack putty-cat lot playin hittin thang song hold eminem manicure saw cut mile lookin behind way lady call hang shadow whee three bank lately rollin upfront fact plus smack wheel kitty-cat mack block possibly ho-in thing time dawnin creep girl gallardo want oh-oh-oh-oh-ohembed step drawer pole climb pedicure stage slow booty ayy feel lamborghini wardrobe flip money tryin throwin less translationsportuguessmack could away drink place look crib kick dull soon bu oh-oh-oh-oh-oh marvelous parking crack singin intact akon tae palace waste ready shall style back claw bend pack full another banger woodie floor watch pocket better slim bo think shit
Smile ; Lily Allen;Smile by Lily Allen.txt;wantin alone tunnel little mental stop light ahead feelin bad way mean call friend first next smileembed find girl want help door smile sit lose feel quite jack end whine could whenever la-la-la mess moan health unwell never leave back cry phone day fuck
Snow ((Hey Oh)) ; Red Hot Chili Peppers;Snow ((Hey Oh)) by Red Hot Chili Peppers.txt;amend need break conceal cover really alone road white little world nowhere run ring descend uh-uh decide friend channel hear sea track ride thing time undecided step inside sit wonder field less perfect deep listen privately known look snow kill love sky rely ho whoa-whoa life divide believe chance leave bring hey lay beneath sing back high play another better try sacrifice
So Small ; Carrie Underwood;So Small by Carrie Underwood.txt;whole shut easy big give alone flyin shine world problem climbin good mountain run okay hard sand ahead light wide swallow hand grain thinkin wrong matter thing time sittin inside lose rainy worry sure movin faith away searchin figure everything yeahembed else love fast open sometimes kind forever leave river back count seem day small change
Some People Change ; Montgomery Gentry;Some People Change by Montgomery Gentry.txt;right tone throw rebel give road hope hate narrow nowhere good yeller bone bottle judge mother grace god trust skin saw light bad brave people way till grain blood raise new old strong habit find brand feller second hit bear ta everyone could thank fill prayer kill love cried fast dad mind life chance odds leave thanks knee boy full hat glass rise man change think
Sorry Blame It On Me ; Akon;Sorry Blame It On Me by Akon.txt;sell rather even meembed shut wish big dealt aware anybody name young wife underage tour alone turn road hope put club verizon proud little occur world gwen problem good entertain pain apologize pop blame dead us grief bag bad manage disgrace grow sorry people would way speak thief hand call every fun though next felt fact stay stefani king start wrong hear son around reason fan thing time shame sleep girl responsibility long want always best add zen inside sit disrespect kid second family busy embarrassment tryin learn listen could blind away agree realize everything show -and-older love street fast yet dad life never leave daddy back affect night bliss neglect keep tryna singer day fed home understand treat
Sorry ; Buckcherry;Sorry by Buckcherry.txt;right round sound turn world hard lot blame sorryyou bad baby sorry way every old blue late thing time shame want inside single die sleepless away everything love tear kiss never miss back night cry day think
SOS ; Jonas Brothers;SOS by Jonas Brothers.txt;give texting line bottom getembed include bleed sorry situation half story call dinner friend next heart walk conversation find time plan five second miscommunication i.m end fyi empty two hug else crazy overrate guess believe broken never s.o.s awkward high glass true
Soulja Girl ; Soulja Boy Tellem;Soulja Girl by Soulja Boy Tellem.txt;right damn sunday someday da-da-dat-dat-da-da-da-dahhh-dahhh need fall corner monday eye pick dumb~ ya ball saw lookin lovely wipe callin walk i- fresh girl pickin everybody step mall smile spring yeahhhhh hit .. sprung huggin goin diggin wow dat-dat-da-da-da-dahhh-dahhh followin mom tickin love cute life talkin told hey soulja boy keep watch lovin phone dress ta wild
Stand ; Rascal Flatts;Stand by Rascal Flatts.txt;canyon alright fall push give break stand alone race shake helpless baby taste decide way hand every wipe strong holdin fight start hoo time candle lose hurricane feel frame end woo picture place look rip life piece enough broken novel yeahyou shove back knee bend keep edge small mad
Startin With Me ; Jake Owen;Startin With Me by Jake Owen.txt;case wish move christmas remind stand live foolish road last woman later little dumb swing sister lot tank guitar catch cigarette baby bed neck grandpa half would speak college call brother friend preacher raise head chalk old start wo dime hog around thing grandma folk best hell pride lose bow family still pawn die could jail gasoline look slip mom everything love job finger wring never startin lay back night pack high another bail beer dream sense day man change think
Stay ; Sugarland;Stay by Sugarland.txt;clock minute need beg give live oh-oh-oh put use tellin share lonely pain beggin baby bed much way call gettin next heart stay strong truth longer bein wo find thing time best sittin bear prayin year tire waitin tired starin million love oh-oh forever waste layin leave sleeve knee seem another keep mine wall man ohembed arm think home
Stealing Cinderella ; Chuck Wicks;Stealing Cinderella by Chuck Wicks.txt;least star secret big grin lean throw somethin give eye woman cinderella voice dancin good hard blame bike shoulder bed lookin behind would hand call cinderellayou bounce popsicle first ask shelf fight hear sprinkler -- son around time always sit rid quite dozen could picture towards look realize living room dad steal guess riding fellow leave wait prince charming pillow play slap runnin man arm
Still Will ; 50 Cent UNCERTAIN;Still Will by 50 Cent UNCERTAIN.txt;deal smarter gas spill mad move throw pull give fence chill really tough put claiming cause hate security decline ditch reef shityou city th good clear okay hard event bitch front buff grade fade real damage fam ima till brother gang every hollowsquad nigga whoever shit lame wo post false fang want murder still sip rid car niggas crash dash cash field end clean none since repent liquor class boosie flex kill bother scene dangerous finger smoke memphis miss coffin leave fleet split straight play quicker dragon silly spazz collect intent fuck man think
Stolen ; Dashboard Confessional;Stolen by Dashboard Confessional.txt;cloudy early gold sleep fade catch stake best glimmer steal sun hibernation heel week stretch pull replace goodnight spin crash soak eye feel celebration grand assure last ballroom weekend another invitation-only high heart liquor floor dream watch away good look clear season heartyou around farewell
Straight To The Bank ; 50 Cent;Straight To The Bank by 50 Cent.txt;case even law em pay tissue issue yayo need purple caprice throw n.y. sixty break eighty wife homie club hate wrap top maggot filthy banana blunts phillies ha bitch slave gold ya bleed fade shorty hold platinum work baby flow rap way bill motherfucker hundred three bank blood jimmy raise though war runaway new old blue fire soldier hear walk shih seven green fresh around gangsta vertebra whip salute crips mane want general door kid hit fo lift roll set feminine money bullet sure wear mill raw movin crip fifth faggot dre lambo rip swishers job street stashbox toll life pas kind lip mo futon gadget enough e-pass never bundle bring dashbox l.a. hugging school hot four dollar internationally back seventy boy fifty high straight breeze nothing dough keep outembed tzu day cool fuck government globe ta teflon laugh shit
Stranger ; Hilary Duff;Stranger by Hilary Duff.txt;crowd right secret stranger eye stand wrap hide anything scar queen blame work person baby much would way tooyou every nobody walk around time long plan ever wonder everyone perfect could away place look whenever show love room mind life kindness believe waste back cruel safe cry think treat
Streetcorner Symphony ; Rob Thomas;Streetcorner Symphony by Rob Thomas.txt;alright corner likewe world shine city good wake clear sister run tight color ya hold light sunshine taste sweetness people behind brother pity every streetcorner meaning wo find reason thing time moment somehow together ever feel perfect paint morning picture love fine street mind summer life different dance never leave symphony another lyricsit may day man try
Stronger ; Kanye West;Stronger by Kanye West.txt;heard right even damn dyke greatness overembed need act give n-now anybody harder anymore homie hour limelight put good apeshit anything hard lot front ya god catch lateness pastelle us blonde likey work ahead real baby moss much would kate secretary new hater strong ask longer wrong nuts vuitton moment time hast long isotoners plan hell uh wronger lose bow forsake ever bos tonight black presence sure since awesome could christian faster honor drink klondike trippin six louis apollonia dior everything kill show gospel kan never wait prince thousand night play translationsportuguesstronger th-that thou fake bape man fuck makin hurry o.j shit
Stuntin Like My Daddy ; Birdman;Stuntin Like My Daddy by Birdman.txt;company even stuff em yamaha pay whole eat lam coupe ice eleven-hundred need big brick throw name uptown young mercedes-benz ticket paper chromed-out trigger hustlas buy chunky put opponent hate shot white heavyweight little hood shine pyong zone caddy pick eleven-hun good gate ugh bitch niggasthe song thang fuckin dead stack us third g rare pinky saw pair work addict way bill locs cooking every kitchen hundred brain nigga motorcycle bounce though first red leather birdman bop-bop new start blade eleven-hundreds hairpin ride form around pistol grab brand gangsta caravan bossembed stuntin motherfucking want cross pussy ballin sit still plate grill holler bear ayy hunter birthday bos body cook spare cash flip money bullet pound park jacket monkey cake ward morning tint house stunna look chairman show fly pipe matching ho bentleys gram summer eleven crack believe chicken mailman hill grind never hot bentley daddy lay dollar throne back key boy thousand ounce rim hat high play egg hoe girlfriends power blow scale spend day man fuck must shawty ta think shit
Stupid Boy ; Keith Urban;Stupid Boy by Keith Urban.txt;meembed right even stupid alive push break fence yes hour precious beautiful voice run innocent god hold baby grow sorry hand every heart nobody old hear around thing long plan always lose ever choice feel please perfect could crush figure everything prayer love happen steal life guess different ah desperate never lay back knee boy flower high build dream wind soul wild think
Suddenly I See ; KT Tunstall;Suddenly I See by KT Tunstall.txt;silver meembed benefit big warm corner give eye white beautiful world calm hold map surround light suddenly much people mean hang every strong palm hear walk around girl tall hell tower word bear feel black could look fill remember everything magazine page captivate leave face power pool try
Suffocate ; J Holiday;Suffocate by J Holiday.txt;even fool need fall bracin eye outta watchin yes turn hope world ring shorty fiendin bed lookin much talk men suffocate hand call every though thinkin nobody time long girl want touchin somebody inside ever wonder feel without paramedic lie goin could away whenever love else mind finger lip grind never leave wait hip back night play breathe breatheembed phone fantasizin day man spendin try hurry hair
Summer Love ; Justin Timberlake UNCERTAIN;Summer Love by Justin Timberlake UNCERTAIN.txt;wish push grey alone last nearly hide loveembed september hard forget button bag bad way call goodbye first wo find time always best word promise feel write please could place look snow remember love sky summer believe lip pack nothing mine cry rewind try change
Sweetest Girl (Dollar Bill) ; Wyclef Jean;Sweetest Girl (Dollar Bill) by Wyclef Jean.txt;rather right pay shakin smarter whether move whatever whoa letter somethin peek corner live trigger wyclef woman triple club beautiful use world top sunny weezy drop good line run hard bottom scar low feed ball rain us work trick bad pastor real amaretto weather would bill part hand call every gettin joke bread new nobody ask loss wrong block pimpin track around washington time girl laundry sour leg lose rainy ever car slow feel takin tonight washin sweet cash respect money dub end whine cop wear drive bruise close rule everything gym kill crazy wu everyday guerilla mind steal finger hoop singin struggle life different hula akon strip grind never mr. school president lay dollar back high chapter hoe stayin dress day spendin child pressure think george
