title;artist;filename;lyrics
Id Just Love To Lay You Down ; Barrett Baber;Id Just Love To Lay You Down by Barrett Baber.txt;doin right jungle stupid among bout alive david simply sound pace eye really target- volcanic sniper doesnt thee mask world top far gown area hide judge dawg spit hunt proper army ya pop boyfriend dead stomach untamed vision stampede bad cap broomstick flow taste neck much dont would growl rappin choppin swoop brain dakota fully raise nobody michael slaughter fact old stay fight king sick rapper trunk want motherfucking backing sippin best side sprite upset everybody hurricane maniac l dagger feel dego black brotha bullet savagly choppa abandon tune north breakin milli potato hole away state kick close sector sad derange perimeter boom bother speed quick debate tear mind life tragedy p believe concern intensity pullin kickin return lotta hot thinking enemy dollar cloud sinner pack battle weep night quicker planning mike lava bomb runnin crater ta hurry home case something introduction eat conquer bar bicycle round crumble suck splash lyrical march bird atmosphere stretch braver give cover stand definition alone axe cause smother weapon acre buck puppet e-dubb city chest record bone forget shootin stop chain steppin catch givin vicodin beatin hold backflip leavin continue allow traitor sigh weak heat roster bury literal blood thinkin loving new dickin gun fire comparable tragic sperm retarded around rippin rapture grab reason holy snap always penetrate trash vary inevitable bake door inside sit sanity hit passively belly fo torch deed bleedin jackson please yaaaa field paint underground lie could actors nevertheless clip look earth darkness ahh rip remember kill punk street crazy cruise death comin finish guess mercenary ready disciple bring reaction wait shove rakin contemplate knee monologue straight another play nothing many dream cry stayin grave blow criminal label steadily errupting pretty gather fuck man makin try entity accept shit treat creepy wantin flame probably dumping suggest star chopper ne need whatever throw bit pull freighter im hyperventilate master c trigger turn afraid homie verse put demon duck ok jaws dipping little mil atr copperfield good yeahh run okay react famous construct theres survive yaaa hearse vital clappin dotter light funnel bag heaven person braniacs sleepin people half way clique part reminisce mic call pity every murderin gettin nigga defeat fit head test labour holdin rhythm irradicate sight mc murder tangle become actually box pussy lose sting syllable ever livin niggas promise body beast profess flip money maker satan killer crown interpretation reaper faster liquor corrupt tired baker alignment til await danger crush bruise imma poppin ash devil dboi redrum love open chopers ho prepare destiny lead piece double storm burning remedy chance pester intrical never coffin leave cerebellum snake darkside automatic breaker split school barrel lay concrete sicker full chapter mine fake must crucify prove posse mad think heard jigga em damn knife scream obvious ax wing move fall warm somethin anybody break name breathing chainsaw send tellin radio murderer insanity pick undefeated drop indeed hard wreck bitch machete handle finna karate pain victim churn playin stick competition casualites runway bleed acid furious barely satisfaction fuckin us skin sun scorch undaground creator inferno speak hacking till slash motherfucker hang dumpin anger flesh century thunder war dusty venom next smash hungry wickeder wrath hater ask titanic longer hear souljiah start wo scaring matter rest find bloodstain translate wicked pa time medicine burn creep mane verbal algorithim hell kid gauge amd family krucial rid counsel quite clamor save single sever paramedic pound ransom everywhere die critical picture honor recipe psycho place cater water crow fill melody fly scene laughin forehead chop mentalist forever ritual gain bruh culprit pavement bundle pitiful whats blessing alien back count boy face diseased tomato keep watch wall clutch dark beat day meet massacre trip
If I Could Fly ; One Direction;If I Could Fly by One Direction.txt;right even pay apart give eye hope guard lonely run hard forget scar pain defenceless half though onlyembed heart ask translationsportuguesif thing time always attention inside feel listen could everything show fly mind waste miss back completely mine think home
If Only ; Dove Cameron;If Only by Dove Cameron.txt;right something read maybe fall hour listening thought line run front someone brave decide way ah-oh every onlyembed heart head new walk wrong find translationsportuguesif sign step lose still word feel could million crazy happen meant never miss magic nothing keep dream
Ill Show You ; Justin Bieber;Ill Show You by Justin Bieber.txt;right even easy act human nonsense movie steel good hard forget real way part translationsespanolportuguesturkcefrancaisill woah matter thing want past feel everyone sure perfect learn show sometimes hurt life never watch lightning pressure
Im Comin Over ; Chris Young;Im Comin Over by Chris Young.txt;im break alone turn put tellin overyou thats light aint way every gettin cant closure goodbye red late fire around time girl want hell still save movin close love comin already miss back youre seem another runnin phone try think home
Im Not The Only One ; Sam Smith;Im Not The Only One by Sam Smith.txt;realise even wish need maybe oneembed month good us bad baby would way call every proof though heart lyin lord fear still translationsfrancaisim year denyin end deep unavailable sadly tearin doubt love crazy vow hurt tear believe enough many keep mine unobtainable think
Im The Plug ; Drake;Im The Plug by Drake.txt;swerve bron tag whole cup oakland curry minute wing big throw somethin give im wrist juan stand really put exotic printin drop suburban record bitch lot plug check franchise thang concord fuckin nah hold whoop-da-whoops encore urgent way call gang hundred nigga three drape red actin dashboard virgin time whip payment bull broad uh sit rock rid niggas ovo ayy curve body cash money designer jig ovation racist bitter away look slip merger everything skrrt sitting comin already drug steph summer blowin halloween p ready bring business purpose wait nike magic brrt back pink tab plugembed perkies keep may tryna day think immigration shit
Im To Blame ; Kip Moore;Im To Blame by Kip Moore.txt;right damn carve train read bet im break live point trigger road hate little line hard scar wreck theres ya blame aint light lyricsif much dont heart blue fire wrong pistol bloodline blameyou stain long girl hell spark sit crash sure aim loud drink love finger print lighter exactly smoke guy back play watch touch pocket change
Imagine ; Sawyer Fredericks UNCERTAIN;Imagine by Sawyer Fredericks UNCERTAIN.txt;possession sky join religion easy us hell life someday need heaven wonder brotherhood today people hunger oneembed live hope peace greed die nothing share world imagine may country man hard try kill dreamer
Immortals ; Fall Out Boy;Immortals by Fall Out Boy.txt;watcher flame immortalsembed pull im live behavior payoff cause guard bottom sand blackout wound fever bad half dont way hourglass suture future every cant eternal compare ill test theyre long best past still without could dog faith picture immortal sometimes curtain forever immorimmortals dream glass day try
In The Night ; The Weeknd;In The Night by The Weeknd.txt;rivet force minute young co-dependent alone woman cold dancin world city wake anything pain song baby crawlin bill weak call relieve deutsche commit understandembed hear wrong walk time girl religion translationsespanolportuguespolskithe always weeknd livin without fallin end woo unforgiving away capable no-no-no-no-no numb tear mind life dance never ohh hey ubersetzung sing dollar knee face night keep think understand
In Your Arms ; Nico;In Your Arms by Nico.txt;stumble fall move break live road world armsembed city run okay hard stop god pass journey reach time want five best still feel without end nine lie crawl remember fast sometimes oh-oh-oh-oh-oh superman unfair life success leave back create machine full foot nothing breathe dream choose arm try think
Infinity ; Mariah Carey;Infinity by Mariah Carey.txt;happy kilo reload ice amend ammo ne throw eternally act lack name outta tea truthfully cold owe thought thats truly game infinityembed comprends theres fritos exist hold grown aint bag bad story friend weight though actin felt heart head fact je free infinity corny false mat best lose door disrespect second pretense ever still without compliment end none could knock close answer show everything love wouldnt already life pas ah believe talkin leave business yup key boy play nothing dream sense phone tryna ta mad
Infinity ; One Direction;Infinity by One Direction.txt;something star wish fall move eye turn hour fix bright world shine far infinityembed okay stick translationsportuguesinfinity catch someone spin mile baby closer behind would way heart stay truth wheel infinity time burn somehow want motion everybody step ever still feel since lie faster two away unless earth million frozen hop breath hurt reverse never leave awake count night nothing many keep mine runnin tryna try
Institutionalized ; Kendrick Lamar;Institutionalized by Kendrick Lamar.txt;west something industry pay probably suckin milk walkin poor clock obvious mansion follow bet neighborhood big nervous loyal somethin remind artist wrist master truthfully stand admit definition presidential trap homie ruse bitin last intolerant quickly yo put cold white poison use mozey proud hypothesis little hood wash problem game award city okay bottle remainder chocolate lot divine diamond dizzle gold chain god spoil diem serviceembed visit compton fuckin givin foreign work lick politics la real flow landin dick lookin wozey much rap talk way streets swallow tv college call turkey ghetto daze nigga whoever thinkin confuse free rollies usually positive institutionalized king sick warnin lord salmonella stash around pistol time jet whip want rent side somebody box mama inside door jewelry kid per livin still rich translationsportuguesespanolenglishsvenskainstitutionalized niggas slow model grandmama quid hollywood money scholarship snatchin listen could wavin thank house pro alleviate flick mechanism bless lactose five-foot remember kill show chevy private hol quo steal life guess defense talented recession image bulletproof instagram goodnight never flashy president four-four constant lay style back passport boy sucker homies full high charge upon many keep zoom dream runnin glass floor watch kendrick meet co-worker harvest true fuck change think k shit
Iris ; Sawyer Fredericks UNCERTAIN;Iris by Sawyer Fredericks UNCERTAIN.txt;right alive give break later movie world sooner bleed heaven taste amembed truth iris fight moment somehow want ever feel tonight lie close everything tear life forever miss breathe touch think home understand
Irresistible ; Fall Out Boy;Irresistible by Fall Out Boy.txt;amor round follow letter bubble shark give name live inflation turn trap babyembed wave weapon truly drag trouble mood good bone okay ring honey catch wound us mon light unannounced la cut baby scent concealed behind talk way hand fixation war blood nail mi flaw truth free fight smile second still f-f-four feel frame settled end except tile score look love hurt burst eventually smoke lip enough leave ought seattle align battle moth nothing cheri many keep breathe mine wall irresistible service try
Jealous ; Nick Jonas;Jealous by Nick Jonas.txt;even right turnin wish aggressive bit protective music turn possessive obsess beautiful little chest ya sexy baby taste lookin invite way mean call gettin though red post hover girl want help everybody lose disrespect chin hellish still fault save puffin jealous love else crazy startin passive face excite think
Jersey ; Future;Jersey by Future.txt;comma represent extendo cup styrofoam nervous maintain young loose turn crime wave thirty rep thirsty benz bitch syrup change fold chain catch stack us hold feelin stress much clique way rate gang superior nigga serious first lame soldier purchase burn huh want rich sip niggas roll set money splurge married cop wearin goin marry two clip hop poppin fill jersey love crazy delirious couple account plane pour code purpose wait reppin banger gang-gang keep dirty spazz blow dress fuck makin fell smell ta birdie shit
Jet Black Heart ; 5 Seconds Of Summer;Jet Black Heart by 5 Seconds Of Summer.txt;even pen maybe dear apart move grey translationsportuguesitalianojet break midnight strike demon poison okay ignite forget fade catch us leavin wide way every war blood heart darkembed stay underneath holdin fire fight start reason moment jet everybody inside dive hurricane write black end could colour oh-oh burst life nothin chemical vein broken return match awake mistake keep dream dark rewind try
John Cougar John Deere John 316 ; Keith Urban;John Cougar John Deere John 316 by Keith Urban.txt;right eden levee fortune bar sunday star need tray rebel two-strike kris swinger live freedom shot baptize mississippi texaco far quarter rightembed california john run monroe jean lot queen guitar backseat boulevard mark whiskey grow wide way tv dinner teenage prom great spinning kristofferson old pepsi blue along wheel cola long quarterback mama kid rock mclean still save year roll victrola garden learn sayin morning hemingway cougar gibson look twain jukebox wayne figure everything chevy love open marilyn superman singin believe broken never hey wait daddy another neon dream tryna spend deere soul child mm home
Jugg ; Fetty Wap;Jugg by Fetty Wap.txt;sell doin meembed stove wish eatin move throw whoa teach scrub pull club cause use hood bottle loyalty section plug zoowap fuckin us baby would way nigga blood rollin hella zoogang shout around whip girl bull monty stripper hit zoovie ayy roll finesse throwin dub woo could squaaaa squaaa everything show love couple drug ah wood fifty full jugg tryna fuck bust
Jump Out The Face ; Meek Mill;Jump Out The Face by Meek Mill.txt;case right truck yellow star chopper woahembed deck purple dip fall move pull wrist jump young mixin tastin watchin trap buy shoot put club white cause shot hood dancin peep eighth drop hard dawg ha playin diamond proper wraith ya rack pop stack phantom duckin light cut margiela freaky goddess choosy margielas perc nigga jimmy though seat new tool sellin approve stay thirty-two fire fresh shooter thing giuseppes choos level meek together indictment dope everybody inside lose rock suicidal worry still lil hit niggas ayy cook freebandz money vvs molly none woo cake mill sayin could mula peepin knock chunk state cape look ceiling hop louis jordan rule devil skrrt fly vv ho bentleys kobe goon bryant boolin ah pour strip shoe gucci loubs school frrap flawless face blatt high straight another keep safe watch bape feeling pool spend cool fuck cuba shawty space k shit
Jumpman ; Drake;Jumpman by Drake.txt;heard fry something introduction cup chopper need wing big throw somethin give monday dopeman young jump live buy shoot club valet date lobster city production bitch ginobili ya chain trust rack nobu phantom tnt collection week la expect chi-town baby trappin much celine way hand call metro boys dinner gettin hundred three left michael star-studded stay team woah country chanel hobby find translationsfrancaisportuguesjumpman flood jet join sleep girl diss codeine text french uh hit car cousin bunch money cop woo fadeaway taliban direction goin two n wow counter usher searchin jordan answer private fast spur comin adderall flexin finger jumpman ah halloween dance chicken mustard memphis mutombo never robitussin miss reject wait bluffin bentley magic boomin back count night another nothing many hoe dj safe keep dirty floor question spend tryna tempo fuck must tweakin wild think
Just Gettin Started ; Jason Aldean;Just Gettin Started by Jason Aldean.txt;even whole minute warm warning midnight turn road window little radio pick lot barely light mile baby taste moonlight talk way gettin friend red seat blue start ride find thing time burn girl lose rubber feel tonight nine could tonightyou two drink drive look slip six love crazy kiss already life tore shoe halfway enough leave lay party back town pack ta wild
Keep Your Money ; Empire Cast;Keep Your Money by Empire Cast.txt;even pay need throw somethin give anymore world quarter worth good m-m-money hard stop fold leavin work chooser lookin bill hungry ask dime hand- time long huh want everybody ever still nickel save money goin listen handout beggar kill guess waste lay dollar face play keep ah-uh-huh man temporary ta
Kick The Dust Up ; Luke Bryan;Kick The Dust Up by Luke Bryan.txt;cup bar glad follow z diesel really music turn road last beautiful boot thats clear line neath farmin upembed song pedal sun light aint dust week pile baby grow flash backin people dont tractor way downtown cornfield nobody bridge theyre eight around long girl packed step door inside money park waitin two ear knock drink kick fill jar tear cadillac whats four dollar party back town plow high full lane lap watch floorboard makin burnin
King Kunta ; Kendrick Lamar;King Kunta by Kendrick Lamar.txt;rather even something court whole probably swear bar walkin need pryor give yes momma three-sixty-five shoot put richard funk share little hood world pick game city honest clinton bone run dig identity buildin okay bottom brown-nose judge bitch bunk translationsespanolitalianoportuguesenglishturkceromanasvenskaenglishking gold happenin baller compton pop within boo cut baby ghostwriter nappy-headed behind would fat bill motherfucker annie rappin gettin nigga friend bounce conflict monkey-mouth next loss aw king hear time rapper want motherfuckin help sittin leg everybody manipulate suicidal limo past plate stage kunta mayor twenty-four-seven ayy belly influencekembed goat-mouth desire bum beast black k-dot elementary jail two tint gunshot million water remember two-man kill street happen mammyfucker twenty couple life twenty-five peasant woo-woo contemplatin bring leave screamin misuse shall enemy throne back prince straight cell flag stuck power vagina yam question day man fuck true smell ta mad shit
Kings Never Die ; Eminem;Kings Never Die by Eminem.txt;summon silverscreen dieembed maybe headstrong eye trumpet anymore road riddick killin top ode award legacy critic spit ya stomach metaphor neck pass much would common mean growl detractor nobody stay shout king upstage rapper want tomorrow pure kings bow liar wonder mistakin howl feel lucifer shakur loud gilbert away close doubt sky summit page champion life crack preach prolong hot throne twitter jam sound-bombing cloud age town forever-and-a-day runnin fury tryna choose ta dreamer even something outsidaz act give blow-out stand alone ridin center deacon cause shot khalil mountain pent-up stop diamond flippin peanut dutch hold leavin work grow cynic thinkin seat new plus accolade fire homage flyer block track around moment blink sleep complain dope door sit thirstin word cerebral appear underground deep consideration drive earth show kill crazy berserk conform oven comin toss kindness bark renegade nothin hunger odds onto anyone accomplishment blow fuck makin arm true try change shit milk sob whatever im master cage duck good whereabouts dig god drummer online stack aint win feelin appeal miraculous someone token sport today people way call plaque sway fulfillin head trophy wrong son out-rhymin motherfuckin actually lose syllable ever still stage moron obstacle everyone respect comeback countin end crown den evil ground drivin composure arena weakness never ensure leave genius floor farina obliterate think thorns fillin swear bet wing move fall artist somethin theme break rage choir passionate throbbin owe burger game attack secure hard bitch lot gold fuckin meanness jay launch swallow story hand shotgun bow-out underdog reach next sellin feature ask hear undisputed love-hate quitter wo matter find time somehow plummet office sin hell powder step gauge grill jack collarbone hallucinogen die critical knock arenas pot fly pout smoke rocky back count opinion youre keep poem wall air beat day retire soul passage laugh
Kiss You In The Morning ; Michael Ray;Kiss You In The Morning by Michael Ray.txt;right even tattoo butterfly im eye x race little drop hide mood line run low jean tight lot fade e aint light baby moonlight hang morningyou toe red heart hear outlaw girl glow curve feel set funky morning drink place everything show else crazy tan kiss parking steal dance back youre neon tipsy floor touch beat pretty
Know Yourself ; Drake;Know Yourself by Drake.txt;swerve woes.kembed yellow woe turnin suck big bugatti kanye name eye neither live hatchback ferrari turn road woman rockin international put de shot pray dis technomarine top rep bling drop city hashtags run yuh shell declare jean otha execute ethan holiday shakiness chubby real flow sleepin bomboclat way nigga three serious expose polos girbaud niko head sellin stay truth gun fort woah ride find jus thing time whip girl diss want always mash winnie jewelry youth irrational haffi ovo bos tj money apology countin jibba two warrior oliver look poppin boi-da shaky book fine street deserve job happen soon unruly johnny cute hol york hurt backpack reign guess life chromatic p translationsturkceespanolportuguesenglishknow forever finer talkin subaru nasty mada dun purpose passenger nuh yute back boy machine patch runnin fake pushin baka man spot fuck think shit
L$D ; A$AP Rocky;L$D by A$AP Rocky.txt;doin right translationsespanolturkcel tongue stranger duh really ridin hippy cold cause gimmick world shine duh-duh quarter city low song acid fuckin hold light feelin trippy baby weather way dreamin rappin gettin fit lsdembed stay loss start lord long girl want dope word leap feel hollywood clothes bumpin faith drink drive place look doubt figure love fly sometimes system drug sex life introduce lsd never mistake sharin party face night high another dream feeling pretty day crave makin think home
LALOVE (la la) ; Fergie;LALOVE (la la) by Fergie.txt;l.a.love west damn represent whole paulo puente minute coast need france christmas whatever diego jump ibiza ticket yes chronic legalize window cadillacs world east slum germany california city london run venice stockholm visit net stack us rico sun moscow limit jamaica la cac-ill-ac people way india till plaque every kingston cali chi new san socal miami kansas vega rio country sao effect track around jet whatchu join burn girl atlanta exquisite side uh phat quebec grill hit slow brooklyn feel puff amsterdam russia roll hollywood south ferg north frisco state everything brazil book love mexico ho puerto york finger switzerland smoke paris mustard hacienda tokyo bring l.a. business itembed lay manila back town straight espana texas beat pump globe think shit
Lay It All On Me ; Rudimental;Lay It All On Me by Rudimental.txt;meembed need anytime alone babe scar uncertainty shoulder baby friend heart free door look remember show love hurt wont believe escape never leave lay key nothing keep lock
Lay Me Down ; Sam Smith;Lay Me Down by Sam Smith.txt;right translationsfrancaislay star deny yes hard overwhelming care skin much way story call reach next strong hear explain want side inside word without tonight sure begin emptiness hole moon crazy hurt tear believe miss lay seem nothing cry dark touch feeling day
Lean On ; Major Lazer;Lean On by Major Lazer.txt;ago need lean warm young standin road wave innocent care bold hold someone would old strong gun fire sidewalk walk around long side somebody a-a-all recall roll remember lazer oh-oh kiss translationsportuguesfrancaislean hey major night longing wind blow home
Legend ; Drake;Legend by Drake.txt;right stone star minute teach pull young oneembed live tour strugglin sentimental owe use translationsespanollegend city good hard shootin god spanish map work much people way nigga first actin new strong late wrong wassup holy long girl pussy word car niggas feel write set money backtrack south clean learn die north house g-o-d everyday pretend life different dance andale honda back pack texas watch legend mothafuckin fuck change shit
Let Me See Ya Girl ; Cole Swindell;Let Me See Ya Girl by Cole Swindell.txt;crowd truck whole alright bet move whoa road club little shine world ditch good shake ya us spin bed baby moonlight wide hand every friend cotton nobody aw country ride tailgate around time girl best side oooh rock save sure tennessee park hop kick else tear whatcha dance chance guy leave bring wait hip back girlembed night beer floor mine wind beat edge think spill
Levels ; Nick Jonas;Levels by Nick Jonas.txt;right law deal give im rooftop aww later drop rising bottle stop us heaven elevator baby up-up-up much supernatural heat every cant high-fiving reach discover jesus walk time level door climb lift please roll could ceiling ground love drug dance enough hey high floor keep wall lightning touch tryna
Life Is Worth Living ; Justin Bieber;Life Is Worth Living by Justin Bieber.txt;hazard even truck scream read gas ice think miracle sent pull give deny live thin last put cold cause send pray midst angel world quarter worth good line run blast judge tank grace stick god againembed us hold map light ahead work people slope april would way mean journey reflection meaning heart relationship strong avalanche blizzard wo skating time long forgiveness help somebody ski ever holler slow feel perfect end perception direction place treadmill translationsespanollife hop doubt living figure crossroad show love comin tear couple life reputation enough mistake dollar another may day difference crucify try salvage
