title;artist;filename;lyrics
(Theres No Place Like) Home For The Holidays (1959) ; Perry Como UNCERTAIN;(Theres No Place Like) Home For The Holidays (1959) by Perry Como UNCERTAIN.txt;franklin billie ives martin lou wish noel christmas warm trio midnight live tree alone ellington rockin orleans white daigleembed orchestra little trotter world fontane leona darlene jolly john sister clear merry gene lot drummer song rawls commander tomlin remastered holiday ken collection light vocal perry carter carol daigles ayres jingle aretha crosby lauren armstrong first flack new michael lewis king guaraldi sinatra hear williams frank around time holy chris marshmallow welcome herald nat ella rock roberta christmastime andy como bethlehem bell single lee holly could begin vince caroling waltz place look snow louis duke bing love version reindeer angels everyday burl daigle dean scott darby hark tyler benny autry sing boy town red-nosed night fitzgerald brenda upon keep cole jenny rudolph carpenter singer day rice santa child claus home
1 2 Many ; Luke Combs;1 2 Many by Luke Combs.txt;right karaoke clock round ice doll young loose alone turn buy shoot thereembed put cold countdown shot buddy little stoppin thats hankerin quarter tonk bottom stop quit song catch us feelin baby half wide hand call shotgun first stay country -- wo thing time long want five hell plenty past still miller hit wink sayin could tune drink tl six ronnie open honky luke diet whatcha singin kind never hey night many beer tipsy bomb cowboy pretty rowdy man tick-tock
10000 Hours ; Dan  Shay;10000 Hours by Dan  Shay.txt;cure ten name eye road hour good song rain curiosity bad grow dreamin friend heart middle rest grandma want smile sweet learn favorite translationsturkceespanolpolski youyou close everything love life dance forever never miss party thousand drunk ooh-ooh spend try ta think
15 ; 21 Savage UNCERTAIN;15 by 21 Savage UNCERTAIN.txt;swerve woes.kembed yellow woe turnin suck big bugatti kanye name eye neither live hatchback ferrari turn road woman rockin international put de shot pray dis technomarine top rep bling drop city hashtags run yuh shell declare jean otha execute ethan holiday shakiness chubby real flow sleepin bomboclat way nigga three serious expose polos girbaud niko head sellin stay truth gun fort woah ride find jus thing time whip girl diss want always mash winnie jewelry youth irrational haffi ovo bos tj money apology countin jibba two warrior oliver look poppin boi-da shaky book fine street deserve job happen soon unruly johnny cute hol york hurt backpack reign guess life chromatic p translationsturkceespanolportuguesenglishknow forever finer talkin subaru nasty mada dun purpose passenger nuh yute back boy machine patch runnin fake pushin baka man spot fuck think shit
223s ; YNW Melly UNCERTAIN;223s by YNW Melly UNCERTAIN.txt;comma industry whole b bet big lackin push pull graow rearrange k whack really trap buy mhm detrimental use strap see-e-e-through worth mac rocco forget bitch lot degree skunk check stop stick apostrophe catch bleed blatts fuckin hold map two-glocks macs cap baby invite facelift talk glokk mean colder hand gang suwoop rappin hundred nigga blood actin twin dicky heart coincidental gun flaggin hear walk find glocks bloodline sleep baow huh roger want five clap uh dope hit niggas ayy body hah stankembed trey click crip mmh two two-fifty clip uh-huh google froze kill punk crazy brackin comin yah p ar cappin instrumental slatt never leave hot hip back blatt face play foot treat floor breathe mister g-nine trace pushin tryna recordin man ta shit
247 ; Meek Mill MISSING;247 by Meek Mill MISSING.txt;exist song meek seem mill miss
3 Headed Snake ; Gunna;3 Headed Snake by Gunna.txt;right lam whoa number pace really music perfectly cold porsche wave co-d world top sponsor dawg broke rain e brink bad bait real stock mean gang sock plastic rappin hundred brain fist stay old late tribe jet want rich thugger aim shape besides tint state uh-huh reinstate page debate brake kiss sex dance givenchy bae thot zoom shank rise ta case bar cover slime cleanse realer hate translationsportuguesturkce date city gate band benz stop diamond guitar wraith catch lake aimin lick brother revenge bury twat art new free block around inside hit stalkin tire bent cake could sensei look show soon pretend unloyal curtain three-headed guy miss bring measles enhance yacht straight play another many safe grave blow fuck man spot space shit gator dyke teeth royce follow need pull cage dodge wet hope buy shoot put planet use mil good run jeepers feelin chubby dick today way part constantly jaw every nigga bank fit head heart land havin ysl huh murder lose stage lil niggas cousin cash end cop j assist dot mmh drivin vibe love gunna ho pas necklace ah talkin mop drip never leave snake school key mine arcade pocket spend swiggity-swap lock mad fillin whole gas paperwork bet teach sixty shark nut send game sprint bitch playin gold wheezy rack fuckin us nah sendin hand friend ape glist wo barclays dunk time rot creep uh mama kid rock plenty ate family plate birthday ross flowin die listen ak two knock drink place hug book creeper spy slimy gucci hey back face patek keep dark dress
365 ; Zedd;365 by Zedd.txt;need fall monday give tuesday hope send fling wake hold aint week baby every cant next fantasize middle stay translationsespanol -- thing time sleep want slow feel year initial deep weekend love already mind ready never heartbeat leave anyone premonition back night day change lock think
6 Kiss ; Trippie Redd;6 Kiss by Trippie Redd.txt;right cup eat fin instead funny solid suck follow whatever pull give northside trippie sound k wife live oh-oh-oh nut buy potter put killin cold white triple virgin-ass thirty prime run cuban bottomless couch scar bitch mud purge diamond gold chain catch us nah opps reality real baby dick optimus behind swallow hand gang hundred bah nigga summertime red stay blue gun la-la-la-la link walk wo find codeine redd want murder pussy uh hell inside everybody kid ooh-ooh-ooh past slippin lil megamind ayy promise feel takin fallin dumb-ass bleedin chandelier money fucking bullet vvs shinin throwin piss woo chillin freaky-deaky siren harry bite house ear flick look uh-huh burtains six close living love pourin kiss disappear finger life jeweler hollow talkin freezin slatt never miss coffin mouth wit translationsenglish pit four slut twitter bae boy certain coraline flag hoe fuck la-la-la-layou shawty mad shit
7 Rings ; Ariana Grande;7 Rings by Ariana Grande.txt;rather tattoo pay loop gee tone tie big flossy red-bottoms bubble breakfast card budget wrist number watchin therapy turn buy shoot put shine problem trouble bottle settin store ring bitch check diamond stop spoil gloss addiction price rack stack nah net skin bag bad brag baby neck lookin deposit mrs. way happiness mean call lash string friend gleamin retail whoever shit new receipt wrong tiffany loot translationsturkceespanolromanaportuguespolskiitalianohebrewdeutschfrancaisnederlandsdansk thing jet girl want beamin solve smile rich atm write black set respect money wear booth closet favorite look crib six sad savage mind juice enough never match business thanks sing woulda yep machine back nothing gim phone must think hair
8 ; Billie Eilish;8 by Billie Eilish.txt;even minute badly really missin hmm good anything gladly chain care neck lookin sorry would thinkin heart commit around best da-da-da-da-da-da overdo feel please wear listen could sadly translationsturkcesvenskaespanolromanaportuguespolskiitalianodeutschfrancaisnederlandsdansk da-da-da-da-da-da-da love see-through finish guess never leave wait think treat
A Boy Is A Gun ; Tyler The Creator;A Boy Is A Gun by Tyler The Creator.txt;right whole think big bit breakfast give hoodie turn shoot wheelies little travel ex hide okay dawg degree depend hittin god fuckin us near bag bad parka baby neck sugar invite mere call nigga cab friend first next translationspolskiportuguespolskia lame stay gun start sick around time passive-aggressive want squad motherfuckin best side sensies fakin takin ginza hello year sweet respect spidey patiently waitin could favorite away look six irony show diabetic else speed garcon mind dangerous repeat talkin bringin leave wait anyone comme boy face brushin keep safe better fencies cool fuck mad home
A Holly Jolly Christmas ; Burl Ives;A Holly Jolly Christmas by Burl Ives.txt;street time case cup ho ding-dong-dingembed best somebody kiss christmas ahhh ding-dong-ding hello year golly everyone wait friends cheer ding-dong-ding-dong holly hung jolly snow meet walk hear mistletoe ahh
A Lot ; 21 Savage;A Lot by 21 Savage.txt;rather right even pay pan alive cup tangent flectin solid outcome big tekashi whoa aware bit give break im lack really point music turn shoot album put cold marathon shot pray comparison got ship little hmm cementin world top problem buck sunny worth br-embed record okay anything dawg lot mirror stop stick studio wondering fuckin dead us g nah aint jot bragging much people ima rap behind cream way would speak brother gang call revenge every vs. rappin nigga friend though great heart new ill stay six-hour flop ride lord around reason fan thing time statement routine rapper rot cheat bat lawyer want plan side stand-up everybody inside lose kid headphone cot rich six-and-a-half hit niggas l beast save markelle write everyone penitentiary money end lie die could abandon drove jail two picture drive thots million translationsturkceespanolportuguesa hop bless doubt stream snitch everything show love else street book open breath mission meme savage special couple seein life boasting guess storm ah smoke dennis jr. chance success switch never leave back machine thousand seem straight play cell many promotion smith cry cole fake beat question day meet fuck spot true think home shit
A Thousand Bad Times ; Post Malone;A Thousand Bad Times by Post Malone.txt;law damn pay attraction star need whatever whoa give break really nederlandse translationsturkceitalianopost world far game cost anything hard bitch lot malone price prolly bad baby would tv every collapsin ignore heart truth ride false practice time burn sleep girl want always mama still car without armor waitin thank house place despite thicker kill crazy throat life back thousand face night another vertaling foot grave spend meet fuck choose ohembed try shit
Act Up ; City Girls;Act Up by City Girls.txt;right truck suckin eat deal um ow turnin bet need big ba-badass act give freak number bubblegum paper classy buy rockin dancer hood fake-ass realest date buck drop city good sister run manner ha hard bitch tired-ass tom tight curious broke lifesaver gold chain ya care jt rack snicker furious pop fuckin givin us hold nah platinum snatch bag bad snake-ass real baby taste lookin sack group weak call brother random gettin nigga earl serious fun nail actin new fact ask miami track around breast brand time hammer girl yung average five scammer add cancer clap pussy hell sit worry ever rich lil dash without tigger sweet money clothes attitude upembed goin liquor loud picture look birkin fightin ford six rover drinkin figure answer fast quick page delirious glock couple talkin shoe gucci never period match cabbage daddy stripe yup ass back haha pink butt hoe keep dirty watch fake beat phone tryna fuck spendin scammin hair
Adicto ; Tainy Anuel AA;Adicto by Tainy Anuel AA.txt;varios el corriendo vino hasta noche vo parar soy reye eh-eh-eh visto puedo vestido han muerte otro viendo vuelvo veo dile solo infiel oh-oh-oh quiero iba de quiere yo llamando amanecer piel esquivarte anuel tiempo estas aunque romper es ozuna contigo vicio ya sigue e caer le puesto translationsenglishadicto la veces instinto puede real baby castigar bien vas algo bebe ese nada soledad usuario comerte bebecita divino prometi mi pasado billboard seguir mal darte -vidarte este despues por dia dime olvidar son borrar negar cuando que hago pa aparece-er conmigo en woh-oh si fueron amigo desvisto dejo llama adicto casa ti mama hicimo olvidarte bebe-bebecita eh temprano necesito las hiciste rica nuevo oiste enfermo siempre quiera ere los desaparecer mera hace-e-er memoria mami cada tal ganas valentino hace eh-eh con brr dios lambo dan uah somos lo extranando sabe tre un oh-oh consumiendo ahi explicarte embrujo copa entender estoy oah vez aparece-e-er va mintiendo tu vamos quieres tainy hay aquella party hacer pero te dificil contestale pegamo se par trato
Adore You ; Harry Styles;Adore You by Harry Styles.txt;ah-ah-ah thing sky ice mind strawberry lose inside summer skin believe ever wonder lemon eye would doembed nothing brown paradise lately rainbow mine state fire lipstick translationsturkceespanolportuguespolskiadore adore walk honey love
Afterglow ; Taylor Swift;Afterglow by Taylor Swift.txt;chemistry afterglow something even need break live italiana put thought worth attack low theres didnt blame us light pin sorry much traduzione behind dont mean hand head heart blue fight walk reason thing burn proportion want box punish lose still fault lift glove ultraviolet siren morning jail away fighting love fine hurt mind hey back face afterglowembed excruciating island mine silence cry translationsespanolportuguespolskitaylor blow meet swift true
All Dat ; Moneybagg Yo;All Dat by Moneybagg Yo.txt;case doin right panty suckin eat shakin turnin ice mansion bet big dat freak type pull card wet possessive nut put thee window tellin world hide good ugh bitch tight mirror degree innocent chain catch hold flight light bag jelly beggin sexy bed baby pant dick lookin cream wishy-washy mean sprinter swallow gettin hundred nigga bread though glo diddy hearin old smack woah fire sight bop whip girl baow huh want best winnie pussy kid chin still lil niggas belly ayy feel please clean deep goin cake bladder titty drive look fightin water love open throat towel couple already stallion spread ah conceited smoke dance batter talkin g.o.a.t never leave denaro hey mouth fiji hot four daddy rim grip public juvenile boat bagg hoe mine runnin touch pretty fuck shawty child trip wild soul mad bust shit
All Day Long ; Chance The Rapper;All Day Long by Chance The Rapper.txt;clock minute grassless igh need big route news patio b-bombastic jump tour ticket quickly use share little world thankful drop good magneto dame blast pleasin sylvia playin stop god kong song acid pop us eminem invent blonde bag feelin broom baby stock scent lookin today mrs. would way tao mazel heat gettin nigga cologne diddy next darlin actin champagne old ask prize shout along boppin eight lebron wo block fan blink burn long want side leg everybody kid sit rock livin short still pippi hit grateful scenic cocktail dash black everyone midget classic peace end clean since could begin click two house favorite hole mom dimmadome show book mild soon longembed dimmsdale loan strongly cat lawn life marli dance miss hey daddy yup back knee boy dustpan play keep mine glass bomb sony tov pocket question day advance rhone backyard ta lock na-na-na
All I Want For Christmas Is You ; Mariah Carey;All I Want For Christmas Is You by Mariah Carey.txt;happy even list right wish need christmas sound translationsespanolturkcedeutschfrancaisall stand really tree send present shin ring tight lot care nick hold light baby laughter stock much hang fireplace stay underneath ask hear wo thing want door ever pole tonight bell brightly everyone please toy everywhere could outside click north snow fill reindeer ah bring wait awake magic sing upon keep air day mistletoe santa true saint claus sleigh
All My Friends ; 21 Savage;All My Friends by 21 Savage.txt;doin even truck coupe pay bar star fame funny mansion garage greedy need big vvss act pull bummy jump really alone buy yo hockey skate ghost mask chasin shine pick paparazzo band bottom hard bitch benz playin diamond sonic stick guitar god army trust givin fuckin phantom wristband light real stress dick bill icy hand friend though heyembed new nobody stay truth around handstand press time always tooth stand-up everybody lose plenty mama ever niggas car prayin spare cash money friends countin somewhere cop since lie could dog fightin nowadays six lendin crocodile lambo remember job fast puck couple dance diamonds never leave hey peso bentley dollar dundee guap straight watch fake dark blow tryna backstage rise translationsturkceespanolall spendin man true mad
All The Good Girls Go To Hell ; Billie Eilish;All The Good Girls Go To Hell by Billie Eilish.txt;even picket cave fool need beg fence cover stand turn crime owe vacation poison lonely california good gate anything ya god heaven invite invitation snowflakeembed friend ignore commit team evidence start sight walk time burn girl want help hell inside pearly lucifer without save traditionalall wearin greenery wow look animal water devil kill warn open fetter peter hill leave enemy haha nothing rise man translationssvenskaespanolromanaportuguespolskiitalianodeutschfrancaisnederlandsdanskchinese
All To Myself ; Dan  Shay;All To Myself by Dan  Shay.txt;star need fall lean turn hide tight jean song hold bad baby talk way hand shadow blue long selfish girl want door body roll paint wear moon away jealous slip else kiss lip yeahyou anyone sing back mmmm night another nothing keep wall dark pocket arm lock think hair
Allergic ; Post Malone;Allergic by Post Malone.txt;something instead sunday monday give demon hard allergic pill hold bad cut sober friday hundred translationsturkceespanolnederlandsallergic friend youembed holdin fight reason impossible sideways feel erase million sad else love open drug believe waste enough never back straight fuck true soberin
Alone ; Marshmello;Alone by Marshmello.txt;feel way alone translationsportuguesalone back nothing try find home
Always Remember Us This Way ; Lady Gaga;Always Remember Us This Way by Lady Gaga.txt;damn whole poet eye really babe world california band gold fade catch us sun light baby couldnt way part every bury goodbye memory hmmmmembed fire wo hoo find time always oooh word write die look lovers remember rhyme sky choke hooooooooo hurt translationsespanolportuguesenglishalways arizona never night play tryna hmmmm soul try burnin
Amor Genuino ; Ozuna;Amor Genuino by Ozuna.txt;tuyo algun el amor extranare decir olvida al puedo detenerte ten quererlo quiero de quiere arruino grito una intentar tiene besos vuelve pido pensamiento ozuna contigo yeh-eh-eh ya amo nuestro e vi le todo la haberte real momento ese alex perdi soledad otra amar ki divida mi camino salgo seguir entonces llega manera tenga genuino por dia encontra cuando que valor pa woh-oh en si plan tus sin ti desespera piedad eh estar siempre hydro consigo cada translationsenglishamor jaja woh-oh-oh eh-eh llevame volvera ni dimelo lo yeahembed quisiera nunca oh-oh un calle fue pasa ah cualquier menos soleda ama vivir final va recorda tu nibiru nacieras pero te woh se uno tuve
Antisocial ; Ed Sheeran;Antisocial by Ed Sheeran.txt;right antisocial something damn issue need give name solo standin music ridin occupied put fume easin wake bottle hennessy low pain care pop catch nah vision inner energy people talk way riot hand friday brain noon though drown commit wo dolo thing engine lose past hit ayy low-low movin loud place drownin close pew vibe yeahembed lit happen mess photo room pas smoke miss leave bring doom back boy night hat translationsenglishantisocial straight nothing keep zoom touch better cool space
Armed And Dangerous ; Juice WRLD;Armed And Dangerous by Juice WRLD.txt;og damn pay cup round iron purple need soda stranger lean give break outta shoot owe swish pick dig run hard forget famous bitch amount translationsespanolturkceitalianodeutschfrancaisnederlandsarmed god ya fade moby pop cashin o.c ecstasy flash dick today much tony bm part call anyway nigga bank red bih fact gun walk hoo son matter three-gram huh baow sippin uh ballin mama everybody still rich adobe niggas ayy dash body cash money aim molly park woo goin cliche look million brr hoo-hoo mom playlist skrrt pourin stark twenty dangerous bodyguard account wood skrr shall four party bound count ounce town full keep swingin fuck arm shit
Arms Around You ; XXXTENTACION;Arms Around You by XXXTENTACION.txt;right el hasta em damn coke ser fumemos hablas forma joda siga pull ten amiga break name juana wife alcoholic disfruto xxxtentacion yes italiana de coat put yo una sorcery daily tiene fx swae race cama vivo encanta good th band estas es bitch lot mally broke ft. studio amo spanish extend vestida hold pone foreign mientras racing la polskinederlandsarms real baby oi dick espera traduzione fumamos problema bebe dice penthouse ya-ah-aah reach though mi heart festival chanel este di portugues around mercedes maluma que pa conmigo en si girl huh andamos stripper mama mall ever pole lil car l como feel hotel body cuesta siempre los pie lee sure mami urgency could pongo wow ya-ah brr positivos drivin activo lo love mismo crazy traducao throat oh-oh un pretend emergency habana drug harm yuh enough gucci vez never miss leave hey woah-oh-oh-oh tu daddy ambiance party invita straight isembed esa hoe floor sense te touch lovin backstage ey woo-oh-oh se translationsenglishxxxtentacion pump arm ta
ASMR ; 21 Savage;ASMR by 21 Savage.txt;right even damn adidas knife stupid mimosa swear chopper solid suck ice need dealt big gutter push brick throw skype pull give young turn road momma ridin buy shoot window white richard shot wave kosher world good cost band mac run store ha dawg electric bitch lot roadster front pain button playin stick gold god trust desert tippin dead nah bike moscow drive-by bag jb glenwood week ac real pant bros dick much way amp mic hand gang call brother metro strange dice home gettin nigga creative holster next felt head chalk blocboy new lame fit fact gun fight chanel toaster slide thing time ptsd burn kidney crew girl side iraq ave. clap pussy inside lose rock translationsespanolasmr door sg dizzy still kite grill lil car hit l body eagle roll money south stealin wifey cop wear goin die could ak liquor jewish house jail broke-ass drink drive doubt lambo everything snitch kill street shyst skrrt becky savage drum glock seein mille life smoke nice nothin mouse brrah talkin ready never leave nas mouth brrrah enemy stripe walk-up night hat straight pillow rat xd glizzy keep hoe many spend toothbrush day try smokin think shit
Babushka Boi ; A$AP Rocky;Babushka Boi by A$AP Rocky.txt;right probably breastesembed teeth star dlrow give card marijuana dancer scarface excessive pray duck world top problem peep eht wooster buck good squeaky shittin low scar grace cheese diamond ya god camera phantom g benjis duckin expect cut pant would call sruoy nigga prostituters drape new strollin pearl blue quiet translationsportuguesfrancaisbabushka sauce eight lord either pistol breast ecafracs stain f-l-a-c-k-o denture si dentist dedicate huh papes scammer become robber uh powder bake ayy babushka please money bullet clean since hookah booster could princess boi potato breezy place w-wait season prada bentleys jodye vegan flacko waste popper wit draco boy shade face fifty play many safe hallelujah power praise fuck globe bandana smokin shit
Ba; by Lil Baby;Baby by Lil Baby.txt;right cart damn tissue issue burberry need big fart freezer tip baptist lean riddle type ayyembed hooooo wet starve paul mm missile hahaha -tastic use trench elastic hmm shine game deadass baseball okay anything hard bitch lisp tickle vro diamond malone ya pop pickle map feelin lick cap real dick rap roc-a-fella would speak shock call heat nigga flesh friend zap though eyebrow champagne fit head hungry jay-z fist old sauce atlas hee block post fresh find babywipe seek pistol whip sensor bat boomerang catnip best actually uh pussy step rock stabby -lastic sip ayy feel taser money field piss milly scratch flex water police giggle rhyme mmm holla fast blart t.i. cat tic-tac mind smoke yuh lip burr drip never cashmoneyap raincoat mr. mouth four oregano yup hip back weed thot stray overlap fantastic regret fiddle dark feeling cool fuck smell try ta think
Ba; Shark by Pinkfong;Baby Shark by Pinkfong.txt;hunt grandma baby shark grandpa daddy last end translationsportuguesbaby safe mommy away run doo-doo-doo-doo-doo-doo
Ba; Sitter by DaBaby;Baby Sitter by DaBaby.txt;doin hazard pay probably fin chopper read lean pull type im shark name graow tough turn angel bro travel line batch hard famous bitch nah aimin shoo drive-by baby crawlin would drippin call gang sock hangin revenge bluff nigga whoever head sitter old hatin free fire salad earn walk beatz son shippin hoo clark time rapper spank baow impossible want motherfuckin best babysitter grizz nat sequence box mama bitchembed kid marii family snappin slippin car ayy cousin fee hah barbarian sweet narc paint woo die goddamn ref squeeze favorite picture trippin look uh-huh water whenever fiend lambo kent rip keepin show book whistle fast fly skrrt ho action laughin defense ah talkin bastard gucci fleas switch bring match hey sparta audible brrt messy stripe back age haha thot khaled dressin high play pack patek keep mine blow tryna fuck man spot shawty opp ta think shit
