title;artist;filename;lyrics
Esta Danada ; Ivan Cornejo;Esta Danada by Ivan Cornejo.txt;sus el en amor esperanza del ya fe carita sonrisa termino dolor felicidad llueve le amigas movia rico delicia al manitas cuando llorando encerrada la-la cree la ah las nos mundo bien esta pura siente hermosa bailar estes danada tu noches bonita cantando translationsenglishesta cada cant acabo toda su mi ahyou desaparecio saca gusta manzanita cancion reggaeton espero con dia se borrachos cuarto ningun bailamos besamos que eso
Every Chance I Get ; DJ Khaled;Every Chance I Get by DJ Khaled.txt;rather doin right sell em damn pay truck eat cee-lo lam easy ago translationsportuguesdj pullin wish need big move pull break im support wrist young number give oneembed hoodie really live italiana music turn tough standin twice deacon dancer put all-white demon send use trench hood pick game drop city good wake run hard shootin bitch mmm-hmm ft. stick care catch mix fuckin claim us opps remind beggin moe person baby aight handsome trappy traduzione people would speak droppin brother dice every dinner lease three cali bank fanta preacher seat smash hater middle nobody fact strong regular plus gun crap durk start callin block track around fan time rapper si long dentist want scammer best add robber rent attention sittin uh jewelry kid livin still rich lil niggas car cousin beast forty year mortgage black roll cash money sure keith clothes nod tay wear scratch cake goin two picture million look water six lambo personal show lo love mmm street tippity-top soon zero room hurt boonie summer life servin different struggle believe nice chance nothin cappin talkin mail niece miss anthem business givenchy dollar back weed thousand fifty panda khaled full charge another checklist rob lap hoe dj keep watch feeling spend cuz fuck makin mode try must lock think home shit
Everything Has Changed (Taylors Version) ; Taylor Swift;Everything Has Changed (Taylors Version) by Taylor Swift.txt;something hld ago butterfly name eye stand hour simpl beautiful good wake grace rain stomach flight hold dust painted new blue translationsturkceespanolportugueseverything green find time tall door smile lose feel takin hello tonight freckle since morning look hop everything open version simple mind taylor yesterday kind pour changedembed miss back face high mine wall meet day makin change home
Everywhere But On ; Matt Stell;Everywhere But On by Matt Stell.txt;truck fe onyou easy need big think beach move push fix put little world line ol stop suppose rearview map sun pin mile would way reach next drown memory coffee load time somehow long plan add mama still without end everywhere could outside house state place look figure fine sky nights colorado lead guess pour mail miss bid concrete back town savannah another keep day meet santa highway try space delta home
Ex For A Reason ; Summer Walker;Ex For A Reason by Summer Walker.txt;doin even right damn deal easy need route pull type give mindset act number trap twice hood ditch ex game good anything hard bitch pain playin check jt fuckin bag trick unannounced spin real stress dick much way call nigga three note though heart woah block guarantee lord wo ultimatum reason time en long nerve snap want always cancer motherfuckin help trespass uh sit still reasonable tonight black sure end competin lie two figure click-clack ringin quick zero translationsportuguesex consequence mind singin different never bring four back day-to-day face play slap keep mine tolerance service beat phone tryna fuck man spendin try ta mad understand shit
Expensive Pain ; Meek Mill;Expensive Pain by Meek Mill.txt;sell list changin even humble right disney celeb fame chopper stressin funny need word christmas active somethin ten eighty name order eye therapy smi-automatic paper turn ridin vain airin buy put richard send ghost use trench share yard bro zone pick quarter richie realest worth america th hard dawg bitch front tickle pain check stick gold spoil ball catch fuckin prolly claim us hold clearly lem cuddle light feelin bad real cut flow trappin totin bros starlet people behind part tote cullinan call rappin gettin penthouse nigga friend three fit partyin ask walt king start sick bein son fear around slide wassup dreamchaserembed culture threeway time long girl want always text best uh kid mall cartier worry ever still pole nickel hit rich slow niggas l kizzy lil ta feel takin influence frame money elli throwin clothes dub end learn since cop blower goin lie winnin christian dot expensive currency jail besides two knock unless million look translationsportuguesexpensive kick dior tickin everything love knowin crazy culinary super blunt range plain cruz remain nice jim bore drippy switch bulletproof bringin never miss match business official bid back boy control skyline cell patek hoe keep dream watch bomb pushin pocket lovin spend tryna bernice switchin fell soul change think home shit
Fair Trade ; Drake;Fair Trade by Drake.txt;rather company findin instead butterfly rub sound southside eye content watchin really anymore security scrollin world top trust annoyin would early-mornin release rollin middle old sick imitation trade want everybody settlin worry rich feel peace goin raw away happen log soil seaside shoulda skeleton town frequent safety tryna uno ta og case even eat cent give young k ridin wake mountain hold g grow lookin droppin bury bread melanin wheel bein sleep lawyer forsake busy roll please slid could outside look repayin show maturity lit guess guy party control straight another feeling dos try understand shit treat tres position turnin follow push throw wavy tea turn put sudden demon ability use race emojis mil bro savin valley feelin baby cavin downtown fair call pity nigga head heart sight payment ever still worryin niggas ayy body peach ah-ah money flattery everything love twenty-nine hurt misunderstand couple lead ah talkin never split sing nosey emoji fake wind iembed think swear walkin purple big somethin type anybody break name dirt harmony owe frontline hard event bitch losin resentment blame fuckin nah us shoulder publicly spin invite friend start hear wo find slide thing time leg mama kid oooh search translationsturkceenglishportuguesitalianofair save senseless single two favorite cape crib honestly figure oh-oh spread darker celebrant ass back face high keep disability ooh-ooh expense
Fake Woke ; Tom MacDonald;Fake Woke by Tom MacDonald.txt;right stupid instead issue b neighbor ashamed order really music pray mask world top adult liberal care trust pill claim bad would riot string fact old stay fight walk sick fan culture rapper cheat girl want side wonder feel without black mention peace goin politician woke bigot secretly association already life believe libtards thanksgivin hot slap safety tryna choose home shut backwards cancel celebrate give daughter segregation point hate gay zone strength scar slay chain feminism song tiny eminem work football sobriety addict damage billboard citizen gun free country bein strategy hero trump always worthless sit busy sure lie exponentially racist design realize police american kill else street crazy silently system sale violence kiddin screen guy anyone translationsitalianofake play public safe label righteous society man try child change accept flame probably need xanax cage turn buy wre planet use race dumb taught th run god privilege censor someone sleepin people way call childhood every gettin team difficult purchase controversial afford -year-old bash murder food help box underfunded mum casualty model everyone tryin end cop wear censorship everything love job exactly never screamin school genius a-men-and-women remove me-too hoe fake amen spend think sell role defund racism artist name vote white native game pick mental speech microaggression slave bleed us screwin ahead week democracy talk legitimate accuse war reach first ask truth effect guilty wo medium matter virgin forgiveness family empower fee single erase idiot die favorite view republican cardi divide homophobic rapist political high information keep pushin illness day difference
Family Ties ; Baby Keem;Family Ties by Baby Keem.txt;doin right coupe compose summon b corner wrist jump eye number advice popeyes killin lens sie world top vaccine legacy critic hittin check father fold headshot pop duckin platinum flow rap mean gang toe nobody rumor old fact amazing topic offend relax fan press girl five side trend everybody grateful past politickin rich tippy-toe takin prophet dave learn ig woo choppa begin tint pro address metatron con holla ambulance life dance four phone tryna social object letter ta case overnight al bird daughter last progress window shot council potty strap city stop catch g hold pant brother visitor kane bury great red new gun free fire around shore alike sleep sittin unzip writin rollie door cryotherapy word hit year could tap outside activist unless drive trippin look tippy show answer soon oven comin guy bring gracious party seventy play safe dream rebirth cool fuck man change shit least occasion star need swervin damien trending momma put man-man gimmick good survive bunk pandemic net process elohim way call gettin nigga nerd megan listener wrong green son ride grandma huh drummin circle motherfuckin still lil niggas everyone respect dot bus class open ho seein double ah paris chance never school motherfuck hoe advance scary mad think heard translationsturkceenglishportuguesfamily juugin tie big france ten kanye name tour album omega game multitask mental hard bitch prisoner button playin competition fuckin us tongue-tied pglang backin old-school reach first next cum whyembed ask truth eight od gemini whip burn mama patient falsify bum tonight hah single two gabriel million cater figure melody thumb uncle success project loony offspring avoidin face beat two-nine smokin independent
Famous Friends ; Chris Young  Kane Brown;Famous Friends by Chris Young  Kane Brown.txt;crowd probably swear big throw county road rutherford touchdown buddy lt city good row record ol jason famous single-season hold light davidson flash people brandon every sheriff friend megan hear randy girl five preachr second year none everywhere place johnny life never yeahyou party cheer back boy town high hamilton small teacher home
Fancy Like ; Walker Hayes;Fancy Like by Walker Hayes.txt;happy right fry truck pay vespa probably styrofoam secret squeaky-squeakin mansion need dip frosty maybe upgrade little radio dancin top delight boxed oreo date up-do theskoal straw shake low jean bangin check maintenance spoil light baby bed bougie champagne-poppin cream wide way every kitchen applebee new rollin blue country girl fancy add uh slow ayy victoria without tesla clean wendy woo entertainment maybelline two hole natty keepin fine street whipped super kiss impress double lip romancin hey bourbon night steak dixieland keep alabama-jamma wine ta home
Favorite Crime ; Olivia Rodrigo;Favorite Crime by Olivia Rodrigo.txt;doin bloody alibi accomplice break sound hope wondr crime hate use trouble line honey translationsturkceespanolportuguesportuguesdeutschfrancaisfavorite bad baby damage doe-eyed hand call every defend flee bury friend heart around thing time become cross smile bittersweet mineembed goin siren could favorite look everything love scene min willing four face mine watch think treat
Favorite Time Of Year ; Carrie Underwood;Favorite Time Of Year by Carrie Underwood.txt;snuggle tie wish cinnamon blanket christmas stocking break chimney sound tinsel unpack music tree yes movie joy white angel bright little merry ring light sugar jingle every underneath fire hear thing time together colorful door sit bow feel year bell black everywhere ear favorite knock snow season love sky kiss life magical pour bring wait isembed keep air pretty mistletoe
Fearless (Taylors Version) ; Taylor Swift;Fearless (Taylors Version) by Taylor Swift.txt;right something farless pull eye stand really road put little drag good run shake hard lot rain catch on-horse fearless baby brave way hand first seat head middle stay ask usually walk absent-mindedly moment want best wonder car slow glow drive look translationsturkceespanolportuguesmagyarpolskifearless remember yeahembed street version oh-oh capture kiss taylor parking storm dance pavement passenger flawless town doorway dress cool try hair
Feel Alone ; Juice WRLD;Feel Alone by Juice WRLD.txt;notice even right least funny splash maybe move anybody dopamine wishing stand really alone hope heartbreak sorrow shot demon pray oxyco bro potency band prime line okay drank electric pain height stick care pill rare hold uh-uh someone person translationsturkceespanolitalianofeel sorry people sober way fair hand gettin reach chair though thinkin head new nobody youembed find thing time long huh hopefully five tomorrow help dope uh lose comprehend wonder rid bunch feel hotel obstacle grand none lie could reefer uh-huh everything devil else fine love fast happen numb mind drug finish life guess school back borrow seem high another many keep stuck mine tryna spend danny relaxin smokin think understand
Feelin Like Tunechi ; Lil Wayne;Feelin Like Tunechi by Lil Wayne.txt;right court pay eat creamy teeth tunechi scream groupie mansion wish need big brick lean throw bugatti give im young wife live really masis turn momma buy last put another supper mil top richie grindin weezy cost two-hundred store skillet forget bitch front grown-ass stick gold wraith hooptie vinci aimin aint platinum feelin bag duffle bad slit real baby carter men dont way drippin tote gettin cant nigga three serious leo bank note dish fit heart shit delicious gun skeet start walk -- fresh oj bop ride nose beef mercedes pistol rapper whip trukfit snot rifle huh want pussy step door kid still plate rich lil feel bos body snub money bullet killer clean maybach titty hoopty trippin gut tha show love tug loosie lit death throat chef drug pediatrician account smoke believe code talkin g.o.a.t worker switch bathroom never miss fleet da heavy count yacht fifty translationsportuguesfeelin foot boat play upon many bosom floor glizzy keep watch beat f. day fuck man pump treat
Feline ; Juice WRLD Polo G;Feline by Juice WRLD Polo G.txt;doin right court damn juug force need lean loyal pull owl young mixin stand loose turn kenobi trap vet shoot yo put white hate pray obi-wan use smackdown cocaine world lonely hide run hard shootin lot bitch evergreen pain playin studio god ball catch boyfriend hold opps real feline porch sack sorry wide talk celine part gang call anger nigga guillotine rough driftin brain war ape .s raise translationsturkceespanolitalianofeline heart new rollin nobody head stay gun late fire start wrong wo track ride around slide screw time campfire girl want always side pussy beam lose still faucet hit grill niggas leakin belt ayy car feel body torch year witness set money field park aim wearin woo wear chillin choppa die hogtied narcotic house two crib hop close fiend kill vibe love devil prada fast boom yet rattle kobe range leav life crack juice seduce ready never hustlin miss leave bring backwoods mouth business harambe bae back boy heartless homies blatt night zombi play lane keep mine dream watch blow beat fuck try burnin smokin shit
Feliz Navidad ; Jose Feliciano;Feliz Navidad by Jose Feliciano.txt;prospero navidad wish felicidad feliz christmas felicidadembed heart ey ano merry bottom
Fiel ; Los Legendarios Wisin;Fiel by Los Legendarios Wisin.txt;uste el matame noche fin soy hambre fiel al caballeros senorita pide mio atleta nos rojo uni solo veinte quiero quiere de yo una tengo tiene llegue paleta cama -siguen pegan piel placer mucha tiempo llame persigue jetta porque ha era recuerdo tarjeta volando movimiento taco contigo enciendeme ya sigue del rauw rozame sexo e shh tbt hyde le pone directamente diga viernes todo quieren la pin baby bien doble siente bebe ese arrebata nada comenten dice otra celular ir avisame mi cancione porta caimos -sigue cortez llega mal vega darte todavia por son jhayco desde jugando cuando llora pensando que dama comer supreme maquillaje pa en explotame si conmigo entrega dale presion castigue louboutin llama sephora sin ti mall quiza hicimo woh-oh-oh-oh caseta salir base pantie eh necesito l jeepeta como estamo siempre los importa manana w escucha suela yaembed ver verte mami despega u die vete cuerpito soporte translationsenglishfiel wow prende hace interpreta pocas digo beber con tra pegate bailarte okey dimelo lo gym sabe quimico olvido mata un vuelta miedo tenerte mia corazon vez seria deja doy hacia va hoy engabeta mr. legendarios tu vamos gana da hay nadie hacer saben tocate consiguen senoritas decirme gemias ustede haze do-do-doble obliga pero te dura urbano podemo relacione cuanto woh atras tienen se uno ta aqui jhay
Fifteen (Taylors Version) ; Taylor Swift;Fifteen (Taylors Version) by Taylor Swift.txt;swear wish redhead someday big fall ten give name outta dancin date anything forget change suppose datin feelin spin football way friend hopin first great thinkin next head stay team la-la-la-la walk find around thing time heal girl want best somebody mama everybody door sit car year mornin end deep wink waitin marry could class look freshman realize figure everything la-la-la love fifteen version breath soon abigail room laughin kiss mind taylor life doorsembed believe nothin enough translationsturkceespanolportuguesmagyarpolskififteen four back boy count town night dream senior mine cry day cool try hi think
Film Out ; BTS MISSING;Film Out by BTS MISSING.txt;exist song seem miss film bts
Final Warning ; NLE Choppa;Final Warning by NLE Choppa.txt;mugshot og damn slidin truck walkin broward suck wish scat bet gas auntie news swisher bumblebee tray pull warning give c stand wet county point trigger tree ridin chase exclusive nut shoot yo put cold send pray race ship drac top th good bitch tank srt catch e informant leavin week lick mug bond neck dick disarray shotta fingernails would impact call hundred al-qaeda nigga three .s jimmy glo first next stay ask translationsespanolfinal start walk murkin transform slide glocks dissin shooter steady thing jet join nle sting ski family still livin hit ayy crash save roll money sure nevr mention clutchin die smilin donut two house squeeze away clip view brr decay ground police inform gym cruise skrrt threat goon heater understood life crack gravedigger internet yuh ar cappin lemon raven wood never miss heartbeat leave dun final wait brrt enemy back flat homies face full bush rat dirty throwaway bomb day soul drill prove opp grape shit
Finesse Out The Gang Way ; Lil Durk;Finesse Out The Gang Way by Lil Durk.txt;lowkey doin happy even swear need big grin news fall pull give coochie watchin yellin alone turn ridin hour strugglin last rockin put shot use trench tellin world percent good run gentleman low bitch handle kit stick chain quit god pop pandemic us invent pluto feelin win bag one-hunnids fifty-three urus spin useless real trappin baby much rap way cullinan group gang brother call motherfucker goofy nigga perc serious three whoever felt head twin sellin ask start wrong matter grab gangsta middleman steady long girl dungeon pronounce together want food murder help side attention actually mama kid bow family ever postin rid niggas feel motivate body finesse roll penitentiary money feminine clothes hunnids mention since deep two-tone die jail two house clip crib figure remember everything love street fly super drought comin blunt hunnid granny servin different jeweler nothin bang peasant enough gucci bringin hustlin mouth translationsnederlandsfinesse thousand ounce fifty banger juvenile foot patek keep dj cry businessmen runnin beat phone pool spend feeling tryna cool man weird fuck uno stamp think home shit
Flocky Flocky ; Don Toliver;Flocky Flocky by Don Toliver.txt;doin right stuff changin scuba cup swear alright gas route whatever senorita cha-cha pull give tastin rooster buy boof orleans lithuania edd top far buck chart shake lot handle flight morningembed dust bait much way call brain cotton head new tool hella gun havin walk wo glocks translationsespanolportuguesflocky candy steady shooter careful lawyer uh still word hit lil tracksuit flocky dash save woo goin cake pint movin morning tune two cougar away place look drownin slip whenever leadin stare answer fast lit skrrt yeah-yeah hunnid juice caught carefully tweak leave blessing back count macarenas face straight keep safe stuck silence question lockin fuck shawty tweakin prove sh-sh tuck
Fly As Me ; Silk Sonic (Bruno Mars;Fly As Me by Silk Sonic (Bruno Mars.txt;extra whole ow follow need butterfly act somethin give really later game apollo band f upstairs okay hard ha sonic player trick boo real baby three-piece lookin much talk downtown speak fair every sprinkle nobody fact ask spell fire vicious hear walk session mack track huh girl together want help mash somebody uh ever mayor l desire single biscuit two potato class look crib cater everything show uhembed love silk deserve fly hollerin language lesson different talkin halfway truffle monte never bring translationsespanolportuguesfly business jibb school float back treat smooth carlo spatula flavor tryna meet showtime child ta understand shit
Follow You ; Imagine Dragons;Follow You by Imagine Dragons.txt;right instead alright wish follow type give number live disappointed translationsespanoldeutschturkcefollow fix put world spotlight attack low tight sunlight hold would way hand call every heart youembed loss team around always glove deep could wherevr la-da-da-da-da-da love comin wherever life deepst enough back night treat cry may
For The Night ; Pop Smoke;For The Night by Pop Smoke.txt;og right industry wish big pull give young wife ridin buy twice shoot rockin triple white exotic porsche camo choker charles hood game cuban low honey bitch c.i.p nightembed ya rack pop fuckin us v light bag beggin translationsturkceespanolportuguesfor real baby rolls-royce aight freaky thief rambo call dinner gettin hundred nigga three re-up seat head new plus gun fight link bein wrong wo son rest time pinot want always five bun motherfuckin cross attention hmph mama yessir rock livin henny rich ap ray thriller cash money killer learn park peace goin could riri grigio liquor look million uh-huh hop whenever lambo dior kill street fly ho cute hunnid payne smoke paris nothin discreet lashawn cashmoneyap bring dealer wit bae boy thot major night full cork tipsy keep thou zoom gim runnin watch beat tryna day fuck man wine think k
For Tonight ; Giveon;For Tonight by Giveon.txt;even secret throw deny give game honest us behind every though stay truth wrong reason time long want become door still translationsportuguesfor tonight closed single rush lie begin morning away youyou numb lead leave lay play keep touch feeling ta
Forever & Always (Taylors Version) ; Taylor Swift;Forever & Always (Taylors Version) by Taylor Swift.txt;something minute break eye tuesday anymore little hide honest line run low forget scared catch rain hold bedroom cut baby almost way speak mean flashback call wrong thing time welcome always door kid second still feel core please sure perfect look stare everything yeahembed love happen version taylor believe forever translationsturkcehrvatskiportuguesmagyarespanolpolskiforever halfway never onto back boy night seem nothing upon silence phone think
Forever After All ; Luke Combs;Forever After All by Luke Combs.txt;truck whole allembed maybe fm break young eye forty-five last later cold maglite thought drop good jean sooner guitar us work heaven moonlight much would way call kitchen string gettin hundred make-up three t-shirt first heart new old blue station lord wo thing time moment twelve shift long together always side lose second year kinda wear duracells could outskirt million look fadin needle love toll life dance forever thousand ounce nothing beer man home
Forever Winter (Taylors Version) (From The Vault) ; Taylor Swift;Forever Winter (Taylors Version) (From The Vault) by Taylor Swift.txt;even instead force apartment scream wish fall beg pull break thread young pace stand live voice use anything hard scar check werent flight sun light much decide winter call every head hear darkest wo around thing time long solve smile please puzzle listen away disarm love fine death version gravity mind summer taylor piece life believe forever waste translationsespanolportuguestaylor never leave night seem symphony floor breathe watch bomb phase spend day swift try laugh
Forgiato ; YoungBoy Never Broke Again;Forgiato by YoungBoy Never Broke Again.txt;case even right stalk em yamaha probably whole swear forgiato bout zip minute need big youngins stretch pull ten foe im number lottery slime sound sniffer wet dawn window use got shotty cocaine top game swing date hide whil run okay line bitch pain evacuate check stick burner chain dada pop catch pill dead claim hold aint work win coming bad real dubba-aa xans rap talk speak laury tote home hang gettin nigga three toe ape escalade heart new aroundembed fact strong free wheel start seven son matter nose beef glocks funeral shooter time thing long baow sleep stuntin tuck want murder pure add always dope mama phat step kid marble ruger four-five lil niggas hurtin ayy bos body pallbearer year black set money tryin sure end since mss north knock bust flex six kick ground natty bitty knowin street counting kobe system already gravedigger dance vein never grandfather business winnfield reppin lay full night dome lane mike casket keep dirty floor hoe runnin claimin shank question contract gardere man fuck prove soul think understand shit
