title;artist;filename;lyrics
Price On My Head ; NAV;Price On My Head by NAV.txt;sell list pay knife ice mansion brick throw pull paranoid im give comfortable act southside oak wet live fendi coat put shot send shine top wash quarter hide run ring low kubrick bitch lot brown check apologize price tonya fade rack pop dead opps work bag cap sexy cut bed real neck carry addict much dont would beefin way joke nigga though head new drown truth loss free gun shout hear sight wesley reset dime rest ride block shooter jet du time actavis sleep girl codeine want squad louder best side xan dope mama kid ski livin still busy hit rid niggas car debt showin insomnia cash less toke balenciaga clean since pint die could outside house drive lambo prada death threat rex life growin double translationsturkceprice smoke waste never miss mouth japan soap bentley party weed boy town snipe night high crew nothing deadembed hoe beat tryna meet mode try shit
PROLLY HEARD ; DaBaby;PROLLY HEARD by DaBaby.txt;og right norbit pay walk-through force zip deal bet big vroom break pull shark give freebie yes vip buy put club voice use bro shrimp swing city line okay store ring dawg bitch spit plea broke cheese stop prolly us bad boo cap sorry rap call nigga friend first new hearin sellin lactose-intolerant free hear callin charlotte post pfft beef rapper huh want mane sir peewee cross uh pussy door slammin still rich hit niggas please sweet tire money married wearin lie waitin die dog leash squeeze uh-huh brr six lambo doubt figure blowout show mmm ho ah juice cd gucci leave thick four da back count fifty orange weave keep floor runnin fuck try ta think k
Puppet ; Tyler The Creator;Puppet by Tyler The Creator.txt;company list instead wish need z apart maneuver somethin number sensesembed live loose point alone chase hour verse put freedom hate wrap oxygen financial puppet lonely city line run front stop god song third nah bike sun light la cut talk way driveway call string bread first next land free start walk son lord ride find complex long want door lose wonder parasitic ayy without translationsespanolportuguespolskipuppet park could house knock vehicle away drive hug grant wait startin self-control back weed control pack breathe rudolph air ayo tryna fuck santa
Pure Cocaine ; Lil Baby;Pure Cocaine by Lil Baby.txt;sell crowd stuff damn coupe tag fool scream wish gas mad need big move brick ten give wrist jump stand live turn trap buy forecast last month put shot send cocaine little dumb ahks quarter band famgoon dawg bitch era broke check diamond stop song rain catch pop work craft bag britches cap real porch much rap way slab mean gang kickbox every hundred brain friend bank toe red new free cancun wo brand thing whip long pure best xan sizzurp dope mama rock worry ever sip hit rid goin could sharing knock million kick close fiend dealership push-start everything book vibe street ho opposite disappear drug life g-wagen shoe status never leave dollar back key boy keep sense tryna day fed difference fuck ta think home shit
Pure Water ; Mustard;Pure Water by Mustard.txt;right west coupe whole eat easy ceilin trampoline star secret coast ice tip bet big ricky brick ten give village plottin master jump eye watchin put triple club shot disguise pray plot trench tellin masterpiece game pick vaseline sub store bitch lot handle jean queen bobby stop chain god ting trust catch care dismantle pop prolly nah flight light athlete bag limit bad goodnightembed lawrence lookin lab rap celine call gang nigga offset bank seat fit t-takeoff team prize country pimpin ride afford slide swap dunk two-step waitress pure want across five somebody askin uh beam candle bustin sneak nawf hit lil niggas ayy wraith takin jetski cash money woo repent tint look water hop poppin skrrt open scene ho comin tear already toss p mustard talkin drip rinse banner harassin leave snake hey backwoods tempur-pedic river back thot full many keep dirty cry runnin beat tryna spend canada fuck rotate lobby ta willis mad
Put A Date On It ; Yo Gotti;Put A Date On It by Yo Gotti.txt;truck damn pay swear royce suck whew bird brick ten mindset number booking really tough trap pussies buy shoot research verse put white shot send use thirty laid camp date city good run low bitch lot plug syrup father check diamond stick fold chain quit third hold flight june work real dick sack hitter talk rap way drippin mean purse hire call fn gettin hundred nigga t-shirt reach first raise wrong i- wo bullshit bop around ride soft floodin murk sign diss always murder folk sippin sittin pussy uh everybody rainy still plate hit lil niggas cook hah roll cash edible money vvs competin iphone woo everywhere goin could goddamn two shop away birkin pew pot show street knowin skrrt crazy comin glock pedestal life kind talkin mouse slatt leave ramyonthebeat wait genius four brrt dollar ass back nope thousand face fifty pack night play scrape rat bush many keep dirty hoe watch runnin label tryna contract table fuck shawty ta stamp shit
Que Pretendes ; J Balvin;Que Pretendes by J Balvin.txt;hasta el meno tarde al presto conozco tiro tiembed hora borre oh-oh-oh quiere de yo una buscando facebook razon tiempo estas muy pierdas porque kardashian horas chequeando eso contigo ya wuh e intentas nah encuentras vuelva yeah-yeah-yeah le prender ja meti balvin todo bad uh-uh volver la baby flow bien quemar bebe nada llamar baby-be-be-bebe-bebe fui hacerlo otra vida claro retro mas mi pastilla punto puse mal por dime son desde que conmigo pa si anda escondidas llamandome ti uh translationsenglishdeutschque repetirlo sabes las actitud hiciste oasis ahora esta quiera ere snapchat yeah-yeah-yeah-yeah-yeah-yeah ver ninguna mamar joder para j envolverme igual bunny hace con atencion uh-huh embachan fotos uah lo sky insistir investigando hablando poder vives instagram vez evita bajo final va tu quieres niegues da pretendes hacer esa morder iguales perfil pero te molestias ey rompiendo woh fuck se cosas lamar plo cae
Queen Of Mean ; Sarah Jeffery;Queen Of Mean by Sarah Jeffery.txt;happy something pay train follow fall move pull name finally sens turn last fiery use angel ruler thought world lonely line run anything advantage endless defenseless pain queen interest overwhelming price blame shoulder skin villain bad person would leader mean unsure third-degree call pastime brain anger blood deserveembed head nobody ask scheme sea wo friendless around wicked time burn want always circle inside lose sit bow ever promise feel body frame kinda toy boiling perfect end draw patiently learn nightmare expensive princess tired picture vengeance magnetic close evil rule darkness devil show deserve pretend hurt reign exactly nice vein broken never leave wait willing back another nothing mine dream watch dark hotter think
Racks In The Middle ; Nipsey Hussle;Racks In The Middle by Nipsey Hussle.txt;court coupe damn deal round fame chess wish gas deck closin mhmmhmembed somethin give condition break enterprise young solo foolish prison embrace motorcaded music ridin road live hope twice month put cold send pray wrap thirty top detail game prevail drop v- cuban invest judge forget bitch mud check height gold god bleed rack catch us hold work expect mhmmhm grow neck lurk unit would vegas hit-boy knew nigga left bread wipe retail champagne though reach new curfew next middle imagine plus regular blue start baddest around shooter jet thing twelve burn sleep forgiveness five always engine best want cross mercy step lose limo youth ever trapadix still focus rid crash reappear dash connects year sweet set respect money student sauna perfect killer splurge learn goin die dot dog tint shop maybach kennel drive rebuild million presale fightin look drownin water lambo dior show lucrative silk street fatts pipe fly breath commercial tear couple granny chauffeur finish life double smoke puma pullin hill bang success freeway never wit dollar grammy-nominated back cloud flower straight battle another build bail patek crew almighty sympathizin dark power beat steep tryna day ta escrow sheddin shit
Rainbow ; Kacey Musgraves;Rainbow by Kacey Musgraves.txt;notice even least yellow alright tie translationsespanolrainbow finally anymore coat umbrella line ol hard tight stop stick color ya rain hold hangin darlin red head green around always tryin alrightembed could blind million look water everything others mmm sky open risin struggle rainin storm pour orange boat breathe rainbow stayin wind
Raised On Country ; Chris Young;Raised On Country by Chris Young.txt;something stomp truck cup give sound drawl strait tradition music breakup proud radio little boot singing tonk run diffie joe lot survive whiskey light merle someone talk every friday raise country dna walk southern reason help pickup family tennessee attitude learn deep listen upbringing prop living love crank honky life willie daddy party neon soundtrack highway ta george
Ran$om ; Lil Tecca;Ran$om by Lil Tecca.txt;bout need rider pull im turn fendi last dancer white hate ghost dumb ton line bottom bitch lot diamond phantom opps flow taste way gang nigga lace red twin blue chanel link start glocks shawties vuitton want hit lil milan niggas year black money balenciaga ransom die could outside two inbox thots place hop louis prada downfall weigh blowin internet stunt banner leave yeahyou thick ass face blow tryna try shit
RAW SHIT ; DaBaby;RAW SHIT by DaBaby.txt;even something screwball pay whole swear eat walkin corporate fishtail star skybox ice bet brick pull give act name im k really turn trap shoot put umbrella cinderella skate send demon richard starfish wrap ship strap mil maggot quavo bling drag quarter ugh low sand bitch magnet broke check cheese stick rrah god tahj castle thang shh mix dababy us activis light platinum bad la brag fedex baby aight weather bragging dick cream talk icy gang scatpack plaque plastic brain nigga ups wipe smash head stay forth challenge gun team fire nappy start walk sick baddest racetrack matter nose beef takeoff grab time burn huh baow motherfucking want together motherfuckin add somebody actually uh pussy metal static door sit smile drawer still prong hit sip car niggas starfishembed feel stab cook lift hah cash money culinan designer none wear woo raw activist donut detector two-ball uh-huh brr water kick hop baguettes ash everything show street boom skrrt fast throat ho savage audemar dad moonwalk defense smoke plane stg addy screen remix leave bring backwoods hey nike hot daddy silent bae back dimple boy backend night pack play nothing casket meeting dragon stayin std excite lightning wall label tryna cast boast fuck wack arm man change pilot think shit
REALLY ; DaBaby;REALLY by DaBaby.txt;right tag zip wish neighbor jiggy act break haul outta young finally stand really turn white x send mil swish pick drop good okay shake bitch hall spit password ya rag rack pop bag cap real dick rap would call luck gang shack every nigga nyquil red thinkin blue roddy hear block beef around time sign sleep huh meek want folk clap pussy uh candle booty rich hit ayy birthday niggaembed sethinthekitchen skip killer jit milly cake liquor wheelie class milli picture look six figure kill show blunt couple drug pas smoke cappin poppa backwoods dealer hot twitter bae back face play respond blow pocket beat tryna pretty fuck rewind try ta chip think shit
Rearview Town ; Jason Aldean;Rearview Town by Jason Aldean.txt;right truck throw outta tough road last use minus run hard mirror stick ya rearview dust much townembed root wipe heart new rollin middle main rust time sign photograph side ever dash flip less somewhere population could place look ground rip sky tear disappear sun-faded finger yesterday footprint nothin broken never leave back cloud town plow watch wind small think
Red Room ; Offset;Red Room by Offset.txt;boss alive mansion gutter eye number circus cold hide ugh dyin check trust e laser rap gang woop maple walk everybody bow past maniac brooklyn feel black sweet operator less naive clean woo away kick living fast sky skrrt room girdle mind boop p believe translationsportuguesred percy cramp lurkin flush homies night mike runnin tryna smell ta crampin home humble cup eat vault round fame blasting ridin lion cause shot tunnel hate snitchin acre city shake controllin stop catch gift hold opps work grow football facetime lookin brother heat great thinkin new wheeze fire workin flop stash pistol sleep abomination cross dope door hit sip bos lamborghini streetlight military could look napkin police kill street crazy basis curtain mags odds miss bring arrive ease brrt cry blow label man shit treat cookin need throw pull turn momma booklet shoot put use travel run hearse pad light person baby roof gettin nigga expose holdin green puddle hoo lord panoramic grandma huh murder circle help hatred livin slow hurtin niggas cash money backstreets cop maverick devil love choke revolver double drip foot floor dirty brazy lock mad think bust sell tag whole gas paper tree trap tellin boot zombie bitch mother pain playin us crook badge situation talk speak motherland hand cant three war reach smash tec imagine start time family nation crash prayin rule fifteen dad bundle hey count casket keep beat soul
Remember The Name ; Ed Sheeran;Remember The Name by Ed Sheeran.txt;list delaware stuff even pay stupid deal ipswich minute funny wish cent big christmas give name wrist translationsitalianoremember wife really turn zales fendi buy rockin put club cold buts voice thought singing insanity top start game saga prevail ironic chart drop good bottle anything open-air forget jean bitch spit taco check stop stick diamond spoil quit song episode pop gift fuckin dead eminem ands feelin appeal seam mile grow real addict today people rap sober would way mean mic call hangin rappin gettin bergdorf great red nail fate head nobody old fact billboard existence twisted scheme king eyelid bein sick conversation eight deathbed fresh find time whip sleep huh want always tomorrow become ballin kid rock worry still rich climb bear ayy feel without tonight year bell money shinin balenciaga clean wear goin buscemis could dismiss shop knock ed look uh-huh doubt remember everything show private else lit yet fly quick super numb sale skinny already seein crack talkin nothin tokyo drip misfit never guy miss denim bring kickin hey business split boy town face straight another hoe dream mixed watch air squeezin blow phone tryna lipstick dress day man must trl nine-inch lock think shit
Remember You Young ; Thomas Rhett;Remember You Young by Thomas Rhett.txt;carpet bar ago move young classy hope forgives little good couch buddies shootin innocent ya us youll light bad heaven baby grow crawlin much roof college tequila ageless red darlin stay wrong matter whoa-oh-oh time long always sippin straight-laced smile kid still perfect marry shuttin away look kick remember youngembed tear wont forever painless never hey back town youre foolin shameless day wine
Reply ; A Boogie Wit da Hoodie;Reply by A Boogie Wit da Hoodie.txt;sell right even damn pay round tie eatin makeup follow think lean artist rubbin type give pull eye really ticket scallop hope put disguise beautiful pray use problem far game comply good sing-along line run bitch chowder father song televised shoulder sexy baby reply would way part thief call every perc serious friend raise shit stay ask command woah along argue wo main around grab time waist girl complain want grizz uh ever hit slow scholar niggas ta televise joefromyo forty tonight write body thigh toddler lie raw could morning favorite look rule fine crazy moan numb plain couple mind finish life different nothin nasty switch guy bring dollar back clam night foot play keep dream cry fake tryna spray fuck change mad home
Rich As Hell ; YoungBoy Never Broke Again;Rich As Hell by YoungBoy Never Broke Again.txt;case stalk whole chopper turnin solid mansion follow need big youngins brick glizzies bale give sound stutter really point trap fendi vl precious creepin put lens eyeball hmm strap bro top dumb problem pick lonely run hard section scar bitch thuggin lyrics check care steppin song catch rack wrestle nah hold work tub bag bad uh-uh lick heaven real however pant fam dick roxies talk tossin speak way clique hang choppin nigga friend blood red head stay ask semi strong gun late wesson plus walk wo message time whip sleep huh want murder best hell dope ballin inside plenty still rich hit niggas temper feel body cook prefer black flip money sure throwin piss pending d-rocembed macs- loud celly tension look mojo kick doubt police sniff slump boom liquid lit presser quick griselda ho drum kiss dad d-roc smoke shmurda often hollow talkin worker reckless drip mail never coffin bring cuttin layer leave kickin mouth draco pit bentley thot night pack play full watch bomb smoking scale pocket thc fuck man pale billy ta pressure think home bust shit
Ridin Roads ; Dustin Lynch;Ridin Roads by Dustin Lynch.txt;early right probably yellow turnin ice gas sunri-ri-rise need ridin road cold window thirty little curb world line light baby flash lookin way hand shotgun friend rollin nobody wheel slide thing time sign girl want plan somebody cross uh sip hit feel sweet roadsembed bullet could countryside moon drive water nightclub street koozie kiss already steal lip forever nothin town night neon keep mine lovin tryna trip makin
Right Back ; Khalid;Right Back by Khalid.txt;right crowd something maybe need fall beach really hour later send rightembed swing date good mood line mirror lyrics fade nah work la real allow talk way ill stay fresh track around thing time ive sittin step patient sit past traffic slow feel save roll pic weve could place honestly shower show vibe love mmm fast soon ah bring wait back weed age youre night power phone cool prove ta
RITMO (Bad Boys For Life) ; Black Eyed Peas UNCERTAIN;RITMO (Bad Boys For Life) by Black Eyed Peas UNCERTAIN.txt;pregunta el guay daredevil therapist noche soy al need rebel otro rooftop rumba live yes culpa puta hahaha yo paz tumban tengo shot fuego toda vivo top dealin merry buildin es rompemo porque ring luzco voy stop quit wuh e ciego bad la baby estilista addict matata vibra nada speak dice asi claro mi new hater improve lego rhythm fire volvemo sick dia wo son around que dinero pa medical en reebok ra dale dejo level zumba tumba scenario sin nonstop niego translationsespanolportuguesritmo flu sabes canelo base pac hit bear como feel tonight los extremo learn woo ritmo movin narrative con ni keepin hacemo lo leyenda mexico fly prospero pedestal life ah timon never several nosotros nike tu hakuna hay party style boy alumbra night upon te spend rosalia pumba se wild space asusta shit
Robbery ; Juice WRLD;Robbery by Juice WRLD.txt;whole funny need throw butterfly paranoid give wrist really sec last woman put hate window wake run dig manner hennessy blur hearse runaround gift saw bag bad person real much decide talk every first heart nobody strong iceberg gun insecure around slur thing time always rock past end flex drinkin answer love fur fast ho hurt dad drug mind different reverse translationsturkceportuguespolskinederlandssvenskaespanolrobbery gucci never leave itembed curse boy haha high keep grave phone man fuck true oof home shit
Rocket Ship ; Future;Rocket Ship by Future.txt;rocket law pay jacob coke ice cookin need bird whatever brick lean bale throw pull demo ship tellin snitchin good dawg bitch check stop chuck pill phantom v salt crook feelin galaxy cut totin i-i-i dick call kitchen nigga first throw-on puttin ask actavis whip long want limo ever word lil atl extendos pound since dog knock arrogant earth water poppin louis fill police mexico soon drankin ho comin chicken bring yeahyou four dually back chargin boat arm tweakin ta space k bust shit
Rockin Around The Christmas Tree ; Brenda Lee;Rockin Around The Christmas Tree by Brenda Lee.txt;happy stop fashion ahh-ahh-ahh couple deck ooo holiday christmas dance bough merrily pie tree everyone way rockin party every later sentimental voice holly hung singing new pumpkin caroling old jolly feeling hear hop mistletoe ring ahh try spirit around hall
Rodeo ; Lil Nas;Rodeo by Lil Nas.txt;translationsespanolportuguesrodeo rather widow truck think daytrip give clue break chill buy last later cold thought oxygen ex bone hard forget bitch stop care hearse foreign light envy cigarette baby talk would speak mean call every nigga heart stay fact youembed hear walk whip girl huh snap upset feel without black please woo everywhere armadillo could favorite gunshot brillo look everything show cardi behalf sex crack never bathroom leave hey party back mine dirty watch dress day must mad
Roses ; benny blanco;Roses by benny blanco.txt;least damn coupe fool need fall news violet give young loose music heartbreak pick bitch check playin past-tense acid pop dead noose zit feelin ridicule bad real blanco neck call every plastic nigga red heart head truth blue bein sick wrld around roses thing time huh want rose uh ballin translationsturkcebenny lose inside past still rich ayy feel without shrooms father-havin end lie could maverick look show love see-through savage passion tragedy believe juice bastard leave trueembed anyone startin back face many hoe keep may day fuck trip true think
Roxanne ; Arizona Zervas;Roxanne by Arizona Zervas.txt;pay whole alright coast need ricky throw live chase thrill cocaine top malibu date drop line run shake bitch spending bobby nightembed chain player shorty nobu lake foreign la roof call fun though whip long food uh bake snappin ayy cash swipe money pic attitude woo goin goddamn roxanne poodle unless drive brr love fast crazy skrrt brake translationsturkceroxanne hill asshole never wait daddy party back night straight keep meet fuck issa think laugh shit
Rudolph The Red-Nosed Reindeer ; Gene Autry;Rudolph The Red-Nosed Reindeer by Gene Autry.txt;dasher even vixen poor christmas foggy dancer use bright game blitzen famous saw would call guide shout history wo nose lyricsyou join prancer ever eve recall glow cupid tonight shiny comet love reindeer glee never red-nosed rudolph names donner santa sleigh laugh
Ruin My Life ; Zara Larsson;Ruin My Life by Zara Larsson.txt;right sleep rain want hell wish life push baby miss leave bring freeze alone set heat back missin night could you-ooh-ooh world would lifeembed ruin edge fire translationsespanolruin start wrong close fuck handle think
Rule The World ; 2 Chainz;Rule The World by 2 Chainz.txt;lowkey happy even right hesitation walkin alright ice yee bubble break eye cover dawn cozy trap shoot last cold pray use share world top acre far trouble okay bottle separation brown bump chain e foldin skin pair bad real baby destination sorry way mean slappin call hitmaka chair truembed trophy matter ride around hair thing long always pussy everybody bow prepared cupid model prayin please patiently deep mill waitin shape could course blind wow reparation chainz place look uh-huh realize rule answer love skrrt mess prepare different pullin dedication never meal reaction navigation basic rode four lay back revelation night foot another smooth suitcase medication watch phone day fell shawty try home bust shit
Rumor ; Lee Brice;Rumor by Lee Brice.txt;crowd even right something bar shut round whatever deny give really last stir little honest it- stop ya song hold shoulder week baby talk hang rumor old girl together want roundyou motion still feel tap could two close crazy dance forever lay boy town night many floor keep feeling true try laugh
Run Rudolph Run ; Chuck Berry;Run Rudolph Run by Chuck Berry.txt;star doll christmas wet shoot cause got little far run electric guitar reel baby behind would sabre jet long girl sleep want whizzing rock merry-go-round roll please merry-go-roundyou mastermind away drink reindeer freeway randolph boy whiz town cry rudolph santa child hurry
Running Out Of Time ; Tyler The Creator;Running Out Of Time by Tyler The Creator.txt;fool minute secret need chill outta wave mask wash buck okay low stop tide ball work spin real lookin daw nigga actin head wade spell translationsespanolportuguespolskirunning lyin track find around time lose costume livin still save drift packin peace end park deep picture water yeahembed love fine pretend ah halloween back fifty target another keep runnin day fuck
Saint-Tropez ; Post Malone;Saint-Tropez by Post Malone.txt;list doin damn need whoa pitt give wrist advice buy stoppin hard bradley bitch bud fitch check ball price light boxer work holiday dick sorry abs translationsturkceespanolnederlandssaint-tropez roof call three fetus pumpin fist new vice wristembed matter time long bat girl five want meter mama ever rich hit ayy versace classic batmobile money bucket apology piss since goin waitin two wow six mille life necklace switch never hey official four abercrombie yacht bliss turnt another carat offish runnin saint-tropez day try understand shit
Same Yung Na ; Gunna;Same Yung Na by Gunna.txt;list flame cure chime need throw break phd young eye put white shine good sister mental shake blur mother confines slay father quit care vision skin sun light spin sorry half undertaker way speak call lace prescription blood jesus stay blue free doctor naembed always kid family car write bell glove ward telephone away place artery see-through hurt plain mind burning vein shoe ready never tend back high play try home
