title;artist;filename;lyrics
Remote Control ; Kanye West;Remote Control by Kanye West.txt;right court ceo spider shwabble-dabble-wabble-gabble tie remote big think lastin twilight give woah-woah wrist simply outta live caress flibba owe send shine game paparazzo drop fold gold god pop light craft feelin glob-glo-gab-galab hand lovely splendid new jesus delicious ask thirty-two titanic fight hoppin dime oj grab load fan brand hover time handstand sign sleep plan want door rock kid oh-woah still pole hah van please roll clothes die could blabba north mmh frozen love skrrt translationsturkceportuguesfrancaisremote mob blabembed mind strobe kind path instagram ha-ha-ha freeze hovercraft floatin control another boat sink med pocket righteous man mad laugh treat
Renegade ; Big Red Machine;Renegade by Big Red Machine.txt;crumble need baggage give really missile window cause hate nowhere timing stop carry damage talk would way weak hand future mightve anyway first stay fire history time translationsfrancaisespanolfrancaisturkceportuguesitalianodeutschrenegade long together want sharp somebody insensitive jag shape demolish tap blind squeeze everything love street open wouldnt anxiety piece renegade leave lay face night many dark shit
Repeat It ; Lil Tecca;Repeat It by Lil Tecca.txt;case everythin even swear census ice eatin cookin unresolved wet really tough turn trap put cold send mask minimum top problem taught drop good line okay hard bitch benz playin diamond check god price rolex fuckin dead light cap cut baby real neck facetime talk involve drippin gang nigga head new stay spell miami vega woah rest ride shooter time rapper jet sleep long bargain want always best tecca cartier ski still lil recall showin feel tonight gamble frame promoter cash money field domino less goin everywhere could wage house shop state look snow hype baguettes remember love gunna oh-oh drought york conceited repeat diamonds told ready leave itembed dollar style heartless face play mine stayin wind dress fuck makin shawty ta think home hair
Rich MF ; Trippie Redd;Rich MF by Trippie Redd.txt;og stomp grimy flame outer eat secret chopper gas think big nervous comfortable serve young hermes stutter spittin watchin really turn ridin stepper hour buy cutta last yo put pray trench herrera hood junkie currently tucker top bro snitchin game dripper cuban okay store bmf bitch queen hittin jt uberx catch shh fuckin dead opps bag sexy cut grow handsome way motherfucker gang brother ghetto call hang hitmaka nigga raise head new twin fact hatin land plus free quiet chanel link birkins tripper start track mf block around glocks shooter thing stain chris together scammer five best clap robber uh pussy ruger base family rich traffic lil hit niggas year roll rush respect dub end ig cop woo goin could tune maybach cougar current fourteen butler suburbans bless close earthling pew lambo meech herembed snitch love slump skrrt drum leechin servin life different curtain ah hollow cocky palace bang switch never overseas president translationsespanolportuguesrich hr haha thot splisher keep hoe baseline hallelujah teller tryna lunchable mothrfucker fuck josh cool man space tuck shit
Rich Off Pain ; Lil Baby Lil Durk;Rich Off Pain by Lil Baby Lil Durk.txt;heard right law damn slidin whole knife something swear truck deal position fame star solid auntie fall whatever teach deny break support young tough turn buy put hate pray use trench voice hood gotti far butter good run bottom scar degree forget pain amount song rain catch ball blame fuckin us hold g tnt saw scam win wild real baby lookin much husband reply way millionaires every nigga rough first new fist emotion rumor old strong stay free fight walk wrong track matter blog stain time bitchin complain impatient want murder uh mama lose kid ever still rich wonder niggas hit motivate please money field dying stealin draw lie everywhere die dog breakin address look crib million brabus jordan everything kill humbly show crazy pipe ho room loan tear yeah-yeah cat granny life servin growin correct bruh never miss leave school daddy relate back pack straight nothing rob hoe keep srts runnin phone tryna day fell mode ta teacher think sacrifice shit
Rich Shit ; YoungBoy Never Broke Again;Rich Shit by YoungBoy Never Broke Again.txt;even right pay slidin staff deal b need throw dracs mclaren slime road buy coat shot steel trench bro top pick tahoe line run bitch finna color stick pop pill us hold near work trick cut fam way motherfucker home call blick friday nigga left reach toe middle blue hitman late walk sight wo low-ky rookie find glocks time thursday sleep level want five side touchin door gunner pole rich hit nawf ta tonight roll money pound nine goin die drive million poppin swag rover show kill love lame-ass lit ho tear already guess draft smoke herembed pullin strip waste bang leave bring split bentley party driv another nothing play keep hoe mine beat day man highway shawty try stainless think shit
Richer ; Rod Wave;Richer by Rod Wave.txt;even something eat star fall give young point starve turn tax loadin triple cold put use chasin strap grindin th wake run bottom hard bitch benz check diamond daydream quit rack catch platinum pluto bag win uh-uh sack would flashback heat plaque gettin nigga friend new heart holdin yak thumbin rollies fight hear muscle som wo relax brand whippin et tuck want uh sit second youngin ever rich lil hit car niggas wonder cousin promise feel tesla please dresser respect money worst end since lie grrahembed mmh look million six else mmm love happen skrrt grr pourin flexin hunnid tear cetera nothin cappin chance reachin odds wrestler leave lotta back nothing keep dream hoe fake ayo beat day fuck brazy relaxin mm pressure think shit
Ride For You ; Meek Mill;Ride For You by Meek Mill.txt;list even condo turnin thorough monday pull sound really last tweakin pray use world shine ex date hennessy lot chain fuckin shorty us howlin feelin energy urus real baby way bill story call every hangin friday nigga heart pressed hear hoppin infinity block matter ride slide time instantly girl always motherfuckin mama still rich hit niggas feel respect bucket since deep die listen house westside view remember drivin kill love sky fly lit summer forever pullin diamonds introduce leave hot seoul relate patch another build wildin many keep fake phone tryna day fuck soul highway arm shit
Rise! ; Tyler The Creator;Rise! by Tyler The Creator.txt;rocket right something shut need dim reversin fall ten comfortable ladder sound eye watchin really terror yo merit credit yt tellin little top buck chart bottom forget carrot plug height ya disgruntled dead fuckin nah us vision ahead win cut baby flow allow vitiligo painful boycott talk involve way motherfucker sheriff nigga next chicago head compare hater michael stay hear start matter fan alike dedicate plase sleep want always tomorrow five ah-ha talent lose spring word niggas ahhh tippy-tippy-top feel da-da please cash presence paramedic sweat skip nine aim none woo could non-believers autumn look ceiling whenever close fill mom fall-off everything show punk love job crazy sky yet brake translationsportuguesrise hurt mind life blowin ah paris chance never guy miss tyler leave screamin style apparent embarrass watch wind pushin touch ba-buh-buh-duh-daiya pathetic rise sideline difference man fuck try ta understand shit
Rockin Around The Christmas Tree ; Brenda Lee;Rockin Around The Christmas Tree by Brenda Lee.txt;happy stop fashion ahh-ahh-ahh couple deck ooo holiday christmas dance bough merrily pie tree everyone way rockin party every later sentimental voice holly hung singing new pumpkin caroling old jolly feeling hear hop mistletoe ring ahh try spirit around hall
Rockin Around The Christmas Tree ; Justin Bieber;Rockin Around The Christmas Tree by Justin Bieber.txt;happy stop fashion voics couple deck holiday christmas bough merrily carol pie tree everyone way rockin party every later sentimental voice holly hung singing dancin new pumpkin old wayyou jolly feeling th hear hop mistletoe ring try spirit around carolling hall
Rockstar ; DaBaby;Rockstar by DaBaby.txt;even fool chopper pen gas need big push pull give somethin translationsturkceespanolrockstar young daughter solo really buy lopsided shoot last put cold yard hood refugee thirty wash drop suburban good wake horsepower run okay junior bitch front pain button check guitar glocky diamond pop catch fuckin hold g opps saw real baby spin facetime talk brother suv hundred nigga new nobody station earn hear chopembed block son guarantee ride slide pistol brand loot ptsd time twelve long codeine want always murder side cross bustin mama ballin lose flu chin ever hit car promise lamborghini write sethinthekitchen flip money bucket sweat cop woo goin dog two squeeze maybach hop rebound fill jersey kill love boom street soon drum rodman tear glock chop different smoke dennis nothin mop talkin enough ready leave detergent lay daddy hip back boy age thousand full play another keep safe watch air wind meet day rockstar fuck choose think
Rockstar In His Prime ; Juice WRLD;Rockstar In His Prime by Juice WRLD.txt;happy right alive deal ago downtime beg lair break paranoia really point hope limelight demon plot minus tellin insanity prime primetime punchin scar low bitch syrup god quit fuckin feelin sorry much people talk part hand gettin nigga friend chair confusing nobody fact start hear callin forgot wo fear ugly time want sittin trend uh everybody step lose comprehend pole rich pardon feel prayin year mention die thank ear translationsturkceespanolitalianorockstar drink laurent percs everything devil prayer kill fine fly anxiety hurt tear mind regardless pullin told hurtembed haha high nothing upper many keep watch wall sense trace timeless air tryna rockstar fuck soul saint understand
Rudolph The Red-Nosed Reindeer ; Gene Autry;Rudolph The Red-Nosed Reindeer by Gene Autry.txt;dasher even vixen poor christmas foggy dancer use bright game blitzen famous saw would call guide shout history wo nose lyricsyou join prancer ever eve recall glow cupid tonight shiny comet love reindeer glee never red-nosed rudolph names donner santa sleigh laugh
Ruff Ryders Anthem ; DMX;Ruff Ryders Anthem by DMX.txt;right something shut round funny gots hear move maintain pull give break cage stand point paper alone anymore yo put crime cheap shot got drop run bone dawg bitch handle spit pain slave stop rain catch dismantle resort fuckin rape us dead nosy slick lem saw light swayze vapor departed ruff baby bed easily brave unsolved people talk way lady mean caper motherfucker clown gettin brain nigga ryders weight ape actin red head new hungry next ask holdin start wrong green walk wishin history find ugly time want murder bustin uh ravine candle pussy door wonder niggas rid ta feel roll flip money tryin lie goin raw die dog two shop look kick ground rip show rhyme crazy boom open scene groove york kiss mind tape violence guess nothin talkin bitch-ass mystery never anthem pitiful leave business shoulda split dearly four-four style crew rob another roam floor keep silence watch runnin grave blow meet fuck prove try grape wild think home bust shit
Rumors ; Lizzo;Rumors by Lizzo.txt;doin even turnin groupie sue read big news teach somethin give break ten coochie ratchet live loose cleanse music last woman bamboo realer use hmm top ex record okay ha bitch ya pop buyin calm drake cut baby smoothie people talk would freaky mean hangin nigga hater nobody rumor nda lizzo hear sick post fcc around blog culture time girl huh readin uh rock pole focus hit body year los black roll since woo goin lie listen goddamn two house internt bronx look million poppin sheeshembed boob stream show love yet cardi language diet summer believe lip talkin goal never overseas wait school machine hat hoe keep watch fake runnin blow translationsturkceespanolportuguesrumors tryna cool fuck spendin true soul lock think shit
Run (Taylors Version) (From The Vault) ; Taylor Swift;Run (Taylors Version) (From The Vault) by Taylor Swift.txt;law darling apart give eye locket translationsfrancaisespanolportuguestaylor paper chase shot run ft. chain care us hold runembed hundred three friend note heart blue reason around thing time reflect car write frame try since could two picture ed away hole drive view else sky version throat tear so-called taylor piece never bring leave wait onto four sing sleeve back key town keep dark sheeran pocket swift pale child laugh
Run It Up ; Lil Tjay;Run It Up by Lil Tjay.txt;doin stuff stupid funny discuss bubble corner wrist sound really tough marathon security trench drac world top far ring spit check board pop dust asleep hitter wide riot gang dice mosh though jodeci noggin rust girl trend bow vvs draw woo goin ethika diggin flex kick stream grr swangin p toe-to-toe kickin hot stout bend hidin runnin tryna carry-on ta cup bar suck give protect young stand glitter shot city wake band diamond stop chain diploma hold opps pinky portfolio drippin heat bah thinkin puttin hatin block beef screw sleep legal daytona hit ovo bos lamborghini oversleep petrol herringbone look dude breed show street kobe comin sum different nothin business pit bentley wakin nope notary r fuck man true mm shit star evrything tip need c turn goalie buy shoot put richard bro dumb butter chart th good run stack win doley baby way call nigga defeat head hearin woah huh circle help lose mall still lil niggas body money hunnids end j movin ground love versus ho flexin piece singin double talkin never crutch smooth earrings pocket must schoolhouse lock mad bust sold tag whole gas route fall break name paper hood masterpiece texaco honest bitch thuggin renter upembed rack us flight gangster beefin ghetto hater one-fifty eraser start muscle fresh slide time uh kid clutchin die morning gut water grrah breath glock hunnid mille growin arizona bang enough switch hey back boy build bagg patek keep wall claimin beat
Run Rudolph Run ; Chuck Berry;Run Rudolph Run by Chuck Berry.txt;star doll christmas wet shoot cause got little far run electric guitar reel baby behind would sabre jet long girl sleep want whizzing rock merry-go-round roll please merry-go-roundyou mastermind away drink reindeer freeway randolph boy whiz town cry rudolph santa child hurry
RunItUp ; Tyler The Creator;RunItUp by Tyler The Creator.txt;notice right beyond damn pay fuzz scream funny need dim grin nervous ten act somethin stand live really music send g-olf gumballs dumb clear run okay sprint roach bitch bluefin lot check upembed rack catch dead us hold nah skin wire limit transmission baby today rap talk speak story scope dreamin clearing tee hum kitchen nigga reach actin dish felt lightin blue fire hear green fear peak reason gangsta whippin want always tomorrow help dope alienate kid ever hit niggas deaf leap translationsportuguesrunitup bunnyhop tire since woo politician two starin confidence phew-phew-phew look ceiling water second-guess sky anxiety background throat photo room nuisance moonwalk ah talkin nothin never school crosshairs cloud face bend high boat nuance treat hoe zoom dirty runnin spend tryna cool fuck unagi true mode fiends goblin think shit
Sad Beautiful Tragic (Taylors Version) ; Taylor Swift;Sad Beautiful Tragic (Taylors Version) by Taylor Swift.txt;right breakdown train darling whoa warm give locket stand fix beautiful demon little lonely city good wake affairyou run distance us forditas bed mean hang note late fight tragic conversation track time long girl translationsportuguesespanoltaylor word erase sweet w deep listen could magyar hopeful look sad love version affair kiss taylor life different handwritten wait magic back face ther dream silence pocket meet swift try polskiturkcesad
Sad Girlz Luv Money ; Amaarae;Sad Girlz Luv Money by Amaarae.txt;right finesser truck pay ko-lo bar booboo star cancel need dey ten give solo outta pace advice young really frequency paper alone turn po-po put benji race pick drop record bitch front ya song bad baby evident spice dolla talk luv bill da-la way lockdown spinnin call muggin nigga left bank though first shit michael mula-la-la-la king start walk frank around time long plan want somebody askin uh girlz mama odo still lil rid feel body tonight jackson please low-low kinda money maker whine since crown could movin two flex sad lambo love mmm dancing knockin moonwalk already life singin dance nice reckless favor grind leave wait kelz da dollar party back count control rim night moliy straight play nothing hoe dj fake phone day fuck man shawty space braid
Same Boat ; Zac Brown Band;Same Boat by Zac Brown Band.txt;star give hope fix rockin shot wonderin share little ship hide good run judge broke peacefully boatembed mile hopin heart truth country walk wishin around time help fishin somebody hell disagree peach money tryin overboard could knock hole agree kick love spread believe nice nothin shoe mistake float back boat keep man ta
Sand In My Boots ; Morgan Wallen;Sand In My Boots by Morgan Wallen.txt;right damn bar pothole star sunburnt maybe wing beach somethin dodge tree shoot little boot bottom sand cowboys hold whiskey headin eastern way hand root tequila flip-flops dogwood red ask aw blue shelf walk heart-broke huh girl wad still mornin tennessee perfect somewhere outside bootsyou drink look water show knoxville love sky crazy kiss talkin never leave bring back town desperado lov accent silverado meet try hiddin think home
Santa Ba; by Eartha Kitt;Santa Baby by Eartha Kitt.txt;list need dear christmas decoration chimney really tree buy x angel little good line trim ring honey forget lot check light platinum baby stock convertible mean fun next blue fella tiffany thing sign girl want tonightembed tonight year deed mention could awful slip fill kiss sable believe miss cutie wait duplex yacht mine phone santa hurry think
Santa Claus Is Comin To Town ; Jackson 5;Santa Claus Is Comin To Town by Jackson 5.txt;list doll curly-haired coo twice tootle tin little good check woo-hoo kiddie bad townembed goodness naughty find time sleep elephant rooty-toot-toot car toy rump-a-tum-tums pout sake drum comin nice awake town boat cry watch better horn santa claus
Santa Tell Me ; Ariana Grande;Santa Tell Me by Ariana Grande.txt;tumaczenie need fall christmas give really alone road cold fling th wake mood blast hard lyrics care hold smart someone baby oh-woo-oh fireplace grande every next heart new fire woah translationsespanolportuguesfrancaisariana walk wo around want side focus year away snow beside love room avoid broken yearembed polskie boy night play feeling day cool mistletoe santa true fell try think
Savage Love (Laxed - Siren Beat) ; Jawsh 685;Savage Love (Laxed - Siren Beat) by Jawsh 685.txt;even give break back-to-back hope laxed creepin use angel ex wake loveembed run jason ya care baby lookin would way till every heart stay usually la-la-la-la lover find reason around girl want somebody still feel without fallin derulo single cash siren could two keepin love fast translationsturkcesavage savage comin kiss lo-lo-love ah forever never leave back night air beat lovin spend meet day fuck makin try lock think karma
Save Your Tears ; The Weeknd;Save Your Tears by The Weeknd.txt;happy fall apart break eye surprise teardrop run care catch saw crowded someone much would heart stay ask late walk wo thing time girl always uh second past na-na save single could away look realize translationsturkceespanolportuguespolskideutschfrancaisshqipsave love deserve room pretend tear ah dance never back another mine cry day fell think
Scoop ; Lil Nas;Scoop by Lil Nas.txt;lopez right stupid eat stone somthing think big need grrr ten name wrist payoff really cheek nasarati overtime daily ex okay ol tight bitch hittin apologize fuckin work feelin baby dick lookin sorry jennifer call motherfucker kitchen nigga ask blue gun workin wo ni-i-ight scoop tomorrow sit disrespect reharsals ever hit lil body pilate sure veneer bumpin goin cake movin look crib kick rip d-d-daytrip translationsespanolportuguesdeutschscoop crazy skrrt fly forehead ah talkin chance miss leave hey bentley back face watch phone tryna li-i-ie day fuck chit-chat understand shit
Scorpio ; Moneybagg Yo;Scorpio by Moneybagg Yo.txt;right role damn probably fool easy solid tie mad gots aggressive give type sneaky number really yes turn possessive oh-oh-oh nut month twice last cold worse shot zamn violate tellin game exit wake good hard honey scar low care second-guessin fuckin stack october opps salt work win energy uh-uh cut continue much situation talk freaky droppin story pam horoscope nigga trauma first next heart sellin commit old ask youembed woah bein block find around soft thing time motive want sittin inside rock past hit car birthday body save cook single spinned splurge goin sayin bite outside movin shop look jealous dude doubt figure vibe show love fast ho hurt summer sex guess scorpio lip talkin instagram screen nothin bestie minnesota back boy hr haha night play bagg hoe mine dream tryna stubborn day small fuck makin try think karma
Screwin ; Summer Walker;Screwin by Summer Walker.txt;doin right neat minute b suck need blanket big beg stretch throw bit pull type rubbin somethin freak give shoot worthy babe hate missin ambidextrous little dumb peep good nowembed okay invention stupid-in-love fuckin camera screwin trustin bad energy baby dick wide freaky would way call excuse every hundred nigga ego ooh-ooh-ooh-ooh great though next head new relationship fact intake callin bein brand time want folk engine leg pussy sit worry pardon body please woo permission sayin especially bettr pleasure alter swag show love open sometimes language hydro-suspension comin mind translationsportuguesscrewin spread different discreet messy high straight play mine better fuck obnoxious pump mode ta hurry toxic bust shit
Seeing Green ; Nicki Minaj Drake;Seeing Green by Nicki Minaj Drake.txt;doin el vixen corporate mio distant number live sandal camden woman mask onika dawg ya video trust vision ymcmb bad cap real riot tv sock flee though fact lisa channel king walk nicki fan girl atlanta want propaganda subbin booty ocean daisy vanilla big-ass balenciaga clean none tune oliver close happen room mob already life dance nice bringin putin hot hip bae machine pack flag tryna canada hypin airport offends ta tattoo wallet even extra bar convince ice garage greedy deny give young stand bop-bop-bop-bop-bop nina lion cause shot league city gate scar ball hold g capsule drake boo supply damage bikini drippin teddy stephen amongst seat art new jesus frio plus blue free country bein track around maserati brand candle door word hit bear sirembed eagle year translationsenglishseeing mornin since deep could drive clip private street lit g-o-d margherita different stunt shoe screen rinse serene parmesan panda straight play meeting glass blow dramatic fuck man makin try change shit star solid need brolic beach frolic lean pull c forty-eight wet dodge prison yes momma buy put cinderella garlic use gat cita good thirsty dig run sand spirit drama queen pizza god stickin pandemic cock dee tarantula blicky person flannel husband homework call boys plaque papa heart land team green stand-in relapse son meniscus afford luxury facade tall drizzy lose p. ever still lil niggas ayy pearly promise cash set money killer cop slice alcoholics jersey duke badonkadonk k-i-n-g ho cat seein torn arena hm talkin g.o.a.t giant never mirage screamin leave bluffin crutch silent key foot hoe floor fake lovin backyard prove opp think g.o.a.t. tunechi minute big move somethin shark graffiti wore white send angel minaj hmm wash game trouble rushin bitch peein suite stick visit talk hand fun first next copy doubletree standout ask start eight wo matter either thing time socially step tick-tockin kall car ross crash huggin lee maraj two house knock vacuum peril mistress water six dios fiend scene cmb diet chico b-boy gucci bathroom back face keep wall ayo beat toothbrush day meet soul smokin k
Session 33 ; Summer Walker;Session 33 by Summer Walker.txt;swear funny ice move timeyou name refuse alone cold game good wake record playin wastin rain continue translationsportuguessession dick almost way call walk dime wo time jet long girl lose family ever wonder car takin try toy end since could two house tired drive six beside vibe private else scene mind life pf drip layin leave match lay back play keep trip child change think home shit
Settling Down ; Miranda Lambert;Settling Down by Miranda Lambert.txt;picket sunset marigold sunday lean give fence hometown homing babe send wrap little world lonely pigeon rain way happiness driveway jet-set kitchen friday head heart stay around caravan girl oohembed settlin settle garden park direction goin could morning empty tile look love couple comfort escape bare wait plant cloud flower foot rainbow question pretty highway child wild
Sharing Locations ; Meek Mill;Sharing Locations by Meek Mill.txt;even train accident cove gofund royce big nervous pull give versuz order swervin ridin nba buy last verse yo owe send ghost voice little hood murderer bro worth hide location mac run store translationsespanolportuguesfrancaissharing hard famous bitch check kj stick diamond hittin ball rack pop song hearse fuckin pill nick shorty stickin bad baby lookin much hitter way murderersembed purse call gang hang brother nigga new sellin emotion puttin fact gun block cursive slide time hero atlanta lawyer together trash pussy foursome inside kid mall ever traffic lil takin durkio roll cash hunnids perfect killer goin lie raw die two donuts look homicide birkin percs louis show copper rank hunnid payin mind jeweler p nothin soho never bring leave purpose worried weirdos exposin sharin bae anniversary boy blastin high play pop-up slap fake contract tryna papz man fuck think shit
