title;artist;filename;lyrics
Lets Go Dancin (ooh La La La) ; Kool;Lets Go Dancin (ooh La La La) by Kool.txt;happy right occasion name sudden dancin good check jt light feelin la baby people call start hear acquaint ride join likehey eh feel park could everything fine lyricsooh scene special shoe miss hey sing jam missis dark reggae man
Lets Groove ; Earth Wind;Lets Groove by Earth Wind.txt;right glide among alright move give sound fuse stand share little good okay ya god light heaven baby spice start sight find time sign girl want boogie lose tonight set peace alrightembed uh-oh-uh tune favorite look slice love sky happen groove hey-yeah mind life shoe cloud play upon floor dj ta
Lets Hang On ; Barry Manilow;Lets Hang On by Barry Manilow.txt;pay shut fortune turnin tie wish need bit give break stand burnin little good anything dyin lot lyricsthere diamond ya quit price chuck us hold baby behind would hand call hang heart stay bind girl cryin door second gotembed love open never ohh leave lotta patch regret cool likethere true arm chip think
Little Darlin ; Sheila UNCERTAIN;Little Darlin by Sheila UNCERTAIN.txt;love-ah ya soon ho hold need ah dear-ah never ohh hey please hand call grand darlin little way-ah mine youembed wrong-ah wrong lover likeno try love
Living Eyes ; Bee Gees;Living Eyes by Bee Gees.txt;right alive miracle move fall deny eye live pray world shine far loveembed rain sun heaven analyze would war heart holdin reason moment time tomorrow still bear away state earth love destiny mind yesterday believe forever never leave arrive magic age face keep mine cry dream power day soul beginning
Lonely Nights ; Bryan Adams;Lonely Nights by Bryan Adams.txt;lyricsoh care breath alright uh chooser win reputation ah eh word baby save stand likebaby way anymore fair ehembed every lie night sayin another thinkin loser lonely may good hear risk beggar
Love Come Down ; Evelyn King;Love Come Down by Evelyn King.txt;sleep force help hold shoo inside baby feel without downembed way please thief last dit night heart dream spell danger sight doo tight around love tender
Love In Store ; Fleetwood Mac;Love In Store by Fleetwood Mac.txt;instead special melt beggin ever scar baby feel never lift bring way anymore awayembed since could felt away look fight whenever store around love
Love In The First Degree ; Alabama;Love In The First Degree by Alabama.txt;ago beg throw prison crime babe degree defenseless plea catch ahead baby would tempted fancy-free first though guilty walk time long want mercy inside door footloose gamble perfect away place book love simple degreeembed never leave key thousand seem decision man lock think
Love Is Alright Tonite ; Rick Springfield;Love Is Alright Tonite by Rick Springfield.txt;alright minute fall lyricsi hope hour world pick trouble hard stop hold work brink baby respectable working though wo incredible sleep together second worry livin tonightembed feel likedo tonight everyone goin sayin crawl dog class tho love crazy sky tonite daddy night power feeling think home
Love Is In Control (Finger On The Trigger) ; Donna Summer;Love Is In Control (Finger On The Trigger) by Donna Summer.txt;right big name number pace trigger explode shot use game good line catch saw sun win baby sweetness hang every fun raise heart stay gun fire sight walk wo around load time girl best mama inside hit ta bullet aim since begin morning away til love range twenty finger guess life different smoke ready never miss leave control target high safety likewell blow better superbullet soul change risk understand
Love Is Like A Rock ; Donnie Iris;Love Is Like A Rock by Donnie Iris.txt;stop nature doctor rely lawyer rock ah superstition never rockyou lyricslove paycheck depend politician preacher teacher mother love
Love Me Tomorrow ; Chicago;Love Me Tomorrow by Chicago.txt;want tomorrow always yesterdayembed need life yesterday carry word promise today much tonight dawn part please alone wait back cold night could though lonely wo sad hurry home love
Love Or Let Me Be Lonely ; Paul Davis;Love Or Let Me Be Lonely by Paul Davis.txt;time nature want room find without live lyricslove part way please leave hey defy gloom completely stayyou wash truly mine lonely stay away day wo doo either mother love
Love Plus One ; Haircut One Hundred;Love Plus One by Haircut One Hundred.txt;right ah-yah-yah-yah-yah-yah bold ah-yah-yah-yah-yah-yah-yah-yah lake la-la give quite without lyricsi oneembed likelove call goodbye plus may good ring fear soul love
Love Will Turn You Around ; Kenny Rogers;Love Will Turn You Around by Kenny Rogers.txt;right gentle believing need move give live turn last later cause shot share thought deliver hide run sooner care catch trick real talk reach heart aroundembed stay blue everytime wheel start wo around lyricsyou time burn sign plan inside shiver away drive living love fast mind life believer never leave knee keep persuader dark man likehow think dreamer
Loveline ; Dr Hook;Loveline by Dr Hook.txt;whole need break number likebaby window world lonely line shake rain hold someone baby lyricsif much mean call though heart loveline time girl want no-one sit oooh ever wonder feel sad lifeline remember fine wherever mind lifelineembed rainbow phone understands think
Loves Been A Little Bit Hard On Me ; Juice Newton;Loves Been A Little Bit Hard On Me by Juice Newton.txt;meembed right ya side calm slight light ashamed bit much lyricsi year hopeless mean romance shy shade back thousand nothing little away touch dark likewell remember close hard child fear love
Loving You ; Chris Rea;Loving You by Chris Rea.txt;fry easy believing sound wet bar-talk little lyricsthe rain take-away way mean thunder time always doyou french take-home smile car black weekend away drink strain love street life leave all-night wait bourbon back night another dream wind spend day spray man think laugh
Luanne ; Foreigner;Luanne by Foreigner.txt;whole someway need someday give send little hide run hard luanne much half call hear find around want inside search word feel write whisper somewhere away look slip close beside love chance never wait school luanneembed town keep mine meet day true prove letter understand
Machinery ; Sheena Easton;Machinery by Sheena Easton.txt;something give eye tatter machinery refuse fading run fever shatter moonlight closer sigh reflection red stay truth thing hell inside innocence xembed hurricane hit feel illusion peace deep reduce ground sky piece behave believe gain wait hot goner night breathe power hitting pale beginning ta
Make A Move On Me ; Olivia Newton-John;Make A Move On Me by Olivia Newton-John.txt;move eye worth nowhere speech baby wide way heart free hear start wo time plan want side word tonight spare single charm surely open waitembed carefully wait thousand another touch pretty arm
Make Believe ; Toto;Make Believe by Toto.txt;anyhow pouring alone shine hide rain hold crimson lookin sorry people way hand hang gettin blue lover matter time always inside ever could pretendin moon away place separate love lead mind summer believe kind waste never rememberin evening wind blow day meet must change
Make Up Your Mind ; Aurra;Make Up Your Mind by Aurra.txt;honesty something follow whoa really cause little problem clear satisfy stop insane baby decide way likewhy strange confuse heart start wrong thing time mistreat want always lyricswhy word wonder feel sure timeembed drive look love sometimes action mind waste never wait another play keep feeling must change
Making Love ; Roberta Flack;Making Love by Roberta Flack.txt;thing sometimes mend us oohembed life break enough feel never confusion neither live would survive heart strong touch feeling good close remember likeand think change love
Mama Used To Say ; Junior;Mama Used To Say by Junior.txt;act young live use mass line hold cut grow pass would old ask fight time sayembed girl want mama year enjoy rush could mommy away life grown-ups hey back boy age small recognize stride man understand
Man On The Corner ; Genesis;Man On The Corner by Genesis.txt;something need move corner somethin lonely hard care every showembed lyricssee nobody shout rest monkey everywhere listen place look everything show love fast hiding lead enough likejust leave wait back nothing day man
Man On Your Mind ; Little River Band;Man On Your Mind by Little River Band.txt;even something goodbyeembed sunk fall name lyricsi really chinese last later liner use ship game hide lot sooner betray shoulder baby till inch goodbye free fight hear start sea rest find junk ever ocean word ta feel write please set rift adrift could blind listen away slip show love pipe happen already mind guess life castaway believe forever never float likeit face night boat dream foolin day man true weight change think
Maneater ; Daryl Hall John Oates;Maneater by Daryl Hall John Oates.txt;pay apart lean type eye really woman deadly maneater world far tame would new hungry heart free matter door sit chew beast maneaterembed money woo could jaguar rip beauty love oh-oh mind purr whoa-oh she-cat wait boy night nothing many watch man wild think
Mega Force ; 707;Mega Force by 707.txt;even hook swear force dryer easy obvious vertigo deck pull type card name beaut finally live epic unfortunately mega verse put cause x use race epidemic zeppelin facebook game far worth artists line run degree dead dare light metaphor continue mile parodied ace effort leader every cope squash great first sahara seat heart megaladon stay truth start career post lord matter rarity moment rapper feint step repping smile still wonder hit misfortune single enjoy less closely paint since listen bite course could approach simile state place look view nowadays rhyme job megastar dessert repatuar summer life guess iv microscope vein waste debut status leave epicenter wait mistake magic lay night seem butt keep may service beat tryna day fuck shit
