title;artist;lyrics;filename
Soldier;Destinys Child;runnin zone name mouth beatin rude grill soldier ta clean call map harlem keep hide five-deep hard heart run love street us leanin go hood provide wave try stack quick 'll say chiefin slang flip life camouflaged white bandanna type care b snatch give time gleamin speaker ooh weezy f. paint low blend put back leather impala outta good would chest d-boy get vibratin toy know guy puttin chrome three screamin mean b.k east one cash nothin takin lyric jean phone salute low-cut always please freeway hot hear less beat mind attraction wheel scar army need kind mark `` next 'lacs ai caesar tie eye king poppin holla carat beyonce 'chelle may boys see embed might around lookin g wit coast right dough girl change quakin also money comin war ya boy ridin tell body na reform sergeant kelly tonight strong spend bottom spittin tellin league thigh purple 'm like way use block open 'em mami 's tryin homie 'lac deep still '' credibility rollin candy even checkin sound baby shoot wan hey thing top feelin walk troop special walkin want country status look dicky kick inside trunk subway stand reason join lames trap well big n't whip every talkin carry take gs plus c'mon girls;Soldier by Destinys Child.txt
Solitaire;Clay Aiken;keep heart play love go 'll say sleepless come life everywhere care easy indifference x chorus lyricssolitaire back oh game pretend die always ...... without little lose town unshared eye embed might around silence man also lonely break unspoken close road day night likea 's end never hope smoke much every another take solitaire;Solitaire by Clay Aiken.txt
Some Beach;Blake Shelton;umbrella something senioritas drill grow bird dancing late singing somewhere needle run go try lot romance gum cold say 'll somewhereyou rage empty come flip cruise give cast old chair novocain fine back smile finally lover get youre pull seem start lyric phone margaritaville mercedes likeembed yell hot cell drive stop mind attitude find burn tooth palm long interstate benz beside parking hair air wait room might car man cigar two right beautiful truck shade also wrong stick tree ready foreign nowhere atmosphere talk thirty road blowing circle day like music dude 's deep doc could feel enough even thing salty sit park minute spot dark sunset beach warm big afternoon whip margarita picture breeze nurse numb;Some Beach by Blake Shelton.txt
Some Cut;Trillville;dress player anyway mouth grill something unique drill call mr. side follow turn play front run go love skin lay hood juggle try second exchange hook doom 'll say ball yeah suck shit pimp breath let give time 've wall delicious doctor slip staller dekalb ah later head almond south back super teddy oh good would thick get kill think real pussy bend know one freak meet seem fuck legion lyric phone taste mall dig dick hot beat step kiss buiseness deal til gut leg law saw ai eye chill drawer melt bust knew hill lady certify viscious fall air first busting brown room see damn might met around embed pretty g smack funkadelic right serious number show also petite delirious someting boy joy rub tell week na tonight wo ville home catch cause maybe really thigh day like 'm limit way jaw lovely monkey fo 's ceiling i'mma behind straight '' bone breaking recall sho' could even feel shut trill baby friend miss wan tear nut business bus tongue bitch draw want look hand stay cut holler drop well every n't take smell ho nigga;Some Cut by Trillville.txt
Some Girls (Dance With Women);JC Chasez;whoa full woman name hold lap ta equal keep love go boom fun girlfriend sexy try come yeah throw begin attention let waitress nice people wall young speaker ooh slow finish back mingle race oh game get kill appeal real know order peel freak 'cause lyric club hot gon legal step sip crew kiss uh single deal doubt hunt wheel make find mama mouse mark chill roll approach everyone see might knowing beautiful right girl tryna show also ya table drink spin ready body na soda though shake grab home babe whose playfulness like 'm night pose 'em rollembed mami 's ceiling work dance feel door baby wan many thing feelin business hinge cat watch movin draw look kick charge glass minute spot blow luck n't move hip send take pass;Some Girls (Dance With Women) by JC Chasez.txt
Somebody;Reba McEntire;shop face keep somewhere love egg say diner life joke search laugh give waitress 've coffee oh morning forget one blue-eyed instead lyric fill ca wonder today always likeembed stranger make broadway `` across next town saw eye long fall train wait see might car two right girl also ready tell everyday somebodyyou talk maybe really cup somebody day floor 's elevator 're '' never read friendly could usually thing happen miss small walk bring look crowded paper 'd n't another future moment;Somebody by Reba McEntire.txt
Somebody Told Me;The Killers;name something rumor leave go girlfriend try pace say seventeen let a-rushing 've moonlight back oh game get think know year blink 'cause lyric please heaven aroundembed without ai confidential rush boyfriend roll toll might around track also ruin break ready tell place ooh-ooh tonight last maybe close somebody 'm like february anything new 's never onto baby miss bring want look potential 'd well n't take;Somebody Told Me by The Killers.txt
Someday;Nickelback;anyway late turn play hollywood try story wish lately say unpack let fit rewrite 've fist think know one paperback instead lyric sign wonder always gon nothing make need long since see might right novel also wrong table somehow na suitcase unclench like 'm whenembed 's end 're hell hope horror could wind miss thing much stay able 'd well n't someday;Someday by Nickelback.txt
Something Happened On The Way To Heaven;Deborah Cox;hold something hide side leave run love go say 'less come life likethey let someone unless time 've back oh good would get know ca please heaven lyricswe rather need lose sorry believe answer embed might 'til right also wrong problem yes 'm way bad 're could baby happen many want stay 'd well n't take;Something Happened On The Way To Heaven by Deborah Cox.txt
Songs About Rain;Gary Allan;georgia name keep play love go wish 'll come let hit easy wherever playin oh would rain morning blame get think mood know early lyric feeling today likeembed gon drive sure heard nothing sunny kind town rainy ai help eye might around car two right also pain lonely radio na ease tonight last cause maybe close circle day 'm like way night unknown new 's nobody cry '' hope never 're could song baby guess hey blue rainyou want look kentucky reason well n't picture;Songs About Rain by Gary Allan.txt
Sorry 2004;Ruben Studdard;fallin weekend oooooooooooooohhhhhhh shot propose wooooooooh heart chance love go try november 'll say ball come fast yeah clear tub hit give june case time 've strip get forget real year one million lyric lie club gon hot oooh build kiss make house lose july sorry ai roof september hair stayin may weekday damn embed december might august gift girl change also wrong october drink ready tell na bottom cause babe ring dont 'm like way night new 's mess 're word apologize door miss thing much want stage hurt drop n't take asleep 'till;Sorry 2004 by Ruben Studdard.txt
Southside;Lloyd;georgia daily hide yah side alone cadillac leave thugging doggin go oooh-oh-no hood lot safely seat yo 'll string come yeah pick daddy jersey care let ride people yeah-yeah low chicken put back south oh would good eat get know three meet mean coo lyric heh lie baby-baby-baby everything hear yeah-yeah-yeah mah stop sure southside nothing make need worry wear midnight ai long chill wann hang gotchu roll see tha might embed goin wit atl man tryna yeah-eeh-yeah girl understand money show also ya boy bull break ready tell place georgetown though tonight wo swear home cause babe oh-oh-oh-ooh-oh-oh-oh 'm like use way tilt shorty no-no-no 's still rock 're never word hoyas ooooh-oooh-oooh-oooh-hooh-hoh-ooooh-oooooh baby thing hoodbug world want alright no-ooh-hooh country braid kick hurt hating wing n't take eh-eeh-eh anywhere;Southside by Lloyd.txt
Splash Waterfalls;Ludacris UNCERTAIN;doggy light name freaky gucci sweet ta babyface call pearl keep follow turn heart ram love go wrap drum lot visionary mack quick rope sheet string say ball come fast throw shit let smackin give nice fingertip coffee flick head purchase slow low meee back dinner stuff good sake game blame actin fact broad get jabberjaws handcuff makin know unite one ex grabbin meet fuck nothin lyric froggy plan hear drive orgasms kiss make babycakes sack need find missionary favorite ai tie sandy style cupid lady waterfall dick-tionary standin shed scream embed might family toe splash straighten ohhhh right girl also stick somethin beating ya pain sun y'all wild relax tell na candlelight grab da last nasty cause lickin ring 'm like glad night frame 'em holdin fo 's tryin finer bad nobody 're diamond feel moon wan thing grand whipped world fussin want together eatin hand buy scratch fight cussin every n't ahold attach plus nigga spendin designer bout;Splash Waterfalls by Ludacris UNCERTAIN.txt
Stacys Mom;Fountains Of Wayne;grow fantasy waited love go try say come give ... 've slip school lawn back mow get pool think know guy lyric ca little star `` stacys long hang since wait see stacy might around goin girl also wrong boy mom tell dad with- trip 'm remember use like way ah-oh-ah-oh 's momembed 're '' could baby miss walk business want towel minute spot n't;Stacys Mom by Fountains Of Wayne.txt
Stand Up;Ludacris;full dress chong shot v.i.p mouth something quit late owner whoop marshal outside us go hickey sort say coordinate come yeah life bras lit care let someone waitress time strap young people reckless tomorrow away ah put back midget chest thick get think one mean million pull goddamn fuck lyric security breast club ca fire today gon sure beat step gun uh nothing little scar dj foot worry bottle buck ai heat necklace hang rush huddle cheech lady blaow damn see embed might become note smoking two right truck girl also show wrong id y'all drink mugging clothes wild break tell promise part na party ceo tonight chi-ali ahh cause like 'm way louis use piss new 's brand mess work luda hell already dance diamond harder feel shut song pant friend moon door hey wan tear bitch watch bring want look system fight stand cut vuitton reason spill big move n't another carry smell take pass medallion;Stand Up by Ludacris.txt
Stays In Mexico;Toby Keith;name tequila ta call love go gate dakota grade lot salesman say heavy ever let time 've bar school shower south back arizona oh would okay morning ocean get real know one meet bite start lyric everything hot kid mind terminal little make `` mexico sioux parking check fall first cantina wait might cabo right also devil telephone drink steve mexicoembed home gina babe remember jump like 'm plane line 's hop wabo 're never cross dance '' enough teacher wife miss thing happen hey walk dirty chew climb stay beach spill n't margarita insurance swim wake phoenix;Stays In Mexico by Toby Keith.txt
Step In The Name Of Love;R Kelly;full name tough keep side youembed follow play love go us story 'll come yeah everybody slide we'll ever let hit give ... time people round listen rockin old whole finish put back rain game thank lover know year puttin remain lyric club gon steppin' step separate little dj make forever believe uncle similar sing since see might around girl change also joy sun spin tell aight ohh na henry steppin last cause dip dedicate anybody rule like line frame fashion 's still 're cross thousand word song clap baby wan many ask world want bring together every move mountain picture;Step In The Name Of Love by R Kelly.txt
Still Frame;Trapt;drift hold keep hard us go portray say empty ever time 've people young away old finally get think fuck start lyric afraid ca cover please everything make save need lose help reflection believe fall frozen see might hourglass also confession break na clock cause really figure 'm like way frame farther learn far 's still 're could wan small inside stand every n't future tick picture image downembed;Still Frame by Trapt.txt
Still In Love;Teena Marie;remix face grill call side leave love class go sore blaze sexy 'll else rep come yeah life everywhere let lovin original time 've ah fa admit fool oh okay get real know year west one cash squeeze lyric cool loving please dona hear gon free voice uh im rather teena feenin heat long eye chill holla honey lady sista scream see seven might stir beautiful right money also chemistry main situation y'all tell sight mix place upon na tonight sistas atmosphere cmc marie closer dear cup 'm like magic crib must joint 's nobody still quite 're never ago upembed feel enough baby thing fly look left sheezy n't take sugar hoo la mama sound;Still In Love by Teena Marie.txt
Storm;Lenny Kravitz;average umbrella mac judge call keep broads heart leave love hood try rap 'll heavy come shit life god depth pimp search hit test running 've kravitz young away ugly fresh head armor bounce smart back brooklyn leather good rain get bomber think grace know karma one deceptively lyric art fire momma heaven less planet angel lefty foot find make star lucky homies forever eye long check beyond embed might thought water wit ground also wrong charm boy sleep yes strong close wet hustle 'm like shoulder storm pray night flashy open pop far budge 's cloud homie bad still 're hope deadly could loud wind earth walk lenny want bless drop warm trap n't take hov;Storm by Lenny Kravitz.txt
Stunt 101;G Unit;tension full hoe blinging light zone ten r mac twenty-four ashy r.i.p basement keep nikes hard maybach front love street lay us go hood tour lot decorate rap dreaming point yo 'll say psycho cold come yeah throw everybody ice white suggest blunt jersey care fit stuntembed time 've six fresh reach school mic trouble old low different back fool roc v good demand game ten-a-key dog suppose get mad box know rebirth one squeeze cash scheme smoke-gray reebok fuck pull lyric bentley feature ca teeth stunt bank cover mall kid sure nothing deal range wheel bm save act buck wear whodi royalty series ai fairly long believe benz check respect coupe liberace roll tint see seven might advance car contrary man yankee right change show also stash breeze money number sprewell ya boy y'all icy bling spin gold lift cashville jet chain naww cause ki really neck record figure day 'm shin like use g-unit flashy brain pop new 's inch homie sense platinum slack rock 're never already sneaker even giovanni enough cristal door thing happen black fugazies fin rim world blue walk probably gleam watch look stay hand buy hurt drop paper beach blow big n't teach color sweeper nigga tv throwback wrist gt;Stunt 101 by G Unit.txt
Suds In The Bucket;Sara Evans;shop nine woman eighteen bare grow sunday beauty heart leave run love go story say come daddy white time away head kitchen old bucket folk morning plenty get hangin year smooth pull blink a-racking lyric pink screen wonder ca pickup gon stop gun sip backyard nothing little pony-tailed foot star sorry biddy gossip eye hang shoulda scratching son see loveembed might pretty matter note truck girl also prince stick pick-up clothes break preacher na preach lemonade tonight fence talk window like non-stop line brain must vegas 's course past '' quite 're could enough door happen walk yee-hoo write looker grounded well n't suds mama;Suds In The Bucket by Sara Evans.txt
Suga Suga;Baby Bash;full sweet chick high keep love go blade grown quick raven yo say thats fling come sexy-cool lick ickey ride hit time ooh rockin italian fa leather fool highdrows get pool berata real mood know chulo feeling screen lie ca dig likeembed rawhide azucaryou nothing little sack mama suga star worry dolce ai dove gurl politic doowop air ultimate set might natural energy gift right tone money also wrong treat lift sticky though wee hunnybuns cause conversation o-zone gabbana cubana 'm like plane dude lyricsso 's ceiling youll fat 're shes feel lil'sugar superfly shift goowy top fly playa watch oowy kick groovy thang tight blow every n't sugar;Suga Suga by Baby Bash.txt
Sunshine;Lil Flip;friends player tall monday whenever call tuesday keep late maybach thug love street bill fun stack sheet 'll say ball major pick begin flip life cruise type hit flipper lil time ooh pay azure smile cook oh impala stuff thick eat get think real know chrome freak meet collar lyric bentley phone momma always twenty nothing make need worry push next ai chill holla style adore spaghetti spoil lady live roll answer embed might private wit man right girl number also change mad uhhh treat boy dollar ya touch pain yeeah ohh na jet spend cause talk maybe road shrimp day 'm like plane chip open pop vegas 's end short lea could switch milk baby wan friend door ask walk world clue bring want look steak kick balla spot bread chauffer whip move n't rid take nigga sunshine;Sunshine by Lil Flip.txt
Sweet Southern Comfort;Buddy Jewell;onembed georgia carolina rise weep sweet high keep misty tide downhome judsley williams mrs. firefly yellow cotton willow begin gabby surround dirt memory old homecoming gin dixie playin whisper comfort sunrise sister get think dream catfish lyric hometown kiss sleepy rather river rusted roll graceland wait might car water man likearkansas jasmine porch also mississippi chase clothes louisiana week place nichols home catch southern san yard creek road arm baker 'm line open antone checker 's row alabama still could priceless knee sit magnolia watch snapshot bless 'd erwin n't carry smell anywhere southland muddy;Sweet Southern Comfort by Buddy Jewell.txt
Take Me Home;Terror Squad;weekend trust face hold beep evening ta keepin chick clean woo turn facade rich bx us go lay front tour sheez wish seat cold yo say heatin broke yeah shit daddy morn everywhere papi pimp near let fit people speaker fresh whole different back freakin good indecent demon morning actin eat get think beggin cali know remy one three screamin mean pull seem meet fuck horn 'cause lyric stress club phone always squad hear hot drunk cheatin' crew little needin' `` ts ai crenshaw heat hang beside bump drivin hair standin damn see horny might embed possess peep lookin man right girl truck tryna also steady ya wild tell invite place city na ease terrific food yes press home breathin mtv really record road cup video like 'm use jump focus crib night shorty mami crush 's 'lac '' never terror sneaker weed diamond could profilin friend wan speedin sit bitch sex cruisin world watch eatin group inside guarantee stand breakfast episode cut gangsta reason leavin' big every n't take nigga swervin;Take Me Home by Terror Squad.txt
Take Me Out;Franz Ferdinand;eye slow 'm shot oh wane wait know might cross-hair leave die 're could lyric show also lie lonely say youyou likeembed come want broken shatter wo time well n't move take away;Take Me Out by Franz Ferdinand.txt
Take My Breath Away;Jessica Simpson;slow oh foolish finally game ocean lover watching 's call mmm keep know wait become oh-oh turn around hesitate one still return '' love never hourglass lyric also secret today say unafraid fated hear likeembed watch yeah place endless inside breath might mirror awayyou time every shame motion turning slip crash take away anticipate saw;Take My Breath Away by Jessica Simpson.txt
Talk About Our Love;Brandy;ay runnin mouth spreadin something sweet stickin ta grow call rumor ret turn play love go us team hood say 'll thumb come field summer let give giggle time 've people trade tune pay head couple listen reese whole nuts back donovan v somethin' actin get think know numerous hey-yeah one meet envious seem cash instead 'cause lyric kanye cousin ca always hear gon juwanna stop mind obvious uh madonna concern make burn honor `` homies ai prove buzzin' wanda confuse see embed might around mann truth matter two man girl number show also wrong ya cab tell speak na wo swear last mcnabb talk somebody 'm jump regret like remember way new whoo 's mess oh-oh still '' ex-girl word enough nowadays baby wan thing hey auntie want nerve wonderin lyin' 'd whoo-whoo n't talkin take yeah-eah piece involve;Talk About Our Love by Brandy.txt
Tear It Up;Yung Wun;full grippin rise light name mouth lap ta call fuckin side board turn love go lay wrap hood swizz robbin flashin come shit white kickin ride let hit give mile crunk time bar alive bounce callin south chest game dog get kill spit know kit bowl surface die fuck start lyric club grain dick gon kid four drunk beat uh wun range wheel make house across ai heat key choppin ballin tec fall first houston pack see set might yung around 'til g atl rest right show money also david sippin mississippi boy y'all drink prank city na gold party building i'ma banner offembed catch chain lean beatz neck arm bet 'm block like deck motherfucker way drought f-l-i-p 'em pop shawty 's tryin homie mess lock straight rock livin window switch baby smokin wife thing dro g-wagon tear bitch downtown want buy fo'-do thang cut drop underground every n't take nigga;Tear It Up by Yung Wun.txt
Tempted To Touch;Rupee;woman name hold de something control turn leave front love sexy yo win 'll else come ah forgive excuse oh havin think real know one squeeze lyric hug taste please uh kiss nothing little twist need lose next dove style lady hair wine see clutch might lookin man girl also touch age clothes ey place na caress princess 'm like way night 's end thinkin dance even feel baby wan waist feelin much yearn want look stage bless tempt inside leaf stand wing tight every n't touchembed flair pass;Tempted To Touch by Rupee.txt
Thats What Its All About;Brooks;cuss num love go mob thats say 'll waitin begin life hit aboutembed ford time chair bed slave smile finally eat one pull start stress ca drive without little thankless tired live fuss frozen might also mad figurin food wo dad spend rhyme cause day jump 's work cry could lyricshey door hey likethat hombound reason well big n't job moment;Thats What Its All About by Brooks.txt
Thats What She Gets For Loving Me;Brooks;name side turn heart love lay wish say thats 'll yeah stone time oh thick fairy get know tale dream lyric likeembed willing little fancy laying forever hang prove tender true awake live whatever count might car man also touch faithful thin sleep stare bottom ring somebody day 'm night 's diamond mmm-hmmyou thing write want stay able well every 'till mmm-hmm;Thats What She Gets For Loving Me by Brooks.txt
The First Cut Is The Deepest;Sheryl Crow;'m like dry oh would first 's know bad side oh-oh might againembed deep heart cry still love 'cause lyric try baby also tear 'll gon apart want come curse sure na cut lovin someone give 've lucky take help;The First Cut Is The Deepest by Sheryl Crow.txt
The Outsider;A Perfect Circle;face somewhere bullet 'll throw wire give time 've drama reckless crave away suicidal imbecile would disconnect pound get fault think hurry one die pull lyric lie teeth please fame help rush self-destruct prove precious everyone outsider might right sincere understand also medicated na belligerence choose trigger day 'm like way line far 's mess desire hereembed 're narcissistic could wan decadence watch perfect dark queen take picture numb;The Outsider by A Perfect Circle.txt
The Reason;Hoobastank;'m day use like put something learn must new live 's know might side youembed person one mean never go could start change lyric continue also wish many thing pain show say tear hear want perfect hurt reason find need catch 've n't every sorry take away translationsespanolportuguesthe;The Reason by Hoobastank.txt
The Set Up;Obie Trice;hoe reggie follow love shady leakin lot cheer hehehe 'll ball coke yeah throw shit give hehe trice later strip finish niggas get think guy career one meet grabbin whatchu scheme 'bout wifey ca plan stop wildin uh make rather og push fame leg genie next tie check cost first resort lookin rest show speakin' ricky marshall na pepe connection ohhh-miiiiiix spend cause day like bet purple deck line chin 'em detroit course boost still boo even d-block enough door grand hazespot world warreng divorcin cannon buttnaked sniff mobile plottin 'd hip shop runnin obstacle ta plannin zipper point yo say bitch+ horse lovin time round school head liquor back oh game floss proportion hangin handcuff lepew-ass whistle loose lie reachin gon voice mind kiss nail help cop best huh live air kush album gettin number money 'ricans busta drink ave tell whippin place party swear surprise catch uhh ring thigh abortion mathers arm jadakiss g-unit way magic cuffin new dolla lp female mess mink '' cheap yup hey noble thugged stand n't take plus 'gators weekend name hypothetically hoodrat chick hide porsche sport photo go dub victim westcoast come hehehehe ride whachu debut slow nate spreewells greeeedy puttin die fuck instead cool kid gun nothing favorite loft bottle scandalous ai doin long hair brown damn embed stripper safe might goin man dat right dough girl add page spin part dogg hah dame neck rule motherfucker chocolate manolo whiff nightschool homie g.e.d bad 're never doc pair ziiip thing dirty creepin lloyd sex cd probably watch hand thong blow nah full clit remix date-rape zone trust mickey clean lapdances rob play skin hungry titty try satisfy york fast fifth naw let uh-huh bar slip pay listen swallow whole nordstrom payin put +dat good thick profit pussy know pattin dream lyric bank everything bulletproof four stubborn drunk crip ear-ring hahahaha coach `` besides bust lady set also obie pocket ey city crazy errbody grab 'm use heroine whoo 's fat thinkin song baby wan tear nut bitch walkin buy kick trunk another legs nigga ho;The Set Up by Obie Trice.txt
