title;artist;filename;lyrics
(everybody Wanna Get Rich) Rite Away ; Dr John;(everybody Wanna Get Rich) Rite Away by Dr John.txt;rather thing right ring-a-ding poor groove everybody believe rich healthy .. rite tacka id lyricshot little wealthy game racka away mood king run day joe rang-a-tang change rum-dum
(Id Know You) Anywhere ; Ashford;(Id Know You) Anywhere by Ashford.txt;crowd chorusembed fool name sound eye babe cause x voice world lyricsthere pair baby flow would likerepeat hand call matter imitation chorus long want feel complete vibration sweet could tenderness loud close melody repeat never thousand another may touch anywhere arm change
(Im A) YoYo Man ; Rick Cunha;(Im A) YoYo Man by Rick Cunha.txt;early stuff staff instead stone sunday scum sent whoa mural carpeting outta sound strike chase killin security share tar truly sponsor outdoors ohio ring barnes ahab broke jammin army care pop dead option clearly near saw moos lyndon bed sensation much rap dice kool hundred raise nobody brotherly hoyt old regular late king offer walk lyin southern form candy provide rapper hospital cheat cryin rent side illinois psst bam choice brooklyn rod sweet surely gesture sawed-off veronica pod lieutenant hole away mm-hmm uh-huh homicide kick rover fast boom mission tear yea ambulance life errol worker decent intelligently dollar bald mylanta outdo town night breeze butt attractive for-real slap rude hidin runnin awesome- phone crackdown sandwich fry pay benefactor easy skinny-ass lou suck cent gots indoors messin conspire young protect point vial surprise last chinese vdp chest bartender uh-uh-uh-uh-uh-uh-uh upstairs anything psychopath joint stop good-for-nothin mix buyin g athlete continue g-rap gilmore future knew joke anyway left thinkin seat local free fella fear larry reason connecticut lookout alike bun recently static dope door short traffic bear terminal lift sure self-defence appear somewhere park wearin lie tap someplace ahh punk others death immortal comin finish kenny toss guess hard-core yup another play public nothing herman safe power gorilla egyptian god-fearin spot probably teeth ignorant girlfriend canadian movement stanley variation clockers yellin turn oh-oh-oh chump buy put yard shirt savin nowhere good th oughtta aid drama hard-on menace holiday feelin mug maricones cut grapevine louisville rosa medelln hangin bell-bottom scumbag rabbit cellular hearin pipin aw freakin buster main help motherfuckin choo-choo askin baltimore purer mall base ever permit promise model cash whale flip noise end jail class mastermind evil ground railroad grown-up homosexual ho heater kind moolies worried adorable lunch spend confusin prove mad think fe swear presto bet move warm ten break offence mixin yo victor minus got hood murderer johnson game honest assault manner speech hard marvello motto stick scared rag barely energizer surround reality ahead limit aight badge stool men speak group story root flesh fun first longer positive protection matter rest either find low-down dunk soft responsibility large license touchin readin hell powder mama leroy rock search iggin .. rodney hello loops lee decency gotcha threaten wise out-of-state jewish two house sharon view ceiling assed water perform fill super mess breath throat ba oh-oh uncle sentence todd ninth drug skyler growin remain desperate bathroom church-goin back boy count noble dough rob rat english air difference normally smokin rather picket long-lost boss stupid israel mm-mm hisself ago dear peer pina beep eye chill number cheek standin tough hygiene world top far crooklyn exit bottom nubian innocent hittin check trust samplin christ slick racist-ass pleasant bad defenceless behind would thief mean yos friday brain stay channel hobby andre shooter stain want tomorrow mr chocho wonder capper feel falter peace misery cocolo besides shop mommy dre suit state authority doubt living quick sweatin special finger definitely nice lend exhaust bastard mouth hot plant mistake enemy jam create homies co beer island landlord percentile lipstick ta hurry dinkins realise law something court fool shut shave glad alla someday vietnam give ronald mercedes-benz plat whack alone cripple cheap hate conspiracy newspaper arguin honey steppin bartucci catch gift shorty concentrate poor-ass grow nada clown shooting typical wu-tang red confused legit breach new jesus ill blue bullshit kept scientific hero sleep diss sittin sit word hit year paint since jacket sayin dog empty ear known homeboys ruin depressed recorder mom mattress snitch rhyme crazy prick crooked-ass print nothin rakin yep disrespectin ounce dang straight orange ho-ho dream recollect cool society fuck penn child try slowly mistaken pail poor colada klein solid throw bit pull blas card penny trigger usin sudden pet investigation little shinehead shrimp goliath run blast mirror survive subway low-life god quit appreciate invent smart bond cocksucker people way call gettin expose head lucky commit palm bdp wrong green lord yuppie staircase afford foolhardy neighbourhood squad murder food sir across become pussy smile livin knucklehead body bell maricone tryin south m-o bus leash whaler jeeter everything gym sometimes york aside lead unbelievable piece double ah hm captain cappin crackheads never fessed cuttin automatic pregnant lay accountant juvenile mine dope-dealin bust sell heard boogie-down damn magician big anyhow apart male trial teach hand-feed cylinder battery paper unlicensed creepin lionel hmm narrow pick trouble whbi necessary gloria playin gold fu visit crackin fuckin comic nah alzheimer shoulder mark pair week hand hang courtesy sa war inspiration actin rio argue hear fried conversation sign long creep office allah step kid per kaopectate save fault throwin sweat wabash everywhere listen morning ii drink thiggy-thiggy dunham drinkin figure personal collectin book cartel laughin range building national gain bacon mafia face hat build texas trace touch dark beat haircut timbuktu se doin right jungle stove train david b f- serve order jump watchin horrible live really road vet twice crime cold club freedom homeless buddy cocaine swing bottle lyricsthere mccauley father ya board lar stomach charlie cap real handsome bitty-bop tv buggin skirt though mooooo sick relax gangsta notify doctor girl motherfucking five folk chick everybody ricochet past liar sneaker without closed favour bullet naive direction goin bench barbara death-dealin grindstone parent gum warrant close cos bother happen microphone edition wander sex crack yesterday education final nike da italian cramp hip clam borrow twistin charge welfare ding-ding smell pressure crowd eat bar overnight accident idea beater sword wish arrivederci news maintain corinthian comfortable clockin pal stand buffer baggies shot problem buck city wake di-gel line shake shootin cracker possession ball suppose desert givin hold nintendo bourgeois work two-year-old moe pant lady hay-sus roberto visitor blood great uniform strung pepsi expectation gun fire usually dime slam beef around quality statement welcome lawyer always whoo trash phat patsy drawer eh horseshit hal bos kinda toy eight-thirty outside thank product bitter look dude beeper remember rip kill street ok. regardless kiddin mandela waste ready guy bring wait president id party completely scotch many glass cry cycle brighten tiddlywinks small one-armed man change hi squeegeemen understand sniffin force hidden tone read whatever herd cage confusion hope hour shoot joy use argument ok gat occur travel guys store ha dickhead tupac golf lem light suddenly headache someone dick sport sober part foul whoever pea dicky dr test faceless lewis payback guidance ride -year-old shift bash somebody pm lose cursin still slow messed-up respect stealin killer mary wear monkey chillin attend faggot listenin officer electricity love warn open lockup seein okey-doke exactly talkin mop leave snake school thanks genius beady rang silent hustle foot floor service pocket value insight must reds lock happy whole deal walkin minute um jew hooky racism somethin slack fence name haul carl wife month movie knocko owe send wonderin punch cost low bitch lot handle front competition us bike confess manage sorry talk involve slob till mazel ghetto grande darryl excuse three friend wipe leather sellin truth nappy start wo load snot journalistic pickin together text leg kung uh horse family reasonable apron birthday quite write african dominate die robbery port six needle knowin nephew clemente three-two health killa spread mazilli account smoke toughness slugger hey explanation solicitation drunk bail keep intent ooh-ooh sweetheart day meet wild notice clock original yellow kennedy nigga-hating cold-blooded tongue funny maybe soda razor woman western proud untold mud bored video pill claim african-american favourite metaphor stress borough trusty intelligent adam goodbye preacher a-a-and point-by-point strong scheme junkyard understanding tribe rudy salute explain best ding occasionally rich atm takin black clean none piss cuff flex fuss manager uncuff qu collar kiss already mind wonderful believe correct bitch-ass interior four pussy-bismol age moo detective serum trolley stick-up bomb deluded fell home even arrest zipper slidin beige shakin hard-working undercover budget daughter -inch neither later window consider oowop record glance swiss windows chocolate forget scar benz ex-wife pinch song third beatin vic budge lookin church brother def adams nasty-ass businessman hambones citizen country workin bein block pronounce snap disagree inside terrify second youth barber bunch jo-jo dmf please roll tire could nevertheless drive nowadays ronnie answer show else yet pipe retrace plead self-cleaning spiderman oven steal violence different walter victory whoa-oh-oh-oh miss business goddam anyone phat-ass nope triple-header seem dome crew boat virus grave may blow tov question criminal pretty self arm startle shit treat stomp charise bloody characteristic need stillyou naw yes nigger poppity-pop term sega duck thought bro dumb shell marvel milwaukee depend brown chuck newborn bag otherwise broom parasite baby today half decide analysis jaw boys every nigga bank heart station sidewalk son basketball sneakin firearm huh religion customer nickel actual central half-hour ty set tablecloth money cedric examine cop double-cross jumbo tired mvp whistle job profit hurt tumblin parking baboon a-writin hill shou willie key automatically full cell hoe dirty santa brand-new bogus jumpy fart wing kirby anybody illa vote jerk white steel tellin wash burger drop attack half-year schnorts ten-year-old rocco tight mother cheese gung-ho pin carry situation bill slappin motherfucker shotgun serious rough reach next two-minute crap ask quiet homo-cide thing time burn waist smellin crackhead nation justice car rid deaf thriller single place arrogant crib slip rule dry splatter bing fine fly zero chrome wherever dad tape strip project enough layin freeze daddy sleeve whiting spic high bush tyrone smith watch wall claimin better soul pump weight pacific aeroplane
(ive Been) Searchin So Long ; Chicago;(ive Been) Searchin So Long by Chicago.txt;something whoa eye good light baby behind part mean strange meaning new free find thing time somehow long ive hell inside search feel end deep searchin answer everything tear life believe never leave yeahyou hey natural question true change understand
(Youre) Having My Ba; by Paul Anka;(Youre) Having My Baby by Paul Anka.txt;happy meembed ya inside need life whoa baby grow glow eye much feel would way woman put lovely face youre could keep sweep seed think love
9 Dream ; John Lennon;9 Dream by John Lennon.txt;something ago warm name sound yes tree music pousseembed cold sudden john spirit mirror bowakawa rain real call heat strange hear walk start pousse around long somebody unfold feel whisper could two away nhoj street ah believe dance magic river seem dream air touch soul think
A Dream Goes On Forever ; Todd Rundgren;A Dream Goes On Forever by Todd Rundgren.txt;ago big exception live hope far stop fade within standing much left old soldier sea fear find time join long without year die away million love everyday tear life guess tragedy believe forever streaking never silent thousand dreamyou nothing dream day true
A Fool Such As I ; Bob Dylan;A Fool Such As I by Bob Dylan.txt;happen fool dear teach pardon angry year yes till untrue sentimental goodbye die little iyou cry dream day love
A Mother For My Children ; The Whispers;A Mother For My Children by The Whispers.txt;need beg eye lyricsi stand live alone got little wash sister mother care us bag someone would brother goodbye dish stay ask along scrubbin find always mama kid rainy childrenyou die could two away place comin never leave boy pack floor day child ta home
A Song Id Like To Sing ; Kris Kristofferson;A Song Id Like To Sing by Kris Kristofferson.txt;thing father song together always want maybe need muppets forever sound mean brother id sing .... woman last enyoying little tune good sister along pretty man mother love
A Very Special Love Song ; Charlie Rich;A Very Special Love Song by Charlie Rich.txt;whole big give live alone turn surprise babe radio world lonely low song near behind way mean every hear find girl sittin word somewhere goin especially youyou love melody breath special life singin sing ounce night symphony play day true
Abra-Ca-Dabra ; The De Franco Family;Abra-Ca-Dabra by The De Franco Family.txt;thing time crazy daydream always explain near reel disappear rock magical believe kind wonder baby give feel half abra-ca-dabra set alacazam magic every use full could keep spell feeling good look wo show
After Midnight ; Maggie Bell;After Midnight by Maggie Bell.txt;outyou inhibition superstition give midnight cream talk suspicion exhibition peach loose hang cause chug-a-lug new shout lyricsafter tambourine start shake find
After The Goldrush ; Prelude;After The Goldrush by Prelude.txt;silver something yellow knight fanfare basement eye tree band run mother queen color drummer saw sun archer friend replacement head felt new lyricswell around burn spaceship sunyou playing lie begin moon seed goldrush look loading hop sky fly armour nature drum burst peasant nineteen-seventies split float thinking sing chosen full high breeze dream haze cry blow child think home
Aint Got No Home ; The Band UNCERTAIN;Aint Got No Home by The Band UNCERTAIN.txt;father even girl aint daughter frog homeyou please brother sing boy voice mother roam lonely place sister man wo son home love
Aint No Love In The Heart Of The City ; Bobby Bland;Aint No Love In The Heart Of The City by Bobby Bland.txt;whole neighborhood blanket big fall county cause shine teardrop lonely city good line hall sun aint light nighttime townembed call pity every strange great heart old around thing feel without sure nuff place love room gloom town seem another mine change
Aint Nothing Like The Real Thing ; Aretha Franklin;Aint Nothing Like The Real Thing by Aretha Franklin.txt;read move aware name sound voice aint real baby much half call hangin though stay memory hear thing together help feel quite frame whisper sweet ear picture place look realize groove back nothing wall touch letter
Aint Too Proud To Beg ; The Rolling Stones;Aint Too Proud To Beg by The Rolling Stones.txt;beg ashamed stand refuse sympathy proud aint baby grow much half way mean every friend darlin heart quiet hear walk sleep want side pride step door please sweet deep away love plead mind leave pleading pit knee night weep keep cry sense day man laugh
Air Disaster ; Albert Hammond;Air Disaster by Albert Hammond.txt;disaster onyou fishtail push give young sage road fading window thrill swish good squeal mountain spit god care lyricsthe fade song brings bedridden dont way chair stay old fire desirable wheel lord son around reason chorus engine mercy climb nurse cocktail tire die bitter love sky life plane freeway stewardess back cloud age lane foot glory watch pile-up air wind power blow pretty day pressure hair
All In Love Is Fair ; Barbra Streisand;All In Love Is Fair by Barbra Streisand.txt;pen road put cold game good fairyou lyricsall ahead win bad writer people behind fair future war fate stay either time side lose word write none lie two away love crazy vow toss chance never leave losing play coin change mystery
All Shook Up ; Suzi Quatro;All Shook Up by Suzi Quatro.txt;shook bug fuzzy act stand tree ummm thrill proud little buttercup shake scar upembed ahhhh hand weak luck uh-uh-huh friend heart ask wrong girl best volcano feel please thank two bless love fine death queer mind itchin lip lyricsbless hot knee seem foot mixed likewell touch beat man soul
Already Gone ; Eagles;Already Gone by Eagles.txt;right even eat star news live yes put stop chain song hold light feelin heaven people felt strong free shelf hear hoo find thing girl nighty-night still wonder write set woo look oftentimes remember goneembed sky happen soon already guess life talkin never sing key lunch day true letter
American Girls ; Rick Springfield;American Girls by Rick Springfield.txt;lyricsoh girl opening want york cityside sun nice grow broadway spice sugar freeways way l.a. sweet hollywood movie cold alaska everywhere night chicago boston new far countryside farm girlsyou john look pretty hawaii wayne american america love
American Tune ; Paul Simon;American Tune by Paul Simon.txt;right liberty eye live yes road hour ship bright travel far bone unexpectedly uncertain weary clearly expect shatter restyou call working friend confused felt forsaken wrong sea reassuringly rest time long tomorrow help smile still wonder statue feel die could tune away sail drive moon look bless american fly mayflower often forever batter bon vivant ease misuse mistake sing certainly back knee age high another many dream rise day soul try think home
Americans ; Byron MacGregor;Americans by Byron MacGregor.txt;right west amazon yellow israel ago german neighbor truman distant woman international decline world far bottom broke annual saw erosion decadent safely nobody old jet plan five french everybody automobile rich debt yangtse marshall less none debris except prop state kick loan lockheed plane gloat several dollar river pursue boeing age entitle flag repair douglas- canada hurry home disaster even law example pay tri-star point alone reward window mississippi present newspaper consider city line shake interest lyricsthe foreign japanese scandal red new san policy insult country around bind appreciated swindle cross monger hit year lift russia rush earthquake since could outside pennsylvania design unless earth look britain american else street franc control another collapse upon many meeting equal dam man least read canadian discouraged finally railway hope buy orleans put race managua percent germany flatten store united someone bond today people hound india land nose british generous recent help ganges self-righteous spring ever still central money italy nicaragua forty-eighth jumbo tired moon rebuild danger railroad york draft paris airplane forgive thousand spend think damn fifty-nine exchange france apart sixty break name send extent radio trouble low blame smug nile talk men speak niger war first start billion hear wo rest possibly forty-one find caboose flood pa time thing long hell dodger write technocracy pounding morning water helpedyou tornado fly thumb building pour remain japan face high build community francisco pump
Angie Ba; by Helen Reddy;Angie Baby by Helen Reddy.txt;right secret read angie neighbor maybe pull volume toward young outta sound live really alone turn music window radio little world good stop song fade insane spin baby touched today would way lady friend confuse ask hear walk whirl lover find around time make-believe girl explain folk always side door rock lose feel everyone roll appear die tap blind house loud away place hop evil ground living show crazy room special disappear mind life dance nice goodnight headline never school daddy bound boy night seem satisfied play floor keep peekin small cool soul think
Annies Song ; John Denver;Annies Song by John Denver.txt;sleepy song rain desert always life storm ocean forest give laughter springtime sens annies lay night die drown blue mountain walk fill arm againyou beside love
Another Park Another Sunday ; The Doobie Brothers;Another Park Another Sunday by The Doobie Brothers.txt;happy sunday need warm name eye dawn turn hour window radio travel lonely city good hide hard way call nobody find thing cryin together want doyou sittin lose smile wonder car without tryin park outside empty starin away place slip else street sky room tear life bring thanks back cloud seem another keep wind dark pretty highway true think
Another Saturday Night ; Cat Stevens;Another Saturday Night by Cat Stevens.txt;em pay instead ago wish name month mhm thats sister hard frankenstein honey someone talk way strange resemblance nobody fella lord find around girl help saturday money since could state look awful fine yet cat ah lotta deliverance town night another blow spend meet
As Long As He Takes Care Of Home ; Candi Staton;As Long As He Takes Care Of Home by Candi Staton.txt;right something fool shut minute need likei move give pull yes little world run bone ha honey meat care hold baby much rap homework home friend fun loving wrong around thing long girl best lose rock feel money sure away love fast groove lyricsjust mind enough business wait mouth town spend day man think understand
Ask Me ; Ecstasy Passion;Ask Me by Ecstasy Passion.txt;case right disco alright scream so-so bet big whether move whatever maybe need lancer drench freak give sound wet really loose yes tough turn hope surprise coat cause babe shine top pick max good line okay shake ring low lot depend front plea pain dine gold ya twist suppose light work moet appeal bad ecstasy real baby allow sport talk way beatembed mean call hang romance joke three lace first seat heart new boost ask blue late shout start wo relax ride frown around mercedes brand moment time thing cruising girl creep want food best fancy mercy boogie martini uh rock smile ever sip feel body hello resist chandelier please sweet bell try world-renowned sweat funky cop deep wear could outside morning telephone two ahh everything show kill piper nature throat groove comin plain lead emergency mind sex passion steal dance chance remain gain cafe waste guy miss hey wait likeit town face therefore night nothing build dark beat sheep-skin rise day meet small hesitate soul wine ta think bye
Ba; Come Close by Smokey Robinson;Baby Come Close by Smokey Robinson.txt;time trust light sit kind still warm real baby stand please music turn hand put play closeyou heart mine dream stay regret touch fire start lyricsturn close wo true low forget love soft
Ba; Hang Up The Phone by Carl Graves;Baby Hang Up The Phone by Carl Graves.txt;right hook flame darling likei fall push give im breathing shoot put cheap freedom cause truly game pick lyricsquit loveembed dig bitch stop ya quit us baby sorry speak call hang reach goodbye heart head shit twin ill fight seek time want nine-feet pride busy body fault please bullet deep die soul-mate ground lo-lo-lo-love everything show love mission aside burry kneel different enemy niggah back play connection grave wall phone fuck weird
Back Home Again ; John Denver;Back Home Again by John Denver.txt;truck stove neighbor news move warm ten eye live yes road hour last supper little farm good valley mother spending againembed barely shoulder light sunshine mile baby way happiness colder home call friday friend felt whining old late fire wheel soft thing time burn long across lose rid feel body roll sweet house tired away softly prayer love sky sometimes kiss finger yesterday storm bring hey four lay heavy back cloud lost lane upon cry spend day feather afternoon
Bad Bad Leroy Brown ; Frank Sinatra;Bad Bad Leroy Brown by Frank Sinatra.txt;damn whole bar ago name eye wife stand razor wave good trouble ring shootin front brown diamond kong bad week downtown part lady mean call dice friday fun dogembed chicago treetop old badder gun dorris lyricswell king junkyard meaner baddest lover nose fancy side sir everybody leroy sit continental likehe sure clothes south learn begin dog look jealous eldorado six soon gambler beware lesson nice custom shoe stud four lay town foot upon pocket edge man
Ballero ; War MISSING;Ballero by War MISSING.txt;ballero exist song seem war miss
Band On The Run ; Paul McCartney;Band On The Run by Paul McCartney.txt;need fall village give mighty county register charity hope jailer explode send world square band run ring judge stick rain desert us hold sun undertaker sigh runembed fun rabbit first sailor find mama inside settle second search ever crash bell everyone draw everywhere pint begin away else nice forever sam forevermore never four heavy town night wall day man fell grudge think
Battle Of New Orleans ; The Nitty Gritty Dirt Band;Battle Of New Orleans by The Nitty Gritty Dirt Band.txt;gator bloody ago round melt bale give mighty eye stand surprise orleans colonel mississippi little bean hickory cannonball ring didnt beatin hold behind till hundred mexicoyou lyricsin cotton head new old gun fire along fight british grab thing bugle powder step lose gulf musket jackson alligator .... could begin mississip cannon look fill mexico open drum mind squirrel barrel river bacon awhile town face high battle another many keep touch must trip
Be Thankful For What You Got ; William DeVaughn;Be Thankful For What You Got by William DeVaughn.txt;gangsta diamond scene tall wooh-ooh-oohyou sunroof big wooh-ooh-ooh still lean car cadillac stand tv brother back great though top diggin thankful may antenna drive sister remember whitewalls
