title;artist;filename;lyrics
Never Ever ; All Saints;Never Ever by All Saints.txt;happy even right pay hesitation need z give conscience really last babe run dig low pain scour within sane bad insane way communicate vocabulary daze affection felt head heart spinning ask free fight start wrong conversation hear wo either find long babeembed always attention search ever feel write black ache sure peace deep could isolate hole away flex sad answer shower crazy sometimes hurt mind enough never ease wait mistake boy face nothing alphabet keep roam feeling question phone soul letter ta treat
Never There ; Cake;Never There by Cake.txt;even flame need bird game distance care hold baby much fickle first strong understanding around time long want always candle oooh ever busy wonder feel away close resistence show love roller fly yesterday never miss hey golden coaster touch phone arm think
Nice & Slow ; Usher;Nice & Slow by Usher.txt;right something hook minute round wish ten pull give freak name really slowly put little top drop good feenin okay interrupt hold sun real baby flow freaky mean y-m hand call every nigga u-s jodeci quiet h-e-r start hear seven thing time long girl plan uh o-n-d ever slow feel roll rush anticipate wear could dot drive place love cruise street mess already ah nice ready never hey wait hot lay contemplate town control keep r-a pretty try ta think
Ninety Nine [Flash The Message] ; John Forte;Ninety Nine [Flash The Message] by John Forte.txt;right something parappa whole eat shut onembed grungy star basement need big ninety teach miz-eal eighty tour tree wyclef buy juggle shoot yo x little refugee top camp fiz-ill yes-man twiz-ill john good run pose hard chisel jean stick subway gold wondering gift cock us light iz-ill real baby flow flash suicide men talk riz-ill till brother placement every three flip-flops kiz-ill replacement head fantasize hungry stay country walk block bop find slide nutzbaby forte message culture rapper huh cease c.o. spark door inside rock hit fault without bos flip cash jack money biz skip learn nine cop wear die could swiftly knock drink all-stars uh-huh jealous adjacent rip trifold show brazil duke street crazy diz-eal vibe jiz-ill hip-hop chrome lock cat reefin mold smoke complacent lip strip image miss bring leave ease hey business hot fiz-eel four floss condom relate enemy hustle high crew nothing many hoe keep dirty sti-zill dark power feeling ninety-nine small man spot fuck risk home bungee shit
No Fool No More ; En Vogue;No Fool No More by En Vogue.txt;right something fool writing alright pull eye finally put use game pain rain clearly baby behind way heart strong truth wo time together want door ooh-ooh-ooh past learn lie wise outside blind sad fine open room tear mind waste leave pack beforeembed wool keep regret cry wall dark ooh-ooh cool think
No No No ; Destinys Child;No No No by Destinys Child.txt;right alive deal alright corner give act young eye really wyclef yo club babe cause radio hood refugee little camp problem good shake oh-yeah front guitar frontin care song shorty hold near limit wild real baby much way part call every shy actin new stay ask soldier hear walk wo guarantee size around time provide sign girl together want inside lose feel supremes set money tryin thighs goin movin thug uh-huh close yeahembed girls love street cruise jeep pretend destiny mind dance hypnotize project remix never hey sing boy seem play keep mine texas dream runnin phone pump child ta hurry home
No Place That Far ; Sara Evans;No Place That Far by Sara Evans.txt;whole need apart turn shine world far lonely run faryou god sun mile baby much would way hundred great though heart imagine swim fear matter find long always still short climb without could crawl two away place love nothin river wakin thousand wall stubborn
No Tengo Dinero ; Los Umbrellos;No Tengo Dinero by Los Umbrellos.txt;likevamos fe vendetta need big senorita freak really bombita buy tengo shot frustrate swing chest attract run lyricsvamos bottom caballero care grown work dust lick baby men tequila bonita sa first next nobody gun wiggle dha wrong wicked dinero thing time together want plan smile bum sweet surely money greet popularity wise could ash bandolero beware guess miss loco onto vamos punani boy face bush cry rude outembed rise meet man bye
Nobody Does It Better ; Nate Dogg;Nobody Does It Better by Nate Dogg.txt;original accident coast b bet warren somethin act give name stand really strike dogg wasnt club cause concoct use nate east game chart good spit plug bangin playin ya care givin us g mark platinum win lick baby people rap call hangin flee three heart nobody ask team start quitter block track ride pimp either betterembed time join always best side sittin spark step kid door still hit niggas l exhibition single set money tryin bumpin scratch geezy breakin two cha wow thug trippin listenin close remember keepin show love mind crack different never match leave hey one-hitter hot nonbeliever back crew nothing keep stuck man fuck hustler think
Nobody Else ; Tyrese;Nobody Else by Tyrese.txt;damn bout shady nana solo live babe far game watt handle drama ya god trust baby situation way doembed ghetto actin nobody insecure around stereotype girl want uh everybody word feel die could bus lifestyle prerogative drive look else crazy exactly crew man try ta wild understand
Nobodys Supposed To Be Here ; Deborah Cox;Nobodys Supposed To Be Here by Deborah Cox.txt;swear need wing fall butterfly stand hereembed turn last send lyrics care suppose eternity win bad heaven lovely heart nobody stay along find around thing time search ever word nobodys black learn knock place sad love crazy fulfill hurt tear mind life spread chance broken key many cry spend must try change lock
Not About Romance ; Inner Circle;Not About Romance by Inner Circle.txt;gal tip big move break chaka confusion eye cause beautiful clear run tight la ka much every romance heart nobody emotion walk tease burn girl want body resist please ina look close love boom room passion dance hunger leave lyricsboom cry excite touch rise man try wild
Nothin Move But The Money ; Mic Geronimo;Nothin Move But The Money by Mic Geronimo.txt;seeembed even pay star funny tie protege disturb mad gots shortie move need grey somethin break give bit live dirt emcee hope spear rockin verse crime tarantino hitted gat little shine world ton top game record run hard low change amatuer frontin ya quit stop ball writtin mix hold fund hdm clientelle ahead feelin bag bad cut carry aha b.m ima coppin mean mic tee gettin nigga fully rough bank fit nobody stay ask fact amazing gun team strong hog track pimp block around time abide sharp side help geronimo step underlocked spielberg still ta bos puff body year write roll money sure pound mami display movin illy sensei flick place imma rule rhyme throat choke microphone groove gram lock mon-ey twenty plague blunt life blowin struggle nothin collabo carefully enough anthem miss kickin lay back boy face control high play dough crew audio keep hoe dirty bomb dark value day fuck makin man try master-i accordly think shit
Now That I Found You ; Terri Clark;Now That I Found You by Terri Clark.txt;chemistry conquer break eye alone last share nowhere hide hold someone heaven real grow would mean heart truth bewteens lifetime longer fear find around lyricshow together feel year everywhere away look prayer love open tear believe forever enough back nothing safe wall touch true
Off The Hook ; Jody Watley;Off The Hook by Jody Watley.txt;happy hook damn unexplainable need warm give really turn sensitive little game cost good unlike datin claim us insane baby much way hookembed untamable felt fire start lyricsyou time complain want lose kissin past desire huggin friendly love mmm crazy stake ah ready never likeoff boy relation touch lovin cool man
One Heart At A Time ; Various Artists UNCERTAIN;One Heart At A Time by Various Artists UNCERTAIN.txt;even need move stand road world shine sister line low rain hold talk way hand call brother friend though heart truth hear walk find thing time forgiveness lose smile woo agree remember love speed wherever lead different lay count universal high ooh-oohembed keep may righteous
One More Night ; Amber;One More Night by Amber.txt;thing right time yeahembed catch lyricsone want hold near inside passion likei baby give eye feel never body wait magic night sayin goodbye felt heart mine stay tenderness beat day hear close sad reason show wo
One Of These Days ; Tim McGraw;One Of These Days by Tim McGraw.txt;meembed even right fool stone sue maybe push pull break eye stand standin alone turn chase last joy use little world good clear bone run freckled-face ring innocent stick song rain suddenly pass sigh call home friend release memory hear walk start lord find chorus thing time moment forgiveness want everybody sit smile still promise feel whisper sweet red-headed peace learn away look beauty congregation love page pourin tear different enough never leave school shove sing boy town high patty dream cry wind blow rise day small cool think laugh
One Week ; Barenaked Ladies;One Week by Barenaked Ladies.txt;fry birchmount pan nub vertigo funny summon iron drumstick wasabi big mad throw harrison break hope chinese club waiver shirt leann drop good satisfy swiss shake hard stop maison tackle afternoon snicker blame cock tiny hold understand light week bad la flavour baby grow kaempfert sorry aquaman mean frantic brain three samurai rug though dish tendency head dans chickity anime history wrong guarantee sailor find hoodwink funeral moment thing although burn sign china together five always help side lose smile sit sting still hit x-files angry feel fault vanilla ache set robbieembed since wear could tune fish rime two cartoon moon bust stinking look stadium ford bert realize living film show crazy fly boom finest soon room mind dangerous yesterday kind chicken never guy tantric match chalet wait hot wit forgive back-swing sleeve back knee sushi rhymes watch fake air touch smoking value day kurosawa man arm try ta think home laugh
Only If ; Enya;Only If by Enya.txt;sky fly seize un want tomorrow star find da-da-da follow sun oiseau ah afar heaven ocean promise broken duh really way da-da voudrais awayembed comme duh-da da journey shadow reach heart je away sail look hear day voler love
Only When I Lose Myself ; Depeche Mode;Only When I Lose Myself by Depeche Mode.txt;sell even something need beautiful hypnotise fade someone heaven hand hang every heart paralyse palm fire start wrong find reason time inside lose feel myselfyou contentment could emptiness two velvet pleasure place treasure else happen sensual kiss disappear thousand control full satisfied nothing keep feeling spend belong soul mystery think understand
Only You ; Tami Davis UNCERTAIN;Only You by Tami Davis UNCERTAIN.txt;crowd right silhouette darling follow fall brick break name alone fix hide line sand castle sun crowded hand call nobody youembed blue find time lose ocean feel tonight everyone somewhere moon place look else mmm street sky oh-oh room dance paris never river upon watch tryna meet fell
Ooh La La ; Rod Stewart;Ooh La La by Rod Stewart.txt;even poor star wish grey young cheek trap woman grandson use far hard la asleep can-can way speak twinkle heart old strong find long want laembed ever word wonder feel learn woo blind granddad bitter away earth show love fast soon room steal kind lip back boy nothing backstage pretty leaf man dressing think laugh
Out Of My Bones ; Randy Travis;Out Of My Bones by Randy Travis.txt;something em cure need sound lyricsi dawn chase ghost voice little drop bone hurting stop fever work carry real bed talk walking till bury temperature head strong spell free amnesia chorus medicine still sweet set jacket picture love fortify fast remedy shoe extreme back weave keep may meyou daylight backyard arm
Out Of Sight (YO) ; Rufus Blaq;Out Of Sight (YO) by Rufus Blaq.txt;slug lyrically m-b-u-s-hembed groupie ice b pull germ wrist nationality spittin wife last woman yo cold progress steel weapon top game chest john satisfy shittin hard ha tight front blaze tickle tank hittin footer frontin stick ya ambush flippin forgets catch rottweiler us squirm baby flow sugar people would speak call every bluff gettin rough compare test hater excel everytime impala sight sick hee track matter chiko beef mc rest around thing time burn girl impossible verbal large yearn uh ever ko still buckin uno doe niggas holler core hotel tonight write sweet tryin haa learn m-o could bite straps entourage numero trippin six ahh rhyme heeyyy quick m-b-u-s-h kamala uhh comin puerto reign title laced spread blowin ferocious double bark p dance repeat talkin chiki hill goal never dontell cuttin leave hot bourbon lay dollar style noo full high b-l-a-q unfadeable mine beat spite spot soul lobby try makin rican bust shit
Paper ; Queen Latifah;Paper by Queen Latifah.txt;heard right bout easy star bet need name swole outta chill live paper yo refugee shine camp heard- hide hard tight queen check stick suppose la someone unit talk lady friend confused hater stay fella hear around girl everybody wonder roll refugees tryin lie u look flava infiltrate lyricsgo else magazine yet slander life spread newark bring untouchable business back crew play keep fake flavor pocket cool try sacrifice
Party Aint A Party ; Queen Pen;Party Aint A Party by Queen Pen.txt;something hook stomp damn whole bar deal shady expand round star lou follow maybe bird move type give eye gotsa really yes center playa shoot later yo tah ran put dancer cause tunnel got pick game city good run bottle blur forget certified tight spigg legs stick ya catch givin shorty hold vision browse aint shorties feelin pair booze makin real aight way spinnin nutta lickin roof hand brother monopoly elimination nestle intelligent three cab proof bouncin chicago head chat new puttin old plus stay team shout walk sick wo track slide slur champ instantly want temptation across butta clap chick timbs door q remy rock smile still henny word hit ta feel set cash lee sure biz assume since jacket except raw diggin two peepin drink look rebound dancefloor keepin answer wop impressed room york blunt cat vide nice lip forever leave wait wit dealer party back awhile rim seem crew nothing many tipsy glass watch collect dom touch blow spend dress day pretty cuz rewind choose delay true smell change wild perfume think home prove
Perfect ; The Smashing Pumpkins;Perfect by The Smashing Pumpkins.txt;street time something sleep always pretend help reason youll unwind lose stranger letter still wonder perfectembed promise feel please friends perfect end cant friend youre send wed angel next far old memory free good line lovers meet lover amends unreal
Pink ; Aerosmith;Pink by Aerosmith.txt;even right lingo turn umbrella flamingo wrap color light ooo kink today obsession deco yeahhhhhhhhhhhhh first red new discover sight lover matter cherry want ever kite tonightembed rubber quite tonight kinda could favorite everything bing love fashion passion sheet lip ahhhhhh lay pink high crayon question think
Pretty Fly (For A White Guy) ; The Offspring;Pretty Fly (For A White Guy) by The Offspring.txt;least tattoo thirteen tres overcompensate ice need gunter girlies give lack clue cruisin cinco really buy twice ricki dopest white wannabe world hard player lake real baby pass today way rate seis gettin anyway friend ask pinto along thing huh lily want always thirty-one uh quite vanilla kinda globen cuatro tryin field draw ink tune look kick denial everything suffice subject love fly glieben debate glauten mind ah guy hey hip style homies straight play keep cube fake may pretty cool trip uno ta brand-new
Push It ; Garbage;Push It by Garbage.txt;happy right need push harder use shine uptight hard baby sorry talk head explodes stay ask fight want help worry still angry body ache please noise hurt itembed awake night nothing keep beat meet prove try think
Pushin Weight ; Ice Cube;Pushin Weight by Ice Cube.txt;meembed doin changin betta homegrown truck fool issue walkin coke ice need big taxidermist gots multiply push bird break name young number pace oak eye retaliate live turn mega harmin janky lincoln yo put cold hate x send firm digit trench scramblin gotti hood maggot zone game pick buck shattered city good wake de-zamn transit dig satisfy woodwork bitch spirit blaze sag change grade army feed rag visit dead fuckin stack cube hold brrrrr hanky work killas lick baby rap musclebound constantly swallow till hand hang ghetto tenth ch-ching nigga thunder weight red diddy legit head rollin hater puttin old ask frankeys earn saturn wo fresh block slide glocks armored bind bullion girl five exquisite want help mash dope everybody settle sit rock search livin nation still rich hit wonder niggas feel dash baguette bandit money learn since jag armadillo chip worldwide entourage pattern faggot state amazin frozen thermos kick ornery rhyme chedda hash champion blazin lead already navigate rolleo nothin enough crouton skull official four back hustle face fifty full straight grip flag keep tundra glass bomb pushin fake nullify mine ben spend slumber recognize spot makin uncandid corleone crumb arm lock think shit
Quit Playing Games (With My Heart) ; Backstreet Boys;Quit Playing Games (With My Heart) by Backstreet Boys.txt;even right wish apart live turn use game heartembed good stop quit us within bad baby way hang heart strong start time impossible feel tonight deep could everything love sometimes oh-oh tear life forever leave back seem play nothing keep may soul true
Rain ; SWV;Rain by SWV.txt;burn sometimes rain catch surround lose passion need fall storm escape real baby shelter simply chill feel misty capacity explode gently control full rainembed sprinkle touch fire dam cool soul shower love soft
Raise The Roof ; Luke;Raise The Roof by Luke.txt;right something west em represent star need big move throw monday break master southside sssssouthside loose express playa yo put club funk tellin little world game iny good f shake d.c brown legs ya federal quit pepa salt platinum huston cap way downtown fat roof hand heat cay left raise red chicago head new fist feature fayetteville ill eastside track pimp ride chorus time burn girl g-club across side ngbg booty hit feel .. -repeat south chillin brat bite house n wednesday flex place foxy show love fists luke uncle comin york roofyou kim roper repeat talkin nasty ready leave westcoast party back bound night high dirty texas air beat day darria makin pump trip change phatlanta bama
Ray Of Light ; Madonna;Ray Of Light by Madonna.txt;flyingembed quickly universe little endless sun light someone heaven call thunder threatens zephyr time mourn wonder ray feel year everyone begin faster earth remember else sky fly translationsportuguesray quick tear piece speeding wait shall beneath night quicker sink try home
Real World ; matchbox 20;Real World by matchbox 20.txt;meembed tag yellow tone wish bet fall apart break order honcho hope planet rainmaker little world store superhero stop rain sun work someone real would downtown strange every friend head shout start around thing want box wonder please funky learn could hassle else fly boy seem high straight stun gig man change think
Reality ; Elusion;Reality by Elusion.txt;funny read number sound outta cause use pick good run ring forget pain reality week real way mean hand felt late around thing time sleep always uh feel dial tingle money could click remember love everyday yesterday night phone day true think
Recover Your Soul ; Elton John;Recover Your Soul by Elton John.txt;something fortune sunset maybe coal sinking name alone turn cold world drag tattered clear soulyou stop baby recover release heart old fire fight matter relax find thing burn across lose lazy save spare perfect love tear torn life piece gain never miss hey losing night battle foot air dark day soul
Remember When ; Color Me Badd;Remember When by Color Me Badd.txt;need maybe likei eye live share thought world hide dyin hard god trust givin heaven baby behind gettin hopin reach memory holdin free chorus time together help inside lose without could lyricsnothing abandon thank reclaim searchin remember love yesterday believe forever nothin chance whenembed never leave hey magic back longin keep dream touch
Rhythm Of Love ; DJ Company;Rhythm Of Love by DJ Company.txt;issue round tie need acceleration point lyricsand yo explode x drop loveembed check stop us light real spin till rough nobody phony rhythm elevation overload thing together want emotional still feel end rythm could morning hea love fly mind steal believe enough hey control night high full beat soul likeand
Right On The Money ; Alan Jackson;Right On The Money by Alan Jackson.txt;right pitch minute melt need broke-in ten jump point music ohhhh last shot world good bulls-eye run grass jean speaker cheese ole song pop net overslept light bluer ace much would hand three first red heart new middle greener old around reason directly best bow second ever hit feel sneaker without cook roll please set sweet money perfect aim begin absolutely direct house favorite doubt everything whistle fast sky forever floatin dealer boy full nothing fiddle lovin day meet home
Romeo And Juliet ; Sylk-E Fyne;Romeo And Juliet by Sylk-E Fyne.txt;industry sexual easy bet big loyal teach act give serve rub chill wet thin playa yo cheap put little top romeo taught game peep good attract overdose react hard bump check ya wheezy catch cowboys saw cuddle boo sexy real baby sleepin lady bombest shy homey first heart discover nobody puttin fact e-z stay usually king wo ride tease around find fadeembed thing time sleep creep dedicate want always best clyde sista rock worry ever feel body compliment try please juliet puh-nanny end since goin dog cha royal sleezy somthin mommy away place kick close bomb-ass healer love else fine vibe street sleepy bonnie mind sex lesson nice escape forever repeat grind never l.a. thick wit hot wait platta lay likecome back yep night hat relation play treat keep regret bomb touch cuz man true prove reveal arm
Rosa Parks ; OutKast;Rosa Parks by OutKast.txt;right west even represent damn cave probably quote pay glad enlighten mad total route move anyhow gypsy throw hush type eye sound live provocative point awfully hour buy lacka-lacka-lacka last hope yo put club east game city good record uh-cracka ha joe handle lyrics bump ya playas player us cut baby flow pass destination people rosa chaos decide way would mean group weak every anyway brain nigga left creative great head new slowin old creek station costly adventure hear earn conversation skippin son linger either find around bust-ya-shit-open andre suckas chorus thing time burn bat dungeon together circle sour sittin spine-tingling everybody doughnut family still hoyas focus past word niggas hit atl ta crunk takin write kinda examine hennyembed sure witcha south funky park georgetown crown goin sayin die bus innovative north shaolin favorite titty earth uh-huh fuss hipped doubt sad georgia shower time-out slump crazy hip-hop committee bulldoggin flawsky-wawsky comin stabbin brougham determine activate life dangerous ah never stimulate cracka mouth wit float style back boy town major night straight another boat play many hoe keep silly flavor beat has-what tryna pretty day meet man try absent think bust shit
Roxanne 97 - Puff Daddy Remix ; Sting;Roxanne 97 - Puff Daddy Remix by Sting.txt;sell heard right paperback bar colada disco ice makeup total move act remind give break name number jock bob outta sound really kung-fu yo put share refugee shine top bro jewel game good bottle shake handle motto scan gold ya twist care pop zealot hold light platinum feelin bad pimper politics similac cut neck today talk would way part emergence call sock every friend similar red pearl strong blue pras walk wrong green wo around district fan time girl want tomorrow sippin mama candle step sting rock sit brooklyn promise feel body puff tonight sweet money since wear weekend roxanne paradise diggin drinking haps away flick drive place million rule shallow love fine street fifteen contradict bentleys room special glock cat mind life kind ye pour lip dance remix never hey thick hots hot daddy jam party boy night hat play crew another island mine cognac blow dress day pretty cool man
Saint Of Me ; The Rolling Stones;Saint Of Me by The Rolling Stones.txt;meembed something flame wish miracle fall baptist serve eye stand yes paul herod woman put cold stir hate angel teardrop john pain song saw light blinding knew torture jesus hear wrong saint persecutor burn temptation plate hit augustine save die could begin faith martyr pleasure love mmm special life believe never cruel sinner cry sinful man soul salome wine think
