title;artist;lyrics;filename
Disco Nights (Rock-Freak);GQ;full nights flow follow us 'll say ear let time reach head and-me good get real one freak lyric feeling rock-freak sky free mind spirit thrill hill might right also joy discoembed body laughter disco 'm like music night lend 's rock 're dance feel baby want tight n't take pressure involve;Disco Nights (Rock-Freak) by GQ.txt
Do It Good;A Taste Of Honey;eye light put back music freaky hold oh good okay get 's flow mmm set might woo hmm go bone feel 'cause afraid clap also likehmm hey stomp come yeah stage lyricscome hand body beat everybody let shy shake beatembed foot ... n't move hip disco slip close vibe;Do It Good by A Taste Of Honey.txt
Do It Or Die;Atlanta Rhythm Section;along twice way gamble live roll ta get dieyou keep bad know might cry die still gettin go matter ground rollin even enough try loser also wrong waste everything say dice break likeembed life wonderin stand let make rough time 've n't people winner lyricsdo trouble moment;Do It Or Die by Atlanta Rhythm Section.txt
Do That To Me One More Time;Captain;like oh woah get might heart one never man word pas enough lyric also baby say hear tell near kiss timeembed time 've n't;Do That To Me One More Time by Captain.txt
Do You Love What You Feel;Rufus;like way anything night hold within holdin sing get set might nobody 're love seem dance 'bout right 'cause feel lyric baby romance wan many also somehow else likeembed come tell free want together fight na lovin spend 've well every time take close;Do You Love What You Feel by Rufus.txt
Do You Think Im Disco;Steve Dahl;cheat turn leave street go bullet doo bop seat satisfy yeah budapest everybody edge bah ooh dust low doorway plenty get think warily one three pull bite lyric be-dop-bop-be-dop buh-bump everything machine gon four beat gun without foot yuh-duh `` yuh-yeah ai heat long hang bump live brim sing wait embed might do-dah two man ground be-dop-be-dop-be-dop-bey also treat ya steve ready be-dop-bop-be-dop-bop-be na yes hey-yayee-yayee-yayee-yayee-yayee-yeah-yay-yah coo-ahh 'm along way like 's bad '' 're baby hey walk happy gim bring alright yayee-yayee kick ba hurt stand another n't rip take sound;Do You Think Im Disco by Steve Dahl.txt
Do You Wanna Go Party;KC;night lady get wine 's dancin' might unwind go love likeooh sexy also baby wan hug satisfy aah drink 'll come lyricsooh partyembed na party kiss little let tonight make time last funky ah ooh;Do You Wanna Go Party by KC.txt
Does Your Mother Know;ABBA;face something tease chick chance go fun try child search easy give ... nice young ah mother slow smile think know one mean seem lyric feeling cool ca hot drive little kind eye style honey flirt see embed might pretty girl also wild funny maybe like 'm way 's 're read dance could baby cute blue want flash look chat well n't take;Does Your Mother Know by ABBA.txt
Dog  Butterfly;Heart;light face hold heart run us tide go balance try say child yeah life laugh hit give message young moonlight old strand back smile ocean strange dog get butterfly know likesee sky fire secret free voice mind stranger little find make need `` town eye true air roll see might safe around freeze soft man ground possibility also beg lyricsthere tree place upon wrestle stumble crash maybe butterflyembed like 'm night confusion 's desire '' 're livin word could feel colder tear world fly together look inside reason warm 'd steal well n't another take;Dog  Butterfly by Heart.txt
Dont Bring Me Down;Electric Light Orchestra;ooh-ooh-hoo ta somewhere run go 'll let time away good crawl get think know one 'bout lyric always gon mind fancy might snake right girl also waste break tell everyday na crazy shake groos talk road dont day 'm floor use like night 's end 're friend wan happen bring look stay glass n't downembed grass;Dont Bring Me Down by Electric Light Orchestra.txt
Dont Cry Out Loud;Melissa Manchester;clown hide high keep awful leave love lot come glitter lyricsbaby wire among paint parade different fine smile think know pull dream 'cause feeling ca likeembed without nothing find make allyou kind town saw fall see might almost also proud break tell upon dont day like remember learn behind cry dance loud teacher baby circus litter top fly want left net inside sawdust 'd big n't take pass;Dont Cry Out Loud by Melissa Manchester.txt
Dont Do Me Like That;Tom Petty;woman somewhere turn love go try say else let someone give pride listen oh good would mine get know 'cause lyric feeling lie ca gon step need `` eye long honey bury wait see embed might around also tell na last talk dont day like night public 's deep 're '' friend baby watch inside hurt size cut n't take someday;Dont Do Me Like That by Tom Petty.txt
Dont Drop My Love;Anita Ward;'m ai put trust dropyou hold good fall high 's know might follow squeeze love 're go right handle also baby anywhere wan 'll likeembed ball heaven come want hand na nothing let care drop wo tight lyricsopen time n't take close arm dont;Dont Drop My Love by Anita Ward.txt
Dont Ever Wanna Lose Ya;New England;downpour lyricsyou siren like anything face likedo brain rain get 's late wait might safe heart 're still die could also door wan ca ya walk hear speedy drive look beat stay na ever home yaembed lose n't dont;Dont Ever Wanna Lose Ya by New England.txt
Dont Hold Back;Chanson;back music likedo hold good embed might around dance feel change lyric also baby say want yeah mind shout groove party stand make ... n't move dont;Dont Hold Back by Chanson.txt
Dont Let Go;Isaac Hayes;hold sweet keepin whooooa ta shuck lyricshear keeps mill love go lip grinnin ear come yeah let thunder time 've nearly eager a-barkin dyin' would rain killin havin dog get mine million whistle 'cause momma draggin stop kiss yeahembed lightnin barkin need buck hill might right girl also ya o'clock really dont 'm glad night brain ooh-ee 's mmm rock a-howlin feel baby wind feelin want inside aaaw tight upside 'd well n't take oo-ee formin likehound;Dont Let Go by Isaac Hayes.txt
Dont Make Me Over;Jennifer Warnes;'m way anything adore hold would get fault know side might one love huazteko right change .. also wrong thing ca beg say always likeembed pick without inside command make tight 'd 've n't take lyricsdo arm dont accept;Dont Make Me Over by Jennifer Warnes.txt
Dont Stop Me Now;Queen;woman light woah defy call shooting control turn supersonic go travel rocket 'll ball yeah tiger translationsdont let give godiva time ah ooh alive collision gravity oh outta good ooh-oohembed real 'cause loose lyric sky machine gon stop travelling make burn star law mar float mister honey lady bomb fahrenheit might around car two man right also ready na ooh-ooh yes explode tonight da racing speed 'm like way atom hundred 's degree course reload feel wan hey satellite world leap sex alright ship inside ecstasy n't pass;Dont Stop Me Now by Queen.txt
Dont Stop til You Get Enough;Michael Jackson;shine keep eternal force love us sensation lot wax yeah darlin question let ... complainin ah ooh vow oh candle would get know risin nothin 'cause lyric wonder fire aah hot stop til make translationsespanoldont eye melt heartbreak embed might despise 'til aint also touch ya body wo closer close hour like 'm power lovely 's temperature desire 're enemy could feel enough baby happen ask feelin alright n't fever take hoo;Dont Stop til You Get Enough by Michael Jackson.txt
Dont You Write Her Off;McGuinn Clark;atop skyline like blind fine good desert new ocean lady true get 's real see know might alone heart one island meet pretty leave love girl change half lyricsbeen also sail ca 'll likeembed blue write york city mind wo find 've n't every across town pass dont guru;Dont You Write Her Off by McGuinn Clark.txt
Double Vision;Foreigner;eah-eah-hey time 've woa-oah ah ooh kinda head race oh good get year one mean seem lyric fill ca always vision likeembed gon mind oooh 'n single need push ai eye best live eah-eah wait see might around also stick oh-ooh yeah-ah-ah body na tonight double really disguise 'm limit night new 's oh-oh straight extreme never feel wan dirty lead minute another n't take yeah-eah 'till;Double Vision by Foreigner.txt
Dream Police;Cheap Trick;hide judge rumor alone try 'll come vacation let nice police listen head pay bed oh persecute get men think know one dream lyric lie ca drive single ai spy fall awake live wait embed might insane also tell sleep tonight wo talk cause survive bet like night brain 're cheap arrest look inside well every n't asleep take wide jury;Dream Police by Cheap Trick.txt
Dreaming;Blondie;idle hold something fantasy flow keep go dreaming 'll mile people away turnstile fade forget real meet dream lyric fill rarity likeembed free stop build little foot movie charity river radiate live pleasure might two also measure tell gold traffic stare reel tea imagine road hour cup 's freeyou never could even ask walk sit watch restaurant want 'd n't debutante;Dreaming by Blondie.txt
Drivers Seat;Sniff n the Tears;driver sweet trick news seat 'll come yeah pick life time people elite away trouble ooh smile get meet always gon beat strife little foot jenny jiving may might right also likeyeah place na day remember way night 's saturday 're never dance blue look 'd seatembed another move take lyricsdoing;Drivers Seat by Sniff n the Tears.txt
Easy Driver;Kenny Loggins;hmmm driver wider skinny rider hard turn run love skate story say come wicked life easy give away ooh fine back oh lyricshmmm good lane get know one smooth mean pull afraid sign machine drive find beside roll room might driverembed also lonely tonight road window like way 's could enough baby probably n't avenue;Easy Driver by Kenny Loggins.txt
Easy To Be Hard;Cheryl BarnesHair Soundtrack UNCERTAIN;'m hang noyou oh know ignore hard might bleeding evil feeling lyric friend heartless also cruel cold say likeembed proud stranger care social easy give need crowd people injustice especially help;Easy To Be Hard by Cheryl BarnesHair Soundtrack UNCERTAIN.txt
Elena;The Marc Tanner Band;name hold evening bird elena side struck heart love lay skin strike romance singin' apart come yeah begin laugh hit thunder alive warnin siren whisper back oh rain rhythm aboveembed lover appear likeah seem dream start pourin wonder fire cool vision felt burn find star midnight eye callin' sing live first might lookin right also lightning charm pain spell city laughin wo closer lyricswell arm others like avenue night 's desire even feel fell wind meaning bring stay stand tight pouring n't take;Elena by The Marc Tanner Band.txt
Escape (The Pina Colada Song);Rupert Holmes;face personal call high love lay red dull half 'll say come laugh ... 've bar tomorrow tire old bed smile rain ocean letter get think know mean meet dune lyric taste curve plan make favorite kind o'malley's wear `` yoga midnight ad long escape instant lady fall wait might noon gettin coladas also place sleep though yes food escapeembed catch like 'm cape aw brain recording lovely 's bad nobody colada routine '' 're hope read poet never feel song health tape column walk much write together look pina cut paper 'd n't take champagne moment sound;Escape (The Pina Colada Song) by Rupert Holmes.txt
Every 1s A Winner;Hot Chocolate UNCERTAIN;erection nervous shuttle face rhythmic call side gentleman follow hard turn fake front love us specifically y-y-you girlfriend lot cheer apple mrs. rap 'll flicker win uncomfortable dumb empty w-we yeah throw square static ever edge laugh someone give life.embed supervise invent craftsmanship unbelievable playfully existence later entire strip abduction um faster y-y- shock crap grandson rhythm glitching plenty get locker ambitious fault think deserve fraud suddenly rare nostril tote guy one order mean noise seem chamber screen ca detail secret aah distract plan hear direction stop pitch day simulate hispanic mindfuck uh deal little single y-you make star worry sorry meaningful possibly check respect identical quark bump scam whatever first t-t-t-they everyone sanchez gotcha lookin family i-im certainly truth meeting tendency slam nonsense almost show ill wrong aggressive chase tree break radio celebrate na food w-w-w-where yes slogan freely mistake wo y-y-y-you ahh universe robotic road baker anybody galaxy like concentrated bet five idiot president deck l nanobotic cynthia sneak selfie congregate marklevitz root course poster still disappear even loud sloppy -- door sewer i-i ask wow small sob world horde specific draw valuable guard fight ship solve able dark render drop student 'd teach collect lighthouse correct pass disheveled welcome t-this cellphone throat cant hold human wha ta mr. keep board leave flips share spencer travel garage married cough uh-oh point trims say yo project everyones soph accelerated final care discolor engine time nice people away school head shower old unremarkable central back oh stuff g-g-give would thank dog campaign interesting mine east peel rat start trouper enter phone lie cover terrify w-w-why plutonic gon groan hot desk reveal beat step kiss diabolical aww act ad a-alright t-t-t-that nebulon m-morty believe best o-okay huh bunch air oof live giant cesium answer room see frozen code son water insane appley matter two butthole convincing number change uhhokay buddy prince great explodes inhales horseplay patent nominate drink problem concentrate relax tell award ready place party cc alien swear combination home opportunity ha talk uhh maybe normally got thirty arm jump way night aw chip open new smith badly far repeatedly tank geez apple-related .... fabled rock '' repetitive word version evil wife hey happen cancel walk sit w-who paramedic special hey-oh reality lead operate target level big every n't take quintons mm examine loudly whoa dress sigh name ten ambulance fought walks ugh rendering l-little outside grandpa go street scary ow w-w-what boom thats else large come everybody life cpu god toss slide finger ride exactly finds drag hip-hop easy test state-of-the-art 've doctor ooh forgive u-uh smart gullible slow bed whisper different fine handrail finally mailman real ding-dong year appear i-i-i die three pull outsmart early successful oops kevin fire cool always kid make-or-break m-m-morty commercial dummy obvious nothing im national cap house kind science bottle shove beeping eye hang least escape aha long lower beside agency shouts ive fall spout careful hair processor staff acquisition pack damn weird wait minimum rick safe freeze hmm coast gasp man right goldenfold glitches uhhh boy clothes c-character mom jerry part shout acquire simulation actually shake capacity wh toaster laughter dad ingredient department wail hero really circle abducted sir stu setting naked power music shirt derivative sucka quote-unquote simple spacecraft rip-off burp laser simulator process cry holy 're never hell tail i-i-im could shut vanishes onto friend notice earth uhp huge famous deeply much sex cat fly park alright look hand system son-in-law state nudity space f join blow tiny perform rhetorical w-w-w-what offstage sunshine processing scientist woman trust beep something quit virtual discoloration disgust somewhere deejay america play run class hungry red con genitalia try continue second snap victory hoarsely field begin attention stat clear question reboot let w-why uh-huh ... x zigerion listen pay exist promote important bucket siren excuse wonderful put fist appreciate good okay towards morning shaym-aliens adjust terrible know ahead scammer artist lyric game-day mortys wonder sign w-what completely today everything fella responsive drive sure jessica saxophone emergency treadmill wheel flap burn need `` lucky blankly h-h-how spy dissect lady glitch true may idea sector barely around car recipe wiener beautiful united also sell situation age poptart audience beth speak isticated crazy hello farmer grab malotes pod waiter chain crowd a-and monitor whose figure leash others 'm spaceship use concert slightly hat complete whoo 's fuel keypad work bit zigerions snore behind dawg vocalize bun dial teacher pant milk wan miss guess song many morty goofball anyone t-t-t-this obsession bitch knife turd want together appointment kick auto trees rocky inside minute size b-brilliant paper gasps well another move screw pour carry goodbye especially picture steal m.;Every 1s A Winner by Hot Chocolate UNCERTAIN.txt
Every Time I Think Of You;The Babys;like affair hold good would grow think know might youembed turn surely cry die love go never 'cause also wrong always say come likeeverytime darlin lyricseverytime understood single let wo time every 've people last maybe n't season pass everytime;Every Time I Think Of You by The Babys.txt
Every Which Way But Loose;Eddie Rabbitt;hold keep somewhere turn leave love lay heartache string come fast memory 've unnecessary away head cave callin excuse resistance get hurry one 'cause loose fire lyricsi always likeembed mind find need kind next burnin long believe roof looseyou might man right girl also ya sun turnin tell thin place body mornin' close term 'm along way night new drinkin 's thinkin' obligation past still 're hell feel baby beer thing feelin wearin want stay fadin testin inside begs minute well every n't mighty move;Every Which Way But Loose by Eddie Rabbitt.txt
Fancy Dancer;Frankie Valli;sweet partner love go wish sort say 'll life 've young ah whole oh know lyricsanother one start dancerembed hear free step without fancy foot make need weak see become might likethe dancer also speak body wo impossible 'm use way music night 's sweep routine 're never dance recall could feel guess much special together hurt dark spark move another n't revelry;Fancy Dancer by Frankie Valli.txt
Feel That Youre Feelin;Maze;keep feelin'you love 'll else yeah darlin lovin give 've ah ooh oh good get know youre 'cause lyric likeembed everything free single make need plain beside see set might self girl sad also somethin feelin' tenderness na chain day 'm like way 's bad nobody pity 're feel baby wan many feelin want hurt i-yi-yi-yi-yi every;Feel That Youre Feelin by Maze.txt
Feel The Need;Leif Garrett UNCERTAIN;light blind shine spread ta sol tough keep bitter leave love skin try cold self-worth say 'll child come yeah life let dirt give time nice ooh pay shower kitchen dim oh sent brilliant get deny winter grace 'cause loan lyric ca gon mind kiss little make need `` wear glow ai eye king sing bear wait see embed might around gift show also clothes break shout na really road pave like power condition 's bad '' 're hell never feel song baby thing hey tear world grandma alright fight render well n't send take fear especially mama;Feel The Need by Leif Garrett UNCERTAIN.txt
Feelin Satisfied;Boston;something ta chance us go rideyou satisfy 'll win come yeah ooo ride let give time people trouble satisfied put oh get know lyric feeling likeembed gon mind 'n nothing little weather need lose help roll whatever might also oughta ready tell na tonight cause stormy like music 's rock never feel feelin together alright hand well funky n't take;Feelin Satisfied by Boston.txt
Fins;Jimmy Buffett;dreams card remora high keep somewhere go montserrat come peace oh-oh-woah post white quiet care hit bar school cincinnati month sand bait south good ocean get three lyric ca reef teeth 'n save town schoolin help hang honey live roll may train boys see might around lighten land man right girl money also sail sun fee maybe close road circle day like way 's hop behind townembed still rock 're feel antigua afloat fin load want look left hand dark shark local n't season big take boat swim;Fins by Jimmy Buffett.txt
Fire;The Pointer Sisters;samson hold late alone turn heart love say apart pullin ... ooh jumpin delilah fool grip actin deny know start takin lyric lie fire cool hot romeo kiss split burn juliet burnin doin pause might car liar right also ridin radio na home cause close fireembed bet 'm like night 're word could baby wan tear want stay nerve touchin tight well n't take;Fire by The Pointer Sisters.txt
Firecracker;Mass Production;whoa name call flow woo love come yeah motion fine smile oh good get mine real mamacita seem lyric lie ca fire mind step yeahembed saw burnin poppin instant lady firecracker wait see might around pretty soft two also potion 'm like glad way lovely 's dance enough dirty fly n't move ophelia boogie;Firecracker by Mass Production.txt
Fool In The Rain;Led Zeppelin;light blind ten ta keep turn heart leave run love go wish say 'll come yeah ever give ... time 've people wall away ooh tire slow smile fool oh would rain terrible get think seem dream start lyric foundembed completely ca warmth always careless stop im doubt make find star thrill kind movie palm eye quiver believe till ive true first wait see might thought ground right aint fright show also breathless wrong touch promise body clock shake tonight swear hah really babe got dont wet like shin 'm block storm night longer hate 's cloud mess shuffle never ho-ho a-burning feel baby happen hey much blue yearn downtown watch hand corner minute stand sink reason drop around-round 'd well blow n't another move;Fool In The Rain by Led Zeppelin.txt
Fooled By A Feeling;Barbara Mandrell;like 'm whisper believe fool night think know might follow heart leave gentle love right feel feeling also lie wrong touch lyricsfooled likei want toembed easy make arm;Fooled By A Feeling by Barbara Mandrell.txt
For Love;Pousette-Dart Band UNCERTAIN;shop face skinny clean tease yah side none shoe ha-ha-ha-ha-ha love red lavish wraith try point empty translationsturkceespanolportuguesfrancaisdeutschitalianostarboy come god let church test hit trek starboyembed time 've starboy ah listen alive ebony whole brag wagon lamb put outta grocery lane get kill mood toy year 'bout pull loose lyric khan hear twenty rack ayy make centerpiece house need mama star motherfuckin king roof style fall hefty roadster p see might ivory competition lookin car gettin two man tryna aid girl money shade comin main also pain table dash pocket week sv legend really close mulsanne league edition overweight cup day 'm like pitt hearin pray crib new hundred far 's brand bad end cry lease switch song baby bitch blue bumpin look buy hurt cut every n't talkin take nigga milli piece bandit;For Love by Pousette-Dart Band UNCERTAIN.txt
For You And I;10cc;full drab coaster keep side control turn heart go street try quick pace 'll wander quiet laugh 've people motion trouble ooh listen understanding put comfort shock would rain game get know daydream one remain seem lyric wonder ca iembed everything hot shy foot make wisdom plain eye fall may answer see set might around underestimate beautiful downward change also ruin gold surprise road others like way must 'em 's doin' mmm behind 're never could roller anyone world bring look n't take pass moment sound;For You And I by 10cc.txt
Forever In Blue Jeans;Neil Diamond;long like ai sighs sigh honey beembed okay sweet sing 's might alone around pardon heart dance nothin lyric money jean baby sound treat fire ca also walk say much blue nothing tonight rather 'd n't talk maybe babe next forever;Forever In Blue Jeans by Neil Diamond.txt
Forever Mine;The OJays;bird grievin' heart love go lot empty ever lovin someone give ... time 've ah ooh trouble fine oh would good hopin get mine think pleasin' know belong one 'cause lyric please needin' make need kind ai babyembed forever leavin might around lookin right girl also tree na ha day 'm like along glad 's mmm nobody thinkin 're bone never baby wan thing hey world want together stay leavin' well n't;Forever Mine by The OJays.txt
Found A Cure;Ashford;itembed fix whenever ta love go heartache lyricsfound try 'll say empty yeah let ... cure medicine away ah ooh oh good rain get know dream likeooh sky ca gon sure little find make kind `` ai sing whatever see might loneliness right also comin pain promise na indeed yes surprise cause tellin 'm far 's work '' hope could baby wan miss thing hey tear blue alright big n't take hoo wake;Found A Cure by Ashford.txt
Four Strong Winds;Neil Young;snow high run go wish bound cold 'll come fare ever time 've back good would get think winter one meet lyric likeembed four sure mind weather fall may seven might lookin change also lonely strong alberta sea 'm way hundred wayyou 's work still could wind friend thing ask fly much movin look 'd blow n't send;Four Strong Winds by Neil Young.txt
Frederick;Patti Smith Group;yearning light name high keep somewhere flame death heart love go lay say fling come fast god channel breath care let give hi 've rapture head back soul express guardian one meet dream lyric wonder sky thy mind beat kiss spirit single angel sleepy burn surrender astonish capture abed dove ignite long awake sing shed room wait set might loveembed land two dancer also sail sun ready promise bye-bye frederick sleep hello tonight last journey maybe day like power pray night 's lord threshold deep entwind 're spare hey thing wing asleep flight moment;Frederick by Patti Smith Group.txt
Free Me From My FreedomTie Me To A Tree (Handcuff Me);Bonnie Pointer MISSING;handcuff seem song pointer miss tree free freedomtie bonnie exist;Free Me From My FreedomTie Me To A Tree (Handcuff Me) by Bonnie Pointer MISSING.txt
Georgy Porgy;Toto;long 'm key like hold georgy pudding confuse 's high think know see might lock one cry 're love never girl lyric illusion also wrong situation ca cryembed addict world systematic porgy tell yeah kiss contemplation ever make need pie 've n't young really;Georgy Porgy by Toto.txt
