title;artist;filename;lyrics
Lemonade ; Internet Money;Lemonade by Internet Money.txt;rodeo coupe pay risky bar fortune lemonade fentanyl fame ice wish big xanax loyal sixty give wock name turn put promethazine hate missin translationsturkcedeutschlemonade game bling wake dawg bitch mother change check guitar stick backstabbers god gift us nah near light bag stress neck grow suicide much way comfortably drippin roof college brother every gettin penthouse nigga grain war head new old bridge hatin land fire walk wo raf around brand burn codeine girl sippin everybody door livin oh-woah still ever ayy feel money xanny vvs countin cop could thank leash empty two nausey trippin water hop bless fill police remember everything yeahembed love fifteen seal oh-oh adderall life disgust earlobe believe juice plane lip talkin addy nice never miss kickin leave hey fiji pj back detain boy sucker fifty percocet pillow high foot nothing play rat grave day rockstar government karat ta pjs laugh shit
Lemonhead ; Tyler The Creator;Lemonhead by Tyler The Creator.txt;ah-ah-ah even doin sue tip cookin bet roommate move lean remind ten eighty give act young wet hoodie really waterfall paper rockin put thy use veivei grillz strap world bro game grindin savin chest woo-hah cost band good drop bottom low ha bitch spit color god rack pandemic spent fuckin us nah zoo bike hold th-the go-kart dust bad real bros lookin much way tote mean story gang call appearance every hundred nigga wu-tang first art tool sellin lame lucky free start green goddammit wo around gangsta aunt huh want help sittin pussy dope wolf lose translationsportuguesitalianolemonhead dive tlc still rich stage lil niggas car chew ayy brooklyn eagle ah-ah roll bunnyhop money shinin bart woo trez two-tone bite dog bowl house cuckoo look view million counter fruit six remember weiwei show love crazy skrrt ho gram twenty hunnid douch lemonheads finger life steal smoke ah earlobe nice talkin hill mouth hot remove back yacht catchin shade turnt many patek keep stuck hoe safe runnin mine pool spend cuz pretty cool fuck drill true man flipmode shit
Let It Go ; DJ Khaled;Let It Go by DJ Khaled.txt;poor sore alright tip big fall give wrist oneembed music oh-oh-oh crime put porsche richard beautiful use proud shine pick quarter sunny good cost bitch lyrics broke ya god price ball stack light baby sport way brawl fat hiccup call every hundred heart ask muscle block load fan thing time whip girl best uh dope sit second priority lil choice slow l frog w money sure end woo away look million whenever answer show love sometimes yeah-yeah mind mille life growin grind dollar bae back hustle pick-up control khaled straight another mony play stick-up dj air phone day small arm shawty try ta shit
Let It Snow Let It Snow Let It Snow ; Dean Martin;Let It Snow Let It Snow Let It Snow by Dean Martin.txt;delightful stop sign long grab pop corn kiss hold light dear storm still warm weather frightful goodnight finally bring really way slowly dying since hate tight outside snowyou goodbyeing fire place snow man turned low show home love
letgomyhand ; J Cole Bas MISSING;letgomyhand by J Cole Bas MISSING.txt;cole letgomyhand exist ba song seem miss j
Lets Go Brandon ; Bryson Gray UNCERTAIN;Lets Go Brandon by Bryson Gray UNCERTAIN.txt;pull cover thy bidn game go- joe treatin catch us light insane let- squid people biden mean brandon every though nobody hear green post time huh china want trump uh everybody chant ayy body woo sayin they- passion commie wit wakin hat hoe mandate fuck try aston
Lets Go Brandon ; Loza Alexander;Lets Go Brandon by Loza Alexander.txt;pull cover thy bidn game go- joe treatin catch us light insane let- squid people biden mean brandon every though nobody hear green post time huh china want trump uh everybody chant ayy body woo sayin they- passion commie wit wakin hat hoe mandate fuck try aston
Levitating ; Dua Lipa;Levitating by Dua Lipa.txt;rocket company even star need mar whatever bit eye music glitter starlight little shin far run blast electric sugarboo stop us energy galaxy baby moonlight way every rhythm ride time together translationsturkceespanolenglishdeutschfrancaisnederlandslevitating want lose ever feel tonight write perfect woo away love sky fly wherever life levitate believe dance forever renegade never premonition night nothing levitatingembed watch meet fell milky
Lick Back ; EST Gee;Lick Back by EST Gee.txt;even something merch truck slidin teeth fentanyl rip-off dnd need big brick throw active pull type somethin ten name advice wife point paper turn trap shoot put daily use hood shirt percent good wake alert dawg trackhawk bitch syrup shootin plug pain song rack us opps lick much people talk speak blick every get-back nigga next foreverolling chalk new ask start block load thing diss five best tall help yeek jewelry wolf still car slow feel bos set money raw bite movin outside house score knock away drive slip kick backyou strain kill fast skrrt fly johnny twenty tic-tac life bark p forever never condom silent back thousand pack foot many feeling phone day ninety-nine fuck spot man change lock smokin think shit
Life Goes On ; Oliver Tree;Life Goes On by Oliver Tree.txt;least babe honest wake feed light work bad baby ima way double-faced entendre fire lover want explain best hell wolf lose fighter tire place translationsespanollife season rip distract life piece believe nasty goner back control youre play keep day change
Life Support ; YoungBoy Never Broke Again;Life Support by YoungBoy Never Broke Again.txt;swerve least kilo right damn probably alive eat force minute need whatever kawasaki indo somethin pull fail support lack young act wet alone ridin turn dynamic de later shoot tucked disguise window trench jeopardize tellin youngboy thirty top zone prevail worth supportembed drop luckily expectin jean bitch pain demonic clicker ya demon-lover song lenox catch custom-made chemo blame calm hold foreign light feelin blicky insane real baby porch decide call gang every hangin shyne brain nigga hopin hear pendant flyer frank insecure block dime wo lord blog flood thing jet time whip god grandma mistreat girl want murder best mercy pride beam metal jewelry inside kid sit rock suicidal settle worry satanic lil hit niggas bear cousin feel takin eagle tonight black please flip respect shoppin throwin clothes cord aim none forbid lie goin die could outside dog granddad house tired look brr hop mom remember garcons love wigh breath rank gram pennies panic drug mind life heel storm enough hypnotizin miss leave snake tim blueprint wit comme lay dollar bae back matthew thousand motherfuck night high full pack straight hoe sleepover keep air fake ooh-ooh pool tryna spend day man fuck try ta home bust balmain
Lifes A Mess II ; Juice WRLD Clever;Lifes A Mess II by Juice WRLD Clever.txt;something swear stone fucked scream star um fall throw somethin give break peek pull finally live really alone turn hope put cold lion use bygone world pick lonely bottle forget us hold someone real taste pass lookin would way roar anyway three lately head heart free wo lord find imitation muh-fuckers want help somebody upset uh everybody inside seriously second ever slow promise feel translationsturkcelifes set learn click ii hole away ruin place earth look fruit searchin remember everything love deserve mess sometimes towel hurt rex life heel ah forbidden lip pe enough never leave face gunembed high nothing keep cry medication wall dom touch belong day choose soul fuck ta accept
Lifestyle ; Jason Derulo;Lifestyle by Jason Derulo.txt;notice comma-mas stone need fall cold bright shine shin jason honey broke diamond translationsdeutschlifestyle baby would bill dolla-la-la call every rollin stay wo thing girl want always uh everybody ayy body tonight derulo money could you-ooh-ooh lifestyle love nothin rihanna-na dollar colla-lar goodby night keep mine cry lipstick fuck
Like A Lady ; Lady A;Like A Lady by Lady A.txt;right damn whole mm-mm waiting minute break live music afraid levi twice lonely playin baby ladyembed lady call tequila every heart fight shelf hair long girl want sippin attention step feel tonight kinda polite woo lie look love mind life singin heel dance never miss leave hip boy night high phone dress man change think home treat
Like I Want You ; Giveon;Like I Want You by Giveon.txt;happy even wish need hm-mm-hm woah-woah really point disguise babe use game good hard stick blame overdue us every stay truth reason want patient ooh-ooh-ooh still ta save set translationsturkceportuguesdeutschfrancaislike mm-mm-mm waitin two view hm-hm-mm figure love sometimes scene oh-oh comin pretend mind guess believe hmm-hmm trueembed face seem play sense day table true try change think no-no
Lil Bit ; Nelly;Lil Bit by Nelly.txt;sell right coupe deal alright shakin funembed big route bit pull break messin road limelight headlight orleans club ciroc game good low jean tom front light ahead real baby lookin talk call fun brady red new tk socal taillight woah wheel country ride deer girl huh uh rock ice-cold climb lil ayy black roll woo pro wow nelly show love hip-hop life bruh ready goat freeze backwoods back boy haha town night another runnin skin-skin-skintight meet anywhere man shawty hoedown think shit
Little Saint Nick ; The Beach Boys;Little Saint Nick by The Beach Boys.txt;whole gas christmas cruisin really surprise cold little peel merry run famous stick nick ooooooooh pad real half goggles frightenin way call every red old wheel workin haulin walk rudy time deer ski hit toboggan sled bobsled year dozen wear north tale snow speed fly oooooooo-ooooooooh reindeer candy-apple cat lead aaa-aaa-aaah miss oooooh four oh-oh-oh-oh watch air spend dress man santa saint ta
Livin The Dream ; Morgan Wallen;Livin The Dream by Morgan Wallen.txt;meembed damn bar menu b need stranger really trashin anymore woman killin window pray world lonely good th trouble mirror care peopl people would friend stay rest bitchin sign long venue sippin sittin mama everybody alcohol livin still ever car hotel eagle cop picture away look sunrise drinkin kill else love adderall accordin seein life success judgin adrenaline party thousand night seem another dream suitcase day meet rockstar spot think hair
Lo Siento BB ; Tainy Bad Bunny;Lo Siento BB by Tainy Bad Bunny.txt;uste especial el amor haciendolo noche vo esto soy enamoro dejame serio huelebicho linda siento solo bebeembed oh-oh-oh de quiere yo una termina intente vivo gusta exigente trates tiempo estas dame comenzar era bellaqueando eso contigo ya del e pone puesto todo la fluye algo bebe ese nada definirlo barullo hacerlo otra pase vida coro mas mi oro esperando je estaba ajoro este por dime aca creyente cuando que hago conmigo pa en chingar si pensar forzar sin ti romantica ven cabron quedar eh mundo como ahora esta translationsenglishlo cambio ere siempre van singular repente mami caliente presente anoche tocandono hace eh-eh digo gira ni lo aquello bb entrar un oh-oh encontrarme tan miedo excelente papito miente enamorarme estoy pasar va cupido tu nadie cierres diferente intentes pero te alrededor se cosas
Lo Vas A Olvidar ; Billie Eilish;Lo Vas A Olvidar by Billie Eilish.txt;el even amor something meno soy echas al need puedo otro de hahaha pierde poison vuelve good tiempo dame care arrepientes la puede beso comun vas algo partirme would este dia dime olvidar que en si medirse choice translationsturkceromanapolskiitalianomagyardeutschfrancaisenglishportugueslo ah-ah please besitos dio con bueno aun veneno perdonas queda lo reap important un bajame ah sow waste va haras seem te paso se
Lonely ; DaBaby;Lonely by DaBaby.txt;even em stuffed damn extra leech sore blood-suckin chopper solid bet need big news push nervous devils pull act im break sneaky therapy grammys alone trap momma wasnt put shot skate use little hmm world bro top pick thats swing lonely weezy hide john k.i.d mood f good bottle bottom scar jean bitch rivalry stop stick fold army dababy catch pop cock camera fuckin calm saw cuddle aint feelin heaven baby dick would dont fourty-four till aggression brother rappin brain nigga first ba-ba-ba-ba-bap rollin nobody stay hatin havin hear either around reason pistol fan gemini thing moment murder best help soma stripper livin still ever hit car bear body onlyfans armor dresser giovannis bullet killer clean die liquor n knock picture away look kill love piper outchea happen hip-hop pipe reverend mj peter pretzel mind life dance feeder internet twenty-five harm never leave amiri hot lay crashin thousand catchin homies another foot play cry blow feeling fuck man ta pepper k shit
Lonely ; Justin Bieber;Lonely by Justin Bieber.txt;early pay fame maybe somethin give name killin listening lonely mirror price fuckin calm saw lookin call strange felt nobody old lo-o-o-onelyyou sick thing steady criticize always somebody everybody kid past still feel money idiot house everything else seein life age translationsturkceespanolportuguespolskiitalianodeutschfrancaisnederlandslonely glass tryna lo-o-o-onely change shit
Long Live ; Florida Georgia Line;Long Live by Florida Georgia Line.txt;doin truck pay cup sunup name midnight live dirt turn road cold dixie towner pick th bottle hard jean lot walmart haggard work cut wide-open pass way story friday sundowner hank old country long girl always circle leg forty park theseyou life longneck school party back throttle night glory day small spot
Lord I Need You ; Kanye West;Lord I Need You by Kanye West.txt;doin even west happy right court shut playground alright sunday need traduction freak give kanye break outta choir really italiana custody turn hour buy freedom fling use wrap audi complaint run nicely ring hard jean benz serenade queen taco ft. god wheezy barely resort us week baby sport traduzione talk would way speak mean call three prom first cussin lately palm gun woah hear seven lord around afford sixteen luxury thing time harsh huh always best rent mercy uh mama step spring still word angry feel without bell child since francaise translationsturkcesvenskaespanolportugueskanye direction could loud favorite walgreens drink mom everything devil show love sometimes room dad billionaire guess different collab shoe startin back kfc many safety silence service spend tryna day man arm try space think
Lose ; KSI;Lose by KSI.txt;whole loop walkin sore naked round star turnin wish need maybe wing fall throw give shark sound therapy alone shoot dumb loser cuban bitch losin stick mark saw light baby grow addict stompin almost talk story call buggin hopin thinkin actin next art stay fact truth old amphetamine parachute sea guarantee around thing psychic lieembed uh lose plenty patience wonder takin fallin draw underground stall lie could fish ground stare devil love crazy comin nothin endin bring demeanour back lost control another i-i grave runnin ooh-ooh righteous comparin fuck hotter makin run-around space extermination
Lost ; NF;Lost by NF.txt;rather train funny maybe fail really rein anymore road coat exit judge burden ragin trust pedal bad initiative neck brain grain toe though fact stay late failing perish level want plan add rent best pride terrific grid l feel takin grand learn cherish begin breakin residence hole away state joyful saddle tear mind life misfit mistake plant messy cloud pack charge serum runnin scatter tryna scarecrow list adolescent wish act point reward cautious hate canvas forget enter evolve mini mix trait unravel grow lookin fragile bury great flaw gun nuts blade fear around hero shrug inside settle sit sanity bear manifest merrily bos kinda field paint testament could dismiss scare wow look searchin show hypnotherapy savage guess carefully ready miss relate man try change treat probably tip need grin throw defensive rebel pull penny cage yes hope verse put joy planet demon use thought travel row good nowhere okay ol spirit pessimist data someone lurk way fair call jaw self-awareness shadow every pity hopin fit heart test lord afford huh translationsturkceespanolromanaportuguesdeutschlost circle help actually lose ever livin glove skip wear oughta love knockin rattle hol torn arena bore never screamin leave wit barrel lay tend heavy foot breathe spend value bane diligent think mad whole sore obvious big apart somethin james anybody fence admit human wash narrow pick combative honest cost handle pain button stick barely us shoulder pair week group hand anger friend sadistic discover ask quiet start matter find thing sin kid family lostembed prayin parody vengeance peril current million personal splatter repeatin book fly opposite lesson overdramatic paddle buzz back parrot high keep air intent dark day embarrassed oblivious
Lost Cause ; Billie Eilish;Lost Cause by Billie Eilish.txt;right something even damn translationsturkceespanolromanaportuguesnorsk easy wish maybe aware give really hour last cause send use thought straw run losin care traditionallost someone grow would way shy riksmal thinkin onc wrong hee outlaw track bokmal find time together always lose ooh-ooh-ooh wonder na-na stairs mm-mm-mm waitin could realize shower fine job a-a-a-ayy lik mind eventually complacent nothin leave flower italianomagyardeutschfrancaischinese face nothing mine ah-ah-ah-ah-ah air day anywhere prove mm think shit
Lost In The Citadel ; Lil Nas;Lost In The Citadel by Lil Nas.txt;happy right need maybe fall whatever sent give envisioning universe put angel thought inbound line victim god someone vent way halo every hopin note aroundembed stay longer find around mt time together still hit rmember feel citadel translationsespanolportuguesdeutschfrancaislost could close realize ground remember love tumblin finish forever never leave sing back seem play floor dream meet slowly think treat
Love Again ; Dua Lipa;Love Again by Dua Lipa.txt;rather right something teeth stone translationsportuguesespanolnederlandslove finally live anymore afraid use chest hard scar rain someone heaven baby would way heart hear find want somebody inside ever die goddamn loud la-la-la show love crazy tear storm believe dance disbelief broken never leave night sink many grave touch beat spend meet fell think
Love All ; Drake;Love All by Drake.txt;shawn something humble previously turnin need fall bit sound chill live paper turn sympathy send little shine top tennis good wake ceviri anything loyalty hard lot ft. height care priceless song price fuckin us flight light envy baby people talk way vegas reasonembed translationsdrake call discipline nigga friend reach violin jay-z bridge forth team shout billion reason ugly grab gangsta thing burn long girl want checkin help best uh everybody lose sit family still wonder niggas pardon fallin friendly end since r.i.p die could thank besides lifestyle two close everything kill love crazy pourin englishportugueslove dangerous destroy violence internet shoe turkce favor ready never individual lotta foundation enemy back night play nothing public build many touch phone value day fuck soul drill spot ta understand shit
Love Is A Game ; Adele;Love Is A Game by Adele.txt;sell whole fool easy incapable heartache al fall prevod portuguesdeutschadele espanoladele unbearable game good satisfy anything compromise lyrics pain amount height god care hold grow thenembed would speak fair catala defeat next heart expectation flood thing time impossible inevitable solve polskifrancaisadele surely traduccio learn puzzle end lie srpski self-inflict sad love mind unbelievable life translationsturkceadele code cruel satisfied another play keep dream cry feeling try change
Love Nwantiti (Ah Ah Ah) ; CKay;Love Nwantiti (Ah Ah Ah) by CKay.txt;ah-ah-ah swear oh-ahh nkwobi follow need fall dey give wey ckay put oxygen world honest nwantiti isi honey survive gbakam god e work bad baby i-i-i yoembed mean call nigga temperature fit nobody translationsdeutschenglishlove lover obsessed girl fantasy want ule uh lose valentine body without ah-ah tempoe totori tu-tu-tu-tu die tu-tu-tu ahh living love open finish mind chop life ah forever silicon leave sing eh-eh-eh-eh-eh tu-tu-tu-tu-tu nyem another ah-ah-ah-ah-ah rise man baba
Love Story (Taylors Version) ; Taylor Swift;Love Story (Taylors Version) by Taylor Swift.txt;crowd beg throw balcony letter pull young eye stand really yes alone afraid white little romeo gown pick run ring ball fade dead saw light real baby talk way story flashback left first head stay youembed quiet difficult start staircase around ever sneak wonder feel save hello please juliet pebble garden somewhere marry princess faith tired away outskirt scarlet close ground everything love version mess dad summer taylor kneel escape never wait daddy party prince town keep cry air begging dress meet translationsmagyarespanolportuguesdeutschturkcefrancaislove try think
Love Train ; Meek Mill;Love Train by Meek Mill.txt;notice even extra swear train fame funny menu think maintain jane act give rearrange number turn road hope bitin put trench little world turning shine game worth chest good bitch change bling-bling pain stop studio diamond god concerned catch blame fuckin dead us flight hold invent aimin receive light rev bad boo cut finessin neck people talk behind would mean hand call rappin nigga ego actin venom baccarat head nobody monster truth team hear strappin medium grab thing time burn girl trade add help cross uh rollie everybody livin rich hit niggas checker feel money learn none raw could expensive score away million look jealous listenin evil living everything private mmm love mess soon plain different impress jeweler believe nice resident never coffin leave bring itembed blessing back simon feedin night play many wildin keep dream hoe watch runnin equal feeling tryna spend value social switchin cool smell try ta toxic home bust shit
Love You Different ; Justin Bieber;Love You Different by Justin Bieber.txt;even right goosebump easy sunday tongue usual need pull give im beep dem cover forembed movie planet beautiful use bright fenty undercovers mother front color ting mix tongue-tied foreign aint light real baby i-i-i lookin way future every cant seat new drown truth fire di wo matter around time want side patient fi promise rubber feel skip morning fruit remember beauty love mutual york hurt kiss life different kind translationsturkceespanolportuguesdeutschlove lip ar nothin face youre night treat r gim touch beat edge goosebumps makin burnin think
Love You Like I Used To ; Russell Dickerson;Love You Like I Used To by Russell Dickerson.txt;solid strawberry somethings road use good band gold didnt blame baby dont way mean hand every fit old strong sweeter longer ride time girl always ive ever fallin single sweet toembed end could love kiss different kind lip back high keep mine feeling day wine change think no-no
Loved By You ; Justin Bieber;Loved By You by Justin Bieber.txt;right wish b need france whether fall textin turn buy hate run sand daydream castle ting catch wire heaven baby mile would way every youembed start walk wrong around thing time translationsturkceespanolportuguesdeutschloved always door still feel kinda end paint could two picture place earth look remember love crazy open room mind messagin different talkin enough wait thousand play build lovin day change think
Lumberjack ; Tyler The Creator;Lumberjack by Tyler The Creator.txt;sell company right cloudy swear stone wand wish-a-nigga-could ventilate wish blanket big celebrate warm pull type card malcolm really paper music buy put emerald umbrella alway beautiful use race credit grillz hood top far max th good performance okay ugh bitch mulan mother father color gold god quit rain catch dare stack nah hold fuckin la rolls-royce weather talk would mean call home coulda gettin hundred nigga cali shoutout ancestor new middle ask shelf salad seven size wish-a-nigga-would gangsta moment quality whip cryin five always tall motherfuckin drizzy uh utah rich hit niggas car sled black end lumbrjack listen milli score wow ear wednesday look uh-huh hop six close msg mom weirdo zero loan picnic finger different ah nothin ready never lumberjack crouton hey shoulda wait magic back woulda boy haha face full another nigg nuance treat keep yap ayo crumb fuck man translationsespanolportuguesfrancaislumberjack mad laugh shit
Lying ; Lil Baby;Lying by Lil Baby.txt;even fry tag probably boss jacob apartment sore pan shady swear clout gas chaser big move millionaire glizzies act pull type give name fraud eye somethin break gangembed really ridin buy put shot mask chiraq little top dumb game city dawg bitch playin stick chain god dm zelle pop catch pill dead us calm zoo opps light bag real baby way speak roof gang hang strange dice gettin steamer brain nigga nunchucks new fact truth gun auto post ride around time rapper stuntin complain pride nan thankin inside spark ven postin hit niggas lil atl ayy body pay gamble everyone roll sure killer aim none lie bite outside brodie dog entourage two house look chopstick mom snitch kill street crazy thumb page blunt range yesterday shmurda talkin bulletproof switch guy never striker jam losing back seem straight foot smurk watch fake tryna cool man fuck true spot ta lock shit
