title;artist;filename;lyrics
Post To Be ; Omarion;Post To Be by Omarion.txt;even eat deal groupie omarion fall pull give freak name c turn homie hahaha put club cold send ghost good pose section finna suppose pop us nah real dick winter gettin nigga printer discussion woop expose sellin fact aw team woah post ride girl want murder text chick bustin everybody worry booty hit rid fault save write roll money pic goin screaming loud grocery breezy dude close everything show kill love ho hol chauffeur summer ah believe mustard bestie bruh never guy leave hey itembed nope boy high hoe beat phone choose soul true ta smokin mad home
Powerful ; Major Lazer;Powerful by Major Lazer.txt;even something powerful star need beg pull give put lingers thought top infinityembed line run hold wire energy heaven scent every first heart swim fire walk sea lord time burn drain want mercy spark smile feel body lift please jump-start could close electricity love mind finger stroke enough never leave back high charge keep mine lightning touch power arm ta wild
Prayer In C ; Lillywood;Prayer In C by Lillywood.txt;time yah destroy life believe word grey waste hair cover never c child starve hey hand forgive send could die wrinkled world house silence land youyou sea man letter slowly prayer think
Preach ; Drake;Preach by Drake.txt;right whole convince secret al need wasabi wavy type break deny name young finally wet gnarly afraid hope put babe wave whooo scripture wray good record bone partynextdoor ft. pnd trust pop e jay sorry way translationsdrake gateway story call participation tequila nigga bank glo old youembed miami titanic hear traduccion find sauga-city afford message thing time girl want always reflect oooh miscommunication still hit brrp niggas feel tonight boring money direction drink state love ray-tay crazy mind tape payday guess different tsunami espanol preach liv miss hey cassidy hot messy party boy preaching sink assistant many keep connection blow tryna day man trip ta think
Pretty Girls ; Britney Spears;Pretty Girls by Britney Spears.txt;even damn whole funny follow mar beg act give jump eye thin pray world cost good glance line windows honey front iggy-iggy predictable us bad la baby men bee would jaw boys every joke wipe toe iggs iggy britney walk brit around thing time waist girl bizarre want always lose still busy hit iggy-iggs beast roll set noise betcha cake house drink softly ground kill girls beauty fly wherever mind piece pour chance australia bring hey thick buzz boy floor keep watch spend slim pretty true change laugh
Prisoner ; The Weeknd;Prisoner by The Weeknd.txt;maybe eye cold wrap hmm world lonely good hard woooo prisoner ft. del addiction real addict would way mean strange deutsche amazing destine burn long selfish want always weeknd slow dreamsembed feel without ah-ah rush hollywood end empty place look honestly translationsturkceespanolenglishthe love life lesson polskiprisoner burning rey bring ohh ubersetzung seem nothing decision touch lana soul think
Purpose ; Justin Bieber;Purpose by Justin Bieber.txt;position teach give card im last put send got thats hard spirit farewell grace god werent gift inner someone would way dont hand weak journey every cant friend reach heart ask walk wrong matter time cheat best ive sin step grateful ever promise feel please peace end learn look bless everything necessarily else happen breath sometimes everyday wherever tear lesson translationsespanolpurpose ease purpose forgive youre weep isembed decision keep breathe spend soul try think understand
Raise Em Up ; Keith Urban;Raise Em Up by Keith Urban.txt;right em truck damn star sunday woahembed eye stand buy white umbrella voice tear-filled band grace god song rain whiskey newborn someone baby toast hand shotgun amaze goodbye raise seat heart fist old trophy truth blue land strong woah along fight hear wrong long tall everybody pickup kissin smile ever saturday choice tonight lift black noise morning sail show love mexico sky fly pourin comin lighter talkin sing daddy stripe night high play flag glass meet makin home
Random ; G-Eazy;Random by G-Eazy.txt;og right pay accident solid follow randomembed need throw whoa bit remind type give slack young florida finally yes music hour passionate put flyin adequate world game california band london okay forget check happenin shh fuckin phantom cashin mccoy manage someone real handsome addict today sorry talk way define random toyota great hater imagine stay woah billion son bullshit find slide breast grab fan practice time sign girl want plan illinois attention uh everybody disagree rich bear mistakin feel save try please money less annoyed tantrum direction lie worldwide none listen two drive flex look hype jordan georgia breed everything figure seein sex blowin life crack guess female gerald cd hollow talkin nothin bay tandem ready anthem nope boy shade stackin nothing fake tryna spend difference fuck must translationsfrancaisrandom think understand shit
Rather Be ; Clean Bandit;Rather Be by Clean Bandit.txt;rather easy give simplicity name battery shot travel translationsportuguesfrancaisrather exalt inner yeah-yeah-yeah n-n-no mile continue would every kyoto heart oh-ooh land incomplete sea find shame long together step stroll beembed peace place scene mission oh-oh stake yeah-yeah different comfort forever chance bay switch everlasting wait casually sacred thousand another nothing dark ooh-ooh beat
Real Life ; Jake Owen;Real Life by Jake Owen.txt;bar deal coke alright fairy tip neighbor fall live really dirt tree cause pray world problem waffle lifeembed good band shake hard grass low queen broke god bad real baby grow way tv rc plastic anyway prom stay late green find around waitress girl food dive still hit model roll crown house loud tale drink drive love hurt life guess smoke dance talkin bore daddy town high play rude pool lovin shit
Real Life ; The Weeknd;Real Life by The Weeknd.txt;push really alone woman precious lifeembed worth good heaven real allow much talk would translationsenglishturkceespanoldeutschfrancaispolskireal mean call every heart stay late hear uh mama choice destructive learn misery away ruin love mmm oh-oh tear life nothin waste never boy seem regret lovin day choose change risk understand
Remedy ; Adele;Remedy by Adele.txt;right fool easy whatever shelter eye finally world mm-hmmyou scar ohhh pain rain saw cut wide way mean story every heart truth swim wo find thing sleep want always promise feel deep look remember love mmm life remedy desperate river cruel night seem keep breathe think
Renegades ; ;Renegades by .txt;even swear tunnel use lonely lifeembed hide line run care fuckin dead vision bad headache bed addict way every string gettin thinkin head overthinking monster rhythm along lyin luxury sleep laundry want still word wonder feel hotel without lie drinking look everything love contradict hurt lead mind life sheet miss leave hangover back sucker face night another sink fake beat question pretty day fuck think
RGF Island ; Fetty Wap;RGF Island by Fetty Wap.txt;damn whole trap uhyou shoot hunned problem lot zoowap ya stack baby beefin gang nigga shit thing rgf pure squad uh trillionaires hell worry niggas zoovie ayy money throwin die house everything mmm boom swell lighter bring dollar party wildin treat island pocket spend causin man try change ziploc
Rich $ex ; Future;Rich $ex by Future.txt;lowkey flame suckin deal replay ice deck big freak thangs number cruisin battery yes ridin audemars nip little glisten recess ex game good run cuban bitch tom piguet fetti diamond stop chain profile catch fuckin us bad baby neck flash future hang gettin hundred nigga smash vega link havin pimpin jet drizzle girl want rollie dizzy ever rich ap busy hendrix lift chandelier fleek sexembed vvs countin ear look ford kick froze show beauty love helicopter kiss sex passion sheet misfit never hot dollar ass back thousand face keep dj watch air wind touch fuck shit
RICO ; Meek Mill;RICO by Meek Mill.txt;notice doin even list probably alright chopper funny wish chaser bird move throw give im really woman reps owe hate fourth hood east game quarter drop trouble wake clear record run r.i.c.o bitch theses translationsportuguesr.i.c.o ting fade pop balance catch informant madonnas rico probation porter fam tony much people today talk way would wastemans gettin anyway nigga new nobody old stay land challenge free double-crossing payback king havin start hear block bullshit hair time sleep girl meek wanted cross beatle rich hit niggas ovo eagle year everyone please jamaican field squealie end cop woo milly listen could shaq wheelie place million view echo poppin jordan illegal lock dad summer building violence memphis enough switch facial never split r.i.c.oembed accountant back count montana play nothing many wildin keep dream forbes shhh equal beat tryna spend day meet table fed man graceland true never-never ta teacher think home shit
Ride Out ; Kid Ink Tyga Wale YG;Ride Out by Kid Ink Tyga Wale YG.txt;sell doin right something whole cure tone cold-blooded yg follow need catalog fall vamanos loyal teach pull type solo eye really paper alone ridin chase hope last woman statistic supper cause flyin hate stoppin problem zone pick good melatonin bone driver lot matador brown check crease stick gold fold burglarizing catch us g blindfold hold ahead bad real mile toast lookin people way driveway brother luck motherfucker call flee bank jimmy first next dicky stay fire quiet fight soldier history fresh rest ride relax syndrome around luxury thing time together pure squad coma fancy help best askin dope everybody door sit car rid niggas symptom motivate roll cash respect domino less dog two away drive fillet trippin look preferably hittas six close police remember pot show street death sake mob loan pope hunnid summer payday piece divide violence impress smoke believe forever code talkin nothin waste specific ready giant never leave hey four bo-boy heavy back feedin fake-friend night crew another quicker keep pete fake question spend tryna day table flea try mad shit
Right Hand ; Drake;Right Hand by Drake.txt;right swear girlfriend big move anybody chill buy last put send strap audi okay blast benz lot ya god trust ponytail bold work limit behind would hand late wheel around afford willyou thing sleep want always maui door past plate henny car thank picture everything else love street open finish never bring business wait back grip dream fuck man must fell ta
Riptide ; Vance Joy;Riptide by Vance Joy.txt;swear magician live turn movie running city run scar lump quit song michelle decide way unstuck lady hand friend left head new stay shelf start wrong conversation green thing dentist girl side ever translationsportuguesespanolriptide word away riptide close wrongyou love job pfeiffer throat york screen oh-o-oh guy sing high assistant dream dark cowboy pretty man ta think destine
Rockin Around The Christmas Tree ; Brenda Lee;Rockin Around The Christmas Tree by Brenda Lee.txt;happy stop fashion ahh-ahh-ahh couple deck ooo holiday christmas dance bough merrily pie tree everyone way rockin party every later sentimental voice holly hung singing new pumpkin caroling old jolly feeling hear hop mistletoe ring ahh try spirit around hall
Roots ; Imagine Dragons;Roots by Imagine Dragons.txt;stone always hell lose door rock throw anybody ta grow way road noise root back wave high another wash away trouble woah look day bottom rootsembed low find belief
Roses ; The Chainsmokers;Roses by The Chainsmokers.txt;stone turn beautiful little good bone couch daydream gold hand typical ahhembed heart old fire thing time translationsespanolroses slow feel deep could paradise favorite ahh film love hideaway room already life smoke waste never back weed night high drunk roam
Rotten To The Core ; Dove Cameron Cameron Boyce Booboo Stewart;Rotten To The Core by Dove Cameron Cameron Boyce Booboo Stewart.txt;mischief glad freak break misunderstood schemer hood world trouble bone forget mirror rotten low-life blame bad useless traitor call flirt blood unique next heart ask truth baddest wicked welcome door kid no-good past core feel friends could nightmare evil callous love yet hurt misfit never forgive back nothing coreembed dirty wall think home
Rude ; MAGIC!;Rude by MAGIC!.txt;need jump outta daughter live yes standin tough human put hate race run galaxy bed way mean till hand luck anyway friend heart ask altar matter rest jet old-fashioned girl best door family still saturday choice car without mornin die marry knock away suit answer love life never leave another blessin translationsrude rude question day anywhere man ta
Runnin (Lose It All) ; Naughty Boy;Runnin (Lose It All) by Naughty Boy.txt;stand standin turn chase missin voice chasin lonely us light win dust way every bury head memory callin matter fear together inside lose still feel allyou please drive kill else forever ready four face nothing cry runnin wall outrun change
Same Old Love ; Selena Gomez;Same Old Love by Selena Gomez.txt;least right apart im break oh-oh-oh loveembed hard forget translationsportuguesespanolsame now-ow heart old hear sick wo thing time still feel body tonight peace away million love tear mind piece believe kind waste enough leave back knee breathe blow spend try change shit
Sangria ; Blake Shelton;Sangria by Blake Shelton.txt;bar coast hut move beg fall lean warm number eye vacancy oh-oh-oh last white wave little dancin shine straw front stop spanish ball sangria hold skin sun light spin taste talk hand every string head spinning aroundembed around hallway thing time sign want door tonight tryin wear two drink close remember kiss lip shoe crashin wreckin buzz shade keep glass mine wine wild
Santa Tell Me ; Ariana Grande;Santa Tell Me by Ariana Grande.txt;tumaczenie need fall christmas give really alone road cold fling th wake mood blast hard lyrics care hold smart someone baby oh-woo-oh fireplace grande every next heart new fire woah translationsespanolportuguesfrancaisariana walk wo around want side focus year away snow beside love room avoid broken yearembed polskie boy night play feeling day cool mistletoe santa true fell try think
Save It For A Rainy Day ; Kenny Chesney;Save It For A Rainy Day by Kenny Chesney.txt;fool bout secret think sinking name eye alone turn music dayembed heartbreak cold cause beautiful bright world good wake stick blame sun bed today tv ignition call friend proof lately head ask blue habit time girl door plenty rainy ever hit wonder feel save kinda two away drink ifs sky happen tear escape remedy bay miss bring wait face high boat nothing beer floor lying wind feeling day tuck home
Say It ; Tory Lanez;Say It by Tory Lanez.txt;right even need gots move act break im young cause top honest low foreign spin baby would way nigga though youembed truth walk slam wo find around whippin thing time girl want always mama inside door ever car promise body tryin less since close keepin show love different waste bringin back play dough spend fuck hesitate prove shawty
Say You Do ; Dierks Bentley;Say You Do by Dierks Bentley.txt;even tongue need beg eye really buy use little good likemess wreck care baby bed damage doembed mean hand call t-shirt heart head truth long worry word feel tonight roll lie could mess lead mind steal smoke lay buzz back bend night arm
Scholarships ; Drake;Scholarships by Drake.txt;carbine swear translationsportuguesscholarships gas need purple move gutter give outta really paper turn shoot hahaha greed daily demon pray trench share butter city wake hard bitch change dodie pain nickel-plated stick ball rain spent stack us hold envy receive mentally lookin much traitor gang future metro succeed every gettin nigga seven-hundred lovey-dovey lately hubby-hubby fact blue usually callin want uh rollie ballin sit rock ever rich mayor niggas without save freebandz hah please money sure scholarship none woo jealousy could morning faze house cheddar doubt everything acknowledgement love private boom skrrt kentucky bentleys room comin basis already passion locate draft leave mouth boomin wakin back count thousand control jugg hoe keep watch choose fuck man soul fell ta laugh shit
See You Again ; Wiz Khalifa;See You Again by Wiz Khalifa.txt;right something damn big break stand turn road oh-oh-oh last yo good line hard hold work light establish bond friendship talk would way every guide friend reach ooh-ooh-ooh-ooh first strong memory start ride thing long always side cross uh lose family hit brotherhood feel without draw could begin picture pays place look uh-huh remember everything vibe love fly oh-oh lead different plane forever path switch never again.kembed oh-oh-oh-oh yup ooh-ooh-ooh-ooh-ooh another translationsportuguesfrancaissee day small home laugh
Send My Love (To Your New Lover) ; Adele;Send My Love (To Your New Lover) by Adele.txt;translationsenglishportuguessend big fall give jump last put send ghost good run okay handle guitar tremble baby way hand heat new strong free walk lover moreembed kid still body set none could love mmm ready everlasting hot forgive keep rise cool ta treat
Shake It Off ; Taylor Swift;Shake It Off by Taylor Swift.txt;least alright lightnin girlfriend move break music hate dancin world date good shake ha stop god player baby people gettin faker brain new hater hella stay late fella sick wo cheat ex-man translationsespanolportuguesfrancaisshake liar sayin could mmm mind nothin never miss bring mmm-mmm hey heartbreaker haha play foot many keep dirty fake beat think hair
Shameless ; The Weeknd;Shameless by The Weeknd.txt;need beg live last fix little good scar pain ya woo-ooh call closure deutsche time shame girl louder want always become uh weeknd sayin translationsespanolpolskithe could francaisshameless loud love hurt composure shameembed enough never hey ubersetzung keep nono touch shameless tryna fuck
She Dont Love You ; Eric Paslay;She Dont Love You by Eric Paslay.txt;heard star stranger distant break give use lonely band sunlight hold trustin moonlight dont way heart free ride time best promise fallin mineembed goodbyes lie away remember love different kind dance forever broken never guy forgive play another upon many mine cowboy
She Knows ; Ne-Yo;She Knows by Ne-Yo.txt;case early right notice em coupe instead ice beg move throw breakfast name eye ratchet wet turn classy shoot triple cause proud wrap mardi top drop bitch toya song opera mix work bad lick eviction baby bed reggie pass talk call nigga bounce first head gras team fella tripper wrong walk around moment long girl leg attention pussy uh rollie lose miller wonder hit showin feel soak takin ripper juicy jack cake j could morning two look uh-huh ceiling dude tina fill show kill love soon threat lip hypnotize tasha soap bentley daddy back boy face night play keep hoe watch air horny meet knowsembed cool shawty child home
Shell Shocked ; Juicy J Wiz Khalifa;Shell Shocked by Juicy J Wiz Khalifa.txt;right em whole easy need fall gutter fail give young live really hour buy bandanna thats undefeated city good anything shell bottom hard check rolex player us hold shockedembed aint gangster cut real weather bros fam pass shocked people way part shock brother call nunchucks whoever war raise ill nobody strong team fight hear wrong green start michelangelo post around hero girl together want plan side uh door smile family ever word turtle slow bear takin save lamborghini pie shredder pic goin sayin die could knock cheddar look hittas soon cheesy disappear believe forever pullin winner hey business four party back machine create face night battle orange dough nothing ridahs keep power pocket tryna man ta get-
Shes Kinda Hot ; 5 Seconds Of Summer;Shes Kinda Hot by 5 Seconds Of Summer.txt;tres girlfriend alright big bit itty really put shot tellin little loser neighbour thoughembed okay low queen understand feelin bad insane leader slob college brain three friend though felt head new king callin wo bitchin sleep plan always self-esteem na-na-na-na-na-na-na-na-na-na-na kinda cuatro goin sayin two mom bitty else job crazy translationsportuguesshes scene sometimes dad broken screamin leave hot four back haha dream med dos uno think shrink
Shine On ; Sawyer Fredericks;Shine On by Sawyer Fredericks.txt;time long comin sun lose life still warmth nothin feel lyricsi live homeyou alone wait joy shine house away woah remember wo home
Shotgun Rider ; Tim McGraw;Shotgun Rider by Tim McGraw.txt;ooyou fall rider eye cruisin road voice radio wake god us shoulder ooo someone asleep baby translationsportuguesshotgun call hang shotgun dinner friday head new puttin old wo matter slide time long girl ever slow without roll sweet end look close beside else love fast speed life singin oo nice lay full night another nothing dream phone
Shots ; Imagine Dragons;Shots by Imagine Dragons.txt;break meantime shoot shot use roadside moonlight lookin sorry way luck every gun hear wrong wishin load thing time always help side second bear drift single sayin empty hole away place everything show love mess mind grant escape bay wait seem keep touch ohembed change space
Shouldve Been Us ; Tori Kelly;Shouldve Been Us by Tori Kelly.txt;crowd even flame maybe eye little hide ya care us real baby downtown amaze war though thinkin head heart forth fire walk around thing want shouldve still wonder tonight sure perfect could drive close tug crazy mess pretend unfair mind heel different storm never miss thick back high mine dress mad usembed
Shut Up And Dance ; WALK THE MOON;Shut Up And Dance by WALK THE MOON.txt;shut eye last woman fading chest victim dare hold light helpless future teenage felt hoo bind girl together sneak discotheque juliet deep look realize backless happen destiny dance chance chemical physical bass kryptonite back bound night keep floor dream beat dress arm think
Simple Man ; Sawyer Fredericks UNCERTAIN;Simple Man by Sawyer Fredericks UNCERTAIN.txt;manembed something follow need young live yes woman sunny trouble satisfy forget gold someone baby pass lust heart wo son find time want help mama sit worry rich closely listen beside love else fast simple ah kind boy nothing day man soul try understand
Sippin On Fire ; Florida Georgia Line;Sippin On Fire by Florida Georgia Line.txt;meembed doin right flame melt ice need pull act give eye midnight alone killin flyin chasin little pick hide scar whiskey feelin call every goodbye truth blue fire along fight time girl sippin inside spark saturday desire bittersweet end lie look nighter slip everything kill lighter back night high safe phone spend burnin
Sledgehammer ; Fifth Harmony;Sledgehammer by Fifth Harmony.txt;right minute secret apart break admit turn far ha stop fever closer would every heart truth fire wo hammer together sledgehammerembed spark oh-woah hit feel body lift sweat contain lie undress could translationsespanolsledgehammer close love yet oh-oh pulse struggle vein enough wait play sledgehammer circulate beat cool
Slow Motion ; Trey Songz;Slow Motion by Trey Songz.txt;something darling tongue need hereyou give comfortable put club pick forget joint finna ya saw baby stay walk wo time steady whip motion door second sip slow clothes crib speed dance lip ready wait back straight keep dress shawty hair
Smoke Break ; Carrie Underwood;Smoke Break by Carrie Underwood.txt;silver doin instead cup need ladder break somethin sound wife tough generation woman little world top drag good hard forget stop feed fade pop small-town sun light ahead work bad swig stiff highball tractor college hand kitchen three first workin big-city son matter load grab thing long sippin oohembed climb sip slow takin set christian away drink hard-workin fill mom drivin job mmm sometimes smoke nothin never run-down mouth four glass watch platter tryna day man understand
Smoke ; A Thousand Horses;Smoke by A Thousand Horses.txt;right damn easy tongue ice tip gypsy pull put cold shot pick good ring stop whiskey downtown hand sway great first heart start habit around thing burn want oohembed slow roll sweet clothes blowing drink kill steal smoke nice lip float ballroom night beer breathe watch man perfume smell home
Soldier ; Damien;Soldier by Damien.txt;mad fall put thought world hide bible hold bad heaven would fist drown fire soldier wrong walk find side inside lose ever feel crash set could place water ground guess reaction hey sink dark question day man soul think
Somebody ; Natalie La Rose;Somebody by Natalie La Rose.txt;turnin need turn club hate shot dumb city good nobodyembed plug us light la natalie new nobody walk thing time always somebody everybody rock tonight end goin everything waste never leave bring party night play rise cool try ta think home
Somebody To Love ; Jordan Smith;Somebody To Love by Jordan Smith.txt;pay someday need whoa anybody eye stand prison likethey put pray little loveembed run bone hard lot mirror barely work lyricscan common every brain nobody free earn start lord find want somebody everybody year ache end die bite morning look water love crazy tear life believe leave hey relief knee foot cell cry sense spend praise day try home
Something Big ; Shawn Mendes;Something Big by Shawn Mendes.txt;something stomp whole big push pull break name outta prison last shot singing world bone anything shake hard forget us work win medal would hand three raise fire woah hear start wo grab clap spark settle hit feel listen two loud ground kill happen yell life lotto anthem four control high play foot air wall feeling ohembed think bust
