title;artist;filename;lyrics
Doe Boy Fresh ; Three 6 Mafia;Doe Boy Fresh by Three 6 Mafia.txt;mint tag garage brush purple wing big pull ten chamillionaire order smelly yes center trap last yo coca put movie cause planet send swelly strap world shine butter award good chest clear prime deli ring telly wireless bump ya pop peanut stack pinky snatch ken jelly real pant damage lookin murcielago tote till hand call choppin three new dicky hater stay strong slangin usually hear walk flickin fresh fresher pimp ride brand transmitter time smellin want plan best twenty-sixes always sedan sin dope attention ballin inside jewelry ever doe academy demandin car belly niggas body takin fallin year lift niggaembed spare flip respect grand money butcher clothes pound nine goin doe-d-doe oh-seven commandin begin smilin outside blind cannon ear address royal celly kush drive dispute clip petty kick peck fill holla street collar i-pod ho drankin chrome disappear mind impress xzibit code pullin hypnotize winner talkin grind switch never leave hey business da dollar jam aquafina back boy mafia night pack another mike slap hoe keep coin stayin mine pocket day leaf man hustler try ta cherry hair
Dont Blink ; Kenny Chesney;Dont Blink by Kenny Chesney.txt;instead secret news give wife turn glue put nap pray world worth good wake run interview sand god trust saw baby grow bed today half dont hourglass tv every hundred friend first next old ask start blink thing tomorrow best become livin slow year flip two look six mom fast pipe dad life twenty-five miss school thinkembed fifty high evening breathe mine tryna sweetheart man think laugh
Dont Make Me ; Blake Shelton;Dont Make Me by Blake Shelton.txt;even give dawn afraid worth clear burden stop scared beggin carry baby needin dont heart strong youembed free quitter find around time long girl want lose please set tire sure place look love leave heavy back knee lovin try
Dont Matter ; Akon;Dont Matter by Akon.txt;doin right even secret konvict watchin yes admit road oh-oh-oh-oh-oh-oh last woman yo babe tellin good queen check apologize boundary us hold baby much talk dont men way call every hopin first actin lately heart nobody puttin fight wo matter thing steady girl together always side everybody inside hit feel respect lie especially towards everything show love oh-oh comin hurt couple believe forever never leave seem satisfied keep wall self must true try think
Dont Stop The Music ; Rihanna;Dont Stop The Music by Rihanna.txt;aura move refuse music rockin cause explode chest shake stop mama-sa us baby stress mama-say lookin dont way hand candidate gettin actin nobody late start naughty around incredible waist impossible feel body ma-ma-ko-ssa please favorite away place look close show private passion dance escape ready party face play floor dj keep stayin possible makin ta
Doomsday Clock ; The Smashing Pumpkins;Doomsday Clock by The Smashing Pumpkins.txt;clock pay alive scream gas beg ashamed break im live afraid last whitewashed mask proud top lonely clear run dig ol survive hall stop likeis dead us youll sun win sunshine spook lick dont way would mean call every cant friend amongst bug-eyed unknown heart truth free hear theyre fear find message want lose ever bear everyone please lyricsis ticking end wage hole towards kill love apocalyptic kafka sake life depends guess ah jackal doomsday wait bound knee certain nothing paws silly kissing day ta
Dreaming With A Broken Heart ; John Mayer;Dreaming With A Broken Heart by John Mayer.txt;fall give eye stand really hardly cause partyou wake hard wondering asleep bed would part hand cant goodbye heart stay roses moment side rose roll could love room wont broken knee shes youre breathe dream cry
Duffle Bag Boy ; Playaz Circle;Duffle Bag Boy by Playaz Circle.txt;damn clock example bifocal star turnin ice wish need big break southside ratchet naw i.d. paper homie cold little hood top far pick game weezy good run okay store ha low honey bitch syrup front rapid ball catch barely fuckin stack us foreign bag duffle win pile focused yappin flow baby today much talk would call hangin bah nigga playaz next head new hater fact stay salad start walk hear callin session wo matter moneyembed ajar time want mane circle side ballin sunroof door hit lil niggas car bos fallin money sure countin die could class shop unless current look suede dealership kill holla happen soon ho nothin pamper toilet gucci enough never leave dealer hot river style weed boy thousand rim high wildin island glass hoe wall runnin beat dress day meet housewife cool fuck dressing shawty try true smokin home shit
Earth Intruders ; Bjork;Earth Intruders by Bjork.txt;paratrooper timber march pouring voltage metallic trench bone necessary dig mud lyrics parachuter us stampede ramble steamroller guide resistance head goodness tribe shooter sharp still marching canoneerers feel beast roll thump turmoil end flock twig carnage branch earth voodoo doubt shower love speed marchingembed intruder soil morbid grind forgive straight foot many skeptic grave furiocity muddy arm
Easy ; Paula DeAnda;Easy by Paula DeAnda.txt;damn easy sunset ow ice tartar whatever act name wrist young number danja turn chase white little weezy chart good dealin hard check paula ya catch phantom charter baby carter tony much mean till weak hand boys plaque fun head blue gun jet shopping girl uh mama sit lil slow chew bos tonight teen wise two gum crib uhm wayne girls holla crazy bother sometimes oh-oh easyembed numb already heel cutie hot back knee boy montana homies night play tryna rice man spot shawty ta hurry think
Empty Walls ; Serj Tankian;Empty Walls by Serj Tankian.txt;time burn choke wallsembed dismissive want pretentious attention yearn mind yesterday love family waste today body coffin leave behind anticipation dying taunt full die decline goddamn empty wall intoxication desolate fuck kill apprehension confines
Everybody ; Keith Urban;Everybody by Keith Urban.txt;need maybe give yes alone turn road voice little nowhere run catch dead sun someone way left new old stay hear find brand thing always somebody everybody ever sometimesembed bear promise feel save end somewhere faster drive close beside sometimes yesterday never leave ohh keep day ta
Everyday America ; Sugarland;Everyday America by Sugarland.txt;even alive swear joey girlfriend alright big fall whoa outta hope angel little good lifeyou sister hard scared us vision light bad grow would way hand college friday dusty great felt trophy sugarplum fight either reason moment tightrope sleep trade always rose box mama everybody smile year toy learn could reminder state place look stare love everyday life shining never wait daddy back boy town night dream cry dark day man backyard fell america laugh
Everyday ; Zac Efron UNCERTAIN;Everyday by Zac Efron UNCERTAIN.txt;even probably boss dyke deal whole need bird news poet type august solo eye live prison yes hope buy window shot missin pray buddy ghost hood adjustin ditch paparazzo good mood ballistic hypnosis overdose devotion september judge bitch lot survive hittin father check ya god care catch fuckin us hold potion co-defendant feelin bag dick chirpin decide coppin church nauseous every gettin nigga papa new rollin emotion middle plus truth holdin gun usually lord raf find pimp ugly brand screw message time sign facade squad sippin wisdom motion office legal bustin uh biscuits ever holler slow niggas slowembed just-a feel body takin pie roll flip chillin goin sayin waitin listen die blind fifth away drive look clip dude agree close drinkin show love fine yet plead drillin everyday sentence system kiss couple seein mind flacko blowin piece double believe imprison shoe switch misfit never screamin hopeless business wait forgive back key legally another dimension hoe outfit keep porsches nag blow beat amen spend day fuck soul true bloglist wine gorgeous mad understand shit
Everything ; Michael Buble;Everything by Michael Buble.txt;star minute fall whatever august wishing carousel far line ring sand song light coy la baby way every swim along thing time uh laembed smile word car bell kinda perfect look everything love crazy everyday cute pretend kiss life exactly ah believe getaway sing play pool day man true mystery space
Fabulous ; Ashley Tisdale;Fabulous by Ashley Tisdale.txt;even something whole ice splash discuss dip big need grey eye tea import somethig fetch fabulous inpiring little world bling good endless lot insulting renew request inspiring tote spain turkey excuse spa goodbye jimmy new old maine blue along wrong tiffany wo flip-flop relax chaise thing england want best help trash smile lifeguard hello perfect .... thank absolutely everything prada sky fashion towel choo simple summer hairband bore never float party style cloud moi pink nothing pool day trip accord hair
Face Down ; The Red Jumpsuit Apparatus;Face Down by The Red Jumpsuit Apparatus.txt;right swear makeup crumble fall push cover finally dirt alone put world mirror way hand hang every friend new drown wade rhythm effect find around girl still bear lecture feel surely pebble end lie drive look water ground ripple love crazy happen action hurt consequence life forever enough never hey face heed cry day man understand
Fake It ; Seether;Fake It by Seether.txt;sell fool follow whoa give raped esteem world drag hide good god fade hypocrite way flaw along wo reason best infection lose feel changing fucking direction lie season hypocriteembed whos anyone dream fake sense belong self fuck man soul
Fall ; Clay Walker;Fall by Clay Walker.txt;doin even right whole fall apart give break last world okay forget fallyou fade catch hold shoulder bad baby every though head puttin strong wrong fear time long always lose smile worry tonight away look doubt tear enough lotta lay mine day arm
Famous In A Small Town ; Miranda Lambert;Famous In A Small Town by Miranda Lambert.txt;yellow star fame bet maybe whether route need break point last put lens little game buck famous tight jean front stop stick catch us baby football much church townembed story every telephoto first nashville heart late sweeter gazette hear cheerin around seventeen quietly grandma ex-girlfriend attention mama everybody rural word rubber money end since wear goin casey die weekend in-law jail place season stare magazine quick page life red-handed believe disbelief tyler hey school turner shade town face high dream spend pretty small burnin
Famous Last Words ; My Chemical Romance;Famous Last Words by My Chemical Romance.txt;translationsfamous eye alone afraid last bright world shin hard honey mirror stop dead light asleep part speak weak shadow next heart stay incomplete walk jet always side word hotel black lie blind living love life never forgiven awake unafraid homeembed nothing many keep cast demanding change think home understand
Far Away ; Nickelback;Far Away by Nickelback.txt;case need give breathing anymore last far anything lyrics stop goembed us hold hand stay ask late along hear wo time long want hell withstand away place love breath believe dance chance never miss leave misuse wait mistake forgive knee keep breathe dream
Fergalicious ; Fergie;Fergalicious by Fergie.txt;tres eat easy t-t-t-t-t-t-t-t-t maybe bit really definition turn put suspicious little f line clientele honey drama check e claim work fictitious baby taste wee lady call boys lace sleazy delicious stay brothas vicious block tease reason around time tasty muah girl want always mama def- t-t-t-t-t-tasty rock patience hit l-i-c-i-o-u-s body promiscuous try fitness witness stacy listen two squeeze pleasure look season h-h-h-h-hold treasure gym repeatin crazy e-r-g photo comin kiss s-t-e-y conceited uhhh bang loco hey hot four lacey boy fergalicious play treat keep watch blow beat tryna gather fergie man uno shit
Fidelity ; Regina Spektor;Fidelity by Regina Spektor.txt;song suppose always kiss mind saw lose fall ever word break protect sound never music sweet call sing fully voice friend foot course heart truly nobody keep heartembed good hear meet fidelity shake ground fell love soft
Find Out Who Your Friends Are ; Tracy Lawrence;Find Out Who Your Friends Are by Tracy Lawrence.txt;gas need big give jump really road thereembed ditch shirt top far bandwagon drop nowhere mountain run couch shake lot stick stop weather cream way fair hand friend fare heart middle old truth find around slide bind time want folk side somebody everybody lose rock hit car rubber end lie bus look water dry everything show fast crank never back high slap floor rise meet man think
Firecracker ; Josh Turner;Firecracker by Josh Turner.txt;rocket right roman big eye fuse paper likewe surprise cause hate beautiful punch little th good bottle wrapper tight handle stop stick blonde light dynamite heaven hang heartattacker joke fun great darlin red heart middle gun start son thing burn careful firecracker candle spark july slacker feel black roll sure look love fly quick kiss cat yea life smoke bang match barn hot ought hay back boy pack night better day ta
First Time ; Lifehouse;First Time by Lifehouse.txt;right something alive easy maybe break eye afraid world hide wake scared hold skin reality first unknown wrong find time inside lose feel crash tonight deep look love sky death breath wherever life chance wait dream feeling belong home
Flashing Lights ; Kanye West;Flashing Lights by Kanye West.txt;doin caesar damn apartment easy ago martin star gina florida museum month yo hardly hate babe mona dancin far paparazzo katrina store shootin mirror frontin ya thang nazi flight light feelin baby weather flash talk would ol-wu-wopte call foul nigga brain fema sleazy though first seat department lately new ordered memory lisa difficult start couture always side somebody past still hit car ayy visa recall without year yeezy sayin class favorite hors breezy view water show love page life believe shoe wood never hey woulda back straight floor roam glass author sweetheart man trip try think home shit
Flathead ; The Fratellis;Flathead by The Fratellis.txt;right instead dop eye da-da-da-da flathead stand ticket twice club stub bone check feed god bleed slick saw gin much talk mean call ba-da head ask hear sick wrong bleeding nose daembed ugly time stood girl want best everybody second ever car chew hotel killer could drive kick kill ba wherever aa-aa-aa-ah nice josephine hey da tonic back boy pink kicking dirty glass mine wall
Forever ; Papa Roach;Forever by Papa Roach.txt;paper hour last woman kissembed bright little lonely good pair cut story hang romance heart memory fire start wrong moment time girl sit fulfil listen realize dry helter-skelter tear kiss drug life forever broken never forgiven shred haunt forgive heroin night another scissors dirty dream mine dark feeling day man
Freak On A Leash (Unplugged) ; Korn;Freak On A Leash (Unplugged) by Korn.txt;company dictionary jungle spector marley yellow original stone spider alive shady david coltrane basement dear labelle stranger doolittle etta village volume harder chili order sound modern eye outta strait number live music paul road gaye chronic express sabbath innervisions woman beefheart stewart coat club western x buddy mask piano fabulous proud husker weezer janis top quest world kingdom stabber utero london chapman longhair floyd professor devo metallica getz innocent father sonic rain e addiction dead pill unusual fever costello prine jazz clash bedroom springfield bad bruce vol brian tracy mile pass sugar sketch behind riot rosemary loaf gang twenty-eight lash b- strange joshua vu brain dylan nash goodbye liz raise theory michael hank old thyme st. slowhand late king sinatra wesley sea yardbird lover tribe rust candy steady jet du ac/dc abraxas girl dock buffalo folk best side rose phil five stankonia greeting boogie everybody earle wolf lauper messenger grateful achtung freewheelin radiohead tlc wonder ocean everyman ray hotel aerosmith supremes rod lobos black nightbird los spiral marshall sweet j. aim collie jefferson veronica jag goin mott presley raw shape entertainment elvis n squeeze loud jobim sail away dre hole henley californication voodoo kick close joni tina doubt jackie dan natty disintegration loveless prayer beggar funkadelic piper sky quick beastie coleman mono johnny groove honky gram tear pretender kiss rex mind sex finger life taylor yesterday clan fillmore believe neil physical portrait image headed deja superunknown l.a. leppard hot rave four enemy river exile jam prince golden vista machine town nevermind theft bend night battle jeff flag crazysexycool notorious connection glory clapton gravel swingin sense legend bomb edge cowboy rise soundtrack social leaf warrior n.w.a pepper delta home franklin aladdin tattoo something sadness immaculate court pay cure lou al wish birth odelay blanc miracle brick smokey jane freak soundgarden go-go young drifter stand ono parton dawn troubled steve butterfield last de aftermath cheap assort lucinda tunnel carole janet imperial zeppelin destruction present maggot parliament puppet santana california davis city band record line gate meat era enter diamond stop guitar chain song haggard catch compton gift guyville hold eminem howlin crooked trail wire cooke collection drake kink sane la mathers jimi trick merle logic b.b damage moonlight artyfacts mule shuffle infinite buzzcocks lady leeds brother heat def crosby inch definitive wu-tang roxy great blood red new filler ill atlantic recording jesus bridge pearl engineer blue gun skynyrd fire wheel country tambourine tommy tragic dime williams revisit experienced track fear abbey pistol randy brand mayall morrison psychedelic holy reggatta document creedence sleep asbury meter moondance spark door patsy youth innocence hunky saturday hit bear buena rubber eagle year parsley astral jackson please rush russia run-d.m.c toy domino transformer wilson park underground mitchell holly layla nelson dog ear newport computer cosmo bland echo earth dude darkness police remember bookend blondie american show coldplay television else street crazy various death joplin cooper bonnie division peter berlin gris-gris pretzel boutique shocking quadrophenia walter lauryn sam pogues bay memphis budokan outkast ready anthem bring tim harlem business heartbreaker wait pixy magic phair pj dummy straight play public nothing another many dream rhymin whitney aja cry power odessey carpenter run-dmc criminal jerry small bo society man graceland volunteer elton true harvest child change grape burnin arm nico george rocket rodeo carlos tres poor bloody force star layter doll beach attraction clearwater harrison variation buckley kraftwerk linda hooker master tea bob gear prison murmur sage gilded skin-nerd hour buy unplug shoot violator orleans joy planet illmatic pet richard ghost ok excitement charles aqualung little jethro rejuvenation bright anthology east apollo square lonely nowhere good mac run dire ike robinson electric tom patti survive brown ziggy queen graham bowie opera chuck bold nd boulevard blonde replica light barry dookie heaven downward baby lennon/plastic suicide sgt today people rosa cyndi way massive spain fleetwood hysteria miseducation call aretha nebraska boys every kronikles eurythmicsembed trout b. appetite temptation papa ltd nail heart head rhythm lewis joel station sandinista green tumbleweed post strictly main mc byrd supreme elephant roger fugees willy murder food help cool dory grievous py metal box q still valentine miller nickel changesone ronstadt impression hendrix model dolly complete oasis tillerman cash money mothership angeles killer end funky mary toot raitt siren lp surfer gilberto j beatles faith score tapestry enchant sleepless moon lynyrd chamber beck parker lo gumbo love usa ramones synchronicity parson revolver want bollock york berry lead cat hombre unbelievable springsteen double experience kind portishead stroke captain hill airplane giant never factory alanis willie leave breaker look-ka workingman automatic mr. antonio blueprint genius sing stripe preservation siamese otis key simon pink pillow b.i.g full foot pumpkin dirty reed chirping t. substance wind service slim singer robert hoople muddy trans-europe stan must highway brew billy sell happy eno loretta damn derek attic mayfield marvin slant purple big wing fall mar revival christmas stevens warm james paranoid artist ten graffiti parallel torpedo rage blige dirt tree nugget rumour rope sticky generation album yo white thrill morissette angel folsom radio cricket zombie thompson johnson r.e.m sunflower john pronounced attack minuteman moanin epmd hard low invention bitch production mother browne button sinead bobby color grace gold avalon daydream habitual bleed moby vitalogy nick us garfunkel sun crook reality week ladyland third/sister wee wailer closer cream burrito light/white talk men redding group story ghetto kingston maytals albert fun dusty jimmy first war bryter next marquee replacement smash jay-z mezzanine feature imagine mellon abba newman session fresh frank load parliament/funkadelic thing time sign bat surrealistic license sin hell lennon mama step bunnymen kid nirvana horse steely rock family nation reasonable tull leh-nerd allman car rid rum desire bum tonight depeche thriller exodus van single halen banquet jack lee sweat nine eliminator u die stooge morning ii ronettes house gabriel two picture velvet psycho pleasure sodomy million petty cliff water ultimate harding chateau book something/anything beauty fly super todd tape building stardust eric iv cline joao regal forever ritual quicksilver palace remain diddley enough bjork pavement disraeli u.s.a. pyromania magik getz/gilberto turner madonna sly harvey back dread boy zz houston high alice axis destroyer oracle curtis fantastic smith outlandos rakim wall dr. dark beat rolling touch sweetheart europe meet day rundgren soul ornette mode wild stevie lynn
Freaky Gurl ; Gucci Mane;Freaky Gurl by Gucci Mane.txt;gurl rubberband scream girlfriend secret participate ice mansion bet name wrist jump number ferrari yeaa put club window cause eyeball elimidate little shine spotlight drop cost record dig front pop phantom stack la baby handsome freaky college baby-daddy brain first seat new hater flare gucciland ride fan long girl want mane lamb uh mama kid limo chandelier single set money diggin ear psycho show uhembed crazy bingo pas conceited introduce hummer gucci guy bring back straight play oochie-coochie mingle hoe dj keep watch man fell think
Free And Easy (Down The Road I Go) ; Dierks Bentley;Free And Easy (Down The Road I Go) by Dierks Bentley.txt;easy alright sunday someday big live road radio boot shin spotlight line banjo broke pair sun sack hang old memory free ride around time ragweed sit pole stroll roll enjoy clothes could million everything life rocking yeahyou back high keep wind blow try home
From Where You Are ; Lifehouse;From Where You Are by Lifehouse.txt;thing tear us star wherever wish light apart sunshine hereyou mile feel never miss stand year would way erase mean shadow face little heart far underneath away beating everything think worlds
From Yesterday ; 30 Seconds To Mars;From Yesterday by 30 Seconds To Mars.txt;message gold quit fortune want map vision read life sit yesterday stranger enough never decide admit hereembed innocent call end learn none council face begin blood world translationsportuguesfrom mountain hard fear lyrics shit
Get Buck ; Young Buck;Get Buck by Young Buck.txt;reload em damn whole truck zip throw bet need bird whoa lean butterfly corner break serve swole presidential homie buy driving club radio shirt game pick buck okay store homeboy ha low bitch brown bobby stop body-rocking fold broke rain pop nah us bankroll work light cut patron aight pass sack way call boys old-school nigga bounce bank though first champagne toe iii hater water-whip polow hear hog block vogue ten-a-key nose tss around pimp thing quarterback rent dope jewelry door still holler rid niggas ayy bos roll money tennessee park purp goddamn morning dog jail kush frozen seventy-two show chevy love open chrome eightball piece smoke ready ban hey mr. titan back boy houston quickonce drunk lane play pack hoe watch whitney quarter-p vest blow beat pocket fuck man shawty try home laugh shit
Get Buck In Here ; DJ Felli Fel;Get Buck In Here by DJ Felli Fel.txt;doin right ow maybe southside number standin circus woman cold club comb top check proper trizzies flow taste sensation much would one-night twin middle he-yeaaaah lively jet clap-clap-clap-clap-clap atlanta level want booty feel brotha testin sweet playa-pay a-get learn goin felli away a-ha mind sex grant lend observe style charge phone ta home fool steamy isle give point massage explode g-string shot flyin zone buck yo-yo-yo-yo record shake fel benz stop twist thang gleamy mix shorty g hold crooked leavin lick pile mandarin insane tiger lady brother scandal lace san ringling incredible whoo sit word hit fo please hollywood sure ovation show private silk crazy deserve tricky ready bring ease tropez seem grip another shoe-string many dj man fuck spot change karma shit rodeo need wet put beautiful use little good run okay ha dreamy baby brave bougie half freaky way call luda diddy fit test station pimp motherfuckin clap bustin still lil body rowrr cash set flip celly ground love prissy couple juice stroke leave chea standard cell hoe think bust damn sutra melt bet big somethin type whylin yo radio hood game a-throw drop manner bitch handle mother heeeey limit spin invite gin talk bill hand motherfucker random three friend leather virgin thing time hell mama livelihood crunk tonight prefer listen invisible house two drink million view picky wood hey back boy jon keep air ayo day soul
