title;artist;filename;lyrics
I Will Come To You ; Hanson;I Will Come To You by Hanson.txt;star wish follow apart christmas ten eye proud thought world good wake run merry song today way every start walk around time want best side ever still oceans could place look dreamedembed close everything soon wander life never back face seem restless dream pretty day think
I Wonder If Heaven Got A Ghetto ; 2Pac;I Wonder If Heaven Got A Ghetto by 2Pac.txt;rather doin right even damn clock fool deal poor troop secret move give break pull conceal young rage retaliate live county trigger turn shoot po cause hate white race little hood guard worth row good wake bottle blast shake hard judge shootin change predict stop overdue stomach g dead snatch wasted bad latasha disgrace negro heaven real pass lookin much people decide talk would riot purse ghetto sock kitchen excuse nigga papa first raise felt actin though fact ask truth free fella block lord find around afford loot time hero burn long huh heal lawyer plan want large motherfuckin cease mama everybody plenty livin wonder hit rockefeller niggas bear fault o.g rodney year takin black tonight witness please erase respect skill penitentiary tryin mornin learnin peace end cop die could movin goddamn listen whupped class house tired racist place earth evil police fill remember everything kill street profit heaven-sent death mission hurt glock piece life violence crack juice mo retaliateembed enough ready never leave business president soulja pacalypse misplaced town face seem pack grip bush many label criminal meet difference man must makin fuck try table smokin think shit
If I Cant Have You ; LFO (Lyte Funky Ones) (Featuring Kayo) UNCERTAIN;If I Cant Have You by LFO (Lyte Funky Ones) (Featuring Kayo) UNCERTAIN.txt;mendes al read move translationsfrancaisturkceshawn admit babe hate good attach timing forget spending distance song hold consumed sorry half talk mean string cant thinkin toronto late wrong matter traduccion want text still without hotel write portuguesnederlandsdanskif drink view everything room espanol miss night nothing keep feeling try think
If I Could Teach The World ; Bone Thugs-N-Harmony;If I Could Teach The World by Bone Thugs-N-Harmony.txt;betta whole deal round wish follow fall teach eternally type armageddon give stand live turn playa last crime harmony cause shot pray little world thuggish thats east police-man met drop artillery bone hation critic backstab thuggin divine check stop ya god song catch united dead us understand charlie speakin heaven real writer much wide would way mean story muggin journey every define nigga war fist nobody stay old holdin free guidance hear wrong lord rest wicked dung fan time girl wasteland folk murder uh ruggish everybody door lose kid worry past nation still fighter essence tightest roll flip erase thugsta playa-haters sure please killer greet politician could dog especially lifestyle n warrior away thug earth doubt tha remember crossroad kill love street clone everyday thug-n-harmony hurt divide smoke kind mo repeat ready unfolds mr. freely cruel weed nooooooo boy high many hoe mine air runnin uhuh amen cuz day small choose fuck must soul arm pump true government mystery laugh shit
If I Had The Chance ; Cynthia;If I Had The Chance by Cynthia.txt;wish big move give alone afraid good anything shell pain betray blame us hold lyricsif story strong find time together explain feel without end learn could empty away love hurt lesson life kind believe chance enough never bring leave ease mistake chanceembed back cry regret day arm think home
If I Lost You ; Travis Tritt;If I Lost You by Travis Tritt.txt;time happen harbor find lose life light struggle sunshine bird wing half without would shinin learn knee could ship felt world fish dream trouble youyou day water anything man darkness understand dreamer
If I Never Stop Loving You ; David Kersh;If I Never Stop Loving You by David Kersh.txt;right even funny nervous bit sound really little anxious uptight mirror front stop real today way mean every though heart loving head ask start wo want always plan become rehearse ever word feel clearer please perfect end away youyou everything love forever never forgive night straight day true think understand
If You Could Read My Mind ; Stars On 54 Ultra Nate Amber Jocelyn Enriquez;If You Could Read My Mind by Stars On 54 Ultra Nate Amber Jocelyn Enriquez.txt;sell paperback heartache read wish fail movie babe ghost thought drugstores chain castle would way part reach old strong wrong time hero fortress feel could tale mindembed love mind kind often never novel back foot upon dark feeling think
If You Ever Have Forever In Mind ; Vince Gill;If You Ever Have Forever In Mind by Vince Gill.txt;moment fool want always easy find mind ever still past forever climb dance hill chance ready stand live music future lay last end heart mine may feeling mountain run rule love
If You Think Im Jiggy ; The Lox;If You Think Im Jiggy by The Lox.txt;right mamis maybe jiggy jump eye really v.i.p club porsche lens mona skate voice pee peel proper video jazz bad real turquoise nestle hundred moist bounce though stay along girl five chick trackin henny choice feel without black tint three-on-three escada prada fur biggie quick sex believe dance mouth hot style willies night rise ta home list even something pay bar ice bird brick act freak sean realest niggy honey forget benz shorty hold lick lady nada hatin billboard inside word hit holler sip roll mornin dump since cake could ear thug look deserve weigh regardless finish guess different thick getaway pj figgy play nothing able many r dream blow louch fuck hotter man try aqui shit ceo girlfriend star whatever lean bit im buy shoot quik rockin put use little shirt good dig sheek pissy bag baby dick way fat negligee call every gettin nigga females vs holdin british benjamin twelve china scorin still niggas respect tryin end guest doughembed love affair cat necklace mo bare never wit lay key mine spend chip think heard em deal tie melt gas bet big trial move fall name e-x nut yo berg owe tellin drop bitch lot us herbs jay pair crook week easily cream talk speak hand three friend next ask fresh slide thing whip together minor uh ven l-o-x-files checker two picture six figure personal book mess laughin o-l back boy haha drunk dough cristal keep wild
Ill Be ; Edwin McCain;Ill Be by Edwin McCain.txt;instead alive heartache fall eye turn trapping emerald tin drop good mountain color stop rain dead shoulder bed suicide way roof hang proof great ill old fight fan thing survival burn cryin together angry lie tune strand towards living remember love sky breath steal wonderful life lip captivate never depth awake back gallows thrust belong dress reveal
Ill Be Missing You ; Puff Daddy;Ill Be Missing You by Puff Daddy.txt;right even glad wish need move give break conceal anythin watchin turn express hope pray use missin thought truly far wake gate anything strength hard ha pain check stop proceed us saw receive someone bond heaven real flow pass today half would mean reminisce hand future every hangin define nigga lace friend great though thinkin heart new imagine memory team bein hear block son track wo around time always somebody inside lose rock step family still livin word hit stage feel without takin black everyone single kinda clothes could smilin morning empty shop away flick look six kick close show love fulfill open death breath sometimes life yesterday believe takeembed miss bring b.i.g. wait back face seem night b.i.g play nothing dough keep notorious dream feeling day meet man makin translationsfrancaisill try lock shit
Ill Never Break Your Heart ; Backstreet Boys;Ill Never Break Your Heart by Backstreet Boys.txt;rather right swear darling need give break live afraid little world judge honey saw baby much would way first heart ill ask wrong walk wo find time girl together want smile oooh feel without lie die could show love deserve quick hurt believe forever chance never face nothing cry feeling day prove try think understand
Im Afraid Of Americans ; David Bowie;Im Afraid Of Americans by David Bowie.txt;even god johnny want coke pretend help star pussy suck need im car afraid anyone woman joke brain lo-teks world comb americanembed look wheel american think america hair
Im Alright ; Jo Dee Messina;Im Alright by Jo Dee Messina.txt;even glad alright follow route letter give im young tough supper hate beautiful send bright singing world top good beating tight lot stick god light three-piece would call future friend chair middle old fight sight grab thing time long always rent lose kid family fax tonight year hello money skip end alrightembed class knock suit place look love crazy kiss couple mind guess believe hunger miss business sing losing cloud face another upper evening many beer keep dream touch better meet day think
Im From The Country ; Tracy Byrd;Im From The Country by Tracy Byrd.txt;wildcat sunday need im crazzies proud ya saw work cap real bed invitation way shotgun call friend old country long sleep folk everybody livin coonskin saturday cook field kick love hollow shoe hill meal bring hey hay back night full play wayyou day home treat
Im Not A Player ; Big Punisher;Im Not A Player by Big Punisher.txt;doin notice suckin force eat position tongue tone mulos capital eatin trois wish fillin repertoire hear stranger freak give im rub jump coochie multiple live tradition alone babyembed buy woman bath yo put killin fix shot voice bonin use gat top caddy climbin far grindin good tongue-twistin dig ugh meat telly forget phillies bitch lot pun pain tank bangin stop cheese diamond ball player catch pop fuckin givin work bag vocal chubby baby socket taste aight mustache dick sweetness half simultaneously sendin menage shack string torture fetus rough bola first darlin dish king quotables bein method start locas skippin linger ride pimp ts ugly mack thing rapper long motherfuckin best chick bustin pussy beginnin step kid blouse ever hymen rich word hit car unbutton belly showin curve .. fee core escobar lift feel cash flip packin money tryin attitude bumpin since culo tummy fish booth papi favorite away flick flex place outnice chamber hop punishment pinga everything rip love crazy hip-hop knockin drillin puerto blunt already sex finger blowin daiquiri chulo honey premium nothin bang pullin wood chocha bring sumo mouth split sing hip back face pink high unleaded crew cunt akinyele watch wall may pushin dream rise meet fuck rican boriquas pump makin mad home bust
Im So Happy I Cant Stop Crying ; Toby Keith;Im So Happy I Cant Stop Crying by Toby Keith.txt;happy something star sunday melt ice maybe news give im wife custody alone hope last universe good mother joint separation pain father stop within saw week baby-sit pass cream cant friend felt ask hear walk seven find time somehow lawyer o.k best legal everybody kid smile worry wonder park since could tearsembed two look darkness answer show fine connect sometimes tear sometime life different miss leave ease mr. forgive face night seem full another mine cry choose man try laugh
Im Your Angel ; R Kelly;Im Your Angel by R Kelly.txt;heard right beyond need warm give im hope put pray voice angel bright teardrop far lonely good mountain survive grace trust dare us near shoulder saw sun angelembed wide way call every fight hear fear matter seek find time want across side still climb end draw morning faith everything show sky oh-oh storm believe shall river cloud face seem high keep safe cry cast day difference
Imagination ; Tamia;Imagination by Tamia.txt;stuff slouch idea need bit eye turn use wonderin little top lonely drop store ha-ha bottom stop ya player us advanced chichi bad freeembed real much explorin behind would way freaky till gray fun head relationship nobody new imagine stay hatin free wo fresh thing long tamia want always uh imagination rock kitted still hit feel bos set sure south place look uh-huh close doubt everything else kiss life dance never miss leave back keep lovin phone day spot true man ta think
In A Dream ; Rockell;In A Dream by Rockell.txt;stop want always find mind wish need believe often ooooo real heaven eye never without tonight leave please wait face angel heart lyricssweetheart dream stay away heartyou close think love
In Harms Way ; BeBe Winans;In Harms Way by BeBe Winans.txt;beyond pay easy give order master refuse yes truly clear pain care price blame lawrence much would bebe way great rescue ask free chorus bind thing time want plan still word rhett without save lift erase set winans could undying margaret repay chorusyou place love deserve risk open sometimes sake hurt life generosity kind wealth harm never leave seem spite day arm mystery understand bell-byars
Inside Out ; Eve 6;Inside Out by Eve 6.txt;motif oblivion clock oh-so-frail tie need wicker lack eye alone turn origami put white beautiful stale rendezvous fold stomach sane spin cabinet painful would swallow ego heart chalk head youembed ginger hear sick find exhale ugly tender time burn want pride demented inside phrase blender thereof word fee blind empty rime faith state clip close doubt sad choke logical pretend tear ale mind bedpost nothin leave nothing sink heed so-cal watch wall tick-tock think
Intergalactic ; Beastie Boys;Intergalactic by Beastie Boys.txt;fry beyond wok guile whole hudson maybe trial rapophile im theme graffiti name number c live tough tree music last flintstone marathon put stir plot world shine worth run shake electric change check pinch stick profile pop dee jazz ahead envy moe galaxy mile neck stock spock sugar pox nile people cream rap mean shock sock boys crop awol adrock new old team coffee scheme hear start green disrupt flop relax soup around routine mock uranus always sour step inside smile slop family d-r-r-rop dial write try sweet biz clean keen goin knock sunbeam tammy jealous intergalactic kick fiend denial wop rhyme mmm hip-hop scene versatile beastie revile finger spread chop nice shoe guy lumberjack bring planetary mr. school itembed river exile party style back knee full battle another dimension keep dream dj beat cast gall table child ta wild steam mario
Invasion Of The Flat Booty Bs ; Too $hort UNCERTAIN;Invasion Of The Flat Booty Bs by Too $hort UNCERTAIN.txt;loveworm billie west walker zendayaembed oxnard stone shady blake sunset tongue b neighborhood dear corner volume harder sensational outta eye live really hitmaker allty xxxtentacion paul chase road redemption astroworld international capitalism thee x bennett joji mask voice trench havana utada pony youngboy world weezer far nwts scorpion area rbe gambino timing devotion minivan carti joe f.n clairo father unmastered care pop tory asahd rare fever vision v toliver bedroom slipknot bad asleep gizzard vol maroon real scummy yokan rap behind sheck riot college quando dice friday offset flirt goodbye theory michael dc sara smino loss stay late scheme chanel kairi king roddy lucas nicki habit wrld gomez kyle form lover maluma overexpose oddment rapper culture pablo girl khalid meek yung deathrace best xan boogie french wolf camila booty rich fulfil gkmc l legendary hotel without ep black vanilla kod j. thugger roy elevate less dave kodak slimey woo rnb mill bryson begin disclosure lizard n loud sail institution away snow claris troy punishment leak suncity fast sky version landon johnny action edition taylor life clan p collab dance goat ventura saba kelly plant throne mtbmb jam cloud age machine renni town montana sinner night golden pack melancholy unluccy mike kirk gttm dragon cole slap regret ggas rise kendrick sideline table iann desiigner rucci n.w.a pressure home dreamer case critch at.long.last.a eat utopia clout ice cent chaser chixtape bird jonas jane celebrate act sweetener young slime honcho hoodie whack melvin sean amine heartbreak member natasha scumz invasion ynw league playboi present shine romeo shoreline vibez loser peep california bone ballad section beerbongs divine enter twist song jetty compton catch mix tbt hold eminem g b-sides drake collection krazy yfn supply logic migos porter carol brother future metro revenge teenage eternal wu-tang great blood katy red seat lucci runaway new gore anderson monster jesus iii infest syre pearl santos gun country cassie track fear mosey s.a.n.d.a.s reason around untitled championship brand hero sleep chiffon ive leray ariana junk motion inside door settle weeknd born ski jeremih hit avicii jackson keyshia rush roll hollywood please childish stokeley perfect szn unreason assume thank fish paradise staple ed thug camel simz season eyez whenever tha wayne american dior show coldplay street jasiah lit death bentleys savage dex system sale kenny shootout g-eazy ye julia victory f.e.a.r nasir nexxthursday one-x tyler igor bas onepointfive party dummy recovery tierra khaled monologue orange boat nothing preseason inglewood lap natsu tpab straight r dj dream sheeran label carpenter royalty ixine shelby atwendys self man lana swift true noir child change space kodie karma spill rodeo wes reload milk hallow sob yg star capital drop-top zendaya total barter twilight grey // hanson trippie paranoia valedictorian turn luis nba hour coloring nip joy illmatic beautiful ghost race ok iglesias little popstar camp east quavo kissland worth koi good prequel cowys mac bslime tiller dame famous roach sabrina survive mudboy ifrtitl brown queen god uicideboy stoney yandhi cadet rihanna inner lanez rodgers light bag win perry heaven dropout baby carter beabadoobee decide xcx fat part call uzi lust /seven vida nav kyoto papa tirzah head vs drown test toronto soutaiseiriron uta megan d.o.l.l.a trilogy reset rondo post strictly ugly riddance funeral partymobile blank deftones fantasy extended religion kamikaze circle panther luccy selena lose q testimony pac ever miller ap lil stage still wizrd ec beast cryp coi njomza cash singular glorious feminine money tj teen wear trapstar killstation lp sremmlife n.i.g.g.a.z fabolous mmlp hndrxx cougar chainz moon btr travis chamber bruise smyle everything vibe starboy love warn pre gunna sleepy l.o.d u.s. hoobastank destiny beware tba bbno electronica nipsey scott double enrique storm juice marshmello flipp kind melii carlie chance reckless drip reject denver nas rapsody guala kauai sing thousand pacalypse derez chapter loggins t.i.t.s mine cube phase slim pnb stan brazy prove mad yachty industry damn kook atake madness tie macklemore aiko big fall revival christmas erys artist james ten kanye ddg name paramore rage melly gossip diablo dirt trap toxicity album wice tarantino white vacation minaj hood h.e.r long.live.a hussle game hikaru vert john rae miley partynextdoor formula willow gravy pun pain shane malone bobby grace bump dababy del acid jhene us jay certify zoo eli skin sun fonsi ave tyga creator encore xanarchy sorry talk beefin shannon happiness luv group story hand bhad ghetto grande excuse sremmurd three serious fun summertime ricch freddie jimmy next privacy emotion huncho imagine fhd swim jeffrey parachute session solange adhd bleeding prettymuch find dinero od time redd package heartthrob hell wizard gibbs kid boa rock eve family nation louse posner .. save dreamville write thriller jaden cyrus hyphen northsbest harverd u listen die nightmare ii ak jasmine two srmm favorite russ vince bunny cape diplo view ultimate yeo sequel bhabie .paak book beauty souled teal krit mcknight cardi super stallion sheff drug summer tape dangerous iv smoke reputation internet forever immunity bjork mustard project enough rocky rey wood tjay hey boomin joyner boy mafia face patch high bush beyonce english bodyheat sahbabii smith vance air dark wall beat tegan charli day meet eilish trip anti-social mode lamar pump issa blueface cabello
Invisible Man ; 98 Degrees;Invisible Man by 98 Degrees.txt;even manembed ohoh probably alive wish sincere hoh eye yes hour hardly beautiful pick hold light real baby taste lookin way call every friend wipe heart walk conversation matter time long girl always lose word feel sweet skip appear deep could invisible away look whenever close ohhhhhh everything love tear kiss guess talkin never wait ohhhhh boy face nothing dream mine beat phone spend sweetheart man makin wine
Iris ; Goo Goo Dolls;Iris by Goo Goo Dolls.txt;right alive doll give break cover later movie amyou cause world sooner bleed heaven taste goo truth iris fight moment somehow want ever feel tonight lie close everything tear life forever miss breathe touch think home understand
It Must Be Love ; Ty Herndon;It Must Be Love by Ty Herndon.txt;right something tongue tip deny break cover turn wonderin thought drop trouble light decide loveyou heart walk green around sleep want circle tall sittin inside car feel sweet sure drive place ground love fly already mind guess miss ought back control night straight dream air feeling must try think
Its All About Me ; Mya;Its All About Me by Mya.txt;right jump eye cause wash swing good forget tight slave stop hold boo baby wide way dinner nigga hell inside still body tonight cook thigh oooooooooohembed clothes look uh-huh love open life leave butt watch man arm ta shit
Its All Been Done ; Barenaked Ladies;Its All Been Done by Barenaked Ladies.txt;heard right west chord aisle dear fall beg thirtieth-century alone put hate run price win much way three fun goodbye next rome wrong time smile ooh-ooh-ooh past yawn love finger goodnight bore night beforeembed play mine cry meet home
Its Alright ; Memphis Bleek (& Jay-Z);Its Alright by Memphis Bleek (& Jay-Z).txt;heard right jigga gator sell caesar even alive swear alright clout fame ice need corner messhall name live point express hope twice last rockin realer skate use game date drop chest city record clear anything hard tight check ya negative ball blame shorty nah navigator pair platinum confess heaven real flow stress pass involve lady part mic dice gray every brain nigga bounce navy great war dish seat flubber heart jay-z ill nobody middle holdin impolite hear walk eight block size pimp rest find mc e-class hair latrell hover loc press provide rapper mics jet alike tougher best afterlife uh rock glow feel .. beitch set flowin jew-els money stairs less cop inherit deep die two potato uh-huh lye poppin six bless investigate close american everything kill else private holla crazy sky soon ho two-seater breath brake comin cat seein jel regardless life smoke extort nice liv project screamin leave bleek mr. harlem hot floss jam back backembed boy town charge play crew nothing jees-ass dough casket crater touch blow vest geah day fed man fuck soul try think braid shit
Its The Things You Do ; Five;Its The Things You Do by Five.txt;k-i-s-s-i-n-g need fall give share hoffa hide good line material queen proper gold within work baby doembed romance abc nobody plus thing uh inside ever feel body deep could j unity else love fine open understood mind nothin chance enough never leave straight nothing keep touch must midas prove think bust
Its Up To You ; The Tuesdays;Its Up To You by The Tuesdays.txt;big likei fall give eye lyricsi road hope share little far line ya hold saw much way mean hang every rough chair first next heart new youembed start find around moment time inside sit ever still word feel tumble look close happen soon sometimes mind never wait back keep breathe mine feeling toothbrush meet try change think
Its Your Love ; She Moves;Its Your Love by She Moves.txt;doin right something happy name beautiful send ot tight change skin win loveyou shock hand heart middle ask holdin spell strong free thing together want touchin emotional ever wonder takin sweet love happen lyricsdancin enough night keep dark touch ta think
Its Your Song ; Garth Brooks;Its Your Song by Garth Brooks.txt;wing give stand music afraid pray voice angel shin spotlight god song light every guide reach great heart new start wo find brand time always best somebody ever stage feel perfect listen place doubt remember melody songembed believe sing night play dream courage feeling belong true think
Jackies Strength ; Tori Amos;Jackies Strength by Tori Amos.txt;david turn hope shot pray camelot laid strength ring bridesmaid lot front donna youll bouvier lick someone real would till ha-hmm jackies sticker typical heyembed wedding popular old matter virgin thing want always box mama prayed inside lose still feel black learn worship lie moon police jackie pot show love lawn guess enough never hey cassidy wait magic recovery shes youre lunch sleepover backstage day theyve beenes think laugh anorexia
Jealousy ; Kim Sanders UNCERTAIN;Jealousy by Kim Sanders UNCERTAIN.txt;name gunnin put club cause max good forget bitch broke ya catch forced real baby sober way call gettin nigga stay king soldier start main find time whip girl mama still stage niggas cash crown jealousy could dog drink unless look jealous six mom show love life intertwine never bringin whats sing party catchin turnt high drunk runnin fake normal feeling spend day fuck ta think home shit
Jump Jive An Wail ; The Brian Setzer Orchestra;Jump Jive An Wail by The Brian Setzer Orchestra.txt;thing pail lyricsbaby fade want ale mama inside male teach baby nothin hill wail jump lookin jack woman learn papa jive jill stay hail away good look icebox man likeyou backyard ta
Jumper ; Third Eye Blind;Jumper by Third Eye Blind.txt;something secret tie wish maybe bit live icing put demon ledge pain light insane cut flash today would way friend first understandembed fight wrong reason want step past jumper angry everyone lie could dismiss loud away shroud code never leave anyone back boy face burial belong table think understand
