title;artist;filename;lyrics
Tell Her Love Has Felt The Need ; Eddie Kendricks;Tell Her Love Has Felt The Need by Eddie Kendricks.txt;ah-ah-ah happy need move warm dawn hope wed ship wake ring sand diamond hold light sunshine pass hand huh-huh felt free wo find want plan best ooh-ooh-ooh could morning away love deserve tear life kind never leave hey face keep safe cry wind touch blow huh-huh-huh-huh man child think home laugh
Tell Her Shes Lovely ; El Chicano;Tell Her Shes Lovely by El Chicano.txt;long lyricsda song wonderful bit suffer people really alone wait da sing .... lovely shes beautiful night another little liketell longer figure try think love chorus
Tell Laura I Love Her ; Johnny T Angel;Tell Laura I Love Her by Johnny T Angel.txt;early cart camille eden quintino tekno bloodboy stone lemonade fortune sonder z ashton kero khaliq arlissa hoodwolf volume sound outta modern aok swindell anymore paul chase undone international stir porsche pray alec tar keegan calvi anuel shay steele swoope february loyalty ring carti joe nevve swv judge meg jenkins army tito care pop e irie addiction hyde dead clearly fever v nest daye marta ryan lucie platinum remastered rico gogh puth snail motel bed kareem salami flexxin rap much yuck gravediggaz aldean az tally strange valee sloan kool shy hundred lauren ego offset raise kari anik jodeci nobody brooke bazzi trapholizay old moro cc late dante maco king along walk nicki fisher southern wrld vie nebu tender candy culture rapper jet cranberry bootmaker complex level unda plan aa pure holygxd side rent catali hbk moncler idk messenger youngin kay l brooklyn philly hotel daniella sketchy derulo azz vanilla os sweet lili friends roy garden kodak draw battistelli killedmyself mill harry shakur shape izniik minogue neptune westside hole away muldrow carey homicide snow kick rover stream blowout davey loveless bonito rawso fast sky nao bombing mei paige room tori tear meant god.damn.chan life ascend code rei favor rizzoo lavender neill return saba azalea youwillregret nuh iolite lotushalves pyrmdplaza taska town night confetti brinnand amil teresa math splithoff cole glory rude faux runnin bonsai phone cast kendrick easton reese pickathon spiffy fry mina beyond pay revolution americana easy knight lou blowjob ice suck verify cent dip bird chelsea jonas loski majest inspire young brainer oak steffany swizz sean outcalls last nina mynamephin realign mpr grandson ernest invasion velous checc elliott doihavethesause shine youngr herojuana parliament darlene california sweetie davis souls mood brandy queendom paloma aaron section jason rosie alison kara otw kit stop burner chain nohidea pt troll southernplayalisticadillacmuzik thouxanbanfauni ily mix g eminem michelle bosh gian freelance drake pediko cigarette yfn addict margiela jillian gordon infinite kawaii delaney future phillip cypress accusation hect aulani iii anderson zaytoven loving jojo san popular fletcher bailey free hinds vuyo ingredient tommy liability track larry reason grab keef screw longshot lookout careful madd blinky cross door daytona swaecation noaaon ski kc short focus doe bear castel atl hiya lindsay carney ruthanne lift kaptain keyshia rush keys perfect babii andonov park steves somewhere winston lie mitchell droeloe oates holly ttdd staple stoner simz remixes digital preiss tha wright taoo weigh death customize mj sierra offering numb nahmir bryant finish g-eazy ye julia batter sarah shoe bulletproof learning tetri broken bahari anthem harlem passenger scone bentley frex kevoe hr tierra rim vera another nothing play sink safe power royalty rita baka rice teairra swift sola saint wine spill goosebump elyse uber bjorn opening babylon milk graveyard sob jaylon girlfriend jamie mammal alessia rivera follow warren medicaid colorless loyal diego rebel louise thread fraud leek bobi turn afraid glasper lykke put planet charles prass sanchez camp liberate quavo maggie nowhere good th john.k f rising dierks robyn blasko jean aid drama tank mstoctoberoctober bible lining jhen bbyshoe surrender data prolly kingjet menace nd holiday empowerment elohim cut sofi carter lindemann hawa burg almost jennifer frvrfriday njne shadow ekko buzzy b. namek rabbit sway note temperature diddy bubbly niko falcon coffee evers reset rd altitude forgot post ilkmoney main vhs mt ian riddance mason whippin illyminiachi help enterpri lore selena mall q dive ever uu miller flexa pinball cousin promise boule curve esydia cassadee cash n/aseptember flip linying tj student noise skip end molly temi crown b.o.b amy sammie detector frankie xone fortunate ayeeii christopher flava ingrosso danger keisha evil ground e^st devil judy schilly suu sake b-legit lawren blunt delirious twenty wont burak l.i.f.t experience kind paris damar mo taxi chance edgewood socialise instagram bare remix alyson mr. burbank yaw heavy series smooth lunch comethru robert nessly advance osiym marqo scary november mad think niggalodeon petras naija em gee ooooohh vacationer denzel levine ddd tie tootimetootimetootime alma strawberry bet jvck syd move bishop christmas aguilera warm mobb shark mindset break vonathan august gary foe florida laurant vai daryl calpurnia human krista knd yo emerald macca chief terrance mistadc hood zombie game johnson artists john rae laura honest merry overdose hard nesbitt degree esco pain shane nove bobby stick nokia holo madilyn thorne rack rhye kristina wolfskind villain jb timeflies tyga busta chirpin cream uchis nombe men speak brakence story sigala fantasia fun thunder fallon first blvk asiah emmanuel privacy poop n/aapril goldspace pusha souf eraser salad newman bfs catherine bryn matter fatbran holla-day tailgate find seventeen wicked finn ginny chris freedia redd timbaland ohb fairytale package heartthrob m.r hell mama mai gibbs rock remy t.k.o lotus boa eve morningsiders moses stat leap .. tonight jaden monk yoself classic lee gawd shwiggy killy wise cero weekend strand r.lum.r srmm vince two house bryan knock cape diplo ekali current tammy view sunrise solitaire water colour ign elel rum.gold rimon pol mitski juiceman awa burna thumb mess ba raiche cleopatrick deluxe goldn jake chloraseptic ebz remmi goon skyzoo drug jasper activate anodyne veggie breeder science chaz gucci hypnagogia desperate adrenaline sorrell ban wifisfuneral nobigdyl madebykuya back boy count hamond caroline shade patch woodie universal dough von casket rob jon sahbabii re-release air yaggfu kymie rockstar eilish n/aaugustaugust trip shawty hmlt ora k murray wiz lynn sudan bron west kilo clara boss falcxne apartment denm blake northern ago alright chilly s. faria barnett dear hawthorne stranger nervous leone tari goonwick wrist eye maisie strz county trumpet carlile rashaun ferrari tough dancer x joji wave haywoodindahood world lyfe top far sjowgren max champane neko rbe maddie curie kunzite bottom monroe lolo tika hall rokusho godsmack yourwelcome vlone jt trust rain sangria christ mannywellz caer rare reyes kiiara pleasant kap skool mccoy summerhill sunshine bad stoopid energy flow bronco continent mufasa tola hitter wide would bebe bee sheck mean rahel monica cyrax define karun friday elliphant swoop bounce cellphone chainsmokers chicago rollin compare ceelo fidlar stay slaughter b.o.n.e st. katie channel yu dawson hobby gomez naughty angello ludwig andre jonna dramamine wic choc stalone apple want soulmate sango tomorrow alicia boogie french kylo jah-nay beginner dominique dexter quinn visa onyx amala feel narf handgun pum elevate solarsuns bea dreamcatcher raw bryson hell-on missy keelan wednesday laflair mommy zombies state suit dre superorganism townes doubt sad mutual bieber lale simmons pristine luke urban cute cosanostra nonono bate toni kiim finger taylor miranda rabino nocturnal kiddo dance nice smerz grizzley jim inga abstract bastard madanii adamn l.a. kelly mistake simi /\ nvdes silvas ric jam bae river enemy golden sinner pack cosmic melancholy flag mike dragon woozy rainbow fallingwater guatemala a.m.i.l redman normani author tmmrw lipstick table letter houndmouth ta sd case list lopez something court kailee astrid shut mikey brockhampton darling coast jgrrey garage coolin caitlyn au/ra booby jane freak give sweetener jeezy yttling cover marian whack alone jvzel fischer cara icey heartbreak medasin hate canvas youngsta briggs fatbranuary anjali canty wafia raincheck superfly band lau chasexspaceout honey smooky junejune contact culver iluvtpc episode steppin prelude catch kruger gift camera waif soleil vory boo dorothy shakale grow emancipation lettetznow krispil aquarius owens wallen meiko katy okra red awol runaway new sosa ill atlantic sammi blue hotsauce lifetime tragic dollaz jabbar freestyle cassie file untitled womp kept zephyr hero gregarious holy sleep guevara nerve binobossbricks cviro ariana kirke talent bbymutha benton attention phora robotaki jeremih miquela rotation mabel word wiser underwood belly ciaran year carvallo tey mcferrin wilson attitude paint skeeters since streetlight dej dog sensei coldhearted scare dwilly ear evangeline youngblood thug ruin khan earth graf american owen marchmarch rhyme starro crazy xavier lit various wendys soon dummo yiigaa omar pvpi sale peter viii sheet lighter mundi calvin calirayk nothin mishegas ignita ama carrie everlasting tim hex onepointfive bandhunta elley ronson p.o.m.s control scerbo straight orange cal upon ryahn dj dream pete feeling zoedajit lana ytk fuck penn society elton esso child slowly try milky anarkist silver jeremy mischief simpson madeline styrke star klein collide svlm capital iron highasakite beach magoo violet rinko grey pull nude baraz riz trippie therapy ezra oyabun aysha deaux madison mikos nap izz fume little nichols huron rosemvry halp row run pfeifer okay shanti blur pleaser craig electric tom mirror queen studio subway god happytree georgi tarver bunz dee lecrae quill inner deadwood mae anna made-it brave dabbin ur jacqueline sumr people way danielle alex sve call lifeboat kate n/ajune cicada gettin cashwaveyboiz lucius kyoto orkid tirzah ignore clarity abc head jahi amanda land nathan megan program bordeaux waldrup festival zne wrong green rowlan n/aaugust clark joker lord ugly zac supreme hugo campfire fabo china kamikaze neighbourhood food bryce panther sir murder pussy smile dimez livin cordova ap lazy renzo victoria andy hendrix body a-trak escobar buzzin bell brynn experiment tinashe south funky misch skeltah ria purp j bus fefe ward neo sigrid vintage cougar carnage bearson ryte cod reparation berninger baauer wile decay poppin chamber devoe crocodile lambo jordan georgia parker haux amber kehlani everything lo gunna awaken morgxn becky sometimes l.o.d beastmode matrix wilt teyana ent cat dowell bj sniperghini ivyxm nipsey double happens raelynn blanca reachin never jae.t mango rapsody wit elysa bloom mvek sing kiki hval cheer abadia kb lost jil kicking promotion mine spazz fake zoey slim singer t-pain ripley trae frumhere brazy finneas dolphin spinking america flipmode tiggs damn jade derek luz gngr pena gas deck big route mar fall jess hoey adreyn apart henry james type cxloe torpedo collins courtney parallel supersonic barbie dogg tree koryn trap paper alina belaire d.o.d brook funk poison analisa minaj lipa radio lush hobo arty hussle louisa fsu matoma laude excellence dwnearth pick tove felixx vert mumbo trouble b.i.d partynextdoor icelandia mick goldlink nont sza florence color height gold furious truthcity chapin fuckin certify mark skin marauder politics kish creator daz rexha warhol hand parquet greatly ramz war casanova copy jaira emotion huncho af swim jodnyl hear conversation fogtavious charlotte fresh prettymuch faceshopping mokenstef virgin sign long creep hodgy aleks lamb r.o.s.e kid skizzy heartstream andra ross blxxd ssn ludacris save sullivan vibration doja domingo jordy negra sweat pound phoenix chun-li everywhere bloodpop u maia listen gianna yoke morning zion ii aloe hurst favorite drink assa nelly drinkin kent figure personal playlist blacc beauty nasta book ruben cardi agnez connect drum birocratic glock kim daigle pashun abby eleven chop zenaware soften mahalia rosette allen dennis internet migo davie switch jzvel loony q-tip foundation mentality yukon alondra mafia outstanding face vanjess walka cuningham dr. bayla dark touch beat a. trace charli banba twine tash crumb hamiltones alae mode lsg skooly stefflon lamar plaza rue alterimage billie right shawn russo anesha caesar jungle el train lloyd r. david cathedral rus clay b yoshi famou harder order jump midnight demo juan lottery live really music road playa blvc cold freedom club kylie drax buddy cutler mari summa hayley cocaine waka namesake aprilapril scorpion gambino london timing devotion blaze faiyaz alunageorge verbatim father proper ya spacebomb october commissary lovato charlie mancuso negro vol real troye veirs kayo shae lenae nighttime dont reply common lucia maesu loaf winter emeryld luck tv mixtape riot superior earl reflection jxck felt sofia middle loss fight sick sea korky beatz lover musgraves oj gallagher maluma underoath rami gangsta fan n/amarch pablo girl gxnxvs tamia five yuno add rose upset everybody wolf annmarie ricochet camila ashe past july parisalexa izzy matt brodinski ray buterflies without aries bari j. bullet keith divination sauna trey goin dallas thenottheotherside loon north n loud potato milli pro marty pineapple felix tana heavn woke close biv troy sayonara prayer kidd bother happen mariah morgue version log kiniza johnny edition wander lahren sex trill jenn crack grant stizz yesterday vanderwaal mexikodro terri xcii dontae tru adidon lamontagne uncomfortable da messy steinfeld hip mmmm inna cardigan machine glen battle relation charge emily regret tomi normal serayah cowboy soundtrack rise moli desiigner pressure ply dreamer franklin luxe crowd eat bar twista vault round hudson wish noel frost diary ralo nikey guapo lyl ivy brick braxton axwell skye tm reference ruiner pharcyde stand hoodie gorillaz spade amine jazmine de natasha creation sheath cautious shot shorelinedothatshit deadly minimum playboi present pharrell janelle lunadira acre problem saxe loser reef pell city wake sivan mountain line yutes couros shake blunts lottie conception plug kenney marko enter taco wraith gummo thang wimble fade ball wound hold cktrl foreign work collection powell mnek la insane shatter anne-marie migos mxndfxkk yk spice teamarrr iiola fickle ell graye lady gunman k-ci teddy hoodcelebrityy n/amay joyride ajr revenge translation digable leo great blood bogan abundance foxell art lucci blocboy monster ashaya tk towkio iggy expectation winona gun fire melanin dime aaliyah mack rachel svnd nonchalant around pistol empress moment calum amara clarke xxix welcome deantrbl always mend motion ronny melo-zed alcohol kirsten rx busy gny hunter margielaa moore patrol campanella julyjuly jackson hollywood toy lyricslast regina childish deeper st domino simone deep cake jacin outside grae wage whoop ary look dude napkin miriam louis skimeetsworld refutation police raveena ppgcasper silk kill spectrum orphus street satica deserve private tre conexao colorado january garrix cuffing kacey repeat sam lauv nasir halle waste screen ready guy kravitz bring wait party icebirds demi n/afebruary khaled scrape reala infared many riley glass cry smook aja fedel flavor carpenter marlo ixine small sameik man jalen corbin change hi lhuma space boyz understand preme notifi cardona kali carlos wes flame marc joey yg tone secret dermot talia royce read site cookin whatever push aoki everette zapp clearwater bruised murda kideko hanson vine master wet mineo ticket nora behavior halsey xander dreamers overland hope hour madeintyo moonoversun shoot orleans ellen tingz reilly joy infamous ghost use grizfolk dram beaten chiraq ok digit bright east lonely spotlight aull karen tiller seater afrodisiac tarzana sabrina superhero evergreen sag ozuna ta-ku curious uicideboy missouri sasha jxmmi salt lanez light win valerie latasha guetta headache someone anastazja heaven dick xcx sober freaky mariner part marcos childhood tripolar cosgrove cope fredo schoolboy isley trainor pea nosninja scibilia defeat test abcd rell hella dolph memory creek immigrant lewis vice team lizzo history meditation ride yaffle mc bazan raye benjamin shift blank boomerang bizarre serre ukweli novah extended fancy capaldi somebody bradbery jefe ballin archive pm lose deezie bender stoopidxoolin spring moondoggies lullaby still valentine slow sylvan qc genesis peach jarren taylorr autograf respect mary wear burnette facepaint movin dua francesca mcgrath faith score ly sophie chainz testing arthur arnold shaylen hustling justine bless ash electricity vibe petri love lavery edit dancing zer alsina gashi impressed open yakul flatlinerz widdit beware tan yazmin simple tritonal honeyberry loote necklace scott leyya juice reckless quelle kaytranada cupcakke isaac imaginary xtcy leave snake peso ayahuasca school ireland artscience joan silent nizzy hector foot sazetrax platten realm swimming chapter headstone floor e- mayhem silence blk amen lovin pnb fireflight medusa rau barrymore kena hopperman merengue claus happy honesty gurl yann whole farrar deal daniel feat disco playground martin um slimeball trippple revival katelyn phoelix coul kanye name awwz juicewrld bada rage choir waterman movie scarface vacation liam parable angel oz ro lucile h.e.r swish wallow pronoun couch mavi low ne-yo bitch front malone avalon love-sadkid blame phantom us eli june sun glynne diamonique zucker ace sorry talk beefin goody priscilla no_one caine ghetto grande excuse brent premier tijuana unotheactivist friend noon reyez edian notd feature imagine truth bk vamp rowland callin start effect morgan shire wo complexion insecure kiera bartier pa gemini jae medicine allblack together leg polo uh clyde horse bronte domo mongeau yuzu jumper nfromthewave anne bnds birthday crash snoop write justin cyrus p-rallel hyphen christina fanning jxmtro starfire timberlake casey die promknght bootsy shameful cliche tye pt. tommie picture lndfk kiira sherbert mozzy brandi six injury eazy-e shower illegal p.skud bali drone interrupter ephorize summer killa ceremony dean tribbett heltah smoke leah reputation cocky forever ashley wood rey t.i.b.e elken hey lw smokepurpp howard lacey alien boomin curse miilkbone teon yrn myers major turnt bliss ant latency decision clinic mak keep mikky cordae veib virtue finis day meet fushou gracie treehouse haula wild thugs-n-harmony gavin mario cabello lowkey reeve company lyte rick original alive yellow kennedy marley clearance sunset troop svrcina tongue funny jeffries basement maybe akinyemi bubble m- lustig coochie starr meltycanon xxxtentacion volcanic khary astroworld patrick razor woman babe mask swae proud havana comb loved quest adult untold stabber drag megaplex saga hide totep thandi clairo hiss bourne marceon tinder-dates dacus tory pill unusual swan asteph eyed mickey aurora unstoppable oneill noname dolla sugar doowops cam copacabana lovelytheband gang sosamann mcreynolds adam goodbye natalie toe liz drawn twin michael wordz hoodrich idgaf vega update gaika judith darrein tribe lucas rudy kyle osiris flying haley redeau du salute atlanta meek yung khalid firecracker best xan correy vancouver grapefruit worry rich ocean li luhcream thomas lucy rixh edward rhett woodstock ep kwaku black kod whisper dave clean odie ciara jacquees crescendo mya flex loner uropa savo rayana jackie dan phresher gallant coquito sherwood milck kassi action vow panic scientist kiss cruisr already mind rex whinnie wonderful klp vene voidz believe januaryjanuary interlude jessie www foster renea four float jain style cloud prince age vista nightly montana madge fajita hashimoto h-town kirk jenny lava sleepover controller legend ben tangerine f. scooter intersection rmans marie castro reykon khalifa squeakpivot home disaster unfaithful even sadness cloves og maymay culdesac sumpn wham caly teo jorja planez timid march monet shaeane miracle whoisfriday undercover void shiloh blossom act remind lack daughter slime betty e.g.o k. deathwish steve sandra zhane wyclef chino glitter shanghai member hydra later re-wrapped jamila emma sanctify mogillah riverside league recess thirty jp shoreline zone santana nancy record dose bone swiss strength chocolate forget scar ritter heynderickx monae pinch diamond khale evolve song mini nola stl third otha hailee lanna lick jimi sexy gangin floating logic moss supply soduh lawrence lookin moonlight tony eben guaponese quarterthing warpaint unexpected django church brother def metro adams lovely crop teenage kamiyah dagny lougotcash audrey reprise bridge underneath deflo wheel country cloutboi burgess williams dena block elle catila latrell randy rapture hammer sleepdealer pronounce alarm legal vandross spark goonew weeknd bake second youth k.t.s.e blanksy sip waxahatchee glow hooked please roll bandit finesse flatbush tidal spaceout bent dracula asiahn could margaret buchek abir blac hopeful drive echo computer nowadays girls/boys season dayz glacier wayne answer show jones else orion c.l februaryfebruary savage dex olloway ari steal phoebe translucent different lils kiyoko payne harlan kaycee shaqdi outkast mail hunger miss tyler jesse freaking period thing/all barns noah anyone magic trinidad filli shon shadowboxers n/ajuly boat coco wonderland r almighty may eera criminal stalley pretty self miilkrate ndai arm true noir tyy hembree pale alan george shit treat mendes reload zilo tres cassy flores ismael bloody ruperto hopkins lingo n/aseptemberseptember chrislee nodfather soccer need snell kean huey wale drugrixh patrickxxlee // resound peas erin c finally bevier ratchet sage misunderstood yes exfiles beautiful d. thought clemmons shea emonifela jstlbby rogers apollo esskeetit duhe mac ozadya september resonance robinson famous linae milwaukee emilia brown holow mimi jordana berhana anthony harris ting pouya blackout wimi brett jrich le likey bag gretzinger hive perry baby today half deathbyromy april abel kai fat pry gato mushroom cult every ravyn uzi creature luciano nigga signal amxxr bank weight heart zouai lame after-party n.e.r.d spell voicenotes rhythm dro glaspy hrs mal station sauce sight infinity son skoolie feyi wintertime strive georgie grandma elephant huh skittle heals ella box actually testimony scarfo samara lil lani forrest yeter fitness manana ty money pentatonix nvm clair ink thru lp princess jumbo stille tired moon autumn gab ocho travis tenille hop crush imma wrinkle job achoo mothe mraz hurt destiny flexin spencer kolorblind vide tay-k storm loftii omi marshmello carlie hill drip a-reece eighteen assad flocka nas continuum key levert.sweat.gill pink full lane bella evan meghan glizzy luniz dirty louie reed stuck ashaun flote flavia sole tempo fou danny tukker santa temporary kodaline gloe daya lexus dopplegangaz billy josephina yachty tag jacob curry akacia deadcats hurd mcbryde hakeem artist foo graffiti asante lola ybn marcella admit foggieraw demand potter album white steel gotti choony glisten sia thompson livvia neva filthy acoustic drop lodola attack nudy cinema secure mindless gravy willow endless reserve lliam grace bri vara del acid moby price luther telefone flight jay bankroll landing zooted chloe writer wildflower pxrry instinct carry gin ima chaos luv bill differently swallow hailey sultana f.a.m.e fireplace t.i tee quad sremmurd coup serious upside freddie ape mi next dounia lately flo tedashii quiet rome hamzaa parden adventure atlas hooligan chantel frank caitie yi jose dinero champ thing time shame burn rn minor mane kooda purppp sonta zayn hack freeman herzig sg icona lifeguard playinwitme car farruko cunningham thriller single van w naji jack shenna kiesza designer ferg niki jasmine lfalfa luvin velvet needtobreathe psycho gibson place identification extravagant rule leon girasoul slump fine sy global fly caviar language xvl jonathan wherever pope dad tape dangerous corral trevor myke lotto rida mustard palace strip liv project warhol.ss rocky ecco eris ruuth birchett leikeli u.s.a. kimberly basic chvrches awake br purpose japan blessing joyner iceland fifty seaze nadia high ghoul bruno mony beyonce thunderpussy gyrls smith watch wall better ayo kd soul diana pump brad lobby greedo loui
Tell Me A Lie ; Sami Jo;Tell Me A Lie by Sami Jo.txt;even glad easy need name familiar live really alone sorrow cause drop ring net us hold saw real almost way hang lyricstell though wedding stay wispering wo around time want tomorrow dayyou spring worry word please sweet married lie place look slip close beside love pretend back town night cry belong man home
Tell Me Something Good ; Rufus;Tell Me Something Good by Rufus.txt;time something stuff babyyou aside pride wish inside kind baby give ta feel refuse set hour nuff yo put sho problem knock good fire day anything love
Tell Me That Im Wrong ; Blood Sweat;Tell Me That Im Wrong by Blood Sweat.txt;sunday need give im hard theres aint feelin youve happiness heart new old lyricscome strong free wrong lord find long girl want dayyou ive hit feel everyone tire morning show else love wont believe chance nothin natural foolin feeling day man nothins
Thanks For Saving My Life ; Billy Paul;Thanks For Saving My Life by Billy Paul.txt;hook glad likei shelter stand live anymore put babe problem pick run low pain stop upembed song dust baby would along find thing together grateful feel without save erase since lyricsthanks misery listen could thank especially repay sad life storm never wait thanks sing back play man understand
That Song Is Driving Me Crazy ; Tom T Hall;That Song Is Driving Me Crazy by Tom T Hall.txt;crazy time quit song simple boogie mind everybody singin baby break hurtin bring would part please gang sing foam mhm friend high first little play heart beer old drive along line hear okay kick low ta home love melody
