title;artist;filename;lyrics
Miss You Much ; Janet Jackson;Miss You Much by Janet Jackson.txt;apart boy-oh-i ashamed warm really embrace alone shoot g-g-g send world good pain ya baby much friend heart whose wrong long girl mama smile comprehend feel body kinda rush arrow end away whenever love soon m-i-s-s miss hot anyone face phone f-feel letter home
Missunderstanding ; Al B Sure!;Missunderstanding by Al B Sure!.txt;sell right something read gas maybe need apart throw give protect sound really demand buy yo f line ha change check missunderstanding diamond grow talk way lady strange every friend heart new pearl scheme start walk wo mercedes brand time shame sleep plan nevelle smile money funky drive uh-huh nowadays hoo-hoo chevy crazy swell tear health wealth never hey misuse face play dream lovin clever self ohembed must amends misunderstanding try ta wild eddie think
Moneytalks ; ACDC;Moneytalks by ACDC.txt;painting king-size law deal big break buy moneytalks ship little good maid diamond price claim us foreign bed b.s talk cigar red hear sight walk guarantee grab girl want french car hotel money pound listen house suit tailored fur fine yeah-yeah chef chauffeur steal dance enough hey hot dollar hustle night keep yeah-yow wall lovin
Moonlight On Water ; Laura Branigan;Moonlight On Water by Laura Branigan.txt;instead fortune need beach uncomplicated babe planet world lonely good line hard competition fade us hold work spin baby real moonlight dreamin reach next head wheel wrong matter mercedes thing want inside horse worry rid feel without rush money water beachembed everyday simple sex life adrenaline night promotion pretty arm wild think understand
More Than Words Can Say ; Alias;More Than Words Can Say by Alias.txt;sleep nowyou find mind lose need still word feel without way beside window seem morning lyricshere dream late look hear six hard think love
My Kinda Girl ; Babyface;My Kinda Girl by Babyface.txt;right minute need give number chill really likewe far good indeed forget stop care us hold someone real baby much way lady mean hand girlie first heart stay start wo matter lover around thing time long girl together always side inside lose still promise feel kinda sure deep die could two whenever doubt separate love room nice never girlembed control night nothing keep zoom touch feeling pretty day man soul think
My Love Is A Fire ; Donny Osmond;My Love Is A Fire by Donny Osmond.txt;knife fool darling need break trap quarter mountain anything low prisoner lyricsoh chain describe likeid heaven cut baby wide every imagine challenge fire swim fight flames find burn girl side lose search ever still climb word without tonight two earth look rule ground answer love mind life forever bass willing id river high cool ohembed
My My My ; Johnny Gill;My My My by Johnny Gill.txt;damn minute whoa break eye dawn yes put proud share little good mood low bedroom baby way till hang every first red matter slide m-m-m-my thing time long girl want step ever tonight sweet sure sayin listen look uh-huh slip show love fine room special heel singin believe never night high mine nightgown lipstick dress perfume smell likeand ta hair
Never 2 Much Of U ; Dino;Never 2 Much Of U by Dino.txt;right star funny wish need give sound really alone last cause share bright good lyricsthere sun light sunshine baby moonlight much way call every next heart stay youembed wrong lover around thing time girl want ever feel friendly u morning remember show love mind kind never liketake night keep phone day ta think
Never Enough ; The Cure;Never Enough by The Cure.txt;time hold big smile fall whatever push ever real however enoughembed enough feel much never way speak h-h-however fill try around lyrics kill
New Power Generation ; Prince;New Power Generation by Prince.txt;something whole fool making idea bet big rearrange give stand music hope generation weapon generationembed world problem worth good sister mother father stop care us light baby would way brother strange bury new nobody old truth shout fight sick block thing time join want help fashioned pardon try noise funky lie tired rule living love open kind believe enough thinking lay party borrow another floor breathe air power cool pump child change think hair
New York Minute ; Don Henley;New York Minute by Don Henley.txt;early cloudy fool minute fall wail advice anymore coat little world city clear line solitary care rain shoulder mark unfurl baby changeembed much people men brighter hang strange nail next head new heart station hear walk wo lover track matter find around thing time girl always somebody cross tooth lose wolf door rock clothing pulled year black please rush somewhere park lie harry siren morning jail gathering darkness everything love street sometimes york emergency disappear guess believe desperate never groan leave back cloud wall dark better scatter dress day pretty change home
Nicety ; Michelle;Nicety by Michelle.txt;right cent ruthless whatever james type name sound really alone hope yo cause boot game good attack anything ol nicetyyyyy honey tight likemennn brown innocent check givin mennn baby people husband talk men would way call every excuse joke new hoooooo-hooooooo-hoooo stay ask hooooo-hoooo-hoooo -- wo thing girl want step promise feel jack .... nicety-eeeeee appear somewhere assume sayin marry approach dre ho comin nicety smoke nice nicetyyyyyy nasty talkin remain never guy hey dollar meeeeeee opinion high keep meeeeeeee dr. may runnin question true try think home treat
Nick Of Time ; Bonnie Raitt;Nick Of Time by Bonnie Raitt.txt;star give mighty surprise precious unsaid nowembed line run hard scar scared nick us baby much decide painful behind call strange unbroken friend ooooh heart shed along matter find time long want folk inside waited still word choice feel body promise less everywhere could show love open soon stake tear life uhhh waste enough mmmmmmm leave back night mine cry watch phone pretty choose change think
No Matter What ; George LaMond (Duet;No Matter What by George LaMond (Duet.txt;west neighbor millionaire order sound eye watchin really credit world hall check trust player bad rap would lowe though raise fan girl doctor explain want side wonder feel hotel without sto black sweet peace clean separate portray happen quick mind life believe plane bastard basketball- dollar concentration create wb ta home even pay eat bar give dribble ridin later flyin cause curb wake peaceembed cracker camera hold ashtray work grow football lady purse brother seat new slam track around reason nerve lawyer always cross attention dope sit word bear bunch year terminal perfect paint since contain lie sayin whoop racist upn police tha american remember street crazy death commercial kobe description bryant steal guess suburb bring autograph party play nothing dream pete stayin equal pool man fuck restaurant george shit star follow need finally malcolm nigger buy shoot fix put race valet camp store electric prolly holiday bag cut sport people way fair call brah fork fit head miami team wrong son basketball food fancy tall somebody box livin still model kramer set course liquor class counter evil love hollerin towel billionaire stree ah creed screamin prejudice detain key upper hoe wind must government think america role walkin martin bet move racism somethin kanye white hood hard low event bitch lot suite color luther fuckin endorsement us achieve men hand hang penthouse friend smarty chair first imagine ask imu nappy roots start matter time constitution long justice car clerk hello oprah picture million slip ucla cuss cupboard fly account fellow back boy haha bush i-i keep air clutch bachelor meet day laugh
No More Lies ; Michelle;No More Lies by Michelle.txt;right girlfriend chill sound likeso exaggeration little appreciate trust do-do-doo-ooh-ooh baby grow almost specialembed every nose time girl cryin want wolf babe- hello lie love pinocchio special leave sucker night watch out-your man true try think understand do-do-do-do-do-ooh-ooh
No Myth ; Michael Penn;No Myth by Michael Penn.txt;secret maybe parallel eye chinese send romeo game dig okay jean endless degree catch heathcliff someone speak friend measure goodbye first ask block find thing time china want junk bow pole myth hello black astaire please sure draw hole look hop private yet soon untie guess sometime life curtain dance soho never overseas withembed investigator knot equator pressure think
Nothin To Hide ; Poco;Nothin To Hide by Poco.txt;right something stone break solo eye alone turn anymore cold lonely hide pain hold someone bed sleepin weak believin heart stay strong fire along around chorus long girl always inside deep lie could blind look danger soon hurt mind nothin ease wait back mine lyricscryin change
Nothing Compares 2 U ; Sinead OConnor;Nothing Compares 2 U by Sinead OConnor.txt;fool eat bird fall whatever remind give live hour put lonely good hard stop song baby every dinner fun compare blue wrong seven matter around sleep doctor girl want fancy mama without since u die could away youyou whomever love fifteen sometimes tear guess plant willing boy flower night another nothing day choose restaurant arm try backyard
Notice Me ; Nikki;Notice Me by Nikki.txt;meembed notice girl ive door likei throw whoa baby im write dont please alone call hang cause world knock watch away phone lyricsday day wo letter think home love
Now Youre Gone ; Whitesnake;Now Youre Gone by Whitesnake.txt;need maybe give break name eye embrace alone turn cold pray wake likenow baby much closing hand call every heart memory sight around time girl want always lose feel without sweat since could blind emptiness mindembed close realize love lyricsnow mind escape never leave back face youre night another mine day try think
Oh Father ; Madonna;Oh Father by Madonna.txt;funny maybe someday live myselfembed use boot good run pain father translationsportuguesoh would way mean anger next felt want somebody sin prayed end away look love hurt tear yesterday believe never lay back cruel seem able cry power child think
Oh Girl ; Paul Young;Oh Girl by Paul Young.txt;right crowd even fool need whoa give woman cause likeall trouble doo-doo depend lot pain lyricsoh care helpless useless would way call friend stay guilty time girl always help ever feel save away place look doo love tear guess double leave hip face better man try ta think
On The Way Up ; Elisa Fiorillo;On The Way Up by Elisa Fiorillo.txt;fool scream ow need fall corner lyricsi put babe cause thought world top far reserve negative us hold work useless sorry people talk dont way succeed every soembed likewhen nobody shout along around thing moment together ever still ta single look uh-huh agree ground everything life kind chance remain never outlook back sucker foot nothing another keep table spot change think
One And Only Man ; Steve Winwood;One And Only Man by Steve Winwood.txt;stone give standembed jump live music turn buy woman far running city tight depend light bad till friend raise heart loving country lover time burn girl inside feel likefind clothes deep morning away place lyricsevery sad everything show dance chance never guy back treat keep dream cry dress pretty man true child
One More Try ; Timmy T;One More Try by Timmy T.txt;give live put use lonely good goembed baby much mean wo find around time long girl want always feel without please since lie could disappiont treasure love kiss miss leave likeoh forgive night lyricsit cry arm try
Only My Heart Talkin ; Alice Cooper;Only My Heart Talkin by Alice Cooper.txt;fool fall apart anybody break give eye afraid babe mask little drop hide run catch baby almost would heart stay everytime hear walk thing time want help word without sayin could loud knock away look tear guess talkin chance enough never lyricsanybody likeit straight play dream cry edge cuz try think
Only Women Bleed ; Favorite Angel;Only Women Bleed by Favorite Angel.txt;right motif peeping instead knight arraignment shady aura push-ups chess yeager move tiersembed deceive fail im give protect paranoia supersonic homing embrace point last woman verse yo cold thee cause hardly top square foreclose guard chest legacy necessary hurting declare marvel low famous posture queen judas pain god bleed gavel barely fuckin dead aint jelly vapor friendship real person weather stress damage pass shaping naysayer people sakers dont way massive angle traitor ankle arise call shadow every defend cant reeking nigga left friend faker briefly second-guessing eternal unknown blood head radius ill stay bridge free lyricsverse claw muscle wrong acute block assumption nose form speaking ugly around seek chorus find stain rapper cheat heal sleep snap want package always best circle caution likechorus brass step smile patience costume past sneak focus ornament bunch crab chuckie obstacle black frame respect initial maker pawn greet draw open-ended end narrative two blinded favorite away look view close healing treasure others kill love open wouldnt versus connect hurt tear hosting lead kindness struggle defense double code escape supposedly serving weakness circumstantial leave whats snake pregnant purpose mistake barrel embroidery relate back speculation control face seem straight play weave build many keep safe vacant rude wall logan steep question tryna tolling claustrophobic slim pretty cool fuck reveal hesitate try ta space think home
Ooh La La (I Cant Get Over You) ; Perfect Gentlemen;Ooh La La (I Cant Get Over You) by Perfect Gentlemen.txt;minute news apart anytime break really leaving use radio worth hard forget mother song la today talk almost way hand every cant friend felt heart youembed fella hear theyre find girl together explain dearest ever short feel save single sweet glove end could course sad remember everything love fine lyricsooh torn life definitely believe nice forever never guy leave likeooh hey wait sing back shes seem foot another keep dream day meet true try ta think
Ooops Up ; Snap!;Ooops Up by Snap!.txt;happy wallet law cart lyricsthis total bubble freak break chill munchies cover breathing yes cheek chinese last bath demon bolo line store ring hard forget song satisfaction hold light bag bad sack talk behind would murphy till friday obtain reach affection felt head ooops upyou start wrong protection lover tease soft stood girl graduation uh inside potential roll money end cop could amy ear grocery oops ultimate fill guaranteed sad fine scene reputation stroke ready leave reaction school hot heavy dummy night pack math touch day chip
Opposites Attract ; Paula Abdul (Duet;Opposites Attract by Paula Abdul (Duet.txt;lozano bout hes s. maybe serve order chaka sound effin music redact stability resent urge professor spit ionic check mitochondrion sonic chucky feed rare nest flow weather marshawn sensation childs dont enable strange rappin topping brain goodbye raise impressin fact king sick noggin theyre ramadan programmer hypochondria collective past clothing fucker takin ache abdul assure draw clean goin raw con happen quick mission special sex life blowin precedence plane consecutive code asshole ignorance flush pack effortless bomb belong pressure home something fool result cancel birth bird obscene inhalation nectar character latent tempest center cause oooooooooooooooooooo thats record incubator tiny youll powerhouse alderaan heat expression gonzo great new ill hatin blue fire track fear sittin cross sit second forsake sanity word hit hunter emoticon resist please rush sayin fish branch khan earth adjacent mom rip kabbalistic show rhyme loathe miss bring lather surveillance powerless straight limb collapse play opposites invade may man fuck spot change shit raisin amish soccer throw bit pull im finally yes hour put sudden pressin good attract blast impressive fringe quit suppress lynch layman within aint light bond youve massive call chuckle temperature nerd palm shed hint wrong overload facade sir box patience still body insomnia end wear sarcastic eminence censorship crush chaotic affair crap- wont boner school bluffin natural esoteric tick wind fake devourin cowardice rouge chip think bust em damn big teach break admit home- yo lyricschaos vacation thompson hard blip slave malaysian paula comic fuckin us mark creator ace babel molecular ima chaos effort hand cant first julian hungry hater sedative rest translate text unhinge kid assailant car toxin ali jack everywhere knock six collectin anomalous account detox status border freeze soap back face youre parrot copyright keep touch intuition soul weird hair
Over And Over ; Pajama Party;Over And Over by Pajama Party.txt;right tip need move fierce turn thrill truly good shake stop care hold near bad real baby every posse chicago new miami fella start wo southern lyricsyou time burn chili-most want inside ever feel body likelove end whoop look rover love fine crazy pretend york passion nice l.a. hot sucker boy night texas touch feeling meet spot try wild home
Owwww! ; Chunky A;Owwww! by Chunky A.txt;even deal need dim cushion girlies name lyricsi hope surprise last woman yo exotic wrap little ton good sister line chocolate velda light thangyou real owwww way call future hang every fun heart brooke time tall rock past short ever busy erotic body midget end shield cake look snow close gidget sky cute hurt life spread kind sing madonna houston seem nothing many dream whitney dark spend wild
Oye Mi Canto (Hear My Voice) ; Gloria Estefan;Oye Mi Canto (Hear My Voice) by Gloria Estefan.txt;right submission overnight canto alright someday oyelo give condition stand tradition hate tiene voice transition good lyricstake change oye del e work people almost behind common way speak hand mi cancion hear wrong este find que thing always pride word ground love happen soon sometimes oir room absurd mind believe corazon leave mistake seem upper cantoembed ta understand
Peace In Our Time ; Eddie Money;Peace In Our Time by Eddie Money.txt;flame stone fortune making darling star wing whoa give break prison turn hope last dove put cause shine worth city line run strength bottom lyricsoh song suppose us surround work dust heaven warmth supply carry heat reach cheating heart strong free fire wheel along start wrong find time shame long likegotta sign goad without sweet timeembed peace phoenix shape faith earth water healing doubt prayer love street fast sky fly storm enough never magic build keep dream wall lightning true wine ta bust
Personal Jesus ; Depeche Mode;Personal Jesus by Depeche Mode.txt;thing receiver care best need confess second forgiver someone believer feel lift alone faithembed put flesh reach unknown faith jesus telephone test deliver touch chest bone hear personal prayer
Pictures Of You ; The Cure;Pictures Of You by The Cure.txt;right stone scream big fall apart break eye finally stand live last cold white use angel world run anything rain hold near real much almost wide would brighter heart drown youembed quiet fear find soft time quietly make-believe long want always lose ever word slow feel deep delicate could picture away look snow slip close remember everything sky open death kiss believe never night nothing cry courage dark fell arm true think
Play That Funky Music ; Vanilla Ice;Play That Funky Music by Vanilla Ice.txt;damn probably eat cure german punks ice bet mad likei girlies bit freak give weakenin sound wet music yellin glue trap vip rockin yo white cause spaghetti funk ok little square nowhere good supercalafragilisticexpialidocious hard tight hittin stop groovin concept ya god steppin song nazi dead stagger ecstasy flow allow people startle sparkamatic way spoon till weak call luck hang ghetto hangin amaze gettin endure fit head loafer sellin along hear effect wrong -- intoxicate dissin practice time girl doctor louder side boogie everybody step kid sayplay delilah yoknock base pitchin meanytime stage lazy atrocious witch body year bell vanilla tryin perfect denyin funky lettin goin listen die begin movin ear homebody starin place trippin kick close ground sad love rhyme crazy fast fly ringin fanatic yell comin jockin dad yea drug dance lend samsonsamson wood cuttin mouth hot sing lay wino style back yep boy control musicembed battle play soonoh rhino d-shay mike smooth keep dj mine phase beat belong anywhere man smell try posse think
Poison ; Alice Cooper;Poison by Alice Cooper.txt;scream ice likei break name wet sens thrill poison run pain stop chain catch hold skin pin taste much call brain lace blood hear burn want inside black sweat deep could look needle kill web love hurt kiss lip vein mouth hot cruel venomous device touch
Poison ; Bell Biv DeVoe;Poison by Bell Biv DeVoe.txt;right something pay whole cure ne big move fall break clockin eye stand ron relationships yo cause beautiful deadly poison demon use laid world loser chest run shake hard low forget -caution brown trust dead g slick cut particular lookin situation strange schemin mellow gettin b. portion serious heart head michael fella start effect wrong rest find wassup thing time girl huh together checkin best step smile still slow .. takin bell money b.b.d park end sayin blind movin breakin house pro drive aaa-fro uh-huh devoe biv drivin show keepin love warn fly open ho johnny beware kiss mind steal winner ready never fellow miss screamin freeze lay boy full seem night crew butt play high mike spyderman hoe ralph wall sense power runnin blow meet must think
Policy Of Truth ; Depeche Mode;Policy Of Truth by Depeche Mode.txt;something pay civilized swear multiply advice stand put use deliver problem hide satisfy event price continually tongue-tied decide proof policy truth late thing time always youth wonder faithfully learn lie listen could consequence lesson different never pursue face beforeembed better change
Possession ; Bad English;Possession by Bad English.txt;need likei live cause little world far game possession lyricsoh hold someone taste obsession every note first heart charade walk find thing time want always lose wonder feel without tonight deep everywhere away else room pretend mind life leave key control night play keep dream mine trace lipstick soul perfume space
Pray ; MC Hammer;Pray by MC Hammer.txt;minute read need move whatever ten outta stand knocking live cause x send pray top good hard forget stop dead work today people would way every old start lord time long want dope prayed still word year child money die outside thank look kick doubt living prayer rhyme love fast happen everyday mission life crack smoke chance never blessing back knee town night high nothing keep day try think bust
Praying For Time ; George Michael;Praying For Time by George Michael.txt;sell lyricsthese poor scream maybe timeyou eye cover stand turn charity hope twice last coat hate pray cling declare hard stop god us hold chooser much behind legitimate way speak hand hang excuse hungry whose late along guilty find around thing time creep door past rich year sure somewhere wear empty score place look wounded beggar love television sky open guess chance ignorance back play keep mine may day man must child
Precious Love ; Jody Watley;Precious Love by Jody Watley.txt;need hope last precious joy cause thrill bright hunt bleed heart compare stay guilty tender thing time quality burn long want side ever feel surely lyricsgeorgia away love important kiss likeprecious passion forever never miss bring nothing keep may feeling soul mystery
Pretending ; Eric Clapton;Pretending by Eric Clapton.txt;right sadness pretending pretendingembed fall fail sound music use prevail band satisfy work real alibis situation strange three stay strong memory time plan everybody lose recall feel two tale living love pretend never lost night many must try change think home understand
Price Of Love ; Bad English;Price Of Love by Bad English.txt;alright star need act give eye turn share shine good anything hard tight price givin us hold bad would way friend heart bridge strong fight wrong lover find around thing time somehow always past likeyour without patiently two house sweep away lyricsgirl close everything love sometimes enough never bring wait forgive knee seem night build dream cry think home
Principals Office ; Young MC;Principals Office by Young MC.txt;happy right even clock deal cardembed scream read ice b marvin tray letter give name young yes express shoot club hardly cause prinicipal mass recess singing pick drag game date trouble line run ring forget lot front hall ball third us reel week bad runnning real pass today would way speak lady hysteria hand likeyo pastime excuse joke friend note first seat next raise chalk passing gun late sauce hear walk find mc time join thursday girl apple cafeteria scratching help office upset tooth everybody kid sit smile word nurse feel sneaker complete write bell crunch rush sure could begin morning stair class two favorite gum place look ceiling hop principal book love brown-bagging fine room glee finish pas lip enough broken ready bathroom mr. wait school rang heavy hip back face another lunch stuck mine feeling spend report must try hi teacher normally think laugh
Pump Up The Jam ; Technotronic;Pump Up The Jam by Technotronic.txt;crowd stomp want find ahead bad dance booty tonight dayembed jam party yo cause goin foot little floor stay place look day pump
Pure ; Lightning Seeds;Pure by Lightning Seeds.txt;sell shut star splash wish push eye shoot slows use shine delight daydream us raindrops someone moonglow nighttime decide colder moonlit shadow every bounce perhaps starry heart head new youembed truth swim sight fresh ride find reason around slide soft time sleep pure dazzle smile oceans garden learn deep lie shiver could tune picture autumn place look season colour realize stream love sky sparkle simple stardust believe pour waste never leave mouth sing night weep keep harden rainbow dream cry dark feeling pretty leaf sleigh
