title;artist;filename;lyrics
Eres Tu (Touch The Wind) ; Mocedades;Eres Tu (Touch The Wind) by Mocedades.txt;manos en el esperanza pan noche fuente sonrisa eres todo guitarra la mis lyricscomo como agua lluvia algo hoguera hogar manana fresca tu de una asi trigo fuego toda brisa mi promesa poema wind touch fuerte horizonte verano
Everlasting Love ; Carl Carlton;Everlasting Love by Carl Carlton.txt;endlessly need beg deny eye stand really last shin lasting forget astray sun someone flow way part loveyou till eternal heart strong start girl always side away realize fill show love bride open hurt life forever never leave everlasting forgive river back mine regret
Evil Boll-weevil ; Grand Canyon;Evil Boll-weevil by Grand Canyon.txt;rocket right canyon alright gas fall eighty jump wife tree unsuccessful hour thought travel good weevil gentleman survive world-famous dare peachtree us boll saw la heaven baby mile much would way lady talk shack bury lyricswe bank serious first boston land thing want help side step rock ever rich feel peach roll sweet jack everywhere die thank outside parent ed away alabama by-golly million evil studios.embed devil love engagement fast summer life concern stunt never miss return snake denver pit river dollar back chattahoochee affect breeze seventy-five many cycle power question man grange child change think home
Eyes Of Silver ; The Doobie Brothers;Eyes Of Silver by The Doobie Brothers.txt;silver stupid conquer need aware give mystic eye standin cold steel share ruby shine shin lonely shiningyou diamond gold mahal baby wide way hundred loving hungry blade help pride inside lie away kick fill love open rely lyricseyes forever taj bring shall knee bend lovin man arm
Fairytale ; The Pointer Sisters;Fairytale by The Pointer Sisters.txt;even onembed walkin bet need big someday move deceive somethin break eye yes anymore alone thin woman use good hard forget care would way part great heart stay strong hear walk wrong nellie wo find around long fairytale want explain best door lose word hit tryin waitin pretendin away realize love else open plain nothin never pack seem another play dream mine lovin true try think
Fallin In Love ; The Souther Hillman Furay Band;Fallin In Love by The Souther Hillman Furay Band.txt;right turnin bright honey hold light grow lookin much stretchin loveyou free lifetime bein time feel fallin sure shinin moon love seein yea believe nothin full night lyricshere dream runnin brighten wind stride mm think home
Feel Like Makin Love ; Roberta Flack;Feel Like Makin Love by Roberta Flack.txt;thing time walkin want touchin seein spring baby feel watchin talk turn winter sweet hand park oo-oo-ooh candlelight strollin dream holdin dark feeling youyou moanin start lover makin true low restaurant show love
Feel Like Making Love ; Bob James UNCERTAIN;Feel Like Making Love by Bob James UNCERTAIN.txt;thing time walkin want touchin seein feelin spring baby feel talk turn winter sweet hand lyricsstrollin park trueyou candlelight strollin dream watch holdin dark touch moanin start walk lover true dreams low restaurant show love
Finally Got Myself Together (Im A Changed Man) ; The Impressions;Finally Got Myself Together (Im A Changed Man) by The Impressions.txt;im eye finally babe use little row glance skid uptight light bad baby confused felt head late along wrong walk thing changed girl together want likefinally smile listen could drink place look abused love unloved destiny smoke hey face night straight keep lyricsfinally man change think
Fire Ba; Im On Fire by Andy Kim;Fire Baby Im On Fire by Andy Kim.txt;doin right give im dawn alone woman babe cause shine good pain sun feelin baby much youve dont dreamin call darlin ill fire babeyou wrong wo lord lyricsyou time burn want ive ever feel sweet shinin could love soon ah never night high nothing man must
Fire ; Ohio Players;Fire by Ohio Players.txt;swerve flame lyricshey ow wish push whoa somethin really yes shoot shot gow tighten game good shake ha lot us someone baby talk way four-alarm heart fire start walk hoo lord tease nerve girl wrack uh curve feel set woo squeeze knock dyn-o-mite uh-huh choke excited smoke stroke hey hot sing knee likewell child burnin smokin home
Fish Aint Bitin ; Lamont Dozier;Fish Aint Bitin by Lamont Dozier.txt;stumble beg human overcome bitin last race crumbling cost run hard broke stop stick quit catch slick aint win recover damage dick shit hungry dc fight frightening likethis lord find destine afford door short lazy bum please sure end bite fish meanwhile two confidence place crazy tricky already life defense hopeless four back knee nothing phase try hatching think
Flashback ; The 5th Dimension;Flashback by The 5th Dimension.txt;dreamed clock mmmmmm need likei lyricsi live really aww turn mccoo cold freedom chasin hoyerembed th wake run hoyer rushin song fade rain hold sun cigarette vocal heaven grow allow much would thinnin flashback dreamin winter brain felt ask memory doug flood time burn want feel sweat could searchin ash answer everything love background marilyn lead summer finger submit clingin bring back night pillow dimension mine dream runnin touch lovin singer day man think
For The Love Of Money ; The OJays;For The Love Of Money by The OJays.txt;sell even changin fool bout funny need give really paper woman precious tellin world good lot mother care bad carry people talk bill mean brother root hear walk green dime thing cheat huh uh nickel body save spare cash money lie listen mindembed drive evil rule love street hurt mind steal piece talkin never lay dollar rob many keep almighty beat meet small soul weight change
Fox Hunt ; Herb Alpert;Fox Hunt by Herb Alpert.txt;early case even slug right something damn extra drummonds swear backwards keep surroundings bet big maybe news aware paranoid foe jump chill eye via wet really live stand last woman yo put club hardly hate cause played funk wave use demon proud facin little hood world pick good f alert stretcher shake scar lot plug seizure retrogression thumpers bangin color innocent god lyricsthe us near dildo body-guardians envy feelin trick seepage real stress lookin much server talk would way tv call motherfucker brah every anger bury serious measure fun though next tec head youngster hater worsen plus free rival gun scheme guilty sick son squirter matter beef bullshit find message press long girl huh want murder always fancy sippin sittin uh everybody phrase search family still nation ta lecture bunch feel without fucker prefer kinda set money tryin sure direction everywhere could loud hole state trippin look clip evil fill kill show love clueless open quick sentence comin hurt tear cat lead life curtain mo success waste never hey oblivious wit reppin party lung back certain town seem high nothing flag hoe texas mayhem watch retrogresses fake equal cuz day man fuck mode gangbang child true think shit
Free Bird ; Lynyrd Skynyrd;Free Bird by Lynyrd Skynyrd.txt;badly bird travel blame baby would though stay free wo lord thing girl tomorrow help still please sweet could place remember love fly never leave high many feeling must change bye
Free Man In Paris ; Joni Mitchell;Free Man In Paris by Joni Mitchell.txt;alive deal star machinery cabaret good lot song ahead work win champs-elysees people decide behind way call future friend felt lately nobody popular ask free walk find time stoke always tomorrow best somebody everybody door songyou screamer wonder l feel please maker telephone wander paris gain favor cafe business back mine unfettered man try think dreamer
From His Woman To You ; Barbara Mason;From His Woman To You by Barbara Mason.txt;even pay fool minute need beg give shirley young buy last woman cause share care claim expect sorry much would way note stay truth wo afford thing want car feel hello surely money clothes barbara two love job bother mind womanembed never wait night seem play keep pocket spend man likeand
Funky Party ; Clarence Reid;Funky Party by Clarence Reid.txt;lyricsparty right something always across uh door smile sound specialize everyone way call party funky town face partyyou place hear walk ahh
Funky President (People Its Bad)Coldblooded ; James Brown;Funky President (People Its Bad)Coldblooded by James Brown.txt;pay cup jaunt need give governor paper tough turn tax buy twice put cold funk motor good ugh bad sexy baby stock people rap mean lyricsfunky blood raise new land payback country lord find around brand thing time huh together food mayor save hah money market funky woo listen wow huhembed drink love job mob dance nice nasty chance enough factory hey president back godfather likegot foot keep glass praise man change
Gee Ba; by Peter Shelley;Gee Baby by Peter Shelley.txt;right gee minute maybe stay-ay alone swing go-o ohh-oh tight ya hold near real baby much would every hopin darlin hear thing time girl want ooh-ooh-ooh no-o feel tonight please whisper ear away close lyricsgee everything oh-oh mind never leave cool mm-mm-hmm think
Georgia Porcupine ; George Fischoff UNCERTAIN;Georgia Porcupine by George Fischoff UNCERTAIN.txt;right tit jungle alright hemi pinchin swiper order chase vet twice killin oregon lyfe quarter bottom mud syrup hittin check buff pop dead near maced much rap common would sock friday hundred brain raise rollin quonny size spike press shopping baow atlanta five best everybody rich belt feel sneaker fallin big-ass sweet draw aim piss raw viper raid close percs discount fast room kiss life believe mailman beecher mouth hip bae flush night battle mike tryna pay cup zip round ice suck brick act give k ridin later hate daily thirty ironic line tipoff chain catch g work doc trick lick lookin fn red thinkin new underneath plus gun dime bullshit ri always dope bake short hit sip year pie kkev kinda sayin could dog approach starin drive look nowadays rip kill crazy wockeisha soon comin gm nothin shoe ready guy miss bring wait party ounce straight play another blow fed man fuck spot try grape shit pension probably porcupine teeth raisin need throw lean pull eighty wet tax buy shoot homo use bro dequindre okay shell store survive god feelin baby dick almost fat call gettin nigga papa head woah method lord son nose afford ugly twelve still nickel lil lazy niggas body set money finder cop diaper trickin hop ground organize georgia everything gym morton ho buyer hurt piece tris kind lip talkin drip leave heavy silent flat thousand seventy-five hoe mine fake med danny think bust g.o.a.t. damn whole minute gas burberry purple be-livid ten break name gary spaghetti white send hood game cough drop drank bitch lot finna playin backseat stick srt rack fuckin thirty-five probation three reach feature rio wo thing waist tased hell mama rock snack car tesla prayin hah oxycontins nine everywhere pint house knock drink slip six drinkin scene glock smoke pour layin hey back weed fifty hat high off-white keep watch beat gorgeous
Get Dancin ; Disco Tex MISSING;Get Dancin by Disco Tex MISSING.txt;exist song disco tex seem miss dancin
Get Out Of Denver ; Bob Seger;Get Out Of Denver by Bob Seger.txt;doin something truck loveland turnin need baptist cover finally turn hour burnin member put cause drizzlin far pick caddy mountain line run denveryou starrin pinch rain us headin light baby half would spinnin till brother nebraska hundred thunder reach red rollin fire wheel start walk southern lord thing somehow long girl bustin trooper pickup still rubber lift policeman money field less bendin funky cop siren could moon autumn state look counter remember shower drivin beside knowin colorado twenty pas commie captain cadillac screamin denver school lay heavy night preachin keep travelin man fog teacher
Get That Gasoline Blues ; NRBQ UNCERTAIN;Get That Gasoline Blues by NRBQ UNCERTAIN.txt;slanged list even betta em flame graveyard walkin scream sinister crackle basement apart lackin news throw im murda name jock c watchin chioke strike twice yo put killin cause daily koop duck bolo drop good lyricssnap ggs run pranksta judge baggin victim bitch pain tank ordinary ya bleed pop visit fuckin dead stack g understand slit insane cut people dont clique gang hang fucka gettin joke brain nigga three chicago head new nobody lame shi blue chanel wo rest jus grab gangsta routine steady drain diss folk always add pussy step sit motha hit rackin body save stab write torch kinda w toy throwin end nine monkey scratch die n psycho gasoline look rip derange bitchyou street crazy throat choke comin glock grabbing aka killa chop plane burning yuh nothin jackin bang kickin bring leave match nkow wit hot sing back stackin play coco another hoe runnin dark shank cuz hellraiser fuck man try burnin think laugh
Give It To The People ; The Righteous Brothers;Give It To The People by The Righteous Brothers.txt;right crowd introduction deal lyricsever ten give ityou yes music club piano angel band okay anything describe light someone people would way check-out hang every first instruction local old land hear find thing time hero long want mama everybody rock playing word year roll hollywood learn since classical wait sing back night play co dream feeling label righteous true think
Give Me A Reason To Be Gone ; Maureen McGovern UNCERTAIN;Give Me A Reason To Be Gone by Maureen McGovern UNCERTAIN.txt;company easy dear give eye put hate cause use good run low lyrics way future excuse first ill strong wo fear reason sign creep plan help patient lose smile feel please away danger denial goneembed love mess heel control seem keep day
Goin Down Slow ; Bobby Blue Bland;Goin Down Slow by Bobby Blue Bland.txt;em train funny fail lyricsi live cause pray likesaid mother father home fun next head lord somebody sin slow feel body write year please clothes south goin shape look fast moan tear health kind reckless waste never shorten leave forgive
