title;artist;filename;lyrics
03 Bonnie & Clyde ; Jay-Z;03 Bonnie & Clyde by Jay-Z.txt;doin right comfy even happy walkin girlfriend dudes b gas thorough burberry need whatever rider surface give lack break young eye cruisin hermes put cause lens occur thats problem date drop city necessary anything hard benz bobby stop trust suppose boyfriend us fever shoulder work bag trippy today behind talk way speak hundred mashin hov new nobody hercedes grabbin swim wheel workin soldier be-atch wo track ride reason time girl together aviator timbs somebody sin clyde kid worry ever focus rid promise respect perfect end mami wear could blind westside yeah-hee manolo place look earth birkin six keepin show roller holla love soon sometimes uhh hurt bonnie sex life necklace believe ready carrie back yep shade blahnik nothing keep breathe whitney air highway trip lock mad treat
1 ; Nelly UNCERTAIN;1 by Nelly UNCERTAIN.txt;morphin shady j.j. lemonade tongue maybe order simply outta pace fuse really music tough chunky woman killin piano earnhardt pupil kryptonno odin superhuman maintainin gene ugh ha-ha hall ya pop dead pill masterfully pat bad scribble rap pissin common mean monica eliminate pharoahe though nobody fact channel king fight walk seven rapper skill-a-holic want add everybody f-bombs fab ray feel ricochetin elevate brat robot away dre doberman speed happen hip-hop ak- special nuisance backpack mind burst life crack kneel levitate struggle nice chicken lemon mistake thaiportuguesitalianodeutschfrancaisespanolcymraegrap ren brutal attempt knot acrobat slap rude bomb noodle normal cable table wack fell n.w.a ta case even something pay columbine easy fame pen lyrical fad celebrate inspire give asgard glue aftermath fading hate league gay ironic wake clinton line anything mainstream pinch ball song lunchtime suppose work doc mathers gay-lookin elevator grow lookin church disastrously shock future truthful translationsturkce bananas thinkin seat new ill accolade homage wheel track around rippin dooma-lumma sleep dale trash rappity alcohol bake word hit shabazz rubber roll packin cornrows sure nod park somewhere since flock underground consideration cake could thank doodle product vehicle bitter computer look earth fatal realize mom keepin unsigned show kill rhyme immortal lewinsky comin rap-bot curtain batter stunt nothin grind period match yackety-yack wait brung straight play nothing able many nascar may blow feeling label gather fuck man arm rapunzel try boyz ramen shit sacrifice understand least inadvertently flame position secret need indecent throw omnipotent buy shoot verse put planet practicin use mass-occur yella little youthful occur half-cock eazy good mac construct god pad feelin censor appeal people half fat way .kembed call raygun every summa-lumma confuse head hella station havin wrong racin discrimination mc pointless rodent murder motherfuckin help broad actually box general askin lose hatred syllable livin ever still pac oy hurtin zod motivate combine skill student fucking sympathetic satan immediately bumpin funky portal lp j bus innovative fabolous poodle faggot moon jealous punchlines everything devil love tug profit versus sometimes revolver hurt couple lead fag singin flunky chance talkin retardbe never overseas school demonstrate heavy key full immortality cube mine pocket utilize slim must prove think mad honesty walkin minute big exact fall break supersonic rage human white vacation futile angel radio junkie zombie masterpiece thor game drop honest trouble attack vey hard front color stick tongue-in-cheek barely fuckin skin exuberance asteroid situation nutsack bill speak dippity-hippity rund.m.c. root rough next hungry trailer crap wrath warp assumin ask hater yap-yap lakim find virgin time shame plank sign long devastate maxi phasa office induct hell uh beginnin patient kid rock mayweather crunch write laptop handin audience scratch place capable monch honestly million six pew bully witnessin thumb flippity basically forever enough hey back boy face drunk keep rakim watch wall day meet trip
19 Somethin ; Mark Wills;19 Somethin by Mark Wills.txt;least stuff whole shave star wish big stretch -something somethin memorize card break finally put bell-bottoms skate shuttle world baseball staubach scar jean trans pac-man shoebox cut-off ams saw grow pant lookin would sticker suv armstrong war first new mtv old aw parachute eight evel microwave time roger responsibility trade mama inside kid -somethingembed daisy decade mortgage black woo die elvis pattern hair-do look duke rink fawcett love sky sometimes cheesy couple dad tape rubik eight-track farrah sideburns back full knievel dawning cube cry watch day man backyard arm fell space afternoon hair
7 Days ; Craig David;7 Days by Craig David.txt;something damn deal david sunday cinnamon need deny monday break name number chill stand live really tuesday alone hope beautiful digit decline hmm quarter date cost bottle rendezvous ring honey craig endless front queen check subway care moet real baby way lady fair call friday three friend first chat ask start walk update block around thing time thursday long girl tomorrow always plenty past saturday unfold impression feel body flip sure nine since keen could two wednesday away drink look six kick love fine oh-oh special couple mind kind talker wait back age twenty-four night seem play smooth mine phone pretty day meet man must ta think home
A Little Less Conversation ; Elvis Presley vs JXL UNCERTAIN;A Little Less Conversation by Elvis Presley vs JXL UNCERTAIN.txt;satisfactioning shut eye music coat put use articulate little dig satisfy baby talk groovy heart late fight along start walk conversation satisfactionin around grab procrastinate girl spark sit aggravation please tire less listen bite close show open action mind summer bark ease hey mouth wait night breeze
A Lot Of Things Different ; Kenny Chesney;A Lot Of Things Different by Kenny Chesney.txt;even alive yellow sunday wish dip beg pouring push carson name cover stand afraid buy last umbrella nearly band trim shake lot god rain dare hold saw bedroom bad taste much people would church hand call brother war red head ask blue green thing time grandma want mama without paint listen could elvis morning bully love hurt kiss dad skinny differentembed different dance chance enough boy town night nothing play jenny touch spend dress change think
A Moment Like This ; Kelly Clarkson;A Moment Like This by Kelly Clarkson.txt;something thisembed fall last share catch people almost would dreamin great lifetime tender moment explain search feel cherish could agree everything beauty love crazy happen special meant kiss believe forever remain wait awake dream may meet change think
A New Day Has Come ; Celine Dion;A New Day Has Come by Celine Dion.txt;miracle hush eye joy angel world wash good strength theres pain rain hold sun light blinding shatter almost new drown strong shed fear find time long everyone away darkness fill love mmm sky tear believe weakness ohh wait boy wall touch dark ooh-ooh day soul think
A Thousand Miles ; Vanessa Carlton;A Thousand Miles by Vanessa Carlton.txt;crowd walkin need fall homebound precious us hold ahead mile pass would downtown way translationsfrancaisa blankly drown memory walk wrong time always ever livin still wonder tonightembed tonight could starin everything fast sky oh-oh pas miss thousand face belong makin think
A Womans Worth ; Alicia Keys;A Womans Worth by Alicia Keys.txt;right read need bubble deny give refuse buy last woman bath put world worth good line run diamond song hold light mm-mmm uh-uh real baby mile do-do-do-di-di-di-di tenderly do-ooh dinner bluff rough first shit spell do-do hear walk wrong find around time always uh candle lose smile promise please fairly cherish could mm-hmm show love cruise passion grant mm-hm never ohh pearls sing sibba-dibba play dough nothing treat keep ooh-ooh value choose man true mm
Addictive ; Truth Hurts;Addictive by Truth Hurts.txt;og addictive c-note pan cup scream secret tongue turnin need fall break give master number specialize stand yes alone revlon put joy planet wed pray use hood boot world thats anxious game bling date good okay anything hard low complainin queen innocent pain stick ya rapid scandalous care ball quit twist pedal light achin ahead speakin baby scent addict lookin half way lady brawl till hand ghetto gettin hundred ups rough toe though red war head plus ask strong team freakin late king habit entertainin loot brand fiending fan thing od spontaneous girl complain lawyer plan candle hit victoria fakin glow tonight set tryin clean mill waitin jail shootouts million fuss water fill rule kilos pot kill silk fur holla love street fashion bedspread page gram wherever drug sex guess concern contagious persuasive layin fetish never return addictedembed automatic wait hot thinking dollar lung back high another build bail keep breathe squeezin rise man hotter arm makin spot ta fuck trip home shit
Aerials ; System Of A Down;Aerials by System Of A Down.txt;ah-ah-ah sky aerial always omyou find mind lose life fall void ah word eye never waterfall ah-ah turn river put eternal high play swimming stay wall free drink swim prize hear small choose around
Aint It Funny ; Jennifer Lopez;Aint It Funny by Jennifer Lopez.txt;right even funny wish move push deny live afraid de far ironic loca circumstance barely hold aint real baby way part mean story strange every romance though fate heart felt emotion fact stay free less-than-perfect longer wrong find thing moment somehow want explain plan side ti feel set perfect deep could picture away alter doubt love yet sometimes enamorada mind life guess believe estoy chance never back cruel create thousand face youre seem play touch feeling true try change lock think understand
Air Force Ones ; Nelly;Air Force Ones by Nelly.txt;early coupe bout maybe kawasaki sound advice standin twice cold security top quarter owner dyin bottom check army ya near platinum cap real bronco flow behind winter sock string toe compare shelf walk size form candy wider sneaker black none especially pro gum hip-hop edition nice nike hot four night fa gim high-top ta case pay timb bowlin give lakers point last all-white cause shot strap problem peep date band shootin kit stop buyin lookin stompin floppy lace red o-kay pearl blue free flop vuitton inside sit swoosh kinda limited since cake display could fish lime-green look hype louis kyjuan tyin basis cardinal onesembed puma nothin shoe miss wait autograph orange nothing mids may flavor man fuck treat force need ne throw khaki dem buy put dumb good clear store shell electric depend person half fat murphy roof murph head locker wrong green sight ride twelve skittle box jewelry mall dayton lil niggas flip tryin cop wear dot drivin love sometimes never leave wit thanks stripe foot dirty mine spend sole spray damn em whole minute purple big crispy ten somethin scuff yo white burrr low-mid kiwi low tight color gold pair pin gray excuse three first leather genie hear tip-top fresh flip-flop time sign kid patent write ali lee two gut personal fifteen spur chrome summer tape wood switch outrageous purpose back boy face high dough wildin keep air touch ankle
Alive ; POD;Alive by POD.txt;even beyond alive whatever deny give turn cause world thankful cost trust song sunshine every first though new lifetime wo matter time flyembed best inside feel peace learn could away look everything love fly breath sometimes mind grant believe happens never mistake sing back face control upon day think
All Eyez On Me ; Monica;All Eyez On Me by Monica.txt;early doin right ashamed whoa give young chill watchin turn club game good tight check thang hold work light morn baby lookin much way monica gettin shy friend fun toe workin wo time girl best step feel tonight perfect end begin movin thug look uh-huh eyez poppin close ahh love oh-oh dance hey party boy night darkchild floor glass mine watch pretty makin
All I Have ; Jennifer Lopez;All I Have by Jennifer Lopez.txt;right instead easy minute need think whatever nervous act break sound chill live alone oh-oh-oh homie last yo put creepin cold use thought game lonely good wake run change stop hold ahead bad real baby independent much people talk way beefin mean reminisce bounce actin phony aw block son matter tender thing time shame mistreat girl huh want explain always uh pride settle playing ever still promise angry without essence feel sayin could especially giggle everything love fine crazy console special kiss cat mind life believe cocky path replace waste laugh leave wait mistake reppin boy town haha night decision nothing phase touch spend man spot choose prove ta lock mad home understand
All My Life ; Foo Fighters;All My Life by Foo Fighters.txt;something need satisfies deceive give wrist rope hate ghost hide nextembed twist bleed hold taste closer wide weight next prize find reason around long inside lose search feel resist end delicate away close love open lead life believe believer waste never leave hey sleeve knee night grip another nothing keep dream feeling day
All You Wanted ; Michelle Branch;All You Wanted by Michelle Branch.txt;need whoa finally cold lonely swept care tide hold someone way hand hang want somebody inside busy save try please away figure goneembed everything show oh-oh sink keep slowly hurry
Always ; Saliva;Always by Saliva.txt;solitude alwaysembed probably shakin likei apart sound live hate voice wrap world pick hide bottle taste would part hand blood heart hear walk around reason pistol thing want always plan door feel desire without blind love tear life guess pack breathe floor cry man
Always On Time ; Ja Rule;Always On Time by Ja Rule.txt;something easy playground need think dear bishop throw letter pull give freak name order remind eye glare live really wet yank woman cause send league share valet boot game quarter swing drop complaint ha hard i-n-c benz lot bitch scar pain bomber father check stop w-i-z care dare shorty rare palisade v ja bad ecstasy boo bond cut baby bed weather dick way fair call m-o-b crystal every three nigga leather truth smack religious lover pimp thing time sheezy kirkland girl coldest together explain always murder want motherfucking money-green smile past hit feel write witness apparently fucking money paint stormy outside two thug hitsembed stare jersey love crazy bother sometimes affair special drug mind sex piece life sunshower double pee-wee believe never leave business wait hot bentley wakin style back key shade night grip play late-night build nothing many hoe mine keep legend buckshot meet fuck wild restraints home braid
AM To PM ; Christina Milian;AM To PM by Christina Milian.txt;doin right bar star need whether move whoa break sound bob stand turn club babe shake honey sixty-five front bump song light week lookin people gettin three head bloodshy fella hear seven find time long girl sleep want somebody chick uh everybody pm rock stereo still hit car body year bumpin woo non-stop place pmembed drivin milian guy hey four back twenty-four night play floor keep wall ooh-ooh beat day bobbin
American Child ; Phil Vassar;American Child by Phil Vassar.txt;silver ten eighty name august lyricsi live dirt thin last yard far lakewood nowhere god someone grow today would spoon three first heart old late woah seven nose virginia inside kid base ever bear promise glove pound deep tune thank secondhand figure american beside love life beat-up grandfather anyone sing blessing count ounce face play dream equal upright fell child wild
Any Other Night ; Sharissa;Any Other Night by Sharissa.txt;company damn timeyou thangs chill youda alone woman verse chasin pick lonely good ya shorty feelin someone bed would way call coulda nigga friend wrong find around chorus time surprised ri girl want busy tonight somewhere end waitin two answer show else fine love page layin wit woulda boy night another keep phone cool makin home
Anything ; Jaheim;Anything by Jaheim.txt;right whole apartment mansion need whatever anytime give overtime last lyricsyea cause pray bone okay anything ring lot handle diamond hold near work fictitious baby way cellular stay ask dime lord thing time girl want plan fancy ridiculous inside car l grasp roll please peace prepay faith drive everything love yea mind finger jaheim believe leave da sing texas mine dream spend anywhere man true spot lexus
Are We Cuttin ; Pastor Troy;Are We Cuttin by Pastor Troy.txt;kilo damn hell-hell knife deal um strawberry need name stand loose really caress shine travel grindin timing manner hennessy ha-ha chocolate jean bitch suite ya chain shorty nah us vice-versa holmes sun boo pastor cut baby real pass much showbiz men substitute weak hand heat excuse friday nigga red truth woah lifetime workin confessin hear wo fresh hair grab sleep girl atlanta huh tomorrow sharp best timbs hell bugle ballin uh pussy low-key kissin chicky second twerkin still saturday tonightembed philly save tonight please money clothes biz wear undress morning uh-huh kick smelling troy show kill love answer weigh room gram cat mind life dance talkin worser cuttin leave bring split condom dummy back boy haha night foot upper boat floor question rise pretty fuck man tuck home understand shit
Awnaw ; Nappy Roots;Awnaw by Nappy Roots.txt;sell hook awwwwwwww coupe damn marley bar notebook alright fame cent bet big dat gutter jane break bob forty-eight naw county aww afraid road last caddy peep yegga awnaw back-seat aw-aw-aw-aw run line anything hard toota-file scar roach benz mud front jean ya interstate flippin song roota fuckin hundred-spokes corn us headin work ac mile suffer fat root hangin boys butter-skin held first jimmy thinkin cussin head forth ask plus nappy wheel country seventy-nine hear harley hog block ride shawties swallowin time shame long customer want rent side cross hell step lose hatred headphone kin faucet grill niggas vertical skullied prophet cashville black cash tryin south sweat mary raw could closet favorite flirtin look water six hop kinfolk wallin everything pot cuss tez microphone page kentucky hurt deville glass-filled crack life ah believe smoke grind bring leave hey lint lay tippy-top party back flat boy bacardi haha hat charge e-dubz gravel beat pocket spend rise man must hustler soul ta wild smokin understand twankies
Ba; by Ashanti;Baby by Ashanti.txt;whole alive bloody feeding need give break name eye live alone human babyembed twice thought world bone run indeed pain stick god care sane cigarette real baby stress flow almost would strange brain blood red desperately relieve hear sick green start wo form shame complain lose ever feel body without please shiver could listen look earth doubt remember everything jones love yet kiss drug life lighter smoke kind quiver lip remain vein never leave mesmerize knee boy seem another breathe mine watch keep may power touch man soul think understand
Be Here ; Raphael Saadiq;Be Here by Raphael Saadiq.txt;sleazin wish big breakfast really alone trap oh-oh-oh last babe missin wrap lonely good hard forget stick work trick baby dick way lady every heyembed bein walk reason time heal girl want uh mama climb lazy feel mornin money especially away drive show job crazy oh-oh never hey beneath night dream day man makin think
Beautiful ; Christina Aguilera;Beautiful by Christina Aguilera.txt;ashamed yes undone beautiful shine wake hard pain song us sun suddenly today way every friend wo insecure matter always tomorrow side inside word single puzzle everywhere tune emptiness look todayembed consume fill delirious wonderful piece bring leave doom mistake full breathe day try mm
Beautiful Mess ; Diamond Rio;Beautiful Mess by Diamond Rio.txt;rather cup swear shave need eye put beautiful spending stop care addiction catch salt work concentrate behind fire coffee walk wrong son time lose smile ahhh bos sweet tire morning ahhhembed drive look love else death mess mind shoe enough hunger style straight foot nothing haze day man wild think
Big Machine ; Goo Goo Dolls;Big Machine by Goo Goo Dolls.txt;alive deal need big aware live turn vain loneliness last beautiful little world good run hard survive stop god care trust pill reel ecstasy real way swallow lust anger heart drown youembed fire fear rest girl sin livin still angry feel desire blind begin house bitter petty love fast tear sex piece believe leave wait machine nothing true
Black Suits Comin (Nod Ya Head) ; Will Smith;Black Suits Comin (Nod Ya Head) by Will Smith.txt;case pitch right threatenin clothe law even mib force train mmmib scum tie dear stranger whatever act foe card protect eye stunnin chase yo crime put cause defender weapon little world finishin headheadheadhead nodnod good manner gentleman honey check ya trust us highly understand near lem saw light galaxy flash lookin men would part brawl mean lady superwoman hangin random pretenders contender fun defeat thinkin flack head new deplete along start sick callin wo son bop fear attacker blank nodnodnod huh tanglin best somebody chick worthless uh imagination rock serleena onon myth fighter without takin complete black erase tryin nod attitude appear provin since woo comecome thank faze breakin away suit riff trippin earth look six hype close elite remember oncomecome girls crazy hotness open mission oh-oh rank comin hunnid mind dangerous haembed nice nothin shoe i.d bringin depth leave bring ohh gaze kryptonite sing alien style back enemy disregard shade boy night play smith runnin touch ray-bans phone tryna praise fed man makin endanger think k bust
Blessed ; Martina McBride;Blessed by Martina McBride.txt;give put beautiful world swing front hall god gift hold sun bedroom crowded porch much way every quiet hear find sleep hardwood across door sit kid word feel soak end lie thank morning place look bless love deserve sometimes room hurt kiss sing foot floor day child think laugh
Blue Jeans ; Yasmeen;Blue Jeans by Yasmeen.txt;flaunt minute need anytime anybody number wooembed jean lyricsoh check near sexy real baby sensation talk would way call heart blue start walk wo time want inside lose rock hit wonder feel somewhere confidence everything else love b-boy exactly nice introduce style night keep safe dream day
Blurry ; Puddle Of Mudd;Blurry by Puddle Of Mudd.txt;meembed whole stumble obscene give protect live turn world far hide run pain us surround unclean someone real nobody imagine no-nobody everybody lose ocean wonder preoccupied feel without save everyone end blurry could crawl empty away everything show mess scene told leave shove face fake change think
Bother ; Stone Sour;Bother by Stone Sour.txt;instead stone wish need diary throw give cryptic live deserves turn voice zombie far hide good shell indeed forget feed bleed care fade protest dead hold masochist creator deceitembed flaw memory wo reason die slip cater season bother open entry self-affliction never leave face digest keep cry try shit
Bouncin Back (Bumpin Me Against The Wall) ; Mystikal;Bouncin Back (Bumpin Me Against The Wall) by Mystikal.txt;even right fool eat bout tongue news letter fail stand really hope album yo cause harmony pray complaining proud thats pick drop chest good trouble run scar forget handle change pain batman bump jammin stick fold appreciate ya stop trust god hmm-huh fearless aint bad grow cnn sorry much rap bammin way call strange friend serious bouncin nobody middle badder land strong truth start meaner hear rest matter find slide time shame long huh cryin want sharp somebody inside chin word hit slow belt feel flip respect set uplift throwin perfect satan peace bumpin learn piss since deep lie could oppose wage knock neptune drive trippin look kick living robin show bother thumb yet happen plead ba sometimes drum mind determine life piece ferocious ah mo ready never miss precaution business thinking back tack nothing keep rude wall watch dramatic day stride causin swift try ta home accept
Braid My Hair ; Mario;Braid My Hair by Mario.txt;case even swear alright criss need road last put fourth use hood travel game good hard jean drama front studio care work baby stress talk walking hand weak anyway cali t-shirt creative though new late hear fresh wo -year-old thing sleep girl complain want side cross leg rock sit worry feel body philly tire dallas ear away look hop rule jordan show love sometimes york mind finger life lip wait back night dough play keep may choose limousine true slowly think home braid hair
Break Ya Neck ; Busta Rhymes;Break Ya Neck by Busta Rhymes.txt;doin right truck shut bar troop making bakin bet need give break dem really music yo put creepin club wave neckembed little hood boot peep drop good okay dawg bitch busta-bus check stop ya givin hold lem real flow neck people talk way steamroller hand motherfucker heat every nigga bounce bouncin reach seat head tec stay team everytime fire fort along soldier start walk link flop ah-hoo ride around thing time motherfucking trunk always motherfuckin everybody hit wonder niggas fo crunk takin cash money nod could address away dre place look uh-huh figure love street recline death breath blowin chop caught bang never backwoods mouth hot back boy ounce night high crew drunk floor keep bomb watch ayo lockin day gather fuck rewind makin spot try lock bust shit
Breathe ; Telepopmusik;Breathe by Telepopmusik.txt;something dayyou star believe bed leave bring haunt lie use another though nothing breathe dream ceiling day close hard
Bring On The Rain ; Jo Dee Messina;Bring On The Rain by Jo Dee Messina.txt;round im ay-e-ay-e-ain afraid drop hide thirsty hard tomorrows rain barely dead almost hang cant anyway war defeat head imagine start wrong time sleep tomorrow circle oohembed door lose feel tonight single somewhere could away else sometimes couple bring id battle another breathe cry day lock
