title;artist;filename;lyrics
EARFQUAKE ; Tyler The Creator;EARFQUAKE by Tyler The Creator.txt;something quake shakin um need fall give break slime confrontation translationsespanolenglishpolskihebrewfrancaisnederlandsearfquake cause d. breathin okay bitch plug diamond god ball hold bad real call three heart ill bih do-do-do-do-do woah conversation tiffany ride around wicked time needembed girl huh lawyer want side uh short rid car complication ayy crash fault feel set earthquake none two earth love happen confirmation already yuh tyler leave igor lung youre information vicky rise fuck ta
Earth ; Lil Dicky;Earth by Lil Dicky.txt;heard cub west pedro tit translationssvenskaespanolenglishfrancaiseestinederlandsearth damn stupid milk eat butthole freak give kanye name act chill cover stand live marijuana music human hope nut shoot chinese woman lion planet white beautiful pony zebra world germany good nowembed attack lot giraffe warming skunk feed africa disgruntled orgasm fuckin dead us advanced lick la real baby neck dick lookin people common fat india mean shooting every sahara next cum land cow simulation fella hear -- ride thing time elephant sleep long huh girl trunk want always together junk ariana uh earthlings hell everybody wolf horse ever still howl ayy ta save hello black russia everyone respect amamos clothes less kangaroo anus ahmed wear woo lie listen could die fish koala drink unless heck earth huge look hop love global bieber hippity-hop sake giddy cute yah heh-heh-heh plain sex baboon hum-dum-dum-dae-dum crack tuna specific hpv internet vulture pollution guy hey fungus squirrel anyone plant ba-dum-da-di forgive alien boy moo clam tierra trudge rhino build many meow horny asia pretty day pig cool man fuck ba-dum-ba-dum-dum hi think home shit
Easier ; 5 Seconds Of Summer;Easier by 5 Seconds Of Summer.txt;right damn easy beautifulembed need fall really hate beautiful run hard change blame work much way part every friend stay around thing time want always best ever translationsturkceespanoleasier morning away place look love da-da-da-dum-da-da-da-da never leave build breathe wind air ta
Eastside ; benny blanco Halsey;Eastside by benny blanco Halsey.txt;pay idea coast translationsespanoleastside fall twenty-three give break young jump turn put window use city line run anything hold sun light suddenly baby grow today much way bill hand every friend heart new eastside underneath old blue late start sea ride find seventeen together want uh corvette seriously family sneak tonight set backstreets bus house away drive place everything love job kiss mind life different setembed believe enough leave willing daddy enemy sing back dream touch day meet anywhere man fell dead-end pressure think
Easy ; DaniLeigh;Easy by DaniLeigh.txt;og damn easy sunday wavy chill homie put babe thirsty okay ya catch work feelin real baby stress decide dont lovely lucky old relax ride whippin od time worry fi feel could look vibe love fast dani easyembed mind behave drip never miss hey mistake bae lane mine touch day highway ta
Electricity ; Silk City;Electricity by Silk City.txt;even need fall deny give im turn ghost woohoo world electricityembed electric stop care us saw baby flow ima youve wide would differently friend lately compare ill strong wrong want feel bittersweet tonight vividly could current ceiling electricity translationsespanolelectricity love see-through ready never awake id face dream feeling think treat
Ella Quiere Beber ; Anuel AA;Ella Quiere Beber by Anuel AA.txt;hasta el champana acerque vo ser soy engano vengarse intocables pide dentro muerte mio veo pal solo rumba veinte music quiere de yo una puta tiene botella escuchaba su cama romeo deseaba jeday deseos piel todas es temblando era eso voy check rumbear traiciono-o-o reflejos e phantom le rico bobolon todo adentro la emborracho-o real baby orgasmo escapo-o-o bien decide problema uah-uah bebe bailar enterraba enterro fallo-o-o servicial amar bonita bebecita vida candela mas mi carajo excita botellas pasado king por dime olvidar desde hijo cuando que hago sus novio conmigo en pa si excitan chris dejo tumba sin ella nena fallo rosada la- ojos eh necesito mujer chamaquitas buena loquita miraba como ahora siempre buscar los kob mera gran illuminatis diablita beber con dios tipo sentimientos devorar uah show lo nunca cuerpo un ensene bailando tan hombre ignora dueno estoy nasty cazando apodera remix difunta va brrrrembed kelly presiento tu hilito envidia gaby gustan r te entrego se probablemente mala devoraba shit
Empty ; Juice WRLD;Empty by Juice WRLD.txt;depression right law deal styrofoam whoa-whoa-whoa-whoa-whoa-whoa big act give rooftop stand live gossip really tough perfectly hope put world lonely good run overdose anything low lot rag rack pill us tmz hold dust real suicide way tote swallow hand mosh semi-autos gettin revolve war unknown actin fight bein wrong vogue find around exhale od time thing survival sign huh want problem-solve uh dope hell lose door rock suicidal past still sanity livin rich niggas feel black child roll bullet peace crawlspace goddamn imperfect empty house hole away drive place look keepin devil kill crazy mission numb lead rogue drug life squish hill never translationssvenskaturkcenederlandsdeutschitalianoportuguesempty tempt pit back key lost semi-autosembed hoe roam keep wind may dark blow tryna rise pnb fuck soul slowly ta think home shit
Enemies ; Post Malone;Enemies by Post Malone.txt;happy even right fry damn shut al tie need throw deceive polskipost give eye really ticket alone turn buy surprise put use radio far quarter lateembed prius good shake ha hard bitch broke malone ft. playin fold dababy dead enemies camera hold relieved platinum partner bag energy pile pass sorry much would swallow mean translationsturkcepost hand call every nigga friend bank reach tendency fist feature drown late hear post guarantee traduccion literally rake around time huh want pride mama box door plate hit lil car fee without year packin money pound could bite autumn look stadium close sad show vibe love sometimes laughin guess life double ah smoke blah espanol talkin never leave enemy tend nope keep fuck man try think home shit
Envy Me ; Calboy;Envy Me by Calboy.txt;og locksmith fall pull give ten nba buy put tweakin demon pray cement run runtz hard bitch front fold bleed ball dead envy trappin mean fair gang clown nigga thinkin raise heart fact fight lord matter around blackin sleep squad mall drawer lil hit niggas ayy black money field end deep class mvp sinkin water drinkin remember kill mob twenty smoke never leave rah-rah overseas school four lay back key boy ounce bend play keep air blow better spend day meyou soul opp shit
Even Though Im Leaving ; Luke Combs;Even Though Im Leaving by Luke Combs.txt;even right need big act im eye alone tough afraid road little churnin far nowhere okay scar leavin bed neck nowhereyou way mean hand call rough goodbye though monster middle stay old late walk wo grab thing always side second please grabbed goin outside away gut close hug prayer uncle dad plane sam never leave wait daddy boy night keep safe day think
Every Hour ; Kanye West;Every Hour by Kanye West.txt;grace god breath minute us need second work fall millisecond mighty hour sing every excellent sanctuary glory power praise translationsespanolenglishpolskiitalianodeutschfrancaisevery lord everything
Every Little Thing ; Russell Dickerson;Every Little Thing by Russell Dickerson.txt;right easy sunday august molasses dixie mhm angel punch little delight loveembed line run -carat forget endless sunshine baby every hung red goodness land coffee woah -- thing time huh girl everybody kissin still saturday slow sweet morning alabama everything love summer enough sonoma hey seattle night dream mine dress wine ta wild
Everything I Wanted ; Billie Eilish;Everything I Wanted by Billie Eilish.txt;notice even right something instead scream ago anybody daughter stand underwater honest wake change translationsturkceespanolromanaportuguespolskinorsk care italianobahasa saw would way weak call coulda riksmal felt head nobody indonesiamagyardeutschfrancaisnederlandschinese bein hear bokmal traditionalshqipeverything long want somebody everybody step wonder feel year kinda learn lie could nightmare everything deserve fly hurt yesterday anyone golden straight dream cry try mm think
Everything We Need ; Kanye West;Everything We Need by Kanye West.txt;west need italiana tree put ft. spoil clemons light baby woo-ooh dolla traduzione people adam lightembed land woah matter level apple inside eve short feel enjoy ty attitude woo radical begin morning dude ign everything life different storm ah juice switch latitude lay back translationsportugueskanye deutscheverything ant ooh-ooh mad
Eyes On You ; Chase Rice;Eyes On You by Chase Rice.txt;damn sunset coast need big beach corner carolina eye babe -whatever world square good london god care saw speakin baby much people talk local stay youembed memory sea matter around time girl help still recall fault roll countin everywhere could booth paradise moon drive view cliff stare remember street sky pfeiffer scene room guess paris halfway miss party montana night arm think
F&N ; Future;F&N by Future.txt;even truck jacob dawgs spider hi-tech chopper big lean teach thread jump young slime presidential standin -f harmin frustration put white richard heavyweight dolce ship max date bean ku drop good band f clear entertain store low certified bitch famous front dodie stick trust pop catch klan us shoulder wristband foreign bad dust bed pharmacy talk would mean thoroughbred fn dinner anger perc flesh nigga friend wipe first head new avalanche scheme bein lucas frank nose around whippin day-date time well-known long food murder tall hell rollie uh door cutter ap hit lil ray atl body lift roll finesse yopper money h bullet vvs park goin taliban j brodie dog expensive ak approach n homicide digital chamber police shaky wipin cruise soon scene slicin throat woadie comin nuisance chop yesterday klux dance pour kickstand talkin told ready redbone four back skeleton mafia machine n-f face high baghdad boat straight many hoe floor keep scale beat pool dress meet m.o.h. fuck cool ta mad shit
Face My Fears ; Hikaru Utada;Face My Fears by Hikaru Utada.txt;version breath long space tear lose life tearsyou mile taste shoe leap bittersweet almost deep face could nothing english faith cry watch walk choose wo fear
Fake Smile ; Ariana Grande;Fake Smile by Ariana Grande.txt;happy alright read im starve alone far honest hard hi blame baby laughter neck sorry much way shock tv every gettin cant hear walk wo thing time want somebody cross everybody smile grateful car feel write roll attitude somewhere woo lie sayin love fine crazy pout tear hurt life shocking ah lip yuh leave party night another fake feeling choose fuck arm ta translationsespanolportuguespolskiitalianodeutschfrancaisnederlandsfake mad
Falling ; Harry Styles;Falling by Harry Styles.txt;need fall aware baggage unpack translationsturkceespanolportuguespolskifrancaisfalling run forget care song blame someone wandering bed talk hand coffee wo around thing want write drink kill meant cafe never miss leave beachwood back many feeling
Falling ; Trevor Daniel;Falling by Trevor Daniel.txt;right something need fall give exception break eye last run pain ya trust catch swore saw feelin baby closer speedin talk would way felt drown hear sick find downyou time girl inside feel everything love fast open pourin numb tear mind translationsturkcesvenskaitalianofalling enough never try think treat
False God ; Taylor Swift;False God by Taylor Swift.txt;even west stupid star beg village im jump road babe window wed city good loveembed confession hard honey god dare us work heaven talk new altar translationsturkceespanolhrvatskiportuguespolskiitalianomagyarfrancaisfalse fight false thing time religion forgiveness hell lose still ocean try worship die could blind scare faith favorite away separate remember warn love crazy fly york lead ah lip leave id hip town youre patch touch wine think
Famous Hoes ; NLE Choppa;Famous Hoes by NLE Choppa.txt;even right damn minute chopper need pull corner really shoot trench thirty blam top zone banana store famous bitch thuggin lot survive dead near three-five spin dick lookin shotta perky hand call al-qaeda nigga raise next head ask gun wrong block ride pronounce motherfuckin nle slow niggas car feel roll roxys paramedic skip depart choppa die house drive clip look counter blicked kill vibe love street grr outyou smoke bang cashmoneyap heartbeat draco micro back count boy high play rob hoe bomb med feeling question fuck ta
Fast ; Juice WRLD;Fast by Juice WRLD.txt;right cup issue bout think move push teach live really trigger gnarly month last hahaha good honest okay bitch blame pill bag win bad continue much ima involve bill mean hand call story every gettin nigga confuse next felt nobody old blue fire translationsportuguessvenskaturkceitalianodeutschfrancaisnederlandsfast sike wo fan time want always uh mama lose still rich niggas ayy promise feel year respect money elevate countin molly since wear die dude ground sad dior fast happen sometimes oh-oh comin drug life talkin asshole fireembed purpose back count high play many day cool fuck try ta hurry mad home
Faucet Failure ; Ski Mask The Slump God;Faucet Failure by Ski Mask The Slump God.txt;happy fry mint ketchup disney deal trainer um tie purple big pull give yes stepper cockpit buy lips put cause x failure dancin band okay polish bitch lisp tilt hittin diamond maison pill fuckin pickle chinny-chin-chin lick disc mcdonalds real ima margiela constructor dont sock nigga skirt new fist sellin fire woah kilt flyer ostrich wo beef gyp huh girl want five uh rock still faucet rumpelstiltskin hit grill lil guantanamera ayy drift pie please demolish suit uh-huh goodfella kick remember chancletas pokemon ashin skrrt mob hol kiss chasethemoneyembed stilt wont different hm drip wood guy meal yup weed foot chasethemoney pumpkin gim wind heh pretty day hotter pepper k shit
Fear Inoculum ; Tool;Fear Inoculum by Tool.txt;elegy chase inhale inoculum poison allegorical spectacle disparate purge evacuate overdue light eternity grow inoculated enumerate clarity venom mitosis recast hear fear exhale malady forfeit bind time long step mania calculate lift naive contagion tale away bless exorcise expel others open breath deceiver division immunity veil control weave breathe belong
Feliz Navidad ; Jose Feliciano;Feliz Navidad by Jose Feliciano.txt;prospero navidad wish felicidad feliz christmas felicidadembed heart ey ano merry bottom
Fine China ; Future;Fine China by Future.txt;sell jupiter need big mar ten remind jump outta eye live refuse twice last beautiful send world ex pick location compromise wheezy shorty lake bankroll pluto feelin dust insane baby would translationsturkcefine call every brain nobody argue fried saturn thing selfish girl china pickin uh pussy inside lose livin plate ayy feel body mineembed goin die movin loud percs everything kill love fine sky crazy drug repeat leave dollar woulda thousand mine diver runnin vagina day man soul fell ta space think
First Off ; Future;First Off by Future.txt;rocket right law pay scrimmage jacob alright exchange tongue gas ammo need dim news millionaire farrow bugatti pap paranoid give linda james order young wavy number point turn ridin nba shoot put flyin shot lens wave sim league use heavenly valet stoppin snitchin city good line blast bitch shootin info somethin check fade steppin catch pop rack cock option us dead mcgrady v opps work pluto bond cut baby much rap freaky way dice gettin fishscale surfin margielas nigga fugazi gelato hundred dae three first red head new wade stay start conversation pimp around whip codeine sleep bull chanaynay uh door dwyane ever lil hit belt atl takin body forty roll set money shoppin pound dog tint travis water close louis fill cheerleader gym kill street crazy lit skrrt weigh juugs finish payday smoke draft curtain pour avoid talkin switch never teenager business wait nike pj back bound catchin backend cloud rim night straight rat patek forbes harden breathe wall touch spend gorilla fuck ten itembed shit
Flaws And Sins ; Juice WRLD;Flaws And Sins by Juice WRLD.txt;even secret suck need fall give im number chill really turn hope mazda little good wake band f run ring scar bitch stop headshot god ball catch e nah humina skin sun work bedroom aint light bed much involve way lady mean huddle call poke gettin bread eternal thunder though red shit heart head jesus flaw woah wedlock wrong conversation protection sight ride reason bat girl gaga want recent sin uh hell rock past ever darknessyou wonder hit choice ayy cupid compliment deeper goddamnit end since raw could thank dot n look uh-huh darkness vibe love prada wouldnt traumatize log room lead already drug mind sex couple finger finish lighter believe tweak leave translationssvenskaportuguesnederlandsturkceitalianoflaws hot back boy face youre percocet night play keep zoom lightning dark belong slumber difference fuck man weird fell try gorgeous karma
Floating ; ScHoolboy Q;Floating by ScHoolboy Q.txt;sell right role represent pay yellow condo chopper big fall ten fail im break freak pace wife yes ziploc turn chase richard ghost wrap punch little hood mil tot problem game max drop run okay ha carti bitch mud plug tat stop god suppose pill shoestring aint floating dick dont mean hand call hang gang jogging hickey nigga floatingembed friend bounce toe new nibble fact slaughter late sauce bop around milles thing rapper waist best robber leg hell pussy metal solve emotional kid rock still focus wonder rich ayy model body broccoli cash money ten-tone learn woo everywhere product house maybach joking unless drive ford swag kill punk show copper transfusion quick seal savage blunt kiss tape steal ar victory drip bring leave washed-up wait float count face percocet straight nothing build keep safe hoe smoking try shit
FN ; Lil Tjay;FN by Lil Tjay.txt;right whole swear deal benefit fame wish maybe think move grrr act name wrist smelly really trigger homie po use mask duck strap game chart good clear kart scar bitch lot pain stick chain trust care catch rearview dare shorty nah near smart spliff canceled insane real bed grow stress much almost speak mean gang every bluff brain nigga grain sb felt heart drown fact link start fear strictly find false stain time careful plan want mama everybody lose sit cartier wisen ever hit lil niggas ta promise feel body roll money field bullet mention skip appear depart park listen could bus pow drive look view remember kill bubba street lit skrrt grr drug starstruck dance gain enough never tjay leave brody business back boy translationsf.n town glass dark blow tryna fed fuck man drill opp change ohembed smokin mad bust shit
Follow God ; Kanye West;Follow God by Kanye West.txt;right even fool gas bet stretch push letter give advice live really turn supernova movie white pressin bright lifelike good wake button father wrestlin god sigel christ wrestle bike light apiece perry needin lookin people typewrite talk way hand every three though next christ-like new nobody free fight argue bein start block find want text best somebody ever word rid ahhh l feel single decimal tryin morning spazzin picture look searchin close drivin everything prayer else referee dad seein life nothin never translationsturkceportuguespolskideutschfrancaisfollow screamin tyler excitebike back night another mike deity tryna cool man try
For My Daughter ; Kane Brown;For My Daughter by Kane Brown.txt;tattoo fall teach daughter tough turn put pick line suppose catch someone baby grow would way mean first heart monster history sixteen want best kid ever past slow without sweet sure girlyou perfect shape scare mamma show love room dad piece guess repeat broken never back pink play foot mine dark backyard change
Futsal Shuffle 2020 ; Lil Uzi Vert;Futsal Shuffle 2020 by Lil Uzi Vert.txt;right jeremy damn whole probably swear fool atake um suck need move letter type name jump clearin loose standin alone ridin turn road hope shoot yo sweatsuit mhm send little dumb drop city good vert okay low study bitch check cheese stop dm trust rain pop goembed fuckin pedal light win bag cigarette doot-doo cut weather flow doot-dooda-loot-doo dick margiela talk shuffle call uzi nigga three eternal serious bank first new puttin fact stay blue woah hear matter false thing jet time girl level together want uh lose ever still rich lil hit coretta bear ayy save hello obstacle hah set money dub scotts woo u could thank mula two wow cougar cheddar translationsespanolfutsal swag rule snitch answer everything love prada clone provolone delirious smoke nylon ready never leave sing back boy fifty guap bend foot runnin pocket phone righteous fuck man try ta hurry mad shit
Ghostin ; Ariana Grande;Ghostin by Ariana Grande.txt;probably whole instead wish tumaczenie need dealt parade anybody card break baggage admit last good lot rain visit hold baby bed much would grande every though next heart head puttin hear understanding ghostin time sleep girl want hell ever past translationsespanolariana mmh look living yeahembed else love hurt tear forward leave italianodeutschsuominederlandsghostin polskie night hat dream cry day arm try
GIRL ; Maren Morris;GIRL by Maren Morris.txt;right hooembed maybe anymore mm put comparison pick okay unflatterin low stop baby way halo hang kitchen head wo hoo find around girl cryin lose vanity feel everyone tryin less draw wear crown waitin everything enough natural lay floor vitamin difference man ta shit
Girl Like You ; Jason Aldean;Girl Like You by Jason Aldean.txt;something pull name eye sound turn top hard diamond gold light sexy baby way thing long girl want motion rock ever hit slow takin quite tonight body goin movin drink youyou close double-barrel love fast crazy kiss lip talkin never bourbon night high breathe meet cherry
Girls Like You ; Maroon 5;Girls Like You by Maroon 5.txt;even right whole alive backwood need maybe hour last babe good run barely spent us sundown flight way fun youembed late thing time girl want roll weekend drive close love guy night drunk play spend tryna day daylight think shit
Girls Need Love ; Summer Walker;Girls Need Love by Summer Walker.txt;right something scream need give breathing babe swing good judge handshake plug focused baby real dick way tooyou joke nigga loving lame stay fight start hear wo reason heal girl want ayy please tire tryin could thug honestly hug girls love never wait heavy feeling fuck must lo-o-o-o-ove think
Go Loko ; YG Tyga UNCERTAIN;Go Loko by YG Tyga UNCERTAIN.txt;hasta el damn cup eat yg tongue ice melt strawberry yi-yi need big dentro latina pull give wilhelmina clue alone sk-krt quiero juanita po-po puta lips yo put una wifed tiene wave mofo loko ugh toto hard low lolo bitch front e fuckin chinga leavin badass le gringa bad lick la negro tyga real taste dick bien ese call geico nigga bounce haina sho red next drown pastilla handcuff marina boricua mejor fire por maria track mamacita yi slide que choco time en rosita want always sho-sho motion sin pussy mama door jacuzzi huele lil ayy fo carro huelas black chokehold low-low sweet poco ver woo culo morning house con six police ahh lo open fly skrrt ho mind behave ah escape mustard drip code moco loco leave hey mouth morenita four outliner party perico town floor mine viajo salen hoe pero touch horny beat phone ben lipstick tusi jerry desnu se mezclo no-no bust shit
God Is ; Kanye West;God Is by Kanye West.txt;right west whole poor cup force alive revolution sunday give break name wife prison italiana turn woman freedom demon race world pick run strength store hath forget lyrics deutschgod god addiction christ dead vision light win sane miraculous god-given much traduzione faithfulness translationsespanolportugueskanye call every portion eternal jesus king fight wo lord thing time heal welcome religion best everybody door sit kid ever still rich word save fountain roll worship sayin listen thank isyou look crib darkness fill idol everything show captive open breath mission life never bring forgiven back revelation keep service praise man soul
God Only Knows ; for KING;God Only Knows by for KING.txt;secret ashamed break sound cover misunderstood afraid world pick lonely god blame saw someone real wide would every nobody memory start find somehow somebody single could show kill love piece believe kind never leave awake keep day knowsembed mm-mm-hmm try mm
Gods Country ; Blake Shelton;Gods Country by Blake Shelton.txt;right whole sunday read fall countryyou bit break sound dirt turn road pinewood put dixie pray baptize riverside proud little lot stick gold god care rain saw light work week heaven church call gettin bread grain land country find around bind time holy sittin box plate save deed money end deep outside thank dog sunrise water six ground georgia devil whistle guess kind bring lay back town foot headstone wind runnin muddy
Going Bad ; Meek Mill;Going Bad by Meek Mill.txt;list wish need neighborhood big fall move christmas diesel break card name outta back-to-back plat really hereembed trap fendi last sticky -piece put richard send lori strap lethal top jeez lonely cost band dawg jason bitch lot marlin playin wheezy trust ball rack extend fuckin near opps saw foreign bad cap real grow involve way mean rambo call story every gettin anyway nigga actin fit head dc fact ask woah bein baddest hallway thing time salute girl want broad legal drizzy uh everybody mall livin still rich lil terry ovo bunch philly bos graduate friendly goin commando could fish empty beatles away place clip lambo show murakami love mille ah nothin bring leave magic brrt harvey back shade night slap keep amiris runnin wall blow day fuck scary corleone true ta smokin home shit
