title;artist;lyrics;filename
Encore;Eminem Dr Dre;lamar eazy-e- mc skylar intro keep ringin' pen love .paak ii blaze funkmaster snoop daz say shit everybody mansa ice akon crack let ride diary hit kendrick guilty time lil doctor ab-soul anderson dre- lamar- head forgot kap- old roger bounce california eminem nate six-two rakim eazy satisfaction sake jay marsha get jointz know jewell guy west die fuck lyric u celebratin compton kurupt cover always please likeembed difference gun soundtrack justin cube- need xzibit- bottle missy timberlake `` next conscience ai ghetto feat key eazy-er pyper pac- xxpolisve bear .paak- kush nuuuts might hippy- grey natural truth wit g recipe cent- nuthin dunn also boy elliott game- flex obie eazy-duz-it wild musa dre hello dogg darkside/gone ambrosius q d'angelo talk trip devin imagine rbx dogg- sarai cube day timbaland- encore dippin' diggity schoolboy dude cocoa new deeez 's watcher bad dr. eminem- fan issue lock deep still rock '' will.i.am alicia jay-z- chronic cent killaz xzibit black bitch mez sly want hurt thang episode hittman ren d.r.e backstreet- big n't queen take daz- nigga trice- dem;Encore by Eminem Dr Dre.txt
Everything;Alanis Morissette;woman connect light aggressiveness high relate heart love go dull else partaking ever 've mistrusting low negative resist terrified soul oh blame know meet lyric ca dig everything moody brave kind closed persists style devastate see everyone might matter also speaks positive funny part gorgeous withhold like 'm anything passive 's hereembed still wise 're never loud baby grand anyone ashamed sometimes dark every n't asshole;Everything by Alanis Morissette.txt
Everytime;Britney Spears;face love try babyyou clear easy time away fade forgive haunt rain seem dream lyric please likeembed without stranger make need sorry soon believe fall may see might also pain weakness strong cause everytime way pray night 's 're feel song baby guess notice small fly hand wing every move take carry;Everytime by Britney Spears.txt
Fall To Pieces;Velvet Revolver;long 'm like breathe fall since grow 's keep wait year alone might still die 're go feel lyric fell try also ca lonely journal memory im piecesembed find time 've every n't piece old;Fall To Pieces by Velvet Revolver.txt
Fallen;Mya;hold play love forward say yeah ever let ... time 've away ah head oh outta would thee get happiness youre 'cause lyric security ca everything free kiss make need accessory next doin necessary accident ive fall lady air whatever standin see loveembed might water tryna aint also mad touch boy joy proud speak nowhere na crazy explore caress spend talk pledge arm like 'm heel complement complete whoo cloud bad 're never word loud feel could baby wan happen look n't take picture;Fallen by Mya.txt
Fallen;Sarah McLachlan;light hold bitter somewhere turn leave love embarrass try reveals intent come begin offer raw time 've young slip head low burden wound back oh good would morning get think bend know pretend one seem lyric fire taste always everything heaven step lose `` 'round long believe best cost fall bear answer everyone see might embed truth redeem change also lonely tell nowhere though missed catch dear 'm like heal way 's mess past '' undone could friend awaited much 'long lead hand fight sink well n't painful take carry;Fallen by Sarah McLachlan.txt
Falls On Me;Fuel;hang 'm like light wound vein shock silently dug within breathe fall explain faith see believe might darkness still disease never skin dream beautiful could lyric change also hole black bound touch sky pain wonder world break draw bring hand life ever strong save wash 've 'round carry meembed weight;Falls On Me by Fuel.txt
Feelin Way Too Damn Good;Nickelback;face something ta keep hotel turn heart leave love go constantly us try say memory time 've shower back oh good finally would get think one dream 'cause start lyric sure make find best fall damn room see embed might around land two show also wrong beg break tell sight last hour like 'm way must 's 're feel miss feelin much fly probably look fight sometimes inside well every n't;Feelin Way Too Damn Good by Nickelback.txt
Feels Like Today;Rascal Flatts;light something keep heartache wish 'll come life running time 've away amazing oh towards morning know one feeling lyric ca today gon sure mind release find save make soon weight long sacred changesembed explain wait might dam freeze 'til change also treat break blessing na last like 'm way drought storm 's end 're feel miss thing hey tunnel inside n't carry pressure picture wake moment;Feels Like Today by Rascal Flatts.txt
Figured You Out;Nickelback;favourite dress nose hard love go try say freckle white dirt test time people put chest good know lyric wonder ca please wreck foot favorite powder long best check damn embed might around disease also place self-respect neck figure like deck way line impress lack hate 's row still 're never pant knee many look hand stain n't pass;Figured You Out by Nickelback.txt
Fk It (I Dont Want You Back);Eamon UNCERTAIN;fracture weekend blind fk trust java ten evening bhopstick ta snow call whoop turn akron leave outside run us juan red fun backend twin hoopin 'll say frontend come fast yeah 'net shit life type crack opps trd hit cameron time strap fresh coffee ooh bome head school stan mamba back virus havin dog niggas get real guava fraud know tron pull fuck lyric breakdance fire likeembed scantron gon squad scoop beat mind heard sip uh sada also cap make brother kind kauri next ape ai frat roof huh dennis 'fore flare see set might around perkies land lookin snake perc hmm man right 'bron money sell bitch-ass k cock bankroll mentality boy uhyou glock break cuddo neighbor tell radio duh popeye party swine shake kam skilla lean oop talk close dip 'm floor jump limit like block night line shitty brain sick must pop slime ron hate 's drank never already hell even menace enough trippin clap opp baby loud many smoke spinach bitch business blue watch fiend nah-nah-nah bag want bring stay guard hand wed cut nah-nah-nah-nah drop leavin' trap big n't move knock cake take nigga ho wake 'bows broad;Fk It (I Dont Want You Back) by Eamon UNCERTAIN.txt
Flap Your Wings;Nelly;whoa eagle card rude eh nose skinny spread call pearl alone flaw trick leave g's front us go dread second apple sin yo say em 'll ball win heavy come yeah naw fabulous let grind panty lil time bonnie wassup judy low slow south back proceed oh good guerra attractiveness maximus get pool think real winter know one order 'head lyric pickup curve plan gon living shall nothing flap make need lose summertime next ai ghetto siegel key prove thirsty concede gluteus pharrell first see drip pause might vida set extension grey wit right girl bodyembed show also o.p.p wrong ya add soak va bling tell body indeed na party yes home talk bottom cause league like 'm motherfucker nel l floor trend thou shorty 's underneath rodeo bad i'mma 're hell could even fred naughty pant friend baby wan black waist fly want buy hand groove guarantee lee wing drop suburbs attack n't move take c'mon ho sweat;Flap Your Wings by Nelly.txt
Float On;Modest Mouse;anyway mouth fake run news say 'll win heavy come life laugh exactly worth back oh good okay get lyric fire ca dime likeembed plan drive worry lose cop float sleight scam might car land onyou also jamaican last day way learn 's work bad bit end already even thing much bring alright hand sometimes well every n't take;Float On by Modest Mouse.txt
Forthenight;Musiq;hold whenever call keep heart love us go share 'll else come life let someone give unbelievable back oh good morning lover get know pretend one neither lyric cool always less separate nothing find act tie fall lady forthenight see embed might around man matter right girl understand also though tonight cause talk 'm like way night 's work 're never even feel friend thing anyone special want comfortable well n't incredible;Forthenight by Musiq.txt
Freaks;Play-N-Skillz;ay bedroom blind light face mouth seperate counter freaky evening anyway ta cuff chick clown high late call yah krayzie none alone turn play skillz thug love go gate provide wide .. lot mack sayin point sheet 'll say dome come coke life ice tub ride let hit someone give panty yay' time hourembed later head shower swallow whole adina payin thuggin different fine smile good would puff chasin morning get think real know one freak meet fuck lyric feeling lie t-shirt ca brick please nada hot voice beat uh deal little 'dro make need kind ai long believe poppin holla weak style ohhh wait room see might around 'til cheese gettin man dough girl also great ya table jewel clothes prada rub everyday week place body na crazy freight spend nasty choose cause talk seed day like yea 'm night brain gucchi 'em hat hate moist bad platinum behind straight still bone never cristal baby wan many knee thing n world downtown playa sex want look hand guarantee big every n't move take kodak ho pass;Freaks by Play-N-Skillz.txt
Freek-A-Leek;Petey Pablo;thirty-four name face r request caller something twenty-four personal kiesha call station keep hard shawna turn pablo play front love go boom lay shady handle lip monica try lot knoll seagram 'll jon ball darhonda come coke shit daddy lick freek-a-leek pimp let b give dazzle x headboard lil time young head chair whole gin payin lisa put back anytime appreciate would good thick broad suppose get pussy know petey freak one monique curl dong 'cause lyric sabrina feature cram shamika dick hear gon yell beat step uh enjoy little scar til make foot need pillow favorite missionary buck dominique `` ding ai felicia eye check spoil roll christina yolonda embed might pretty wit toe man album right girl number also stick ya drink clothes problem shavon homeboy break trailer relax tell aight radio shout na razzle o'clock cause earing like 'm floor line anything new 's work bit forty-six hop w '' 're weed could loud enough song baby wan hey smoke cute tongue business bitch park want g-g-g-g-g-g-g-unit tonisha sniff tara well big n't another crystal teach hip take nigga;Freek-A-Leek by Petey Pablo.txt
FURB (F U Right Back);Frankee;side alone fake go share story jack yo else come throw yeah shit everybody crack care question present back admit oh would good fact get fault think real know mean 'bout fuck cryin 'cause lyric u ca uh snitch make `` f.u.r.b moan see thisembed might goin two right also somehow proud break na catch ha tellin maybe really woulda like 'm glad crab night must 's '' could feel loud song friend wan guess smokin wack bitch sex write want f 'd well every n't talkin sweat;FURB (F U Right Back) by Frankee.txt
Gal Yuh Ah Lead;TOK;deh flexx full bumpa blind yuh mi gal finesse yah side clothe class go leeeeeeeeaaaaaaaaaadddddddd skin leeeeeeeeaaaaaaaaaaddddddddembed wey juggle quick crime yo large come yeah life verse test give ... time round away ah chorus bounce worth craigy race good pound broad get har know fraud linin smooth fuck di pas fi bay-see anyman gon shape becau form stop tekin mark sentence haffi cau cost true bomb alexx first wine weh lyricsyo set might lookin likechorus waan two man girl k goooooooooooonnnnnnnneeeeeeeeee also everyday place body indeed na ....... yes last talk yard shoppin road belly hour e like line fassy likkle prime behind inna caan aircraft bun hey leff walk nut divide wid bay-c nuh watch look lead stay matta charge glass kindly nah pressure dem;Gal Yuh Ah Lead by TOK.txt
Game Over (Flip);Lil Flip;average connect fam rich thug dub street go berzerk hood half rocket mack rap em producer niggaaaaa yeah field shit flip life ice pimp let hip-hop time ah pay month globe bounce game mil get mine think know eight die 'bout dream fuck lam takin lyric sign hear hot beat deal make need act lose `` across rainy heat ai 'pac prop benz red-winer prove houston might around gettin football franchise track man change show also cock y'all clothes ready gat tell rhyme cause cube 'm like day block motherfucker way crib 's opening work lock '' cristal cream usually black top b.i.g bitch load cat much watch want look headliner stay ship flipembed charge minute drop big every n't move knock take nigga ho;Game Over (Flip) by Lil Flip.txt
Gangsta Girl;Big Tymers;booty+ full jeep grippin name weekend fix freaky hypnotiq teresa ta bird chick call keep woo fake heart cheah dub go street bill share hood sexy continue titty file +feelin say 'll ass come fast yeah jerk shorties life pullin ice fabulous pimp type spinnin ride let hit ... x time shakin casket round laneisha drama rubbin fresh pay chorus old slow openin back super lakeisha freakin oh good pound get cali makin know one freak meet rat grabbin fuck nothin takin lyric bentley raisin breast club ca bacardi gon dick squirt stop beat uh wheel o.g knowin make need tanya nail `` slim tims next ok +snake+ cop stabbin ghetto stank believe benz hustlin wanda hair air roll live stackin leavin strokin room see wait might embed lookin killer goin toe sho man calico dough girl dudes great also ya +wanksta+ drink y'all rub earthquake place fifty body upon na city kims party shake kelly grab i'ma undress catch cause choose close somebody 'm blazin like twice glad hottie sick 'em new pop mami hundred sittin drinkin 's fo brand nobody behind legendary still 'gain '' singin never rollin totin door smokin paradise hey happen smoke dro friend baby dice world sex bitch knife nut playa fly hand hurt inhale cut gangsta big every move n't smell nigga mama;Gangsta Girl by Big Tymers.txt
Gangsta Nation;Westside Connection;hoe connect face mouth hustlas dub-s-c call linnas side gang gunner hard rich run us go street hood wuuu ori-gi-nal mack c rap 'll ashanti say ball come yeah westside shit throw hoo-bangin summer motherfuckas ice square ride let b hit greenest rough conversate young kinda old whole nate back fool good game d-boy strange niggas thank get congregation pussy real nation makin know stunner spit hummer probation one dream fuck concrete 'cause lyric afraid motherfucking ca sumo g'est gon puno affiliation drive l.a. pruno liter bangin single kissin ruthless til barkin blunts buck chalkin `` su ai label supreme believe holla cuban check tired beyonce rapper bust sing industry peer see might killer lookin goin g truth insane man cigar right number also mad comin h hotter hyp-notic havoc y'all stick ya naembed hater claim tell invitation gat ohh body na evacuate andre incarcerate building g-string useless dogg crowd talk uhh countless cause really runner cube run'n'duck video 'm like consider ban-dana plane piss brain pose muthafuckin must holdin 's homie w.c. homey i'mma bombay clearin still influence 're singin '' chronic loud enough cluckas drug thing entre khaki nut bitch world sit bang flank movin park causin look uno stay servin charge cri-mi-ni-mi-nal thang gangsta suckas join muthafucking 'd big well n't nah ruckus talkin nigga fear;Gangsta Nation by Westside Connection.txt
Gasolina;Daddy Yankee;vacilar prendan rinde marquesina gusta pendiente llaman asesina de mi llena ritmo ni esquina algo le reggaeton ajore' cuentas adrenalina yo dejas mejores gatas cualquiera tanque hace ella bailas mamita sabe' es debes gasolina gata apagan un combina limusinas den bien aqui nadie carros janguea nos sus lyric los en las hasta se porque viene `` zumbale su yan-kee discrimina te janguear colore' mujeres conmigo son embed might turbinas encanta quitar pista tan preparen sale also tenemo que sombra va mambo acicala cazadore' party somos enamore menore' dame domina todos weekend'es para prende e tambore' like como tu mayore 's lo cuando llevar matadore motoras '' pierde pa da-ddy al duro escucha luce la motore' bocinas zorras esto;Gasolina by Daddy Yankee.txt
Get Back;Ludacris;bawlin dtp woman light face mouth mac spotlight jab bird keep districtembed woop flame play false brawlin run street red knack try stack story dead hook jack yo 'll 'm say ear come shit flip crack ride hit time lil shaq wassup ah head whole o-o-oh put back feather good yeek morning lane get think know acrobat one stupid fuck 'cause start lyric club yep ca hear drunk enjoy nothing little uppercut an-and weather split cap make house lose paddywhack saw homies ai heat till prove bunch ballin booty since pack see might district around family wit two man knick dough right change also ya y'all action tell speak caught na pin catch chain talk cause swung trip county day like motherfucker cape plane block music jaw way vain 'em 's bad cadillacs end wh-o-oh still brake hell shut swisha wan waist hey walk sit fly watch together want buy baggies scratch kick stand plaque drop s-s-so spitting attack pendant another n't move knock who-o-o send take c'mon wake;Get Back by Ludacris.txt
Get Low;Lil Jon;twerking something ta clean map keep owner side hard play thug front dub go balance titty twin say 'm jon ball come fast yeah shit slide question let calm panty give crunk time lil wall aye threaten fresh low fine back put oh yang good crawl b-i-itch hopin get pussy bend know one east mean stupid 'bout goddamn fuck lyric security skeet-skeet club henn' gon stop mind little scar need hahn act `` ai palm a-pop till lady damn see contestant might embed toe atl buckey twerk right also disrespect wiggle steady boy y'all drink clothes drunker touch pole na shake tonight catch cause talk sweat window like motherfucker floor line naked pop female shawty 's sock work bit hop harass yin still 're '' already dance even song clap -- friend wan baby ask dirty bitch bring want left look hand guard stand thang drop n't another move take nigga ho pass;Get Low by Lil Jon.txt
Get No Better;Cassidy;freon whoa name cuz fix icey chick keep gentleman hotel shoe love go sexy story visit swizz cruel yo thats dumb come yeah morn verse type let hit time w/ six bright later couple chorus fade put oh good would get knuckle deny think know three chedda mean math hatin dis mashonda lyric stress wifey sky ca always hear hot shape beat make need nail `` ai ok doin eye rush till chill respect lady whatever first yet son scream see embed might goin wit man self girl almost also ya sun problem party strong da undress remind dedicate beautifully arm hustle somebody 'm like shin block way storm hella thurl ridin' sunlight holdin 's elevator cassidy knockin still rock '' outfit boo telly even song bout baby hey thing cute cancel feelin world playa fly mmmm sex yacht together throwin look stay warm paper spill every n't take ho;Get No Better by Cassidy.txt
Getting Away With Murder;Papa Roach;'m like murder back beyond get possible happiness think wait create might somewhere thought truth 're never even feel confrontational lyric also master addict drink calculate sadness tell reality want look madness punishment disaster need n't crave away murderembed irrational;Getting Away With Murder by Papa Roach.txt
Gigolo;Nick Cannon;dress name blouse cuss something coat grow chick call applause keep to-day singing turn leave shoe love go us girlfriend tour moschino grown lot yo wiz ball come pick surround pimp type ever spending let hit ... unless time lil bastard six round bar fresh head booth reese vic bed gigolo weee put crow heel invisible oh bush would outta game eat amerie get kels think know beckham three one mean seem christian scare lyric bk ladi-dadi jean club phone ca secret always please gon groupie free beat uh damone lebanese make need favorite sentence `` wear town busy necklace key roof body-hotty check hypnotic hair vogue initiate first wide-body damn see seven might unblock around embed car freeze wit nick man tryna dough money show david change also dior's hotter ya clothes spin drawl tell body na thangs ms. shake wo melody chain last ha cause record visible fair 'm shin remember way like floor night brain shorty 'em new joint mami lawsuit shawty 's degree row i'mma rock '' never bone 'nother boo feel baby wan many black knee haha thing sit bus cannon park look thang drop big every another n't move ducatti nigga ho throwback wrist;Gigolo by Nick Cannon.txt
Girls Lie Too;Terri Clark;card anyway ta turn gray love go us flower come yeah care round wall head forgive old excuse shock good weigh sister get forget think bend stretch guy one seem lie wonder ca always likeembed hear drive mind make brace hang hair may wait see might pretty truth matter girl money also hotwings break mom tonight thatyou deer like hooter lyricsso sick learn comb 's baby-sit 're never cross could friend thing sweatpants much bring look size n't send golf girls sound;Girls Lie Too by Terri Clark.txt
Give A Little Bit;Goo Goo Dolls;eye long along way back smile oh sing ta get 's see bit might 're love man share feel 'cause lyric also lonely 'll tonightyou likeembed want yeah come hand life uh ride little tonight give surprise need home time 've n't send take ooh;Give A Little Bit by Goo Goo Dolls.txt
Go DJ;Lil Wayne;ay murder runnin name light nothin' throat hold aid lawless grass call flow opponent keep gentleman gang gas youngin flame pow play leave outside alone run go blade jag try rugers dead say aim 'll thats child come dome yeah coke shit begin naw stunna blunt tit let plastic mike hit time veteran young medicine present fresh mic later weezy head pay mustard mother put back authority oh hash chest good absent game residence eat niggas get hilarious know askin youre one cash residue fuck trashman 'cause lyric bentley hear hot pimpin' blastin' gon stop tommy step bent gun uh mentor dj ayy army gotti need find fame `` mannie wear birdman garment chump ai motherfuckin long rush pro roof fuckin bust lady coupe live hair ate yet first blap hustler son harmin see tha might advance snake water insane man track right dough trash money great show also mad steady sooner boy ya y'all sun homo tell foreign city model-bony diddy hall traffic though na sergeant yall wee yes choke i'ma tryna record arm carter hour like 'm spazmatic grizzy music dude brain throttle 'em fo 's homie fide bona behind '' never already binoculars bone sho' even pair shut baby shoot guess door wan sit bitch pa fly bang walk restaurant bring want djembed stay guard helmet mask wizzy cut grown-ups thong well courtesy n't move big better talkin whip phony nigga rid fre-re-re-re-fresh hiding gt;Go DJ by Lil Wayne.txt
Good Little Girls;Blue County;woman hold keep heart love wrap try waitin daddy life ever innocence pride 've ugly tonk back good womenyou lyricsshe hangin year trail ca momma likeembed broken twenty kiss little although make kind ai hardly fall savin since might lookin man girl also boy joy wild part na gold ring 'm beginnin' limit holdin vegas 's honky never dance baby wan want look hand wing well n't mighty take;Good Little Girls by Blue County.txt
Goodies;Ciara;barricade freaky beatin ta chick call broads keep baddest fruit play lem run love wrap boom handle sexy story second 'll dumb come uhembed throw yeah pick fabulous type ever dirt pin-up hit lil 've young changin nookie later capable slow callin put back good game fact get men think know petey one nothin 'cause lyric ca hot bothered drive cooky goodie basket planet uh need ai ne'er benz prove dramatic valet respect reputation ha-ha may since yet damn room see wait might around car goin truth wit gettin matter right dough girl bein tryna also mad comin show goody ya insinuate bam boy rookie tell wo home bada talk spend-it anybody bet 'm like use way slick sick 'em shorty 's independent bad 'lac oh-oh still workin 're jar boo already quite 'gain number milk baby hey ask many top tongue bring want look stay mo minute n't;Goodies by Ciara.txt
Got It Twisted;Mobb Deep;murder runnin something cuff bridge high keep death leave abercrombie thug front us snowflake .. yo 'll vacate manslaughtered heavy come yeah muthafucka shit girl-girlembed edge twisted ... promoter paranoid shiz tomorrow police wherever head liquor put outta grip pound niggas get box real know one peel swing fuck lyric club sign ca gon beef kid scoop stop mind step daughter nothing little twist scar make house d's ai cop m-o-b-b qb banger huh mobb live clash fixed p see might m.o.p. truth invest gettin right tryna girl bein show haze also wrong bullet-proof ya britney drink boy cottonmouth body na party blix shake wo double catch crash ring somebody shotty vest-es 'm like girl-girl crib dump-dump caliber pump-pump shorty 's grillin mash lock i'mma deep never shoot panel musket ask thing bitch probably blood charge trunk drop well n't better nah move queen rid talkin nigga jive dutch;Got It Twisted by Mobb Deep.txt
Gotta Go Solo;Patti LaBelle;woman takeout ta bridge keep somewhere leave love go mrs.patty theres flower lyricsronald homecooking come yeah verse isley quiet ever let exactly lever time 've nd ooh chorus ronald dinner oh soul good get troubled think know year labell 'cause u ca solo likeembed mind seal doubt need chrous mouse grant rainy ai long raindrop till patti ive sing confuse might water pretending ..... girl change show also labelle tell body remove melody surprise talk maybe really dont window day use way ron 's work end still 're never could enough song fadeyou baby friend thing nails perfect well n't mighty take;Gotta Go Solo by Patti LaBelle.txt
