title;artist;filename;lyrics
(You Want To) Make A Memory ; Bon Jovi;(You Want To) Make A Memory by Bon Jovi.txt;use good line dig ring god understand baby dont hows reach translationsportugues ill stay old memory ask lifes hear reason time photograph want always plan solve smile sip bittersweet memoryyou hello tonight write kinda could be- look kill else melody couple mind steal life piece leave whats hey sing key breathe phone tryna wine mystery laugh hair
1234 ; Feist;1234 by Feist.txt;changin cart alive apart ten eye cozy hope buy put cold little scar woo-ooh boys three teenage heart old heartyou long want five door horse youth bitterheart money nine lie breakin two sleepless six love oh-oh tear leave four back night nothing sweetheart
1973 ; James Blunt;1973 by James Blunt.txt;time song rain always clearly wish skin light guess saturday sober would call sing journey every club seem night morning though could play tune simona old strong stay memory etch
1st Time ; Yung Joc;1st Time by Yung Joc.txt;right hook sutra teeth easy secret unwind ricky dat fall push give joc chill jock sound live dirt demand bath yo rollercoaster top wash spine city john drop line expectin low button ya song pop energizer shorty nah work ooo bad goodnightembed real baby cut talk blushin way drippin climax nigga friend first new nobody twisted wrong block wo relax i- soft time dovey satin long girl yung welcome best motion mr j-o-c rock still hit mmhmm slow cousin feel body peach aftershock whisper roll sweet st south goin entertainment non-stop tummy bunny thug look slip imma remember shower love crazy sometimes m.h beware kiss mind sex sheet lovey mo seduce introduce grind rinse leave cuttin hey tempt hot daddy boy nothing keep mine watch vicky touch blow lovin tryna adore pretty day man must smell shawty ta cherry karma
2 Step ; Unk UNCERTAIN;2 Step by Unk UNCERTAIN.txt;right hook function f-r-e-a-k whole cup hoopa easy alright tongue follow ricky lean pull freak young eye ratchet turn eeeiii thizz top dumb rep pick drop thun dougie bottle shake ha bitch koopa bobby finnattic fade song fuckin pill us bad cut taste lookin sorry dont would gang nigga drunker head goodness middle t-kruger king along wrong hoova frown grab thun-nun girl skittle tomorrow sippin somebody chick step hit car ayy takin mothafucka goin sayin waitin two house scoopa fast hoola ho brake summer inc. ready remix never thun-nunembed party back moola boy face night turnt crew keep day fuck poopa shit
4 In The Morning ; Gwen Stefani;4 In The Morning by Gwen Stefani.txt;meembed right alright need give finally really last worth wake lot sun baby would till fair stay fight find time sleep want lose ever feel save complete please handin less lie morning moon remember everything love hurt tear guess pour escape four night another nothing sink safe watch dark day true change think
A Bay Bay ; Hurricane Chris;A Bay Bay by Hurricane Chris.txt;right gurl crowd yellow bar star chopper big throw lean dem freak pull dubs stand ridin turn hope limp put club white cause shot ok bright shirt shine game swing band bone low finna brown skunk diamond gold ya care song chain unpop boyfriend prolly stack light trick bad mug real baby canary patron chirpin people talk behind roof hand hire hang reach bouncin seat rollin ask holdin fire walk wrong baddest pimp saint find wassup vuitton gangsta candy burn creep stuntin trunk folk chick everybody bucking holler car rubber crunk takin hotel expedition please cash pic hunnids sweat paint park thru goin upembed j booth wen drink thug trippin dopey wat look hop followin louis show chevy holla choke hollerin groove piece dance stunt bay shoe bang mouth hot da style back key boy straight play foot drunk floor dj mixed blow tryna cuz rise man trip fell try ta think
A Broken Wing ; Jordin Sparks;A Broken Wing by Jordin Sparks.txt;sunday wing give break eye last shoot window angel little spirit bedroom carry church note flyyyyyyyyyyyyy lord find ever still wonder morning wingyou earth ground everything love crazy fly sky blowin curtain believe broken leave ought sing back breeze keep dream cry man dreams
A Different World ; Bucky Covington;A Different World by Bucky Covington.txt;right sunday cover turn disappointed pray world game satellite store pledge mother playin video bike someone would tv every three lyricswe friend lid proof seat bridge team channel start allegiance misbehave chorus time girl always kid base still car belt bear try garden paint outside drink crib water close helmet lead life different smoke worldyou hose rode school daddy bottled boy day child change
A Feelin Like That ; Gary Allan;A Feelin Like That by Gary Allan.txt;right fool coast follow act midnight eye lyricsi chase road shoot flyin thrill race world thats reef chest hard catch saw light feelin sensation lookin half way spain till thunder great felt heart head compare blue start sinsation find around bull want tangle step dive hit fallin tryin deep everywhere searchin close open breath life ah nothin vains australia thatembed barrier back thousand likeit face town seem another looin wind lightning runnin pushin anywhere
A Great Big Sled ; The Killers;A Great Big Sled by The Killers.txt;something wish big snowman christmas ten break sound live alone chase last pray little thought merry bone mother innocent chain god rack flight work bed grow roof strange brain make-up proof great red head sprinkle hear eight find around time long girl want inside kid still wonder sled tonight bell roll toy sweet hollywood peace shape tap weekend robot earth snow love street soon ho action already relearn finger never bring awake boy seem night wonderland dream mixed dress change
A Womans Love ; Alan Jackson;A Womans Love by Alan Jackson.txt;thing plead god hold kiss lose need grant love taste waste never miss resist grand woman curse face worship hat thank little felt place loveembed adore anything try understand
All For One ; High School Musical 2 Cast;All For One by High School Musical 2 Cast.txt;right even alright beach move celebrate jump finally oneembed really turn last share top good hard stop sun work real closer today way mean future every fun summertime strong rhythm start moment time join girl together want everybody rock ever past feel single roll everyone woo everywhere could begin uh-huh everything show translationsespanolall deserve e-everybody drum groove summer pas dance forever never guy miss hey party another day makin
All Good Things (Come To An End) ; Nelly Furtado;All Good Things (Come To An End) by Nelly Furtado.txt;flame dieembed fall pull young really travel drop exit good clear forget pain stop daydream rain sun reality dust stress would way friend new stay lover barking thing dandy want become wonder feel set less end die could tune dog away moon honestly hop living everything whistle sky gravity soon salvation life bark miss bring cloud restless dream cry feeling day
All My Friends Say ; Luke Bryan;All My Friends Say by Luke Bryan.txt;crowd truck fool bar star throw act clue really shoot club cause little worth good wake hard broke billfold cain hold work charlie sport hand call home friend chair raise heart start walk find around thing time girl rock kid stereo comeback sure clothes everywhere elvis remember show yeahembed crazy crank tan double smoke pour rocking party yay neon beer cry must hair
Alyssa Lies ; Jason Michael Carroll;Alyssa Lies by Jason Michael Carroll.txt;playground brush need big news monday eye cover anymore cause little tear-filled swing run lump god calm bad grow classroom today much would way every friend first felt head new jesus ask hear fear soft thing sleep girl everybody step year sweet tire alyssa lie liesembed look bruise bless mom sad prayer throat everyday room hurt tear dad exactly filled ready school anyone daddy lay face night nothing question meet day try teacher think home
Amarillo Sky ; Jason Aldean;Amarillo Sky by Jason Aldean.txt;sell round pull diesel dawn send pray worth run gold price carry grow tractor cheapest every crop grain dusty stay ask holdin underneath strong coffee lord complain across amarillo ever still family ray body please sure wearin granddad hail thermos ground dry prayer sky toll dad storm never back knee pack full plow another night lunch haze dream day child burnin
And I Am Telling You Im Not Going ; Jennifer Hudson;And I Am Telling You Im Not Going by Jennifer Hudson.txt;meembed even scream darling push im live strike yes lyricsand share wake mountain stop hold finding much way part rough blood though nobody stay free shout walk time liketear want tomorrow best mr ever without please could morning away place show kill love yell mind leave mr. river man try
Anna-Molly ; Incubus;Anna-Molly by Incubus.txt;right something attic wish need illuminate name eye loneliness put ship city good satellite mute care light de-fragmenting anna sober happiness call hang proof fate compare stay prize fire sea time girl together ever wonder please less molly could picture sail wounded others mess pas wait back cloud thousand face watch air distress meet anna-molly persist
Anonymous ; Bobby Valentino;Anonymous by Bobby Valentino.txt;even hook pay whole minute maybe fail name eye sound yes good satisfy hard bobby sunlight iikki-eh hold v bad v-bobby baby much lady hand luck kathy fact strong anonymous dime ride find time girl huh want sir uh step anne feel save timothy-timothy rush lee perfect end mary lie valentino two eh-eh look agree close everything love fast special couple mind klutch life e-eh-e-eh-eh never guy miss match bring pre-occupied back borrow another keep touch spend meet delay try ta think
Another Side Of You ; Joe Nichols;Another Side Of You by Joe Nichols.txt;heard right soccer push woman bath vacation pray world stub far chest good minivan urge honey dead bed stress sport almost ballet talk lady call tooyou four-thirty toe head ask strong coffee fight hear lord hallway thing somehow sleep five side lose smile settle car overdo roll whisper end nine listen could morning class look fuss cuss love job flirty mind enough lay lyricswhen back seem another dream cry watch day fed arm mad laugh hair
Anyway ; Martina McBride;Anyway by Martina McBride.txt;theyll right whole somethin turn chase pray world good hard forget god song someone today way anyway reach great heart walk reason lyricsyou moment always tomorrow ever away love crazy sometimes life storm believe pour yeahyou sing seem build dream blow spend choose soul think
Apologize ; Timbaland;Apologize by Timbaland.txt;woah-woah-oh need fall ten sound turn rope afraid shot angel apologize hold heaven cut sorry red heart new blue late fire woah hear around groundembed oh-woah ayy ground love oh-oh chance wait foot another nothing beat think
As If ; Sara Evans;As If by Sara Evans.txt;least something need big act send little world lonely good jean fade rain sunshine worn-out someone baby invitation way blue walk conversation around thing oooh sweet perfect wear away unless look show else love fine kiss believe never miss leave keep mine true change think
Ay Chico (Lengua Afuera) ; Pitbull;Ay Chico (Lengua Afuera) by Pitbull.txt;el even pena eres hagas bebida jump agua dribble yes agachate licky quiero yo hate thats gusta date loca lengua tickle stop ya rico ja work ahead todo la lick baby behind dont call dice climax tengas asi umm nibble late dime wo tease que girl dale fellas coollipark lil loquita mundo feel puedes please set c.l.i.m.a.x end mami bite click dog two pow pleasure ticky con look dictate show fina bother chico afuera hey mr. wait hot tu face bend nipple watch jiggle te ying cool fuck se spot yang
Ayo Technology ; 50 Cent;Ayo Technology by 50 Cent.txt;right law damn position cent maybe need move throw somethin give break club use top spotlight good mood nympho ugh shake couch low bitch info front stop pop rain work baby taste craze much talk way kitchen lust head new money-money unforgettable late start ride around thing time satin girl timbaland fantasy together want always side hell ballin sit pole hazy hit justice soak thigh roll justin tire money sweat could goddamn look counter poppin close hype thatthat show fine crazy technology special plain sheet different smoke dance jumping seduce hypnotize ready backstroking switch leave new-age split four hip style face girlembed night tick lap dough double-jointed floor watch touch phase ayo meet fuck spot daylight shawty ta think
Ba; Dont Go by Fabolous;Baby Dont Go by Fabolous.txt;damn fool jacob instead cup easy scream makeup read bet need undercover break give somethin really yes alone turn cause fought little ex good wake sister okay hard tom stick lime burner trust song spent givin option us up~ bimmer boo someone baby patron cream much rap talk dont would way mean hand brother every friend though actin next hatin hear perm ms. relax slide screw time trunk want side sittin pride lose ever climb fab watchdog try tryin sure wifey lettin learn goin oprah tex-as meanwhile house parent away look thermos doubt pot show others love cruise crazy open page already dance uhhh nothin talkin hus-by never entree mr. hot nieman go~ buzz yup back key throne ass seem pack straight play another keep dream smith may phase pool phone bay-bay t-pain day cool man think home
Bartender ; T-Pain;Bartender by T-Pain.txt;list doin wantin bar star bit somethin give break act name young last put club triple white shot little top chart bartender good okay bitch proper stop lime distance care thang shorty us feelin trick real patron baby lookin talk way mean mini-coupe every gettin hundred three fun new plus billboard free workin hear fresh ride slide brand time burn girl tomorrow side sittin somebody boogie everybody step inside rock ever still hit car feel takin tonight sure dub end none wink except goddamn empty two wednesday drink suit uh-huh keepin show love soon jockin building smoke babygirl freeway bang cutie passenger hot back key twenty-four night drunk rarely pretty t-pain cool shawty spot think
Be Good To Me ; Ashley Tisdale;Be Good To Me by Ashley Tisdale.txt;knight star need whoa break lottery point club use mil shine world shin saga good run hard drama ya catch skin win bad someone much monopoly strong ask wrong thing plan want pleaseembed somebody hit please hollywood whale tisdale mommy place look hop water love armour everyday hurt smiling believe forever ashley jassy never bringin miss prince dream cry wall day makin think
Beautiful Flower ; IndiaArie;Beautiful Flower by IndiaArie.txt;something lyricsthis coke powerful move turn cause beautiful radio world likecause good bottle shake diamond song light leader define every next head supermodel fire brilliant moment time money-maker heal girl want brilliantembed ever word feel could look darkness special mind life believe resilient sing flower valuable nothing think
Beautiful Girls ; Sean Kingston;Beautiful Girls by Sean Kingston.txt;doin damn apart move young chill eye watchin sean dirt last movie crime beautiful use suicidalembed world date good clear losin care work feelin baby declined way defined kingston first heart fight start lord time girl together mash slight suicidal haffi please sprung south park mami lie could fussin away drivin love crazy j.r. mind seein kind believe forever never guy back dark clever fell think
Beautiful Liar ; Beyonce;Beautiful Liar by Beyonce.txt;read wish follow ashamed live yes heartbreak beautiful worth ha drama pain trust blame saw suffer would shakira nobody free fight start walk wrong wo find thing time together innocence liar slow translationsespanolbeautiful desire without could liarembed everything kill answer love dancing scene hurt kiss simple steal never hey forgive tolerate play beyonce cry laugh karma
Because Of You ; Ne-Yo;Because Of You by Ne-Yo.txt;even need move thought problem good stop quit ooh-oh-oh addiction barely real baby much would way obsession every string grain next strung stay drugembed wo time fantasy want help become second feel sweet away doubt love knowin everyday oh-oh oh-oh-oh-oh-oh drug concern nothin enough never sweetest leave hey stuck true try think
Because Of You ; Reba McEntire Duet UNCERTAIN;Because Of You by Reba McEntire Duet UNCERTAIN.txt;even damn whole force lean ashamed break young eye point afraid cause far good hard forget pain trust saw much way every ooh-ooh-ooh-ooh heart middle sidewalk start hear possibly find around thing long sleep side oohembed lose smile everyone ah-ah learn misery die empty mmh everything else hurt life ah weakness never mistake anyone stray night play safe cry watch fake ooh-ooh day fell try think laugh
Bed ; J Holiday;Bed by J Holiday.txt;right alright round secret rub give eye sens turn put send wrap angel oo-oh world irreplaceable temp wake okay finna stop sunlight ya care sun holiday week heaven bed neck way till three war first raise next fact everytime workin soldier matter peak thing time sleep girl huh long five want touchin leg uh everybody rock victoria feel body tonight drift roll sweet mornin j. ay-ay-ay nine two repay starin bless close beauty love fly room cute kiss finish finger wonderful thanks ayembed back face horizon breathe dream stayin watch air touch ooh-ooh tryna spray perfume shawty change hair
Beer In Mexico ; Kenny Chesney;Beer In Mexico by Kenny Chesney.txt;right star melt maybe warm ponder lack tourist mexicoembed young rage really road thought travel sun grow way heart old stay blue free start reason best settle sit search still single marry emptiness away crossroad answer love mexico life hill waste mystery yonder town another sink many beer air day soul try wild
Before He Cheats ; Carrie Underwood;Before He Cheats by Carrie Underwood.txt;right karaoke probably carve dug maybe showing name dab shania buy shoot headlight little worth trouble dig four-wheel fruity whiskey white-trash louisville behind slash three seat next leather lucky tramp wo soup time cheat girl side polo slow save tire hole drink drive version frisky dance bathroom bleached-blonde slugger four thinking sing dollar pool-stick key combo drunk pretty ohembed think
Before Its Too Late (Sam And Mikaelas Theme) ; Goo Goo Dolls MISSING;Before Its Too Late (Sam And Mikaelas Theme) by Goo Goo Dolls MISSING.txt;exist song mikaelas doll sam theme goo miss seem late
Best Of Both Worlds ; Hannah Montana;Best Of Both Worlds by Hannah Montana.txt;star big chill really movie worldsembed radio little world premiere good famous front color guitar song mix much would way part orlando every fun friend whoever discover nobody hear time girl together best rock limo ever livin stage slow without kinda two superstar picture wow show magazine life double shoe school hot bloom autograph style shade town face play ooh-whoa small cool anywhere weird think hair
Bet On It ; Zac Efron UNCERTAIN;Bet On It by Zac Efron UNCERTAIN.txt;right instead bet need move push give type live turn shot world top game swing worth good stop blame hold work win today way mean every head heart ride find around thing want always plan everybody inside lose ever takin tryin end translationsespanolbet lie listen away place close doubt answer room life believe path talkin never guy bring mistake count face play dream gim question day recognize scary true try ta think
Better Than Me ; Hinder;Better Than Me by Hinder.txt;thisembed wish im really cold cause use wouldve good bed taste lookin much dont way cant closure note old memory start lyin find time guilt box lose mall innocence feel end lie picture kick remember beside deserve room pretend wont believe never miss face nightgown edge dressing think hair
Big Girls Dont Cry ; Fergie;Big Girls Dont Cry by Fergie.txt;perri soy star darulo big move beach solo sound stand cry- loose ridin chino republic solo- minaj shine far anything jason mother front stop bike u.s tyga brave yeeeeeyeeeah first head nicki track moment time girl car rid bear feel sweet y.- christina nine parent favorite away drive stare love sky nacho uncle dad life leave tu sooloooo cloud face angelito me- fergie fell nowhere- think home
Big Things Poppin (Do It) ; TI;Big Things Poppin (Do It) by TI.txt;notice damn rewrite ready-ready alright b maybe big throw homie put daily me-let prodigy proud radio little thats drop good record run anomaly hard famous handle stop care suppose pop catch repetitive mark reality vent carry fam today way speak mean till anyway fugazi note great art heart nobody unforgettable stay ask truth resurrect free hear start wo matter either reason thing rapper authentic somehow incredible want add hell everybody steady-steady headphone youth focus feel without write everyone respect none could begin away drive place petty show crazy stake hol life definitely escape ready remix awake back seem b.i.g foot play straight able breathe air normal legend beat tryna day recognize man trip try concious treat
Bleed It Out ; Linkin Park;Bleed It Out by Linkin Park.txt;something stomp translationsportugueslinkin throw pull atop loose italiana dirt verse trench shine far filthy line dig satisfy hard scar tight stop hundredth bleed care opera hearse cock noose work someone pin flow traduzione half mean roof hand shotgun hang every excuse string reach ignore new truth wo matter find load brand chorus candy time thing help mama word grenade roll fucking park somewhere paint deep contain lie shovel away place stare prayer show open death hurt choppy mind dance pour bring mouth lay curse back face knot floor sloppy watch outembed fuck try lock
Blue Magic ; JAY-Z;Blue Magic by JAY-Z.txt;right kilo stuff hook even bar beige bird whether beach whatever push name wrist southpaw stand live circus turn last triple crime wave imperial top game record sponsor prime run okay ugh hard bitch lot woooo hall prisoner creole pain diamond bid-ness chain reagan bidness pop blame nah g commissary work spin easily itfuck hova roc-a-fella would way partied behind unnecessary brother gettin hundred fishscale visitor nigga bread great repetition red champagne leather head twin monster stay pepsi blue bailey ringling fight history green block matter guarantee c.o around skateboard brand time rapper whip together motherfuckin become broad indict dope general bake livin still sneak word niggas contraband write cook pie roll flip money end except mill die could tap course north two picture oliver state look slip concert slice chairman breed pot jar w-h-i-p book rhyme barnum profit sky open show couple already mind iran-contra chef pisces life guess b-boy p repeat talkin waste gucci gggget vein guy hustlin never bring match magic siamese sleeve back knee boy straight hat bush treat sweater keep outfit rhymin rakim wall may pyrex spend fed rockstar wack d.a man try cherry understand shit
Boston ; Augustana;Boston by Augustana.txt;even sunset need dear name eye thought world california chain care sun light appeal carry weather behind would spain red boston new shed start hear lover essential across cross lose tire nameembed field wear begin look sunrise snow yet open fly tear summer life nice leave anyone gaze flower town cry must think
Break Em Off ; Paul Wall;Break Em Off by Paul Wall.txt;thumbtack right em coupe truck fool derek headrest minute myspace capital bet spill big senorita maneuver bumblebee warm pull ten break wrist young cover wet paper paul ridin definition playa razor berkman slabembed white send steel mackin chasin hood top game lesbian mist drop duece good attract satellite shootin lot maid button hittin gold chain quit tippin pill phantom mcgrady hold bankroll laser widescreen work bad tracy real baby taste cheetah crawlin lookin cream slab mean roof call dropper buckle choppin three fully struttin similar seat ill mindframe wheel workin parachute start walk green mack fresh panoramic mamacita nose load fan gangsta trunk stainless sharp best sippin broad ballin tooth chronicle phenomenal rock waiter continental still backbone traffic grill hit belt jeter aye buzzin leanin mornin skill money retractable student friendly clothes clean paint piss shiny park mill streetlight wavin expensive boppers breakin kush-flower papi fifth bunny kush million look snow woodgrain poppin ground swishahouse show open seal swangin crumblin pourin two-seater knockin comin loan beware berry heater already mind piece feeder finer hill mustard-green broken switch wood sunkist leave cuttin untouchable grape floatin bentley dollar ass concrete dummy oil machine ounce houston full high mink brandywine pedestrian swingset osama floor dream sloppy watch swingin wall glass tf air tryna runnin liter hotter makin ta burnin flatscreens shit
Break It Off ; Rihanna;Break It Off by Rihanna.txt;right instantaneous meh follow move spz dey push roughest dem break give chill number really admit sean paul sp de woman yo x top tek good run settin ha pain scout height ya ting immediate rihanna e givin reel gan feelin trait energy real baby nile way call bounce hopin reach great affection sho new shout start file naughty bawl time penelope long girl dancehall want tall side uh q s-k-y dere kite fi booty car sile l ayy feel body tonight try sexiness set lee sweat wha direction u fuh could riri wine breakin whan wat uh-huh hype doubt love holla cruise fly mind definitely struggle ah waste miss bring dun shoulda wit hot four da sing style back pedigree boy yoga-machuga plow pon keep dutty gah bodyembed pumba man spot makin shawty child wild gyal
Breath ; Breaking Benjamin;Breath by Breaking Benjamin.txt;right eye pray wound salt win way head heart youembed fire fight start wo find please less hole away evil realize yet open death breath soon mind kind pour leave wait hat nothing reveal sacrifice
