title;artist;filename;lyrics
Like A Ba; by Len Barry UNCERTAIN;Like A Baby by Len Barry UNCERTAIN.txt;right dictionary alive shady ago midwest nervous sound number chill tough paul road twice security top cleveland ugh feed saw bad real mile rap would mean ego rosenberg umbrella-ella-ella eulogy old stay fact shout shelf sick seven size literally fan candy rapper salute girl want everybody gunner rich without black marshall except flex dre idol fast action already clipper believe pullin brrah instrumental bitch-ass asshole mouth hailie four age cooped tryna ta feather itembed home sweatsuit even personally pen wish blackball evenin armageddon young daughter cover stand ridin surprise last ebenezer record anything scar stop shh selfie hold eminem trick weak future joke knees wouh great new forty-six usually bein around grab diss always ronny dope inside settle colson decade year please roll conference could thank dog bitter ruin look brr wedgie realize treasure kill else crazy beard comin accordin anyone brrt recovery sucker self man fuck est hesitate hi shit read pull producin yellin afraid homie shoot verse put ghost prodigy use scrooge good okay ha studio god rihanna baby sober mic call every dweeb rabbit sway diddy heart chalk head rival nursery fuckery corny oscar ugly luxury huh kamikaze food help become somebody tall actually pussy lose livin still ayy body everyone respect money tryin apology shovel treadmill thuggery devil love choke simple payin talkin bore g.o.a.t captain tweet never leave kells slim stan dungaree think mad em damn swear big interscope ten somethin type name support album movie spaghetti white shotty punch dis game drop attack couch bitch handle front grouch fuckin us nah gangster week sorry talk beefin scope motherfucker fun jimmy actin next discover hungry ask quiet acknowledge wo soft time ogs text readin mama translationsturkceespanolportuguesitalianofrancaisrap puff hello write single morning million six bully fine knowin gully zzzzt dad kim smoke bare-faced national addy back shade fifty haha face hat sweater yelawolf pushin claimin dress difference weird
Lil Red Riding Hood ; Sam The Sham;Lil Red Riding Hood by Sam The Sham.txt;even walkin think big maybe spooky eye alone sheep little hood good satisfy baaa trust hold bad someone owwooh way mean lure red heart old walk thing grandma girl want side wolf lil rid sure listen could chased baa drive suit place look close everything show love riding kind lip wood hey ought full safe keep try mad
Listen People ; Hermans Hermits;Listen People by Hermans Hermits.txt;happy time peopleyou care always somebody everybody lose sometime win people never advice part hope lyricslisten listen got heart day find love
Little Boy (In Grown Up Clothes) ; The 4 Seasons;Little Boy (In Grown Up Clothes) by The 4 Seasons.txt;girl want round tie clothesyou finger lyricslike guess maybe ever baby grow rub never try hand clothes woman boy friend wrap toe little pony head inexperience along oughta meet choose man show think understand treat
Little Darling I Need You ; Marvin Gaye;Little Darling I Need You by Marvin Gaye.txt;pay fool darling need give little lonely hard care price ooo baby mean three heart loving hoo want always inside feel two awful love hurt tear mind finger life wait willing many cry sacrifice
Little Girl ; Syndicate Of Sound;Little Girl by Syndicate Of Sound.txt;knockin girl catch want ha-ha-ha-ha-ha everybody door past bad nothin leave would hey goin little new away hide heh wo true around hehyou think
Little Latin Lupe Lu ; Mitch Ryder;Little Latin Lupe Lu by Mitch Ryder.txt;crowd right whoa allright put flyin duck ad little dig shake song baby mile lookin way speak call groovy repetition shout wah lu find around time best everybody ahhh noise etc end thru could lupe intro latin watusi lib bamma ah dance talkin ready -yeah hey high pretty day try bama
Little Man ; Sonny;Little Man by Sonny.txt;stand cold pray little world hide mature mother catch near sun lyricslittle way mean till hand believeyou stay old land along hear girl always side please sure learn place look close growin believe anyone face day man understand
Livin Above Your Head ; Jay;Livin Above Your Head by Jay.txt;something put good baby way strange though head strong start wrong thing girl lyricsseems pride inside livin still likelivin sweet headembed look kill love comin hurt believe hypnotize guy seem runnin change think
Living For You ; Sonny;Living For You by Sonny.txt;right something fool maze minute bird live turn afraid road hour exit run lot queen lyricsthe song tried ahead baby bee part call felt new start mat want inside sit ever wonder calculate without write deep pollinate could million look youyou happen summer guy wait throne flower face straight play nothing silly day cool home
Lonely Soldier ; Mike Williams UNCERTAIN;Lonely Soldier by Mike Williams UNCERTAIN.txt;dear yes vain woman sympathy voice little lonely junior hard mile people behind would call war confuse heart strong ask free fight soldier hear wo son lord explain somebody mercy smile promise sweet tire patiently die libertyyou nice leave wait daddy heavy seem many cry question must try home
Lonely Summer ; The Shades Of Blue;Lonely Summer by The Shades Of Blue.txt;wish nineteen maybe need isnt im young live dirt turn cause thought world far lonely city good fateful remembr theres stop didnt song found us hold understand dust behind dont would way lust defeat felt loving heart ill truth blue free wrong find time want always mama awaits still rmember year set field end lie could empty away await foreverembed ahh remember love yet kiss mind summer life grant believe forever waste never miss leave wait onto id sing shade night high another nothing evening lying spend belong day think home afternoon
Long Live Our Love ; The Shangri-Las;Long Live Our Love by The Shangri-Las.txt;something darling march need live send world far trouble anything lot stop god us toast people happiness childhood heart lucky fight wo lord long girl wonder please faithful likelong away fighting love happen johnny vow simple overseas wait hurray hurrah lyricswhen back night another sweetheart day home
Look At Granny Run Run ; Howard Tate;Look At Granny Run Run by Howard Tate.txt;something alright anyhow look-a greyhound little wake run fright carryin stop catch pill a-mighty baby grandpa closer behind runembed gettin serious great new middle wrong granddaddy wo son matter brand doctor want mama sit still a-nothing bus gosh faster look close everything love granny mind ah hill night almighty runnin
Look At Me Girl ; Bobby Vee;Look At Me Girl by Bobby Vee.txt;even stuff non-sense need maybe fall anytime give im really lyricsintro alone chase verse cold hate cause owe world chest honest good cost okay tense care trust deathembed gift us hold aint week asleep bond phisically baby mentally stress much dont talk till motherfucker call every friday great shit ill bridge ask everytime fight start matter around time bat girl want tomorrow best smile worry short word promise feel body presence likeoutro end lie princess two look jealous show love fine death drug mind adjust never guy purpose four dollar buzz prince youre full high straight play hoe dream cry runnin pretty fuck arm soul try think laugh
Look In My Eyes ; The Three Degrees;Look In My Eyes by The Three Degrees.txt;time goneyou want always darling mind need still eye much please set touch free look lyricslook love
Look Through Any Window ; The Hollies;Look Through Any Window by The Hollies.txt;time walkin busy pullin people way lady road byway sly heavy throughembed window shy face town movin smilin little gown look day rushin driver highway child drivin around load
Look Through My Window ; The Mamas;Look Through My Window by The Mamas.txt;rearrange hurryin admit lyricsand window shine rain dead sun someone people behind would roof proof new stay ask unkind lover find time long always still quite require sure place look love street sometimes mind leave another nothing beat meet must change
Look What Youve Done ; Pozo Seco Singers UNCERTAIN;Look What Youve Done by Pozo Seco Singers UNCERTAIN.txt;arrest damn pay probably jade star basement drop-top maybe need big move push somethin comfortable healthy support young finally really music hope neeks put hate deadly send use little world far robbin good sister anything hard aubrey hi button father pinch check god song fade us flight calm work bad cut real stress neck sorry youve almost would way talk mean signin call story mixtape kitchen painkiller romance bank hopin bounce thinkin next felt heart new youembed rome argue walk conversation son wo bullshit seventeen either thing time long girl together minor explain help uh lose sit kid boohoo worry grateful still sneak word car lecture promise without child black money operation end deep j could morning thank two house place look counter view fightin crib bless living wayne ash sad american remember love job street deserve translationsportugueslook hampton hurt loan dad summer wonderful toss life account dance memphis ready never heartbeat leave school heavy back key boy houston acting charge another lexus mine dream keep touch feeling phone pool spend nebby grammy fuck man spendin fell backyard try change smokin think home accept shit
Lookin For Love ; Ray Conniff;Lookin For Love by Ray Conniff.txt;music vain hide lyricshe near light bed fair till counterpane new discover underneath sight lover time together grateful still wonder whisper end since overhead tune away waltz look ceiling love dancing soon dance face night floor brighten dark try hurry
Lost Someone ; James Brown;Lost Someone by James Brown.txt;father bleed care gee tomorrow help star lose need sun stranger someone ten today people lyricsi weakyou weak whiz thousand great heart away million home love
Louie Louie ; The Kingsmen;Louie Louie by The Kingsmen.txt;right give alone ship little okay ya catch jamaica baby goyou constantly three sea wo long girl across sail moon love fine never leave wait hustle night louie dream rise day fuck smell arm ta think home hair
Louie Louie ; The Sandpipers UNCERTAIN;Louie Louie by The Sandpipers UNCERTAIN.txt;right give alone ship little okay ya catch jamaica baby goyou constantly three sea wo long girl across sail moon love fine never leave wait hustle night louie dream rise day fuck smell arm ta think home hair
Love (Makes Me Do Foolish Things) ; Martha;Love (Makes Me Do Foolish Things) by Martha.txt;beyond fool funny name sound foolish alone precious far ring tight hold speak heart memory hear linger thing long door sit still sweet listen knock picture softly hop love never tightyou control night keep cry phone soul
Love Bug ; Jack Jones;Love Bug by Jack Jones.txt;ordinary underrated role glad ever im people live extraordinary hardly guide play world new many treasure stay pleasure youyou overrated muddle beside love
Love Is A Hurtin Thing ; Lou Rawls;Love Is A Hurtin Thing by Lou Rawls.txt;right tit tier fervency outta custer anymore auror conservancy wingle fervently absorbent sie world hide hoembed spit uncertainty bored christoph rawls pop informant war-torn bad real flow much dont mean roar though twin old stay torment wiggle walk theyre undercurrent girl kringle apple tomorrow want best add past fucker sweet scoreboard piss waitin seed waltz warrant stream gestapo explore biblical quick life susteren sense legend smell ta vajazzle list even something lou guapo give kris stand last forewarn cause thats buck record shake forget stop ball extend greg ladys fearless foreign allow soar whore lady jingle great fishy ill gore plus blue lifetime blade around shore hume welcome ive courtsy worthless werden door sit that-thats core galore please sure since urgency could sophomore look remember show death near-miss ready period bring slut straight kimmy nothing mingle normandy horny insurance mirthlessly fuck hi shit ketchup ignorant star lingo reich tip whether beach inerrancy rebel manipulation im turn hitler shoot put demon germany good lowborn attract divergency nazi aint bond cut flash dick today people call every note ignore wizened land aw greta buster lord concurrently general dual-wield solve pussy lore everwood still ever hurtin everyone thousand-year fucking money insurgency evil devil pringles love furtively ho sake important forlorn bingo storm chance never leave gibbler nipple upper wizarding hoe floor senior fake cryptocurrency damn whole swear muster move fall name skilled got mustve currently abhorrent dearless throwing mental bitch pain cheese swore ken corridor orator leader speak tearless happiness mordor cant war shampoo hear brit matter thing deer torrent wizard rock peerless berlanti tingle write sioux single van overboard listen dry super onshore emergency health pour mustard layin dormant ringo gaslight back youre hoard keep floorboard touch day massacre anti-social
Love Is All We Need ; Mel Carter;Love Is All We Need by Mel Carter.txt;right need move give break downembed wet good thang work real baby way hand giv time girl want inside ever slow glow feel eys sweat seditious look agree love fine sky never hot high keep touch pretty hmmmm try
Love Is Like An Itching In My Heart ; The Supremes;Love Is Like An Itching In My Heart by The Supremes.txt;beyond bug need apart bit live turn cause far thirsty correction shake stop lyricsthe pill hold wire real baby grow sensation nagging situation mean sigh heart ill fire bugyou burn whoo help itching yearn infection imagination mama oooh rock complication desire scratch irritation bite morning drink fill love tear toss burning daddy information a-reeling keep cry feeling
Love Is Me Love Is You ; Connie Francis;Love Is Me Love Is You by Connie Francis.txt;thing yet together everybody wonderful news still warm forget baby pass people never way everyone rumour sing gimmick else notion great nobody mine lyricscome blue free hem start habit true fine try find think love
Love Letters ; Elvis Presley;Love Letters by Elvis Presley.txt;right sign us kiss darling near read apart memorize name write alone every night straight heart keep line start heartyou letter love
Love Makes The World Go Round ; Deon Jackson;Love Makes The World Go Round by Deon Jackson.txt;lyricsyou thing bobby sherry girl important marsha tall round seesaw star everybody need spring baby grow feel without would child tree sweet sing boy flower twinkling could world cry watch fact good true billy prove birdie love fine
Love Me With All Of Your Heart ; The Bachelors;Love Me With All Of Your Heart by The Bachelors.txt;moment want always kiss near summer fall apart give promise lyricslove winter hour every heart far beat start heartyou love
Love Takes A Long Time Growing ; Deon Jackson UNCERTAIN;Love Takes A Long Time Growing by Deon Jackson UNCERTAIN.txt;maybe break name live alone human music road themembed freedom hate cause daily game good hard forget us hold grow laughter today men hand call future obey are- fire fight along wrong time shame long chilrdren want large inside kid ohter search past climb gamble learn combat listen could parent honor away rule love crazy fly lead mind passion life forbidden dance ready never leave play breathe safe day child lock home
Loves Made A Fool Of You ; Bobby Fuller Four;Loves Made A Fool Of You by Bobby Fuller Four.txt;lyricsyou right time fast crazy care fool want feelin baby feel make-a men last night blind a-passing cry blue good youyou has-a anything sad love-a try find think love treat
Loving You Is Sweeter Than Ever ; Four Tops;Loving You Is Sweeter Than Ever by Four Tops.txt;instead glad need lyricsi live really yes reassure pray share world truly lonely thankful satisfy within grow much part every felt heart discover strong sweeter find around girl best lose ever sweet since could two away remember love yet life hasembed never night build meeting meet day true try
Lulla; Of Love by The Poppies;Lullaby Of Love by The Poppies.txt;stove ago gutter thirst ladder chili sound midnight really tough music chase supportive confrontation tenderloin quickly urn x voice share janis swing area check video hyde saw pleasant kozelek cabinet pass would mean kitchen goodbye though cigar butch safely felt old stay late along walk rehearsal memorial girl explain want rehearse matt climb mayor attendance fucker cook black sweet clean piss except begin entourage bouquet tl living microphone room grant correct dance resident return several hot beer cowboy pepper home wallet law something unexplainable character give young familiar point last storage fishbone band mood clinton bone entertain shake forget joint thanksgiving stop sparse dillon work budge flutter heat turkey clown inch affection hostile red san fear around reason join holy sleep always tomb leftover seriously bear year poppy sure could outside tap unless look echo stare remember show kill street deserve yet protectiveness joplin steal pharmaceutical often ramon toilet ready hunger guy onto seem another insatiable play many may grandmother pretty small cool fuck man try space george shit least star tip drugstore need follow wet turn hope buy put joy planet beautiful use little sunny good th encounter spirit studio pizza someone person cut people almost way part amp roof call every hum alley nail head handful heart nathan memory earn main directly somebody box smile lullaby ever angry everyone respect uplift fucking end funky moon towards chamber ash love strangle cat couple lead piece exactly experience kind chance never leave lay remove key agile foot floor ox backstage think equipto happy damn drumstick name cozy sickle singing franciscos machete mother lot pigeon dilaudid us mark sorry group story liston friend serious chair first next ask thing time burn relentless long hell rock plate car bum monk charm everywhere threaten die listen house granite favorite grail fill pot hug crank mess understood range tape smoke wood bathroom back caroline face keep watch wall day laugh
Magic Town ; The Vogues;Magic Town by The Vogues.txt;big give live last cold beautiful send lyricsthey good gold fade pave light hang gray nobody sidewalk sight dime find time girl rich die could street bother room life repeat blinkin bring magic concrete town night neon dirty dream true try ta
Make Me Belong To You ; Barbara Lewis;Make Me Belong To You by Barbara Lewis.txt;open lyricsdarlin whatever baby string darlin heart puppet power youyou belong anything beggar queen
Make The World Go Away ; Eddy Arnold;Make The World Go Away by Eddy Arnold.txt;thing hurt shoulder astray sorry forgive awayyou use world away day remember love
Mama ; BJ Thomas;Mama by BJ Thomas.txt;result tie isle need big teach give young eye whem alone cause little hold shoulder saw someone mean future friend first old walk time graduation mama inside smile tire obligation leauge away show love bride plead tear whos introduce shoe dedication lyricswho patch cry mamayou meet try home
Mame ; Bobby Darin;Mame by Bobby Darin.txt;lyricsyou right mameyou mint whole alive easy special corn groove us plantation blossom give name sensational feel inspirational bring yes fascinational tree charm julep mention hum south back revive mame since dixie strum tune cotton dixieland magnolia coax pick old blue plunk drive beat horn husk band kick banjo think
Mame ; Herb Alpert;Mame by Herb Alpert.txt;right mint whole alive conquer easy cake-walk rebel blossom give name sensational tree dixie pick weepin band manner speech willow banjo sill mameyou corn us skin saw manhattan black-eyed revive pea ritz fare cotton inspirational old blue sweeter lyricsyou satin smile feel peach charm fascination mention south since plunkin tune magnolia absolutely drive husk kick georgia grit special plantation never bring julep style back mame seem nothing dixieland coax may beat horn prove think
Mame ; Louis Armstrong;Mame by Louis Armstrong.txt;lyricsyou right mameyou whole special corn yea plantation blossom strummin name sensational feel bring live yes tree charm fascination mention back mame plunkin hummin since dixie tune dixieland world coax magnolia inspirational swing old blue beat horn husk band king satchmo louis prove banjo think
Marble Breaks And Iron Bends ; Drafi;Marble Breaks And Iron Bends by Drafi.txt;remorseless fortune train mangle bleeds woe kindred detest sustain vulgar dear pent sinking dy blot fierce eye chill lengthen live strike wretch vain compassion woman crime thee western freedom diffuse sorrow voice fling wave sympathy proud share scorn world delight far forego cadence urge spurn mute check boon distance care eloquence annual dare renew dead claim near frenzy pleasant energy repose pass livid numbing emulate common wide would length wayward horror reeking far-divided flee mitigate stifled appal annals endure raise twin consent rescue consecrate late along ala sea habit form stain tempests severe lambent trade want pure add mercy azure terrific honour past rich ocean ray guardian feel dash despair dwell sweet hemisphere contagion draw cherish aim shape endear tint hail speculates state mingled stream strain explore anguish sky tear mind soil passion life fleeting fleet climes slave-trade bound cloud night breeze flag heed fury convulsive lightning heighten cast rise belong object home law something contraction pay cave cup toil powerful cure glad round asylum ennoble ice isle frost stretch untrod maintain wakeful discern oppression act give inspire heap cheerful protect tempest stand point troubled alone terror decree vegetation last creation unmoved thy hate cause destruction shine gay half-form scourge wake band unlike souls glance poetry shake madly interest slay seize divine chain lyricsthe fiercely catch gift wound crooked work avarice morn grow yield prudent sigh weak arise knew keener lovely stoop fram affection blood great art new whose vale blue free insult condemn breast rapture bind shore extract moment alike heal selfish england nerve proportion prevails charg diminish spark marble lustre traffic bear glow bestow essence deed resist roll rush tire perfect contain howling deep lie ear bitter tale design ruin earth echo look fatal britain poverty pang valour others yet weigh death soon region savage fetter reign finish guess cultur ye wealth finer partial waste bring ease thick domestic gloomy accumulate magic bid consum knee gloom flower control soothe dome seem another limb play sink harden muse dream grave courage may power scale lov cool self man hotter arm true child change gust space stamp try risk flame poor force hallow afric secret read iron deem recedes whether barter beach whatever throw lavish commerce atone senate hour ardent hope fix joy race upbraid gasp enlarge prevail clear dire blast polish desperation visual spirit drama rapid god thine sultry light unsunn scarce helpless abhor coop flash vessel decide almost way part drest suffocate impious roof call pity unseen every foul nobler sway head heart labour dreg land altar shed wrong green desolate sight tainted british useful borne fancy surge beam lose smile spring illume ever still base devote trembling impression nigh grasp untir spare glorious skill half-expiring ruffled ample wear course bower drear kindle danger galling fruit agony hop presumptuous ground elude span captive love mild lead fond storm ah kind juice languid lip path chance bore hill extreme never goal groan regulate hopeless leave bloom lay cheer fruitless bosom realm infant breathe wind substance value hue must lock think sell happy sterile yon excess knife calamity gild unconquered maze meteor madness deck spectre ruthless purple wing half-worn teach warm offence break foe interpos rage possessor human demand universe merchandize native owe steel nymph stedfast feast narrow drop honest straw unremitted hard victim magnet mother pain grace reproach gold polar bleed price furious insatiate roves rag shriek flight surround mark sun sickness pin blasted gleam chalice centre bill clos cruelty baleful scope hand hang greatly unequal throb first possest vast gladness delicious ask ravag truth produce humanity link guilty -- sailor fresh rest find load imprest soft agonize plank burn relentless long creep torrent robb large lamb sordid former reflect shackled calculate feeble fee desire stab frame sever charm require affliction die morning strand direct sweep sharpen distinction pleasure million view fabric water lunar thus fill retain ceas dart lofty fly nature breath scene swell summer spread soften pour hollow glade gain doom purpose shall blessing beneath landscape refin sacred awhile shade stray bliss noble high air wall dark trace touch virtue europe dress day meet soul globe blest deform wild darken
Mas Que Nada ; Sergio Mendes;Mas Que Nada by Sergio Mendes.txt;right mendes samba raio oaria rhymes-a move bada eye bobbie kind-a eu yes massage de yo put daily wave piano radio pick drop veio motivation baaa tight velho check stop ya lab song magnification boundary e mix robbie work eyed bubblin la misto way nada heat every pea mas times-a old team station este wo fresh rest starter ride que thing mind-a penetrate cross passar rock rotation lil feel body esta black maracatu armor poi sauna operation funky monkey animado movin sambar preto hop minha occupation rhythmically beamer piper crazy magnify everyday peter oba sergio bay never quero several business hot frente tu da heavy party hip blastin relation play tab hot-ter keep lava remixed day daylight hotter sai ta pepper
