title;artist;filename;lyrics
Shes Got A Way ; Billy Joel;Shes Got A Way by Billy Joel.txt;heal find surround smile feelin light love sound without feel talk live lift way please turn show inspires anyway shes everywhere woo anywayembed around keep dream touch million walk anywhere strength reveal reason lyrics laugh
Shes Tight ; Cheap Trick;Shes Tight by Cheap Trick.txt;right something train tongue tip pull give young number alone turn window videoembed thought radio upstairs ring tight hall vision ahead light talk way speak call first fantasize head memory amnesia start time sign girl door busy write could answer open action smoke kind talented nice ready float lyricswhen key shes shade high lane dream wall excite phone try home
Shine On ; George Duke;Shine On by George Duke.txt;right onembed bout move eye finally really overtime openness cause send shine attract ya sun feelin lyricsshine baby way lady mean dreamin every lovely fun heart discover aw workin lover wo find message thing time sign girl want somebody inside smile ever word feel body mornin tryin woo away drive foxy show love soon special comin strongly mind hey straight touch blow pretty true try think
Shock The Monkey ; Peter Gabriel;Shock The Monkey by Peter Gabriel.txt;something darling news throw break cover tree anymore turn lifeembed run shake translationsdeutschshock much shock ape pearl swine fire wheel thing sleep please sure learn monkey blind knock ground stake hurt guess life burning hey beneath knee rat keep breathe watch must fox
Shoot For The Moon ; Poco;Shoot For The Moon by Poco.txt;blink somehow seal together kiss throw chance eye lyricsi miss way set shoot back aim wink distand night moonyou darlin far dream moon away hear sight true remember
Should I Do It ; The Pointer Sisters;Should I Do It by The Pointer Sisters.txt;right flame maybe fall give name really anymore turn far lonely ring tight swore hold light today would swallow call anyway old hear walk time help pride car feel tonight could telephone away drive uh-huh everything love fine crazy hurt play
Should I Stay Or Should I Go ; The Clash;Should I Stay Or Should I Go by The Clash.txt;happy even el enfrio ser decir darling bugging haber esperda yo tengo peligro trouble voy ya suppose hola doble ir next fit stay frio free por digame tease que time si want always quedo sabes ojos soplo indecision librarme esta molesta black ropa los set clothes end debo lo fine tienes exactly double quedra va split quieres back knee quedarme serum mine rrattarrattattaa blow day cool ta
Since Youre Gone ; The Cars;Since Youre Gone by The Cars.txt;tense mess likesince stumble help treacherous guess big fall apart throw peak sensation moonlight feel never miss thrownin strange perfect throwin gettin since shade vacation youre sedate night nothing great tenderness sense away good start makin lyricssince forgettin everything
Sing A Simple Song ; West Street Mob;Sing A Simple Song by West Street Mob.txt;right walkin joey hour last little good trouble hard ya song givin hold baby grow pass do-re-mi-fa-sol-la-ti-do people talk every ups old hear frown thing time sleep girl together everybody smile livin feel hah sweet smilin la-dee-da-do love street fast happen simple life ah talkin bring onto sing keep likelet beat try
Situation ; Yaz;Situation by Yaz.txt;right move eye sound stand hour pick shake scar baby situation brother every blue wo lover around time somehow long nation feel without doubt remember mess bring control doorway outembed power dress
Sleepwalk ; Larry Carlton UNCERTAIN;Sleepwalk by Larry Carlton UNCERTAIN.txt;wantin eat conquer stumble fame need maybe poet pumped-up conkin somethin give cover lottery kooky loose music alone turn chump thaiportuguesitalianofrancaisthe haystack shoot nut killin voice balloon use sheep thought straightjacket ironic straw okay losin stop seize gold ooh-wee fuckin vision receive bruce spinrumpelstiltskin real bed much way abuse great call every excuse gettin kool hundred ego friend translationsturkce amongst conflict blood confuse ocd head shit tool nobody monster interventionist fact regular holdin payback along walk track mc steam ponderin moment thing sleep want phasa tomorrow whoo somebody attention actually inside beginnin lose kid messenger still newsweek hit wonder feel bittersweet save fallin coo-coo tryin lee keith civilian wilson vanvonderen friends ink cake goin winnin used could choosey two dre million huge inflate beggar kill love crazy breath sometimes drum comin russell wander mind guess struggle draft wanderin nothin yodel-odel-ay-hee-hoo never intervene squander leave onto spawn yonder relate back face mink yoo-ooh relayin straight public jeff play keep blow ooh-ooh day leaf weird child think home shrink spill
So Fine ; The Oak Ridge Boys;So Fine by The Oak Ridge Boys.txt;woh-oh time doggone rain so-woh-woh baby chill cold thrill send shine spine fineyou lyricsso love fine
So Much In Love ; Timothy B Schmit;So Much In Love by Timothy B Schmit.txt;together vow star hold darling aisle need stroll lyricsas much alone wait hand twinkle else high die iyou world two touch along walk sea love
Somebodys Ba; by Jackson Browne;Somebodys Baby by Jackson Browne.txt;right probably shut corner eye outta stand cause shine fright light baby talk friend nobody hear walk sight around sign girl somebody car tonightembed a-look tonight streetlight else fine comin ah talkin guy back town mine must try ta think
Someday Someway ; Marshall Crenshaw;Someday Someway by Marshall Crenshaw.txt;right whole want someway someday need maybe life love whoa wonder bear give stand bring really way aww back cry hear sad everything awww understand
Someone Could Lose A Heart Tonight ; Eddie Rabbitt;Someone Could Lose A Heart Tonight by Eddie Rabbitt.txt;right something follow fall condition eye likewith heartembed run lyricsthere stop someone baby lookin much mean shadow heart spell lose kissin feel fallin tonight everywhere could movin paradise moon place love crazy hypnotize leave heavy full air touch
Somewhere Down The Road ; Barry Manilow;Somewhere Down The Road by Barry Manilow.txt;meembed right maybe distant really road cause shin us would way call lyricswe goodbye heart stay wrong matter find shore time long together always best cross inside still somewhere begin away love yet sometimes likebut guess believe forever back another dream belong think home understand
Soup For One ; Chic;Soup For One by Chic.txt;right girl rest want darling soup love someone moonlight feel eye alone homeembed minus night evening empty mine stay look run depressed must home else bathe
Southern Cross ; Crosby Stills;Southern Cross by Crosby Stills.txt;silver bar easy following tie big fall fail eighty name midnight yes music twice voice use ship world run nicely forget spirit downhill survive avalon chain anchor coming heaven noisy way waterline call reach first endure head test truth along sea southern around thing time cheat trade tomorrow large best somebody cross promise lie outside sail away a-dying look a-flying realize love fine marquesas never bring leave papeete crossembed town boat foot flag many woman-girl island dream watch wind day small try think understand
Southern Pacific ; Neil Young  Crazy Horse;Southern Pacific by Neil Young  Crazy Horse.txt;silver company right pension round diesel mighty young coastline turn put tunnel decline rail driver sixty-five tide conductor moonlight highball would though policy fire southern ride time long past angry roll whine could jones brake mountainside railembed giant leave mr. bend another man daylight pacific ta
Space Age Love Song ; A Flock Of Seagulls;Space Age Love Song by A Flock Of Seagulls.txt;space song mind saw smile fall eye age little though cry touch loveembed love
Spirits In The Material World ; The Police;Spirits In The Material World by The Police.txt;subjugate spirit something constitution solution evolution bloody revolution meek rhetoric so-called word live leader answer troubled speak way buy political failure lie worldembed another world jail faith material day must try
Stand Or Fall ; The Fixx;Stand Or Fall by The Fixx.txt;exaltation trodden fall conscience daughter stand forgotten line bottom scar survive rotten likean lyricsthe relies dead us foreign talk red existence blue son ugly screw rock reflect nation hit exclaim tonight euro peace population ember die empty parent state morale extinction affair destiny proclaim divide persistence fallembed theatre desecrate face nothing cry value difference child
Standing On The Top-Part 1 ; The Temptations;Standing On The Top-Part 1 by The Temptations.txt;even yi-yi freak name sound lyricsyi-yi stand really funk congratulate yi-yi-yi top square buck low understand standing people way part friend great chat likewhen stay ask long want temptation fancy lose sit agent everyone money somewhere woo superstar place /single manager stare rip love l- street crazy else version loan lend talkin never hey sing chit nothing question meet man braid hair
Stars on 45 III ; Stars On;Stars on 45 III by Stars On.txt;twist wanted photo special star office near mind work lyricsoh-ho-ho-ho whoa still hit volume reply please turn hang woman every bulletin oh-ho-ho-ho war information iii keep baker fbi wall station shout remember police post contact
Start It All Over ; McGuffey Lane UNCERTAIN;Start It All Over by McGuffey Lane UNCERTAIN.txt;swear maybe total whatever eye likeso thats far hard forget surrender againembed beggin someone baby sorry way mean truth start find girl want somebody lose ever lyricswhy tryin lie could look ahh remember everything tear kiss mind never thinking forgive seem think
Start Me Up ; The Rolling Stones;Start Me Up by The Rolling Stones.txt;rider give eye top run dilate stop dead grown rev mean hand heat rough cum cumembed start walk green starter ride slide whoo greasy gasoline place kick love speed spread double ah lip never hey hot oil machine tick smooth cry wind blow compete day man
State Of Independence ; Donna Summer;State Of Independence by Donna Summer.txt;silver flame yeah-e-yay alive abound shablimidi name sound live yes independence temple freedom shot world game tibet survive third caribee meditative today shablamida call signal heart truth land hear oroladian lyricsstate indonese time holy wisdom likemoving yeah-e-yo word beembed essence body please state water love sky nature shablamidi life guess believe lip shablamid bring hey shall magic siamese high treat derive may touch meet day soul yeah-e-yeah home
Steal The Night ; Stevie Woods;Steal The Night by Stevie Woods.txt;something read eye lyricsi alone last verse precious catch clearly within closing great first heart bridge late fire start wo chorus message time past feel deep listen away slip rhyme love mind steal repeat escape waste hunger hey night
Steppin Out ; Joe Jackson;Steppin Out by Joe Jackson.txt;alive yellow follow young eye turn babe window radio shine mist hide line color steppin light behind lightembed old blue find time across side smile word wonder car angry tonight tire drive look darkness dry electricity fine life taxi leave night pink nothing t.v dress child
Steppin Out ; Kool;Steppin Out by Kool.txt;thing least steppin special alright us find work smile move comfort dance baby likeeveryday feel tonight bring way please paint town face night smooth outembed blue adore lyricssteppin anything hard love
Still In Saigon ; The Charlie Daniels Band;Still In Saigon by The Charlie Daniels Band.txt;thirteen damn jungle cure ago minute ashamed ten vietnam break young sound cover stand alone afraid vet month last pray world run check rain catch dead bad someone insane behind differently brother call every war next head stay hear walk sick time long everybody door search past still feel year sure sweat killer could mindembed place snow wounded rule ground else fifteen sky saigon eyes mind summer kneel different plane forever bring school daddy curse mingle cry silence day canada smell home
Still In The Game ; Steve Winwood;Still In The Game by Steve Winwood.txt;move fall stand ticket music alone hope lonelyembed world game lonely hard likehere care song player hold light till reach though heart land hear walk lover ride find reason time sign long want side lose search still aim morning sky fly sometimes gambler mind ready never match leave haunt silent night lyricshere keep watch rise try
Still They Ride ; Journey;Still They Ride by Journey.txt;street ride time nightembed round lead light chasing still traffic spin rid slow name jesse leave chase carousel town thunder night nobody keep old restless strong spell fire woah wheel rule hard around main change wild survive
Stone Cold ; Rainbow;Stone Cold by Rainbow.txt;spellembed right stone ice fall stranger distant break eye sound familiar put cold far hide run fade leavin baby thief old spell sight wrong inside likestone search word feel without deep lie empty away lyricsevery frozen darkness ground everything love escape leave freeze night another nothing many dream silence searching dark try change think
Stray Cat Strut ; Stray Cats;Stray Cat Strut by Stray Cats.txt;right pay wish carefree fence chase strut broke care thrown howlin real feline moonlight lookin lady mean dinner alley casanova old blue fight around rent sittin cross black could class tail bother cat summer singin path shoe mouse enough slink guy hey hot style flat stray night garbage orange dough meow cry air man styleembed wild
Street Corner ; Ashford;Street Corner by Ashford.txt;right stuff big corner really turn worldembed little pick cost satisfy stop ya bag bad real baby grow neck sugar lookin hand rough avenue dime wo ride find around girl want best lose ever nickel fee feel woo everywhere waitin pleasure love street life ah kind guy leave anywhere man try think
Summer Nights ; Survivor;Summer Nights by Survivor.txt;right beyond fall young turn last cold wave race dancin shoreline buildin run september sand innocent playin diamond castle tide light moonlight dreamin fingertip fun driftin rough shore time thing plan always oooh livin ever could lyricsgirl remember love fast summer repeat enough back night seem
Super Freak (Part I) ; Rick James;Super Freak (Part I) by Rick James.txt;em rick alive b marvin mar bit james im c yes turn gaye surprise put l-o-v-e-r x funk little top pee ze grindin mood mountain line bottom survive brown father ya god brown~ g incent work light beggin lick dick freaky dont way oh~ brain tate king lu wrong lover ride time whip long apple together grounding scenario zen deaky uh candle smile rock delilah flexa body roll perfect bumpin t-i-g-e-r woo could dot two superstar hippopotumus airrrr moon drive doo wop love super ba connect mind life hoop hula mo talkin juction wait wit thick back t.i.g.e.r nothing pushin feeling venus soul smell spot hike
Sweet Dreams ; Air Supply;Sweet Dreams by Air Supply.txt;right lyricsthis glad need whoa deny give eye live likeclose share near someone much half way till friend rest ride thing time moment sleep want always word dreamsembed tonight write roll sweet deep could look close love sky kiss forward life wait thinking night many keep dream spend day fell dreams letter child think home
Sweet Time ; REO Speedwagon;Sweet Time by REO Speedwagon.txt;time steady awaken want easy explain hold risin find feelin timeyou love visibly bit baby ready fallin never behind surprising sweet lyricswhen waitin temperature could mine holdin touch spend shake pain
Tainted Love ; Soft Cell;Tainted Love by Soft Cell.txt;right need give stand really turn ran pray share taint nearly nowhere loveembed run tight pain hold light someone baby sorry way though heart tainted tease thing sleep want lose feel please could away drive love sometimes hurt tear toss boy seem night pack touch think
Take It Away ; Paul McCartney;Take It Away by Paul McCartney.txt;bar corner paper road hour radio lonely band driver impresario ya fade light carry mile till hand hundred seat wade stay late hear around load message want complete hah audience doen listen away show jar else important survivor ah switch never flower play evening watch may darkened sole
Take It Easy On Me ; Little River Band;Take It Easy On Me by Little River Band.txt;meembed crowd easy need whatever cover road use care minstrel song baby friend hear lover time long want lose still without end loud wander chance leave sing liketake back night lyricsit cry day think
Take Me Down ; Alabama;Take Me Down by Alabama.txt;flame alright maybe move warm eye live turn put share bright flight hold light ecstasy baby part mean hand every heart loving nobody emotion stay strong free fire around time burn long together want inside glow feel tonight set could away close everything love else fly one-way forever night another keep man arm understand
Take My Heart (You Can Have It If You Want It) ; Kool;Take My Heart (You Can Have It If You Want It) by Kool.txt;right something least alright darling likei move apart bit anytime give wife really lyricshas little good appreciate satisfaction someone real baby hand pleasing heart loving ask offer guarantee matter find time sleep girl want oooh ever ahhh feel please listen place love moan tear mind nice waste night dream pretty day
Take Off ; Bob;Take Off by Bob.txt;case right idea um wish maybe push ten memorize solo bob hosehead music hope coo dayembed album put white expert hosers angel toque photographer singing jeez buck good record band okay anything coattail section lot stop ya us bad professional real today sorry people talk way brother call luck great aw doug topic wo time long welcome hoser lawyer together uh everybody sit headphone ever short eh hit rid slow loo fault single everyone rush lee sure mckenzie field sweat wear lie except listen could thank north picture pleasure look agree everything beauty fine fast drum geddy mind guess sheet ah believe sort nice success decent guy hey thanks magic sing back another lying dj label pretty day prove hi
Take The L ; The Motels;Take The L by The Motels.txt;tough music lyricswatching cue x far good anything forget fade hold grow would hand every head stay longer lover thing time always l ciggarette could intention away drink place view kill tear waste enough never miss liketake face evening watch belong meet change
Take The Time ; Michael Stanley Band UNCERTAIN;Take The Time by Michael Stanley Band UNCERTAIN.txt;law something fortune ci need trial fall give break eye che sens tough turn demand hope disquiet clearness voice wave share world anxious pick square clear spirit catch within craft wasted la real carry much bead way obsession sigh fair hand heat cope unbroken weight suppression new drown fight hear di wo fear find around time pensive still promise feel save year os end learn lie blind away place re-evaluate water close answer love vedo fashion breath ho assuring wander mind destroy piece life piu waste freely mistake perso relief back vista another decision obscure rise day man must change think
Talk Talk ; Talk Talk;Talk Talk by Talk Talk.txt;bleed crisis walkin solution rain stone dead extend miracle sit work wayembed brave body without talk dont lift way wait hand accumulate talktalk cake adorable thought faith jesus problem deliberate fuck try prayer
Teach Me Tonight ; Al Jarreau;Teach Me Tonight by Al Jarreau.txt;right star b z likei teach c stand x use clear lot near almost shooting blackboard start fear thing time across help graduation solve lose tonightembed teacher tonight write perfect learn since love sky lyricsdid thousand high spot try mystery think
Tell Me Tomorrow - Part I ; Smokey Robinson;Tell Me Tomorrow - Part I by Smokey Robinson.txt;right whoo-whoo-whoo alright secret need yes little tight spoil hold someone baby thinkin wo thing want tomorrow inside feel tonight prefer mineembed please waitin love mmm tighter fine mind forevermore never leave night keep mine true
That Girl ; Stevie Wonder;That Girl by Stevie Wonder.txt;need apart joy cause use clear run hold smart bad much would hand weak every heart rescue strong ask free start hear lover wo time long girl want inside emotional word body single please deep listen realize doubt sad love fine soon room hurt tear mind torn leave flat girlembed play upper keep cry man soul true change think understand
The Beatles Movie Medley ; The Beatles;The Beatles Movie Medley by The Beatles.txt;realise right easy alright need mad lyricsroll tour ticket last movie sung game oho california hide medley hard grass care work ahaha today people ohohoho way ask hear tucson ride find thing sleep girl likehey step feel jo-jo roll learn everywhere could dog beatles away drive loner stare sad love happen log kiss arizona magical never leave hey wait sing back night play nothing mine day man mystery think home laugh
The Clapping Song ; Pia Zadora;The Clapping Song by Pia Zadora.txt;right break ann tobacco buy likeclap put little leff row line drank materialize song aunty pat three-six-nine partner heaven would goody hand goose three left fun palm soldier wo clap cross mama car chew lyricsthree rubber dolly thigh nine monkey six goodyembed street choke prepare kiss sing back boat slap watch clapping arm wine
The Elvis Medley ; Elvis Presley;The Elvis Medley by Elvis Presley.txt;happy right glad lyricshey beach sound turn momma last bright little pick medley dig shake barefoot clambake v work light spin baby bongo hand hangin appetite reach first heart free tease find grab want everybody clamembed lif listen outside squeeze moon look hug love life hey clam town night foot feeling beat gather choose
The Gigolo ; OBryan;The Gigolo by OBryan.txt;follow likei move freak eye stand really admit alone surprise little lyricshe bed baby would nobody stay walk wo time gigolo flaming want everybody body could look beside love soon room dance waste leave party touch phone man must think home understand
The Girl Is Mine ; Michael Jackson;The Girl Is Mine by Michael Jackson.txt;right sending endlessly m-m-m really paul hope proud share okay ha doggone way every heart discover michael fight start walk hear lover time girl rose ever eh fighter feel since could remember love special mind believe forever waste yep town night another build keep mine dream silly blow meet day anywhere think understand
