title;artist;filename;lyrics
$ave Dat Money ; Lil Dicky;$ave Dat Money by Lil Dicky.txt;doin company b cheeseburger really world refillin kike quarter anyways check ya care v saw bed iced rap would mean cali though preacher raise rollin compare along hallway fan whatchu yung want side caution waiter l differentiator without takin rod worn dave woo goin expensive loud away flex variable thoughtless embarrassedembed servin chicken several judicious hot charge frequent math airbnb collect phone tryna sandwich luggage quan ply even something venmo extra eat bar accident ice dat margarita cover hate problem peep date review band scar greg hold frugal work ac burp generic church underneath free workin around brand join holy stingy always meter drawer word hit please whet shoppin since could unless look brr louis non-free crazy applies sale different play nothing may mafuckin blow fuck man restaurant true stamp shit delaware need bit card thread membership homie hour verse put worth savin logins roach jean easter god december light cut baby in-between fam half way hiccup shiz every gettin lease nigga appetite bank coffee difficult wrong green waitress motherfuckin general tso still lil ayy parkin cousin money biz wear walgreens convenience versus sake piece double talkin finch never leave ohh hand-me-down mr. split thanks sing full breathe dirty cube spend think happy damn swear minute jew wing trial tp teach somethin type trap month thrifty fig burger game hard low bitch playin stick gold disregardin bleed price blame fuckin flight pair ave brag yolo coppin bill motherfucker netflix actin lately ask hear fresh thing time perk hell ld save imprudent single dozen clothes jewish yelp two place book fly cost-efficient aka drug summer smoke bruh rappers bacon count boy major stackin dough decision rob sweater matinee day difference overpay independent k hair
10 Bands ; Drake;10 Bands by Drake.txt;sell even right omg deal condo bleu discuss soda need cookin carolina wrist live turn put calabasas shine ex city good band run meechy grace diamond check ya treatin god davinci claim v feelin week bad much story call cooking hand drape new toronto ask fuelband free shout king translationsespanol rest thing time rapper sleep selfish atlanta long together package always rent motion box mama ever still hit niggas ovo takin year szn peace clean woo could movin north house flick trippin look crib amazin six close jordan love street happen open mission payin never leave awake nike wri-wri-wri-wriembed magic back night play treat keep safe dirty watch timeless phone tryna praise stride fuck man diana november ta shit
100 ; The Game;100 by The Game.txt;right function alive shady funny unify live club henchman wrap top guard dawg trust pop energy real pass much would though nobody stay fan meek want everybody feel black testin bullet learn mill kush biggie fast disappear trill life blowin physical favor l.a. four cloud prince town night h-town choose ta teacher even fame stressin cent give budget young ridin later cause platinum-plus strap conscious california chest city forget catch beatin hold drake thinkin beef dissin always sittin busy word frog roll rush since underground wearin ob sayin could thank finicky meech wayne show kill street crazy soon guess nothin period miss straight play accomplishment many vest response small mothafuckin cool fuck true try tuck shit realizin owl c wet tax suge ghost dap good run committin skimmin tom studio god davinci snupe baby suicide people call every nigga hopin diddy confuse heart hearin pimp funeral circle drizzy lose ever still pac lil niggas set respect indigo money j bus fifth pyramid jealous ford drivin love simple granny talkin reachin never screamin wit thanks fake think heard happy damn walkin bleu hush name oneembed missin bitch color competition fuckin us jamaica ovo/blood motherfucker friend actin unresponsive ask truth hear eight matter thing time waist family car compliment single nine house confidence crib four-pound hug hunnid success back face keep watch beat
30 For 30 Freestyle ; Drake;30 For 30 Freestyle by Drake.txt;doin tongue brampton basement jump number really woman club porsche luckily check care platinum request much rap would overreact mean tv seis champagne translationsportugues bumpy michael fact regular fight shelf mercedes girl want plan side collective testin naive away purely durin happen action life believe champu bringin yeahyou mistake four flinch night brutal higher-up cole noodle phone tryna choose ta case changin fry becomin eat convince pen nineteen dip give young embrace scallop de flyin hate conspiracy city line scar forget suppose hold toast ourself droppin brother knees great local passin workin freestyle around championship sleep complain always legal second word hit jackson pie keyshia tire sure macarena bucket thank fish product papi pablito chattanooga look season else g-o-d january guess different ready reaction celebration perspective party awkward legally pullman dream sear fuck makin arm space obligate treat shit secret solid need throw peyton movement put sudden ghost use square run well-done expect person sport people distraction way call dinner gettin nigga discussion ignore aw dro uneducated rookie message actually wide-eyed patience still niggas money end score spacious poppin google jersey love arena talkin never split crutch thousand foot mine crucify think exchange big move ghostride movie white send vacation losin paternity flight eli crook closer effort talk hand t.i war hear start either thing time together raptor kid family write drastically absence die listen two dios summer spread banner back avoidin hat high keep retire destine
3500 ; Travi$ Scott;3500 by Travi$ Scott.txt;doin carpet alright sunday order wrist chase coat pray wrap motor jas err tennis check army pop pill option brink bad real neck mean tv hundred though champagne radius nobody rumor old hobby size mercedes hallway rapper want takin black only-only-only piss woo jag abandon maybach elegant living sad skrrt room trill definitely resident hot float homies night h-town tryna scooter smell ta pay translationstravis cup bar styrofoam remind give young flyin city scar chain wraith song lady future metro azrbaycan red new iggy free breast percocets backstroke imagination bear roll thirty-thirty-thirty-five park dog boi papi stoner drive look private yah shoe bring wait bentley chevelle yacht straight play public bra r alias dream pool grammy fuck man spot child shit milk royce sundays need lean throw monday turn momma ny buy put planet yard mil good run ft. god tity stack mug baby sport call nigga head heart holdin station tens lord clark ride ugly portuguesespanolsvenska babysitter still lil slow niggas forgiattos ayy money molly cop wear movin score chainz hop poppin love scott shmurda drip never paraphernalia punani emoji pink swimming hoe spend actavis damn truck whole swear gas big somethin name yeahhh trap promethazine send hood drank bitch lot finna front pain bobby gold price rack us nah mark legitimate painkiller triller bathtub leather lately wrapped-wrapped nappy proudly load fiending mileage thing time punkass hell car jr house favorite picture auction crib drinkin pocketbook drug killa smoke pour oah back weed count haha face mink rob build keep touch trcum rowdy hustler lobby bandana k hair
6 God ; Drake;6 God by Drake.txt;sell heard right whole nowyou tone minute royce need whoa give anybody haul sound rrr really naw admit aww road last put hate swish city bitch benz change hittin concept god ting rrrr ball muhfucker fuckin u-chain us work feelin bad week real pass talk would way call every nigga first new nobody puttin old translationsespanol hear hog thing murk long girl stuntin motherfucking squad motherfuckin side worry ever hit niggas ovo black single roll toy money wear except sayin goddamn usher poppin ahh swishers else ga comin mob hurt couple already finish life fixed hey business hot bentley brrt back boy another watch phone man fuck grrra-ga-ga-ga-ga try true home understand shit
6 Man ; Drake;6 Man by Drake.txt;deal force lou magician macgyver woe need young cold club owe buddy award run ix pill fuckin prolly saw light work win cut baby cnn would mean every kitchen gettin nigga friend heart new michael fieri truth blue along career thing psychic shift girl motherfuckin worry cousin save gwinnett single roll south end listen two million look snow demarcus kill show matrix ho pretend tape nothin never guy boomin back myers homies night public tryna man fuck makin soul ta think shit
679 ; Fetty Wap;679 by Fetty Wap.txt;swerve happy something damn whole girlfriend pluck tip need wing im sew window shot remygirl problem dumb buck yeaah city band dicey jean lot batman zoowap spoil us zoo near v pair light baby real behind talk dont every nigga though note diddy great hunnies yeaaah ask zoogang sauce walk press time stain girl trade want somebody monty uh remy past walkthrough wonder hit sip slow niggas ayy feel year money everywhere could loon lifestyle loud fatty look benjamins robin fine fast remyboy zoovier glock twenty smoke shoe yeaaahembed bring cutie daddy sing ass pursue dollar weed thousand control high play nothing rob fetty mine rude blow pocket bimbos tryna meet anywhere rewind man true smell wine boyz think
711 ; Beyonce;711 by Beyonce.txt;exude fool instead shut deck bet act break foolish live goyard shoot put wed vma little thought world top faucets america date good -carat hard swept rue mother queen stop ya player dead nobu net us v work broom expect baby deposit suffer people would way speak mean nigga first next fate felt head rescue stay blue cancun representin rome dippin time huh girl trunk across sittin uh self-esteem disrespect still plate ocean hit ta oww aye leap year write black motherfucka cash set goin meanwhile closet two faith confidence away uh-huh dude usembed louis everything love street deserve connect room special life exactly plane never bring mistake back straight play low-lows keep pool phone day cool man hustler jumpin true change lock space lo- home shit
A Guy Walks Into A Bar ; Tyler Farr;A Guy Walks Into A Bar by Tyler Farr.txt;sell probably bar funny fall corner order eye punch little line tight fade catch hold work light mile talk would joke proof heart new ask taillight hear walk lover time girl want help everybody end could cliche booth away drink believe barembed guy night another nothing many keep cry dark day laugh
A Little Too Much ; Shawn Mendes;A Little Too Much by Shawn Mendes.txt;translationsespanola alright alone afraid use little clear okay hard barely carry much would way hand though strong always help lose focus feel everyone could realize show fine soon sometimes face fog ta muchembed
About The Money ; TI;About The Money by TI.txt;heard doin even gator stuff sheesh damn extra pay yellow interested stone tip dip big bird neighborhood brick bye-gones corner card slime wife honcho behavior l.a standin turn ridin trap buy limp shoot ba-bow put shot send buddy use ship little hood shrimp slang bling max buck good london f line store hard bitch finna lettuce playin stop rag wastin rack catch addressin nah hold bankroll hardo smart real baby bronco pant ugk t.i.p bando talk way motherfucker dimps gettin bah brain nigga bank alley opener quiktrip next head feature ill loss slangin free woah hear sick track flood time murder best fishin bustin uh metal jewelry door disrespect stolen ever rich felony car niggas ayy quite hello niggaembed black roll money witcha watcha learn betcha woo goin listen could goddamn parvo ak n away thug grocery brr six bitty boom skrrt fly ringin reverend quick ho trill blowin crack smoke lip yuh shoe bruh bang guy never miss bring hey da hip back weed count mafia hustle pack full dough bail tonto respond convo watch may blow pocket gah day man giuseppe try think bye shit
About You ; Trey Songz;About You by Trey Songz.txt;right bet move pull name turn put hood desk ton good lot front song cuties baby elevator way call shy friend youembed ride around thing burn girl want booty hotel puff roll could bus favorite titty love fly room talkin full another floor phone pretty think
Acquainted ; The Weeknd;Acquainted by The Weeknd.txt;rather right probably cup glad type live really embrace momma put babe woooooh use duck accustom sh-yeah good run forget bitch pain polskiacquainted us feelin real baby talk way call every nigga thinkin lately nobody deutsche puttin lyin wo acquaint find time although girl cryin want dangerousembed touchin somebody sin inside weeknd ever bear body rush since could drink love warn crazy fast translationsturkceespanolthe comin numb dangerous life complacent believe comfort gain leave ubersetzung keep tryna meet fell try think
Adore ; Cashmere Cat;Adore by Cashmere Cat.txt;alright scream need give babe owe nowhere anything catch real baby friend time babeembed tonight look everything love ma-ma fine breath pretend mind ready boy adore wine
Adventure Of A Lifetime ; Coldplay;Adventure Of A Lifetime by Coldplay.txt;alive turn umi share beating diamond woo-hoo hold skin light half way every weight heart underneath lifetime adventure want feel woo shape die away everything sky life magic dream legend day pressure
Again ; Fetty Wap;Again by Fetty Wap.txt;scream star need big give young jump live admit turn trap chase hope afraid movie triple window digit little top far game good band run anything queen check tat zoowap playin care bimmer baby bando dont way call dumpin nigga bank though youembed start sight fan girl want pussy hit ayy without please roll dump money countin lettin woo goin marry could lifestyle loud drive look gut hop living lambo drivin show crazy zoovier comin finish ah talkin wood never screamin knee fifty face breeze play smooth mine watch wind pocket tryna spend fuck understand
Aint Worth The Whiskey ; Cole Swindell;Aint Worth The Whiskey by Cole Swindell.txt;bar round move name cause buddy thought worth savin bartender good care song catch us whiskey aint work week baby anyway friend raise heart drown stay memory country wrong dime wo matter time long girl hell second drink place close whiskeyyou already waste broken never overseas buzz cheer lost another glass try think
Alive ; Sia;Alive by Sia.txt;notice alive overnight stranger give ticket alone hope demon taught forget survive pain translationsportuguesfrancaisalive saw light envy grow would way aliveembed strange every possibly find thing want thunderstorm ever still bear single solace wear lie could place ground everything love mind life one-way never hey mistake back face hat pillow play nothing breathe mine cry wind spite change
All About It ; Hoodie Allen;All About It by Hoodie Allen.txt;sell right something damn clock bar david scream pen need push type young hoodie music limelight hardly shot use duck shine mate game pick davis record line anything jason speaker front guitar yeezus paula quit song blame us sun win drake baby manhattan mile pass people rap talk dont way noembed pub hand every shy typical friend three actin feature stay plus late megan wo larry hating find literally fan time rapper revis together plan want everybody rock worry base transport stage wonder ray patent body adrien please money tryin capacity since bus two parent broner million leak warn love happen fashion oh-oh-oh-oh-oh room pretend backpack dad mind guess different double sort believe often guy naturally ban wait sing oh-oh-oh-oh back cloud prince reborn full high play public weave glass mine interception lovin tryna singer pretty fuck spot soul beginning shit
All About That Bass ; Meghan Trainor;All About That Bass by Meghan Trainor.txt;right doll move translationsfrancaisturkceall barbie chase momma little top clear shake bottom bitch silicone stop stick-figure suppose hold work ahead real fat boys every inch raise along size wo treble junk uh worry booty perfect two place beauty magazine boom skinny bring bass hey back night play photoshop pretty think shit
All Day ; Kanye West;All Day by Kanye West.txt;case right court pay stupid swear easy alright denzel mjs ebay need actor ten im broadway give woah-woah young grammys really light-skinned turn month undone disperse swish sumbitch worth th farrakhan run hard low kembed bitch finna slave grade ball rack pop p.o how-how us flight g rico bad chan dropout real hen lookin much people talk way winter call hand gettin hundred nigga chi reach allstate jesus middle stay late eight matter ride wo hallway sus moment time long huh always side broad uh everybody mall still niggas dikembe ayy forrest save sweet yeezys money shoppin south since cray how-h-how listen die could sensei class house suave runner earth jackie figure thicker translationsespanolall whistle street crazy fly breath drought gram yah sum already finger piece kind dance ye pour stunt leave passenger sade boy face gump high straight play shout-out many keep watch fake may better spend day small mothafuckin man wild shit
All Eyes On You ; Meek Mill;All Eyes On You by Meek Mill.txt;list right deal reclusive need fall somethin give kitty name eye wife tour exclusive rockin yo put club duck translationsportuguesall hood top pick hide good buildin run bottle bitch plug trust nick us duckin feelin bag real baby lookin goose guide ego nigga new ill woah baddest girl meek somebody chick still hit niggas model money countin none goin lie approach drink look uh-huh birkin fliest hittas love crazy fly york cat ah nothin enough ready chinchilla never dealer back catchin boy hitta hoe feeling lovin pretty choose fuck trip think shit
All I Want For Christmas Is You ; Mariah Carey;All I Want For Christmas Is You by Mariah Carey.txt;happy even list right wish need christmas sound translationsespanolturkcedeutschfrancaisall stand really tree send present shin ring tight lot care nick hold light baby laughter stock much hang fireplace stay underneath ask hear wo thing want door ever pole tonight bell brightly everyone please toy everywhere could outside click north snow fill reindeer ah bring wait awake magic sing upon keep air day mistletoe santa true saint claus sleigh
All Your Fault ; Big Sean;All Your Fault by Big Sean.txt;disaster list even caesar whole derek disney bout naked kerosene round maybe big move g.o.o.d whatever throw gina give plottin name satisfied young karrueche coochie truthfully live loose dot-dot-dot tree homie woman all-time babe white send use janet wonderin wrap little world top game city good record satisfy couch bitch tom finna spit lot diamond pizza data protest fade us pinky light mickey shatter baby cut much people clique hand tanisha luck goofy every rafter gettin dice brain nigga actin thinkin new head nobody middle imagine forth badder chokin rollin ask vega walt king bein walk fresh medium around thing time chris waist sign girl long impossible want five boniqua leg hell pussy rollie family jeter hit feel fault without single roll pic peace end somewhere since cop scratch crown sayin repopulatin house guest til place crib close evil whuh diabetes everything love spouse cruise lit fine quick mj york domination tear finger life sheet piece ye nice lip talkin nomination grind status leave shoulda magic dollar back boy straight another play foot mike many grip keep hoe dream blow beat phone timeless pretty day meet fuck man spot arm jumpin caesars ta mad home comma-comma-combination shit
Already Callin You Mine ; Parmalee;Already Callin You Mine by Parmalee.txt;right round whoa order hometown eye sound momma last put little reading tight song barely us hold shoulder light way mean first head callin wrong rest slide thing time long girl want sit worry slow two drive place close everything fast already life dance chance leave play mine whoaembed think home
Alright ; Kendrick Lamar;Alright by Kendrick Lamar.txt;depression even right pay complicate alright big twilight name live turn momma homie trap hope afraid po-po put hate piano chad world acre wake record anything preliminary hard low dawg resentment lot alls guitar god dead us bick pat gangster partner bag bad hearing heaven cut logic lookin mule deposit rap talk would abuse weak nazareth motherfucker schemin every painkiller gettin nigga reach conflict preacher head heart drown gun late vice prayer fight hear wrong wo lord track rest find around benjamin candy time huh girl motherfucking want cross uh pussy pride inside door mac- mall translationsfrancaisespanolenglishportuguessvenskaalright highlight car lucy influence fo feel fee forty hotel write black please presence assure paint deep cray die dog house favorite look homicide answersembed evil sequel remember everything kill illegal love chevy street boom profit reap zero sometimes room hurt yah twenty chico life ah believe regal self-destruct sow enough digging screamin bass misuse thinking dollar heavy back knee boy face night high full another keep silence runnin dark blow pocket lovin power pretty day recognize fuck trip change think karma
AM ; One Direction;AM by One Direction.txt;right clock break use world scar forget favourite a.m talk part dreamin war raise a.m. stay swim conversation wo around time sleep always feel tonight tryin learn could outside loud place look kick ground remember yeahembed behave forever waste never ass back town face glass
American Oxygen ; Rihanna;American Oxygen by Rihanna.txt;breath girl side motion whoa nickel ocean young eye turn every sweat boy chasin oxygen new breathe dream feeling woah tryna wheel americaembed anything dime empire american close america
Anaconda ; Nicki Minaj;Anaconda by Nicki Minaj.txt;law something romaine bo-bought eat stylish big country-ass pull name chill live buy put club hun use hahahahahahahaha tellin cocaine little dumb slang boney bitch god pill mcqueen appeal real much half way fat purse rrrrrrr gettin nigga motorcycle dun-d-d-dun-dun-d-d-dun-dun thi-thi-thi-thi-this first nyquil michael middle alexander gun salad callin ride grab rifle sleep want bun hahahaha dope hell pussy automobile tower grill hit fat-ass mayweather toy money fucking none jag anaconda bi-bi-big gosh balmain who-who-who-who unless look dude kyuh troy ahh keepin kill love jab di-di-dick skinny shootout sex toss daffodil talkin palace bang by-by-by-by-by-by miss meal hey dealer oh-oh-oh-oh back boy muthafuckin high wa-wa-was butt play keep detroit coin pushin dress d-d-do fuck re-re-re-real shit
Animals ; Maroon 5;Animals by Maroon 5.txt;alive eat maybe deny sound hide run deny-ny-ny-ny hunt stop stick cut baby mile scent mean head stay free along start hear sea find girl inside still animals-mals oww beast tonight roll lie fish away animal prey ground kill yeahembed love pretend entirely drug forever enough hey si-si-side enemy high yo-oh smell try think
Antidote ; Travis Scott;Antidote by Travis Scott.txt;lowkey right flame occasion cocaina sunday b monday type young rrr cameraman paper twice window number-one dealin bottle anything dyin bitch front hunt check god catch shh pill fuckin us flight translationsespanolportuguesantidote peat light week la angle home nigga three fun though old hatin late fire callin lord dinero time want bun sippin stankin door kid ooh-ooh-ooh snappin hit stage over-impatient bos roll hollywood satan overboard weekend two place poppin pip ahh everything show lit crazy open happen complicated ho different ah mo antidote hill kickin mistake relate party back age night high straight stackin coco h-town horry hoe spend robert meet fed day fuck ta think no-no shit
Anything Goes ; Florida Georgia Line;Anything Goes by Florida Georgia Line.txt;rocket silver right helluva bout star secret big equis fuse county turn road rockin dixie x little masterpiece good bottle anything losin hittin lime twist fade song boombox headin light swayin baby mile way heat friday gettin friend nobody taillight ride girl sippin somebody box everybody stereo victoria lift feels sweet indigo crazyembed sayin breakin loud alabama hop chevy crazy comin disappear blowin nothin bang tock bring river party rim night tick wind beat phone boondock mindin spot lock smokin
Apparently ; J Cole;Apparently by J Cole.txt;unfaithful right panty damn em deal eat swear easy star wish follow need wing big give clue live really alone chase put freedom canvas e-e-eee fume hood percent zone foreclose city good wake urge hard forget bitch tight stop exist e-e rolex song catch rape na-da-da-da snatch carry baby forest flow sorry today would way call nigga friend great though head new shit rescue strong ask wrong lord slur virgin soft thing time selfish girl huh together want always trump best mama sit ever translationsenglishespanolapparently word lazy niggas ap rid without write resist please apparently sure perfect paint aim could thank dog faith two moon view selfless show love rhyme regurgitate zero ho york loan toss believe forever trombone hill never miss leave wait blueprint hot thanks enemy back boeing dome high another play boing keep dream cole watch coin horny feeling phone spend day iembed fuck think home treat
