title;artist;filename;lyrics
French Kiss ; Lil Louis UNCERTAIN;French Kiss by Lil Louis UNCERTAIN.txt;right dilicous suckin eat bar oooo glad suck need im wet alcoholic turn express massage hope girll x little thats good yeahh bottom scar legs stop hold lyricsayeee lick baby ur dont way fren nigga toe affection shampoo bathtub thursty head hungry likewhen delicious walk wo naughty around grab candy girl best french ahhh promise .. body feeeed crazyembed woo u sayin favorite ahh hickies jar crazy gotchu oven towel special kiss couple mind passion piece sex oo lip nasty wooo rinse drip never leave lay sing back straight gasping treat blow feeling kissing cuz spot ual hair
From A Distance ; Bette Midler;From A Distance by Bette Midler.txt;even march need hope instrument white harmony voice world band mountain distance god song us flight cap common every friend war though heart hungry land blue gun green comprehend ocean distanceembed fee eagle peace look echo snow stream fighting love disease enough mouth likeit play watch bomb lyricsfrom meet man
Gentle ; Dino;Gentle by Dino.txt;gentle likei fall give name cause babe joy world run pain stop quit catch hold baby call daze confused next loving time girl want ever promise please since lie lyricsgirl love soon sometimes hey wait boy night
Georgia On My Mind ; Michael Bolton;Georgia On My Mind by Michael Bolton.txt;whole song always lead mind smile still forever mindyou moonlight tenderly eye peaceful talk sweet georgia road pine peace back reach keep dream old clear day arm find
Get A Life ; Soul II Soul;Get A Life by Soul II Soul.txt;example idea aware eye afraid put race hmm clear line ya satisfaction ahead work supply flow achieve way speak mean call meaning new tool test positivity free implement thing sample become motion collective selective word controlembed feel body experiment elevate ambition funky ample listen loud uh-huh ambiguity electricity mission asset mind life ah believe gain shining goal dread control notion dream feeling objective must soul ta
Get Here ; Oleta Adams;Get Here by Oleta Adams.txt;right something sailboat carpet windsurf need big colt break jump tree railway rope hope balloon swing good mountain arab blaze musical care desert us closer would way canyou reach trail-way ride slide caravan always side cross speedy climb slow sled surely close soon mind life just- hill airplane border mine man arm
Get On Your Feet ; Gloria Estefan;Get On Your Feet by Gloria Estefan.txt;ago pull stand use clear devotion scar spirit handle stop shoulder weather strenght much heart emotion find lyricsyou thing time long together tomorrow feetembed feel likeget deep die could look answer happen action meant life pas overcast nasty waste onto foot keep mixed true weight try ta think understand
Get Up! (Before The Night Is Over) ; Technotronic;Get Up! (Before The Night Is Over) by Technotronic.txt;right stomp move stand demand buy record dig shake lyricsget mix win cut people three fight start seven eight thing want checkin five kid rock busy body likeget two six never miss four jam party night battle foot butt floor beat trip pump
Getting Away With It ; Electronic;Getting Away With It by Electronic.txt;original force suggest ago fall give wet really yes hate clear forget mirror care rain ahead bad however repressed talk walk time long selfish worthless feel less could away look love life guess impress purpose itembed sinner true try think
Gimme Your Good Lovin ; Diving For Pearls;Gimme Your Good Lovin by Diving For Pearls.txt;sleep eat want cure kiss fever need baby lyricsi way loveyou hand weak sure knee deep anyway shiver loving gim good lovin start anything love
Girl I Am Searching For You ; Stevie B;Girl I Am Searching For You by Stevie B.txt;cure need anymore last cause lonely loveembed gold pass way lady hand every lyricstell heart loving lover find time long girl always help search ever please end begin kindly show love happen special mind likegirl forever hey face seem cry touch blow try
Girls Nite Out ; Tyler Collins;Girls Nite Out by Tyler Collins.txt;right girlfriend ow outta alone turn babyembed nite trouble lyricsget us baby behind fun bridge sick wo thing time girl step oooh tonight tired realize likena mind ready leave wait party boy night play nothing change home
Give It To Me Good ; Trixter;Give It To Me Good by Trixter.txt;alright need move teach give name live last city good ring lot father diamond bad baby man-i much someone- way anyway rocker lyricswell son thing shame girl together always fancy goodembed car feel takin tonight learn it-give two look palio rule likegive show love fast ready never hey school dress man ta teacher home
Giving You The Benefit ; Pebbles;Giving You The Benefit by Pebbles.txt;poor benefit benefitembed minute give number tough turn put a-kissing babe little world good hard queen stop diamond trust us work real baby part hang rough heart loving lyricslately start around reason thing time long girl diss whoo g-g-giving inside oooh still ta feel sweet deep could two away doubt figure hurt mind believe lip miss mmmm boy nothing keep man trip choose try change think home
Go For It! (Heart And Fire) ; Joey B Ellis;Go For It! (Heart And Fire) by Joey B Ellis.txt;right flaunt minute move push give master eye stand reaching yo cause shot gifted good trouble knack stop youself bold hold perfection trick grow flow every reach next heart fire fight moment time bargain together plan want best dope ever lift rush sure teaching closely direction listen hop lyricsgo rhyme repeatembed quick life blowin double farther back preaching high nothing knowing keep mine better question feeling man prove try think
Going Home ; Kenny G UNCERTAIN;Going Home by Kenny G UNCERTAIN.txt;thing something girl want endlessly hold mark different exactly act give baby eye leave alone hot could around emotion good translationsespanolfrancaishold hard everything think home love
Gonna Make You Sweat (Everybody Dance Now) ; CC Music Factory UNCERTAIN;Gonna Make You Sweat (Everybody Dance Now) by CC Music Factory UNCERTAIN.txt;crowd right pay whole easy dip move give jump live point music nut yo pause world shake indeed ya bleed price work baby pant people hand dice twirl upside heart tu-ru-tu rhythm free command effect grab time girl dope everybody unfold hit feel body combine pa-ra-pa-pam tryin sweat raw house rhyme breath groove life dance nice chance waste precise enough guy bass wait squirrel pursue jam back party control dome night butt mike floor air beat soul
Got To Get ; Leila K;Got To Get by Leila K.txt;crowd right devastation fin pen big coolin exact move chill rage live paper thrill delight intellectually game good shake homeboy hard spending playin check cut flow rap psychological mean mic story def fun new ill strong smack effect fresh relax grab brand pa time girl step rock horse stage takin write bell respect funky obligation house wow place crib bless hype stream svenska show yeahembed rhyme fly super microphone scene crack knowledge correct success remain layin never bring foundation back age boy leila pack m-i-c full butt poem beat wack soul k
Got To Have Your Love ; Mantronix;Got To Have Your Love by Mantronix.txt;read need dear whoa butterfly eye loneliness caress disguise angel share shine wash ha-ha-heart surrender clearly heaven much would way mean every felt heart new free hear walk start find time sign long want disagree inside smile ooh-ooh-ooh search word feel desire despair whisper sweet sure woo die could ear away lovers close love mind image never sacred boy night horizon dream mine dark day must ta mystery think
Got To Tell Me Something ; Ana;Got To Tell Me Something by Ana.txt;stop something thing mess want us kiss different ready maurice part willing brain boy seem first begin confused two bridge may touch feeling fire loveembed prove ha love
Groove Is In The Heart ; Deee-Lite;Groove Is In The Heart by Deee-Lite.txt;sell delightful right doin manembed stomp loop deal maze wish follow dip move hears chill eye pied music yo supper funk truly glowin dig electric playin quit satisfaction us feelin baby lightful three fun stoop dish heart bridge ask delicious rhythm blulululu vicious along hear huh side de-lovely motion uh inside bloop dive hit hendrix astronomical kinda roll flowin funky hmmmmm deep could especially two deeply look realize fill show piper crazy hilt groove hoop dance hula horton torso succotash depth wit hot sing back key malicious another who-who high keep dj nth watch haze wall blow horn soul makin true think spill
Hang In Long Enough ; Phil Collins;Hang In Long Enough by Phil Collins.txt;sell writing need beg enoughembed pull give road good clear hard near taste way hang reach emotion ask free hear find thing sign long want always best hell ever feel end could hole ground everything life enough never key play wall touch pocket think
Hanky Panky ; Madonna;Hanky Panky by Madonna.txt;even tie need big give translationsportugueshanky beautiful little world good sister panky bottom honey spanky hanky bad ecstasy someone behind talk way speak lady mean hand call frankly rough handkerchief start wrong tease slobber candy thing girl spank doctor want disagree settle oooh smile bossy please sweet somewhere woo thank picture others hurt kiss softie grind guy back nothing cry interesting better cranky think treat
Hard To Handle ; The Black Crowes;Hard To Handle by The Black Crowes.txt;alright cent drugstore ten give yes afraid ad little good store nicely hard shake handle song light baby much advertise call boys every free jeffrey dime around thing time want louder sir cease mama candle word noise dozen sure throwin speaks thank place love scene action comin experience nothin back boy another pretty man prove ta home shit
Have A Heart ; Bonnie Raitt;Have A Heart by Bonnie Raitt.txt;pay shut lyricshey darling need big fall apart bit eye stand yes later little heartembed good run handle sooner bleed fade liketalk baby talk would heart free want pardon please lie could blind away look love hey back mister man think
Have You Seen Her ; MC Hammer;Have You Seen Her by MC Hammer.txt;glad star coast need corner veo young chill knocking road buy last woman movie put yo club cause thought world game peep clear store ted hard front levert hold vision bad baby grow bill mic brother call unseen friend homey heart strong memory wrong lover wo track find around hammer long girl want five help door search stereo base fab wonder car drift please sweet dub appear somewhere vj d-b could lyricsah prop picture ed dre place look show homeys love cruise sky fly special hurt mind tape definitely different guy magic back face night another rob keep cosby mine dream feeling beat phone meet man home
Heart ; Neneh Cherry;Heart by Neneh Cherry.txt;right phoney beg move break harder strike turn alimony little strap banana peel shake meat hard chocolate pain stick god dead larder bad bed baby salami people half would lady mean heat anyway creature friend alley neneh fit heart stay buttercup wrong hee around cherry time burn girl boloni want candle everybody lose doughnut gentlemen- ever coz feel body sweet end lie place ceiling digital everything hurt cat mmm- waste never guy leave cabbage style back face control full satisfied patch rat slap dj cry spite feeling day man lyricsout try think laugh treat
Heart Like A Wheel ; The Human League;Heart Like A Wheel by The Human League.txt;sell law fool anymore turn stealembed steel world anything blast hold likeheart promised real pass way colder hand heat anger friend war blood heart land free wheel hear seven sea career wo medium fear around message time holy want help word promise set retreat lyricscalling away drive captive happen johnny ready broken pack nothing keep power beat cool true soul change
Heart Of Stone ; Cher;Heart Of Stone by Cher.txt;crowd right eden stone round wish wing big ten break protect alone turn road caress put sorrow white steel shine wash lonely flown overgrown ring sand pain innocent diamond chain castle suppose rain win lyricsbeneath winter heart ask fire wheel joker peak moment sign long together tomorrow mercy lose sweet set learn house knock picture moon away look season show love crazy soon sometimes room hurt tear summer forever shoe headline queue never lay river town night dream stoneyou soul dreams laugh dreamer
Heart Of Stone ; Taylor Dayne;Heart Of Stone by Taylor Dayne.txt;even stone easy need fall give eye ityou yes alone turn hide lyricswe reach heart walk wo want ever still feel could away close everything show else love hurt tear believe never lay back another dream arm reveal try think
Heartbeat ; Seduction;Heartbeat by Seduction.txt;right eat intense wish move freak give im really alone cause little lonely good loveembed anything hold sweetness would way hand weak felt head hear walk fear around want lyricstheres rock oooh darn feel body complete year likemy charm sweet lie ground sad everything love everyday tear kind enough heartbeat wait night straight nothing keep sense dark feeling phone arm
Hearts In Trouble (From Days Of Thunder) ; Chicago;Hearts In Trouble (From Days Of Thunder) by Chicago.txt;right west naked crotona a-t-l german funny infrared bubble fierce eye fuse really music road fiction crime chevys far rolexeses monroe joe blaze hall hunt hittin ya pop rain dead duckin bad energy real neck dribblin rap gentas obsession mean prospect define hundred cigar chicago stay fact old vil late scheme fight sick hallway doctor lambert pure best side politickin takin less aim none mothafuckas goin raw north courtland loud state flex kick ogden bigot prayer punisher dugy randall gram consequence yea mind blowin crack concourse nice tango tremont throne town detroit runnin rise ta steam home crowd even law pay pen ice eatin march nineteen brick act give broadway pulp lafeyette point troubled terror deacon last cause shot shine zone tariq longfellow city chest benz stop catch consciencious anita fearless leavin l-a omestead stompin joeys weaken brother left expressway new monster blue gun jokin avenger dime block track file beef mack reason around peelan shore dale ave. cross spark nondescripters word hit core park since lexuses sayin could click dog racist thug earth searchin police keepin kill rhyme theriott lit convert plain bryant regardless chilin nothin blaow gunz miss business seventy dome colgate patterson play straight crew many leanin dream panama vest blow fed small man makin spot saint try change treat shit probably simpson restin need abductin lean im jerome put mckinley reps argentine thought melrose little walton east worth th earless run drama god castle stack boulevard pad light bag killas feelin watson baby people fat abuse webster call murderin every redeem exorcist nigga willys heart head test holdin team n-yembed rd lord son strictly main squad circle bustin beam lose smile due buryin still academy irrational leakin influence forrest cartagena cash money tryin south vyse cop wear slice bless devil permanent love open ho york blunt couple double funkmaster hill reachin never leave wit heavy key mine fake switchin objective chip lexus bust slug freestylin bet purple big trial break carolina wife cozy tree yo white brook tellin john trouble artillery checkmate bitch pun front crease fuckin commonwealth us sun ave partner shorties bubblin cream aah men hand motherfucker three friend percentage thunder actin boston adventure callin hear aiyyo d-c find washington thing time trinity long large uh gauge family showin save senseless cryprus nine die soundview two one-time puffin bronx place bointain six knowin facility chrome range glock enough niece sexist back heartless face rolexes rat wildin texas creston beat gauze day
Heat Of The Moment ; After 7;Heat Of The Moment by After 7.txt;right admit tempting good stop lick carry baby would lady heat every lust head strong wrong moment time although girl explain always want best lose ever slow ta promise faithful drive everything love crazy kiss momentembed mind life heel believe kind lip never tempt mistake haha cool man must fell change think
Heaven Is A 4 Letter Word ; Bad English;Heaven Is A 4 Letter Word by Bad English.txt;round need millionaire letter dawn tough wordembed babe cause world lyricsthere enter surrender heaven baby talk way heat rumor hear walk ride find long girl fantasy side lose rock innocence word feel roll lie could paradise pleasure til realize prayer love street happen kiss experience dance chance halfway enough never hey wait four likeit touch meet anywhere limousine wild
Here And Now ; Luther Vandross;Here And Now by Luther Vandross.txt;right needembed together always vow hold glad need life believe ever promise eye feel really happiness mean sweet faithfully thee night share nothing heart dream away look day start close pledge love
Here We Are ; Gloria Estefan;Here We Are by Gloria Estefan.txt;right something funny sublime breathless eye alone turn world game hide forget stop hold tremble helpless baby pass reach though heart strong prize time together want become inside feel friends lie could place youyou close everything love fly sometimes hurt kiss lip never back face nothing lyricshere keep mine cry touch beat feeling spend arm think
Hide And Seek ; Pajama Party;Hide And Seek by Pajama Party.txt;something attraction need move eye likebaby put hide seekembed chain hold someone lyricsdo baby grow talk reply way felt heart strong start walk lover seek around time burn long want somebody door slow feel look show love open kiss mind passion ready reaction wait ought boy straight play touch mystery
Hide Your Heart ; KISS;Hide Your Heart by KISS.txt;deal shady big whoa messin name rooftop eye chill finally stand shot jewel hide good trouble run tight possession tito hold saw win someone rosa till story hand hundred thunder blood fate heart heyembed holdin gun fire king start hear sight lover ride time side pride still liar word rid car feel desire tonight end crown lie listen could die vengeance look doo prayer love street seal johnny ah hey town night battle play nothing meet understand
High Enough ; Damn Yankees;High Enough by Damn Yankees.txt;need whoa live anymore run baby talk would way call brain goodbye next heart stay memory fire hear wo thing shame want door without pounding sure misery die drive close remember crazy fly yesterday forever goodnight enough never mistake back high whoaembed
Hippychick ; Soho;Hippychick by Soho.txt;something force deal oppression strike correction hard ha stop bulb motorbike today way revolve hippychick blue gun coffee wo around door sit rid feel without tonight since drink close devil love hippychickyou room hurt miner mind life bare incident hip gloom flower lyricsit true try change lock think
Hold On ; En Vogue;Hold On by En Vogue.txt;honesty tie need dear give break really share thought little game good strength tight ya trust care hold within bad baby much would home hang every noon first head loving art heart fire fight wrong hoo around thing time burn complain want patient lose sit wonder feel despair since deep blind morning faith deeply blinded away rule remember show love mind passion burning waste hey school mistake magic golden night play keep day must soul ta space sacrifice treat
Hold On ; Wilson Phillips;Hold On by Wilson Phillips.txt;sustain someday comfortable break really turn babyembed unhappiness worth pain chain blame hold baby pass way fair goodbye heart free wo around thing time somebody step inside worry ever feel lettin except could open mess mind life anyone cry day change lock think
Holding My Heart ; Bang;Holding My Heart by Bang.txt;fall thirst act name hijack paul cold john mood hall stop care hold favourite cut people call first recliner heart free hair want plan oohembed iconic beatle favour bandit die crawl getty dessert hurt mind life ready wait decision glory duo watch table
Holy Water ; Bad Company;Holy Water by Bad Company.txt;heard right easy funny sens run satisfy degree reel light baby sensation way lyricsin first new everytime wrong walk find time holy girl temptation want ever word feel please blind water whenever close ground salvation life yesterday believe never sacred certain seem nothing mine feeling lovin meet change
House Full Of Reasons ; Jude Cole;House Full Of Reasons by Jude Cole.txt;happy clock among lyricsthis remind break im trap hour window .................. trouble hard theres hall people way till hang slam reason climed ive side inside door sit smile movin morning house picture away love peopleyou ......... room couple believe wait full seem nothing watch wall normal dark day
House Of Broken Love ; Great White;House Of Broken Love by Great White.txt;even something deal fall beg grey break eye turn cold suspicious sorrow recognise send use shine wake shake pain blame saw baby constantly loveyou though loving stay lyricscome free hear sign sleep want help lose search set lie misery listen could morning house moon devil else love steal daybreak chance broken heartbeat leave back night weep dream
House Of Fire ; Alice Cooper;House Of Fire by Alice Cooper.txt;flame pay instead stone alright solid need brick throw give downembed stand window use buildin ya us baby unlock roof every strong fire shout walk wo time together want rent door desire tire garden overhead house ground love tear wood key high play build watch touch landlord lovin ta home
House Of Pain ; Faster Pussycat;House Of Pain by Faster Pussycat.txt;right need big rearrange pace live alone momma wonderin little worth line anything pain blame mime porch behind old ownembed time script five sittin step past still ever year write tryin learn lie waitin could house look million everything soon page room dance talkin waste eighteen daddy boy suppertime lyricsit fake likeno try home
How Am I Supposed To Live Without You ; Michael Bolton;How Am I Supposed To Live Without You by Michael Bolton.txt;even pay news break live hope hardly proud world swept price suppose blame leavin someone carry today much friend heart hear around thing long cryin plan livin without end could away look love goneyou believe face straight build upon dream mine lovin day true
How Bad Do You Want It ; Don Henley;How Bad Do You Want It by Don Henley.txt;carpet lyricshey tongue enoughembed somethin give put good hold mark leavin bad week weather lookin today talk would way happiness mean excuse affection next ask start walk find reason want year could away look season love b-b-bad lip education enough bring party boy glass day likehow think bust
