title;artist;filename;lyrics
Drowning ; Backstreet Boys;Drowning by Backstreet Boys.txt;even maybe need breathless pull cover drifter oh-oh-oh loveembed okay oh-yeah baby sorry weak every heart drown imagine hear time survival long girl help inside without save resist sweep away lifeline love oh-oh pretend yeah-yeah life forever enough leave mouth freely float seem another safety keep breathe dream air power beat rise arm try no-no
Electrical Storm ; U2;Electrical Storm by U2.txt;truck sore someway need break sound hope cold wash compromise honey color rain bad someone bed baby weather way luck head new swim coffee sea lover wo kept time sleep alarm hell rainy electrical car ache sure lie two away place else love sky cryembed soon swell room mind sheet crack storm enough never hey awake hot heavy back night nothing dream cry air day must
Emotion ; Destinys Child;Emotion by Destinys Child.txt;instead heartache star need fall apart live sorrow cling world shin tight song catch hold goodnightembed baby heart nobody emotion find thing side inside lose ocean word ahh-ah without tonight else wherever tear kiss lead goodnight broken never leave hey river back pillow cry ta home
Escape ; Enrique Iglesias;Escape by Enrique Iglesias.txt;right something maybe beg break worth hide good loveembed run shake hard forget bad real baby stay fight wo matter find time past feel end love fast soon escape leave try
Every River ; Brooks;Every River by Brooks.txt;time stop sky rain catch star tear fall past someone believe forever ever baby promise sound never call river last every dryyou somewhere steel upon tumble drop touch mountain run day hear ground true dry fell love
Everywhere ; Michelle Branch;Everywhere by Michelle Branch.txt;whoa eye alone turn wash far wake hard pain catch within light real way part hand every driftin matter time sleep always inside feel everyone deep everywhere begin away look water close everything beauty breath believe never breathe sense touch day recognize try think understand
Fabulous ; Jaheim;Fabulous by Jaheim.txt;swerve babyy shut bout alright funny need hearty whatever give thangs name young tough alone hate shot divas cause fabulous little cornrow game suburban cellies ha-ha low hard gravy jean lot sag ya twist trust ball pop dutch us bad baby grow weather r-e-s-p-e-c-t call every rough first raise local block dime wo matter time prepaid girl together likewas best timbs kid mall rock ever h-e-a-d single rush naive cop lie could parent mommy slip crush doubt mom love job u-n-i-t-y u-p chrome cat storm smoke kind believe switch never hey g-i-v-e u-pembed daddy bid party back doorag charge lane dough keep blow spend meet man child hi home
Fade ; Staind;Fade by Staind.txt;stuff need surface express cause thought fade someone bed much talk mean anger felt stay old memory ask time overtake become step busy feel scratch could away darkness everything else life never conceive face seem breathe try change
Fall Into Me ; Emerson Drive;Fall Into Me by Emerson Drive.txt;meembed right follow need fall move turn road cause hide cost scar us someone baby much wide heart stay strong shelf always lose love else open believe wait anywhere arm soul
Fallin ; Alicia Keys;Fallin by Alicia Keys.txt;time ya sometimes fool uh fall someone baby give pain outta feel never fallin much would way sing back cause use darlin confused felt keep blue pleasure good lovin start think love
Family Affair ; Mary J Blige;Family Affair by Mary J Blige.txt;meembed alright ice b need gots celebrate jump loose holleration turn white mhm problem good hard drama ya twist ahead work real baby situation dancery way hand heat fun pumpin hater free fight start hear dime track matter beef grab time long want percolate somebody everybody step door percolatin inside lose rock family holler crunk feel body tonight black set j. mary cop waitin outside drink dre dancefloor love open affair mind life dance hateration crunked leave mmm-mmm floatin party back boy night high another floor mine spot try ta
Family Portrait ; P!nk;Family Portrait by P!nk.txt;happy right milk easy star nicer spill need act break shelter name sound stand yellin turn no-no-no alone last little world good anyways run anything pain stop nightembed us work holiday bed grow today much painful way mean brother dinner war iii stay fight hear wo matter around thing sleep girl cryin want uh mama sit family choice da-da-da-da-da-da promise please money noise deep could two address mommy away place look tearin mom remember everything love pretend hurt dad destroy growin forever nasty portrait shining never naturally leave split daddy back night play keep glass cry normal pretty day true step-brother change home shit
Fatty Girl ; Ludacris LL Cool J UNCERTAIN;Fatty Girl by Ludacris LL Cool J UNCERTAIN.txt;ummph stuff tit represent coupe naked tongue thangs eye really cheek chunky international world fb robbin ring check ya player pop tub dang-a-ling taste flow rap mean strange toe jello nobody stay king noggin walk size friskier silencer glocks girl want chick mercy l feel without sweet less slobbin goin entertainment undress shape greasy squeeze doubt holla sex hot clitoris pack butt home shut cinnabun easy fame bird crushin act give young plat point de ran smother league weapon shake meat stop cringe steppin ball baller catch suppose thang whoo-wee socket lookin claat whore k-ci lady brother effervescent blood goodness jesus jojo fire workin mack around sleep welcome trackmasters yoor second belly essence please paint since wearin sayin dog papi fatty brillo look street magazine soon uhh sheet repeat nasty gracious dream almighty small cool fuck shit clothe lyricsf fubu beach pierce thickness mobbin mighty thieve beautiful thought gat good dame jean god heaven cut baby crawlin fat aphrodisiac call pusher every nigga havin wrong lord pimp endembed fantasy smusher broad bustin mall ever still juicy funky mary jang-a-ling j christian liquor gusher badonkadonk challenger hurt stanky cat necklace talkin cuttin automatic pssh full pillow foot floor breathe service amen scream gas big type graffiti name nut yo creepin ding-a-ling kremes drop hard gravy bitch front competition heeshy talk slappin hang three re-up hear aiyyo eight thing time waist uh step rock ludacris .. lubricated hello thigh butcher lee listen die two drink gut cater krispier bing fine dillingers scene ehhhh glock dillinger back face keep curtis kathie watch wall claimin murray hair
Feel It Boy ; Beenie Man;Feel It Boy by Beenie Man.txt;right damn whole instead alright funny yow name really buy joy cause little world game yowembed good okay shake honey forget pain queen ziggy care nah shoulder feelin spin baby people almost brother call brain blood head heart stay old fight gyal king wrong lord reason around luxury thing stain girl together venue uh everybody jewelry lose zagga still fi car feel without money clothes two cho away whenever zow everything love open sometimes kiss yea ah dance forever bare ready bring mouth sing party back boy crew nothing keep cry feeling true think bust
Feel The Girl ; Ms Jade;Feel The Girl by Ms Jade.txt;doin slug stuff right changin feelembed jade curl bar train stumble shakin bet mase wing route throw freak type clue name combin freh pace cheek chronic turn frick coat killin club white earr scrapin gerome world err game cost bub-bel-in clear dame blunts gentleman tight spit shrivel puff stop amount ya chain care concerned rain ponytail shh stack dutch bike hold hurl duckin leavin light snatch feelin la professional lick stiletto cut real flow taste fee fra way lady speak lickin bill freaky fridicka poke hum hangin gettin skirt thunder rug toe bouncin seat pumpin rollin asses masculine frickida free workin -- ms. virgins matter beef around find loot track time digga girl stuntin engine folk rent timbs large chick bustin lose mall bow chin skrip car niggas peelin fricky feel philly takin tonight write black kinda please set frame tryin shoppin clothes sweat countin wha crown toothless lie could movin frid two house loud ruin dude hug love jaaaaaaade duro sweatin throat chrome comin kiss pas sheet different plane dance nice chicken bang waste bringin never miss doha ladies nike william wit smugg-el-in lay fricka back face town peurto fa garbage satisfied rat brushin keep silly runnin watch question phone rice switchin rican makin government jumpin h braid shit
Feels Good (Dont Worry Bout A Thing) ; Naughty By Nature;Feels Good (Dont Worry Bout A Thing) by Naughty By Nature.txt;right damn whole bout backwards gentle star b dat move throw rub kitty give inspire master number cheek music hooray last generation swellin club dl hate x window punch little world thats matress iicons drop good lot drama stop g. ya twist song treach mother-mm-mm fade mix thang us g invent o.p.p der lick sexy baby stress pass people lordie dont hand brother goose cab fun toe l-dub hater test after-party barley ask truth iicon strong h-t walk block track naughty son ride find ...... slide tang chorus thing culture long welcome clap cross everybody rock smile worry ever family still hit stroll outdoor feel body .. write year feels flip glorious ooh-ah dub bachler since vinnie u tap n away hop close heyyy-yo crazy ashanti nature groove towel kiss simple mind dadda double dance by-gones never anthem ohh leave ease hey lw kelly wit yardie da party hip back pursue bacardi age key sooth kat high pimple pu-tang many dj flavor beat cuz day rewind gap man prove think
Fine Again ; Seether;Fine Again by Seether.txt;aware expire dyin scar color againembed blame sober sigh every gray discover stay late hear hell behold prepared liar feel everyone assure away everything fine prepare never leave seem dream label day must try
Flake ; Jack Johnson;Flake by Jack Johnson.txt;right something even whole alright tie maybe fall move break harder name eye stand tree use world far drag nah work baby pass much wide would way mean call next new flake longer usually brand downyou thing time sleep want always help lazy please money lie tired sunrise water everything love fine untie often shall seem silly pretty try change think
Foolish ; Ashanti;Foolish by Ashanti.txt;even something need think maybe whoa deny give foolish really alone cold window run strength stop appreciate trust desert hold bag bad baby allow way lady weak though accept heart stay wrong thing murder always still feel without year learn could look sad love ashanti hurt tear believe remain never bring leave sing back backembed boy pack many keep cry regret beat day change mad home inc treat
For All Time ; Soluna UNCERTAIN;For All Time by Soluna UNCERTAIN.txt;happy even crumble maybe need warm young really refuse embrace alone cold shine wash good souls anything rain sings shoulder sun receive baby shadow shifting heart new quiet lover matter tender time long somebody word feel timeembed could tumble morning songbird two moon away love silently kiss never night keep wall may touch air belong day anywhere soul ta
For You ; Staind;For You by Staind.txt;something scream need give daughter turn nowhere mother father us someone person way head insult hear son help attention inside sit feel listen could loud fastyou remember everything kill fast enough curse decision nothing silence fuck lock
Forgive ; Rebecca Lynn Howard;Forgive by Rebecca Lynn Howard.txt;even right big move mighty live cause thats drop relive honey forget stick suppose expect would call confused ask around thing time always ever word fallin tonight sure two rip love soon tear life sort forgiveembed leave forgive regret bomb touch day small man think home
From Her Mama (Mama Got A) ; Juvenile;From Her Mama (Mama Got A) by Juvenile.txt;list role introduction whole nineteen mad big twenty-somethin ten break serve card toxic jump eye dirt turn uhyou month strugglin woman later put hardly fourth homeless hood world top grindin lonely sister run jhacari bitch pain god flippin pop fuckin hold june spotter work beggin baby lookin porch much way lockdown hand motherfucker call brother every three nigga first next relationship nobody puttin channel billion walk seven eight block son relax find seventeen turf sixteen gemini time steady twelve girl atlanta drain overprotective five want murder motherfuckin always best mama inside lose womb rock kid smile still lil hit niggas feel cook year roll tire stealin dispatch learn nine goin could j movin elementary two state fourteen million six figure love fifteen crazy hurt flexin dad eleven struggle wrongly caught nothin remain favor eighteen ready leave school mistake four blessing daddy startin back age count face charge play another juvenile karma dream forbes runnin steery pushin ayo beat tryna day delay try ta think understand shit
From Tha Chuuuch To Da Palace ; Snoop Dogg;From Tha Chuuuch To Da Palace by Snoop Dogg.txt;introduction coupe shizzle chilly deck follow cookin need big beach somethin khaki give name pull mack-allenium juan ron really dogg d-o-double ridin refuse homie eff sticky yo cause steel world breathin annihilate drop reading gate run couch famous bitch neptizzle chuuuch crease check dizzle stop ya god trust ouch chuck data catch fuckin stack us g moet bad someone mae boo real baby pant pass sleepin gin much dont bill fulla snoopy hand c-walk motherfucker heat wisely annie hangin inch joke three nigga friend isley stance bouncin thinkin accept fit new rollin puttin ask blue falcon king fay green buster whatchu time burn long bossembed folk busta-bust mark-ass side journal hell chronicle kissin board bam still car rid three-wheel niggas doggy body snoop fountain thriller year low-low player cornrows tryin clean since none cutlas goin everywhere cuff two gunshot million uh-huh usher chairman police tha youse hehe ratta street grit boom fly guess picky believe dance juice savior archbishop palace l.b.c enough contagious wit gizzle magic da party back thousand boy ounce homies rim alice fa straight low-lows keep rakim runnin sandy wall touch beat feeling scatter legend cuz fuck must man hustler makin soul home a-ha-ha
Full Moon ; Brandy;Full Moon by Brandy.txt;case notice even something right happy star whatever whoa give eye turn club low front visit crackin saw someone baby way bouncin though first felt new start walk conversation around thing time somehow want door smile feel tonight since lie could moon look show love soon special life kind dance guy hey boy town full seem night floor meet man must think
Gangsta Lovin ; Eve;Gangsta Lovin by Eve.txt;heard doin list right exchange need big give corner name eye number wife-beater yo ok available stoppin top game drop good hard bitch tight lot bangin playin stop ya pop givin shorty hold feelin establish oh-ah real baby way spinnin lady mean till call shy buggin skirt though first fit test puttin ask youembed wheel bein walk wo ride find hair gangsta thing time shame long girl average explain want always best uh settle rock short word demandin car without frame provin approach thug place uh-huh dude e-v-e show love street crazy oh-oh action comin tan lead regardless status cutie mouth daddy key night seem outfit lovin tryna a. cool ta understand shit
Get The Party Started ; P!nk;Get The Party Started by P!nk.txt;right freak pull anytime volume break stunner send good nowembed line ring benz lot bumper enter check diamond gold boulevard mile mean call friend new start mercedes brand message burn license everybody plate saturday car rubber set operator chillin superstar westside look cruise fast dancing scene room groove comin kiss dance arrive flashy wait party style night connection beat pump
Gimme The Light ; Sean Paul;Gimme The Light by Sean Paul.txt;bout gots move rider deny dem inspector live really sean paul turn center yo cause anotha clyder wreck buff gwan ya catch player nah gyaldem light moet flow pass lookin situation wide part hang every protector three watchie mi dro connivers sight around jus girl five inside everyman fi liar grill lecture collector bokkle tire money nuff sweat knowembed could bus especially two hype sector vibe beside friar bride open spiderman injector infector disease ah never guy four inna affect dough fuel gim hider power drill try gyal
Girl Talk ; TLC;Girl Talk by TLC.txt;happy doin right damn em bar sexual star tongue think big need give mini-me eye finally really yes stem last woman put killin cause little game bean worth good line forget stick ya catch pop us pinky work feelin lick tame lookin talk way hand brother poke call hangin joke blood thinkin fit new nobody fact truth swang woah earn thing co-signin bat girl want uh alcohol rock short booty word tlc hurtin spreadin glove tryin austin listen approach papi ear kick remember everything girls holla hurt plain yea sex pas talkin gucci switch leave business face straight foot boat swingin foolin power feeling meet sideline small man mad home spill
Girlfriend ; N Sync;Girlfriend by N Sync.txt;right even damn pay whole alive joey girlfriend idea star mmmh break name eye stand world shin hide good clear run care nah saw real baby would mean fair friend heart middle hear walk around thing chris girl side attention girlfriendembed mama smile search ever feel without justin sure end shield since listen could place everything show love mind lance life ah jc ease hey sing face night nothing cry stride man think treat
Girls Girls Girls ; JAY-Z;Girls Girls Girls by JAY-Z.txt;early doin right jigga fry sell damn coupe extra derek shut deuce-zeroes belle curry naked tie thorough need throw act give paranoid young number tour paper buy chinese fix yo put club new-school chief destruction problem flier date hide good hypochondriac scar tight forget mirror broke seat-back reeboks ya deuce-zeros spanish care twist e pop pill ouch catch dead real pollo baby neck cherie momento r-e-s-p-e-c-t mile rap half would fat part bigalow mean murphy call peru excuse indian fufu appetite rough red seat hov heart tae jay-z shit head je plus squaw ask gun blue stay start walk wrong ms. tribe beef mileage thing time whip twelve sleep girl snap scoop want always across weed-head chick french hell sit cabron immature plate slow cousin model cook black narc roll african clean mami wear tantrum listen course merci dot amour goddamn house con uh-huh look animal million narcoleptic sniff show girls love fine holla crazy fly quick scene ho un kiss couple drug finger toss chica talkin chicken crepe lots-a-dough project introduce stewardess never custom maricon first-class leave skull arroz deuce thick bootleg tu daddy dollar party back pillow play scrape public frequent high roam floor keep treat many girlsembed better adore dress rice day tempo bo man fuck makin meet globe feather eddie think home hair
Give It To Her ; Tanto Metro;Give It To Her by Tanto Metro.txt;whole weh need deh give dem heap devonte yo stamen buck good run dig hard pose tackle dimmy mini nah work rev real bed request fat metro slimmy skirt ignore mi figurine old ask free ram shift huh want engine hackle uh pm short eh fi hardcore philly please tire lee nuff wha wear listen could ware score away ganga love bwoy yah soil bruk bore never hey wait sing boy rim full pon promotion keep floor gim tanto service singer man galang hesitate billy itembed gyal
God Bless America ; Daniel Rodriguez;God Bless America by Daniel Rodriguez.txt;right swear stand music international white voice use far america mountain secure reserve god renew us fund light fair foam guide raise land free sea allegiance prairie across grateful ocean solemn assign sweet administrative permission trustee bless prayer irving beside love berlin storm companyyou cloud control night copyright gather home
God Bless The USA ; Lee Greenwood;God Bless The USA by Lee Greenwood.txt;least right star give usayou wife stand live l.a freedom cause proud shin forget gladly god lake work today men defend every next heart new lucky land free start sea wo thing time tomorrow across pride still tennessee die thank away bless doubt american love usa york plain life hill u.s.a. minnesota houston flag texas detroit child
Gone ; N Sync;Gone by N Sync.txt;right something ago wish maybe need apart act wishing slowly alone turn cold insane baby pass way hang strange every excuse heart fact strong truth walk wo find around thing time long girl want best sit still word without please goin could blind away drive remember love crazy mind guess life remain miss leave hey thousand face seem touch day man try change home
Good Morning Beautiful ; Steve Holy;Good Morning Beautiful by Steve Holy.txt;open care girl rain always side wonderful light sun worry eye never dawn sweet since cause beautiful face night could morning outside shines day-ay mine good along day reason mmm
Good Times ; Styles UNCERTAIN;Good Times by Styles UNCERTAIN.txt;happy right clock fool curl participate march ten sporting live turn timesembed put skate little quarter drag good shell care ponytail jitterbug cut stress half behind friend rug fate new rumor late wo time girl together want tomorrow best settle strife less end toys state roller cute mind life leave wait boy clam jive keep silly day must makin hesitate change think
Good;e by Jagged Edge;Goodbye by Jagged Edge.txt;rather right stuff bye-bye alright need la-la-la-la-la-la woah-woah stand really oh-oh-oh last window babe share world hide good hard crackin bad real baby sorry situation goodbye thinkin nobody woah wrong reason thing girl always best side somebody uh inside ever oh-woah wonder oh-oh-oh-ohembed feel erase learn deep could place look la-la-la everything love else sometimes oh-oh hurt life never thinking oh-oh-oh-oh night pack another cry may try ta think bye
Good;e To You by Michelle Branch;Goodbye To You by Michelle Branch.txt;right star closin fall whoa eye live chase last thought starembed givin hold light pass behind shooting three goodbye hearin old start form thing time want lose still word feel without year countin deep lie blind away place searchin everything love pretend hurt tear believe nothin awake startin seem mine cry day soul try think
Gossip Folks ; Missy Misdemeanor Elliott;Gossip Folks by Missy Misdemeanor Elliott.txt;right bout j.j. coke jump sound live really club world broke buff ya care pop stomach calm bedbug bad real rap izzinembed college timmay plilzay string kitchen plastic nobody michael rumor walk seven izzall izzo girl plan folk waitin bite missy loud milli sniff fur fast skrrt microphone kizzay mind life bass va dollar phone tryna feather ta home even pay fool eat chickenheads outa coast fad cent bird give stand alone ridin later elliott curb hilzzoo line pose scar cracker stop rotten trina shorty hold la grippin toast cotton soggy cow dilzutch mamajama block around breast amigo sillzome hit core year lift jackson roll please park marry could ahh kill cillzan finish cd puma grind mostly looky tim business party straight lap upon boast fuck hi tuck shit gator poor need bale pull im yahh yes turn millze little zebra shirt glidin clear run okay stickin brillzing light headache cut baby way hangin gettin gossipin nigga head ten-and-a-half smack goddammit wilzzo-izzo-zee huh stuntin lose still respect monkey hop drivin tumor job love twenty piece lezzy talkin never leave pregnant thousand hoe report adios gap mad think heard sell damn burberry move break name gossip nizzow payless album yo wannabe radio pick hard wizzee bitch lot tight snare fuckin swamp brag week prowl talk speak hand motherfucker sprayed three goh cologne next devise ask izzin hear start wo time whip chris vanilli smellin uh step dilzzouble ludacris tonight burnt clothes gizzirl booth house rizzight knowin fly chrome drum boy fifty high hat dark horn day pump weight
Got Ur Self A ; Nas UNCERTAIN;Got Ur Self A by Nas UNCERTAIN.txt;tattoo chu coupe appearances cup whole bloody cris shook ice outcome ya move throw corner wrist haul boxster dodge watchin stand live really brain-getter s-i-r hope limp fix album yo put porsche thought hood world top jewel tennis good wake record line blast store anything low famous interview judas front stick twister chain god hearse africa player vodka rag rich lingerie shoulder saw pad light collection sip professional real cut flow football pant pass ur bizkit rap behind would part huddle call every war first though ill lame wrath glist bridge blue gun team soldier sick happy-go-lucky son block rest beef soft gangsta time hospital shift pablo level quarterback want across best uh tooth everybody step kid rock plenty leg-spreader livin still pac barber word nasdaq slow belly chipped hit hardcore bunch feel bos escobar year black child ripper mornin field throwin killer cop crown sawed-off die could qb papi n shop guest puffin await look petey hop keepin biggie death quick tear life struggle lyricist bravehearted savior sambos shoe never return nas automatic barrel enemy apparel floss back prince golden tropical gunembed dough many mine nascar watch beat question source dress righteous self must preciseness true soul try chip think hair
Gots Ta Be ; B2K;Gots Ta Be by B2K.txt;right damn eat easy flaunt b need gots omarion stranger whatever raz anybody serve stand put cause hate good sister run recieve anything ring forget fizz lot mother change check father bad manage half talk almost way hand brother call fate relationship nobody fact fight walk thing time long huh girl nerve want always somebody door past still plate lil promise feel sure waitin listen j rally sad everything yeahembed cuss love boog deserve already mind life believe never whatevers regret meet man true ta mad understand
