title;artist;lyrics;filename
I Was Made For Dancin;Leif Garrett;long day lyricsyou like floor face night all-all-all oh ah-hah get 's see dancin' hard might dancin 're love go rollin two dream feel also 'll tear likeembed turnin tell want yeah nowhere crazy wheel make find spend 've move round time take road phase everytime;I Was Made For Dancin by Leif Garrett.txt
I Was Made For Lovin You;KISS;eye like magic oh something true get 's mmm see might darkness 're lay getembed 'cause girl lyric baby wan enough ca also much wild gon come yeah drive na lovin tonight give make foot ha n't feel;I Was Made For Lovin You by KISS.txt
I Will Be In Love With You;Livingston Taylor;long day others way smile brings finally sweet live soften see know become hard might darling one gentle love million soft two word understand also ask gentleness lyricsi say 'll much hear youyou likeembed come look hand ever someone strong need 've n't pour take survive lonesome alive;I Will Be In Love With You by Livingston Taylor.txt
I Will Survive;Gloria Gaynor;strength crumble face hold grow high side hard turn heart leave love go lay try second 'll apart yeah life lovin someone give 've head alive welcome back oh get think know stupid one die surviveembed 'cause afraid lyric anymore free felt without broken little expect find make save sorry long key mend fall live first see might petrify around person change sad also wrong break upon yes kept strong spend chain survive somebody 'm along use like droppin night learn new tryin 's lock cry still thinkin 're never spent could feel door many hey walk much bother look stay hurt space 'd well n't take goodbye piece;I Will Survive by Gloria Gaynor.txt
Id Rather Leave While Im In Love;Rita Coolidge;'m believe vine rise best oh get 's mine fantasy keep see pretend end might heart leave still die love never chance dream word go loveyou lyric also baby usually many id ca meaning 'll say likeembed gon break want na hurt im find rather need 'd time 've n't take carry goodbye wake somebody;Id Rather Leave While Im In Love by Rita Coolidge.txt
If I Said You Have A Beautiful Body Would You Hold It Against Me;Bellamy Brothers;hold shine flow love lot say come daddy question bright would rain know die lyric sky always thirst mind angel weather make `` fall embed might coast soft beautiful also devil treat sun tell body na crazy tonight swear talk really window like night 's '' quench could friend wan ask small n't;If I Said You Have A Beautiful Body Would You Hold It Against Me by Bellamy Brothers.txt
If You Cant Give Me Love;Suzi Quatro;cant something hide beauty chance love go try unbounded say else surround breath let give 've discoteque away old oh likeso know one feeling ca drive mind find make need saw ai eye king honey may wait see embed might advance hesitate glance lookin called man also touch ready na though hello swear maybe really lyricswell intend somebody aristocrat floor fashion 's dance could enough baby wan thing ask meaning look stay stand 'd well n't take;If You Cant Give Me Love by Suzi Quatro.txt
If You Remember Me;Chris Thompson;eye remember shin believe way oh blame 's keep see smiling know might tho cry hope go love realize even try also lie many thing ca 'll likeembed youyou come want promise look 'd time n't lyricswhen wherever saw;If You Remember Me by Chris Thompson.txt
If You Want It;Niteflyte;whoa face woah ta love try say 'll yeah life ever time people ooh back smile soul oh game get think know meet feeling lyric likeembed everything fate saw long believe beside wait might pretty wit matter girl also part place way anything magic 's affect deep ityou could feel baby thing hey much want inside n't take;If You Want It by Niteflyte.txt
Ill Come Running;Livingston Taylor UNCERTAIN;day 'm window light ah-hah sailor wait see might somewhere oh-oh play one run 're rest dream pull gate shoe change lyric ill door moon also 'll waste sit gon youryou watch come want wander place na corner patiently find garden season silhouette likeembed tie solitaire;Ill Come Running by Livingston Taylor UNCERTAIN.txt
Ill Know Her When I See Her;Cooper Brothers Band;hoe face seethe judge call lot rap mrs. carpet overdue 'll coke throw shit wheatie ever laugh plastic mentally give invent bastard mic accept mother finish race cooter midget get kill think rapocalyptic guy severance one squeeze order fill ca papa's dick operation stop pitch uh spirit scar rather boring burger edible poppin finna patient first clutch german family truth slit show ill wrong reminiscent stick ya cab tree waste action fee positive friendship everyday asthma yes produce cause expose spittin cue bet like president molly line droppin whiskey attend sneak 'em fan end limited moon ask write badder drop student interested reason 'd pass wrist sweatin passion assessment keep gas dyke skeeting saginaw death leave decide half laptop say supper powerful lactate atleast forgiveness nude o'neal classic dilate school writtens couple head shower raul flavor back fool within letter boppers spotify stab seditave napkin task pas start likeembed heaven respond free less beat step without 'prolly larry gut act munchkin prolly pedal live introduce room see biohazardous- bean shittin' wit two permit nap number residence betsy beg abundance problem razor place surprisingly tattoo sobbin swear maybe imagine butt ring hour peasant breakup scrooge pupil hooter mattress ya' magic brain hitlist tenant ringtone hop format punch bathroom celebration poker tape happen hey spinach sit business lead corner cut billy big afternoon n't cake take various pencil christmas ten name seperate hide stomach plate go spazzing psycho rep rent habit verse ride drag difficult cootie adrian 've sniffin hack flabbergast booth nipple low bed witness fucker fact listening box pardon three graduation baboon fuck ftp medical trained crotch groupie tissue cower increase split favorite tasty lose division wear movie ai label till prove laughable tag bury spring pack wait might extension massive debt gasp charter girl sad mad ruin id touch boy cock pot-chips oven part actually dad last base really huntin neck record repent semen setting naked music poopy hideous dude extra making bad chattanooga 're never could thing cd cat chew look stain mask spasm shave attack optimistic send erase rabid flat father livid cable station masturbatin beavis tho date class skin red titty second stoppin dreaming accuse flip droopy swap crack let teeny intimate wipe listen boob satan paragraph excuse put doobie terrible gagged sister profit know birth forth shrooms lyric wonder fable momma vision -chemicals drive sure heard rack common sack need brother jordan cowubunga pessimistic penis bust pre-show bad-breath train thought car tan also pain table invitation city body grab vibing 'm pop monkey pastor slap confetti 's sue tubes behind past breaking already read bun miley song guess miss philly peek script nut bitch bag steak kick minute size throb underground move screw grin picture piece;Ill Know Her When I See Her by Cooper Brothers Band.txt
Ill Never Love This Way Again;Dionne Warwick;remember way back fool hold good something true since fantasy 's keep know might turn one love never go onyou lyric ill also yesterday sorrow 'll else likeembed come look inside ever stand memory wo make find 've lose n't tomorrow take reach away head;Ill Never Love This Way Again by Dionne Warwick.txt
Ill Supply The Love;Toto;lyricsyou supply night tender must first see fourteen might horseman turn meet love loveyou persuasion could girl ill baby also wonder sky 'll likeembed hear come life dark reason make save season last across occasion changin sea old;Ill Supply The Love by Toto.txt
Im Every Woman;Chaka Khan;woman compare love 'll child come ... 've instantly cast old put anytime good rain braggin plenty get know appear one 'cause lyric ca fire aah secret shall mh-mh-mh mind uh im make need womanembed ai naturally might thought right also spell brew tell mix danger na rhyme cause really seed 'm like whoah anything confusion 'em fashion 's sense z read feel baby wan ask special bother want inside every n't fear;Im Every Woman by Chaka Khan.txt
Im Gonna Make You Love Me;The Blend;flow love lay devotion 'll come yeah time ah dry describe ocean lover get 'cross bend pretend year mean million dream lyric discover sens ca gon little im make pillow lose long eye least river hair might right girl also beginning great sad na stare talk sea hour pinch 'm like glory 's end yearsembed 're never word could friend baby black tear world tumble want perfect together stay big n't;Im Gonna Make You Love Me by The Blend.txt
Im Not Gonna Cry Anymore;Nancy Brooks UNCERTAIN;'m believe best fuss bad might hard around turn cry heart jilt right anymore door friend try also treat walk jack tear 'll gon say likeembed want yeah na fight im make ... well 've sorry close piece lyricswell goodbye;Im Not Gonna Cry Anymore by Nancy Brooks UNCERTAIN.txt
Im So Anxious;Southside Johnny;something late keep hard leave run bill quick satisfy developer say come throw pick vacation florida television drag time 've people pay get know one lyric phone beckons always southside anxious im need worry ascapembed rush react insomniac might detergent worrying tan also sell pontiac undertow wo stimulate talk record 'm line music b. backwash condition 's behind 're never motor likei want n't music/marilyn-kristi pressure;Im So Anxious by Southside Johnny.txt
In The Bush;Musique;like jump bush oh woah must get 's know might none mean 'bout could also baby thing lyricsi say ready come want peace part mind yeah sometimes let find time push bushembed likein ooh kinda;In The Bush by Musique.txt
In The Midnight Hour;Samantha Sang;eye 'm hold oh shine 's twinkle wait see know might around nobody play one 're love girl also baby wan thing lyricsi else say gon tumble likei come tell yeah alright begin na yes til star time hourembed really take midnight arm hour;In The Midnight Hour by Samantha Sang.txt
In The Navy;Village People;study submarine recruit dive play sport skin team come fast begin search people young mother watchin navy put oh good goodness get meet treasure 'bout dream lyric enter afraid sign ca today always gon grandstand sure mind protect find make need science worry adventure true seasick wait see pleasure seven might land hesitate water man also sail recruiting ease na yes fellow maybe sea others like 'm motherland technology oceanography learn new seaman 're bold even thing hey standembed sit world fly want look hand stand office join big n't band tv bout;In The Navy by Village People.txt
In The Stone;Earth Wind;strength tall light keep alone heart experience love provide say 'll wander come yeah stone life question ever time people old witness soul folk get know meet conscious unlock lie lyricsi free mind doubt find bringing forever believe key true sing embed might darling truth man also great touch claim sleep strong passing home day shin learn likenever .... deep past 're never song friend meaning walk world write inside stand spark every take;In The Stone by Earth Wind.txt
In Thee;Blue Oyster Cult;arab thoughtlessly sweet snow love us go wrap loser travel wish cold say win 'll come breath give pride tomorrow destiny back oh breathe thee winter solitude pure dream lyric fill likeembed hot drive without stranger make surrender star wont fall air roll see everyone might also ill jim city aeroplane tonight atmosphere cause maybe arm ticket along detroit deliver still easily could indifferently baby dice much theeyou buy distance well;In Thee by Blue Oyster Cult.txt
Instant Replay;Dan Hartman;whoa keep woo heart love us doo lip win say let time 've ah ooh moonlight oh good get real know one dream lyric fire ca everything heaven aaah stop find star need float eye instant key replay loveembed set pleasure might around also show touch likewell ooh-ooh strong cause 'm way magic doo-ooh must 's cloud dance feel enough baby eeya happy special shining look stand every move n't;Instant Replay by Dan Hartman.txt
Is She Really Going Out With Him;Joe Jackson;woman something go street married dead cold say come 've coffee listen head kill get real know gorilla smooth mean deceive 'cause lyric fill gon kid aroundembed star mark engage eye boyfriend lady hair count might proof around pretty man also wrong tell scene na party tonight home really window 'm use like night new 's could hey walk much jeanie look hand wash n't take;Is She Really Going Out With Him by Joe Jackson.txt
It Hurts So Bad;Kim Carnes;whoa ta keep alone heart love go try lot say let laugh memory casual lyricswhen haunt old fool oh get know pretend mean 'cause ca cover plan nonchalant obsess badembed act might likeoh possess goin also ya na yes spend really 'm night 's tryin bad can't 're never friend wan thing want hurt well n't steal;It Hurts So Bad by Kim Carnes.txt
It Must Be Love;Alton McClain;whoa lyricsmust hold something woo heart love yeah life ... round ah listen ooh eee race oh get know cool likeembed felt sure beat lose eye glowin might goin mystify girl also touch surprise catch talk like open must .... never baby happen hey bring look upside ooh-wee move talkin bout;It Must Be Love by Alton McClain.txt
Its A Disco Night (Rock Dont Stop);The Isley Brothers;rockin'you thumpin' dancin' shoe fun yeah everybody lyricsbaby let give 've ooh rockin oh havin somethin' rockin' know one dancin ca likeembed gon stop find lose happenin long might lookin gettin girl also action place na disco dont music night new 's tryin rock 're baby wan thing hey kick well n't;Its A Disco Night (Rock Dont Stop) by The Isley Brothers.txt
Its All I Can Do;The Cars;lyricsone rendition like night finally something likeit doembed new flirt shadow grow 's think keep wait judge get might saturday one holiday go gate dream fell great romance many soon also cancel want come nowhere crazy protect hurt nothing wing twist time n't wall flight moment;Its All I Can Do by The Cars.txt
Ive Got The Next Dance;Deniece Williams;hold flow love go fun try cheer hook 'll say yeah clear near let lovin fit ... give time 've young slip reach put smile soul oh get mine think know one meet 'cause feeling lyricsi plan gon free nothing movement make next saw forever style ive since wait might truth 'til man right steadyembed also drink ready tell place na yes tonight really 'm floor like way night new 's hop still rock 're dance feel door baby wan thing sit walk watch likei alright hand 'd well n't take moment;Ive Got The Next Dance by Deniece Williams.txt
Ive Never Been In Love;Suzi Quatro;hurricane lyricsoh name love go strike bound say come life ever laugh give ... mile 've doctor away twiceembed put oh good would get know 'cause ca everything hot gon matchhead foot need lose ive may damn scream see crazed might ground also break ready tell shout na likewell chain really lightening day 'm like second-hand 's cloud blasted never miss fly much write want revelation well luck n't send take;Ive Never Been In Love by Suzi Quatro.txt
Jane;Jefferson Starship;name ta call hide keep hard play love go fun say win 'll yeah janey jane let time 've away lyricsjane seek fool oh good game get real know pretend likeembed make house mouse plain believe see might girl also yes spend talk like 'm night 's 're never feel baby door hey ask cat together stay n't;Jane by Jefferson Starship.txt
Just Another Night;Ian Hunter;face grow side hotel chance go craze lot plead saw-bones say yeah life reefer let easy give head old chair slow papa oh folk get think chrome die one stupid pull bell jail lyric gon kid joe felt spoutin bleed wreck 'n make `` ai long hang hair room embed ian might man also shade touch boy madnessput body na fortune downstairs spend league ronson 'm like line night hunter/mick 's bad rock '' hell never noodle poor dance intrigue baby wan black hey roller likei 'd well another n't fuzz doa take;Just Another Night by Ian Hunter.txt
Just One Look;Linda Ronstadt;'m nothin' oh woah good mine get 's think keep see know might hard around one 'til love scheme dream feel fell also wrong baby hey say always 'll likejust gon world come yeah look na without build care find make lyricsjust really take ah someday babyembed forever;Just One Look by Linda Ronstadt.txt
Just The Same Way;Journey;day like key way fine night oh hold good morning get 's timing might leave chance never go love 're right squeeze girl lyric feeling also likeembed fly come want yeah free mind ooo life stay wo 've every n't take away midnight yesterday;Just The Same Way by Journey.txt
Just When I Needed You Most;Randy VanWarmer;window lyricsyou like way comfort oh would something rain morning letter pack think know might leave one love 'cause also door miss say 'll likeembed write yeah god without stand stare find need star struggle 'd every n't 've mostyou send close;Just When I Needed You Most by Randy VanWarmer.txt
Keep On Dancin;Garys Gang;like music get high keep dancin' might dancin love dance feeling baby wan also touch say fly likedance lyricsooh body danceembed na romancin' tonight make funky n't move maybe really ah ooh;Keep On Dancin by Garys Gang.txt
Keep On Running Away;Lazy Racer;full distraction something keep fake death run go say 'll shit life breath contracting easy filibuster away list put race get real motivated know stretch one 'cause guest ca lyricsi today always likeembed living stop expect find help react reflex might around also waste youyou na stumble turning really trip thirty hypocritical 'm way anything learn remotely 's even feel lazy wan sit much burning n't plus moment;Keep On Running Away by Lazy Racer.txt
Killer Cut;Charlie;something ta electric pearl keep hard turn play say 'll hit time listen forty success blame get men think real one start art likeembed mind burn star need fame worldyou best roll might killer lyricsthomas right change money also tell radio company na learning remind record road day music night learn 's bit still rock short 're song wan thing guitar top world write buy cut well every n't steal;Killer Cut by Charlie.txt
Kiss In The Dark;Pink Lady;eye window like 'm long fall twinkle room know see might play 're run go start lip lyric soon try lie afraid also likeembed everything hear gon ready come tell lead na type kiss dark thru find lieyou kind 've time across away saw old;Kiss In The Dark by Pink Lady.txt
Knock On Wood;Amii Stewart;like 'm way good frighten get 's think know see might embed surely chance love mean burstin 'cause enough lyric lot lightning thing baby superstitious ya ca secret touch much want wood spinnin yes also thunder well n't lose knock trance take ooh feel;Knock On Wood by Amii Stewart.txt
Ladies Night;Kool;light name hollywood alrightembed sophisticated york come yeah everywhere let 've ooh oh good get one noise dream feeling lyric everything hear gon step uh fulfill single mama ai huh lady see might right girl also boy y'all celebrate na party yes tonight steppin disco like night new 's mmm romantic baby special alright stay well n't;Ladies Night by Kool.txt
Lady;Little River Band;heart play love go cold say come let lyricslook time oh think winter know 'cause cool likeembed gon mind make need long best lady bear answer might around rest also somehow part na maybe fair like 'm floor 's thinkin 're never ago dance feel song wan thing want look warm n't doyou take;Lady by Little River Band.txt
Lady Writer;Dire Straits;name face beauty call rich leave dead come yeah command fit writer time old mother oh get think grace know virgin lyric felt hardly lady hair fall embed might around quality man also singer book ringer place mary yes remind talk like 'm use way brain expectation never read recall jazz could fell write want look 'd another n't plus take tv picture history;Lady Writer by Dire Straits.txt
Last Of The Singing Cowboys;The Marshall Tucker Band;woman ay blind tough singing ole hollywood yo say win 'll child come laugh bar aye tune brag playin fine back folk chug know west one three yi million 'cause likeembed hear spirit cowboy make star wear `` publisher western lyricsin lady since cow room see might show silver also war joy ridin wild break audience tell grab last maybe buckle arm hour bet like 'm way music cowboys learn hat 's stinson 're singin '' bartender song yippie door beer sit ye corner wonderin inspiration dark holler texas 'd n't take c'mon;Last Of The Singing Cowboys by The Marshall Tucker Band.txt
Last Train To London;Electric Light Orchestra;turn play leave love street go share else everybody tonightembed let time 've away head back know london one realize lyric sky fire stop felt nothing burn town forever eye rush air train might around right also sun city na tonight last really hour like line music night must underneath still could feel wan starry world want look stay stand big n't;Last Train To London by Electric Light Orchestra.txt
Lay It On The Line;Triumph;hold late lyricsit turn love chorusyou lay story ever time 've tire chorus old playin fine foolish game lover mine get think makin know lie likeembed make true precious wait might truth insane right girl also waste na wo talk 'm line 's never could friend wan ask much unkind another n't better;Lay It On The Line by Triumph.txt
Lazy Eyes;TMG;likejoin heart lay vacancy yeah ever drag eat forget know one lyricsthey 'cause little make need forever eye weak patient might thinking money also mental ahh last trip really 'm new still cigarette 're lazy ask much want together look buy ahhembed join well n't take goodbye;Lazy Eyes by TMG.txt
Le Freak;Chic;chic call le us craze fun savoy try 'll say come ride stompin time young ah listen head old oh good rhythm get real told amaze one freak lyric hear sure find `` check everyone outembed might around show sell also joy spin rhyme day 'm along like floor way night new 's surely 're '' dance feel allow spot c'est big pressure;Le Freak by Chic.txt
Lead Me On;Maxine Nightingale;tease heart leave play love go say 'll come throw exactly someone give time away fool would good game lover real know pretend seem start anymore ca lyricsi always likeembed hear broken nothing rather need long might right change also youyou tell part maybe 'm like anything night 's still never feel friend baby anyone world want lead 'd n't often;Lead Me On by Maxine Nightingale.txt
Let Me Know (I Have A Right);Gloria Gaynor;blind face polite follow turn heart leave love us try say 'll lately win empty yeah life breath let peck someone 've ooh listen important bed back oh good get forget makin know one mean dream instead hug ca warmth lyricsi likeembed plan hot mind little make kind lose till might right sad also touch tell yes heartbeat like 'm way night new 's bad behind still 're livin word feel thing politeyou fight minute stand n't future take;Let Me Know (I Have A Right) by Gloria Gaynor.txt
