title;artist;filename;lyrics
Like This ; Kelly Rowland;Like This by Kelly Rowland.txt;right thisembed ago dudes stressin mad big whatever throw give name jump sound live standin turn hope month put club cause use game good satellite bottle rendezvous gentleman ring forget lot drama lyrics info pain bump stop ya trust pop suppose bold us near light partner feelin real stress lookin invite talk lady hand call home three bounce hopin though thinkin head strong late hear wo bullshit around thing time girl want best chick confident door second word hit slow feel .. tonight spare please mention scratch goin sayin could knock look jealous dude close e-v-e entice personal show love quick breath excited comin seein chicks life anthem leave bring ladies mouth kelly wit vibratin back boy night another dough bowin keep watch blow beat lovin choose spot change think
Like This ; Mims;Like This by Mims.txt;case shawn balboa thisembed probably cup monea alright tone need shortie throw ten somethin act break wrist number really club hate little shirt top shine zone pick drop good shake ring low front ya care song baller pop shorty us hold g bad real baby way mean motherfucker call hundred bread rough homey upside though head download palm smack -- wo fresh either breast grab waist long girl lawyer want side uh worry pole lil slow whisper grand ear crib ground show love nino sky fly scene dance rocky hot back night high gino knot floor keep safe watch gim dom touch blow beat phone ta
Like Youll Never See Me Again ; Alicia Keys;Like Youll Never See Me Again by Alicia Keys.txt;wish granted really last present thankful wake run forget gift hold youll baby would every lord guarantee find time long want lose promise feel cherish could morning look everything beside love kiss grant never leave another many may touch day ohembed
Lip Gloss ; Lil Mama;Lip Gloss by Lil Mama.txt;gurl hazel probably brush bet think fall dey corner anybody im rubbin cai eye bubblegum zay yankee whack really standin music ridin chase yes admit usin put cheap upgrade club use wrap top worth drop eighth good trouble record mac run okay hard spit ya loudspeaker gloss work cap flow spice dont way speak droppin hand call wipe new rollin locker ask walk corny rest reason hallway thing whatchu time huh girl clap sittin office uh mama step ms rock flavas luscious still lil wat-ballermelon n-uh fault mac-mac hello write vanilla schoolembed perfect peace could n dunno mcclarkson crush poppin swag show beside love chedda jockin york already dean double ah melon nice lip period mouth school chea hot official da yep boy homies pink universal play keep lunch flavor lovin label virtue ben cool must ta cherry hair
Lips Of An Angel ; Hinder;Lips Of An Angel by Hinder.txt;right dreamt funny wish move clue name sound really yes voice angel good okay hard honey talk weak goodbye next hearin late fight callin hear start cryin girl word tonight kinda whisper faithful sweet sayin loud everything sometimes room comin guess lip talkin never ta think
Lips Of An Angel ; Jack Ingram;Lips Of An Angel by Jack Ingram.txt;right dreamt funny wish likei move clue name sound really yes cause voice angel lyricshoney good okay hard honey hearing angelembed talk weak call goodbye next late fight hear start -- girl want word tonight kinda whisper faithful sweet loud everything sometimes room guess lip interlude instrumental never cry ta think
Listen ; Beyonce UNCERTAIN;Listen by Beyonce UNCERTAIN.txt;even something least wish aisle need ricky move yee teach name malcolm sean turn last angel ex taught thankful good handle drama pain god song fuckin hold yeeembed bad someone real grow much almost hand amaze friend discussion next smash plus amazing havin walk find time mama lose patience worry grateful search write end forbid married learn u listen could thank look love else fast happen dad ari translationsturkcesvenskaespanolportuguespolskideutschfrancaisnederlandsthank match pete spend meet day think laugh shit
Little Bit Of Life ; Craig Morgan;Little Bit Of Life by Craig Morgan.txt;doin snuggle truck cup eat alright chime yee bit yes supper window dixie little radio swing lifeembed bean farm couch guitar backseat suppose work light spice porch sugar sleepin hound tractor tv luck cornfield head stirin coffee around long smellin ding pie mornin haw goin bite dog house moon drink slice pot boom popcorn crank breath alomode life nice nasty bring barn bacon hay back town night homemade play ling wind lovin day table pale wine home
Little Wonders ; Rob Thomas;Little Wonders by Rob Thomas.txt;right need fall really turn hour little shine wash trouble hard forget twist shoulder behind way part till define clarity fate heart matter around slide time somehow still wonder remainembed feel roll end away remember mind life remain regret small
Livin Our Love Song ; Jason Michael Carroll;Livin Our Love Song by Jason Michael Carroll.txt;something lyricsbaby ago fairy darling star badly need move sound stand live far spotlight good hard exist song us work eyed shatter baby grow people talk would way reminisce shaking hand knees teary heart stay strong blue wrong sea chorus thing time girl want across lose livin still songyou feel without fallin year princess tale moon look doubt everything love fast room believe dance never backwoods lay back boy night many dream beat pretty man arm prove think hair
Long Trip Alone ; Dierks Bentley;Long Trip Alone by Dierks Bentley.txt;right stumble maybe need aloneyou really alone road little travel sand us hold sun hand along walk rest find afford moment time long everybody smile short feel without peace somewhere lie could snow beside sometimes mind piece pas enough beneath hallelujah must trip home
Look After You ; The Fray;Look After You by The Fray.txt;lean break assuredly city hold spin baby heart start wo around steady always lose ever slow feel surely urgency begin look separate doubt love never leave wait forgive count control mine ohembed hurry home
Lost ; Faith Hill;Lost by Faith Hill.txt;obvious scream fall hope race far wake anything losin hold someone real way mean every heart stay youembed free bein walk start fear linger find thing time long always inside lose feel without likedo erase lyricsis rush defy end everywhere could deeply away stare everything love fast gravity room finger believe forever enough never completely face control dream touch power feeling mystery think
Lost In This Moment ; Big;Lost In This Moment by Big.txt;right whole aisle daughter absolute eye lyricsi momma beautiful heavenly angel song tremble talk preacher head new jesus start walk sight brand moment rose candle lose bow word feel tonight lift please sweet draw jasmine look consume bless doubt love seal tear kiss wonderful life veil yeahyou wait floatin daddy knee completely dream watch air feeling true smell
Lost One ; Jay-Z;Lost One by Jay-Z.txt;heard even role probably girlfriend fame b maybe partly twenty-three give serve eye beverage finally divorce buy put cause beautiful j-lo share dis little restart mature run okay restore forget famous bitch mirror change interest playin reserve burden army pain song rothstein gift child-like work win bad real allow sorry much almost would way part mean fair story motherfucker nauseous daze nigga friend though hov unnecessarily stay brainless strong ask free colleek havin guilty block lord belief thing time want food explain pure become uh lose still short car glow feel fault prefer child please sure end mami sayin except die could waitin faith squeeze towards place look earth honestly differ close shallow love deserve nephew champion flossin hurt drug forward guess life sam nothin return leave business shoulda pregnant wait back heroin another breathe ben day man soul try ta think shit
Lost Without U ; Robin Thicke;Lost Without U by Robin Thicke.txt;alright darling need warm break cold cause good depend stop hold sexy norwegian baby would way every darlin heart nobody stay fire hear want help lose birthday right-right feel without body roll perfect u shape morning yeahembed else love wood guy dirty touch man weight think treat
Love Like This ; Natasha Bedingfield;Love Like This by Natasha Bedingfield.txt;right thisembed glad wish apart whoa break really natasha put babe owe use wrap world far swing lonely luh-luh run hard us hold luh baby talk call strange kingston friend chair mi heart middle hear find around thing always side everybody sit rock still eh feel save year roll attitude wifey look show love kiss mind finger life ah never skrr guy leave hey school willing sing back seem high keep watch air may cool man must backyard yeah-eh try think sacrifice
Love Like Winter ; AFI;Love Like Winter by AFI.txt;beforeyou ice read turn far line mirror december barely warmth taste sugar winter every three lace blood war stay por exhale press want bear year siempre vanilla surely somewhere bite away drink warn love oh-oh yesterday lip four face seem dream sculpture trace lipstick day meet
Love Me If You Can ; Toby Keith;Love Me If You Can by Toby Keith.txt;right teach give stand turn hate homeless pray angel good necessary father us work would speak mean tv hand shotgun call every war jesus ask fight wrong son want disagree kid worry conviction word angry sure peace learn earth look agree everything love sometimes believe bring freely dollar night able debatin may man soul try think
Love Me Or Hate Me (Fk You!!!!) ; Lady Sovereign UNCERTAIN;Love Me Or Hate Me (Fk You!!!!) by Lady Sovereign UNCERTAIN.txt;rather notice right instead issue bout stupid ago tongue methodically b maybe dear serve conceal refuse road vain abroad cold homeless mask proud world shin far hide backward broke verb claim nest saw ryan energy real flow neck waitng dont would mean tv wayward strange rappin guide bounce though felt pragmatic strong ure walk deathbed haphazard chorus provide girl want pure side pride slippin climb brooklyn tueday feel keith patiently direction n institution suit spoke close secretly outsmart solstice yrs mind life defense grant believe concern supahstarrrrrrr thinking dollar supahstaahhh wino collect sense transparent phone cuz even something summarize fool problematic result insecurity fame suck cent likei void stretch give young protect point last later cause hate rep line scar contact sibling enter flippin guise hold leavin weak shooting left new kno existence free usually throughout block supastar track fear around brand hero procrastinate pronounce always peering cross static turmoiltulous inside focus word altogether please lyricskeith since lie could empty design trippin look dude whenever remember show others yet supastahh pretend print yr seduce batter vein wildchild refrain talkn seem play nothing dream cycle may power self mundane try change space tuck charismatic shit biological star read whatever insulate im fraud spittin gear foolish hope buy use ok coward sup dumb precocious store shell famous ft. prognosis fks expect baby grandparent decide half almost painful way gymnastics call expose ignore daized head heart ostracized strive funeral venture louder help become lose ever still ahhh promise pinkston apparently noise end thru jealousy mathematic emptiness closeness cower flava flagrant rented love open hurt plague lead ferocious kind path avoid never leave hopeless pragamtic lost prouder foot spend must aqueduct think mad heard maze pleasantry scream exchange route fall paranoid name admire opus yo white game filthy hard speaker front starembed pain visit nah diagnosis effort talk speak till amaze reach first confusing ask truth vicious hear protection matter possibly find rest time cloth oooh car save fk write prefer uve probability u bravery weekend two favorite possibility reputable mechanism mess scene synergy connect speachless forward hollow hv grandfather frontn tatics back unlit middleton decision fantastic dark day soul pump wild laugh
Love Song ; Sara Bareilles;Love Song by Sara Bareilles.txt;happy even convince easy minute need break underwater babe nowhere good hard song hold leavin light today way mean hand guide unusually head heart stay ask twisted hear walk seven sea wo reason thing blank huh want help word promise hello write please learn deep stare dry yeahembed love soon page room hurt believe leave heavy high sink breathe daylight try think
Love Today ; MIKA;Love Today by MIKA.txt;meembed hook something lyricsive big give carolina little shell tight mother nook aint lick carry today youve shock till cant anyway fun papa blue walk theyre lover tease long girl want kid smile begin likeeverybodys sits away fighting mamma book love everybodys tear life lip hey wait dollar papas shes cry cuz dress try bust
LoveStoned ; Justin Timberlake;LoveStoned by Justin Timberlake.txt;right even hook damn yellow swear lovestoned stone shut uncut ow ice move glare hope put cause send funk little bottle bottom stop care song light bad flash freaky way fair walk baddest find around grab thing time girl want uh hit model without tonight goin everywhere except listen could unless look fuss stare love mmm bother room dance interlude lip chance hey hot mmmm flawless town seem floor hmmmembed man trip think home
Low ; Flo Rida;Low by Flo Rida.txt;tattoo whole sexual minute gal big whoa throw give break paper turn poster woman club x cadillacs low-low-low-low-low-low-low-low strap boot problem worth drop band bottle bottom low jean handle reeboks playin legs fold stop rain pop stack hold invent shoulder work professional sexy patron baby pant lookin sorry talk would way baggy three bank expose next lucky flo smack pornography soldier cola toaster around thing girl apple want mama rock rosay booty pole hit henny lil ayy birthday rubber showin prefer roll cash mornin grand money clothes sweat cake could two million snow clover close rover drinkin vibe show love fur crazy shones fly moan flexible glock steal crack maybachs nothin ready never groan hey wait hot dollar back guap night full control bend dough hmm-mmm-mmm-mmm-mmm-mmm spendin makin shawty man ta lock think home
Lucky Man ; Montgomery Gentry;Lucky Man by Montgomery Gentry.txt;even manembed truck whole swear sunday miracle bengal give last woman put hate supper little world good mood forget god rain reel sun bad week would fair hand call brother friend new lucky old land coffee lord around brand moment time complain mama lose kid spring still rod year everyone could house look close tickin job fast oven dad piece ticker hot dollar curse back town full runnin pretty day woh man saint
Make It Rain ; Fat Joe;Make It Rain by Fat Joe.txt;even tattoo joey need brick lean dividend give name southpaw live asap paper ganja terror triple promethazine umbrella cause hate send mackin strap bro game good ha bitch chemist change calca bangin rain stack us ands shoulder sunshine n-y cut baby invite storch tony hand pusher nigga cali cr-cr-crack handful stay team hear seven buster green grab oooooowwwww customer best sippin clap beam metal everybody mama lose powder kid lil hit oww body fallin cook niggaembed roll south mami jada echo poppin love scotty reverend couple eleven pas crack life scott chyeah pour code switch anthem layin miss droughted bid yup style weed bx control full pack khaled co hoe keep dirty tryna man hustler ta mad shit
Make Me Better ; Fabolous;Make Me Better by Fabolous.txt;doin even right flame lam force star ice they-they-they-they-they-they need move push movement give anybody name dynamic woman cause hate top problem game swing good timbo pep with-with-with-without ne-yo front sag batman check stop playin ya god shorty g a-a-a-and cut baby half way every whoever first though great improve middle plus and-and-and-and-and-and holdin ask fire king soldier havin wrong find reason around thing burn giuseppes girl together side loso step oooh livin hit coretta feel takin compliment sweet to-to-to-together tryin clean mami cake could frostin parent tired hahahahahahaaha look slip whenever bless but-but-but-but swag keepin everything robin show sky fly page flossin ma-ma-ma-mami already finger guess scott nice and-and-and-and gucci never hey tim notch hot daddy boy major high ahhhhhhhhh math duo watch equal she-she-she-she bossin man trip treat
Make Some Noise ; Hannah Montana UNCERTAIN;Make Some Noise by Hannah Montana UNCERTAIN.txt;meembed right bolder pay keno bug need wing tuxedo sift give prosecco break bada number yes tax put leggo cause lethal anti-depressor injection good record election run ted drank roach check competition hawk ball catch financing perfection collection cut insurrection rap part nada mic formaldehyde every romance ego left brain friend stance lucky popular old ask danson coffee fight shelf hear wrong -- mc time burn motherfucking want lambada best uh crazy-crazy scalpel fess sip incision eagle year lift set noise fizzy-lifting less piss wha beagle drink flex riff clip doubt dino flamethrower ornithologist sniff show rhyme crazy yet fly open parlay seagull pas b-boy believe forbidden dance eggo chance bitching never ad-rock party back age sucker straight play nothing lane casino mike connection rotary dress self must arm restaurant wine ta pressure
Makes Me Wonder ; Maroon 5;Makes Me Wonder by Maroon 5.txt;even something damn goodbyeembed deal move alibi memorize give eye really anymore aftermath unsaid worth good wake forget god catch bad spin bed behind way goodbye meaning felt head truth wo reason thing time want dive ever still word wonder feel thigh lie blood-shot pleasure hurt struggle believe leave lay oh-oh-oh-oh back decision cry day difference fuck must true try
Maneater ; Nelly Furtado;Maneater by Nelly Furtado.txt;doin even thisembed scream wish move fall somethin card break jump buy maneater world nympho anything hard handle work cut real neck people talk mean ask start walk either around time long girl want side everybody door oh-ah-oh-oh-oh-ah ever car body oh-oh-oh-ah-oh sayin look love crazy passion crack ah-ah-ah-ah-ah-ah-ah never back knee boy translationsportuguesmaneater keep spend meet
Me And God ; Josh Turner;Me And God by Josh Turner.txt;early father god staff together life lean talk live rod weak forgive trod end friend godyou night angel nothing morning could pea pod nobody two world strong team late day wrong beginning rule hard
Me Enamora ; Juanes;Me Enamora by Juanes.txt;el hasta luz atravesar remolino ser enamora alma lleves leeme des solo quiero de yo tiene vuelve vidas muy sonadora cielo es despacio volando color viento bosque e le la mis blanco deseo bien vida cenizas mas mi resto sea por dia que boca en esperanza si nuestras mente ti sin tantas mano ojos hables vientoyou como los venideros compania van eleves verte cada sentido fuerte digo con aun lo un dias tenerte divide merezco hoy tu hay gustan te senda se cosas labios
Me Love ; Sean Kingston;Me Love by Sean Kingston.txt;damn beach move eye chill alone caress missin use good loveembed trust feelin baby half b-baby three chair first thinkin drown blue hear time girl want somebody sittin ocean july ayy feel year sweet two away look love kiss kind guy leave hey w-why evening day home
Misery Business ; Paramore;Misery Business by Paramore.txt;right clock easy exchange big finally refuse month top good run honey snare innocent god suppose catch translationsportuguesespanolmisery week brag pass sorry people whore involve would way hourglass mean free fire woah eight matter time long girl forgiveness want goodembed smile second ever hit feel body set wear misery lie could intention two away look million steal chance never business mouth wait tick nothing mine watch possible true dreams change wild think
Mistletoe ; Colbie Caillat;Mistletoe by Colbie Caillat.txt;alright big apart christmas fall warm break stand alone icing cold cause wrap game trouble gate hard crumbles would plastic three bread friend great ginger late hear flood thing time want lose smile bow still feel timeembed house snow slip ground rip open walkway tear wait foot play many keep safe fake small mistletoe home
Moments ; Emerson Drive;Moments by Emerson Drive.txt;right tag dug follow need ashamed bit warm pull young eye stand coat cold homeless scar care e e. sun lookin almost would way cardboard story hang shadow anyway war felt bridge old memory fire along walk son ride find around moment time long nerve always across help box second wonder bear tonight single tryin momentsembed end somewhere none could crawl earth look street summer trashcan plane halfway miss night keep wind day recognize cool man soul change think home
Money In The Bank ; Lil Scrappy;Money In The Bank by Lil Scrappy.txt;sell doin wallet extra cup bar big dem card a-town bme young paper mega buy yo scrappy club cause credit shine top run homeboy hard tat cheese amount stop fuckin shorty stack g hold bankroll lem pat baby cha-ching stompin murcielago talk way lady g-unit heat dice nigga bank bounce homey cigar country start flop find time long creep squad large box ballin step mas-sage family me-nage still lil fallin big-ass please roll money tryin tennessee throwin south killer clean paint goin outside two pro drink drive look fill show chevy love crazy morgue okay-kay-kay-kayyy drankembed couple yea account lemon-lime pullin grind project bring bentley reppin sleeve back knee weed yacht full hat jon dough knot cristal hoe keep mine dirty watch dj beat rise cool fuck shawty try shit
Money In The Bank ; Swizz Beatz;Money In The Bank by Swizz Beatz.txt;pay bar walkin easy girlfriend round bet need roselito warm pull give break number live paper fendi buy put cause hate angel far good bottle anything finna frontin ya spoil ballers song fuckin stank bag pant lookin invite mean hand call gettin clico nigga bank hopin homey affection first actin lately new quiet start protection ride shot-callers soft thing girl want best sir sittin chick uh hell niggas save money tryin brawler south jag sayin could christian dog house drinkin sad dior love open fly excited storm kind repeat talkin shoe nothin g-g-g-get enough mouth sing party back face vive girlembed d-d-d-do dress showtime man think
Money Maker ; Ludacris UNCERTAIN;Money Maker by Ludacris UNCERTAIN.txt;even right something pay whole cup original bout bet cinderblock act give break stand wet loose point paper really turn afraid momma penis center month member cause little hood pharrell top game bbc thankful good run shake bottom hard forget jean bump stop ya god givin gangster bedroom work eyembed carry lookin invite today behind distraction way mean till hand call luda left friend breaststroke next release hater stay free swim earn nose ride jet burn girl want tomorrow squad side somebody backstroke attention hell everybody rock mile-high worry renaissance erotic feel curve body frame please money maker sweat radar everywhere j.o could thank yepp dtp away look therapy deserve calorie breath pourin breadwinner hurt distract mind lesson campus stroke ready switch leave hey genius many tipsy keep air feeling ey fuck man must shit
More Than A Memory ; Garth Brooks;More Than A Memory by Garth Brooks.txt;findin alright need fall number helpin low forget lyrics god care dead beggin asleep people home hang friend head nobody memory hear find thing time hell ever word fallin prayin write forgetembed please loud picture drink sinkin look six realize drinkin drivin everything life tore smoke talkin match wait wakin knee dialin town night sink upon dream watch wall phone
Movin On ; Elliott Yamin;Movin On by Elliott Yamin.txt;right damn glad move give name sound eye stand really yes willembed consider good baby much way lady dice every friend ignore fact hear walk wo matter around thing time shame girl always help best lose door reciprocate focus slow feel roll sure learn movin look love crazy excited life chance waste miss ohh man true try think
Mr Jones ; Mike Jones;Mr Jones by Mike Jones.txt;sell even rick boss deal teeth vault asylum ice diesel rub spittin really alone music chase melo hatchback buy later album put club movie hate white steel use far ha production benz lyrics diamond gloss catch rain phantom real baby pant would way bill gang shotgun call hundred nigga friend bank hater stay strong king walk -- track ride long diss want saggin chick smile livin grill mayor car belly ross feel black roll jack except away million hahahahahaha american jones show love street ho pretend eleven myke hill never cadillac leave hey mr. thick dollar back key age boy homies town haha another mike dream hahaembed label day man fuck try home shit
Music Is My Hot Hot Sex ; CSS;Music Is My Hot Hot Sex by CSS.txt;em tem furacao debaixo girlfriend fiquei um escola faria need beach mais rub hometown eu lencol music basquete buy de bath cheirar granddaughter sim ele saindo seu sister olho bitch dizem computador e boyfriend dead farsa saia bed pebolim ia tambemyou lady brother fui claro friend great mas bateria alto king som size encostar cola mim que bemol tava podium junk tigela ate tambem dele tudo end sentir sei house favorite drink direto mistress alguns sou job gosto nao gemia nem sentada queria kiss tensa drug sex guitarra sol chegava imaginary raiar perto hot graca da lado back boy escoteira-mirim lyricsfrom touch meet bem choose ta fodao home shit
My Drink N My 2 Step ; Cassidy;My Drink N My 2 Step by Cassidy.txt;doin cup onembed stone stressin mighta big celebrate standin yo put cause two-sixes use swing braindead ring bleed swizzy rain nah hold grown dutch patron flow toast lookin people hand coulda left recreate raise lucky imitate shed wheel link aiyyo around whip trunk murder engine sittin step door kid immature still slow car crash takin year dutchie skill money sweat could booth two n drink wheelchair snow chromed show affair tear couple smoke lip lay relate pink dough husky haze blessin air beat pretty makin hustler try think home shit
