title;artist;lyrics;filename
Run Tell The People;Daniel Boone;nervous shot face political grow item call vetro hard dy turn degenerate chance love front hollywood pirate us girlfriend merry-go-round self-indulgent cocaine lot decorate win dumb ball child coke yeah cologne shit loose-fitting suck fannie-pack square much ever dune-buggy europe give tip hi unless zoom disgusting young trouble tire entire ugly complain later iron honest jewelry mother finish material rain garbage suppose get kill suddenly forget think couldnt fault lifes pasta-machines election-day guy one hyphenate meet spray mean daniel order highly ribbon athlete jack-off mall please scrimmage christ-sakes dick hear plan custer stop i-stay-home comedy little deal two-man make save star dental push ignorant report next pine dirt-bike term-limits thirsty possibly mci wendys university give-me-that explain first count viking everyone deep-sea create surrogate swell family silence rest birthday aid intelligent speaking ill baby-boomers show memorize ya tree waste book break imaginary disfigurement handshake cinnamon produce slogan anger perforate cause soybean-futures qualify bankrupt somebody day like purple characteristic make-believe line croissant needs secondary pile bezerk puncture price meanwhile course end still short motivation outfit guilt poor even radical enough self-righteous loud ask small world dozen valuable pan putz sometimes solve rogaine social drop george reason foster violence motorboat television-time color tv shallow pass election criminal card jet-ski healthy hold isnt smelly cant configuration whenever diving-bell high keep alone leave lay bill news after-shave rock-n-roll snowmobile youngster say generalize sophisticated pick yuppie-boomer-cocksuckers white jericho-fordescu support-group tainted jane care television spending church offer guilty twelve-steppers time people mythic nice parent away school bright head decision back oh stuff would game blame eat floss thank dog view mine campaign nation youre nostalgic over-board christian start jesus rodent anymore phone nature t-shirt breast improve federico cover yuppie hot module free voice beat step without planet photo-finishing dishonest enjoy jerk-me-off-fuck-you-too movement twist balloon secondly cowboy mouse mark act either law accord miracle help fairly beltone cat-house believe best wont huh tired bunch zoo air live yet castrate minor favor see theyve environmental water bullshit lewis cheese two century motivate forest change aint urinal politician dilemma drink lonely problem folks ready tell essentially place neighborhood cultural home talk maybe whoever budda-boom one-hour rv dont dear vehicle emotional pheromone lame way magic technology longer sick skill new lack elect public stake temperature windsurf mess complaint intense sober shuffle quote hope '' word narcissistic bathroom feel tape hey cunt happen black walk notion sit business reality lead lyricsnow stand theyll budda-bing wash big every portuguese technical take clerk baseboard donor nine boot incompetent dress event name ten hostility philosophy excursion delusional low-angles nose personal spread costume immediately camera actual undefeated fuckin experience outside arbys go happens theres wheres thats else victim bloodless come meaningless everybody life finger havent adoptive earring ride test whats case telephone-calling choice concerned different panda folk seriously pretentious fact men real year fellini bore three die leader scent blue-eyed cam-corders fuck abstain security jean hole store cool always difference commercial equipment superficial nothing im salad complicate house lose bottle emily wear soon long period hang abomination parking demonstrate gain arent urban ive hair zero-sum fall since cow goofy brown might fucking man right likeand highway understand doesnt id boy touch add document spin fluid wardrobe acquire docker critical pleasant lunar last halloween really trip middle-age boone nimrod baseball certificate motherfucker laid supply learn simple theyre bad 're never ago culture sneaker cent could random pair drug wind usually thing notice consistent load blue sex happy watch probably country look barrel hand stay levis system certain society blow backwards send self-esteem smell asshole dehydrate citizen unfortunate whiney woman boomer light responsible something mickey child-abuse america play masturbating run solder -it skin red fun try yo-yo cold rubber crime cam-corder sort em ass everywhere logic innocent membrane let prick selfish panty ... bar lucas haagen-dazs concept listen pay whole ruth put para-sail test-tube good okay didnt mention hard-on strange know eatable birth hang-glider stupid outmoded burn-out inform dignity pink wonder sky mystery everything button living four toys sure stopwatch twenty need go-cart vote rectal `` cage colored saw conscience besides gram necessary free-floating tex lady idea become proof around tow thinking natural pretty american mother-fucker also entirely sell laterembed pain age body rhetoric everybodys green feminist tonight close god-damn disguise figure others remember self-mutilation anything piss shelf farther must hat credit scalp lord work elevator bit genetic brand behind fat blond already announce pant baby many biological nut anyone soiled jack-offs want bring gim buy creature kick scratch exciting office presidential clark well move another stair-masters fat-ass screw cancer piece sperm-egg portable;Run Tell The People by Daniel Boone.txt
Runaway;Charlie Kulis;calculator tension mac shine zoot eyelid turn fruit chance love kelis lot wish innovator 'll peace yeah ever opps give bastard mover blasting finish hus mil get break-dancers think one smooth squeeze million scheme garda ca plan hear stop deal childhood make next town ting grease even- invest stock note mcguire stick radar meek tree na aggression nygeembed cause yard messiah like day hereafter end still poor even door knee ask smoke world clue ship risk chat daily bare ta keep leave force non-fiction story market point say diva duppy time away couple decision bunda tsb eager rice soul fool would game eat dot spit faith coalition start enter phone stress youth corn hot gon free felt release compromiser wesson crew depression re-billing help live answer see cheese tryna court money tell razor place safe-house black-hearted gyal swear catch adolescent talk raise ring coloniser brandish jump way pray brain new smith hundred operator far mash hop '' cross feel shoot tape black prayed cut bread every n't queen big knock cake take amnesia name taker sweet gang ignition g's mill street bullet go master hook apart come refill life ride baiteze 've lizzie forgive criticise assistance conquer blast real bite fuck bail club fire smarter kid lesson milkshake build nothing snitch bundesliga lose division ai long till prison fall roll wait shaker might man touch cuh add spin part jakes chocolate learn condition laser bad clip 're never hell harder much leader watch bang look system stay distance charlie creepa bombard blow nah self-esteem remix light play run try stack religion winning reefer roast impression dropping fresh police kitchen whole reh put slave good narcotics mood know metaphor return lyric today vision shaytan forbidden need `` saw bust eclipse tec conspire true become diabetes youtube t's also war pain hater pocket speak pea talker crazy malaikah close teh leash 'm block dare pop bonsam 's self-medicate bun wan miss tear bring want kick omelly gymnastics forefather move grin piece heap sound;Runaway by Charlie Kulis.txt
Sad Sweet Dreamer;Sweet Sensation;long day dreamer put night oh would aii sweet 's think know might experience one thinkin 're '' leave love man lyricssad girl song sad story miss thing ca also likewas tear blue happy tell walkin summer endless without hurt experienceembed memory strong find pillow another magazine n't `` road help;Sad Sweet Dreamer by Sweet Sensation.txt
Sadie;The Spinners;cherish sweet grow sunday turn us love story say 'll angels cotton yeah daddy life ever memory give time young school old mother sadie papa smile oh would morning eat troubled forget hurry know rare one mean seem early dream lyric fill ca today always living heaven bind without doubt need mama ai despite brandy live awhile see might around money also show boy table break funny place strong occasion dedicate like way glory learn simple lovely 's lord bad end cry past holy quite '' never sinnin' livin word candy winnin could song baby thing world load happy special bring sometimes able stand breakfast allembed 'd well n't teach;Sadie by The Spinners.txt
Sail On Sailor;The Beach Boys;crumble blunder frighten unenlightened alone try sorrow empty lying wicked life persevere marauder give feed thunder 've neptune gale-swept crust oh uninspired ocean sailorembed die rat commotion lyric feeling wonder always stop bleed wrest daughter unrelenting searing tired heartbreak sailor damn restful might unrepenting water rumble also sail caught stumble wail unsettled seldom like 'm needing shipwrecked must 's work end deep cry past never even feel sewer sighing tumble buy fight drenched seaway bread often stinging clearing fear;Sail On Sailor by The Beach Boys.txt
Sailing;Rod Stewart;like night oh far bird 'cross high cloud lord might water cry die thro lyric also sail sky say fly hear free near dark lordembed home away sea pass forever stormy;Sailing by Rod Stewart.txt
Salsoul Hustle;The Salsoul Orchestra MISSING;orchestra salsoul seem exist song hustle miss;Salsoul Hustle by The Salsoul Orchestra MISSING.txt
Same Thing It Took;The Impressions;woman sweet keep love romance lot hook say fast yeah begin life people good get forget think real tend lie loving gon lyricsthe make ai whatever count loveembed might likethe rest also y'all tell na yes strong last really remember 'm use 's work cry 're enough baby wife thing hey reason n't take;Same Thing It Took by The Impressions.txt
Sandy;The Hollies;rise light firework face quit forcin leave us love babyyou 'll say york life casino waitress ooh strand oh finally chasin lover virgin shore mean th anymore fire likeembed silly hear ought little lose july cop forever sandy bust may see set might latin girl boardwalk also boy stony hailin lyricssandy promise score speak tell scene fortune pier tonight wo last marie eden madame like shirt asbury night open new 's carnival desire behind never dance baby hey park aurora warm well n't;Sandy by The Hollies.txt
Satin Soul;Love Unlimited Orchestra MISSING;unlimited orchestra soul satin love seem exist song miss;Satin Soul by Love Unlimited Orchestra MISSING.txt
Saturday Night;Bay City Rollers;'m night soul good folk rhythm roll ta get keep wait know might i-i-i-i saturday heart date dancin rock 'til go love dance ol s-s-s-saturday show also baby lyricss-a-t-u-r-d-a-y ca thing nightembed likes-s-s-saturday ball gon tell na little let 've n't s-a-t-u-r-d-a-y got;Saturday Night by Bay City Rollers.txt
Saturday Night Special;Lynyrd Skynyrd;full trouser commence play lem cold else come yeah six people reach old creepin' creep fool oh layin good would get kill men think puttin one pull nothin start lyric unlock lie hole creeper gun twenty nothing foot make house lose either soon ai mister eye songembed might around pretty hmm two man ol right also dollar feets drink jim dump tell body na a-thinkin' bottom sea somebody like whiskey naked night 'em 's cheatin end saturday even losing poker door shoot black friend wan blue cat special barrel pistol hand buy fight lyin' 'd big n't;Saturday Night Special by Lynyrd Skynyrd.txt
School Boy Crush;AWB;name hold high heart 'll say apart care time wipe away retard fade month timeyou worth good lover kill year one stupid dream anymore phone lie likeembed hear voice eye damn wait might matter right also waste tell wo day remember 'm pray night new crush 's could feel tape thing tear sit glass minute lyricstoast tight every another n't rip schoolboy;School Boy Crush by AWB.txt
Secret Love;Freddy Fender;dreamer wonderful 'm way within hill open live high 's lyricsonce become might heart love friendly even anymore door also secret golden daffodil likeembed tell free shout impatient star last often anymoreyou soon;Secret Love by Freddy Fender.txt
Send In The Clowns;Judy Collins;clown late keep rich love mid-air ... bliss finally fault think know year one farce career lyric ca ought stop sure make lose sorry next approve entrance timing embed might around ground also usual last maybe dear line open 're pair door queer tear bother want likeis 'd well n't move send flair fear;Send In The Clowns by Judy Collins.txt
Seven Lonely Nights;Four Tops;sigh cherish hold keep turn go curtain hurting come throw final time slept coffee satisfied creep oh good morning eat die early lie hear lyricsseven rescue obey tightly pillow ai babyembed long fall ate seven might man humble right girl also stick lonely book promise week crazy wo swear pie day 'm night 's cry likeall holy cigarette baby tear happy inside certain blow n't begging mama;Seven Lonely Nights by Four Tops.txt
Sex Machine (Part I);James Brown;cornbread woman tall nothin' beep jab ta flow death play love go ah-ha-ha crime say 'll pleasingly come yeah memphis care ride lovin easy ... 've discotheque showin ah kinda low fine put super oh get mine forget think know one mean 'bout backside maceo ca machine gon rump form harm uh little biscuit make need brother worry leg lyricsyow hahaha ai glide stride long finna huh check mem bump wait see embed might bean hairy tryna also show add 'meaty ready tell part scene na pinck shake molasses cushion wo strong i'ma nasty arm walk like 'm use way lima anything 'em lovely 's lord deep fat 're funk likeshake ant dance fred could pant wan guess thing ask usually gravy business sex grit watch plump hump want look greasy stay buy groovy groove corner minute stand well n't funky move fever take legs sweat;Sex Machine (Part I) by James Brown.txt
Sexy;MFSB UNCERTAIN;nervous hoe section shine judge side hard turn love us lot wish 'll ball everythingeverything yeah shit breath hit complain later pic worth sh niggas get forget think one million loan motherfucking ca please dick hear bigging make fame push sorry next finna check cost doembed whatever clutch truth note chainz ill sail waste cottonelle tru mental saint caption league road ticket somebody like floor line translationsenglishportuguesenglishall toronto end still even switch enough ask smoke drive-thru ship sometimes 'd teach wayans ta keep rich leave half plead say sauce time people condo old back dinner oh chest game eat dog cash start stress lie free mind step closed help king j wont yet kush room see advance dancer money great detector y'all drink problem tell swear talk ring dont way new '' diamond randy condom walk arrest legalized zip benz-full big n't take broad nine dress go muhfucka sexy thats come rent everybody retro god 've paint different box real year pull goddamn fuck jail always glee split im complicate quarantine wear ai fall roll damn might man right girl understand bullet-proof touch i'ma last chests really window motherfucker shirt learn simple homie bad 're never keith shut wind givenchy thing much sex load probably watch perfect look stay bless mercedes-benz season guide wake woman light trust late play skin crime manner daddy fifth type let ... lil ah pay listen whole excuse good okay know alert eight metal 'cause lyric everything babysit heard due need `` 'round forever 'fore fork lady true car gentle sale also table age crazy 'm use pinky hat fashion 's work bit issue bout baby guess many bitch want damon buy office nigga ho sweat;Sexy by MFSB UNCERTAIN.txt
Sha-La-La (Make Me Happy);Al Green;something alone leave love go try say let ... time 've oh get know die 'cause feeling heh ca lyricssha mind sha make sha-la-la long sing see embed might also ya tell na wo 'm way aw 's cry thinkin bone feel -- baby wan likesha happy n't la;Sha-La-La (Make Me Happy) by Al Green.txt
Shackin Up;Barbara Mason;marry call alone leave outside love go us wish point yeah throw everybody life lyricsbaby ever let freedom unless people pay grocery would good within thank get know 'bout wonder store ca free stop mind nothing sorry next perfectly ai hardly hang true live likemmm see might water hmm man right girl understand also wrong lonely clothes funny talk 'm like use way betterembed neighboor 's mmm nobody 're never even feel door guess dirty business happy bother together want paper 'd well shackin n't;Shackin Up by Barbara Mason.txt
Shakey Ground;The Temptations;woo leave say drown throw life ever shakey clover time ah ooh put oh morning get year one 'cause lyric four preserver lady since leavin standin see might car 'til ground girl also situation repossess ease wo ha occasion 'm like waa waaa whoo harder feel wow tear special hurt leaf stand luck well n't better ho hoo downembed;Shakey Ground by The Temptations.txt
Shame Shame Shame;Shirley;sun-roof go try say fast yeah motion discotheque ooh chorus repeat put back get think one dancin ca aah likeembed hear gon stop foot find need ai till might man lyricsshame show also comin action break body na yes wo catch 'cos really day 'm remember way monkey 's 're dance diamond fadeyou baby wan hey notion want groove wig blow every n't shame move shaky;Shame Shame Shame by Shirley.txt
Shaving Cream;Benny Bell;full shh- keenembed quit antic clean keen love girlfriend story wish 'll say bathtub fit nice time six head old france admit sandwich would good folk morning terrible think kit one die order darn -having feeling lyricsi always step fulfill split foot army find `` offended bury lady may -aving might darling likeand sad also stick break tell last -shaving sh- day 'm window night pile bit end '' bathroom feel cream fell baby queer thing walk anyone load barrel look hurt shave 'd big every luck;Shaving Cream by Benny Bell.txt
Shes Gone;Tavares;face high woo mirror love go try quick 'll everybody let memory young away pay brush decision oh morning get think replace i'd need tooth ai help hang toll see might thought pretty worn right also devil wrong drink eternity tell consolation city body choke spend wrongembed 'm learn 's lyricseverybody carbon never shes dirty monoxide look dissolve stand 'd n't better talkin take likeshe;Shes Gone by Tavares.txt
Shining Star;Earth Wind;strength light shine alone man-child wish come yeah begin life clear give 've bright listen sand oh view likeso get watchful seem dream lyric sky grain always make find star need wisdom saw ai beembed giant bear see might matter also sun upon body yes strong dear shin night far heed work 're word could hey shining bless truly stand big n't take carry;Shining Star by Earth Wind.txt
Shoes;Reparata;laembed lyricsjohnny hide somewhere turn shoe run love abuse say throw pick everybody god give johnny time confess mother papa likeahhhhhhhhh smile rice good didnt bouzouki get forget hup know tom start louise fill everything gay make wedding uncle bride true air may wine see might safe car glance girl also jerry day pray music open far theyre dance frolic knee hey grand bring bless hand theyll band la aisle;Shoes by Reparata.txt
Shoeshine Boy;Eddie Kendricks;ten tease keep hard somewhere rich go fun lot 'll come yeah life 've reach back finally havin get forget know year lyric discover gon make star long might around noon gettin man girl also boy ya sun na though day like way learn tryin 's work workin 're livin wan many thing top much together look well move n't shoeshine heyembed;Shoeshine Boy by Eddie Kendricks.txt
Shotgun Shuffle;The Sunshine Band MISSING;sunshine shuffle band seem exist song shotgun miss;Shotgun Shuffle by The Sunshine Band MISSING.txt
Showdown;Odia Coates MISSING;odia showdown seem exist coates song miss;Showdown by Odia Coates MISSING.txt
Since I Met You Baby;Freddy Fender;'m way since might nobody meet man change lyricssince try baby also please canyou likeembed gon happy tell everybody life na need every n't cause whole trouble;Since I Met You Baby by Freddy Fender.txt
Sing A Song;Earth Wind;day believe like way smile oh good sing bear 's might hard heart feel song also 'll huhembed retrieve bring yeah life shout sometimes uh care give make need time well n't lyricswhen ai;Sing A Song by Earth Wind.txt
Sister Golden Hair;America;itembed woman monday correspondent sunday keep hard fake love try middle care time 've sister get mine think one mean meet lyric ca sure mind without little make agree find undressed ai eye sayin' hair live air damn see set might show also ready sight surprise depressed like 's altar poor enough friend golden well n't;Sister Golden Hair by America.txt
Sky High;Jigsaw;like thrown high think might love could lyric also wind lie sky touch top fly spin tell stop stone highembed without wing reason give make blow 've round 'round blown;Sky High by Jigsaw.txt
Skybird;Tony Orlando;bird high flyin somewhere leave go nest 'll come let 've back oh get one feeling sign heaven make find star lose trace a-while see embed might 'til liketil rest ground also touch home maybe day 's cloud earthbound fly blue skybird watch look stand warm 'd send take lyricsskybird;Skybird by Tony Orlando.txt
Slippery When Wet;Commodores;ooooooh something marry keep leave run love ow fun lot 'll yeah slippery care let ... tip 've slip away listen oh outta good get know mean 'cause loose lyric likeif ca dig uh expect brother ai sho'nuff hang huh see embed might around man right also tell sight wet must 's 're undone thing business together homework well n't take;Slippery When Wet by Commodores.txt
Slow Ride;Foghat;slow 'm like woman fine music night hold oh good woah rhythm roll flamin get mood woo might know embed heart one 're rock go right feel lyric also baby ridin lovin' mmmm come yeah oooh ride sleazy easy time 've move take;Slow Ride by Foghat.txt
Smokin Room;Carl Carlton;lyricsoh hide side heart chance love share likeyou say yeah life god time ooh old oh goodness get know seem sure find ai key honey true room see pleasure might smoking beautiful right also wrong add closet tonight timeembed spend 'm use glad way night must extra 's lock never could smokin baby thing many happen hey look n't;Smokin Room by Carl Carlton.txt
Sneakin Up Behind You;The Brecker Brothers;sneakin might likeembed behind youyou lyric also;Sneakin Up Behind You by The Brecker Brothers.txt
Sneaky Snake;Tom T Hall;a-kissin' keep go 'll ear warn near laugh tickle old stealin dancin lyric likeembed hear make leg sneaky eye a-hissin' lake see might snake lookin girl also stick boy drink wo maybe arm like open sneak sick 's underneath root behind beer much look underneathyou a-gigglin well n't take wigglin wide grass;Sneaky Snake by Tom T Hall.txt
So In Love;Curtis Mayfield;face love try devotion 'll life ever let care time swallow success affair good strange fact get faith require know mean 'bout lyric taste always kiss nothing kind worry lose doin believe key best true see embed might honestly two rest man testify also confession emotion pleasant strong smilin like along 's tryin 're never feel baby many thing ask feelin much write movin want look sometimes big every n't;So In Love by Curtis Mayfield.txt
Solitaire;Carpenters;within would game playing 's keep pretend end around heart play die silence love go man never hope likeand also smoke lyricsthere lonely 'll always say hand life everywhere without command solitaireembed care little might easy indifference every lose take town road unshared solitaire;Solitaire by Carpenters.txt
Some Kind Of Wonderful;Grand Funk;woman hold sweet clean heart run wrap lot yeah lovin ooh whole witness wonderful fine spine soul oh get mine know 'bout 'cause lyric fill fire everything drive mind kiss little need kind out-of-sight chill set become might around car man right money also treat wonderfulembed yes talk babe arm anybody somebody like 'm night 's desire could baby ask want alright stay big well n't talkin;Some Kind Of Wonderful by Grand Funk.txt
Someone Saved My Life Tonight;Elton John;strength light sweet passin electric high basement alone play run go donna rope hook lately head-on altar-bound ear field life god someone freedom mornin clingin time 've slip nearly away ooh listen alive hypnotize shower haunt chair payin whisper sleepin oh good would demand morning thank butterfly think hangin east one realize dream lyric anymore hear four free little pawn save 'round prima tie forever river shoulda bear damn room embed might muggy stock truck almost also comin bye-bye scene crazy dominate tonight downstairs home o'clock really perch dear hour princess like floor 'm music night sittin 's lord end deep still 're never rollin even friend beer walk bond fly draw h.p dark out-played social n't queen take sugar strangle noose curtain;Someone Saved My Life Tonight by Elton John.txt
Something Better To Do;Olivia Newton-John;wastin ten shine something bird keep alone somewhere run try 'll 've moonlight fine back comfort sleepin good would get cryin lyricsi drive find make lose doembed moan live patient see might patience likethe also waste nowhere company crazy sleep relation wo humour talk conversation arm dear 'm shin shoulder night shelf 's tryin sense cry 're singin shinin feel song friend moon wakin much well n't;Something Better To Do by Olivia Newton-John.txt
