title;artist;filename;lyrics
Forever ; Little Steven;Forever by Little Steven.txt;right even whole allembed stumble unwind need fall apart give young lyricsi really cheek turn vain punch world jewel pick hard stop blame hold privilege work win likenow baby much would mean leather heart nobody quiet fight wo around thing girl together want inside still feel year ache learn could look slip love hurt piece lesson life kind forever leave back boy soothe slap keep cry touch
Forever Mine ; The Motels;Forever Mine by The Motels.txt;time stop long always rare maybe bad forever word real live would speak erase whisper mineembed perfect lyricsthey longing mine stay bridge memory question place line meet arm sweetly answer prove love
Forget Me Nots ; Patrice Rushen;Forget Me Nots by Patrice Rushen.txt;need maybe give really last joy send share little good hard forget care nots bad baby would friend affection though memory thing time want always help still wonder please charm end could remember love crazy happen soon room simple passion life believe forever chance never dream pretty think
Freeze-frame ; The J Geils Band;Freeze-frame by The J Geils Band.txt;close-up sunday sound zoom-lens tuesday hot-flash shoot spotlight hard weekday wound lookin flashback friday darkroom heart strong wrong wo find moment thursday still focus factor without frame rough-cut freeze-frame woo could morning ear stop-time proof-sheet stare froze love disappear mind hot-spot snapshot dance image grind freeze face night frameembed test-strip slow-motion mine feeling sweet-talk lipstick defect reflex
Friends In Love ; Dionne Warwick;Friends In Love by Dionne Warwick.txt;darling fall likewe turn alone loneliness surprise hoping lonely sunny someone much behind way mean every friend strong along find around time together always cross still feel friends could away look remember love nights mind yesterday forever lyricssometimes never leave night dream cry day true think
Funny How Time Slips Away ; The Spinners;Funny How Time Slips Away by The Spinners.txt;heard doin right pay funny hope till new lyricswell thing time long hello please end somewhere away slip remember love fine guess yesterday ah never back town seem day ta
Genius Of Love ; Tom Tom Club;Genius Of Love by Tom Tom Club.txt;marley walkin expand glad need smokey warm james remind collins bob funk present cocaine consider likeall clinton skankin robinson brown hippie-the-hop wailin boyfriend hold robbie lyricswhat insane heaven way fun hippie-the-hip great raise deepembed new expectation mutation rhythm musician time maven sleep uh mama step rock kurtis feel quite roll please surely end bootsy intention weekend jail oops love unhappy miss depth genius natural sing sly bohannon foot dimension dream blow reggae man beginning arm think laugh
Get Closer ; Linda Ronstadt;Get Closer by Linda Ronstadt.txt;notice something instead follow maybe lyricswant give jump eye run forget hold closer hand sweetyou seat heart head slide thing girl want worry away look fuss close remember love crazy forward mouth man understand
Get Down On It ; Kool;Get Down On It by Kool.txt;sha-baba-daba-daba-doo want groove across uh move ah dance baby chance feel people body stand really whoa-oh-oh-oh-oh-oh-oh back listen dancin floor wall hear wo ta show
Get Up And Go ; Go-Gos;Get Up And Go by Go-Gos.txt;extra eat turn put likeall wake song us activity bed toast much way bluz till tv every fun head monster lyricsl.o along start find time burn long busy frred playembed clothes wear begin shower mess already pour mustard sing play keep dirty day scary-os think
Give It Up ; The Steve Miller Band;Give It Up by The Steve Miller Band.txt;right darling need smart move bit baby give way hey direction affection play little heart loving keep good true love
Gloria ; Laura Branigan;Gloria by Laura Branigan.txt;something breakdown anybody number live really oh-oh-oh voice line run gloria afternoon catch outro call hangin head start callin lover main somehow careful want always somebody everybody innocence slow feel fallin money marry away slip rebound remember answer intro show soon comin believe leave back alias blow meet ta think a-ha-ha
Goin Down ; Greg Guidry;Goin Down by Greg Guidry.txt;instead fool secret eye lyricsi last cause nearly run hold light goyou way head drown spell free fire time careful side charm deep goin could place look love comin mind passion never anyone magic feeling cast must soul
Going To A Go-Go ; The Rolling Stones;Going To A Go-Go by The Rolling Stones.txt;yeahembed alright everybody dance taxi mile go-go people stag black everyone dollar every white robinson/moore/rogers/tarplin everywhere town fifty pack goin night likegoing beer new flag drag drop place six matter find around brand
Good;e To You by Scandal;Goodbye To You by Scandal.txt;bye-bye ago darling need stand last far good lyricsthose pain hold week someone bad likenow baby much talk pity goodbye heart youembed wo time long want lose ever feel could remember strain love dull guess never wait seem night day
Goody Two Shoes ; Adam Ant;Goody Two Shoes by Adam Ant.txt;right something eat al makeup follow big heartbreak all-time put send eyeball little far game hide good stick ya saw subtle win week token much goody mean joke note fight wrong green sleep side inside unspoken word innuendos write everyone set sure pound two superstar insideembed drink look treasure open fashion throat pretend lyricswith kneel smoke shoe cry legend likeno must think
Gypsy ; Fleetwood Mac;Gypsy by Fleetwood Mac.txt;room wish maybe light gypsy dance still remain enough eye leave strike paper twice back freedom underground lace flower night face little bright floor velvet memory lightning away youembed fear child love
Hand To Hold On To ; John Cougar;Hand To Hold On To by John Cougar.txt;right easy need young alone jerk hour educate pony financial pick good trouble four-wheel mud united hold work insane spin tame situation talk hand luck every joke brain fun friend preacher middle old strong havin joker matter lyricsyou girl always somebody nation rich ahhh body please hollywood toembed except begin drive drivin pretend ah nice stud president boy play phone cool likeand wild laugh
Hang Fire ; The Rolling Stones;Hang Fire by The Rolling Stones.txt;eat need throw put shirt nowhere doo-doop wire work ahead baby slob hand hire hang fun hundred-to-one dole nobody old fire country time hell lose ever lazy aggravation sweet money marry drink doo job dollar thousand full nothing
Happy Hour ; Deodato;Happy Hour by Deodato.txt;case happy crowd right og bar fame big fall im sound ejaculate deodorant homie hour redenbacher cold bin pray top playin youself ya ball us labels flow brave dick people dora mean call underwear rappin gettin profound explora nigga bank cologne new nobody old topic hobby admiration track hair lyricsyou rapper girl bravo dayyou across sour touchin phil trash inside nation hit crash takin body saturation scrunch crunch cash skill pound aim population port knock kush metaphora- place fedora hop dry keepin occupation soon mound uncle risin guess slayed success balll enough leave bass rung school hot hip lung back town face full seem cal another treat safe power beat tryna cuz meet day canada fuck hotter feat- try shit
Happy Man ; Greg Kihn Band;Happy Man by Greg Kihn Band.txt;happy manembed something want hold need likei someone still real break much people lyricsi night nothing ask touch late tension man tight lot others understand
Hard To Say ; Dan Fogelberg;Hard To Say by Dan Fogelberg.txt;easy maybe fall last far lonesome clear hard lot fade weary near win way hand future every bank steer blue wrong walk fear thing time best rock past still ever flounder drift lyricslucky faithful begin likelucky away snow love fast sky cryembed careless sometimes navigate bay never miss face straight play upon keep dream cry may try think
Hard To Say Im Sorry ; Chicago;Hard To Say Im Sorry by Chicago.txt;time even want hold everybody need holiday im promise sorry body never oneembed stand would part really could little keep lucky far stay sweep away hear day lover hard love
Harden My Heart ; Quarterflash;Harden My Heart by Quarterflash.txt;time swear rain always ive darling tear disappear life news ever word corner give im feel never youve leave swallow wait turn lie heart harden dream cry heartembed feeling good close wild think
He Could Be The One ; Josie Cotton;He Could Be The One by Josie Cotton.txt;trial move name number modern really put lyricsyesterday okay much call every passing heart ride time likehey everybody worthwhile rock stage could score away uh-huh love fine super mind steal kind waste guy hey wait hip style age night another dream meet day
He Got You ; Ronnie Milsap;He Got You by Ronnie Milsap.txt;time right lyricshe sometimes rain side lead sunshine bad letter forever baby pain taste sweet road back goodbye foot loving dream bitter good lifetime sad true wine love
Heart Attack ; Olivia Newton-John;Heart Attack by Olivia Newton-John.txt;crazy thing death likemust breath catch givin leg ever lyricsmy heaven cut past feel attackembed way speak mouth point weak put recovery die heart dream attack look must dry think
Heart Like A Wheel ; The Steve Miller Band;Heart Like A Wheel by The Steve Miller Band.txt;long want pair need family real give feel really roll pity rollembed babe everywhere summertime heart two fake blue wheel lover love
Heart Of The Night ; Juice Newton;Heart Of The Night by Juice Newton.txt;crowd heartache madness need fall eye city good run survive prisoner twist likein cut invite way heat shadow reach release heart hungry gun free find search bandit two moon slip close darkness lyricsdark love street moan room already steal unseeing dance escape descends lay night nothing mine touch cool
Heart To Heart ; Kenny Loggins;Heart To Heart by Kenny Loggins.txt;right darling maybe need apart alibi give eye anymore turn last later little heartembed anything honey sooner near grow people way goodbye darlin heart loving truth start find reason time together mama year end lie away love crazy torn forever chance leave final back collect touch try ta home
Heartbreaker ; Dionne Warwick;Heartbreaker by Dionne Warwick.txt;follow whatever lyricsi universe world hard pain rain hold suddenly pass would call goodbye spell strong matter find around want search ever heartbreakerembed feel likemy end die could morning rule everything love hurt mind life lesson reverse believe never everlasting heartbreaker dream cry may power meet soul try ta think
Heartlight ; Neil Diamond;Heartlight by Neil Diamond.txt;happy right heartlight need young turn world shine wake nowembed someone lookin people call friend liketurn next middle stay lyricscome ride time want across lose still word glow feel everyone away moon place soon sometimes wherever kind back boy excellent dream home
Heat Of The Moment ; Asia;Heat Of The Moment by Asia.txt;right disco scream big wing fall eighty young eye alone use grace circumstance song catch hold bad would mean arise heat teenage wipe heart pearl ride find moment thing together want smile sit charm ambition two look remember show beside unsung lead momentembed dance concern never incident hot face night another many dragon phone spot
Here I Am (Just When I Thought I Was Over You) ; Air Supply;Here I Am (Just When I Thought I Was Over You) by Air Supply.txt;stand live alone thought good pain playin stop rain hold baby part every though heart memory free time best inside without set could outgrow fill taunt everything pretend never miss ease crashin keep sense feeling mending try space think
Here To Love You ; The Doobie Brothers;Here To Love You by The Doobie Brothers.txt;right even law glad maybe fall live loneliness world problem kingdom worth pain stop ball baby pass men way king along hear wrong girl everybody bear feel emptiness love life enough build heed true arm weight space think laugh
Hold Me ; Fleetwood Mac;Hold Me by Fleetwood Mac.txt;meembed fool minute corner line hold manage baby damage hand future percentage nobody wo matter around time although want step inside plenty due ever spare glove waitin slip love payin dance understand
Hold On ; Santana;Hold On by Santana.txt;something minute memorize break solo eye pace live last fading x got detail worth fade hold within concentrate lyricsdo pass would way every nobody memory along file moment thing time want lose ever slow feel without rush likehold away close remember everything love pretender steal life forever repeat enough another nothing try hurry
Holdin On ; Tane Cain;Holdin On by Tane Cain.txt;fool fantasy onembed hold lose reality need move fall believe still likeholding give enough break feel lyricsi leave alone anticipate night reach could play next keep strong holdin away touch charade await walk wrong hard try love
Hollywood ; Shooting Star;Hollywood by Shooting Star.txt;sell silver something damn riches bar gentle star read someday pull give name uptown live l.a road use world top game california stageyou celluloid couch advantage stop rag dead glamor hold us blonde boulevard light grow talk way manufacture hand every fun fit heart new along walk lord fear around time long apple leg lose sit youth stage hit wonder feel tonight everyone pie hollywood boring applause mid-america drive american love street magazine speed producer york life lip strip screen struck never leave face night play dream cry day lyricsshe true home hair
