title;artist;filename;lyrics
(Do You) Wanna Ride ; Reel Tight;(Do You) Wanna Ride by Reel Tight.txt;early right scream round rub break name dawn cause pick game bangin ya hold lyricsdo baby bed half freaky till nastyembed nigga next hear wo ride wassup thing shame long girl together side boogie inside kissin thigh tennessee pound house moan lip nasty back night straight dirty lovin man hurry
(God Must Have Spent) A Little More Time On You ; N Sync;(God Must Have Spent) A Little More Time On You by N Sync.txt;unsentimental early stuff liberty staff instead z aware corner illegible willya volume cobblestone sound strike voice stub nearly ohio wastebasket protrude concealment broke army care clearly near jazz saw navigator whiskey water-proof particular bed neck much rap length edify blushed-automatically college appearance straighter string fortunately raise wedding nobody old along communication offer bulling walk form steady hospital photograph corpse side politely terrific selection melodious draw combat debris especially breathtakingly hole away urgently parte piercing a.p.o triple-reading room numeral tear meant life schrafft instrumental return accompaniment stature slender cruel twenty-four town night brutal damp knot confer weightlifter silly uneasy edge considerably cast object luggage manly cup result easy writing hut bird riddle posture-conscious young familiar point dreary axe center last triple cause armistice new-higher-interest sweetest-sounding regularly superficial intellectual sister anything enlist stop absorb cigarette continue presumably levitation future exposed anyway cutting seat dostoevski soaking-wet p.m. reason grab careful recently cross door born short bear lift sure nod .... appear somewhere marry tap laboratory someplace others death seal schedule comin quonset finish guess vacuously ceilingward shoe porthole odds straighten certain rim another nothing play sink power response adore readdressed gas-mask swift hesitate stamp tuck probably teeth position usual hostilely follow slightly lean movement wavy thread bob turn limp put charles shirt camp distinctly fountain-pen th good clear lyricsfor megley shrilly nazi filament downward flash almost gaufurt pity annoy detester note nail suspect frankfort facwith coffee difficult sensuous talisman main british waitress ever temper exceptionally chain-smoke glove end salinger campbell class category oughta belonging sake middle-aged twenty intelligence entirely albany experience kind chance halfway forgive standard heavy theatre solemnly series tartan sergeant lunch spend think hopelessly muster detachment observation bet move muffler christmas stumped warm sixty ten ponder break ladylike passionate sensitive efficient-looking hood singing coughing game assault fright alert hard pain bump stick rack uncomradely memento receive ahead gradually airborne equivalent faut badge men speak group story snobbish first peninsula -- eight matter rest either find surprised coupla aunt responsibility package large hell reflect temporarily tonight hello classic require enormous-faced groom throbbing belch posterity two house qualified bronx view ceiling huge water pew fill roller thumb breath throat sentence discard ash-blond self-consciously prevent bang tweed squalid queue specialized back count v-mail boy opinion english air retire trip expense mirth rather matter-of-factly paperback issue naked ago small-size german experimental methodically cinnamon dear nervous inaccurate wrist number eye register quickly regulation bulletin x wave serial wrap compact world top far fish-and-chips spine abruptly professor include check il spoil rain christ standing pleasant behind would wide mean hymnbook bounce fact stay hideous seven undergone collapsed heavily want wider tomorrow ridiculous pride french lighted wonder belt feel suffering ache initial less aim state goebbels -devon quick enthusiasm statistics-lover special title finger dance nice concern coach touchy uncontestable bastard mouth enemy earlier grimly pack lightning sense excite radiant handwriting table letter ta hurry teacher case list something suspiciously helluva shut glad notepaper stretch partly container give necktie cover alone thin instruct cheap canvas wrists interest scan ear-lobe catch listlessly pile vigorous denominational vicinity sigh inch swastika red new whose fishy jesus perished aleck paragraph eighty-eighth mat treble comer practice join gregarious faculty sideways attention overlook sit word familiarly year wooden clay. authorize sincerely since semi-pleased jacket cuticle dog empty ear countryside clip american beside lit soon division sheet adjust intact custom trifle messy-looking match arrive constant knee straight orange upon ohne feeling gather recognize child try slowly silver speedily breakdown aloud star tip whether extensively throw pull resolve therapy trigger coolly fix sentimental articulate unworthy woollen little remark desk germany extenuate row editor run compromise seemingly violently god unload pad smart receptively people way call gettin ignore letter-writing head lucky palm compassionate method green speaking immense accurately scratching across become smile unfamiliarly hurtgen novice body fountain apparently glorious experiment incessantly friendly grooming counter flatting jersey everything amateur bride instant interference sometimes york aside lead couple cat piece training cunningly never eleventh flattered gaze sing separately lay cheer remove certainly acuteness thousand unmistakably coal-black enormous mine mixed wind s-l-a-i-n singer small-talk advise america heard loretta damn rear harbor undamaged gas big fall beak teach type regard paper tree listening radio brick-red satisfactory defective pick campaign reading introvert trouble security-minded undarkened transit color zeal folding furious visit mark pair partner week professional forest effort angle hand hang greatly rostrum left-hand appendage war chair unique heller technically je military-looking hear conversation sat fresh que harsh overhead-light sign long ranch deadpan step kid fault save prefer pound beautifully overhead listen reefer drink dickeybird figure personal book v-e range national switch shall face hat information stayed touch right blase among sermon train shook drool clay truth-lover order jump live really p.s unfortunately road twice abroad temple cold unmistakable extrovert swing governess london bottle bernstein father board ya employ inclination dare valognes pre-invasion itch cap real handsome hamburg reply baffle sock guide conflict though felt biting sick bom relax press tearoom girl five add indictment everybody rainy propensity without closed-mouth umpire j. mention bavaria beispiel direction goin achievement bite begin north f-a-c-u-l-t-i-e-s loud gum animal purely close separate pencil wristwatch bother happen saddle unstable olive-drab lawn yesterday plane dignity messy hip charming entitle battle minister regret normal social belong specification pressure afternoon strangely eat exclamation intimate idea wish news maintain heap stand beeline shot aussi poise problem line seance shake pose avid enter thanksgiving possession ball africa immediate bulb hold thirty-eight-year-old collection insane apply toast invitation lady pussycat great three-fifteen existence harassed usually calmly slam acquaint around cotentin moment statement england bull exquisite always settle saturday busy spectator prolific squalor rubber vividly midget fairly childish experimenting nostril deep thank fraction chronograph look silly-billy napkin whenever tic remember kill street deserve magazine lengthy often repeat ready bring wait willing party wistfully completely able many glass ping-pong possible contrary automatic-arrest radiantly small chrissake man change space thanks. least oddly downstairs ten-thirty secret read whatever push accordingly warning toward mighty tea confusion hysteric wet hope hour shoot verse joy ability use race wriggle insert lonely delicately advantage overawe intrinsically opera within light suddenly subside someone expect revealing heaven part childhood unshaken dreadfully reader fit test dryness crossed blond nose ride crumple message directly short-story portable circle somebody corporal lose still slow mauretania immediately shield wear monkey attend blind absolutely faith film love open exactly lip ordeal bore talkin leave photogenic overseas school genius thanks foot upper floor smoking service pocket insight must mother-in-law whole esme minute terrible bearer latrine name smacker wife duty choir month disguise gifted send punch detail imperceptibly interrupt low unopened bitch lot front bleed shriek us june eisenhower sorry till devon three navy-blue friend navy perhaps loosely imagine essentially start effect wo insecure meetcha shetland together o.k leg horse reflectively family scenic shelling quite compliment write composer yawn assign enjoy obligingly die featured deeply six pot spy health forward spread intend account smoke forever raincoat hey typewriter major embarrass keep european virtue meet day laugh ankle notice company chronographic-looking walker watty violent clock troop tongue funny discuss maybe sincere actor levelheaded fail simply pitch-pipe underage express candid woman coat mask enclosed stale adult comb drag quarter baseball inquire comment wince evacuate circumstance distance mixer zeit taste pass livid terribly tribute vocabulary intelligent sickly fully splendid g.d. goodbye toe meaning rumor e.t.o rehearsal right-hand puny explain best emotional gripe lovable black none except house-counting select address strain fur jeep association page kiss already mind wonderful impress ehstadt believe snapshot justifiably observe novel seldom several inscription official four style humor disclose age teeter fell home frequently even arrest thirteen contradiction tissue outa pen brush spooky act surface daughter extraordinary member extremely later window thirty exceedingly zone glance forget pinch tremendously song flap third wire catchall envelope flyleaf publish barrack church brother turkey crystal expression lovely bridge insult country entrain penetrate writin inside psychology second conviction alvin bunch kidding please roll exclusively civilian could paradise properly drive streptococcus stare addicted answer show myopic else yet velocity threat galosh termination different opaque intact.embed mail mostly miss period business goddam anyone tack lone seem lap sleepily muse almighty courage may blow question pretty clever slanting arm startle faintly accept treat strained brief suggest host need somewhat finally yes auditorium dislodge plot d. deliver angelically archivist shell infantry impressive brown amount recreation duration bag tragically otherwise combat-style person below-par moving decide half april every signal enclose spell white-hot sight son ecstatically brilliant although instantly customer actually box dissonant stillness soak everyone unmarried windshield set tablecloth money infantryman ink course bayonet guest flick unable hop convenience sleepy rank hurt communicative unbearably hill drip squint flat key automatically full align dirty unequipped sole tempo temporary yorker interested bronze wing enviable clinical anybody companion reread glare admit demand white gently tellin generally wash cashmere yarn tight mother specimen apologize landing jot writer however easily alertness rough dusty reach despised next devonshire ask quiet soldier fifty-eight possibly ribbon slide thing time rebuttoned burn waist correspondence hymn slight resonant single dozen nine synchronize direct place slip curly dry stink execution fine scene grencher opposite wherever forehead sometime faint pre-pearl bitten strip enough layin ought interdependent sleeve parrot high watch g.i wall dress shockproof importunate weight hair
2 Become 1 ; Spice Girls;2 Become 1 by Spice Girls.txt;deal need stranger bit put little game good spirit ya light work real baby closer achieve way free girl together become candle wiser word beembed feel tonight set empty two danger doubt remember love endeavour mind believe forever never leave back boy night play dream silly soul
2 Way Street ; Missjones;2 Way Street by Missjones.txt;swerve right panty gurl even whole tongue fame gas follow need maybe big chippendales letter give beep name number sound really fix verse cause x shirt shine pick game lonely good trouble sister missjones store hard honey handle lot pun hall pain stop diamond youself chain flippin trust catch pop ball baller hold lem sun tried boo someone bond real continue people way part fat lady fair call nigga three chedders actin cheatin ask truth late hear wrong callin -- fadeembed ugly chorus time shame long girl want always explain chick fairwell punish ever word model frame tryin sure watcha wha bent lie u two faith cheddar thug look millionare crush someplace doubt stare remember answer jones else love street crazy comin hurt cat mind decieved believe enough remix miss leave mouth back boy control night straight another weave nothing many keep cry watch wall horny lovin phone accent munch self try ta think home hair
26 Cents ; The Wilkinsons;26 Cents by The Wilkinsons.txt;picket whole read cent letter anytime give penny fence alone momma buy white wrap thought quarter lonely loveembed anything lot fade hold beaumont envelope much behind would call goodbye note old strong always inside sit feel year write money since tap bus house ear love eighteen enough never school high wrinkled nothing watch courage coin anywhere
32 Flavors ; Alana Davis;32 Flavors by Alana Davis.txt;beyond eat harbor secret someday give eye starve turn poster record forget god dare vision someone would meaning head hungry nobody truth ugly girl noneembed want help hatred past word everyone ambition none phoenix jealousy could course peripheral state look close ash everything fly room life chance smolder demean never doom squint thousand flavor pretty rise try
4 3 2 1 ; LL Cool J;4 3 2 1 by LL Cool J.txt;doin alive stupid train illest tongue pent gypsy bubble meth-tical sound number rusty live millennium mazda mask swing driver blaze spit ya dead dare platinum real flow poisonous much rap behind sock bluff hundred bounce release nobody stay strong fight sick seven size form rapper five want best side ricochet hardcore snapping sweet roy timeembed mention naive learn timberland shape carumba uh-huh kick close vigilante doubt speed already finger halogen life believe itchin mouth shoulda hot four hip borrow sinner dimension mike bomb swingin phone smell ta chickenheads sword act give young cover last explode shot deadly shine city attach line meat sonning possession feces ball catch shorty hold excalibur tiger petro heat metro clown great seat canibus idolize gun free sperm ski word hit attitude somewhere deep tap could dog gritty politic approach drive look hype punk rhyme street yet death g-o-d finish disease bring knee play many dream cry blow griffey cool fuck fog arm try shit anaemic grimy position read symbol absolute penis turn missile shoot put thought little nowhere good run shittin ha prominence shitty invent light heaven baby confront way mic call jaw every bankhead nigga signal bank note fantasize head surface-to-air team smack buggy wrong history dominance son mc ugly mics huggie circle syllable ever still respect crown j christian cummin flick ringmaster crush love amateur committee ho challenger blunt sickenin piece never leave overseas terrorize mr. trizack value prove think mad bust cub big sixty type anybody break name tour yo send got punch boot ex pick game drop trouble hard low certified lot lump front bump fuckin nick sun receive snatch limit spliff ken however thesis root three fun ask challenge start detention either transform wicked time burn long leg uh step playing car single cliche two confidence six infliction dart fly wu zero lesson pour enough raincoat back boy keep smith watch dark ayo beat socialize wild
4 Seasons Of Loneliness ; Boyz II Men;4 Seasons Of Loneliness by Boyz II Men.txt;lilac need fall apart remind break chill eye tree loneliness fix use share pain chain ball warmth baby scent would way reminisce winter heat release heart new compare imagine memory everytime shed wo dippin matter bind thing time burn long always side somebody emotional ocean feel without drift please empty autumn snow season crush close remember kill love vow kiss skinny summer life comfort springtime bare byembed bring ease hots four bloom night breeze mine cry watch courage air belong day leaf mistletoe perfume try change think
98 Thug Paradise ; Tragedy Capone Infinite UNCERTAIN;98 Thug Paradise by Tragedy Capone Infinite UNCERTAIN.txt;alright millionaire mural jump paul stewart piano world ode loca driver check jenkins comedy buk dead animist eva sunshine raygunn dolla much rap nen pacifier theory jill resurrect late king wesley mf meek ray feel dash rod mill dre bieber mentionsyou encyclopedia mortal p saba dollar fauntelroy mike glory legend kendrick ta c.n.b. pillay coast young sean diggs starfish clinton line song eminem work drake hemlock deux future blood new anderson blue free gun justus cross fiasco kunta honorable eagle lift psychodrama perception deep lie daveed paradise staple yomilo thug digital wayne lupe show punk street death sale travi fifa norf victory blacker guy jeremiah party ronson glass dream man fuck true george joey chopper jamie senorita im dopeman momma little deliver barman good mac run blur jean brown ziggy sigel thundercat lanez sebastian anna fam roof homosapien shadow souvenir maria lord mc ayesha ernst food troi bilal q miller ap lil body ty money funky dot trickeration elucid miguel intro paak love open anti-anxiety berry scott remix untouchable rapsody crutch lay busdriver giver alchemy slumber trae danny billy think comma ab-soul deal feat big gfk/bbng james bada dogg candice beanie white grandkids hood game trouble couch mick degree mother prisoner malone del surround mark politics hand freddie dusty truth pusha institutionalized complexion torey nikki time jae medicine gibbs snoop tonight justin scratch wise u nightmare vince favorite place water six ign krit everyday drought range xx forever rocky doom milo basic awake madonna halftime face drunk casket keep wall dr. dark jaco lamar
A Little Past Little Rock ; Lee Ann Womack;A Little Past Little Rock by Lee Ann Womack.txt;crowd gas stretch corner break lyricsi turn road leaving headlight little far lonely line tank ahead mile way hand every heart blue late wheel around thing long always rock past short still feel without learn dallas could away drive look youyou fast soon disappear mind life guess leave back town face nothing keep cry dark anywhere highway blacktop change
A Man Holdin On (To A Woman Lettin Go) ; Ty Herndon;A Man Holdin On (To A Woman Lettin Go) by Ty Herndon.txt;force aisle dear young daughter woman angel good valley bottle hold carry grow goyou fragile hand home hang bank heart drown old holdin memory swim fire fight walk lover lord time side smile innocence feeble desire body year ache clothes lettin deep two tear twenty-two life hill leave daddy river back town sink watch man
A Promise I Make ; Dakota Moon;A Promise I Make by Dakota Moon.txt;breath long want always hold read mind maybe need move life due often forever word baby promise really every likea heart mine youembed may good lyricsgirl hear day walk rule true love
A Rose Is Still A Rose ; Aretha Franklin;A Rose Is Still A Rose by Aretha Franklin.txt;realise least dear void bit break tough dooby twice heartbreak precious sorrow scorn game honey forget tight hold near slick sunshine thorn baby today way tossin darlin new nobody truth unashamed hear sight insecure thing girl cryin always tomorrow lose youth still hit without sweet tryin clothes deep wear lie listen darkness fill doo love mmm else flossin hurt regardless steal life believe enough never leave bring hey flower play may power rise meet pretty man
A Song For Mama ; Boyz II Men;A Song For Mama by Boyz II Men.txt;right even force star teach give yes afraid anything strength queen care song bad would gray downin thinkin heart wrong around time girl want always food side mama inside soulembed feel without everyone oohh could ware drive look whenever fill everything show else love sky tear life comfort never anyone back face many keep lovin day soul understand
Absence Of The Heart ; Deana Carter;Absence Of The Heart by Deana Carter.txt;right something time happen together want kiss lose sit fall apart grant letter deny lyricsi write live try themyou separately every end send missin absence reach emptiness heart inside keep silence figure beside love
Adia ; Sarah McLachlan;Adia by Sarah McLachlan.txt;easy pull fail buy cause hard honey pain innocent betray blame carry talk way friend possess wrong wo matter find born innocence search still tower feel falter everyone since misery could empty away show beauty love finger believe leave adia try change think
Aint That Just The Way ; Lutricia McNeal;Aint That Just The Way by Lutricia McNeal.txt;stumble gentle likei warm give really music put crime world nowhere mountain aint someone person much would way speak gettin reach though guilty time always climb slow feel movin place rhyme fast special hurt tear life never oooooh seem high another touch steep think
All Cried Out ; Allure;All Cried Out by Allure.txt;fool sunday need whoa give break yes alone vain cause hide grass pain fade rain blame astray leavin baby easily ladyembed inferno sorry noisy would way weaken romance confused heart late fire hear wrong green find neglected thing burn cryin want add whoo inside traffic body fallin hello please set apology lie could outside tired pleasure place love oh-oh tear simple often never leave forgive pillow cry collect slowly home accept
All For You ; Sister Hazel;All For You by Sister Hazel.txt;maybe fall sound eye finally turn road cause turnabout hard wondering rain confused youembed blue walk time long always word wonder without blind away figure sky lead pour enough trip prove try think
All I Do ; Somethin For The People;All I Do by Somethin For The People.txt;right something damn bout fifty-two bit somethin give freak admit last worthy put cause thought good ugh honey sixty-five tight stop stick suppose catch vocal week sexy baby bed much waiste talk speak call every three nigga stay ask holdin seven wo track matter lyricsaight thing time want help sittin kissin feel bos roll wasp end could mindembed trippin kick astare show love open ho special mind talkin alittle dubbs twenty-four night satisfied keep floor dream day man ta think shit
All My Life ; K-Ci;All My Life by K-Ci.txt;glad fall stranger finally really yes turn hope precious cause send pray pick sister mother father tooembed god song someone baby way brother every thinkin sweeter likeyou lover lord find around girl la-la smile ever glow promise feel sweet cherish thank close hug everything love life never sing face another praise think
All My Love ; Queen Pen;All My Love by Queen Pen.txt;notice right list even alive breakdown notebook star minute pen move throw freak give headstrong name young eye number hope hour yo window pray use hood top shin wake good line store couch hard grass scar bitch mother queen check stop lab god ball ya e dead light bedroom limit work real cut grow much talk would bounceembed hang every gettin nigga friend bounce first hung felt nobody bridge wrong stash staircase hair hallway virgin practice thing time si sleep dedicate fantasy want always chick attention uh spring ever lil wonder brooklyn feel write thigh draw learn since wear guiding lie morning house place uh-huh close doubt remember hug love else death hurt kiss summer sex sheet chasing bang project enough never match school thinking back thousand night another play frequent crew many keep dream watch blow dress day meet spot try shit
All Of My Days ; Changing Faces (Featuring Jay-Z) UNCERTAIN;All Of My Days by Changing Faces (Featuring Jay-Z) UNCERTAIN.txt;even right aloud eye breathing stand yes turn road loneliness bright shake rain clearly near hand friend rightyou lyricswell walk sight find around quietly breaking smile search confound promise feel look cried sky soon mind shade night seem many keep breathe watch day try
All The Places (I Will Kiss You) ; Aaron Hall;All The Places (I Will Kiss You) by Aaron Hall.txt;right give im wet turn babe zone good mood loveembed moanin okay dyin honey tight theres ya surrender hold light tremble concentrate baby taste neck would every expression ill start hear likeyou lover reason fiending thing long girl want inside erotic body desire thigh single please heyyeahyeah begin away place realize love moan tear kiss believe lip ready never hey wait hot lay back face control night many keep mine cry day man arm spot
Am I Dreaming ; Ol Skool [Featuring Keith Sweat;Am I Dreaming by Ol Skool [Featuring Keith Sweat.txt;cloudy right need teach eye yes hope babyembed last pray dreaming angel good pinch real baby decide talk would call hoax head imagine lifetime hear thing girl want help somebody inside hazy feel illusion kinda please show love sometimes disappear mind life kind forever mirage never night dream mine touch true think
Angel ; Sarah McLachlan;Angel by Sarah McLachlan.txt;sadness easy madness need maybe hereyou pull break lack turn last cold weightless beautiful angel seeps good line okay wreckage hard twist would distraction thief release memory fear find reason endlessness time always reverie second feel hotel tonight sweet glorious peace end everywhere lie empty tired away fly room storm comfort believe escape chance vein enough vulture bring wait silent back knee straight build keep may dark spend day difference arm
