title;artist;lyrics;filename
I Love Music (Part 1);The OJays;woman lyricsoh light hold sweet whenever force love enchant romance cold say yeah laugh ... low fine smile oh good harmony get mine know swing arms grooving nothing make kind long honey wine embed might man likeand girl also boy joy part understood atmosphere close arm 'm heal glad music mellow complete 's 're dance song baby thing world happy bring groove glass every especially;I Love Music (Part 1) by The OJays.txt
I Only Have Eyes For You;Art Garfunkel;eye blind must may view 's high see know might youembed 're love million go 'cause also moon thing ca sky anyone likei cloudy tonight garden star kind crowd n't people lyricsmy maybe bright dear avenue disappear;I Only Have Eyes For You by Art Garfunkel.txt
I Wanna Dance Wit Choo (Doo Dat Dance) Part I;Disco Tex;jitterbug youembed a-little fun doo come yeah boogaloo time back oh get know lyric dig gon kid dig-a-dig-a-dig-a-doo dig-a make mama bump showtime roll might around darling dat girl diggy-doo also shout na ooh-ooh loop-de-loop rug double honky-donkey-doo disco like floor wit'choo 's hop rock dance feel chugalug baby wan walk camel world witchoo jellyroll hump want dig-a-dig-a-dig-a cut mop boogey-boo boogie;I Wanna Dance Wit Choo (Doo Dat Dance) Part I by Disco Tex.txt
I Wanna Learn A Love Song;Harry Chapin;full faded ten marry grow clean hide backlog keep alone turn play love street go bill hollywood wide try lot story couch string crisp say child come fast life god let laugh pin-up easy give six fresh away listen kinda couple ooh old whole den good get real know year castle one noise meet dream concrete lyric jean always hear living lesson hobo little foot make rather chord `` movie king eye playing sing live meat room embed seven might silence 'til soft man tinsel girl show also touch dollar boy week place na crazy yes wo melody building lean talk belly heartbeat hour like 'm tight-legged dilapidated learn 's work bad bit stud still '' bone never scared could feel song lazy poker wan door thing guess happen wife guitar sit much world happy want stay dark 'd well n't another teach take;I Wanna Learn A Love Song by Harry Chapin.txt
I Want To Be Free;Ohio Players;strength leave run likeyou 'll child life give time away listen put smile finally morning get think know one realize afraid lie gon free mind nothing make conceive act lyricsone honey awhile embed might money also tell speak funny na wo day 'm lord 're never could feel even thing walk alright want stay able n't;I Want To Be Free by Ohio Players.txt
I Want To Dance With You (Dance With Me);The Ritchie Family;like way music soul oh night get 's high keep know set alone desire might lyricshere play belong go dance nonstop also baby rocket moon fire 'll likeembed glide youyou hear come want together step groove stand shy let strong make space 've funky move take;I Want To Dance With You (Dance With Me) by The Ritchie Family.txt
I Wanta Do Something Freaky To You;Leon Haywood;name freaky something quit love 'll compatible mistreat slide hit ooh valley position put oh freakish good get happiness lyric sign everything free mind little make need long canyon style spoil embed might rest right also joy totally wo like zodiac feel baby want bring spot 'd blow n't mountain image wanta;I Wanta Do Something Freaky To You by Leon Haywood.txt
I Wont Last A Day Without YouLet Me Be The One;Al Wilson UNCERTAIN;grow leave chance us love continue say 'll else sadness come throw life madness ride let care ever hit give time 've tomorrow away bright whole yesterday good lifetime get predict know one die seem dream lie sky ca mystery today solo hear free without wheel make find star worry forever long knew fall true sing live may since no-one see might embed ah-ah-ah-ah-ah gettin right also sad show wrong lyricssing lonely tell fortune wo last maybe close ooh-ah-ah-ah-ah-ah everytime ticket day like way simple 's behind past singin even feel enough song baby thing medley guitar small walk anyone tear world rainbow likehe well n't future take goodbye pass;I Wont Last A Day Without YouLet Me Be The One by Al Wilson UNCERTAIN.txt
I Wouldnt Treat A Dog (The Way You Treated Me);Bobby Bland;name turn heart leave love go plead 'll say come throw ... rough time away listen old bobby back oh would good dog get know one hole loving always find need hardly key wouldnt true embed might around hmm right also beg treat spend lyricswell likealthough day like use way 's lord lock cry never bone could friend knee walk n't mm;I Wouldnt Treat A Dog (The Way You Treated Me) by Bobby Bland.txt
I Write The Songs;Barry Manilow;heart chance love give 've young alive old whole put fine songsembed soul oh within get real start lyric lie fill 'n spirit make forever eye sing roll first might girl also place though melody home 'm like music 's worldwide deep cry rock symphony dance word even song thing world write special together look well move take;I Write The Songs by Barry Manilow.txt
If I Could Only Win Your Love;Emmylou Harris;like oh hold would live know might loveembed heart 're love never go could lyric show also win everything 'll much say inside stray ever wed give make burn tight 'd wear crave proudly away ring;If I Could Only Win Your Love by Emmylou Harris.txt
If I Ever Lose This Heaven;AWB;face cant something sweet ta run love go handle theres try say thats yeah life ooo god ever time oh within rain get faith know youre one mean dream takin fill always everything living heaven mind without nothing little im make ft need lose ai least prove wont ive wouldnt fall moveembed may see might likeoh around convince lyricstheres change show ill also somethin everyday place lift shake shelter cause anybody day like floor new bit ignore nobody never hope could thing much every n't pour;If I Ever Lose This Heaven by AWB.txt
If Loving You Is Wrong I Dont Want To Be Right;Millie Jackson;hmmm hold eh marry side youembed love try married say 'll else child daddy life god care ever let someone give 've people oohaaow ooh oh good get know mean lyric heh ca loving gentleness downright without uh little rather mama need long heeeeeeeeey best fall live ohaaow likeno see might knowing man two right also almighty wrong disgrace touch tell hunger na wrong-doing home dont depend 's bit friend baby wife thing wan deeply much mmmm want 'd n't shame future;If Loving You Is Wrong I Dont Want To Be Right by Millie Jackson.txt
If You Think You Know How To Love Me;Smokey;weep shadow side run love street wave lot life ride 've reckless dust motorbike deserted oh mid-day get think know untitled lie sky likeembed drive stranger movement lyricsa burn need make trace town heat eye may yet see might safe understand show breathless also wild promise sight sleep though yes really close way night nameless learn desert wayyou 's silent still hung walk downtown want lead hand stay stand beach 'd move take sound;If You Think You Know How To Love Me by Smokey.txt
Ill Be Holding On;Al Downing;onembed full light hold ta run love go wave 'll say come life let doctor reach trouble pay lyricswhen back oh rain get think know one darkness ca please hear oooh nothing find make need help believe sayin' beside live see might darling right likeand understand also ill wrong beg touch na wo strong lean sea arm 'm way vain price 's 're baby wan thing knee walk business look hand hurt stand n't sunshine;Ill Be Holding On by Al Downing.txt
Ill Do For You Anything You Want Me To;Barry White;hold love go lip 'll say come life ever give ... 've ah ooh doggone would get think real know one mean dream nothin lyric ca fire aah everything gon shall stop without uh concern make kind thrill help burnin long showin' true live willin' see embed might insane beautiful girl also ill feelin' na strong wo swear really like 'm way anything simple 's nobody desire still 're hope never word could feel baby thing world want n't take knowin';Ill Do For You Anything You Want Me To by Barry White.txt
Ill Go To My Grave Loving You;The Statler Brothers;day prove daily honey night oh would live bridge 's call work know end might love go man lay us even nothin ill also lyricsi 'll likeembed abd place life grave lovin give wo save ... 'd 've n't really take forever;Ill Go To My Grave Loving You by The Statler Brothers.txt
Ill Play For You;Seals;light practice play love go share 'll say come begin life ever let time 've chorus repeat would year always likeembed hear free stop lyricstonight spirit foot forever long sing whatever see set might also ill stomp blessing yes wo 'm like way music night microphone end short shinin song clap friend many write special together stay hand 'd n't band take moment;Ill Play For You by Seals.txt
Ill Still Love You;Jim Weatherly;long remember along like lyricsrun oh rain hundred sing bear 's embed know might somewhere likeoh rich end one still 're love go run feel girl song ill also thing 'll else ready come want field life mind meadow green someone doin home thrill instrumental sunshine;Ill Still Love You by Jim Weatherly.txt
Im A Woman;Maria Muldaur;nine full woman dress nose go hungry 'll say come throw dipper verse guaranteedembed let lovin give feed fit w-o-m-a-n time six a.m. scrub chorus iron starch bed back satisfaction get hex know one swing nothin start ca dime gon scoop twenty kiss im make house need outro powder ai lyricsverse hang till grease melt drippin count might car likechorus two man also great shiverin spell dollar fee rub break tell na gold forty-four shopping skillet cause 'm like shin five line jump shirt sick 's sock lard pair baby grit want bag dozen pan wash well big n't piece;Im A Woman by Maria Muldaur.txt
Im Her Fool;Billy Swan;evening ta call side run love go foolembed likeyou say come time 've school decision papa fool lyricsshe dog get pool pet 'cause ca im make dawn mama `` long bury first wine son might goin right girl also great wrong tell mistake tonight really like 'm 's 're bone '' even teacher shoot guess alright stay sometimes overnight 'd well pour n't teach;Im Her Fool by Billy Swan.txt
Im Not In Love;10cc;call hide keep love go us 'll quiet give ... time 've wall ooh back get forget think know mean lyric lie silly im make long fuss wait see embed might two also wrong boy tell upon nasty phase 'm like 's cry friend ask much stain big n't picture;Im Not In Love by 10cc.txt
Im Not Lisa;Jessi Colter;eye day 'm like lisa rise light name face smile night shine sunlight morning grow mine winter year told might cry leave one julie 'til love ago lyric also touch sun tear blue drown lead hand stay lisaembed im wo 've n't away;Im Not Lisa by Jessi Colter.txt
Im On Fire;5000 Volts;long 'm way honey night game sweet new call see might around turn play squeeze 're run love chance go feel also lot wan lyricsif fire touch baby 'll alright come yeah want na kiss yes im tonight someone make burn take liketurn town fireembed;Im On Fire by 5000 Volts.txt
Im On Fire;Dwight Twilley Band;willin remember 'm line name honey lady lover get embed know might likebut never i'm-a read lyricsgot could 'cause also friend fire cover feelin table 'll tell mee-ee-ee free-ee-ee ninety-nine though able ever joker im awhh ain't time 've n't ai;Im On Fire by Dwight Twilley Band.txt
Im On Fire;Jim Gilstrap;light sweet high keep control play love sexy outa say child come yeah daddy life lovin ... time tomorrow away pay achin oh good get know height swing afraid fill fire dime piper today likeembed heaven tickin mind lose jones might stir girl show almost also sight na tonight spend last cup 'm lyricsswing must 's rock 're feel baby wan tight n't send take mama;Im On Fire by Jim Gilstrap.txt
Im Sorry;John Denver;china alone go cold say else time 've away fine anytime put good rain think know die seem 'cause lyric lie ca always hear without expect im grant sorry ai believe live might almost also tell everyday city sleep chain dayembed 'm like use way anything night 's bad deep cry 're feel friend thing ask inside every n't take;Im Sorry by John Denver.txt
Indian Love Call;Ray Stevens;'m true call answer wait know might alone belong mean love refuse also likeembed oohyou blue hear indian offer clear ooh lyricswhen ring dear;Indian Love Call by Ray Stevens.txt
Inseparable;Natalie Cole;wonderful like woman style way aroundyou 's know year might around 're love us rest word could flower lyric also thing always 'll tree break likeembed bring yes melody make blow inseparable incredible;Inseparable by Natalie Cole.txt
Inside My Love;Minnie Riperton;yearning like huh infinite willingfeeling hmmmm far lack grow see barely knowing turn one might 're love meeting two lyric try also wan touch world come onefulfilling yeah embed na inside stranger peoplejust ride strangersnot oneinside spiritsgreeting another carry ummmm whole;Inside My Love by Minnie Riperton.txt
Is It Love That Were Missin;Quincy Jones (feat The Brothers Johnson);drift entertain alone hard play leave love go fun try cold say peace let ... time 've away chorus comfort oh game get forget know one seem realize start wonder likeembed mind kiss make find need brother lose saw simply since first see might two also tell na remind lyricsfeaturing way work behind past 're baby wan miss hey thing knee walk johnson want sometimes missin hurt well n't take carry;Is It Love That Were Missin by Quincy Jones (feat The Brothers Johnson).txt
Island Girl;Elton John;coal sweet trick street wrap go rake white tire back oh one th lyric teeth fire burn six-foot-three save make lose nail john honey standin see might around island man girl also jamaican boy turnin tell city mistake well-worn cause manembed like racket dude 's lexington cross feel black world want flash scratch boss big well wantin take;Island Girl by Elton John.txt
Isnt It Lonely Together;Stark;isnt evening something leave love go tooembed 'll come ever let give away bright listen whisper oh would good brandnew know one dream start lyricsis please desperately make dawn need star believe honey true see might darling show also break tell na liketogether day like shin along night lovely 's word even enough baby wan thing ask walk hand n't 'till;Isnt It Lonely Together by Stark.txt
It Aint No Fun;Shirley Brown;criticize hold evening sweet call late keep run love go lay fun try lot wish quick 'll say else shortly come yeah life care laugh someone give time 've wall slip away later lyricswhen bed oh good get men think know pretend one three phone lie wonder always today rotten four commercial make save occasionally act soon ai believe lady whatever count see might car aint also likeyeah telephone clothes tell funny shirley though hello ladies home ain't ha talk really record somebody day 'm like floor way night tile 's hop cry ohembed word even feel friend baby guess thing ask sit much probably happy nerve buy sometimes minute stand familiar well n't another take tv;It Aint No Fun by Shirley Brown.txt
It Do Feel Good;Donna Fargo;gnaw daydreames distraction grow keep awful heart front love go yesterdays lot 'll occasional come kickin question quiet fit ... guilty time 've tomorrow alive accept whole worth back race within good finally fact get know die seem dream 'cause feeling lyricsi gon lesson free mind without nothing little doubt make find conscience long believe unfinished answer wait embed set might patience change also action fee claim hunger na figure 'm heel like confusion learn 's bad 're feel guess thing likei together kick n't painful;It Do Feel Good by Donna Fargo.txt
It Doesnt Matter AnymoreWhen Will I Be Loved;Linda Ronstadt UNCERTAIN;face r woah intro hide side bae outside run love go lay lyricssee 'll say come yeah throw life finger care uh-huh tic time tacs month oh good okay get real know year one die neither mean anymore wonder ca secret always kid felt sure flis without deal little make find favorite next ai endlesslyembed eye king believe voyce admirer huh hair since heartbreak see might studio matter right intertwine also wrong stick tell nowhere though wo i'ma hopefully really window like 'm hate 's cloud 're even feel song baby guess usually fly likei look spot cleopatra stalker well n't another goodbye;It Doesnt Matter AnymoreWhen Will I Be Loved by Linda Ronstadt UNCERTAIN.txt
It Only Takes A Minute;Tavares;unemployment turn leave chance love street go half egg second 'll readin accomplish come yeah throw waitin life let give time 've away whole back oh interview likeit get winter know year bom one career 'cause sign store gon mind little find least girlembed fall sing spring see might man girl also beg na spend hour day line night new 's lyricsyeah tryin 're never spare dance flu baby shoot wan thing walk corner minute attack well n't take fry;It Only Takes A Minute by Tavares.txt
Its A Miracle;Barry Manilow;whoa name hold dancing woo boston go street 'll come near ever 've people away oh would good forget know 'cause lyric gon spectacle town miracle believe till true everyone embed might around change almost also tell ohh city na crazy yes home ha babe arm 'm like night must 's 're never dance could feel baby hey anyone blue together look stay every n't hoo denver;Its A Miracle by Barry Manilow.txt
Its All Down To Goodnight ViennaOo-Wee;Ringo Starr MISSING;starr viennaoo-wee seem exist song goodnight ringo miss;Its All Down To Goodnight ViennaOo-Wee by Ringo Starr MISSING.txt
Its All Right;Jim Capaldi;hold something turn heart sorrow say else yeah everywhere wire ... people get think know pretend one 'bout 'cause fire loving likeembed felt make need lose lyricscapaldi prison lady see set might right understand also everyday tonight strong 'm way 's feel friend baby walk want look hand n't move wake;Its All Right by Jim Capaldi.txt
Its Alright;Graham Central Station;long way night oh sing wha get 's know keeps might embed play chance heart 'bout dance feel lyric song also wan baby say hear likedance alright beat na crazy me-going thang foot strong make engine burn time well move talk funky ooh hoo fade everytime wanta repeat;Its Alright by Graham Central Station.txt
Its Time For Love;The Chi-lites;hold shadow side heart love go flower second 'll apart middle ever church give time wall ooh wherever whisper oh get bloom bell lyric kiss angel foot forever eye sing answer wait embed might right show also tell clock sleep ring dear hour 'm like night 's baby earth tear much look minute tight move;Its Time For Love by The Chi-lites.txt
Ive Been This Way Before;Neil Diamond;eye day 'm way light sigh ive sing get see might likebut flame cry one die refuse never song regain also wonder lyricsi sure release laugh make timeembed time 've people;Ive Been This Way Before by Neil Diamond.txt
Ive Got The Music In Me;The Kiki Dee Band;hold something frighten bird keep firmly play go 'll say life let round trouble head chorus foolish good get know dream cool always gon foot make find worry ai heat honey ive sing embed might ground likefeel also ya tell na lyricsai neighborhood extended catch circle 'm like way line music hat cry straight never word feel fly blue wing n't move funky take;Ive Got The Music In Me by The Kiki Dee Band.txt
Jackie Blue;Ozark Mountain Daredevils;rise hide play love go fun try wish 'll say come life care lovin easy drag mile time 've nat'ral slip ooh moonlight indigo sand smile prob'bly game frown think strawberry seem dream lyric fill solo find make star lose float eye style ooh-hoo live sing aware true wine room see set might embed around girl also sun tell place wo winner cup day like music jackie free-form 's inch 're never quite enough thing ask hey guitar world blue watch wearin hand inside siftin 'd every n't take sometime;Jackie Blue by Ozark Mountain Daredevils.txt
Jam Band;Disco Tex;section thatll sweet mickey ta wham swingin go sexy music-making heavy come daddy let drag easy roxy bandembed rhythm thank get rowboat fanny horn lyric dig sex-o-lettes foxy drive beat jam wreck make ma'am house mouse ai doin jammin tex lady sing roll first seven might mojo soft man also bam wild shake home disco day like jump dit-da-dit-da-da dude lovely 's d-disco sock lunatic bad stud rock 're dance baby hey thing load blue alright boss n't move band knock ho mama honky-tonky;Jam Band by Disco Tex.txt
Jive Talkin;Bee Gees;woo love go cruel crime 'll say child yeah lovin away fine fool oh good get know die mean lyric lie gon talkin' fancy yeahembed wear ai eye believe dumbstruck till leavin might misunderstood lookin energy also treat tell na really disguise somebody like way 's nobody still 're never much n't talkin take jive;Jive Talkin by Bee Gees.txt
Judy Mae;Boomer Castleman;shine side turn leave go lay wide travel half lot try apple cold say child seventeen daddy begin mae care time later judy papa pane back oh would good lyricsas get think know year one die noise sheriff wonder momma always please secret hear gon drive sure kiss next saw soon eye accident room might around family tiptoe man two right girl also show boy age lonely break sparkle tell ready na likewell yes wo dad home talk cause day like window use way night new maeembed 's brand cry never could even wind wife thing look hand hurt wed 'd well every n't take goodbye mama;Judy Mae by Boomer Castleman.txt
