title;artist;filename;lyrics
Downtown ; Macklemore;Downtown by Macklemore.txt;west dukie uber damn whole deal stone ducati alright gas follow need wasabi big neighbor kawasaki throw warm pull budget break give broadway sound chill derriere mow embrace mayonnaise po-po white cause skate peruse fourth moped a-c little valet wash sassy game drag banana drop good run store low forget jean mirror tank stop stick catch player balance stack rare slick wristband bad lick headstand real cut baby pass storch almost ballet downtown would mean hundred kickstand cab alley bank mullet stance seat leather head birdman ill felt hella shit land free wheel harley eight pimp ride beef around bullshit salesman waist girl timbaland together want hey-oh-ey-ey side leg hell dope mama everybody french oreille sit ski ever still slow body eagle hello windshield cash bullet reprimand cop lie raw tip-toeing listen could goddamn bus fish thirty-eight coat-tail snuck two towards suit place carey honestly view water oxen mom dan dealership kill cruise street bugattis mariah yet helmet kit-kat quick pend chrome yell canopy backstreet tear lawn wonderful pas scott scrotum b-boy dance ollie pike stunt mop tandem layer hey downtownembed concrete back boy face town khaled tiramisu crew nothing keep safe yee-ow watch wall air backstage pleather blackstreet day fuck man arm k hair
Drag Me Down ; One Direction;Drag Me Down by One Direction.txt;easy teach downembed stand drag shell scar sun light someone baby behind would heart nobody fire reason best ever could blind look love else life never leave river boat nothing dark man soul
Drifting ; G-Eazy;Drifting by G-Eazy.txt;case even damn pay you-all-know-my-name-shit probably swear minute fame fall apart somethin number live really hope ran cause suspicious use wonderin far game london shifted blunts hard ha bitch lot distance fade pop catch barely blame fuckin us flight week pile mile grow sleepin xans dont would mean cattin every excuse rappin nigga rug conflict thinkin actin head heart translationsfrancaisdrifting fact strong woah start wo track main around time long plan text add chick oohembed uh sold-out kid ever still wonder feel fault without drift hotel lift roll somewhere since lie could faded parent sweep away current trippin million mistress kick mom drinkin show love else ashin dodgin careless prepare different plane concern paris escape nothin bay happens switch miss leave l.a. overseas tsa party disregard face play keep phone tryna terrace difference fuck change wild think shit
Drinking Class ; Lee Brice;Drinking Class by Lee Brice.txt;crowd clock sunday push monday break rooster tough music likewe hour member proud little good timing shake hard classembed us whiskey week lady friday lyricswe fun raise blue hear eight matter long tomorrow saturday slow class drinking knock loud drink bust crow whistle love collar dance shoe never shove sing back tick night beer keep glass cry blow label belong man rowdy ta wild laugh
Earned It (Fifty Shades Of Grey) ; The Weeknd;Earned It (Fifty Shades Of Grey) by The Weeknd.txt;pay convince na-na-na-na-na grey break marian live oh-oh-oh hate use lonely worth care us work expect unexpected would way call confuse felt nobody tragic earn bein moment girl always inside rush perfect lie favorite look yeahembed love deserve mind kind believe hill remix never hey magic shade fifty night fell
El Perdon (Forgiveness) ; Nicky Jam;El Perdon (Forgiveness) by Nicky Jam.txt;heard el even hasta esto pena wish move beg n.i.c.k turn historia pierde quiere hate tiene white luchar angel iglesias gusta saga max nowhere good pido anything pain stop intento us nicky work la baby way perdon middle vale por matter que thing time girl huh forgiveness want uno feel without save black please could away drink drive moon kill lo love crazy sabe haciendo perdonembed hurt enrique enough never miss jam back hacer night breathe pero te dicen try space
Elastic Heart ; Sia;Elastic Heart by Sia.txt;doin everythin conquer move fall apart pull give break eye elastic weapon heartembed band clear hard survive trust skin dust bad war red heart stay fire woah fight walk blade wo snap want sharp lose still rubber without save peace bite close love fast translationsespanolportugueselastic oh-oh-oh-oh-oh life thick oh-oh-oh-oh chosen night another flag many may think
Electric Body ; A$AP Rocky;Electric Body by A$AP Rocky.txt;swear ceilin ice suck bit pull give serve wrist number coochie wet really strike alone jerk turn shoot sparkin prosper killin put white shot use race little bright mil top rep bling drop spine buildin ike shake hard ring famous electric bitch finna groovin diamond god fade pop wuh christ ball shorty stack g light work smart hiiipower wig dick lookin chirpin almost way nigga schoolboy clump first next new memory free corset payback workin start sight green hoppin nose ride find brand strive time nissan whip clap-clap-clap-clap-clap girl payment trade trunk always whoo ow-ow-ow q patience rock ever ap hit car body year money perfect low-ow-ow could floor-or-or blind class ear favorite racist clip crib birkin hype mom kill memories job fine recline matrix two-seater uhh couple instagram never ohh notch hot ass boy count face pink high another play mike hoe rude feeling bodyembed cable small fuck man weird spot boyz shit
Emperors New Clothes ; Panic! At The Disco;Emperors New Clothes by Panic! At The Disco.txt;weeper naked ice melt mansion push serve eye lavish oh-oh-oh sofa ghost world loser good run era chain castle keeper snatch socket taste much fun new king mace time hero welcome dynasty always settle liar legends feel tonight flip clothes finder end crown die royal vintage velvet close rule remember sycophant oh-oh translationsportuguesemperors sentence life mortal decapitate double-double-double switch never back mine watch dress must wine
Energy ; Drake;Energy by Drake.txt;truck court uber kennedy wi-fi fairy total whoa act give somethin really turn road hope buy mayne wave pray thirty savin run bitch lot ya fuckin online buyin nah win energy real request people rap talk way part mean purse call every nigga actin timeline memory free hear wrong virgins track time girl drain askin stripper everybody kid mall family still livin past niggas mortgage money friends sure somewhere lickwood goin everywhere two house tired picture tale gunshot look million poppin six show version ex-girl finish forward life female code talkin never leave translationsespanolenergy wit enemy high keep tryna day canada rewind fuck man try ta shit
Everyday ; A$AP Rocky;Everyday by A$AP Rocky.txt;even probably boss dyke deal whole need bird news poet type august solo eye live prison yes hope buy window shot missin pray buddy ghost hood adjustin ditch paparazzo good mood ballistic hypnosis overdose devotion september judge bitch lot survive hittin father check ya god care catch fuckin us hold potion co-defendant feelin bag dick chirpin decide coppin church nauseous every gettin nigga papa new rollin emotion middle plus truth holdin gun usually lord raf find pimp ugly brand screw message time sign facade squad sippin wisdom motion office legal bustin uh biscuits ever holler slow niggas slowembed just-a feel body takin pie roll flip chillin goin sayin waitin listen die blind fifth away drive look clip dude agree close drinkin show love fine yet plead drillin everyday sentence system kiss couple seein mind flacko blowin piece double believe imprison shoe switch misfit never screamin hopeless business wait forgive back key legally another dimension hoe outfit keep porsches nag blow beat amen spend day fuck soul true bloglist wine gorgeous mad understand shit
Exchange ; Bryson Tiller;Exchange by Bryson Tiller.txt;lowkey complicate swear exchange stressin follow maybe loyal give break young loose really yes turn hope surprise last fix yo leveled-up use tin scrollin cynical problem game good tiller lot playin check stop god song player nah saw feelin bad real baby louisville way speak reminisce roof college strange gettin ignore next strollin stay forth truth start lord around mileage thing time whip sign girl want exes sir soulembed ayy save please everywhere two jealous prayer job happen rank already sex guess wont different lexington campus strip favor ready never wait lay dollar dank back key grip play nothing hoe blow feeling fuck man true shawty try change think
Exs & Ohs ; Elle King;Exs & Ohs by Elle King.txt;a-sailing whoa warm name turn orleans ex california good mountain run low baby winter story a-ghosts seas three heart new head lover wo find thing want always best breaking cursin spring climb roll two uk season show love summer never leave freeze hey getaway haunt back boy high keep man ta understand
Failure ; Breaking Benjamin;Failure by Breaking Benjamin.txt;whole fall dawn alone road last cold failure world lonely sunlight calm light wasted carry way bury war failureembed time long lose feel tire none die begin tired away drive place look breath tear lead frail life return leave back cloud nothing dark feeling home
Fairly Local ; twenty one pilots;Fairly Local by twenty one pilots.txt;even walkin vote yo cold proud radio world truly pick good song us people clique local fight around funeral yeah-uh want tomorrow uh emotional core save translationsnederlandsfairly black fairly evil kill street yesterday dance repeat chance avoid bulletproof switch never keep beat ohembed try burnin
Feeling Myself ; Nicki Minaj;Feeling Myself by Nicki Minaj.txt;list right kilo damn bout b cookin geek big male teach breakfast card kitty young number rrr whack tour really yes alone ridin poster tax wax hahaha yo killin cause fourth mask little hood let-let world top game drop good high-grade record mac run panky bitch tight queen stop earnin ballers ball flippin pop song gift hold laser lem work claus feelin bag bad carry real baby taste flow laughter lookin today rap whore drippin icy gang call plaque gettin bracket ki translationsportuguesfeeling nigga brain rabbit bounce ego perc ask everytime king chanel sauce kahuna nicki habit empire around mat whippin thing whip girl saks always uh dope nyu base still pole hit niggas car ta curve fee takin prayin black fleek jack learnin migraine maverick north rrrrrrrrrr diggin two maybach trippin look snow digital glacier punchlines kill snitch love pipe nature skirt ho rely urban finger toss female smoke national talkin reckless ready never anthem leave biggin daddy bae back key flawless full hat coco i-i keep texas gim stingin legend pretty difference money.kembed santa trip dal change think
Fight Song ; Rachel Platten;Fight Song by Rachel Platten.txt;meembed right scream alright big really turn chase send wave voice bone ha wreck lot care song ball brain left friend heart nobody strong fire fight hear start thing time sleep motion everybody inside lose worry still ocean word tonight year single deep two explosion loud else open life believe burning miss match leave hey back boat play power small prove home
Fire N Gold ; Bea Miller;Fire N Gold by Bea Miller.txt;even something whole astronaut madness eye eyesembed shine beating bottle hard scar height gold stick light dust baby behind hand every though heart fire walk moment time spark inside bear feel n moon realize beauty love speed sometimes tear steal life different believe wait magic throttle cry lightning
Fireball ; Pitbull;Fireball by Pitbull.txt;right flame yall conquer stone naked big fall give break kitty name turn momma shot little world game suzie bone bottom stick care map saw pat light baby aha dont would way roof boys wiggle fire oogie walk infinity around burn best boogie ever booty fireballembed liar slippin bear everyone u.s.a clothes learn worldwide m.i.a drink oggie chico dance nice bang never bring mr. fireball back boy shade play jiggle runnin may noogie think
Firestone ; Kygo;Firestone by Kygo.txt;changin fly burn flame together spark need light stranger dance whoa word inspire feel desire tonight firestoneembed strike testify perfect x night high world heart far dark touch fire bone ignite firestone love
First Kiss ; Kid Rock;First Kiss by Kid Rock.txt;truck cup wish fall remind break clue im jump young neither turn window cause wed radio clayton nowhere ol tom us cigarette baby lookin would every cant friend rough first felt new old fight avenue main tailgate rust brand steady time somehow always stereo kinda roll money timeembed end park could bus drink drive cheyenne petty crush remember chevy love street kiss couple yesterday forever never miss wait school back town seem jenny beat spend day small man smokin think
Flashlight ; Jessie J;Flashlight by Jessie J.txt;flashlight need eye road afraid hope ohhhh shine top mountain stop stick rain light oh-ohhh way shadow gettin cant oh-ohh though heart along start wo find around thing long tomorrow lose frighten sweet lie look kick sky fly life ohh sing beneath night flashlightembed dark feeling
Flawless ; Beyonce;Flawless by Beyonce.txt;right sexual star feminist teach do-do-do-da give support young wife live nina joy h-h-town com-com-comin little world taught dum-da-dee-da good wake congratulation sister judge forget bitch diamond twist weekembed nicky c-candy otherwise equality expect do-da-da person much men lativia way part drippin lady group speak boys receives raise next hater twisted competitor vicious do-do post candy time thing girl welcome always attention mama rock bow choice rid feel economic tonight respect perfect ambition aim crown threaten goddamn ii h-h-town-town score crown-crown look ground love job mutual fine hip-hop-rappin important champion challenger flossin comin mind marriage sex life female believe ashley roc successful kelly daddy flawless boy aspire political houston skeleton accomplishment beyonce crew dum-da-de-da h-town keep dream source social small man tyme think shrink shit
Flex (Ooh Ooh Ooh) ; Rich Homie Quan;Flex (Ooh Ooh Ooh) by Rich Homie Quan.txt;case meembed right role big give clearport homie buy club cause x skate thirty top drop bottom bitch check stop rolex e option jay light bad loft baby sack much talk call two-faced mixtape every nigga new shit stay land free quan hear walk green start time want always folk help worry short rich niggas set clothes wear dog two drink flex million toupee poppin six givenchys love fly ho rodman cat sex guess dennis talkin waste screamin ohh hey sing dollar back thousand boy play glass watch pocket day fuck try ta mad hair
Flicka Da Wrist ; Chedda Da Connect;Flicka Da Wrist by Chedda Da Connect.txt;fool outer eatin need james wrist point turn nba put ferragamo touchdown duck swish game guard california good wake section bitch lenox catch pop v flicka feelin bad bed call hundred nigga bread free team wristembed lebron luxury time sleep quarterback whoo uh mall waiter ever phew hit niggas car crab money fredonem cake two loud moon away look hop louis lit skrrt super goon capture mind plane bring da catchin play bowl runnin tryna fuck skrrrrrt try space shit
Fly Away ; 5 Seconds Of Summer;Fly Away by 5 Seconds Of Summer.txt;na-na-na-na-na replay wish bit fence jump dreaming little world california na-na-na-naembed london run front pain fade talk would war goodbye heart new memory fire fight translationsportuguesfly start sidewalk wo find time want always best second ocean tonight erase na-na-na-na end misery paradise away state place look second-guess sky fly open york mind crack waste never hey back count another wind day small never-ending
Fly ; Maddie;Fly by Maddie.txt;even ten give break thatll eye road window cause pray far lonely drop run shake ohh-oh pane climbing scar forget rain hold light baby dont way string reach though heart blue find burn sign long step search wonder staring feel flyyou learn weve gut close ground fly mess breath oh-oh wont enough heavy count shes youre night limb keep breathe dream dirty dress
Focus ; Ariana Grande;Focus by Ariana Grande.txt;doin need translationsespanolportuguesfrancaisfocus universe put babe react curious us hold ahead light bait real baby lookin sorry talk three hopin nobody holdin woah workin wo find girl uh inside focus write ba-da-da-da-da-da woo f-f-focus two away ba-da-ba-ba mmm lip enough ohh hey bae back night keep day change shit
FourFiveSeconds ; Rihanna;FourFiveSeconds by Rihanna.txt;heard pay swear wish monday hope buy mhm little thats wake run optimist apologize hold sun would .kembed call friday three thinkin positive translationsfrancaisfourfiveseconds time selfish five want somebody trash pride second wonder promise tonight shinin could jail sale mind kindness talkin reckless enough weakness four back thousand drunk bail spaz tryna day try mystery think home understand
Fun ; Pitbull;Fun by Pitbull.txt;right hook performin loosen live tour turn sticky undone de disguise little far hard brown song nah g baby much rap would way thong shadow shy fun friend new miami microsoft fresh ride find brand que time chris huh want headlinin casa uh lose campo hazy feel body takin tonight bos set good-good somewhere mami woo listen moon look crib show love else crazy happen icky life heel enrique ah often worker never bring l.a. monaco key haha night high largo keep ownin f.u.n. think
Games ; Luke Bryan;Games by Luke Bryan.txt;doin even something bar act surprise cold dancin top game wake line playin stop suppose saw baby lookin way mean call make-up hopin nobody holdin thing want always somebody cross break-up dizzy ever sure winnin gamesembed til place kill kiss never miss leave bring mistake hot party back straight play keep ta
GDFR ; Flo Rida;GDFR by Flo Rida.txt;makeup gdfr beach bugatti freak swole ratchet wet loose yo put cold minus far drop city katrina record shake stick alaykum tide tonkers pop anna bi real as-salamu lady hand m-o-n-e-y plus hatin team entendre slam girl cobra chick sheik birthday emirate lift roll cough-cough set money realembed throwin south peace goin cake could femur tint thots rover love sky open auto-biography comin hol kiss already blowin double bruh never key high floor touch lipstick limousine spendin surfboard midas man bronchitis home bust
Geronimo ; Sheppard;Geronimo by Sheppard.txt;move fall sound stand waterfall us hold coy way hand friend bridge free bombs find around geronimo lose dive past feel leap rush toy set away crush crashing love fast steal toss curtain broken wait back knee boy bomb man gap understand
Get Low ; Dillon Francis;Get Low by Dillon Francis.txt;get-get-get habibi yalla woo brr get-get-get-get barbes low whistle
Get On Your Knees ; Nicki Minaj;Get On Your Knees by Nicki Minaj.txt;panty pay twitchin position magician smarter dudes need rundown beg beautician mmmh poet act give chill nutrition make-make-make ridin yo put ok present tuition grindin good run primal got-got dine non-negotiable bag beggin perry baby lookin way kate gettin rrrrrr brain bouncin head fireworks workin murkin walk g-g-g-g- roses want emotional sit bow due twerkin l-let slow legendary bos please dozen assume crawl meagan look animal birkin show job mission yeah-yeah seein finish eleven ah peasant mistake four back knee face play i-i gim fake pretty y-y-y-you scary wine ta laugh shit
Get Ur Freak On ; Missy Misdemeanor Elliott;Get Ur Freak On by Missy Misdemeanor Elliott.txt;shook ago round scream lastin throw hush freak give jump outta yes yo mujhko proud radio stoppin dig headbanger bitch mother spit stop shh taste copywritten ur people way nigga copy new puttin gun translationsromanizationget quiet hear drilly son around timbaland want best hit feel year sw-sw-switch sweat since listen missy maut loud close holla crazy skrrt biggie-biggie-bounce open twenty sloppily mouth hot sing style face town battle play silence blow gather dealio shit
Get Used To It ; Justin Bieber;Get Used To It by Justin Bieber.txt;right swear need fall christmas translationsespanolget celebrate protect stand put use ex nowhere th interest check trust visit firework hold june october grow closer almost april hand every shy friend bank heart new stay strong throughout seven wo woeing moment long side brace reflect eve eh july year sure faith separate shower love subject system life forever bloom count face flower keep safe may touch feeling day
Ghost ; Ella Henderson;Ghost by Ella Henderson.txt;something need move give name eye live turn cold demon ghost pray bright wash hide shake spirit pain innocent stop saw skin light insane baby haunting every friend heart truth around time burn sleep creep awakeembed hell inside sit still learn away evil living figure devil love deserve hurt never awake river shade another keep watch wall meet true prove try think
Ghost Town ; Adam Lambert;Ghost Town by Adam Lambert.txt;sell flame throw james satire give name last ghost voice world city gate enter god trust dead saw townembed call friend disconnect heart head old walk rust time disaffect search tonight try everyone hollywood die could elvis answer love street spread dean believe vampire leave sing machine town night keep dream wind fuck saint lock
Ginza ; J Balvin;Ginza by J Balvin.txt;el amor acercate turismo disco al vamo senorita viene feid senora baila de yo romanticismo leggo nene traje swing pues f eso sigue e somo le balvin la sexy bien siente bailar luce bonita three mo-mo-mosty mi imaginando reggaeton mu-mu-mu-muevete hacerte infinity cuando pegarno que pa en si dale bull ti ella diciendole sabes eh como pare ahora ginza esta imaginandolo mami necesita ritmo ganas j two con animale dan queda cadera lo mismo quisiera boom sky un bailando hacen salvaje mia meneas estoy ensename deja bajo hoy business tu da pantalon esa faldita iguales magnetismo te cuanto todos rompiendo sismo man aqui reggae-reggaeton
Girl Crush ; Little Big Town;Girl Crush by Little Big Town.txt;maybe whisperin midnight admit hate bottle givin blonde bad real bed taste much way thinkin heart drown slowin lord downyou long girl sleep want smile rush peace crush everything mind sheet lip pullin magic touch perfume try laugh hair
Girl In A Country Song ; Maddie;Girl In A Country Song by Maddie.txt;test-t-t even truck shut easy making shakin wish name conway strait really naw dirt music road put cold hate use little world top good ha jean song chafe cut-off real baby lookin sugar bikini way lady shaker friend lucky old aw hottie country along hear wrong bein dime ride tailgate slide thing time girl climb kinda juliet respect sure clothes paint wear woo sayin weekend cliche two drive look crazy harm nothin shoe bare whistlin moneymaker never hey mouth tan-legged back yep haha foot slap keep mine red-red-red-red-red-red-redneck pretty day ta george treat
