title;artist;lyrics;filename
(All I Have To Do Is) Dream;The Nitty Gritty Dirt Band;day 'm gee night hold whenever mine wine embed might die love dream could feel lip also charm taste wiz blue want life tight make need likeonly ... time away trouble lyricswhen arm dreamin;(All I Have To Do Is) Dream by The Nitty Gritty Dirt Band.txt
(Call Me Your) Anything Man;Bobby Moore;nine hoe tuff runnin name trust liner rude ta bridge call fuckin keep bitin contac play trick doodoo run us go class isuzu dread try mail accumulate jack yo say emcee else dan come peace yeah rippin shit life kickin ever butter give time strap freestyle shuckin bryson head kinda jumpin bobby bed shootin put sleepin dryer soul cook good doobie puff game morning breathe niggas get fourembed blast year one swing rat 'bout fuck woody nothin lyric flier pump ca cool moody mamma gon four difference tony duck skunk jam build crew bungee parkay make need jokin aww brother blunts movie schoolin ai battle burnin motherfuckin prop king pappa doin russell moe check passtime omniscence hockey bust sleeve trooper since ganjy sire roughin pack brown peabo see might nosebleed goin g dee man two right crimestoppers money also david change sell mississippi propers y'all ya comin gutter gat bluff indeed mental yes earnin' sam b.b wo quail vagina last o'clock rhyme cause womack scale ring bunk i'm guru braxton 'm motherfucker like anything 'nuff skill must microphone onn ron 's fan fat straight still bong mcgruff weed nipsy never could snub shut enough black philly many lynchin top dirty bitch fly stay nun kool definite yale tight continental n't funky another nigga jivin' todd pass;(Call Me Your) Anything Man by Bobby Moore.txt
(Hey Wont You Play) Another Somebody Done Somebody Wrong Song;BJ Thomas;wont new get 's real brand lyricsit alone might play cry love go right feel song feeling baby wrong hey miss sad also lonely please hurting want likehey everybody tonight wo make melody home another n't cause babyembed somebody;(Hey Wont You Play) Another Somebody Done Somebody Wrong Song by BJ Thomas.txt
(How I Spent My Summer Vacation) Or A Day At The Beach With Pedro & Man - P;Cheech UNCERTAIN;throat frisbee pencil flat something wha ta call board turn go ow geek wave try yo-yo babboon 'll say come yeah throw everybody summer god clear vacation let butter weber someone give ... thanks people ah listen head excuse bug sand creep ahhhh back fool oh race good okay crawl towards within eat garbage get forget think hurry know guy one arrrggghhh baloney curl lifeguard ca please everything hot gon sure peanut step little stripe foot kind sorry shove ai skip daytime zoo ate hap first idea wait see might sucker likeoh bean around water private settle surf man twelve beautiful right two girl rest also stick wrong touch ya trashcan geronimo break tell place na kool-aid pier sleep dad spend catch dewey ha maybe really pedro neck wet golly manembed greek day 'm like aw hundred monkey far 's behind orange musta 're tower refried even feel lyricshey miss hey many wow fin fly blanket dessert watch look nightmare hand minute stand beach wash well shark n't big knock take wake;(How I Spent My Summer Vacation) Or A Day At The Beach With Pedro & Man - P by Cheech UNCERTAIN.txt
(I Believe) Theres Nothing Stronger Than Our Love;Paul AnkaOdia Coates UNCERTAIN;believe 'm full good 's know might loveembed nobody disappear 're love go could theres feel also baby loving lyricsi 'll always world somebody sadness likei surround madness near nothing care strong make give need nice worry really trouble ooh;(I Believe) Theres Nothing Stronger Than Our Love by Paul AnkaOdia Coates UNCERTAIN.txt
(if You Add) All The Love In The World;Mac Davis;grow side alone leave love us lyricsif 'll say ever give freedom time 've people away good get know completely plan living nothing lose live see might man right likeand also pain add overembed tell cause others heal way hate 's bad still 're hope could thing world stay move take;(if You Add) All The Love In The World by Mac Davis.txt
(If You Want It) Do It Yourself;Gloria Gaynor;'honey turn love go say 'll come waitin daddy someone away oh hopin get think year one prayin find lucky help lady may see might around wishin lookin also yourselfembed fortune likewell lyricsmany dad do-do-do day use way 's 're never ago want money' glass inspiration luck well;(If You Want It) Do It Yourself by Gloria Gaynor.txt
(Im Going By) The Stars In Your Eyes;Ron Banks;grows heart love go second pisces care let give chorus old repeat oh would know scorpio sky likecause gemini difference sure im make star need leo ai eye bear embed might taurus virgo girl also book lyricssagittarius heck cause maybe aquarius 'm zodiac 's still 're never could even capricorn happen look n't;(Im Going By) The Stars In Your Eyes by Ron Banks.txt
(Just Like) Romeo And Juliet;Sha Na Na;face de judge call turn lot wish rap 'll child helpless yeah shit give member complain mother slipper defect niggas get stigma forget think one mean ca nenem direction stop little make star oh-oh-oh-oh-oh-oh forehead fate sorry trump juliet weight nelson weak style moan first marquee everyone create foreigner family silence truth rest almost phrase wrong singer book ahem coyote day like line end straight poor even door meaning hillary world starve write blood esso trap hip fear image uh-uh slavery keep death leave lif travel yo say anti-bullet joke offer time drama people parent away mangrove head old wound back smile soul would dog toy faith djonga tim compton voice beat rewind depression law best huh live yet room see land person gift money russo translation problem ready tell stagnant screaming talk maybe pedro whoever raise jump clinton heal open tremble hop '' punch feel shoot english black walk arrest stepfather consume villain stand ge n't take motta whoa dress mouth drill idol gang bullet go cowardly victim come life god washington dieguin original easy pride bonnie airplane north doctor choice ih gaze sour south gravity tragedy men real brazil die early fuck successful bro gun reporter nothing hitler foot familis complicate lose wear soon reflection omelette prove sing junho might sucker fucking smoking right girl boy bull gangster differentiate rug earphone remind hero record neck motherfucker sense bad clyde pit grandmother cry never shakespearean envy thing earth dirty tongue fly much leader look system hand hurt self-esteem wake woman father defy renato bird run barabbas try gum cruel aim let ... bazooka pay axe educated know gauze excluded realize lyric capital wonder today everything living romeo ayrton `` saw hamlet maia ghetto scream concise ground also age speak body popo crazy close 'm dare 's sweatshirt work hereembed cigarette lustful already song miss many top tradition tear anyone crook want bring carlton hobby bahamas another narcissus carry nigga gossipy;(Just Like) Romeo And Juliet by Sha Na Na.txt
(Shu-Doo-Pa-Poo-Poop) Love Being Your Fool;Travis Wammack MISSING;fool shu-doo-pa-poo-poop love seem song miss wammack travis exist;(Shu-Doo-Pa-Poo-Poop) Love Being Your Fool by Travis Wammack MISSING.txt
50 Ways To Leave Your Lover;Paul Simon;gu light grieve something leave furthermore wish jack say 'll habit begin easy slip ooh head listen stan repeat back appreciate smile oh would morning lover get realize roy lyric please plan free kiss make need lose freeembed `` help believe key logically explain answer see might right also pain problem fifty sleep tonight wo struggle really crude like discuss way must new 's hop '' hope could intrude meaning bus much probably inside lee risk drop misconstrue 'd coy n't take;50 Ways To Leave Your Lover by Paul Simon.txt
7-6-5-4-3-2-1 (Blow Your Whistle);Gary Toms Empire UNCERTAIN;shake also might likeembed blow come whistle upyou body lyric get --;7-6-5-4-3-2-1 (Blow Your Whistle) by Gary Toms Empire UNCERTAIN.txt
9 Dream;John Lennon;name something call mirror go street likeon cold say bowakawa pousseembed away ah whisper soul rain strange think real sudden know seem dream nhoj start lyric hear spirit john heat long believe river air might around two also touch tree yes somebody magic music pousse unfold ago dance could feel walk warm take sound;9 Dream by John Lennon.txt
99 Miles From La;Albert Hammond;eye 'm like sandy hold rain count keep see gas might embed turn cry 're love read l.a dance windshield also phone telephone miss sail sign cover please fly write want pole l.a. hand radio lyricskeeping white kiss laugh wheel foot press ... mile beach need road pass;99 Miles From La by Albert Hammond.txt
A Friend Of Mine Is Going Blind;John Dawson Read;decomposing face relieve weep ware grow ringsend watching judge tuesday paperstuck furrow turn front chance nod goodheartedness pluck navelcord kraark waggoner clover et six werburgh tomorrow stitch il hindu swurls padded widowhood link upset sake affidavit plenty suddenly think nostril meet spray seem awry chamber redhot screen m'swiney cemetery little awfullygladaseeagain urbright boroimhe star mulligan pompously crofton adelite reply poisoned devious tenantless however selfwilled possibly clad unresisting cost byrne eldest brian clutch german font intelligent silver bleak scribble trifle putty jewel funeral tree break aside mesias deadhouse upon furniture gold greystones sleep caress produce lino mistake fold knelt wet saviour like purple floor molly turf line decisively price coffincart end reward wither tramtrack tannery gramophone liver weed thousand pointing even disc stroke buttonless grand cork fullblooded write ye draw clue dillon bog reason student richie trap hip meant chuck image dying dutch hasp roar cabbage earthy hold shouldered whenever human bob bridge toil windingsheet greatly gas death unbutton twirl half chatter nisi yellow tweed pick hellohellohello palmer church time round buries stumping bright broadly standard a.m. rtststr ireland old tiptop hospital recognise clamp irish cockle game pitchdark spice coroner interesting silkhatted bloom leah sorrowful piously handkerchief collar gravel loose frogmore lurch chap venetian parsee legal free felt blackedged riordan broken gravesores armlet find conceive quay traverse swerve charnelhouses tomboy simply help counterjumper king hill resurrection mass answer see poco canvas batch water sustain fawcett court shade money spell gallaher dollard woe decease tell crushed ease slender passing hynes daisychain ferry county wisp jump shoulder way night drily unpleasant policeman confirm mathew cunningham portly female bulk spoke vacant wife lead curse alleyne corner shame queen repose take botanic insurance betide grass boot mutely topnobbers dress ten huggermugger camp ward carnal apprehension invention saul unconscious experience outside oblige gate ow lily visit quick rope bony auction major everybody farrell violet ee waistcoatpocket upright cure coleman softly gown forgive honeycomb gaze slow sheep whisper pane fine bennett slaughterhouse watchchain amawfullyglad asia practically granite afraid cousin club hole crusoe always service fore wheeling ruffian escape pennyweight sleeve hair careful since assure awhile brown damn pack stonecutter sensible glance patience amid sad germany boy meade ballsbridge part invaluable leopold sepulchre chilly brute streetorgan tamely window stifled auditor galoot margarine rippedup springer clothing tail ago coffinband corny shift wind subdue earth prospect flank skull croup hand nun knob loop choked shave liberator breech spruce canvass whip band stratton easter saucepan wake full namesake passer nearer convulsion something infliction coastward livid clean dive hospice lambert condemn pointsman roadway midst plasto skin plod divided thumb begin innocent deathchamber tuo ... june beard assent month chapel hidingplace stow turnip harshed towards wrongfully waterway bend know eight dustbrown west forth refuse flaxseed i. tom metal prius wonder bank machine thy living drive drunk heard expect extraordinary bros obtainable burn secretsearching engage priest saw leanjawed unheeded besides charity croak bust ordinary grilled bear possible train set pleasure silly-milly around pretty fragment beautiful drawn jolly cigar serious sod landslip table pocket throng body crape geary green decompose yoke disturb close figure opera e madame fair whore block levant anything caper doyle silently must rag fashion vitals slat lord desire o'callaghan stump fat past slack blottingpaper tenement baby health miss panel harpy nut sinking fluent bring together rumpsteak bared robert croppy boss minute luck sphincter neat picture especially crumble accountant slowly eyelid brass gentleman lantern awful afresh fruit heart vorrei love inning team balance tour blaze lip traveller dead 'll agony laughing sprout exhume armful square starving knocker laugh turkish nevermore cheesy someone give houseboat tip apollo bowlinggreen gordon j. screened anderson later iron haunt accept mother stuffed express ignatius forget treacherous rare replace wayside lankylooking have-you resume ca please jerome mamma shape ought stop stiff deal barge make ideal barrow tooraloom sorry next stuffy likely check m'intosh jogging admire blueglancing whatever lying-in server m'cann silence fish kernan bonnet almost show politeness speaking james waste commodious book decent foul week papli poison ripple perch road felly huuuh hewn orifice pup somebody day chief hire campbell inexpressible gurls course smiling statue catapult railway businessmen disappear tribe spurgeon switch ned door queer knee domine-namine dullgarbed eulogy opened stink quicker 'd basin unmarried slouch value wide breed character ay organ sunlit contract china condole mi regular native jarvies quid quinlan beefsteak caretaker bargain married mastiansky point jack powerful white grind pip haft dennany crypt antonio trade away head fade liquor shower lithe papa lucia fowl uncertain chest peake frockcoat dot dog view march mine faith deathday thomas cash soprano christian start jesus enter consort breast amusing cover notepaper mind bent protect gesture twist swirl dwarf nail law mark mouse whisk caesar elvery railing sadly putrefy river foundation dye air terrace widow land chainies matter truck distress residence intres towpath faithful carefully fifty party though rampage double joylessly surprise swear opportunity bottom whoever arm thigh oot raymond murderer athos pray geisha uncovered open vain hundred nudge homage comedown poke domine stake p.m. wriggle ownio plinth hope cross feel happen drain ne business inquest sexton quickly angry stand clasp substance wash big paddy knock piebald horrid mortgage nine evidence bow greyish mausoleum temper hide beauty cheek beautify patronage flower doorframe bloodvessel pace morgue whitelined else chapfallen large bloodless scarlatina life god shovel aunt mount plant maccormack bed rome moira weigh lilactree men box spoon three rudy pure bite instead goner callan kay expression pump taste ulysses puzzle mildew harm split foot cap royal agree throstle incline notebook arrangement gardener martin across paul grudge eye long hang till key beside uncover prayingdesks pub shiver pause docket lethal misadventure lofty soft gasp right companion communication ruin thread nil servant awe add gravetrestles bam branded measure pole sway grime consolation mauve clock dunphy smoother shake praise quicklime kneel torchlight remind drover college robinson really fifteen outrage affirm glimmer review crissie shirt phibsborough floey toad simple clonsilla independent o'er sense maggot sparrow holy 're hell beckon bulge poem could shut friend lowdown usually notice contaminated nephew much nimbly country look monumental baldheaded streak tight stood tiny rip carriage blessed remains mush requiem jury rise gnaw crosbie odd marry bird hellohello run mortify fun bias waterford sort beggar cold object jerk recent fifth middle raw dropping shakespeare mortuis fresh peter important picnic dogbiscuits pullman quarter spine leather kneecap morning wy briskly cheerful speech artist fleming acre treasure infernal custom crustcrumbs tap exclaim expire sky artery everything exhaust backache florin form obese gloomy prosperous tramp wren brother thrill coil coach jolt palm prop hugecloaked temporary stuck redlabelled idea catastrophe measles become thinking abreast emery toe twelve develop ground sell ivy age usual bootlace mourner crowd flag remember along use profound clot misericordiae emigrant touchy grig crown sunlight pop behind extreme alderman apex announce suffering ambush milk fell solicitor top crook consist climb want bag left hobby stager overhear kick inside trunk childbirth embalm quiff convivial gravely municipal office raft warm underground well oyster ell carry wrench chinese anyway gamble watery tritonville compare warning side hard blade paltry wish hurl wax child empty simnel transit peace summer eugene wood breath ever handsome ghost colour unless invent bastard seventh young trouble wretch photograph macintosh brush churchyard creep cook brandnew rudely suppose get fault sinner voglio bowl naumann insanity hoarding fill dick hear corpus murren save carcass cattle leg weight opium sacred feeding nelson tramway circulation bump lyricsmartin tougher handy butcher first explain eagerness swell airhole gloom dawson scan mildly keyes wrong stick callboy sun drawl stew saint yes wo spend fellow cause yard rattle occasion heir anybody irishman l path sharp tre boatman still pity lease poor trenchant discreet cream smoke burst golden aboard matchbox slacktethered tramtracks ash trundled hover drop disfavour gallop collis muscular todd troy pass mullingar tall card umbrella relic swiftly shadow sol firm high coward leave ra share news bung travel seat cough drown weeps wander stone decency curbstone shocked unclean joke near cardinal reproof dirt hawker fit guilty nice emerge commissioner alive coombe un reuben verdict smile coffey candle letter spit hoof rat christ diningroom nature lie curve wore dig affection silly shall liverpool flesh step basket wrinkle o'grady pillow scrawl sally drunkard tivy act builder wedding ad maggoty believe gravedigger best thrush mervyn depart yet hhhn england son cart lighten downward branch heavier number change great pillar lookout middleaged rutland rub knowledge kelly pin gasworks garden press consumptive preserved catch jot poldy maybe memorial habeas martha coalshoot thirty dear hooper wordsworth byproduct cobbled louis twice instinct seymour new agent smith deuce budge crush opposite quite cheap doublequick ant epicure tower werner evil rattling lilt walk grief raddle special damp rollick creaking shampoo spot cut clod every n't doubledyed tick bandmann cake ballad midland avenue broad maxim blind sigh mouth mortuary mulcahy ree electric rendering berkeley loss deftly go street bushe strike tombstone sliding cease ear slop stole hume quiet thanks among cramp doctor jingo faction straddle feverpits dung frown lane envelope real paradisum grace cone year pill appear die pull horn maze influenza philip salute menton lowered nothing civil fancy hunt fog house bottle wear insure lonesome breadcrumbs gravehead sculptor temperance newly fall rusty poetical darkly plot particular grumble wait peer embed might ninetynine carrion crossguns devil telephone dinge cycle elixir oven grave dressy corpsemanure gill pristine lean hero dedicate repent depend gumption arrive glad whiff pulpit learn pleased opening pauper saturday outlive clip never falconer friendly stamer gruesome sidepath thing huge brunswick burial twentyseven mummies plaster probably stream dicky stain muzzle hurt kindly traipse intently society smell roo tomb wreath judicium sympathetic propose charitable father purpose dun hobbledehoy late costdrawer hotel play killarney barabbas newspaper bristol shaded frontlet try satisfy parkgate bath heavy fast curious field everywhere dreadful clear mrs type william athlone let feed mater brink sideways wipe slip encouraging eccles lazarus mudchoked dry heavily good terrible slavey wholesale tidy ahead delirium blink penny feeling pink sign art emmet rueful ajar solid trot cell irishtown bleed tiresome sure twenty finelooking daisy hamlet tender finglas greatgrandfather sinico lady true brim circumstantial poplar mason car darling gentle weapon latin hairy hazard dealer clatter also jove pain language speak graf scene blessington tonight journey darken peak leonard hum anyhow properly unfolded others 'm trundle protestant dare thou hat hate 's sock work tallowy fluke read garland tear tread anyone prayer daresay immortelle dignam paper move soap blank grin lightly sound o'connell corpse murder shot evening de gramme call pleasantest follow whoop us milly lot cheer deadborn barleycorn inner victoria fryingpan causeway blunt edge tickle pomp wall coon pirouette pierce kelleher finish worth o'brien blackbearded race funereal spade invisible rain kill scrap stretch unite one smooth mean daniel goulding anniversary canvassing quietly secret bully bleat hely noiselessly dubiously marriage drove rather mourning noisily politely catacomb town c. cad float eagerly instant rush collapse respect weak incurable chummies dreamt rook acknowledgment count no-one dodder breakdown inked family private shilling straighten rest snuff slam tone descendant departed sail unclasp fee company lift otherwise flee steer crock landlady cup sleekcombed creak weeper five awfully interest owe reed appealing behold softy root immense rank bloodshot obligation bachelor short bone industrious dance mat sluice superstition tentationem enough cremation postmortem dressing ask world determine blood sometimes dark par asleep yawn boat fear thwart drunken boylan healthy monday keep singing alone purgatory tuft dodge bulletin upcast lay bill handle parnell story youngster say shortly cartload seventeen epidemic foggy thursday cum care horse people isle whew nearly suit school brow dust fogarty plague wellcut back soul stuff dinner would goodlooking lowry pound tramline thank eat brother-in-law marion sudden frequent height brayed bom crumb pas ennis hot heaven voice without kiss instance pat capsize accord piking pallbearer mate bugabu j pebble bunch lump live giant spat meat room antient ooze peep grey person catholic cheese noisy two nap fright treble inmost drink fidus ready place perhaps mary indeed curved infanticide sergeant tram stumble home chancel talk mercy raise imagine dangle sea hour deathmoths buried jaw reverend charley lovely far hop lock riverbed punch bier word canal hind corporation tape black friday sit jimmy guncarriage suicide chiseller oblong afternoon often job hoist moment name moyvalley veiled account roastbeef bald kraahraark eh sweet nose dismal lap freeman bottleworks per polish eleven gray donkey grating halt servo doom ben dan sappyhead fling come apart animal habit wilkinson used simon finger tinge embrace drag easy case gallon juicy dr headshake edging paint low inducas illness position seriously fact impressive bore darn jupiter prudent elster fire shear shoelace angel weather craped national grove kind oath lose grant hearse john soon shove powder dedalus least snarl breedy beyond soil bury roll automatic dublin ramble man policy coffin girl understand roundtown whiteflattened touch clay sight barmaid henry elephant fascination pleasant skeowways laughter last husband tea non neck clare transfer circle dislike sir graveyard power milan solemnity saloon stationery cuffe m'coy underneath bad silent mortal nobody cry tweedy wise rein gently leixlip shutter gaiety cent armstrap carriagewindow clap paradise straw burner krpthsth fly blue jew happy watch mourn park seaside stage obituary stay saltwhite glass voyage wallace whitesmocked tedious space mute waltz blow h. guide send ides poppy hoo frayed safety lombard overdose slipperslappers woman light idle treacle corps sunday altarlist physician tho silk red dull second lately aim volley fare crack memory calm bloody peck present bee weedy thirteen ah pay kitchen bucket whole coatsleeve excuse rotunda put amawf mild thee strange eton moustache profit hurry unweeded terence return achates four romeo liffey wheelwright obey pawn seal wheel dawn wisdom squint haulage raindrop albert artane retrospective thought natural mr rot sidedoors disgrace lung tantalus thoroughfare funny buff resignedly crazy hall browne trim hello colander theatre trema mound strong struggle whose belly term plum heel concert slime plume tantalise bit vault row hades already passout twentyseventh song pant many bronzefoil waggon shook crampton plump flash allow buy eightpence pear toddle fountain another saddened;A Friend Of Mine Is Going Blind by John Dawson Read.txt
A Hurricane Is Coming Tonite;Carol Douglas;hurricane tonite sweet call outside force go street sin ball drown child come yeah give away head smile lover know lyric nature everything gon house honey fall true embed might around water also score na shake messing tonight swear like 'm 's temperature 're even feel baby wind door watch look gather wash take barometer;A Hurricane Is Coming Tonite by Carol Douglas.txt
A Lovers Question;Loggins;rise sweet caed call grows auld ram mak thorn yonder sheer cam blossom peacock sheaf bonny question time stitch sickle strand finish needlework dry withoot leather shell feather rain thee lover get lyricsas mine bloom three one oer meet acre horn grain corn likeembed aa shall bind ran wi sow hill neer since may bear moor answer might land water also ill youve untae plough cambric wee maun atween sea oot adam shirt nell lass work youll longing never saut fell ask unto bring noo mineyou wash well every stook;A Lovers Question by Loggins.txt
