title;artist;lyrics;filename
Kiss Him Goodbye;The Nylons;eye whoa lyricsyou remember fallin way comfort would willin' 's flirtin know might ahead heart still love go never even bye baby also cheer hey fallin' always tear 'll likeembed break ready thrillin na near though kiss oo strong n't cause goodbye repeat;Kiss Him Goodbye by The Nylons.txt
Kiss You (When Its Dangerous);Eight Seconds;mouth red flower point 'll heavy easy someone ... dangerous ah pay chorus fine back would polygram rain get winter know sens wonder please kiss likesenses wear vocal garment lyricslifeline long hair true see might pretty right also danger unfair incembed strong wo catch last close record 'm like line night must price 's sense never thing adorn walk much clue want look beware well n't;Kiss You (When Its Dangerous) by Eight Seconds.txt
La Bamba;Los Lobos MISSING;la lobos seem bamba exist song los miss;La Bamba by Los Lobos MISSING.txt
La Isla Bonita;Madonna;sting ama face call high play love go ear fast care isla bonita spanish time young away samba yesterday would know translationsturkceportuguesla seem pa-pa-pa-pa-pa lyric nature sky verdad free el `` tropical eye long te dreamt lullaby set might island beautiful girl also boy que sun wild puede san last siesta pedro pa-pa-pa-pa-pa-pa-pa-pa sea ring ah-ah day like como pray night desert far lullabyembed dijo 's '' never song fell wind amo la-la-la-la-la-la-la world watch want ser warm 'd carry la breeze;La Isla Bonita by Madonna.txt
Land Of Confusion;Genesis;superman name hold alight keep control love street go news try say 'll come life let give time 've people round away bright ooh haunt worth put oh march men know million dream start lyric showing fire ca today everything hear living foot burn make star lose long steel live scream see might land right also wrong problem somehow sun tell promise danger place toembed yes tonight wo laughter home generation hour remember shin use like power night confusion must 's still 're never ago read thousand many much world look hand fight stand tight move n't future sound;Land Of Confusion by Genesis.txt
Lean On Me;Club Nouveau;call sorrow 'll say life let pride tomorrow swallow oh know one lyric fill always please gon jam uh need brother borrow help long might 'til understand show also pain problem na nowembed strong wo lean somebody 'm 's wise 're friend baby thing hey likei hand sometimes 'd n't carry;Lean On Me by Club Nouveau.txt
Learning To Fly;Pink Floyd;tension light hold watering shadow compare keep warning alone turn vapor sensation try point empty fast field stone ice misfit twisted tip fatal back bliss soul morning think stretch dream ribbon lyric trail sens ca sky iembed everything tongue-tied form mind planet attraction fancy halo find across unheeded eye escape roof grubby air see might thought ground right also unladen navigator irresistible reel home animation circle like way windswept unthreatened night learn condition 's cloud could earthbound black translationsnederlandslearning fly prayer determine suspended distance corner stand wing state blow n't grasp flight;Learning To Fly by Pink Floyd.txt
Lessons In Love;Level 42;keep mold hard turn heart leave love go us wave try 'll drown heavy yeah ever let time 've fulfil reach fade sand good shore return dream lyric lie lesson felt sure without build spirit doubt burn lose eye footprint live overboard wait loveembed might truth also wrong proud restless break wad nowhere lifeboat home sea 'm like use learn 's ignore deep never hope egos word could enough token n't future take 'till;Lessons In Love by Level 42.txt
Let Me Be The One;Expose;trust hold alone play leave heart love go 'll come ever let give time people away fade game get think real know belong one dream instead lyric fill make need saw long tender fall true first might two show also touch promise strong timeembed cause close like way new 's brand never feel much together want sometimes n't;Let Me Be The One by Expose.txt
Lets Dance;Chris Rea;full soul true sing far 's see know bad might heart one certainly chance love 're never dream dance go also many thing joy tear likeembed world heaven bring near let catch time danceyou away lyricswhen fear moment;Lets Dance by Chris Rea.txt
Lets Go!;Wang Chung;whoa onembed anyway hold sweet ballroom love go share wish 'll say come edge let case time motion existence reach away listen back oh rhythm get meet 'cause ca today heaven foot float long sayin' might right also language talk arm cue floor 'm block way 's end 're dance could baby top lyricsmeet world likei restaurant want together level drop space 'd blow every n't isolation take mountain anywhere;Lets Go! by Wang Chung.txt
Lets Wait Awhile;Janet Jackson;something frighten late love go share try say 'll let give time bright later ooh honest slow worth oh would good get think real know lyric feeling ca always sure make save star endeavor rush first awhile wait might right also great show waitembed tell promise strong talk really remember shin like night longer far 's 're quite never feel thing much special want together stay n't take;Lets Wait Awhile by Janet Jackson.txt
Lets Work;Mick Jagger;woman tall sigh greedy poverty come yeah breath let dirt slave oh eat get kill generosity translationsportugueslets start lyric seedy gon free make yeahembed lose humility ai clouds live might energy man show also touch waste proud na wo butt like way shirt owe la-la-la-la-la 's cloud work deep cry 're enemy lazy wan rut sit nut world bring look hurt stand ecstasy n't take sweat;Lets Work by Mick Jagger.txt
Lies;Jonathan Butler;blind lieembed call side cheat heart love lyricsuh-oh story wish say yeah wicked white ever someone give time message ooh vow old oh lover mine think faith deceive realize lie hear voice saw strangest long eye believe true live web see might man girl understand also break tell shake swear catch likewhoa hate 's end 're never ago read could baby friend hand well n't take;Lies by Jonathan Butler.txt
