title;artist;lyrics;filename
Leave (Get Out);JoJo;breakin' hold ta call late bae heart leave chance go cold say come yeah ever give time 've choice head back oh would blame get think know one refuse 'bout 'cause lyric phone lie wonder ca always everything gon uh make pillow confused forever eye sayin' mmh bump fall wait might truth right number also somethin treat ya boy waste tell promise na wo last talk maybe day 'm way like night must 's mmm work end behind cry ohembed 're hope never word could feel friend hey sit anyone tear together want look buy tight well every n't;Leave (Get Out) by JoJo.txt
Let Me In;Young Buck;jumping nine hoe light shot name hold shine yayo call keep gang hard leave thug run love go henny street hood handle loser stack sin cold win em thats ball 'll come yeah g-g-g-g-g-g-unit begin attention life daddy let panty time bar benet young school trouble pay couple old bounce whole watchin eminem back folk rhythm niggas dog hopin get mine listening outline real handcuff know year tech vice dream fuck raaaaa lyric security club sign teeth ca momma stunt gon beef hot stop dope step crips make need bottle winembed buck soon ai cop holla oldie prison motto i.d eric live gd count damn see grammys might car berry miami peep wit two note nickel chopper money also mad bub ya y'all drink boy break in-in aight fifty na gold party cashville tonight home spend winner cause really imagine neck halle bet like 'm g-unit block pray shorty 'em 's tryin sock homie lord end deep cry i'mma still rock behind never weed shinin diamond cent pair feel enough bout wife miss shoot smoke walk bitch fly bitches probably fiend gim want alright buy blood wrists stand reason n't move teach rid take nigga perform;Let Me In by Young Buck.txt
Let Me Love You;Mario;full woman beauty control love go story say yeah perfume everywhere type let give ah listen head description ooh worth back oh good suppose get deserve know one 'bout 'cause lyric lie dime everything stop enjoy protection make star need worry babyembed doin believe true whatever might around toe man right bein girl show also stick comin na stare home fistful ring like way shirt night 's bad 're never selection diamond even baby wan thing hey mmmm want together look hand hurt makeup 'd every n't shame plus smell take;Let Me Love You by Mario.txt
Lets Be Us Again;Lonestar;heart us try say 'll come life ever let pride reach head back smile oh would know 'cause lyric ca please likeembed everything without make lose sorry wait see might right also tell tonight wo imagine 'm way anything againyou open 's end past 're even baby thing want look stand 'd n't take;Lets Be Us Again by Lonestar.txt
Lets Get Away;TI;whoa erase woman ay asian light name cuz face use translatin partner take'em keepin high station keep side juice adjacent gentleman date chance popper go front girlfriend rollerskatin' .. second apple sheet yo say heavy indian come waitin daddy skirt shit ice white blunt type kickin jersey pimp let make'em impatient memory panty ... whachu give time young tomorrow away flick tire listen kinda trouble month whole willin excuse watchin playin italian dayton south smile oh layin would aggravation killin get 'cross pussy think cali know askin to'em beggin ricans replace virgin one freak w- removin smooth spit start lyric got'em hug hear linen freak'em day bent collaborangelle uh tell'em kiss brazilian til meetin flirtin' feenin act bottle `` malibu town pine ai lightskinned chill king style itchin wake puerto phizzle lady sing leavin tint pimpin houston 'burban room offend embed might around lookin miami goin pretty toe gettin two nightlife right jazze also stick somethin virginia jamaican ya sippin fillin dodgin'em boy ridin tell place city na laughin classy chilllin relation nasty talk uhh lickin opportunity accent requestin butt wet vega cup e hustle breakin bet like yea 'm semen wit'em naked way dude orleans t.i t.i.p. 'em new hat shawty 's moist chillin 'lac end hop behind thinkin '' hope t.i. bout friend wife baby hey black many dro wan grand dirty feelin relieve'em want futuristic cut state demonstration haitian n't talkin c'mon sprung sound;Lets Get Away by TI.txt
Lets Get It Started;The Black Eyed Peas;full remix cant promo ta dancing ritmo uprah pow heart front love ra go scary boom half hook wah november jon unreleased peace positivity pepsi life verse ga let time lil countdown back sumthin game get real bend year start freshb-sideselephunk pump havana dope friddy single rd make complicate house mama movie phunk feat lyricsunreleased live embed demo urbz streamable. boy add mix lopez travis barker party sticky b-side da cha spike steppin simlish dew edition dont way night chicago unknown monkey ep jennifer bad still rock dance version shut song jaba miss hey lmfao dirty business blue hump want steamable.;Lets Get It Started by The Black Eyed Peas.txt
Lets Go;Trick Daddy;ay border v.i ta tough actor fuckin swingin trick celebrity thug america run front go street slaughter hood dade try lot m.o 'll jon psycho come yeah shit daddy everybody yeaaaahhhh square type let hit twisted give lil drama thugsters penicillin flo whole south fool good sk get spit know pretend tote 'bout hennessy fuck lyric club ca momma gon gun crew scar need act bottle wanted `` fo-fo homies ai fah ghetto rush finna style rapper industry hustler answer fury see embed might killer miami lookin goin soft ballers bein dealer kin also comin somethin ya jim tell gat aight part city na tonight cause ay-ay-ay-ay-ay-ay ak somebody county 'm like murderer strictly bougie chicago dude 'em crush 's twista i'mma scrilla straight still '' never already rollin enemy m-i-a loud even -- door hahahahahahahaaaa friend cute impressin johnson feelin script playa bitch want bumpin alright cat kick hennessey stand overnight steal big n't mop nigga bogus chop clique crissy bout;Lets Go by Trick Daddy.txt
Letters From Home;John Michael Montgomery;boot hold something soldier call keep hard alone love go say 'll pick daddy waitin laugh television june x 've wipe kitchen callin dry put back layin good rain letter get johnsonville know one 'bout nothin 'cause lyric everything stubborn sure gun scar kissin find dawn make saw occur ai long eye best honey drivin homeembed son might man ol almost show buddy also y'all proud funny part sleep tonight home catch fold talk cause ring dear 'm like way shirt night sittin 's work cry 're hope read could much write alright wonderin missin well n't send take mama muddy;Letters From Home by John Michael Montgomery.txt
Little Moments;Brad Paisley;face mouth hold imperfection hard heart go lay red try tinglin 'll say yeah god let laugh time back would thank get forget sudden know year darn lyric ca cover likeembed plan hear direction little angel burn house act lose boring fall live first see might pretty misread track birthday right truck change also mad detector sofa last cause arm thatyou remember like shoulder 's bad cry 're never word even could smoke cute dirty much want perfect look hand dark well every n't move cake take asleep wake steal moment numb;Little Moments by Brad Paisley.txt
Live Like You Were Dying;Tim McGraw;eagle name sweet hard chance love go news imposition lot second say come life dyin'embed fu hit forgiveness give time 've tomorrow dyin' finally would good get deny think real sudden year three die 'bout early lyric sky dime stop option divin' kind lose next long manchu live might become lookin goin gift man also ya bull book eternity speak fishing dad spend husband really day like x-rays 's end deep hope read could friend ask fly sweeter watch look rocky sink 'd well n't talkin take mountain climbin' someday moment;Live Like You Were Dying by Tim McGraw.txt
Locked Up;Akon;dress lock-down call lawyer registration love go forward visit empty come fast life -tration let freedom magazine away ooh head couple pay accept put back commissary re-up oh get forget order seem 'bout fuck instead lyric phone fire ca please cell stop without find make ai cop key ohhh damn wait might around car visitation family matter right tryna girl money stash sell motive also steady ohh patrollin food wo uptown last cause closer 'm block like longer far 's lock product upembed mat baby much fiend want bag corner steal n't move send nigga undercovers;Locked Up by Akon.txt
Loco;David Lee Murphy;torch light shot grill grow keep charcoal run go alrightembed half say 'll yeah life vacation lime time whole oh get plug forget hangin lyricslittle know pretend west nothin losin 'cause jean t-shirt store fire cool everything hot gon mind little make need hula loco town ok long key honey live might insane pepper right girl also wrong likeyeah na crazy babe close dear rule joes 'm like 's tiki work bit end nobody deep 're never livin word feel sloppy baby hey excitement want alright salt buy glass hurt cut well;Loco by David Lee Murphy.txt
Long Black Train;Josh Turner;name father a-drivin beauty heart go victory sin say peace yeah everybody middle ride let mile away destination worth back soul good makin know remain whistle 'cause lyric wonder sky hear heaven protection find brother lose feedin burnin long eye engineer train might redemption also devil comin cryin' pain ridin trainembed nowhere starin stare a-waitin ticket like line rail must 's lord holy '' evil black watch look stay well n't cling sound;Long Black Train by Josh Turner.txt
Lose My Breath;Destinys Child;partner keep none hard go drum try satisfy say come fast yeah breath grind let hit easy give ooh slow put breathe fact get know noise meet 'huh seem lifeguard lyric lie ca huh' everything affection steppin' direction difference drive beat protection wheel make find need lose act `` ai believe prove huh see embed might darkchild wit two man right understand also boy ya na ooh-ooh startin grab adolescent ha talk really like 'm way halfway tryin 's dismiss deep 're '' boo could baby wan thing ask much business movin bring clue want groove paper n't move teach take swim mama;Lose My Breath by Destinys Child.txt
Love Me Right (Oh Sheila);Angel City;ta keep hard love fun come let ... 've listen ooh oh morning put'n get hangin think know one seem likeooh start fill ca gon lyricsooh male need coz plain till honey wait see might man right understand also na oneembed qualify somebody others 'm way 's .... baby friend want sheila hurt n't sugar;Love Me Right (Oh Sheila) by Angel City.txt
Love Song;311;long 'm like whenever far whatever clean might alone love fun word feel song lyric also always say likeembed youyou free stay make home young away however whole;Love Song by 311.txt
Love You More;Ginuwine;hold something high leave love go say 'll else come yeah life ride let give ... time 've listen valley ooh put fine comfort smile soul suppose happiness know mean treasure lyric gon stop felt mind kiss nothing make forever best since might family show also promise everyday na wo spend really raise 'm like sayembed way night 's work end 're never baby wan wife friend top fly bring rainbow inside reason every n't piece;Love You More by Ginuwine.txt
Lovers And Friends;Lil Jon;rub-a-dubbing shot v.i.p hold beep something patron whipping ta grow call alone turn heart leave play go yo say 'll jon bathtub ah-hooh yeah begin ride let ever impatient uh-huh lil time route ah slow fine back oh good would lover get know huxtable one mean rudy pull dream bite fuck 'cause lyric hug ca please gon hear stop sure mind beat uh separate nothing kiss make pillow feenin leg `` ai squeezing long holla check lady sing first see set might embed around man ohhhh right girl change shotgun also touch boy jodeci spin ready tell promise scene na shake tonight usher crowd choose really trip record butt day 'm like way use anything line night aw open 'em bud shawty 's mess end luda 're hope '' ludacris dance never cross could feel friend baby guess wan hey hugging want look hand fight inside comfortable dark 'd n't take oh-oh-oh nigga ursher sometime gt sound;Lovers And Friends by Lil Jon.txt
Loves Divine;Seal;blind name love try belief say come throw give time 've message forgive oh forsake bend know realize 'cause lyric lie please sanctuary felt spirit nothing find need lose plain help believe live see become might around show also wrong break divine promise mistake wo like along rainstorm 's still prayer fly reality inside nameembed well n't take;Loves Divine by Seal.txt
Lying From You;Linkin Park;criminal alone turn run go try second 'll say life pullin let exactly away back stealin would forget think bend know pretend 'cause lyric lie ca always everything ought rather push listenin see embed might person truth also turnin aside part na condescend turning talk really like 'm way remember bad never wan fittin want look stay 'd n't teach take anywhere;Lying From You by Linkin Park.txt
Maps;Yeah Yeah Yeahs;'m like oh 's pack map wait youembed might straight love enough lyric also say 'll stay stray make kind n't;Maps by Yeah Yeah Yeahs.txt
Mayberry;Rascal Flatts;name sunday call high map turn street try pace string fast coke yeah god white dirt time people six ooh list old slow watchin faster strain back na-na pickin get nanananananaembed one noise dream pas 'cause lyric ca aah always everything hear less endless foot worry mayberry drivin naturally roll first son might natural rest two porch bye also tree shoutin' spin pole city na nanananana fishing disaster dad pass road na-na-na-na-na-na day like window 'm sittin drinkin 's cloud process disappear ice-cold even feel wind miss black earth world fly climb look sometimes blow nananananana n't every carry mountain cherry progress wake;Mayberry by Rascal Flatts.txt
Me Against The Music;Britney Spears;zone runnin uh-uh face something bare partner ta keep control turn go drum sexy pace say come yeah pullin care let uh-huh hit tip time people speaker vein soul chic-a-tah would good rhythm saddle get think one dancin rapid lyric ca hot beat uh burn rather make lose 'round battle long huh drippin hair lady explain see embed might competition hesitate toe bass tryna also almost show britney ya ready whippin place body na party stare grab tonight i'ma crowd really somebody 'm like floor music night 's work bad 're hell dance friendly feel song baby wan waist hey feelin watch movin minute 'd n't wantin hip take sweat;Me Against The Music by Britney Spears.txt
Me Myself And I;Beyonce;woman blind trust shine ta cheat front love us go try lot translationsportuguesme say dumb 'll come yeah warn pick time 've people young yeah-yeah vow low callin oh foolish would controlling rain bey havin get think know one three scheme dream realize nothin loose lyric hee cool ca iembed everything silly smarter gon kid stop deal find make need trippin' next homies help ai doin eye believe naive best whoa-oh lady sing see might goin family wit man right also wrong sun clothes tell whoa-oh-ha strong home spend last changed survive road compete day 'm like regret along way learn 's end oh-oh cry past still 're never thousand disappoint even feel fell friend thing hey many hurt n't move take yeah-eah;Me Myself And I by Beyonce.txt
Meant To Live;Switchfoot;father somewhere providence try half second liveyou yeah life offer 've attempt men mean dream lyric wonder likeembed everything bent broken lose mouse eye live confidence ah-we scream might also war fail maybe got argument open fumble 's hop 're livin world fly much want inside whether meant pass;Meant To Live by Switchfoot.txt
Megalomaniac;Incubus;eye like mean scissor hold oh open would sent clean 's answer see might alone one elvis meet 're us fuck never jesus lyric also screen baby hey hear heaven yeah radio hand step fight megalomaniac permeate appendage unkind wing cut ... 'd wash principle ooh downembed;Megalomaniac by Incubus.txt
Milkshake;Kelis;go 'll pick thief time smart blend oh within good get think know guy freak scent lyric maintain ca mind milkshake halo make lose next squint la-la eye damn wait see everyone might right also charm boy crazy technique catch yard like way brings must 's 're wind thing watch want bring look perfect buy charge chargeembed warm n't teach plus la involve;Milkshake by Kelis.txt
Monday Morning Church;Alan Jackson;full monday hymns sunday heart leave love lay piano bible say empty come god church 've drawerembed lid dust whisper put morning get deserve faith seem 'cause jesus lyric anymore ca service yell hear heaven sure without find make believe key drawer since might man ground girl almost also devil faithful tell preacher nowhere talk close 'm like use bad still '' miss thing sit dresser prayer hurt n't take collect;Monday Morning Church by Alan Jackson.txt
More & More;Joe;bedroom face monday ta love go .. 'll say come give ... time kitchen bed um fine oh get know lyric please hear willing living drive joe mind kiss make house next ai long lady sing whatever scream room embed might girl stair also problem speak place na crazy spend like 'm floor anything night 's straight 're even baby wan want look stay dining guarantee level n't take bout;More & More by Joe.txt
Move Ya Body;Nina Sky;woah hold yuh shine slowly flow turn heart love go lip market yo say fast everybody lick ride let grind goembed listen ooh head slow whisper oh within towards rhythm get know one seem pas lyric club imma ca fella hot stop beat crew make `` trough eye long approach first see might massive toe right girl also touch ya singer ey part body party grab strong catch babe closer jabba really vibe warmer 'm floor use way like must new whoo brand worldwide dancefloor behind '' 're dance feel baby wind hey feelin fly probably alright want look group hand groove stand dark warm big move n't hip take;Move Ya Body by Nina Sky.txt
Mr Mom;Lonestar;shop nine monday sweet mr. high hard leave charcoal go bill juggle gum say come yeah barney time six stave list checkbook chair bed pampers soccer dryer oh eat dog get think know balancin one squeeze potato 'cause lyric hug ballet kid pta gon kiss rewind eighteenth nothing find make crayon lose `` long drawer melt honey fall hair seven might football man nap also mad classified page mom na crazy tonight wo dad home fifteenth day like 'm maytag scout heroembed 's work bad '' 're bubble feel lazy baby smoke much watch look breakfast well another n't sixteenth cake take tv job sound;Mr Mom by Lonestar.txt
Mud On The Tires;Brad Paisley;nine four-wheel blind hold campfire outside run us mud news try say come throw middle clear dirt let test nice 've time tire moonlight finally good get know year one catfish lyric tiresembed bank trot drive sure mind duck build little star need hardly lake key sing stuck count wait set might sleeping two cricket girl also sun tell place nowhere chevrolet grab cause road 'm like shoreline way line background night new 's stake brand blanket perfect bag soakin big luck piece;Mud On The Tires by Brad Paisley.txt
My Baby;Bow Wow;name trust face uh-uh ta clown call keep side hard heart leave outside front us go try wish 'll say come pick begin life summer care laugh let give time 've drama tomorrow ah later listen kinda dust playin fine back smile would game fact except lover get think loyal know pretend ex meet return million dream instead start lyric feeling stress phone ca step broken nothing need house aww mouse next ai busy rush holla remember mend true live first yet whatever wait see embed might man right interferred girl change understand nonsense great also chase ya homeboy break tell place na sleep unfair wo cause talk maybe really ring figure day like 'm discuss glad way unsafe night crush 's mess homey cry still never blush already could even baby wan friend miss ask sit tear walk cat special park alright together look lead stay hand kick want hurt reason well every n't nah future take fear;My Baby by Bow Wow.txt
My Band;D12;anyway woah salsa call decimal map hard love us simmons shady tour rap 'll suck throw shit yeah capella give wassup mic yesterday mics suppose get think guy one 'bout ca please performance hear uh single little make star next vocal whatever despise rest show wrong cock singer givecome book marshall na cause babe like tryin fan underpants dance even sound ask small bus world write clue group fight tool drop 'd dumbass hold smash kuniva becky half jack say pick time back oh outta suggestion start yell hot gon beat crew bra aww act pro best room see code two tryna intact somethin y'all problem ready tell swear ha adat talk video jump way night sick medium new rock '' artis feel hey walk lead roxanne cut every n't take alba dress name lesbian chick stomach go ow sexy come apart everybody life god van jealous kinda interview real dang pull fuck security always solo dj lose hahaha ai damn embed might fucking man right girl boy wife-to-be i'ma shirt music dude simple area 're hell could shut cute haha park alright stage look hand arena blow whip band backwards shante nuttin' superman light late punk play try snap em loot autograph crack question let uh-huh panty slip flick retard eminem amusement okay somethin' know lyric fella jessica need `` slim sup russell sibling ayo lady big-ass proof percent liar 'til pretty also sell obie kon funny buff dre popular swift 'm 's soundcheck read dawg rivalry sit-up baby wan tear knife bitch want bag screw carry nigga especially steal instrument;My Band by D12.txt
My Boo;Usher;blind name ta hide heart us love lip try say come yeah life clear give ... time people young away ooh put oh okay get mine think know one screamin 'bout 'cause start lyric ca always uh kiss brother fame `` eye first scream see everyone might embed person matter man girl also comin boy y'all though yes spend remember like way use 's still rock 're never boo '' even feel could baby alright n't another take argue moment;My Boo by Usher.txt
My Happy Ending;Avril Lavigne;hold something high hide leave dead say dumb shit care let memory thanks difficult time 've nice away fade hangin' suppose get think know pretend one mean lyric everything make lose act knew fall might thought also thread tell city talk close like 'm 's translationsportuguesmy end oh-oh 're could even feel friend thing much happy watch want oh-ohembed n't breakable;My Happy Ending by Avril Lavigne.txt
My Immortal;Evanescence;erase light face hold alone hard sanity leave immortal go try wish presence life time 've wipe away ah haunt wound would resonate ahembed real year seem dream 'cause lyric voice bind linger tired scream might also chase pain tell though pleasant wo captivate 'm like heal use along 's behind cry still 're tear much childish hand fight 'd suppress n't fear;My Immortal by Evanescence.txt
My Place;Nelly;quit call hard go lot seat point say come disagree pick flip life finger offer fucked-up laugh let hit give pride time message back oh good would rain frown get mine fault think wooo know one mean bite 'cause lyric stress lie ca mall gon hear sure mind enjoy little single weather make act sorry ai forever long believe check adore convenient since see embed might around truth man girl understand also problem tell place upon na ease yes wo home hopefully flipped really excite stormy day 'm like use way anything shorty 's issue cry still '' 're never word even feel could friend wan thing hey sit world sex want together truly drop every n't another argue take;My Place by Nelly.txt
Nasty Girl;Nitty;dress name face ta call mr. side date run love fun sexy lot wish yo say bittys come hourglass throw pick lakers ooo spinnin ride let butter hit give time shakin north coffee right later crawlin put south dinner oh get know puttin east west smooth potato lyric ca dime taste always motivator hot sweetheart gon bitty shape free recognize bakers uh flava little brother `` long eye alligator key jamaica honey booty ballin poppi neighba hair roll standin damn wait see room might embed land lookin private jada gettin coast man whatcha matter dough girl money show also navigator chase ya hater break witchu tell body na likewell party spectator shake wo i'ma perk-u-later waiter nasty champ last really like 'm way night open must operator whoo hate 's course elevator ignore worldwide mommy straight '' 're dance escalade candy could even serve bathroom wan hey thing shaka's rim dirty playa sex downtown want hand sometimes inside makeup nitty whee paper well n't talkin take;Nasty Girl by Nitty.txt
Naughty Girl;Beyonce;name call flame turn love sexy say lately 'll come reach rhythm get know start takin lyric hear gon partyembed uh kind across see might energy girl also n-a-s-t-y boy body na crazy party tonight home translationsportuguesnaughty babe vibe 'm floor like way 's 're funk feel naughty baby wan feelin want look burning minute n't move take;Naughty Girl by Beyonce.txt
Neva Eva;Trillville UNCERTAIN;ay fightin trust strategy dreamin' woah mc flow keep woo factor fam love go stoppin rap debatin empty york yeah god rappin clear ever neva easy automatically booth rockin fucker south back oh ghostriders killin realist know one hatin lyric maintain bloka stop doubt scar star house fame hahaha ai forever doin believe gain blah bunch true sing whatever first see might german peep truth dropper man track matter right tryna millionaire also show mad boy ridin hater gangster monstablokaz skeemin body na yes mtv monstabloka figure bet 'm like block along crib frustrated new pop 's grillin bad chillin fan explodin nobody slack still rock 're never clip rollin even shut envy wan top feelin world bitch much rulin together stay beach trap big eva n't knock wake meembed;Neva Eva by Trillville UNCERTAIN.txt
