title;artist;lyrics;filename
Someone Like You;Daryl Hall;face grow side hard leave chance love go try romance spaceyou else empty come ever let lyricsonly someone comparison 've away satisfied advice oh get real know fools one seem fill ca today likeembed gon find need kind plain ai bear see might also pain place na strong somebody like 'm way night 's bad nobody suffer 're hope could enough thing thru n't carry take;Someone Like You by Daryl Hall.txt
Someone To Love Me For Me;Lisa Lisa;whoa lyricsoh bow-legged hold something materialistic high heart love story master lou say yeah surround search care let someone give lisa eee fine oh good satisfaction would lifetime lover get real taught mean dream feeling please less sure make star need confused fame science paul forever long eye best true live idea scream see might settle person hmm show also lonely endlessly tell yes laughter really meembed hour 'm like glory power 's mmm end past '' hope anthony feel enough baby hey ask thing anyone world write want look allow drop well another n't take;Someone To Love Me For Me by Lisa Lisa.txt
Something In My House;Dead Or Alive UNCERTAIN;bedroom runnin something hearing ta keep somewhere heart love dead say else wicked ghost someone time round haunt affair good morning get think iiiii know one meet lyricsi four bangin house laughin' midnight long might stair show also ya break spend o'clock halloween really hour 'm affairembed 's cry 're never sit minute 'd likethere every n't queen piece;Something In My House by Dead Or Alive UNCERTAIN.txt
Something Real (Inside MeInside You);Mr Mister;face hold something human run come yeah time me/inside race oh likegimme sister get real know lyricseveryone always make brother lose forever everyone embed might person also ready part place last 's 're feel miss hey world want together look gim inside steal take;Something Real (Inside MeInside You) by Mr Mister.txt
Something So Strong;Crowded House;hang like frame weep something fall spread jealousy root see might turn deep leave freeze run us love ground could feel also thing happen cover today cold taste much likeembed lyricslove bring life gold sleep strong make trap 've wall carry away lust old strongyou;Something So Strong by Crowded House.txt
Somewhere Out There (From An American Tail);Linda Ronstadt UNCERTAIN;friends bedroom face counter nylon grow somewhat crumpled enormous turn insert ram front chance nod graze mrs. cord uncomfortable comic library cologne outstretched -elijah six medicine unbelievable strip wiper purchase print link upset suddenly foam observe think desperation guy meet noise careen seem -i covet screen folding crunch landing spiral recognize little -why championship star forehead worry push derails series tie however panic identical survey engineer elderly clutch font armrest aid knees frustration intelligent arch silver ill narrow break claim -jeremy aside upon gold marble sleep site upstairs fold expose survive therapist wet overweight sketch like floor bet line mediocre unwraps attend confusion pennslvania overhead price piercing ceiling end fan bracelet bikini enemy thousand even disc -- volume unreadable meaning bus write draw helmet depiction social reason student refrigerator smoulder hip preparation twitch color telletubbies imperfecta image horrific theory roar hold human solar roam death windshield syrup twirl half egg drape belief hunch yellow pick register doughnut excited television church engine time couple discourage decision old hospital clamp strain traveler oh breathe unusually threat photographer game interesting horrifically locate nephew's anguished surface screech peel napkin reception carrying collar loose medication anymore phone profession identity rust harsh yell respond free felt beat brave laundry uterus find fragmented noies simply miracle help definitely listens king softness pre-game entrance mass web answer see seven wheelchair authorized converge water sustain unopened quality sole seventy-two money dashboard oddness spell malfunction triple cartoon tell crushed eerie ease slender passing cultural fence trance jump shoulder pattern heal way plane storm ointment night longer medium confirm violent teenager constant remote standing distant version individual wife english superstitious gurney parked lead corner tunnel utterly -do examine take insurance aisle grass fracture eagle dress christmas ten driver tug representation loosely sideline tangle wince janis stomach mirror unconscious experience aloud outside sport gate hood happens listless visit quick c hook lull major everybody wallet lit ride earring crisscross softly booth rapt bounce gaze slow sand whisper fine virus ominous drexel framed rod practically o.s medical afraid cousin hole store always service titillate synchronize gun stairs attitude whir ai compact embossed chill lower parking tag sleeve similar hair enters since brown pack damn safe glance massive freeze hallway jeb highway draft sad warmly sparse treat boy elliott management equation weakness clothes soak spin jerry part frazzled crashed newborn unwashed headphones ravage window baseball chocolate focus naked slick thud haul core jennifer deep clothing tail ago bubble toward shift wind waist earth excitement skull tremendous hand knob certain location baggy specialized shave band flight drowning wake sledge thunderous full hurricane study fix something soldier flashcut clean unreal oversized effort wrap reaction skin forward slicked inverso turnsstile substantial mob headbutt ascertain york begin blonde winning delivery suggest mike phalanx third ... phobic bar coffee month i'll three-fifteen eventually potter fist okay towards fanatic mention sister customer enraged one-seventeen quarterback bend know eight bench refuse dream publicized metal underwater handwritten wonder momma machine drive slump heard rack emergency stripe common extraordinary expect burn horizontally cabin priest saw concussion eclipse ordinary playing faced bear possible lotion train set pleasure nose-bleed around hesitate pretty beautiful drawn sale serious insinuate table somehow pocket thin body crane messing green sling downstairs choose folder disturb closer close figure fair block cornerback breathing anything silently stool farther must gallery slightly credit fashion dusk slap rag worthy tile deliver lo issue fat past believer admiration machinery laboriously assume baby philly gradual knife they're together bring cloth half-smiles dissolve tyson subway minute pad wed familiar breakfast glisten luck neat barbecue rid picture passageway closely slowly swimming tiled exact gentleman heart team balance lip debris dead carpet 'll agony sadness deformed throw ice square laugh plastic pm clocker give someone hit mile osteogenesis hi lever veteran member grinding reach later entire iron pneumonia mother stuffed messenger chicken real- ups poncho forget storage replace disproportionate momentary unoccupied athlete cram ca yank please shape stop single deal make male error hesitates sorry next check superhero moan university awake seventy admire everyone silence parish almost show savage joy waste book metallic everyday week awkward shatter connection building echo hanging road league day notepad hire knowingly course unbuckles statue straight businessmen disappear door trickle jut knee beer pasta hammer group guard helicopter violence scenery 'd at- fever residential depressing pressure shaky etch value wide shop character smelly skinny northbound mangled hanger torn african regal jenkins decide sweater one- point sheet depict jack uniformed inverted powerful post white offer channel final grind officially fritz parent away scrub turnstile head glaze fade shower community dunne physically within chest view mine pool troubled conduct cash donut technically start jesus exhales enter cover groan reveal mind bent i'd protect article gesture movement swirl twist either mark cramped uncurl normal silhouetted railing pro differently gear diminish matching sixth passenger air dye boxing land gift matter untie hazy truck david explodes bruise problem unspeakable carefully razor fifty philadelphia agility though double swear surprise opportunity o'clock bottom fierce buckle arm speed thigh limit mailbox pray open sick limping skill hundred modest pours tremble p.m. hope cross personnel feel payment shoot happen int hey unharmed business prayed restaurant quickly noel mitchell exaggerated villain contorted angry stand level colorful upside wash dart big corridor knock slight curtain angle occupied nine caution bow yelling cup-like hide cheek walks caved-in response juan flower blossom pace else large tackle appropriate life gap god van original mount wiggin bed blend mein handful men box x-ray three bite jail instead commotion blare expression heaviest septum split foot crumples across airfield it- index leaning abrasion long eye hang till key prove react researcher oppose circular virtually prevent shiver maintenance pause sucker stroll herd soft directly right desperate trash mad main brutal steady partly awe add like- page podium mom pole sway shake inconsolable cushion kneel b.b dad atmosphere base college headrest really fifteen trigger information wrapped inspire rule setting shirt background dude simple condition extra 're hell amount bulge could shut onto friend usually notice dirty nephew much load airport chew satin country look perfect nightmare paneled -sometimes gross seven-three-seven streak state tight spill attack tiny rip painful torso trample erase amtrak rise hesitation scrubs jefferson marry odd mystical somewhere amplified annual run engulfs bicep interconnected espn elementary continue cold sort stevens jerk presence perfume flip fifth middle search elaston dangerous fresh doorway siren impressively quarter appreciate inspect listener jog versus eerily morning thick striking negotiate winter artist illustrate chrome dazed treasure realize inform apartment tap infant completely sky approximately clipping everything exhaust bundle form mast gym anxious purse brother massage coach `` blankly in- multiple palm spy manage fork client may idea perspective become barely snake tow twelve ground develop sell riddler age usual vulnerable blurring crimson score training drawing remove shopping legend mourner crowd nightmarish remember along use damage nebulous pinky sunlight pop soggy coldly vast sweatshirt injure behind unfold apex announce staff milk teacher guess peek top trendy rim bitch climb hump want bag left dense appointment daze kick inside crowded size mirrored office warm tighter well pour better carry legs bogus waiver portable reference sweat chinese cardboard compartment soup asian strength anyway happily gamble tylenol spoken frighten explanation rhythmic item basement africa side fourteen hard fake apply interior misty tray click mathison wish overcoat win flicker empty child helpless meantime peace tense coke wood disposable breath ever handsome ghost seventh young existence trouble tire brush what- intensity trainer museum congratulation except suppose get hears jeremy considerably bowl whirlwind half-eaten fill throughout playground plan hear greet direction pitch daughter atrophy mechanical labor bruce blurr leg fate weight battle sacred jacket skip padding hidden bump scam breathes first patient drip note scan rumble goodnight wrong multi-colored stick dyed bulb action immobilized forty-eight totally ushered identically food yes freight forty-five wo champion choke spend unsteady cause yard rattle cubicle edition he's anybody ticket jockey consider spacious wedge shatters turtle still fifty-fifty limited scared worried layer cream burst wow blanket pistol stadium sizable dozen fight towel able exercise drop i've muscular pass ethereal flabby player card throat tall cherish embarrassed 'security intervene shadow mr. high unbreakable unyielding board leave rearview j.c. share news collide travel territory olympic seat cough drown -they unnaturally shocked joke near arched what's fit genuine nice emerge alive unaware chair collision krpytonite smile late-nighters letter man's spit blur walkway christ thrust lie t-shirt curve gon shall less splint step bind echoed crew range protection army pillow act flashback unnerve wedding lamp holder heat believe best temple platform depart yet doll son frozen code stationary track rugby uncontrollably number change immaculately great prince storefront pillar extremely flop equivalent rub proud knowledge kelly skewed pin press garden catch steep countless maybe thirty emotional cavernous twice instinct tilt new agent public crush withered intense opposite orange quite tower milky low-end co-worker evil allergy walk fifty- manager downtown special awkwardly pictorial eyed kicking cut spot every n't erupts broad wary event blind -that mouth ringing immediately quadriceps camera affected photo go street bullet sore wave grade master painting starbucks ear swimmer limp quiet tub twisted luggage among thanks magazine doctor cane list forty ancient capable emblem dragon proceed bike sidewalk navel assistance driving brilliant seventy-five outline envelope real year agitated appear immobilize die sag pull vibration tuck fourth decoration kid desperately commercial equipment powerfully bathrobe nothing obscure hunt house bottle considerable wear glow gain worker receive accident fall rib particular peer wait embed might muscle discharge football beginning fifty-four telephone leukemia dollar speaks traffic actually paraphernalia pristine usher department lean hero stall derail arrive variety glad strongly learn dunk area shadowy opening banker berserk belt clip stun never random drug thing cute huge conservative probably stream bang distance stain secretary shaking lee hurt we've riddle join beach local mouth's attach direct smell sometime resent connect exaggeration bat rode father protein late gunfire hotel play undo charcoal newspaper try pregnant heavy fast field insist everywhere jeopardize clear type realistic let b japanese sideways wipe slip police exist karate saleswoman barbell swallow dry heavily becomes good glaring shaft c.b birth ahead darkness blink penny feeling pink sign art formerly today vision cell cluttered sure elbow duck bleed mab twenty separate selling flap locust need answering balcony guestroom holly t.v scatter refer elijah melt rusted true aware scream car cereal percent weapon prep american frantic also virginia pain threatening impatiently shaken speak language scene disaster grab tonight chain tarp monitor violently hum staring sever 'm others pulling prescribed hat hate 's cloud sock work genetic descent flexed darkened terror read horror bin outer upper wrapping tear claire anyone customized floppy official toned paper honda move shiny blank eighth grin piece sound lightly shot going- evening section salvage call disappears twenty-five follow install miraculously us clink one-piece skeptical lot cheer file bathtub yeah warn shit surround tame perm edge casual wall brunt swallowed honest cave pierce faster finish mascara worth repetition sacrifice battered grip rain internet locker kill stretch upward one career mean squeeze million walkies stairwell guest quietly secret crackerjack hovers -oh sip wreck overwhelm vintage scar escalator rather report attribute town unravels float obviously rush -out toll imposing count declare tailpipe heave family island truth private rest straighten tone slam intimately swimsuit wad na recovering package lift closet walkie anchor clang steer visible cup creak expensive five exhale frame interest sixty-thousand victoriously pile poster short physical bone homemade unmercifully dance loud enough slumped dressing column ask small fanfare world specific tumble blood valuable sometimes dark sarah humanity nods asleep fear underway wrist crutch merchandise cordoned advise tighten startle healthy match sits practice ta plexus keep alone smash pen force lay container officer clack handle dunkin unlocks story mail jaguaro bound spider-like yo say unwrap seventeen skirt care horse people ritual classic nearly school v.o limbs represent prepare back soul tube stuff would dinner dryer thrash pound eat thank contact toy sudden pretend remain coalition concrete verge pas sentryman spectrum coincidence hot religious heaven desk voice mixture stoll without footstep kiss pat silhouette brace nearby fenced urgent bunch lump live giant sickening slower room strained person grey surge constrict shield two century buddy hooded drink calculate businessman icy ready place curved steadily horoscope neighborhood stare spectator dominate home glazed crash talk raise dangle ring i'm avoid hour unlike jaw far 'guys inch mess .... hop lock cynicism '' poorly punch egyptian diamond word bathroom tape misunderstand black sit reality unload afternoon often employee eagles sitter various eyes proximal explosive job anywhere glassy starting moment squeak survivor drift name ambulance amongst bald mine's approved coat nose spread lap lecture per clothe control eleven gray plate disbelief inaudible struttin safely couch cameras rep come animal diner apart haired finger slide drag easy giggle talkie case pride 've message dismantle lyricsint paint low stillness witness disorder different cabinet position din finally angered fact emotionally african-american occupy glare splatter swing neither early fuck bell security moral jean kevin fire relentless international reporter obvious rescue backyard puke shoelace louder angel concern pyramid favorite kind stocky lose that's soon laying five-o period least touchdown injured tortured roll trait weird extension aerial stir man unbuttoned girl investment understand touch grimace sight tangled whispery display banner laughter last husband record neck circle sir graveyard -you power music driveway underneath bad silent bagel nobody nacho cry wise gently harder fly blue happy watch barrel glen stay patiently glass t.v. sink comfortable mask injury whether space blow ponytail grasp backwards send swim history safety involve woman eighteen ext light idle flat beep sunday station flow physician handgun backpack unsettle date boston unlit activity class red dull impact second trembling gum manner blurred center pennsylvania attention survival length anomaly jersey crack question calm lunge present thirteen instantly listen pay moldy kitchen whole lawn put crawl strange bacteria return curl engineering button announcer four concession cockroach jam construction sixty wheel sleepy frantically artifact squint midnight offspring cleat funnel huddle steel approach thought other's liar convince stair walking toilet slayer kickoff situation rinse trashcan bedside mix city thermometer hall hello emotion babysitter quicken uniform fiddle strong thirtieth wreckage mound 'it fantastic whose dimly heel aluminum bumper magnetic pennyman shelf sandbag megan affect dr. bit row suffer cigarette already blond therapy teen jazz song pant dial exit many abstract headline flash allow buy scratch gather dish glimpse evaluate vise fountain density another crescendo bay menu progress emerges nurse;Somewhere Out There (From An American Tail) by Linda Ronstadt UNCERTAIN.txt
Songbird;Kenny G UNCERTAIN;'m shin like sing 's keep know might cry never love right feel 'cause lyric also wish beforeyou 'll sun world cold likeembed alright score give songbird;Songbird by Kenny G UNCERTAIN.txt
Soul City;Partland Brothers;dancing fake heart leave outside go 'll yeah life search ride ever let head moonlight back soul outta get know one start feeling gon lyricsboy desperately drive beat step dawn town rush sing see set might 'til man money also great sun ready place city na shake tonight wo talk babe window likesoul far 's nobody hop rock 're never distant dance goneembed wan thing alright look n't take sound;Soul City by Partland Brothers.txt
Special Way;Kool;trust hold heart love us lay share empty come fast life clear someone give time listen back oh know one mean seem fill likeembed find miracle long eye true might show also beating yes learning strong really unlike day way wayyou 's lyricshere still ago much special want moment;Special Way by Kool.txt
Spring Love;The Cover Girls;full hold grow call alone heart love go 'll someone give june time nice january oh would morning lover march think winter bloom one dream 'cause lyric phone always gon mind make need pillow star sing spring wait embed might boardwalk also joy lonely likejust na maybe day like 'm february way new 's 're feel song springtime baby paradise april sit watch park bring look stay dark warm every n't;Spring Love by The Cover Girls.txt
Stand Back;The Fabulous Thunderbirds;fiddler something hide cheek keep turn run chance go say else come life pushin let time listen lyricswhen pay chorus back good get think know one mean ca likeembed gon lesson mind step nothing make lose help ai long might man also stick meek aside tell speak score na steppin day 'm way line learn bad nobody 're ago dance even enough world want stand n't take;Stand Back by The Fabulous Thunderbirds.txt
Stand By Me;Ben E King;long whoa meyou crumble light night oh fall whenever shed see might land cry 're lyric afraid moon also sky 'll tear likeembed tumble come darlin look upon dark stand wo n't mountain trouble sea;Stand By Me by Ben E King.txt
Stay The Night;Benjamin Orr;full anyway followembed hold hard follow turn love go cautious try say 'll come yeah insist let ... 've would get know seem lyric always little twist lose see might around matter right show also upside-down tonight maybe circle 'm way night 's making oh-oh 're even onto lead stay sometimes shaking n't likein take;Stay The Night by Benjamin Orr.txt
Still A Thrill;Jody Watley;hold passion late keep turn run love go try near mile time good ocean get know year meet lyric likeembed make thrill midnight forever key first might around also charm funny tell home last day like 'm new 's overwhelms deep cry still 're never feel thing tear walk fly watch move;Still A Thrill by Jody Watley.txt
Still Of The Night;Whitesnake;full woman rise light face evening sweet shadow ta hide keep heart love heavy yeah lovin give ... time away ooh head moonlight low get start lyric store ca taste cool hear gon stop beat nothing wolf make need 'round start-a heat ai hang honey wait see aching might embed around c-c-c-come also sun tell everyday body na ache ahh babe closer close day like night sneak 's howl still feel door moon wan baby shaking sniff n't take mama;Still Of The Night by Whitesnake.txt
Stone Love;Kool;anyway light unique whenever high lyricsgirl alone love street skin red fast stone life edge ever time 've ooh oh lane get know one meet challenge 'cause solid always everything kiss likela kind babyembed best live may first might natural girl change also na yes surprise cause 'm like way 's mmm rock 're livin fell baby wan hey addict walk much blue want flash corner stand n't take la;Stone Love by Kool.txt
Stop To Love;Luther Vandross;overtime hold whenever ta keep alone roam turn leave love go lay lot lately say 'll empty come toss near ever let away reach ooh shock good get know hurry guy one lyric discover wonder ca always stop mind kiss make forever hardly best homeembed see might rest loneliness almost also celebrate na home cause really road day like 'm night await hate 's work still 're never could wan many top fly look stay stand tight whether every n't wake;Stop To Love by Luther Vandross.txt
Strangelove;Depeche Mode;something practice worthwhile high heart love go constantly try sin crime 'll say life stray give time 've reach low smile oh strange get think appear return seem lyric always willing make strangelove riverful inembed may might almost livable also pain yes preach wo unforgivable sea day like 'm way learn 's enough another n't teach take;Strangelove by Depeche Mode.txt
Strap Me In;The Cars;long like 'm way back night oh good fall get side might likeoh oh-oh undone fun show baby also come tell want beat gun longembed uh ride give well strap ricochet take lyricswell;Strap Me In by The Cars.txt
Suburbia;Pet Shop Boys;something high hide call roam pen run hairdo street front say else ride let colour police listen old mother siren blame dog get one dream lyric ca toys stop felt need lose town hang roll boys scream might around car suburbiaembed also spell page break hall tonight hour window like policeman 's 're hell '' suburban bus want distance paper stood suburbia n't take tv;Suburbia by Pet Shop Boys.txt
Sugar Free;Wa Wa Nee;face nothin' ta high ugh fake love go ow red likena yeah life let memory hit ... tomorrow ah ooh head bed ee-ee-eeeh-ooh oh ugh-ah get real know dream lyricshuh nothin fire always bank today free uh seal make lamplight lose ai river check huh oo-hoo-hoo-hoo-hoo see might two also naembed dollar break everyday scene place na piggy talk breakin 'm like use glad pumpin hundred lord mmm desire nobody 're mm-hmm even baby wan daylight world another n't take sugar meant anywhere;Sugar Free by Wa Wa Nee.txt
Summertime Summertime;Nocera;'m believe sand liketake rain fall true far 's call loveembed might water outside love dream also baby lyricstake lie ca please say today hear come want hand summer ride time n't summertime talk maybe really take away listen;Summertime Summertime by Nocera.txt
Sweet Love;Anita Baker;trust hold sweet call heart leave love go 'll ever uh-huh away ah ooh girli sweetly oh know belong namei dream 'cause lyric ca always hear need believe huh wait see embed might man right also wrong strong close arm 'm like way lovely 's nobody 're never no-no feel baby sweeter worldoh stay n't shame fear;Sweet Love by Anita Baker.txt
