title;artist;filename;lyrics
(Cant Live Without Your) Love And Affection ; Nelson;(Cant Live Without Your) Love And Affection by Nelson.txt;likei apart give live alone anymore put use angel loveembed strength hard us hold baby way till cant affection heart fight find around thing time tomorrow pride wonder without desire save sure end outside look earth realize living answer love mmm pretend tear mind yesterday forever waste never miss bring wait face night seem another nothing keep understands arm try change think
(Its Just) The Way That You Love Me ; Paula Abdul;(Its Just) The Way That You Love Me by Paula Abdul.txt;rather right fortune fame ow ninety-foot throw break buy world top game material ring honey famous diamond guitar paula baby people way heat friend stay rome bahamas maserati thing huh girl french black hollywood money clothes wear weekend house place riviera brazil love crazy fly impress plane hill a-rocking monaco heavy party yacht night hat connection keep watch limousine trip home
1-2-3 ; The Chimes UNCERTAIN;1-2-3 by The Chimes UNCERTAIN.txt;truck tongue suck big brick throw whoa give young jump really trap demand verse yo ghost salty top bean worth drop run okay bottom bitch finna diamond chain baller rack pop cigs rain stank cut neck dick sickembed scope uzi nigga bread bank head bih hatin blue sick -- eight cookie blade ride huh girl scammer murder want motherfuckin robber dope kid flu still rich dodger lil hit ap flip jag movin koala away water bless sniff everything fur ho rank hunnid crack account smoke yuh wood switch wait back count purpp full high lane hoe smoking shank blow spend tryna fuck ukraine bust shit
500 Miles ; Hooters;500 Miles by Hooters.txt;stop soon tide train five tank uh-uh-uh-uh-uh-uh mile penny name miss stand homeyou turn four home back hundred uh-uh-uh-uh-uh three shirt two square land away free blow along country hear day man lord whistle love
99 Worlds ; Peter Wolf;99 Worlds by Peter Wolf.txt;train need jump number live cause world trouble forget lyricsthe dead hold baby mile lookin much tossin way call heart land wrong lover track reason thing time girl want rock hurricane crash awayyou end away drownin close love street emergency nothin leave back lane breathe wall feather worlds
A Dreams A Dream ; Soul II Soul;A Dreams A Dream by Soul II Soul.txt;realise right time something thing open somehow welcome star cross wish mind lose hope show river thought could many dream picture analyse hop darkness arm true dreamembed front
A Face In The Crowd ; Tom Petty;A Face In The Crowd by Tom Petty.txt;street crowd sky crowdyou life ever face town another heart dream loud place walk around think
A Girl Like You ; The Smithereens;A Girl Like You by The Smithereens.txt;right goodbyeembed tone follow big exception reference really tough last heartbreak use little travel record london run anything remainder care lyricsthe hold win someone much people talk way almost call luck hertz shadow strange first hear walk wo find washington message time girl level nerve together want hell pride inside lose without except outside place stare everything else love operate believe waste never mistake anyone back seem mine anywhere man try wild think
A Little Love ; Corey Hart;A Little Love by Corey Hart.txt;fool alright shakin bang-bang beach nervous bit go-go simply lyricsi prison demon little sha wake sister run bottle ethereal rain tiny potion la sky-rocket laughter secrect loveyou serious thunder reach heart free long explain wisdom side still oceans pebble cary dry love sky gibraltar guy bring school magic river boy flower night think
Across The River ; Bruce Hornsby;Across The River by Bruce Hornsby.txt;even west riverembed probably ago move distant give eye stand proud row good hard grass forget driven thirty-five week today talk would way downtown hang idle bank strong prize lyricswell hear walk green wo find around shore time long always across side leg inside sit still slow closed listen tail away look fine happen lead mind never remembers leave river back night seem lane longing dream mine may beat day try wild think
Advice For The Young At Heart ; Tears For Fears;Advice For The Young At Heart by Tears For Fears.txt;happy whole secret big give young eye advice stand live hour surprise last send little world okay anything forget mother brown father work someone people hound would wide hand call shadow bluff heart souvenir old walk sleep girl want due promise feel quite naive could love soon everyday disappear believe chance bay never hey tiptoe boy weep play many soul think
After The Rain ; Nelson;After The Rain by Nelson.txt;whoa pull give break live really afraid hope wash survive mirror pain againembed rain sun light way mean hand heart truth start find thing time girl fantasy want inside lose ever feel likehe appear emptiness away love tear broken never wait face beat lyricslook true change think
All Around The World ; Lisa Stansfield;All Around The World by Lisa Stansfield.txt;think give world hearted quarrel care bad baby lookin much weak himembed wrong lyin find reason around thing time somehow cryin somewhere away look sad open comin waste never back many mm mad
All I Do Is Think Of You ; Troop;All I Do Is Think Of You by Troop.txt;somethings alone angel little world heeeeeey ooooooh ring ooooooooooh ya baby pass oooooooooooh way heart stay heeeeeeeeey ..... start wo bub oooooooooh hoooooooooo thing time long girl bell please .... begin woooooaaaah heeeeeeeey love bup ba sometimes bu mind heeeeey hey daaaaaa oooooh wait school worried sing da oooooooh back night keep mine day ooooooooooooh daaaa think home
All I Wanna Do Is Make Love To You ; Heart;All I Wanna Do Is Make Love To You by Heart.txt;right stranger whoa pull give name eye live tree road surprise woman coat umbrella likewhoa little lonely wake rain dare hold understand knewembed standing saw baby easily way note first fate imagine stay ask memory along offer sight wrong walk ride find thing time long want always side smile rainy hotel please garden could morning seed drive place everything love happen bring leave onto plant magic boy flower night another many lyricsit day man arm try accept
All Im Missing Is You ; Glenn Medeiros;All Im Missing Is You by Glenn Medeiros.txt;right something wish missing need give im babe world consider lyricsoh likein saw traveling real bed baby bragging would way part hang every friend reach heart head a-you along walk find around moment time babeembed girl want search still car without save toy clothes end since could look fill answer love else crazy simple life kind enough never miss wait boy night another gim spend day meet man true
All Lips N Hips ; Electric Boys;All Lips N Hips by Electric Boys.txt;hootchie-koo right tattoo west tongue give name wet cheek use little east game spotlight hide dig store shake hard front ya tattooed blame work week likenow way part story romance fingertip old earn walk find breast time best whoo hell uh ever wonder cradle tonight whisper sweet flip end wink begin sits n ear close lyricsnow hipsembed whoa-whoa kiss boutique dance lip chance enough never miss daddy hip boy target straight keep a-dancin dress day table man try change
All My Life ; Linda Ronstadt (Featuring Aaron Neville) UNCERTAIN;All My Life by Linda Ronstadt (Featuring Aaron Neville) UNCERTAIN.txt;something need satisfies deceive give wrist rope hate ghost hide nextembed twist bleed hold taste closer wide weight next prize find reason around long inside lose search feel resist end delicate away close love open lead life believe believer waste never leave hey sleeve knee night grip another nothing keep dream feeling day
All Nite ; Entouch UNCERTAIN;All Nite by Entouch UNCERTAIN.txt;heard flame domain funny pen gas mando big beach swisher anybody break name fuse k. really shoot rockin cold cause flyin nite angel world game city good wake mac ike wreck bitch finna bangin nightembed burner chain pop prolly map light dust la wig baby people gang luck every tee brain nigga war raise test strong gun fire fight sight block post main ride slide time whip long welcome license side mama candle lose still short lil hit niggas ec body gamble black poppy roll bullet killer bite bus dot squeeze close gym love street brake reign already mind flamez norf waste ready never leave grape turner barrel boomin back town face night another hoe mine phone tryna day man fuck jumpin prove ta shit
All Or Nothing ; Milli Vanilli;All Or Nothing by Milli Vanilli.txt;right something marvin maybe likei push hush give wet live gaye rockin babe bumble game good mood lyricsthe real baby grow bee beatembed heat michael lyin tease slide time jet girl want rock sting livin still backbone slow feel please sweet could pro dry show love p lip never night high nothing keep mister feeling beat suitor ta george
All That Glitters Isnt Gold ; The Cover Girls;All That Glitters Isnt Gold by The Cover Girls.txt;right isnt give advice really turn glitter cause shine game good goldembed gold baby people behind way friend great heart strong matter find thing time girl together always inside listen could away look everything show fine sometimes mind yesterday kind waste captivate leave mistake boy seem play dream mine meet true think
All The Man That I Need ; Whitney Houston;All The Man That I Need by Whitney Houston.txt;right sleep hurt kiss hold need rock ever slow give eye turn woo use night high morning world evening cry moon close man fill wo think love
All The Way ; Calloway UNCERTAIN;All The Way by Calloway UNCERTAIN.txt;right c-note swear alright girlfriend beg push somethin eye edgeembed tour really afraid universe club white race top cadence band hard pain care rack rain barely dead phantom g saw bad insane real baby addict lookin would way call every brain nigga friend casanova though red head commit slowin green wo ride time medicine want help thunderstorm everybody inside lil car sled quite fallin feel please money xanny clothes countin translationsportuguesitalianoxo lie die away look swag yeh fast llif tear twenty brittany never leave hey overseas shoulda control stackin keep cry watch nascar fake blow edge man spot g-roll mad treat
Almost Hear You Sigh ; The Rolling Stones;Almost Hear You Sigh by The Rolling Stones.txt;crowd fool stone tongue need beg stretch act eye live turn vain cold wake pain calm bad mile baby sorry much half almost would sigh mean every left memory free hear main find photograph girl want smile feel without charm sweet set morning pleasure place look yeahembed love street life believe leave silky nothing smooth mine cry dream meet man wine laugh
Alright ; Janet Jackson;Alright by Janet Jackson.txt;happy alright star wish fall thin world shine catch real baby pass mean till sh-sh-sho three friend sho heart command around time always best shoo-bee-doo-bee-doo clap fallin friends bay-bay-bay-bay-bay nuff end could doubt show love mind shoo-bee-doo-bee-doo-wah never everlasting thick bay-bay-bay-bay-bayembed may bay-bay belong self true dreams think hi-hi-hi-hi-hi
Always And Forever ; Whistle;Always And Forever by Whistle.txt;something melt give really lyricsand cause lonely care win sunshine way every heart moment time thing somehow together explain always tomorrow smile second ever still feel away look foreverembed sad love special life forever magic dream phone day true likeand change
And So It Goes ; Billy Joel;And So It Goes by Billy Joel.txt;tone break eye cautious sanctuary share suppose wound hold bad thorn much would speak every felt heart new strong along lover time heal pretense past still choice feel close answer soon room defense knowsyou leave mistake seem decision safe mine silence rise self choose
Angelia ; Richard Marx;Angelia by Richard Marx.txt;maybe warning give turn vain use shine run hurting pain sun sorry way next head strong wrong around thing photograph want inside ever still wonder feel without lie tumble aroundyou love mind believe kind lip nothin lyricsmemories never leave awake wait night mine angelia try
Another Day In Paradise ; Phil Collins;Another Day In Paradise by Phil Collins.txt;something probably move anybody twice cold mhm nowhere line call every fit blister hear walk start lord sleep help sir cross uh para- somewhere paradise place look whistle street paradiseembed pretend sol back face seem another foot nothing embarrass cry day man must try think
Anything I Want ; Kevin Paige;Anything I Want by Kevin Paige.txt;even follow push white esteem anything stop jammin skin work light someone people decide talk way lyricspeople crap shout hear son want always everybody sit tower attitude wantyou sayin listen jealous kick street crazy pout groove life kind justify instance shove sing jam upon power meet difference self man dreams think
Anything Is Possible ; Debbie Gibson;Anything Is Possible by Debbie Gibson.txt;case read whoa teach warm give break eye surprise put cold disguise league thought run anything front bad attentively much would way every felt wrong rest matter thing time stereotype long want slow charm set misjudge listen could course look vibe love mind guess enough remorse guy leave itembed boy face possible pretty day likeno prove think
Anytime ; McAuley Schenker Group;Anytime by McAuley Schenker Group.txt;even something need maybe corner anytime really standin anymore alone cause use little lonely scar pain stop scared care catch win lyricsblow baby pass much hand call war though heart fire wrong fear time burn cared want always likeanytime lose still hit promise desire peace empty ground hid fighting room sentence hurt kiss remain never wakin control mine cry dream home
Around The Way Girl ; LL Cool J;Around The Way Girl by LL Cool J.txt;least even court eat shook gentle bug suck bikin need neighborhood maybe act break really camay fendi woman bamboo movie cheap cold renee use share jewel shin slang game good mood shake hard scar lot brown button bobby stop din gold hawk surrender gloss pop pair standing gangster bag win sunshine cuties bad real baby independent sugar rap half talk would way brother pamela joke candied heart loving new homegirl stay bridge lisa ask hottie hear walk complexion perm cookie matter basketball around tender thing dedicate girl long want always manipulate smile ever short sweet flip lollipop attitude sweat somewhere wear extension bus angela two parent homeboys suit place petty curly love rhyme street rayon silk crazy private fine pumping edition mind summer sh kind dance lip ready switch denim jam sleeve silky honey-coated another play weave crew businessmen watch outembed yam earring meet day cool man pump milky think hair
B Girls ; Young;B Girls by Young.txt;least something bar walkin star b discuss need big beach jane pull act name young chill stand yes turn bangle verse yo put cause sudden pause world city line overdose bottle benz check frontin pop us pair ave claus uh-uh ac baby bronco malt pass b.m people lady mean call knew joke nigga bank friend though old ask aw blue -- slam find context around breast thing time moment girl doctor trunk five explain want rehearse mac- second automobile b.m.x booty bmx nova dolly year black tire broughamembed tryin friends park could liquor two place clip figure everything janice punk subject rhyme judy brake comin wherever brougham couple mind already believe nice cadillac bring bass hey wait prince one-of-a-kind face drunk another beer keep pushin b.m.w slim bmw santa change think
Ba; Its Tonight by Jude Cole;Baby Its Tonight by Jude Cole.txt;need fall stranger eye live really fadeyou alone turn x world far pick lonely care us hold baby way bridge start walk wo matter chorus time heal ever still word tonight please begin close fighting show pre pr tear repeat leave face night another many dark phone arm home
Back To Life ; Soul II Soul;Back To Life by Soul II Soul.txt;theyll em clock cup shut yale lamp styrofoam facts ice sword lyrical big stretch im hour shoot put cold aerobics explode x deadly antichrist occupy thought hood thats caddy game audi th assault prime bottle hard forget jean fold gold twist pop catch flight near slick cyclone mark work light win bag aint flash optimus talk dont gordon dice nigga abandonment first champagne heart transporter popular stay blue concubine fundamental start block son stash lord file glitch instrumentals rifle five yac search playboy short traffic wonder stroll rid niggas brooklyn without beast gamble black pie roll organ headembed cop manslaughter raw fish booth ii knock racketeering hole mossberg crib fill devil show rhyme jab mind ritz-carlton life crack different radisson reckless oxford selling lemon fennel never bundle school haunt back lazarus youre night play likecrimes dirty watch dark blow phone small man hustler gag soul try chip shit
Back To The Bullet ; Saraya;Back To The Bullet by Saraya.txt;even bar follow whoa alone shoot use good run fade us hold baby every stay truth lyricslately hear wo find time long want past word body bullet house picture away drive place oh-oh-oh-oh-oh lead yesterday hey back night belong anywhere
Bad Love ; Eric Clapton;Bad Love by Eric Clapton.txt;something long alive glad heartache side need life bad remind enough people behind road proud heart lucky keep lonely strong blue feeling memory meet walk sad everything love
Bad Of The Heart ; George LaMond;Bad Of The Heart by George LaMond.txt;fool instead need gutter apart throw rearrange ba-ba-ba-ba-bad really put fading thought game trust saw smart bad cut baby would way every heart along start wrong blade girl want side wonder lie could likebad yeahembed love hurt aside kiss tear life never leave cruel night play ba- day ba-ba-ba- slowly change think treat
Bang Bang ; Danger Danger;Bang Bang by Danger Danger.txt;easy someday mad stranger warm give fail sound really turn shoot put game good line lyricsbang urge playin heat friend heart test rumor rest sneakin around chorus girl side hell lose past south learnin goin blind drivin show love crazy fast likebang believe chance bang never mistake town face night silly wall cool must think
Banned In The USA ; Luke;Banned In The USA by Luke.txt;sell doin right arrest stickered even court totally broward fame jew think purple fall give protect stand live county music chinese woman album club freedom cause world adult ruling game good brutalize record material election u-s-a double-platinum speech judge lot lyrics front include quit arouse us curiosity people- bond brave today amendment people rap talk right-winger previous banning group left-winger brother home joke expression presumptively friend ancestor first whoever uphold publicity nobody boost old strong fact appellate miami free land wrong green wo grab fan harass thing time china want always tall help side uh sit wisen ever still rich choice year black write russia hollywood tire end audience politician sayin die listen movin begin two house cardin white-collar pleasure place concert perform police bigot show else rhyme fly version luke comin sale simple different lip -and-over nasty nothin never u.s.a. bring ban corrupted precaution business party earlier style communist crew play keep versions- wall day man must government try sexually america
BBD (I Thought It Was Me) ; Bell Biv DeVoe UNCERTAIN;BBD (I Thought It Was Me) by Bell Biv DeVoe UNCERTAIN.txt;right even comfy damn b ricky eye live ron cozy loose turn last yo disguise boot world good meat yeah-he ya hoooo catch stickin us sexy lookin much almost way past-time every naaaw bread serious fun head late lifetime bein wrong relax find around burn afloat girl rock sit .. takin b.b.d wiiiiild wear wha could n knock favorite look close waterbed show love cruise fly ho manhood everyday room system understood yah was-sup chance ready never guy leave b-i-v wit jam back nosey night straight boat many keep r stayin runnin bachelor cuz meet day choose spot trip prove hesitate sandwich wild oooooonce think
Because I Love You (The Postman Song) ; Stevie B;Because I Love You (The Postman Song) by Stevie B.txt;right open care song girl always side lose light door exactly postman real give feel decide write really way please guideyou guide count reassure heart around day start anything ground letter wo everything love
Biscuits In The House ; Biscuit;Biscuits In The House by Biscuit.txt;right hyped al move give name sound chill tour road wax cause heavyweight use top nowembed prime shake b-i-s-c-u-i-t hard tight contact check studio cut baby carry real capone mic nuttin lyricsbiscuit new strong late along track wicked load grab thing time whip long likebiscuit large static lose kid rock hit stage body biscuit killer house slip kick hype rhyme boom fly hip-hop groove york dance ready never miss iller party bound age night high straight butt able mine beat showtime table prove treat
Black Cat ; Janet Jackson;Black Cat by Janet Jackson.txt;damn need rebel give break live alone afraid stepembed game lonely good glance okay anything carry real way scheming gang hang stay strong late sick wo around time long together plan always want step short promise black insist tire nine lie die away look realize rule living love crazy cat dangerous life ah chance never heartbeat mistake boy night full keep watch sense edge spend day man try change understand
Black Velvet ; Alannah Myles;Black Velvet by Alannah Myles.txt;heatwave aisle move molasses schoolgirl music white mississippi little dancin settin ya song shoulder rodgers sun baby flash way every heart new middle spell southern tender long cryin religion want always pleaseembed sin mama smile word slow black please sweet victrola could velvet drive dry jimmie everything love sky happen soon memphis leave bring sing style knee bound boy high lightning true wild
Blame It On The Rain ; Milli Vanilli;Blame It On The Rain by Milli Vanilli.txt;something fool star wish need fall whatever put shine good satisfy care rain blame baby sorry coulda goodbye rainembed strong walk wrong want pride still feel could blind blinded away love mind back night prove ta sacrifice
