title;artist;lyrics;filename
(I Hate) Everything About You;Three Days Grace;sigh awake translationsturkcei yet get hate think keep scream know might still love feeling lyric also lie miss likeembed everything stop hit roommate make time every n't take;(I Hate) Everything About You by Three Days Grace.txt
(Reach Up For The) Sunrise;Duran Duran;lifeyou light something turn us go ball come life time young reach alive put sunrise know darkness mean seem dream 'cause lyric enter sky likeembed everything fireball planet burn 'round bear might change also touch though day music night new end feel watch bring together hand big moment;(Reach Up For The) Sunrise by Duran Duran.txt
(Theres Gotta Be) More To Life;Stacie Orrico;something slowly ta high go satisfy empty come yeah life search let time 've oh get 'cause lyric ca always sure next temporary wait might also chase waste tell i'm 'm like halfway must 's oh-oh thinkin feel trippin onto door deprived miss thing want inside well every n't lifeembed moment;(Theres Gotta Be) More To Life by Stacie Orrico.txt
1 2 Step;Ciara;woah hearing mr. flow gentleman woo control supersonic jello love go mignon fun lot melodic say 'm goodies come yeah sophisticated everybody flip papi ever let uh-huh nice young crave fresh ooh rockin slow oh stuff chest eat get know one swing outrageous start 'cause lyric ca gon hear stop beat step chart uh nothing foot dj make missy crank ai pha believe best strut flaunt phizzle hypnotic lady roll since see might automatic jazze matter right number also great impair ya boy body na party retarded yes wee shake grab hello productionembed ha princess somebody day like floor productshizzle jump way mc's 's work ciara rock dance yup wan hey top whichever filet drop funky n't contagious;1 2 Step by Ciara.txt
100 Years;Five For Fighting;ten high go half wish thirty-three life ninety-nine ever ... time 've head back within good morning get suddenly year die twenty-two dream blink lyric fire kid mind twenty make star lose mar `` eye live count see might family crisis man right also who-who-who chase sun caught ooh-ooh forty-five choose babe fifteen sea day 'm like way sixty-seven new hundred 's still wise 're never '' feel hey buy liveembed well every another move ooh-who-who moment;100 Years by Five For Fighting.txt
1985;Bowling For Soup;average blondie twenty-four high halen wham actor turn actress go skin hood debbie yellow life prozac limp van hit springsteen time wall member classic school back game get think know crue guy one dream 'cause lyric u pink club suv fire please elmo likeembed plan gon kid uncool stop ozzy madonna nothing bizkit bruce make star cpa nirvana sing since whatever see become might snake car preoccupy pretty man two show also tell radio na saint shake husband mtv day way line made music sitcom hat 's whitesnake fan still rock never enemy even door happen motley alright duran look reality hand bring breakfast 'd mini-skirt big every tv;1985 by Bowling For Soup.txt
8th World Wonder;Kimberley Locke;love fallin' yeah summer rising hit thunder 've slip coffee away ooh amazing oh rain morning think makin know one realize early th lyric wonder ca always everything kiss doubt make yeahembed believe seven might water also wrong somethin comin feelin' nowhere week crazy i'm day like 'm way night 's oh-oh deep 're never feel fell baby guess hey world wash n't eighth wake;8th World Wonder by Kimberley Locke.txt
99 Problems;JAY-Z;hoe compartment hold patrol something sweet foes grow side mirror african rich tack play lawyer fruit registration rearview love go hood forward d.a try lot half rap say dumb 'll cameras em grape come fast shit strong-arm type search raw hit give case time 've casket bar young k choice bein important bounce whole intelligence low smart fucker motorbike yappin put back clappin' fool would havin fact zapatos jay get mil shaft critic real pussy know year one stupid cash pull goddamn 'bout fuck bail nothin lyric hole captain beef gon stop sure mind step riff-raff heard gun scratchin kiss little also make need closed law push `` ai ad motherfuckin long pedal fiends bust warrant son see might rick around car snappin weapon two license right dough girl understand money show translation devil highway reader chase dollar y'all problem mag boy gat radio celebrate na upon crazy boyembed wo press i'ma paparazzis steppin cause talk kit-kat road saccharine somebody sir 'm like use floor pray 'em rag hat sharp 's tryin lord glove bad bit sense z lock ignore 're '' illegally ago loud feel enough wan guess black thing happen arrest bitch advertiser look system fight jake trunk harassin minute paper 'd trap well n't take plus nigga asshole carry legit pass ho perform;99 Problems by JAY-Z.txt
Accidentally In Love;Counting Crows;meltin runnin light face high follow alone turn love say come everybody ice time cure faster whisper oh snowball get think comin' know strawberry mean 'bout brighter nothin 'cause lyric sky ca hear stop uh accidentally little make surrender lightnin `` long escape spring loveembed might around settle also problem spin ohh upon na shimmer maybe closer 'm jump like line sunlight 's ignore belt '' 're never feel cream baby wan much world blue runnin' never-ever-ender inside tight well every n't move take;Accidentally In Love by Counting Crows.txt
All Falls Down;Kanye West;name shine clean call high alexis rich us go love bill team ballerific lot hurr 'll say major yeah westside pick daddy come life pushin white crack care pashas jacob freedom people parent school concept ugly police pay couple low back admit oh grocery floss get real one three acre seem dream fuck pas jail 'cause lyric store ca weave cover always gon four drive southside syleena without daughter uh nothing single make save need house jordan rollies act buck `` ourself dealin ai carurr doin long believe least pronounce benz securr fall hair air precious coupe first idea peer see set might safe embed car pretty man american right tryna hollerin money also ballers dealer show treat sophomore degrade clothes problem funny promise tell na crazy party terrific wo eve spend college tellin retail really cause road ring 'm like way crackhead shirt thou new hundred 'em shorty female hate 's issue translationsespanolportuguesall still holy '' belt livin diamond wealth pair could enough even drug baby wan black thing afford addict insecurr stoop specific watch yurrs park want look stay buy inside stand cut drop ver-say-see paper 'd past-due well n't c'mon pressure nigga self-esteem self-conscious spendin chi-town;All Falls Down by Kanye West.txt
Alone;Lasgo;keep side alone leave chance love go life care let would think know one lyric feeling ca today likeembed stop without nothing eye might thinking change show also wrong youyou tell close like must 's never even feel friend baby stand dark 'd n't;Alone by Lasgo.txt
American Idiot;Green Day;tension call agenda follow control america propaganda translationsfrancaisamerican everybody television alienation tomorrow faggot paranoia welcome okay nation one mean dream lyric likeembed everything hear redneck hysteria kind across mind-fuck sing might american also age argueyou part na maybe information subliminal idiot 'm along medium new 's 're enough wan want well n't argue sound;American Idiot by Green Day.txt
American Soldier;Toby Keith;boot dress weekend anyway monday father growl soldier call front holiday bill provide try 'll come yeah peace freedom 've suit bright pay head mother success sacrifice oh good lover sister real liberty soldieryou know die early lyric ca solid always everything likeembed free daughter wolf honor brother long beside cost true bear count son everyone might matter american right money also steady ready responsibility sleep tonight strong cause proudly raise bet 'm line glory night sick core price 's work straight still jeopardy cross door hey ask business duty want sometimes stand n't future take pressure;American Soldier by Toby Keith.txt
Another Postcard (Chimps);Barenaked Ladies;lyricsevery dress daily keep gang follow alone leave love go depraved mail wish stack hard-hats rubber say bath thats come goth overseas hutch starsky irate repeat oh finally mine get think one chimpanzee swing underwear fuck trail likeanother fill ca gon monkey-sender address mind burn make find lose chimps amsterdam vine admirer hair jackboot pack mustang see embed might album stationary matter birthday money also great a-womens swimsuit funny na sleep though fishing wo british chain home maybe imagine somebody 'm like devoid night monkey-fight monkey 's shuffle postcard never could version pair even guess many black sit cat chimp look anonymously 'd shave every another n't a-working move send dutch;Another Postcard (Chimps) by Barenaked Ladies.txt
Are You Gonna Be My Girl;Jet;boot face sweet go say come yeah let six away fine oh mine get know one three lyric get-back gon four uh make need ai long honey hair brown see embed might two man girl money also ya na stare home really like five 's could wan black much look hand kick big well n't another take;Are You Gonna Be My Girl by Jet.txt
Away From Me;Puddle Of Mudd;full misery leave go else drown ever let someone 've away strand put back rain pool think one fuck afraid lie ca taste always gon find lose bottle push help see might change also na closet wo maybe somebody day 'm like way 's lyricsyeah 're bone could wan thing sit knife look stay n't take meembed;Away From Me by Puddle Of Mudd.txt
Away From The Sun;3 Doors Down;light leave go yeah life care ... 've away tire back oh get know one 'cause lyric feeling ca living nothing make find see embed might also sun tell place lift arm 'm shin like way far 's sense miss anyone world dark n't color;Away From The Sun by 3 Doors Down.txt
Awful Beautiful Life;Darryl Worley;hold hymn soldier sunday awful turn pounding love go wide try sin say 'll throught throw life joke ride church drag 've kinda head forgive mother bed back smile dinner cook game morning ups kill think year stupid die meet michael early lyric cousin wonder ca today please little make save brother sang awake live aware may first shed might family sorta beautiful almost also crazy sermon home rollercoaster talk really butt tragic day like along way laid magic night lord 're drank never read poor could worried friend wife beer miss sit prayer tear watch want steak fight sometimes tight 'd big n't lifeembed wake iraq;Awful Beautiful Life by Darryl Worley.txt
Baby Boy;Beyonce;deh shop itembed woman fantasize 'longside yuh mi fantasy seh basement follow leave run love go wrap us quick yo mek come yeah tuffest gyaldem slide type ride let b give time slip damplified ah odda certified fine oh breathe good get mine deny think real know year dancin dream dis di fi lyric feeling dig hear hot gon drive stop dutty mind step without fulfill uh deal wi little angel conceive need buck 'round paul town ting stride long eye beyonce certify true sing live introvert weh damn see everyone might become quality waan dat man policy right girl also hotter boy ya apology sun ready tell everyday na party yes wo da ahh tellin really close sea day 'm like way music night 's likkle sean dancefloor cry inna rock word feel baby paradise top fly world nuh alright gim together stay ship fight corner hurt dark drop well every nah n't picture dem;Baby Boy by Beyonce.txt
Baby Girl;Sugarland;full dreams light compare turn rich play leave love two-thousand sort say 'll broke come yeah everybody white mile time bar pay playin worth get know ritz one mean dream ribbon curl 'cause lyric lie ca fire sky please gon sure nothing little fancy burn make star need due worry town glow ai long true stayin see might car girl money also oughta add mom funny promise tell place na tonight dad home ring dear 'm remember like way anything night 'em 's still trueembed never diamond enough baby friend black thing knee top much world blue write alright stay well big n't shiny every send neon;Baby Girl by Sugarland.txt
Baby I Love U;Jennifer Lopez;woah hold ta control love go try come helpless yeah life let time ooh soul oh lifetime get know one meet realize 'cause lyric u feeling ca please everything willing felt mind without kiss need lose eye adore lady first everyone might around pretty man change also beg boy strong wo swear talk babe got day 'm like way power night new 's 're never could feel baby knee hey meaning much want look bless curse inside big every n't take heyembed;Baby I Love U by Jennifer Lopez.txt
Baby Its You;JoJo;nothin' yeahyou side celebrity heart love go lot 'll yeah everybody ice spinnin time get know 'bout 'cause lyric cool dime always likeembed hot beat ai doin explain see might car lookin matter right tryna also nowhere tonight spend mtv somebody like 'm simple 's livin enough baby thing ask rim much fly want look buy n't;Baby Its You by JoJo.txt
Back When;Tim McGraw;ten flat station keep play strummin' love street click rock-n-roll say coke slang life joke white tomato crack give time round old whole peanuts fine back sandwich put soul oh get comin' one mean noise 'cause lyric anymore four dummy complicate vinyl favorite bottle fizz might bologna blew two man pepper money also table fried out-dated record remember like whenembed way over-rated pop 'em sittin 's hummin' read flu wind miss happen black top much world want country mayo well n't screw shiny ho sound;Back When by Tim McGraw.txt
Badaboom;B2K;whoa name weep bada-boomembed gentleman badaboom turn dub street go lay mack yo come throw slide care ride grind let uh-huh hit laugh june deservin clingin shakin bar fab closa omarion bounce slow back oh eat get think know one swing dis lyric bk jean club sign handstand hot bada-boom soundtrack uh little make star house `` 'round town ghetto poppin believe t-scott finna lady leavin damn room see might around fab-o-losa family smack wit dat man tryna girl wrestler show also bub ya boy stoke body na pressin yes shake grab tonight ya'll bottom fabolous t.u.g hum dave like yea 'm way chocolate bada-bing mmmmmm 'em mami 's nobody behind 're '' dance could serve lotta wan thing top chris watch bring hand groove inside wing big n't move take la welcome;Badaboom by B2K.txt
Balla Baby;Chingy;chinese asian player c-h-i-n-g shot errrthings name ten caller ta chick high call keep rob fake play habbit outside chicks us love jag lou say ball lettin come yeah surround god white pimp let hit colour ... japanese drama kayslay round slip ah pay rican bed playin praisin' put back oh stuff suite okay inn good killin get think real flirtin know chrome one cash three meet lyric pink club five-star momma bowlin gon four free mind solja uh make need wurrs brit cage ai king hang j benz check 'get puerto explain leavin embed might errrrelated wit gettin sho man matter right wabbit girl change also money somethin sheena ya boy jewel soak hater proud herre ready tell city na vip crazy v-i-p though site wo pin nasty o'clock cause occasion crackin belly ak 'm like day blazin flashy wasky night magic must shelly 'em dezzy sittin 's tryin foreva fo carrots nobody past rollin hu telly diamond could even baby hey ask black roller smoke walk dirty sex feelin probably definition bring look matta purpin balla spot pipe haitian n't maaaan knock take girls;Balla Baby by Chingy.txt
Beautiful Soul;Jesse McCartney;face hold something hide heart leave chance love go forward try 'll yeah let give time ooh fine soul oh think know soulembed one lyric always mind nothing make need see might pretty beautiful also chase waste faithful na ease crazy wo maybe 'm like way 's cry 're hope never could feel wan thing anyone special want minute 'd n't another move c'mon;Beautiful Soul by Jesse McCartney.txt
Behind Blue Eyes;Limp Bizkit;none hard love say empty mistreat vengeance eyesembed back blame defeat know one seem dream bite lyric feeling discover lie free worry sorry conscience eye might man sad show also pain lonely woe tell anger tellin hour like 'm hat 's bad behind fat 're never feel blue l-i-m-p n't;Behind Blue Eyes by Limp Bizkit.txt
Big Chips;R Kelly;whoa cochran izods jigga drinking shine chick high woo control turn fake hotel play maybachs hov' go lay d.a egg lot second try twin say win em yellow come yeah shit life toss type mixed give ... unless case time nice overhaul fade rockin coming old low chicken slow sand back oh would good suite magical niggas thank jay get predict gracious real think stretch know bark replace freak mean million fuck start lyric club ca nightembed dig hear kells stop option recognize uh common make mama fronter leg ray either swerve saw matrix ai best huh honey flocking matching uncle ballin lady model roll pigeon first overboard since boys boxing see set might around water 'til pretty gift island track tone right girl number partying sell also stick shade situation ya sun drink swimsuit pshh tell week place grave na radio preach lemonade farmer gunplay spend talk hah trip really dip road vega day 'm like way pray crib naked chip tilt must 'em hat slap spacious vegas 's sock lord bos reward bracelet chillin platinum dolphin wopping 're never punch cross word trackmasters could wrist switch shut even -- baby wan superstar world blue watch park want look hand relish buy inspiration risk drop vicious big 'whoa whip n't move bread take ho nigga bishop loughlin;Big Chips by R Kelly.txt
Bigger Than My Body;John Mayer;name something tangle call flame go skin second 'll surround give time 've soar strand gladly dry get return lyric pavement fuse tie horizon true damn wait shed color-blind might also body yes nowembed cause maybe trip circle 'm like remember line power learn credit 's behind clip quite never iou guess fly much grounded wing big take someday;Bigger Than My Body by John Mayer.txt
Bless The Broken Road;Rascal Flatts;keep heart love point come yeah god give wiped time 've brow back smile would lover get think know year dream lyric sign loving likeembed plan broken grander find star lose push long true roll see set might two understand also narrow break part yes home spend road arm others along like way 'm ooohyou 's hop straight ago northern could many much lead bless hand 'd every n't take pass;Bless The Broken Road by Rascal Flatts.txt
Boulevard Of Broken Dreams;Green Day;dreams shadow vital alone somewhere heart go street wish empty borderline edge ever someone alive know one dream fuck lyric sign everything mind broken find beside check embed might 'til right also beatin' lonely boulevard city sleep home road ah-ah 'm like line 's still read thing walk divide walkin sometimes translationsitalianofrancaisboulevard n't shallow;Boulevard Of Broken Dreams by Green Day.txt
Bounce;Sarah Connor;woman name freaky call late cheat somewhere play run response go front chance love heeeey try yo say 'll else come yeah shit let give ... tire bounce bed creep fool stuff soul good game dog get mine know one freak mean start lyric lie fill ca dime today gon hear kid oooh nothing make find need rather worry act lose saw ai forever eye explain wait might studio man girl also boy nickle tell place part na sleep tonight green home talk cause conversation babe pager bounceembed arm role day block remember 'm like way night shorty hat 's work 're hell never bone even baby door guess two-way look stay minute eyed sarah space 'd every n't nah move take plus;Bounce by Sarah Connor.txt
Break Down Here;Julie Roberts;blind something late keep gas clangin mirror turn rollin' leave rearview love go leanin hood wish 'll say middle god near edge ever let drag easy ... mile trouble dead-end back outta good rain gauge know ahead one dream start lyric lie ca everything stop sure without broken bangin nothing single little wheel make need town help ai bust hefty embed might likeoh around pretty danged also wrong marker somehow break nowhere fifty radio last road e pave 'm far hate 's underneath bad cry cigarette ago thousand baby thing smoke tear bag blood 'd n't pour another move knowin';Break Down Here by Julie Roberts.txt
Breakaway;Kelly Clarkson;something spread grow ta keep hard chance love onboard travel try wish 'll come fast easy reach away breakaway un would rain ocean get forget know belong one darkness swing lyric sky hear felt da-da-da make da-da-da-da 'round town revolve palm rush fall train might 'til da-da change also wrong touch sun tree awayembed break tell speak place na sleep though stare jet wo building maybe window like floor plane pray learn hundred far 's end could feel door wan small fly happy want wing risk warm 'd n't move take goodbye dreamin breeze;Breakaway by Kelly Clarkson.txt
Breaking The Habit;Linkin Park;leave clarity try say 'll apart habit pick breath memory unless wall cure paint wound worth anytime get fault know one mean realize start 'cause always likeembed option translationsportuguesbreaking tightly battle confuse room scream clutch safe might show also break tonight lyrics catch instigate choose like 'm way open 's end lock never assume door tonightyou much want alright consume fight inside hurt n't;Breaking The Habit by Linkin Park.txt
Breathe;Fabolous;face chokehold something ta chick flow keep woo alone hard leave shoe us lay share quick hook pace yo say come fast presence york yeah hearts stone flip lick verse everybody embrace quiet breath ride let worst mile unless time present fab doctor fresh glocks chicken sicker put back oh breathe race good chest grip brooklyn tef' fact niggas get oxygen toy know year one three metaphor fuck start lyric phone sign ca taste dime dick gon four money-hungry address stop staten twenty crew make rather need mask-es gut find either investigator wear hearse ai cop best react 'fore coupe air escalators roll wine see embed might wheeze 'bach 'til island two gasp man right k also stash respirator chase ya hater break diet funny tell na asthma shake may-b grab choke wo uptown heimlich catch last rhyme cause talk kb seed hum bronx a-b 'm like block way slick motherfucker dude 'em pop new 's bad lock deep harass past behind underestimaters bone punch boo weed hope wealth even pair could feel bout baby wan health cork walk bitch blue bring left look breezing plasma hurt minute inhale cut reason tight space 'd f blow well n't every attack stethoscope future take smell nigga tick queen pass;Breathe by Fabolous.txt
Breathe;Michelle Branch;ten hold keep chance say 'll yeah rainembed breath let give time 've away fade whisper breathe good rain real know one mean realize 'cause lyric fill wonder everything hear drive little eye count wait see might 'til also waste tell na crazy talk hour like 's overrate bit end hop never feel wan thing watch alright stay dark reason space well every n't another take piece moment;Breathe by Michelle Branch.txt
Breathe Stretch Shake;Mase;whoa light grow ta mr. flow keep woo gray maybach velour iran play resurrect run turn go wrap ow tour waive hood win 'll say yeah collaboration everybody life god ever let raw uh-huh hit prolong give time bar people away later g- soar list kinda pay old fist back proceed put oh breathe good game fact get forget think real men stretch year know guy one mean million bringin hatin dream suede instead mandalay lyric lie plan hot hear kid it'sit uh little dj make star need hahahaha law `` sorry moses next ai help oxymoron long hair awake coupe bear favor see embed might pretty gettin man right girl change show money also wrong beg chase boy ya y'all fee break bling eerie city indeed na diddy lift saint sleep though shake spend della singapore hah ha e somebody day like 'm five way floor use new crucify lack extra 's hate stutter work bad chillin betha bit brand fan cry still thinkin '' thousand even feel wrist wan wife thing haha bus sex yacht fiend bring heis buy stay fight chow scratch stand drop tight big blow n't rip another take c'mon wake dreamin ceilin m. sound;Breathe Stretch Shake by Mase.txt
Bridging The Gap;Nas;light runnin name voicin father match bridge sketcher call mr. africa keep side none luh turn heart juvenile class go queenbridge street natchez try grown master charlesembed rap curriculum youngster 'll say yo child come york yeah peace daddy gap nasir stone verse type care let snatch hip-hop spoffard give mile x olu muddy 've wall young delinquent school ah alive old dyslexia greece slave back nas stuff would good rain game bid well-known get box real think saudi know year arabia magnificent artist one pull horn harmonizin 'bout start lyric discover art please kid blowin profile stop uh dara little coulda wolf house brother ray `` la-la-la la-la busy jones doin style dizzy huh gre-gre-gre-gre-greatest cost ooh's live hey-hey-hey-hey great-greatest bear first see might around berry water gettin man track mozambique right rest number also great prince wrong mad change mississippi boy mighta y'all madagascar ya book wild tell speak everyday place city na home cause superkids rule purple 'm like music poppa paris new pop integrity 'em 's howl mess bos end hop still '' skit read rollin jazz poem feel hey-hey-hey teacher -- minneapolis many writin gospel blue world compulsive want draw pix homeroom tool graffiti every n't move guide chuck la history searchin;Bridging The Gap by Nas.txt
Bright Lights;matchbox twenty;light name late keep turn leave love go bound 'll say york come yeah god let bright sake except get spit lyric apartment hole ca scar find save make need broadway town receive homeembed see might around man change also somethin city alien home talk maybe 'm like new 's sense railway 're enough baby miss thing world well another n't take picture;Bright Lights by matchbox twenty.txt
