title;artist;lyrics;filename
Hearts Away;Night Ranger;blind face hold heart go wish come throw hearts near ever let memory x time young away cast yesterday oh kill think know one mean lie today always likeembed sure stranger lyricshearts sorry next everyone see might forgotten also lonely place na sleep really 'm night 's cry never romantic feel wan crowded 'd wake avenue;Hearts Away by Night Ranger.txt
Hearts On Fire;Bryan Adams;light runnin face side hard heart street empty come ever thunder time fine oh good get know one pull risin nothin start fire ca please always likeembed gon mind foot make need worry lyricssome town ai help heat burnin best honey true standin see might right also hotter comin ya tell place na babe like 'm way night 's tryin bad 're never bin feel baby wan thing inside movin' n't sideyou;Hearts On Fire by Bryan Adams.txt
Heat Of The Night;Bryan Adams;light high hide call side alone turn leave run say 'll nightyou crossfire come ever mornin time message pay tune low back chasin real know one meet lyin pull dream piper cover lyricsi likeembed gon soon heat answer scream might around lookin man right shade also comin ya na catch pray night 's silent behind 're could nightmare look fight 'd well another n't take pressure someday;Heat Of The Night by Bryan Adams.txt
Heaven Is A Place On Earth;Belinda Carlisle;alone outside love street wave say 'll come begin reach ooh alive worth know pull start lyric afraid anymore hear living heaven kid voice make star lose miracle fall first wait room embed might around understand also spin place lift home close sea 'm like night 's 're feel baby earth walk world bring move carry sound;Heaven Is A Place On Earth by Belinda Carlisle.txt
Here I Go Again;Whitesnake;strength hold sweet keep alone heart love go street search ever give time 've yesterday oh know mean seem dream lyric gon sure mind rescue make find need ai hang charity bear answer wait might rest likeand also lonely waste promise na though timeembed cause road drifter 'm along like day pray 's lord never song walk look n't another carry;Here I Go Again by Whitesnake.txt
Hes My Girl;David Hallyday;dress blind hold woah lyricsthought hide pearl prize late hard heart date love go us say win impression time ooh put resist shock fool oh good would game strange get think know one store please stop kiss little twist foot find make leg fame fate help long best girlembed true hair first see might man whatcha matter likeand girl also tell cause fingernail arm 'm glad 's behind could door baby guess knee friend miss look hand blood drop big n't pressure;Hes My Girl by David Hallyday.txt
Hip To Be Square;Huey Lewis;hard play go fun try lot come everywhere square care time suit fool good eat deny think real know renegade lyric freeway likeembed farthest hair idea boys see might around settle also tell nowhere crazy yes punishment whose figure day 'm like use way 'em 's work straight could even business watch look fight cut hipyou every n't hip band take tv;Hip To Be Square by Huey Lewis.txt
Hold Me;Colin James Hay;light hold something thatll ta dancing side chance run go lip try say win everybody breath ride mile dangerous wall away chair low put back smile stuff good get think realize start cool curve likeembed gon hot voice less mind harm deal im awayyou lose across ai eye ive room wait might around muscle glance water matter also tree break place na leainin shake tonight home rhyme cause sweat day pray must 's rock thousand even feel shift shoot guess hey watch want ship fight lyricsbetter inside sink reason well move hip n't carry take breeze bout;Hold Me by Colin James Hay.txt
Hold Me;Sheila E;erase reverie hold side leave love try say ever memory time 've head oh would defenseless lyric lie fill sens likeembed hear voice mind kiss nothing lose capture long eye yet see might pretty also wrong touch promise na strong last babe 'm must 's baby wan many want look stand every n't picture;Hold Me by Sheila E.txt
Holiday;Kool;face snow call flow dancin' play run holiday love fun romance lot cheer 'll child vacation let lovin give ... time ooh rockin wonderful back smile oh lyricssummer winter know year one dancin horn cool fire rejoice need relaxation town lake tender invade fall hair spring embed might private also sun celebrate blowing like likewhoo night learn whoo 's work 're baby top tear fly stay getaway romancin' burning beach well season spiritual crystal fever breeze;Holiday by Kool.txt
Holiday;The Other Ones;eye sand way hold far get high pack hate a-hoo know might lyricsanother ahead land car straight distant 're holiday dune go right wave show also likeanother sail walk sun hola-hola-hey 'll awayembed hola-hola-ho bag look hand a-hoo-hoo a-ha-ha kiss foot wo ache beach well another n't take away listen head moonlight job low;Holiday by The Other Ones.txt
Honestly;Stryper;believe 'm beside trust honestlyyou true call betray see year might honestly love never lyric also friend ca always 'll say likeembed patiently stand faithfully n't forever;Honestly by Stryper.txt
Hooked On You;Sweet Sensation;whoa rise name cant hold something grow hide high youembed control turn play heart love go sexy try wish hook cold say thats else yeah curious time ooh oh good game lover real know youre one seem maze start cool fire hear free lyricsooh im find make need lose eye long wont true explain see set might insane right serious also touch tell body na whose dont day way night temperature tremble nobody 're word could feel likeim baby wan want look th-th-th-thats inside trap take ho steal;Hooked On You by Sweet Sensation.txt
Hot Hot Hot;Buster Poindexter;ay sweet likehaha keep ole ee-yessa go come yeah let time people fundamental lumbumbum lalala resist soul oh get ee-yes real know feeling fire ca hot hear mind jam spirit need air see embed might around lyricsole girl also que party captivate rum-bum-bum-bum like 'm como estan music night 's lord rock 're feel celebration song haha n't chant rico;Hot Hot Hot by Buster Poindexter.txt
Hot In The City;Billy Idol;lay fun long-legged 'll york yeah a-walkin summer quiet tonightembed ride someone 've people young round head get forget know scheme dream seem ribbon lyric afraid hot breaks beat stranger foot make heat eye train wait see might 'til right also lonely city tonight chain cause 'm like night brain lovely pop new 's 're hateful a-bomb black walk world look drop n't move sometime;Hot In The City by Billy Idol.txt
Hourglass;Squeeze;light blind ringing flat face bridge call run red throw sand fist back fallingembed pound one shore lyric grain hear stop crew little house hang hill fall overboard spring see everyone might hourglass also telephone abandon shake green catch steep turning like 'm floor 's feel door watch hand ship big knock take swim neon;Hourglass by Squeeze.txt
How Much Love;Survivor;lyricshow alone leave love takeyou say give time slip away softly chorus put oh get deny mine know die scare likeembed eye see might rest show also beg touch waste break ready tell part persuade na anybody like 'm 's end word -- wan guess meaning much left stay stand well n't take moment;How Much Love by Survivor.txt
Human;The Human League;face hold human hide go try else come apart ever someone time wipe forgive dry born would one lyric fill please flesh nothing emptiness make need saw eye long bear see embed might man change also pain place mistake wo like 'm way night cry 're never guilt could feel baby many ask tear void look blood hurt space n't shame take;Human by The Human League.txt
