title;artist;filename;lyrics
Chantilly Lace ; Big Bopper;Chantilly Lace by Big Bopper.txt;right round funny big act bopper a-hangin loose pony world lyricshello pick ha honey real baby talk goose lace big-eyed late wiggle walk likeyou eight thing long girl feel sweet money tail giggle chantilly nothin necked face spend pretty
Come Closer To Me (Acercate Mas) ; Nat King Cole;Come Closer To Me (Acercate Mas) by Nat King Cole.txt;acercate darling dear give eye live music besa thrill besas porque divine song besame heaven closer asi heart lyricscome ask hear start sufriendo long como mineembed please whisper mucho learn paradise close love kiss estou life pronto wait tu likecome bliss mine pero adore
Come What May ; Clyde McPhatter;Come What May by Clyde McPhatter.txt;mayyou even long kiss find near mind apart fall lip mile bear remain lyricsi live plant since night though upon heart teardrop mine picture lonely may away start day true love divine
Crazy Eyes For You ; Bobby Hamilton;Crazy Eyes For You by Bobby Hamilton.txt;crazy sometimes peggy darling minute sue cra-cra-cra-cra-cra pat dear second baby anne carol eye feel lyricsi yes glenda hour every mary gay jenny good day marie indeed true love
Delicious! ; Jim Backus;Delicious! by Jim Backus.txt;even mmmmmm dear cozy yes paper put f ha-ha ha hee-hee-hee lampshade hehheh care every fun champagne new heh-heh delicious want waiter eve dabba year hic scooba j lyricsfriend thish doo job loshe pour jim night hat cork keep heh table
Do You Want To Dance ; Bobby Freeman;Do You Want To Dance by Bobby Freeman.txt;want hold kiss dance baby moonlight yes hand romance night squeeze sweep lover man hug mmm
Dont Ask Me Why ; Elvis Presley;Dont Ask Me Why by Elvis Presley.txt;long want need love kind without dont would live goodbye though heart dream ask whyyou good sad else
Dont Go Home ; The Playmates;Dont Go Home by The Playmates.txt;yet fade hold near saw dance lyricsdo likedo finally complete leave dont please wait till tree party learn little world stay meet home love
Early In The Morning ; Buddy Holly;Early In The Morning by Buddy Holly.txt;early time right yeahembed milk stone want best cross hold ever moss break sorry miss hey yes back lie tight goodbye morning heart rollin cry bridge nobody away day gather man spill
Early In The Morning ; The Rinky-Dinks;Early In The Morning by The Rinky-Dinks.txt;early right milk stone whoa break yes dink likewhoa tight ya hold bad moss sorry goodbye heart rollin nobody bridge lyricswell time want best cross ever mornin lie morning away miss cry rinky day gather man spill
Enchanted Island ; The Four Lads;Enchanted Island by The Four Lads.txt;wherever enchanted beyou yours-and-m never stand call magic lyricstrue face upon island roam enchant land may sea true find around home love
Endless Sleep ; Jody Reynolds;Endless Sleep by Jody Reynolds.txt;alone ran voice nowhere run quarrel endless rain hold near saw baby reach darlin heart fight hear sea fear around shore join sleep footstep cryin angry fallin tonight save black deep away look water steal forevermore leave breaker night seem full keep mine cry trace
Everybody Loves A Lover ; Doris Day;Everybody Loves A Lover by Doris Day.txt;ya ball gee help tall everybody anyhow guess lyricseverybody worry ten feel personality yes call since else foot thinkin wow popular havin youuuuyou lover fell love pollyanna
Fever ; Peggy Lee;Fever by Peggy Lee.txt;julie right something flame afire ago give name live point put thy romeo hard tight care dare fever hold forsooth sun light baby much way till story call lovely felt giveth new lyricsnever centigrade start wo around thing burn long chick everybody youth pocahontas kisseth bear juliet learn listen daytime morning missus moon kill love fahrenheit affair burnyou kiss captain never sizzle daddy night thou smith arm try mad treat
Fools Paradise ; The Crickets;Fools Paradise by The Crickets.txt;cana fool darlina wea sit dear apart worry lyricsdo mile ia never live please alone back cause flower night many paradise heart heartyou true think love
For Your Love ; Ed Townsend;For Your Love by Ed Townsend.txt;lyricsfor kiss repeat grow foolish would heart beat anywhere anything ahh love
For Your Precious Love ; Jerry Butler;For Your Precious Love by Jerry Butler.txt;whole fool darling lyricsyour know-oh-ho precious world woo-ooo-ooo lonely whoa-ooh grow wide mean ~you first oh-ooh blue a-you so-whoa sea wo thing surprised long girl want ever deep could realize love ooo-ooo-ooo
Ginger Bread ; Frankie Avalon;Ginger Bread by Frankie Avalon.txt;lyricsyou crazy time long kiss nice corner spice sugar young much kinda wait momma every bread full share heart two date ginger say- beat meet naughty think
Got A Match ; Frank Gallup;Got A Match by Frank Gallup.txt;stuff instead fortune stone emphasis incline disturb volume sound modern strike resume pray share truly engender by-the-way liberal care babbling comedy soullessness curiosity near nest saw appropriate particular incompetent much rap length laertesadvice enable strange peru improvement peculiarly ragout raise spinning-jenny nobody old along offend censorious form likely tender veteran humility trunk pure side characterize l smoker sweet surely cherish abandon especially knitteth away enwreath stream occupation fast recommendation midriff life civility sort pith shining presently return excitedly pursue morality object manly increase hook result easy ribanded contention clergyman deny inspire heated simplicity cheerful young familiar coincidence point latter last viler surprise cause pearsa ruby gay mood mystify anything garland hath ballad wine.who rotten weary continue pensively christianization yield unexcited rosy future mitylene.who indian indignation consolation seat popular free noonlight ingredient figurethink fear reason greased tooth herbage short extinct bear whizzed slid sure perfect appear population lie rag-house princeliness others punk subject misanthropical ye sterling individual hearta enhance himthe certain rim notion wrinkled play another nothing safe invade power adore presentlylet overgifted par accord reveal wine stamp treasure-chamber misgive enlighten outnumber lean poetical celibate turn afraid worldling put precious excitement yard good spirit aid accessory bible last-named doctrine almost abuse indifferentlyfill detestable eccentric befit difficult certainwhat philanthropic philanthropists moderate help heightened ever permit agesthe stage moral presence maker italy impetuous senile crown evil ground devil likelihood labor inca sake joyous experience kind chance categorical barrel speculation alabamaian pecuniary graceful wine-corker receptacle advance prove think mad commentary tie france automatonism move warm break extol august affable converse loose human meantdivinely inculcate hypothesis murderer sha softnessto prime manner ingenuity speech hard degree match-box pain genuine stick inexpensive mildly snow-bank memento limit unhandsome ungenial men speak eunuch group drules gray mellow ketch flesh first paper-and-ink vicious find wicked soft bat poetic large wisdom former require wise left-hander two closet madeira knock speakdepend pleasure reduce view fill uncle varlet cattle remain fellow economy boy opinion vile noble dotard-of-state air globe displease factit dexterity west ago atahalpa dear stranger attest eye advice invidious fervently world top far guard tread indirectly hall trust energy flow repose cite persuasion calumnious would mean gravely escutcheon unbroken stay fact heroic stagewith apple want bravadoing irresponsible waiter immature wonder evoke competent foes.who feel redness embarrassment less misery raw besides revel doubt sad living ripeness thinkand steadfastly distrust enthusiasm wrung-out expressive unto concern tobacco-plant abstract touchy indiscretion mouth unfortunate plant golden genialized undeceive sinner fuddle advicein sense excite author table suggestion case something law fool glad birth stretch heart-joy forbearance give alone glue valeta cheap thy hate canvas sedate jewel hey-day mature madly era tickle interest protest guise spurious snowy urgent autolycus probe trader red new whose ill forth casethat join virginia sideways imagination inadapted sit cot coonskin word year sauce-pot sincerely capacity since verification affirm dog fatal thatthat beside goodbut christianized crazy queer division print eagerly mischievousness petulance trifle disciple match fellowship oil joint-stock upon dream distress supremacy boast slowly try paralytic earnest lecturer poor provocation iron tip throw deceive bit acquaintance to-day disclaimer hardly fume flesh-and-blood little desk poloniusyes brewer gentleman survive exist god effectively breaketh brave people sentiment way call head lucky approve commit exert smack cheerfully truth.then hint green lord linger dandy offense general smile boyhood influence impression body chesterfield experiment impair supposition maxim agethe corrupt tidings reclaim wholly sometimes gladiatorsgeniality eclipse lead stylea proved ah extreme broadcast withdraw never breaker surly transfer lay tend certainly mine fiddle thaw mellows roguishly paste fall cylinder faust regard recollection tree concede mass boot criticism pick straw ice-bound color gold tide impel abatement coming triumphant professional surgeon ripe effort puritan hand sibyllic hang bounteous century chair inspiration steer panegyric hear clandestine philanthropist long office step exclaim cometh desire save puff prefer operation amphitheatre morning corrupts drink genial figure personal magnify charitable irreligious disgust conceited smokecome shall face inferior touch wreathe delightful right represent among sourly captivatingly fierce manas live really whit diffidently abroad suitable resent bottle sacredestis interview father devout employ stomach charlie cheery real invoke prudence bungling common reply winter superior flee confidencethat moist reflection cigar though fare genialization felt lyrist nobleness sea career admiration fan press needy employment doctor add rose everybody moreover missourian without grand saying learn begin drinking close precept beggar bluntly rogue purposely grant freely dignity charming flush earnestness weep weaver social example powerful intimate round idea conceivable wish isle character virtuous rhine latent exception stand charity present peep buck utensil indispensable conception enter companionable morepoor suppose lyricsopening wound hold modesty fatuous ascendant sobriety apply implies weak lyre great abandonment indefinite monster cringing calmly moment quality england always mend sharp witness thank unless look remember pleased fanatic confidence-man particularly indulge repeat cleft arraign discreet bring serene aspire glass cry contrary flavor small man change understand least sinneris hidden tone secret diabolical read misanthrope whatever push humanitarian vine wayby hope geniality jocose hour grapnel recruit use bluing-bag fly-blown decorous advantage grass self-possession dispense light process heaven suffer sober part profuse impolitely fit history fain false tyrant winethe lose spring still glass-unperceived stiffly wear attend intention warner vocation bless ash love open simple confine allthe pas exactly fuseth leave prejudice thanks livery spleen uncompanionable pocket must pressman lock catawba alleghanies happy honesty pitch whole avowable pirate salutary archly profusion name admire perplexed genuineness drule grapple budding unsettle drank low resentment consort us sun confess repulse sworn deposit sorry comrade talk involve launch till anger friend crude perhaps truth unsuspected laertes effect wo together isisin leg ate family nettled scholar quite mischievous enjoy shakespeare wasp profession shameful port bias confidence mankind thus hug account smoke forever sonmonstrous bliss stun keep cram praise day preoccupy wantonness laugh company notice original one-sided senator outlive twinge conjecture condition tobacco whiff wretch express thermometer western schooner decline stale compatible hide insincerity comparatively circumstance goldsmith ardor principle previous signifies hortatory giveth finishing eulogy growth strong understanding tether explain best poloniusa occasionally companionably black none except chap attentive address hail accompany reverence evidently tranquil prescribe mind believe money-making pizarro observe malvolios style humor age assurance leaf vinous even tickled surface selfishness act hob-a-nobbing progress league superfine consider benediction gentility unaffected glance forget knave frankno poor-house prudent brother commonplace rhineland importunity department rejoin convivial unreal rapture bind pronounce loitering impossible adoption youth sip goad knuckle assume hasty could hopeful bland echo cigarsyour noi answer show else pipe yet heedless fancifully cravat unprepossessingness bark mostly naturally business noah genially contemplate stigma seem thou deity grave may rattlingly question pretty true arm accept treat fireside suggest ifsupposing dropped tarry poet cosmopolitan yes fastidiousnessthat fourth refinement thought gallop depend stack privilege otherwise stump person vas bowing dinner every creature qualityin heart illiberal conviviality sociability son treason generous scullion hast venture investiture everywherea patience evince reliable set money lightly fop christian course probable fifth rheuminess flourish wrinkle auxiliary mild affair time-serving hangman eventually likeness reject opulence aspiration unimportant full disinterested inflicteth sole unpropitious expand madness melt anybody companion admit foreshadow rope universe expert steel wash drop indeed victim polonius speaker drilled reserve forsooth probation pooh however testily courtier bribe serious measure mummy-colored contrast retail next devise pottery quiet confide affirms frank possibly thing time constitution bounty murderersno slight counselor plate appealingly exultation jack butcher puzzle friendshis oppose place kindly slip contingency agree dry fine fly boorish nature scene language cigar-stand dangerous knowledge timon hollow free-and-easiesit blessing rosiness spaniard high soul willshould passage destine
Got A Match ; The Daddy-Os UNCERTAIN;Got A Match by The Daddy-Os UNCERTAIN.txt;wantin slug stomp quake knife fool force magician intense wish give break cover slitherin whack point tradition chase last verse yo killin mask orchestra dis masterpiece bacteria intellectually good wake gate shake jason bitch playin proper steamin ya wither care twist christ clearly lake skin win gibberin itch flow pass much rap people launch way mic hand jaw every gettin torture superior nigga appendage serially friend wearier flesh first sacrifice release smash tec infest fibber ask flake fight throughout effect hear fresh fear mc hemorrhage wicked reason fisherman time rapper want always plan offense hack everybody hysterectomy michigan ever physician stage contraband showin mystical feel ache set tire flip tryin less none goin recites shape shiver weekend bite course could invisible potato unless amazin slice kick fill materially personal illegal rhyme open slicin sake task wizardry disease steal life blowin sorcerer different toss stiffer piece operate quiver impress chance jackin success physical image remorse toilet never fest match snake hey hot whoooo enemy back spiritual disrespectin face full battle deteriorate dream spatula inferior fake ayo severin day clever fuck man wack teapot flea amends bust shit
Gotta Have Rain ; Eydie Gorme UNCERTAIN;Gotta Have Rain by Eydie Gorme UNCERTAIN.txt;even something bout heya wing rub name stand live hockey flyin white chad imperial problem game f tickle stick vagiiineeeey rain skin peeney jelly cigarette dick today people thinkin coffee hear lyricsyou thing time digeridoo kimya noooooooooooooooooo want always omelet kid kin rich black grand ked audience wear listen likeadam two cha hole suit remember cute crack ah margarine- guy miss hey mouth lay sing jam condom night play foot egg rainbow dream power meet ta think k shit
Guess Things Happen That Way ; Johnny Cash;Guess Things Happen That Way by Johnny Cash.txt;thing happen god girl everyday help kiss find someway guess someday lean forget baby give heaven miss stand way alone put another ask wayyou along man strength
Happy Years ; The Diamonds UNCERTAIN;Happy Years by The Diamonds UNCERTAIN.txt;happy right something even least truck pay probably alive bye-bye force goodbyeembed personally scream star round type eye wife live hope dominican month divorce woman later yo last joy hate demon beautiful little coward janis game pick good honest dig ha scar tat stop gold color trust catch counselling shorty us pregnancy astray saw tried bag baby flow aight fam much people half talk men would behind speak heat friend serious goodbye meaning next heart new imagine stay plus altar miami depp ahhhhhhhh longer fight walk seven matter either pimp reason ride deposition nose gangsta thing time burn cheat selfish lawyer want louder pride everybody highlight grill niggas angry fault .. year write black cash enjoy peace clean end since cop awesome listen could die morning two racist away seed cuter look crib birkin truest mom love crazy yet happen bride mess joplin version breath action johnny cat mind guess life different believe forever happens bruh enough never leave match final nas daddy back key boy certain night seem another bail grave watch fake blow day rewind fuck weird trak arm ta soul think bye
Hard Headed Woman ; Elvis Presley;Hard Headed Woman by Elvis Presley.txt;doin manembed clock round tree woman cause world pick trouble clear hearted hard catch thorn till adam cotton head king hear start around soft jezebel apple side rock delilah eve ever since listen begin loud away curly evil mess swell finger samson play keep cry man hair
Hey Girl - Hey Boy ; Oscar McLollie;Hey Girl - Hey Boy by Oscar McLollie.txt;doin right west yall bout r. sunday funny b mumble maybe mase dipped jump modern watchin live really music melo havent woman pray breakup wrap world top floyd ya player rain dead saw kap bad real rap dont cam mean gang horror cali though twin nobody dc old stay fact tyrese vega shout blunder keyser walk nicki tiffany oj jet girl meek dock want folk everybody matt wonder l aye feel takin rod black peace learn clean mill waitin north couldve cheddar away doubt special backpack chicks taylor boonked putin lotta kelly kyrie style lonzo runnin phone tryna choose wack fell spacey ta even humble sexual hart march dat news give stand heres sean alone triple cause shot thats gay loser buck solar wake shake meat scar stop didnt twist song protest chyna catch ball mix eminem work soze la lookin lady weak dumbass confused new pepsi hatin gun fire usually beef around percocets fif diss welcome trump weinstein sit mcgregor hit glow year russia please tire somewhere wendy outside jenner racist ruin blac trippin look usher dude lavar show kill engagement street crazy rootin soon skillz comin yah violence ye shoe guy wait affect control seem dome grip play straight bowl many power fidget fuck man swift bye shit probably bloody tip need haddish throw im finally yes turn homie buy verse manchester thought little lala bro good clear despacito brown united net salt light aint bag baby stole people way fair every gettin head test oscar son speaking somebody lose still beast buzzin respect money south slate molly cop boujee kevin j ground jordan spinner lo love charlottesville wouldnt sometimes eclipse dumber heater hurt seein wont storm libya talkin never leave liangelo pink khloes mine silence wind sprinklin lovin mad heard damn em whole celeb big somethin break trap album movie disguise send peele masterpiece game drop kardashian sza bitch lot yeen slave bump apologize us pair sun nfl covfefe busta ima couldnt beefin speak bill coulda excuse cant three friend wipe cmon next hov rap-up ask start hear insecure rest find bitcoins shame chris sign together hack kid draggin spicer kendall listen house royal place million bully lauer cardi super everyday faint internet winner hey serena harvey back boy shade beyonce rob wildin keep watch touch ayo korea day trip soul wild issa
High School Confidential ; Jerry Lee Lewis;High School Confidential by Jerry Lee Lewis.txt;something shakin news bit give fuse a-honey rockin little confidential a-movin good shake honey light baby sugar heart rollin rhythm blue boppin hoppin lover burn a-here a-beatin a-jumpin mama lyricsopen everybody rock tonight sweet woo listen movin look hop a-groovin jukebox cat singin shoe school boy high foot smooth hopembed likewell blow soul
I Believe In You ; Robert;I Believe In You by Robert.txt;even pay sustain outnumber apart give dawn alone turn driving white far worth shake pain rain renew near real mile laughter today winter friend though heart ask walk matter frown around want always plan door forsake still feel drift black set could morning drive look earth youyou show love tear disappear mind summer believe pursue back thousand town night keep may feeling change home
I Wonder Why ; Dion;I Wonder Why by Dion.txt;care song background want always d-dahs d-d-dun d-duh d-d-dah often wonder continue break mentally doo-wop d-d-duh-duh-duh never dun would part sure friend share thank heart upfront away d-duns throughout true fill think love
If Dreams Came True ; Pat Boone;If Dreams Came True by Pat Boone.txt;lyricsoh happy company soon song always agleam darling star dear need ever laughter moonlight eye match would moonlit garden starlight trueyou dreaming could heart paradise keep discover dream world trouble king lover true arm everything
Ill Get By (As Long As I Have You) ; Billy Williams;Ill Get By (As Long As I Have You) by Billy Williams.txt;early dew right need stranger gypsy warm eye turnpike alone surprise cause use travel california good stop castle weary bed grow roof call root head throughout around long together always side settle word feel body withered could begin morning house pennsylvania cabin pleasure place look indiana everything love crazy instant wherever life hill never homeyou youre night high dome another keep wall touch soul home
Itchy Twitchy Feeling ; Bobby Hendricks;Itchy Twitchy Feeling by Bobby Hendricks.txt;something dip mad jump music twice lot legs twitchy flap reel bad much people hound call felt nobody ask shout start wrong long leg sit rock still wonder stroll feel feels roll sure tune dog house itchy look hop soon dance nice yappingyou rocking mouth bandstand dih feeling rolling must arm yapping try think lyricsdih understand hair
Jealousy ; Kitty Wells;Jealousy by Kitty Wells.txt;crazy shame fool cure hurt darling life deceive feel never set sure lyricsjealousy suspicious cause control jealousy heart faith breathe air free drive jealous realize must soul wreck distrust love
Jennie Lee ; Jan;Jennie Lee by Jan.txt;bother girl lyricsmany ago seventeen life grow name eye without year live leave sweet wait lee leeyou marry bright little heart jennie fire meet true try love
Johnny B Goode ; Chuck Berry;Johnny B Goode by Chuck Berry.txt;among read someday big maybe name stand live tree music orleans use strum little band driver ring mother evergreen guitar stop sun light carry mile pass sack people would way leader b. gunny new old engineer rhythm goode country hear track around sit ever tonight write bell learn deep could cabin earth close railroad goodeyou log johnny wood never beneath louisiana back boy shade play many man
Judy ; Frankie Vaughan;Judy by Frankie Vaughan.txt;cart fool heartache stranger fall eye drawl yes hope voice smart lyricsif way call every hundred heart shout hear wrong southern find soft apple upset spring bornyou l sure betcha danger judy guess fellow bring wrtech seem watch praise saint hi yourr
Just A Dream ; Jimmy Clanton;Just A Dream by Jimmy Clanton.txt;time plan always song sit love past still forget never live leave please alone vain last lie misery seem could dream mine picture cry late scheme hear wo mournful think pain
Just Like In The Movies ; The Upbeats;Just Like In The Movies by The Upbeats.txt;crazy happy pretend lyricsjust kiss hold follow confess fall believe baby kwai part paper river south movie end build world cry bridge moon swim youyou close lover pacific around love
Kathy-O ; The Diamonds;Kathy-O by The Diamonds.txt;thing kathy-o always star secret kathy-oyou wonder grow bewitch never strange window angel little lyricskathy-o dream taunt devil love
Left Right Out Of Your Heart (Hi Lee Hi Lo Hi Lup Up Up) ; Patti Page;Left Right Out Of Your Heart (Hi Lee Hi Lo Hi Lup Up Up) by Patti Page.txt;right lou dear give name mighty really yes red-head merely heartembed city suzie cindy surrender hi-lup baby lyricshi-lee call believin left hi-left heart start bein hear around time girl best hit save charm field since telephone marine look tho figure hi-lee love impressed breath cute kiss caught leave likeoh back town play silly hi-lo arm reveal
Leroy ; Jack Scott;Leroy by Jack Scott.txt;wail lyricsi live month hate date dig judge pointed minny heart stay blue son rest lateyou long best leroy wear jail two cha tale six cellblock shoe never back boy straight bowl bail keep man try
