title;artist;filename;lyrics
Legacy ; Offset;Legacy by Offset.txt;right jungle boss yall corporate fail wrist southside eye number wave legacy dawg check scandalous care trust informant mickey bad cap cabinet stock would brr-brr offset felt nobody strong shooter want rent side disrespect worry booty rich feel clean woo abandon titty animal orphan fast skrrt tear mind believe vomit lotta town woozy tryna smell home humble cup conquer easy wish bird cleanin give young k cover stand bath cheap shot mississippi chest catch spent hold opps boo trappin drippin choosy blue gun block track grab diss always cross bos year roll witness veneer since deep dog clip napkin show kill street comin print styro bandage straight lap nothing another play fuel cry fuck true try shit need throw pull ticket momma shoot put richard use gimmick run performance react famous god blicky bando half way part every nigga expose fit head command shed wrong hoppin pimpin ride twelve pussy lose ever lil niggas body money j open important lead lip path drip-drip-drip leave rari flat residue think mad whole minute big move ten shark nut sticky yo tellin zombie game bean cost blindsides formula bitch pain playin rack fuckin us nah rah talk story first genie swim quiet hear wo find slide forfeit time dentist tattletale ranch uh mama piranha car throwin pint bruddas house knock bunny sentence mille hey daddy back mafia beat
Legends ; Juice WRLD;Legends by Juice WRLD.txt;damn making maybe fall daytrip ten foggy young paranoia live last club cold demon world change uncertainty diamond hold sorry unexpected speak lace confused nobody pearl truth gun quiet usually hear time girl want always uh lose youth past hit end eeriness die importantly flex answer else soon drug title mind translationsturkceespanolpolskiitalianofrancaisnederlandsportugueslegends hey cruel seem nothing keep silence legend feeling question tryna fuck ta shit
Let It Snow Let It Snow Let It Snow ; Dean Martin;Let It Snow Let It Snow Let It Snow by Dean Martin.txt;delightful stop sign long grab pop corn kiss hold light dear storm still warm weather frightful goodnight finally bring really way slowly dying since hate tight outside snowyou goodbyeing fire place snow man turned low show home love
Let Me Down Slowly ; Alec Benjamin  Alessia Cara;Let Me Down Slowly by Alec Benjamin  Alessia Cara.txt;easy fall throw embrace hope cold sympathy little kingdom lonely grace stop fade hold cut baby way kitchen slowlyembed find long girl step feel please could away slip show hurt piece crack waste remix bathroom leave awake dignity night sink keep man slowly
Let Me Know (I Wonder Why Freestyle) ; Juice WRLD;Let Me Know (I Wonder Why Freestyle) by Juice WRLD.txt;swerve right swear comfortable eye enviyon top dumb game worth prime run god translationsturkcepolskilet care mix talk way nigga left frankly lame woah freestyle wo dime find thing time still wonder ayy feel look realize vibe kill love sky mind life waste leave night high air touch man change think
Liar ; Camila Cabello;Liar by Camila Cabello.txt;need move beg alone good trouble stop care nah way hand though stay fire wo long huh want uh lose liar slow feel kinda whisper clothes picture close happen kiss ah believe lip fireembed hey startin control another translationsturkceportuguespolskiliar floor watch think
Lick ; Offset;Lick by Offset.txt;doin right damn pay whole dawgs eat splash whew need trial france teach ten break fence wrist jump eye daughter downembed cleanse turn ferrari homie buy bamboo crime cold fought world run bitch survive brown broke pain slave stick hittin chain quit trust lynch spent pill us hold slick fund ridicule lick bond real fam sleepin bando people way root hundred rough expose note fit heart drown sellin middle land gun cancun incomplete start sick history wo son frown find time slavery codeine creep sleep food rent mama door kid lose livin still family rich hit niggas bear car beast stab black van cash grandmama money tryin hunnids pound clean deep repent woo die could bus breakin two critical seed treasury million evil ground rule kill street risk reap savage couple mind struggle repeat talkin sow kickin bring fleet hey school plant daddy concrete back political boy weed flinch foot rob many sweater keep dirty cry watch runnin pool tryna dam belong hauntin ta wild think bust shit
Light It Up ; Marshmello Tyga;Light It Up by Marshmello Tyga.txt;right eat push mello throw whoa pull serve freak young live loose trap chase put top run controllin bitch backward upembed dm c-breezy balance nah whiskey light real pass call nigga friend nobody middle stay hear bop beef slide girl want t-raw clap hit grill niggas ayy birthday throwin end mami deep beckham dog kush drink close kill street lit cat finger smoke blah addy mouth face drunk straight lap play keep air beat change
Lights Up ; Harry Styles;Lights Up by Harry Styles.txt;thing sometimes step light ever sorry never would way mean sweet translationsespanolportuguespolskiitalianofrancaisnederlandslights put back la-da-da-da-da could bright heart shine stay runnin dark around
Like A Rodeo ; Kane Brown;Like A Rodeo by Kane Brown.txt;something rodeo bar easy fall move obsess put far pick gate guitar song hold light bronco would way hang heart fight start eight ride time long girl become hell second hit hotel rush nod less since drink hop show love crazy dangerous steal life rodeoembed smoke kind lip hot houston night play keep mine touch tryna cowboy wild
Like Its Christmas ; Jonas Brothers;Like Its Christmas by Jonas Brothers.txt;right christmas warm deny cover oh-oh-oh put white angel bright top good twenty-four/seven stop beatin light feelin heaven way every inch first heart youembed fire matter reason thing time long always inside feel central year bell single wishlist end park woo could look snow season twinklin ground la-la-la love everyday life dum-dum-dum-dum believe nothin never miss bring hey cheer night keep air fake day sleigh
Listen Before I Go ; Billie Eilish;Listen Before I Go by Billie Eilish.txt;turnin need scattered rooftop cheek hmm world salty good okay endless stop pretentious leavin sorryyou headache taste sorry way year-long call vu friend blue matter feel save love soon tear miss deja leave breathe translationssvenskaespanolromanaportuguespolskiitalianodeutschfrancaisnederlandsdansklisten hurry
Living ; Dierks Bentley;Living by Dierks Bentley.txt;even right alive need bird give break eye live tree beautiful little world chest clear forget whiskey saw sun baby bluer poundin kitchen t-shirt first heart blue fire coffee start walk reason time always lose grateful livin hit feel without mornin die away drink branch look kill love sky fly livingembed breath sometimes kiss mind enough never miss back thousand likeit full high watch wind rise day try laugh
Loco Contigo ; DJ Snake J Balvin;Loco Contigo by DJ Snake J Balvin.txt;clock ice sana pela need move salsa pide im abuela latino de yo una tengo top estas run muy okay contigo stop rompe wuh e balvin todo la baby gang cancha antidoto friend fun lugar quiso mi chiquita seat new ma-mam-mami art old rum-pum-pum-pum-pum manera por wo ensenando cuando cintura que hago conmigo mujere en disenador translationsenglishnederlandsloco waist girl dale saucy want best mama selena sit booty eh lil ayy como body esta ere manana ataduras mueve mucho mueves fama caliente j two gastar con tygaembed pra sigo cadera yeh muchas lo quieras olvido champion un mata tienes cute lock kiss bate antique piece ah lip drip loco bass va hacia snake tela hot tu four gana vamos hay party face fuera dj watch pero te normal avena man trato aqui
London Boy ; Taylor Swift;London Boy by Taylor Swift.txt;motown west highgate walkin darling translationsespanolhrvatskiportuguespolskifrancaistaylor somethin uni hometown eye tea watchin live italiana camden babe mate good london stella jean queen mccartney stick god fade v whiskey saw bond much traduzione pub story gray cab first heart rumor socal blue brixton woah hear shoreditch ride find time fancy best uh smile rainy hackney ah-ah please enjoy market tennessee friends end threaten rugby louis drinkin american drivin show love street sky happen heath guess springsteen soho woah-ah-ah school back dimple boy night high english mine accent scooter meet swift true child home afternoon
Lonely Child ; YoungBoy Never Broke Again;Lonely Child by YoungBoy Never Broke Again.txt;yaya comma even right pay probably fame pen ice grandmom wish iron need youngins harder young rage therapy alone human road wax hope babyembed bracelet put killin daily missin pray thought nene chasin game slang lonely hard scar bitch thuggin pain kaylyn father tahj fade song barely fuckin hold tnt pad ahead feelin bad someone expect wild real sorry talk would way happiness behind sheronda call home brother gettin though thinkin heart head nobody old strong plus bein hear callin track lord son ride sixteen time burn blank sleep girl long want help side mama candle dive livin still draggin lil niggas feel without monique beepin dump money dave killer goin north approach royal away dmac bust kill love street knowin pipe open death comin mind life ah kacey nothin image paw-paw never miss leave snake mouth basic daddy sleeve heartless age montana town boy seem straight play dome charge keep breathe runnin feeling tryna choose man fell child change burnin fuck understand shit
Look At Her Now ; Selena Gomez;Look At Her Now by Selena Gomez.txt;right mm-mm glad dodge human woman little problem good nowembed god trust real way first new translationsturkceespanolportuguesitalianodeutschfrancaislook wrong lover find moment thing level want still feel soak year bullet mm-mm-mm perfect shiny course wow look sad love fast tear summer life ah night another regret watch fell mm wild
Look Back At It ; A Boogie Wit da Hoodie;Look Back At It by A Boogie Wit da Hoodie.txt;notice goosebump something right walkin somethin type hoodie really admit gassin plot good ring low hard benz lot diamond chain rack da-da-da bag lick focused promotin way speak every gettin nigga fun friend new stay wrong stash girl everybody ever rich hit feel takin da-da single money apology look da-da-da-um-da everything vibe love melody lit fly translationsportugueslook life different talkin never guy split da back drrrat another da-da-um-da true try think shit
Look What God Gave Her ; Thomas Rhett;Look What God Gave Her by Thomas Rhett.txt;even right swear move give anybody eye race angel god song blame nah light heaven spin wide way every heart hater fire hear walk seven billion around girl want attention lose daytona corona smile feel fault everyone perfect die could faith design drink look ceiling answer prayer sky open room kiss mind building herembed hypnotize never hot sing face evening blow man fell think
Lord Above ; Fat Joe;Lord Above by Fat Joe.txt;stove alive sermon ever-ever watchin live music porsche pray world top area joe pop dead saw cap snail real rap common hundred though preacher gun-shy stay sinatra form shooter translationslord salute side chick grateful feel takin handgun mention peace fran kick mariah sky ferry mind life mouth twitter bae cloud montana guap night bomb squeezin sense roofless pressure even immaculate fool miracle news deny give act plat terror last hate shot strap jewel buck arguin wake forget cracker diamond stop ball gift givin bulb g foreign lookin future new passin jesus san anderson sittin cross chicky door word hit year poppy neuter civilian unicorn since deep could thank dog starin clip look dude whenever mom keepin kill rhyme else death savage comin offering poo sheet blow pyrex pool cool fuck man arm spot try mm shit teeth afeni cookin need hope cue charles thought gat sub timepiece good dig shell god spanish opera quit cock lem aint light feelin cut opportunist almost way reminisce call plaque every nigga note nail head chalk brewster sauce globals lord son twelve squad across pussy box lose pac promise actual everyone flip end mary cop edna rebuke everything love heaven-sent whipped knockin aside seein prosecutor paris solitar talkin chance cafe barrel hustle full stuck hallelujah pocket think slug scream confinement tie mobster bet big move fall somethin break fore human month puns send tellin wooembed thankful drop handle stick forever-ever us nick nah villain limit politics thunk sendin hand jimmy hov soldier eight frank either caboose rest dinero dunk hamburger thing time nutjob whip sin uh horse family mischievous jack throwin scratch nightmare booth house million ceiling fiend .paak zero glock eleven chop project blessing fifty high stackin hat keep better day meet pump
Lose You To Love Me ; Selena Gomez;Lose You To Love Me by Selena Gomez.txt;easy need give month put hate world off-key rose-colored us saw forest vietturkceespanolportuguesitalianodeutschfrancaisdanskshqiplose blindly ignore first distort goodbye fire translationstieng find chorus burn sign always lose sang promise set two softly close healing show kill love dancing deserve tore replace purpose thick chapter glass adore fell think usembed
Lost In Japan ; Shawn Mendes;Lost In Japan by Shawn Mendes.txt;right knife convince idea fall sound hour zone ya flight asleep friendship cut mile baby i-i-i hundred timeline ask hear thing time plan lose feel hotel tonight could paradise mindembed tension look hop translationsturkceespanolportuguesdansklost crazy fly oh-oh couple mind leave japan seem rainbow ta think
Lost In The Fire ; Gesaffelstein;Lost In The Fire by Gesaffelstein.txt;right type alone put babe use top hide lot price light baby dice friend heart stay fire woah sight ride find thing girl want oohembed lose ooh-ooh-ooh slow year roll tire could keepin oh-oh sex never bring hey face straight keep safe phase day fuck translationsturkceespanolportuguesfrancaisenglishlost home
Love Aint ; Eli Young Band;Love Aint by Eli Young Band.txt;fool need stranger break sound alone movie hate pick hide wake couch pain check song whiskey aint talk way call friday next heart new stay sidewalk girl want somebody lose wonder feel hotel write two place sad show love pour bore leave town night keep cry may dark phone dress meet day lobby try
Love Lies ; Khalid;Love Lies by Khalid.txt;company damn whole overnight easy need deny eye admit afraid hide good hard trust catch feelin bad someone baby sorry underneath lifetime history lover ride want side focus feel lie waitin listen liesembed cravin sunrise translationsespanollove vibe show love mmm open synergy life waste night spend day ta mystery independent shit
Love Me Anyway ; P!nk;Love Me Anyway by P!nk.txt;even apart fall break voice world pick good scar catch hold bad cut mile would anyway flirt heart stay aw walk time criticize girl lose still noise lie could away million love hurt piece scandalize boy rise think
Love Me ; Lil Tecca;Love Me by Lil Tecca.txt;meembed right maybe big mad fall throw loyal pull freak wavy young hope later hate pray chasin problem date line bitch shootin sooner god fuckin saw baby much would every nigga regular free fight start find around time long want text pride tecca lil lazy niggas money dub deep could love throat soon ho replace drip winner waste never thick party sinner hoe tryna day meet man fuck shawty think
Love Me More ; Trippie Redd;Love Me More by Trippie Redd.txt;right stupid issue wish bitch stick nick crawlin would yeah-ah-ah-ah fair compare nobody ask callin time huh hahahaha uh brawlin lil ayy fallin money goin away look translationsespanollove else love internet ohyou yay keep mine cry stuck fuck arm shawty
Love Someone ; Brett Eldredge;Love Someone by Brett Eldredge.txt;right need move fall im put world good wake tight stop suppose hold sun someone baby dont would way weak hand next ill middle sea want ive smile sit ever hit sip mid-air feel sure everywhere knock sail away drink look everything love kiss mind blue-eyed dance laugh someoneembed back knee youre night breeze cool understand hair
Love Someone ; Lukas Graham;Love Someone by Lukas Graham.txt;even something probably need give afraid world wake hard scar pinch stop scared us bad someone real way doembed heart find time becomes lose smile still feel bittersweet perfect look everything love else open room life never dream day think
Love Wins ; Carrie Underwood;Love Wins by Carrie Underwood.txt;right sadness madness news fall whoa break hope put cause hate world pick worth sister lot pain fade hold win politics baby story brother hand believin reach avenue wrong walk wo matter sirens winsembed thing together side hell mama everybody door smile ever still tonight bullet end faith away fightin answer love open sometimes comin tear struggle believe remedy never screamin prejudice onto stray seem another evening keep cry power day ta home
Love You Too Late ; Cole Swindell;Love You Too Late by Cole Swindell.txt;damn probably ago star wish wouldembed clue county turn freedom pick city line interstate song hold whiskey work mile half wide would gettin goodbye felt head new old stay late wo around want car tonight roll tennessee die could close love open crank couple pour never miss leave back face another phone pretty man try change
Lovely ; Billie Eilish;Lovely by Billie Eilish.txt;even something translationsenglishportuguesdeutschfrancaisenglishlovely alive stone need someday alone hope thought hide good bone near skin way hundred lovely heart head stay woah fight walk fear find time welcome always feel hello year outside away place look tear mind guess piece ah never homeyou night glass day ta space think home
Lover ; Taylor Swift;Lover by Taylor Swift.txt;swear force darling dear christmas translationsnederlandsespanolbosanskiromanaportuguespolskitaylor stand italiana suspicious gentleman honey scar mysterious guitar dazzling highly light traduzione way lady hand call every string joke three friend seat heart blue lover want always second ever crash save year everyone please end could place magnetic close rule living love room twenty january summer loveryou ah forever overdramatic deutschfrancaislover leave borrow haze dirty table man swift true home
Loyal ; PARTYNEXTDOOR;Loyal by PARTYNEXTDOOR.txt;even probably risky star need loyal road last trouble pain bad way three friend war raise head stay truth want best fi translationsespanolloyal please money away look pretend summer nuh party homeembed control tipsy pocket spend true shawty home
Lucid Dreams ; Juice WRLD;Lucid Dreams by Juice WRLD.txt;meembed instead easy fall move give break outta point last heartbreak enviyon hate wed thought good ring forget mix dead drastic bed way shadow plastic friend prescription heart head land wo find thing girl want tangle a-okay uh inside past still feel ache end listen listenin evil everything love translationsturkceromanaportuguesitalianohebrewdeutschfrancaisnederlandsdanskespanollucid room replace leave mistake thinking back face full another lucid dream grave watch wind fake blow pretty must change think no-no shit
Lucky You ; Eminem;Lucky You by Eminem.txt;right coupe benefit alright mansion mumble sound live really asap circus road killin jugular pray puto legacy ya rain pill stomach platinum brink asleep mile pass cujo much rap would mean kitchen rappin brain cab though nobody old fact lucas bop press rapper havoc level humility want side feedback l feel takin marshall bullet draw aim pear woo goin waitin begin lifestyle syruped away fast boom happen hip-hop room lawn wonderful life chulo sumo lotta uncomfortable four ha-ta-ta bend pack regret runnin tryna cowboy fell uno ta even law humble pay suckin eat pen al eatin wish give grammys alone last hate wreak california bap record cracker chain song g work lick elevator damage lookin ghostwriter clown adat thinkin mejor wheel bein outlaw blade bullshit beef methamphetamine moment bull snap slither attention inevitable inside tirelessly bunch roll culo lie could dog ba-ta-ta answer kill subject downfall recap oven comin system finish three-hundred espanol nothin broken guy maricon bring acetaminophen anyone seventy ounce seem straight play another feeling spite grammy man fuck makin risk shit least chopper need somewhat lean pull card minithin southpaw partridge turn hope buy shoot ability upswing use little good masta mac run grass punchin buffet ft. god prolly stack invent win cut dick suffer half way practically call every nigga lucky trophy recognition woah payback dna wrong son mc twelve food motherfuckin actually askin lose ever still lil ayy buzzin juiceembed money end inability reapin hop evil everything love job bup ho hol hurt couple cat ah juice yuh path never breaker snake jammies callate motherfuck full mine think mad sell knife minute tie deck big move christmas mar fall portuguesitalianofrancaisenglishenglishlucky somethin vroom break admit tree trap album lever hood ketamine mower drop manner hard bitch lot button tat sap stick fuckin nah villain gangster rah writer ace talk motherfucker ghetto underdog truth wishin matter traduccion ribbon find boca thing time kanes long hell kid ate plate prayin die drink ceiling milligram cater rule translationsturkceeminem drought tape reverse smoke pour enough hey joyner back face banger bruno keep wall intent beat day difference relevant soul beginning shawty
Mac 10 ; Trippie Redd;Mac 10 by Trippie Redd.txt;sell even elliot swear deal big active give trippie outta slime young master wet whack alone trap homie shoot put league gat bro top problem translationsmac bone cuban bitch diamond stick wheezy ball pop song camera snatch woosh bad energy macs baby flash cream freaky swallow spain penthouse nigga gelato squash shoutout blood actin kristoff lame shout king link walk block post pistol codeine together want sippin gangbang pussy kid mac- ever still rich lil niggas hello please casper seed trippin look hop poppin show kill fly wherever range cappin slimy drip slatt never lint sing throne knee blatt mink public sink treat keep pocket cuz smell drill trip shit
Make It Right ; BTS;Make It Right by BTS.txt;right indonesiaenglishromanizationmake oh-oh hold light life baby save please everywhere night could rightembed good day translationsbahasa rehab tight
Make It Sweet ; Old Dominion;Make It Sweet by Old Dominion.txt;right lemonade sunset minute young road little radio top drag worth savin honey stick care week heaven mile baby sugar glimpse appetite san sick seven dime block find long kissin short saturday wonder ocean anne tonight year frame sweet tire windshield end jones sky open fly mess already life waste grind lemon surfside never yeah-yeah-yeah-yeahyou soul-sucking dollar town night another keep wind tangerine day cj- try ta hair
Make No Sense ; YoungBoy Never Broke Again;Make No Sense by YoungBoy Never Broke Again.txt;notice damn em stupid bar issue alright need brick im northside slime bob trap buy shoot put strap youngboy world convict cost jury ike hard bitch front slay diamond burner ball nah bag cut real neck flash today much dont way clique tv motherfucker nigga shit hatin ktrey post stash ride slide whippin whip baow want mane uh pussy jewelry youngin still cutter hit niggas ayy feel sweet cash fucking money h bullet yeah-eah die could goddamn slimeembed million brr bless close tina meech love boom fly grrah buddah oh-oh dance gucci slatt tweak never four turner dollar back motherfuck fifty face another play hoe sense beat fuck tot
Make Up ; Ariana Grande;Make Up by Ariana Grande.txt;right shut makeup break name really surprise fix cause argument fenty thats translationsespanolnederlandsmake wake mood kit stick pop work ahead bag yeah-eh-eh energy bed way every head stay find time highlight promise tonight attitude end sorry-in-a-box coincide ruin look beauty vibe love mmm eyeliner yeah-yeah kiss life lip yuh screamin bring match uh-huhembed boy dream mine stayin day fuck mad
Maze ; Juice WRLD;Maze by Juice WRLD.txt;maze big live really dirt chase sorrow thrill demon race tormented translationssvenskaportuguesnederlandsturkceitalianodeutschfrancaismaze ditch run okay mental anything pain stick rain pop continuedyou pill bike insane continue logic deposit way story every brain bank tool ill wheel ride subconscious unconscious codeine help mama lose still sip feel without everywhere mmh pro knock everything death seal numb drug life crack hot crashin stuck watch day anywhere
ME! ; Taylor Swift;ME! by Taylor Swift.txt;company follow doll thaipolskiportuguespolskiitalianofrancaisnederlandsdanskme name jump strike alone trouble band run color ya rain baby lady winter call three fun translationsturkce ooh-ooh-ooh-ooh handful nobody lame spell team fight walk lover find thing girl want phasa chick uh livin me-e-e eeh-eeh-eeh promise without kinda awesome me-e-eembed two psycho away others love oh-oh summer bore enough never guy leave lotta tend another keep rainbow phone cool think
MEGATRON ; Nicki Minaj;MEGATRON by Nicki Minaj.txt;even drunk-drunk b eatin need millionaire pull name pricey prison barbie fendi mega sticky marathon put shot send race lonely drop good mac benz bitch tight donatella shorty clappin ken baby mean zaddy call gettin margielas th-throw red fact hercules nicki megatron either candy front-front apple trunk pussy brra-ta-ta-ta rum feel moscato piss blunt-blunt bite tune squeeze con jealous pot comin hunnid telethon baddie talkin custom addy miss yup precisely keep th-that excite m-my fuck shit
Memories ; Maroon 5;Memories by Maroon 5.txt;powerful alright wish someday name drop doo-doo pain stop ya december light ayy-ayy carry toast today would way call reach raise felt heart stay youembed memory time somebody everybody lose doo-doo-doo hatred ayy feel torch ember drink remember everything sometimes oh-oh hurt believe forever never bring cheer back doo-doo-doo-doo translationsturkceportuguespolskimemories glass dark day
