title;artist;filename;lyrics
Lets Go Steady For The Summer ; The Three Gs;Lets Go Steady For The Summer by The Three Gs.txt;right maybe outcome infrared jump eye number representer live refuse faking crime cold proud convict gathors spit hittin jacked ya player pop dead bad slit real birthdays mean gang fully raise damned eastside strong old fact walk lyin nuh-huh turf chorus gangsta steady add robber mercy boogie pride everybody without black besides breakin cheddar nighter close sky mind life machine island runnin phone source ta home sadness pay round gots act give young protect k stand nina cause daily shattered city robs jury shake g-cell stop vapor tec- lace plus fella block moment hahahaha talent unfold year roll please sure underground could empty squads trippin clip busta-ass tha show rhyme street fullies magazine death threat miss control struggler seem straight many dream crippin power criminal label society fuck man child try shit stomp force need throw starve momma homie buy shoot put demon watts row good mac gangsterizm shell verbally god quit hearse felon tragically cut suffer way call pity nigga note head test rhythm buster lord son footstep motherfuckin help beam lose still niggas crucifies set money tryin biz killer course bless love job heater hurt lead mo reachin never screamin school silence wind lock bust damn whole madness caliber creepin tellin hood exercise game bitch tight handle front bump playin fuckin spliff needin cream motherfucker three friend releasin tec hungry hater feature quiet loc thing burn long parole hell step shower knowin misdemenaour fly bustas throat scene semi-automatics summer tape rida bang freeze purpose back high rat sweater keep watch beat byter day soul hustler wild
Little Mary ; Fats Domino;Little Mary by Fats Domino.txt;stop rain want doyou reel sun need apart lyricslittle believe baby spin rocking call mary since little heart top shin cry hear love
Little Serenade ; The Ames Brothers;Little Serenade by The Ames Brothers.txt;fly care long song hurt yearn shoo bird apart damour bear name miss return bring loveyou wait hope sing back window melody pray could little heart date away melodie lovers lyricsmelodie lover find serenade love
Little Star ; The Elegants;Little Star by The Elegants.txt;sky god ra star uh wish starembed light need search whoa wonder tonight lyricswhere somewhere cloud twinkle send woa high share whoah little thinkin liketwinkle may true ta love ratta
Midnight ; Paul Anka;Midnight by Paul Anka.txt;burn care hootie together kiss hold seeyou ispoon sane lip owl peek midnight eye way tree hand beneath brain high lane red lyricsmidnight heart old moon drive blue lover tickle
Moon Talk ; Perry Como;Moon Talk by Perry Como.txt;sincere really last little bright hubba tight ya care castle moon-talk hold moonlight talk would way part mean sigh call every heart hmmm word whisper lyricslast paint die ear moon hug love meant kiss night air pretty
My True Love ; Jack Scott;My True Love by Jack Scott.txt;sky always capture star kiss darling lip heaven eye never lyricsi answer set hand send pray angel thank heart touch place prayer devotion soul true lord aglow love
Nel Blu Dipinto Di Blu (Volare) ; Domenico Modugno;Nel Blu Dipinto Di Blu (Volare) by Domenico Modugno.txt;ritorni sogno mani svaniscon musica che pian luna teembed una piano laggiu dolce su tuoi volare rapito sognare blu faccia cielo tua negli il del e trapunto felice spariva suonava le cantare la occhi incominciavo voce non quando cosi perche mi porta alto di volavo sogni io mai degli per tutti belli li vento poi ancora tramonta suona soltanto ed con quaggiu stare continuo un mondo venivo piu nel penso infinito lontano dipinto sono lassu dipingevo sole scompare stelle se mentre dal
No Chemise Please ; Gerry Granahan;No Chemise Please by Gerry Granahan.txt;doin right position whew fad artist cover really music surprise last chemise crime put cause wonderin date front stop rack saw creator baby sack would musta tent hangin pity head billboard wiggle firefly start -- wo peak form find lyricsno time want door rock word stroll forty please roll sure granahan wearin dungaree gerry shape could arnold hop doo everything open mess goland woman-hater interlude talkin instrumental leave bring arrive -yeah dickey back night seem egg sweater keep dress man change jodi
One Summer Night ; The Danleers;One Summer Night by The Danleers.txt;hold kiss summer ever lip tenderly ohh loveyou night held could moon place close fell tight love
Op ; The Honeycones;Op by The Honeycones.txt;sell flame bloody train playground secret read twilight bit give im order advice tortoise prison slowly strike terror carousel grey-cast poison use voice ghost angel ho-hum orchard cling mass bright honeycomb quarter sunny welles scorpion row good wake valley run bone shell honey mother glum father stop sunlight fold stick bleed visit prism wound vision light lyricsmy irrelvant pass cell-division half boycott would speak poke horror compel every hum hundred ignore war quinine head nothingness nobody stay palm firefly sick find ugly kept press rosebuds welcome apple become leg box inside hellish still word choice uglinessyou slow bear feel without year black single please whale noise bullet clothes spll waylaid embellishments crisp lie listen wine tail tale ed evil show kill television fine othello wouldnt language simple plain orca summer morbid life coin-op different footprint eloquent never skull split bordetella beneath lung remove age night skyline cell nothing build math orson rakim day arm try
Over And Over ; Bobby Day;Over And Over by Bobby Day.txt;steady happen girl poor everybody life prettiest dance a-please bit break sorry stag talk would please wait toot night little world heart drag date late wo try
Over And Over ; Thurston Harris;Over And Over by Thurston Harris.txt;steady happen girl a-once poor everybody oooh life prettiest dance bit likenow break sorry stag talk would please wait a-wo night little world heart drag date and-a that-a late wo doo try
Padre ; Toni Arden;Padre by Toni Arden.txt;bird eye embrace alone turn hour wed pray share grace lyricsthe song us weary grief win heaven grow bead would padre first heart king along thing holy spring rich honeyed wonder bestow cottage please lie away place bless love happen fly kneel palace sing golden count full cry may day small meyou true
Patricia ; Perez Prado;Patricia by Perez Prado.txt;patriciayou wish move cha-cha eye yes care brag heaven gleam starry heart patricia long want always everybody stroll meringue charm could away million geisha uncle kiss steal guess sort lip sam lyricskiss never japan dollar mambo many dream arm true try
Poor Little Fool ; Ricky Nelson;Poor Little Fool by Ricky Nelson.txt;poor fool hasten fall carefree give eye lyricsi foolish use little game care hold win someone would part call first next heart tease around time girl huh uh lie away close devil love else kiss victory likepoor broken never leave full play meet day think
Rebel-rouser ; Duane Eddy His Twangy Guitar UNCERTAIN;Rebel-rouser by Duane Eddy His Twangy Guitar UNCERTAIN.txt;right fool outer alright sent rebel eye pace supersonic chill rouserembed razor disguise explode rouser streak catch heaven baby flash infra-red weak heat brain rocker thunder head strong king time burn lyricsinside likegotta hell bear crash tonight set appear bent worship lie knock lasered look rule everything roller sky u.v heel vein hypnotize guy freeze knee face cosmic high juvenile jive lightning soul ta space
Return To Me ; Dean Martin;Return To Me by Dean Martin.txt;amor amo ritorna want hurt darling ti dear mia lip solo sorry return please cara tu forgive back bella mi heart mine lonely meyou wo arm hurry home love
Rock-in Robin ; Bobby Day;Rock-in Robin by Bobby Day.txt;tweedle-lee-dee bird big wing teach owl a-singin oak buzzard really tree rockin little song jay swallow chickadee every out-bopped flap-a treetop old hear start hoppin bop steady long tall likerockin wolf rock a-boppin tonight black grand goin wise bless crow robin whistle love street singin tweedle-lee-deedle-lee-dee raven tweet bandstand oriole blow pretty day soul
Secretly ; Jimmie Rodgers;Secretly by Jimmie Rodgers.txt;thing right want kiss secret wish steal secretly lyricsdo openly content wait afraid till world two secretlyyou away meet must rendevous show love
She Was Only Seventeen (He Was One Year More) ; Marty Robbins;She Was Only Seventeen (He Was One Year More) by Marty Robbins.txt;right wish bet young wife hope last god us someone husband friend first heart test old strong wrong seventeen long girl best moreembed past year score objection love else happen life believe enough seem another question adore meet
Somebody Touched Me ; Buddy Knox;Somebody Touched Me by Buddy Knox.txt;stop somebody hold rock move stranger fall lyricsfeat yes roll set hand boppa last thrill tight night heart rhythm touch dark orchid lover soul man ta love
Splish Splash ; Bobby Darin;Splish Splash by Bobby Darin.txt;even whole alright bug sue splash think with-a move splishing rub jump yes bath put wrap a-moving was-a good forget peggy saw tub ooo wee moving golly a-splishing gang rug a-rolling flop relax bop around a-grooving time long step door saturday flip lollipop dub teen molly a-splashing splish living everything bing dancing open room groove towel dance shoe bang a-strolling rocking miss party back night foot a-reeling floor a-splashingembed feeling rolling a-well-a mm reeling
Stay ; The Ames Brothers;Stay by The Ames Brothers.txt;happy wonderlandyou parson song plan pretend lyricssleigh bird snowman conspire tonight bluebird bell winter sing later unafraid beautiful town face listen lane marry build glisten brown wonderland new meadow stay dream away fire along snow sight walk man ring love job
Stupid Cupid ; Connie Francis;Stupid Cupid by Connie Francis.txt;even right stupid fool wing act jump put hood good picking stop blame mix lovesick real carry half mean homework every clown heart feature lyricsstupid free start likeyou eight thing shame somebody past cupid set since morning clip robin book love else fine crazy bother fly kiss lip guy hey school straight play cry meet wine think
Summertime Blues ; Eddie Cochran;Summertime Blues by Eddie Cochran.txt;quote cure sunday young lyricsi vote cause vacation use a-ridin problem date united work week lick baby congressman call dice every summertime papa raise next bluesyou blue late workin earn sick son time help mama nation wonder holler car just-a bos money two fuss a- fine sometimes summer told dollar try ta
Thats How Much I Love You ; Pat Boone;Thats How Much I Love You by Pat Boone.txt;tie move kitten give stand horsefly cause thats pick honey glossy baby mare tiger much would hang gray old lyricswell find around candy nickel listen bite marry den youyou love fur parson purr stroke pester never knot spend pretty hair
The Bird On My Head ; David Seville;The Bird On My Head by David Seville.txt;sittin bird someone lyricsi armsyou cruel head world vacant belong lot wicked
The Freeze ; Tony;The Freeze by Tony.txt;tongue christmas decoration chimney eye tinsel dreary tree disguise cold boot butter line bone store low honey seize song dead parka sugar sorry winter hand hang stubbled reach heart memory station maple dime blacken across still rum angry sweet glove field snowbird empty bitter snow fill love street sky unsung angels smoke comfort rumyou bring leave freeze hot silent feeling santa woolen
The Purple People Eater ; Sheb Wooley;The Purple People Eater by Sheb Wooley.txt;em eat shakin eatin purple big eye really tree tough music last rockin flyin voice little swing bap band line ditty playin ya one-horned dead saw light lappa people would way tv commence strange tequila head land hear sight start bop reason undergrowed around thing one-eyed long rock oooh lyricsaaaaahhhh bam short roll sure friendly wear tune loom look earth bless ground show fine a-one job sky crazy boom knockin comin ooh-eee gruff pigeon-toed mr. aboopa sing eater night swingin likewell blow horn soul
The Purple People Eater Meets The Witch Doctor ; Joe South;The Purple People Eater Meets The Witch Doctor by Joe South.txt;pattin shook star purple mar twilight jump sound surprise likethey little far pick trouble band okay ol ha guitar stop ting ball givin us saw sun doc real moonlight people way hand home strange b. two-piece head strong goode lyricswhile woah along hear boppin havin around ugly tang chorus time long doctor girl side sittin walla oooh smile rock stroll witch roll sure a-miles could eee n til a- bing crazy johnny comin range cat a-clappin ah bang enough wood wait back eater bandstand town seem play foot keep of-a beat edge horn meet gather man space
Think It Over ; The Crickets;Think It Over by The Crickets.txt;happy kiss bird life real grow slow yes bee sure cold fun goodbye little overyou head heart two lyricsthink old lonely blue thro pretty day remember mystery think love
To Be Loved ; Jackie Wilson;To Be Loved by Jackie Wilson.txt;moment thing care fortune kiss fame wish someone miss despair lovedyou hour share queen truly lonely away feeling king hear day lyricssomeone love
Try The Impossible ; Lee Andrews;Try The Impossible by Lee Andrews.txt;ew plead incredible conquer impossible want reason need love ever wee feel .. beckyou really way mean call lyricstry goodbye heart dream hop beck true try find everything understand
Volare (Nel Blu Dipinto Di Blu) ; Dean Martin;Volare (Nel Blu Dipinto Di Blu) by Dean Martin.txt;happy even ritorni sogno mani wish wing give rom che via live mandolining volare rapito sunny medley blu faccia cielo sand /an pleas il e near le sun cantare la laughter incominciavo vegas/ grinning much non sotto cosi though mi heart rome country avenue di lover plaza girl casa mai espresso las wonder vento hotel romaembed lyricsvolare italy begin two love street un disappear venivo guess piu nel penso infinito sing stratum dipinto evening dipingevo meet whn arm beginning dal
Western Movies ; The Olympics;Western Movies by The Olympics.txt;jeremy em train um big brick remind give break shoot movie babe western lyricsto boot travel date shootin bowie win baby half story call great head heart old land gun channel fight eight time huh uh bam hit .. save hardy arrow jefferson tune maverick mccord telephone pow cheyenne love roller cochise drum comin saddle wagon moviesyou ah jim broken earp thanks back hog-tied certain restless t.v wyatt soul sugarfoot
What Am I Living For ; Chuck Willis;What Am I Living For by Chuck Willis.txt;time long girl whole want doyou darling hold lyricswhat life love lip baby feel cause tight night little nobody mine lonely close living else
When ; Kalin Twins;When by Kalin Twins.txt;right want always kiss near smile need ever baby yes hope lyricswhen night mine good hear fine love
Willie And The Hand Jive ; The Johnny Otis Show UNCERTAIN;Willie And The Hand Jive by The Johnny Otis Show UNCERTAIN.txt;doin fall give name lyricsi last rockin put chief little sister dig junior joe famous a-that baby way tv hand indian papa flo walk dime time grandma millie doctor lawyer chick mama q stroll marry susie ruin look crib crazy uncle cat willie town foot jive beat cool home treat
Win Your Love For Me ; Sam Cooke;Win Your Love For Me by Sam Cooke.txt;happy right wish miracle tom-tom hope sorrow beautiful pray little song hold win carry would church heart woah long girl tomorrow torch charm marry could winembed look whenever everything love manys night full many cry beat day arm
Yakety Yak ; The Coasters;Yakety Yak by The Coasters.txt;doin cleanin scrub give paper coat put hoodlum yakyou father dust broom talk kitchen friday friend yak laundromat sight walk ride time trash rock cook roll cash outside dog look fly room cat finish yakety bring hip back night garbage hat floor dirty spendin
You Cheated ; The Slades;You Cheated by The Slades.txt;lyricsyou something cheat want please lie nothing keep try love
You Need Hands ; Eydie Gorme;You Need Hands by Eydie Gorme.txt;lyricsyou care want dayyou tear hold us brush sincere need someone baby give feel way hand guide thank new nobody away lord living show brand tender
Young And Warm And Wonderful ; Tony Bennett;Young And Warm And Wonderful by Tony Bennett.txt;time find wonderful search mineyou warm young happiness last every seem lyricsyoung heart dream mine improbable true matter love
Youre Making A Mistake ; The Platters;Youre Making A Mistake by The Platters.txt;lyricsyou even help darling lieyou believe never mistake untrue youre though cry a-help prove love
